Nucleation rates of spherulites in natural rhyolitic lava - University of ...,https://www.degruyter.com/abstract/journals/ammin/101/11/article-p2367.xml
Timescales of spherulite crystallization in obsidian inferred from ...,https://www.degruyter.com/abstract/journals/ammin/93/11-12/article-p1816.xml
"Spherulites of Tussah Silk Fibroin. Structure, thermal properties and ...",https://akjournals.com/downloadpdf/journals/10973/64/2/article-p645.xml
Formation of ring-banded spherulites of α and β modifications in ...,https://journals.scholarsportal.info/details/00323861/v52i0020/4619_forsoamipa.xml
MPE Mathematical Problems in Engineering 1563-5147 1024-123X ...,http://downloads.hindawi.com/journals/mpe/2015/506204.xml
JNM Journal of Nanomaterials 1687-4129 1687-4110 Hindawi ...,http://downloads.hindawi.com/journals/jnm/2012/180989.xml
ETIDERM® Shampoo - Accessdata.fda.gov,http://www.accessdata.fda.gov/spl/data/1f3bc491-7975-4274-909e-a137ee404547/1f3bc491-7975-4274-909e-a137ee404547.xml
Rescue of amitriptyline-intoxicated hearts with nanosized vesicles,https://cardiovascres.oxfordjournals.org/content/74/3/480.source.xml
1. Introduction - Hindawi.com,https://downloads.hindawi.com/journals/ijps/2014/374368.xml
MSA Materials Sciences and Applications 2153-117X Scientific ...,https://www.scirp.org/xml/87442.xml
