Chapter 4 The Infinitesimal Calculus of the Soul - Brill,https://brill.com/view/book/edcoll/9789004285163/BP000011.xml
Chapter 4 The Infinitesimal Calculus of the Soul: Moses ... - Brill,https://brill.com/abstract/book/edcoll/9789004285163/BP000011.xml
INFINITESIMAL GENERATORS OF RANDOM POSITIVE ...,https://projecteuclid.org/journals/taiwanese-journal-of-mathematics/volume-1/issue-4/INFINITESIMAL-GENERATORS-OF-RANDOM-POSITIVE-SEMIGROUPS/10.11650/twjm/1500406117.xml
Infinitesimal Generators of Time Changed Processes - Project Euclid,https://projecteuclid.org/journals/annals-of-probability/volume-8/issue-4/Infinitesimal-Generators-of-Time-Changed-Processes/10.1214/aop/1176994661.xml
THE INFLUENCE OF INFINITESIMAL TRACES OF NUTRITIVE ...,https://journals.ametsoc.org/view/journals/mwre/48/9/1520-0493_1920_48_508_tioito_2_0_co_2.xml
On infinitesimal conformal transformations with respect to ... - Sciendo,https://www.degruyter.com/view/j/auom.2012.20.issue-1/v10309-012-0009-4/v10309-012-0009-4.xml
On the Willmore energy of shells under infinitesimal deformations ...,https://journals.scholarsportal.info/details/08981221/v61i0011/3181_otweosuid.xml
Calculating Matter and Recombinant Subjects : The Infinitesimal and ...,https://journals.scholarsportal.info/details/15327086/v16i0005/462_cmars.xml
Untitled,https://www.scirp.org/xml/77682.xml
