Metadata XML - HESS - Copernicus.org,https://hess.copernicus.org/preprints/hess-2021-103/hess-2021-103.xml
Identifying Periodic Components in Atmospheric Data Using a ...,https://journals.ametsoc.org/view/journals/clim/8/10/1520-0442_1995_008_2352_ipciad_2_0_co_2.xml
"PERSISTENCE OF WARM WEATHER AT DENVER, COLORADO I",https://journals.ametsoc.org/downloadpdf/journals/mwre/83/7/1520-0493_1955_083_0143_powwad_2_0_co_2.xml
Untitled,https://www.newyorker.com/sitemap.xml%3Fyear%3D1929%26month%3D11%26week%3D5
Assessing Dsge Models with Capital Accumulation and ...,https://www.elibrary.imf.org/abstract/journals/001/2012/083/article-A001-en.xml
"Conclusion, or:The Ambivalence of Bundist Modernity - Brill",https://brill.com/downloadpdf/book/9789004321397/BP000017.xml
"LEXIS, RHETORIC AND FIGURATION I Imputations of intention - Brill",https://brill.com/downloadpdf/book/9789004490383/B9789004490383_s011.xml
The break-up of Greater Britain - manchester hive,https://www.manchesterhive.com/downloadpdf/9781526147431/9781526147431.00020.xml
"ARCHITECTURE, MEMES AND MINDS - manchester hive",https://www.manchesterhive.com/downloadpdf/9781526114297/9781526114297.00019.xml
Untitled,https://www.biorxiv.org/content/biorxiv/early/2020/07/28/2020.01.14.906016.source.xml
