Dioecy and Its Correlates in the Flowering Plants - JSTOR,https://www.jstor.org/stable/2445418
AND THE EVOLUTION OF MONOECY AND DIOECY - Nature,https://www.nature.com/articles/hdy197883.pdf%3Forigin%3Dppub
[PDF] Dioecy in plants: an evolutionary dead end? Insights from ... - bioRxiv,https://www.biorxiv.org/content/10.1101/414771v1.full.pdf
Dioecy does not consistently accelerate or slow lineage ...,https://nph.onlinelibrary.wiley.com/doi/pdf/10.1111/nph.13696
Geographical distribution of dioecy and its ecological correlates ...,https://esj-journals.onlinelibrary.wiley.com/doi/pdf/10.1111/1440-1703.12068
[PDF] Origins of Dioecy in the Hawaiian Flora Ann K. Sakai,https://repository.si.edu/bitstream/handle/10088/7586/bot_Sakai_et_al_dioecy1995.pdf
Repeated Evolution of Dioecy from Monoecy in Siparunaceae ...,https://academic.oup.com/sysbio/article-pdf/50/5/700/19502658/50-5-700.pdf
