SEED PELLETING-HISTORY AND MODERN FUNDAMENTALS in,https://journals.ashs.org/hortsci/view/journals/hortsci/29/12/article-p1408d.xml
Importance of feed structure (particle size) and feed form (mash vs ...,https://journals.scholarsportal.info/details/03778401/v233icomplete/133_iofssapipnar.xml%3Flang%3Den
"[PDF] Ann. Anim. Sci., Vol. 20, No. 1 (2020) 11–28 - Sciendo",https://sciendo.com/downloadpdf/journals/aoas/20/1/article-p11.xml
Frog farming: Investigation of biological and mechanical agents to ...,https://brill.com/view/journals/ah/1/3-4/article-p271.xml%3Flanguage%3Den
Frog farming - Brill,https://brill.com/previewpdf/journals/ah/1/3-4/article-p271.xml
Pelleted Bait for Control of the Black Cutworm in Corn1,https://jee.oxfordjournals.org/content/70/6/699.source.xml
DEEP-FREEZING OF JACKASS AND STALLION SEMEN IN ...,https://rep.bioscientifica.com/view/journals/rep/14/1/jrf_14_1_016.xml
Diet-induced obesity and pancreatic islet blood flow in the rat,https://joe.bioscientifica.com/view/journals/joe/151/3/joe_151_3_019.xml
sitemap_products_1.xml - Veterinary and Poultry Supply,https://www.vetpoultry.com/sitemap_products_1.xml%3Ffrom%3D594236867%26to%3D8661374403
