Scaling for Truths - Buzzsprout,https://feeds.buzzsprout.com/1861377.rss
On the Couch with Liberation - Buzzsprout,https://feeds.buzzsprout.com/1620421.rss
The Forensic Psychology Podcast - Libsyn,https://pod.link/1533101974.rss
SAGE Psychology & Psychiatry - Libsyn,http://audioboom.com/channels/2558675.rss
Nutrition Lifestyles with Kim & Johane - Audioboom,https://audioboom.com/channels/5003841.rss
Tel Aviv Review - Libsyn,https://telavivreview.libsyn.com/telavivreview.rss
RareBirds Emerging Markets Podcast - Anchor,http://feeds.soundcloud.com/users/soundcloud:users:310838800/sounds.rss
"Best Morning Routine, Ever! - Pod.casts",https://pod.casts.io/podcasts/best-morning-routine-ever.rss
News | Zentrum für Afrikastudien,https://zasb.unibas.ch/de/news/587/feed.rss
