"The Processions of a Pavian Flagellant Confraternity, 1330–1460",https://brill.com/downloadpdf/book/9789004339521/B9789004339521_009.xml
Structures of Arrival in Songs Sung by Flagellant Pilgrims in ... - Brill,https://brill.com/previewpdf/book/edcoll/9789401208130/B9789401208130-s004.xml
"Literary Images of the Russian ""Flagellants,"" 1861-19051 in",https://www.schoeningh.de/view/journals/ruhi/24/4/article-p425_3.xml%3Flanguage%3Den
The New Mexican Alabado: a machine-readable transcription. - Loc,https://tile.loc.gov/storage-services/service/afc/afc1940002/afc1940002_int001/afc1940002_int001.xml
Rosemary Horrox - 9781526112712 - manchester hive,https://www.manchesterhive.com/downloadpdf/9781526112712/9781526112712.00010.xml
Contents in: The Black Death - manchester hive,https://www.manchesterhive.com/view/9781526112712/9781526112712.00004.xml
"SIDONIUS, Poems | Loeb Classical Library",https://www.loebclassics.com/view/sidonius-poems/1936/pb_LCL296.305.xml
[PDF] Confraternitas : the newsletter of the Society for Confraternity Studies,https://journals.scholarsportal.info/pdf/11800682/v09i0002/407_lddbn1dcdbab.xml
Plague and its Consequences - Renaissance and Reformation,https://www.oxfordbibliographies.com/view/document/obo-9780195399301/obo-9780195399301-0062.xml
