[PDF] ORIGINS OF NATURAL REMANENT MAGNETISM,https://www.geo.arizona.edu/Paleomag/chap03.pdf
[PDF] Measurement of the Remanent Magnetization of Igneous Rocks,https://pubs.usgs.gov/bul/1203a/report.pdf
The Remanent Magnetization and Magnetic Properties of Red ...,https://academic.oup.com/gji/article-pdf/10/1/105/2372867/10-1-105.pdf
THE REMANENT MAGNETISM OF ARTIFICIALLY DEPOSITED ...,https://academic.oup.com/gsmnras/article-pdf/7/3/115/1643920/7-3-115.pdf
CHEMICAL REMANENT MAGNETIZATION (CRM),https://www.sciencedirect.com/science/article/pii/B9780444410849500138/pdf%3Fmd5%3Dcbb639a0255bde4d83adc5d21859f142%26pid%3D1-s2.0-B9780444410849500138-main.pdf
Remanent magnetism at Mars,https://agupubs.onlinelibrary.wiley.com/doi/pdf/10.1029/GL015i008p00737
APPLICATIONS OF THE REMANENT MAGNETIZATION OF ROCKS ...,https://onlinelibrary.wiley.com/doi/pdf/10.1111/j.1365-2478.1956.tb01406.x
[PDF] Detrital Remanent Magnetization' Viscosity Theory of the Lock-in Zone,https://www.whoi.edu/cms/files/5_121528.pdf
[PDF] REMANENT MAGNETIZATION OF AMORPHOUS La-Gd-Au ...,https://www.osti.gov/servlets/purl/7301064
IRMITS: A MATLAB program for analyzing isothermal remanent ...,https://aip.scitation.org/doi/pdf/10.1063/5.0015636
