Lewisburg's Gardner honored | Sports | desototimes.com,http://www.desototimes.com/articles/2014/01/11/sports/doc52d08a74466e5021380325.txt
"OKAY, IT'S MY PLEASURE TO INTRODUCE TODAY'S SPEAKER ...",https://videocast.nih.gov/vodCaptions/dss121815.txt%3Fdownload%3Dyes
Trojans top Pirates; Kuehl goes over 1000 points in Husty win,http://www.wdtimes.com/articles/2008/11/26/sports/sports1.txt
An Exploration of Older Men's Acceptance of Age Inequality • Neal ...,https://vtechworks.lib.vt.edu/bitstream/10919/97002/2/GSA%252014%2520King.pdf.txt
b169831x.0001.001.txt - Deep Blue Repositories,https://deepblue.lib.umich.edu/bitstream/handle/2027.42/35351/b169831x.0001.001.txt%3Fsequence%3D1%26isAllowed%3Dy
Ags >accomplished a lot? during spring | Sports | hjnews.com,http://hjnews.townnews.com/articles/2009/04/20/sports/sports01-04-20-09.txt
