Vertebrate GAGA factor associated insulator elements demarcate ...,https://journals.scholarsportal.info/pdf/17568935/v6inone/8_vgfaiehgithc.xml
Diversification of Floral Homeotic Gene Function in - Journal of the ...,https://journals.ashs.org/hortsci/view/journals/hortsci/38/7/article-p1328.xml
[PDF] Diversification of Floral Homeotic Gene Function - Journal of the ...,https://journals.ashs.org/hortsci/downloadpdf/journals/hortsci/38/7/article-p1328.xml
Author Summary - PLOS,https://www.tools.wmflabs.org/opendatasets/plos/extracted/pbio.1000251.xml
The dysmorphic cervical spine in Klippel-Feil syndrome - Journal of ...,https://thejns.org/focus/view/journals/neurosurg-focus/6/6/article-pE3.xml
Genetic Differentiation of Common Fox Vulpes Vulpes (Linnaeus ...,https://www.degruyter.com/view/j/aoas.2014.14.issue-4/aoas-2014-0052/aoas-2014-0052.xml
Expression of Polycomb-group genes in human ovarian follicles ...,https://rep.bioscientifica.com/downloadpdf/journals/rep/130/6/1300883.xml
biorxiv BIORXIV bioRxiv bioRxiv Cold Spring Harbor Laboratory ...,https://www.biorxiv.org/content/biorxiv/early/2020/12/22/2020.12.22.424043.source.xml
Evolution of Gene Expression - Evolutionary Biology - Oxford ...,https://www.oxfordbibliographies.com/view/document/obo-9780199941728/obo-9780199941728-0085.xml
