[PDF] Effective Sensory Strategies In The Classroom Environment,https://www.michiganspeechhearing.org/docs/Effective%2520Sensory%2520Strategies%2520Powerpoint.pdf
Mechanisms of airway hyperresponsiveness - Journal of Allergy and ...,https://www.jacionline.org/article/S0091-6749(06)01597-1/pdf
Albuterol Amplifies Airway Hyperresponsiveness in an Allergic ...,https://www.atsjournals.org/doi/pdf/10.1164/ajrccm-conference.2009.179.1_MeetingAbstracts.A2414
Potential Mechanism of Hyperresponsive Airways - ATS Journals,https://www.atsjournals.org/doi/pdf/10.1164/ajrccm.161.5.9909068
Airway hyperresponsiveness in asthma - Thorax,https://thorax.bmj.com/content/53/11/992.full.pdf
[PDF] Detecting asthma and bronchial hyperresponsiveness in children,https://www.hkmj.org/system/files/hkm0003p99.pdf
[PDF] Asymptomatic bronchial hyperresponsiveness to exercise in ... - NCBI,https://www.ncbi.nlm.nih.gov/pmc/articles/PMC1745513/pdf/v054p00587.pdf
Longitudinal changes in airway hyperresponsiveness and COPD ...,https://erj.ersjournals.com/content/erj/55/2/1901378.full.pdf
Atrial septal defect in adults is associated with airway ...,https://onlinelibrary.wiley.com/doi/pdf/10.1111/chd.12665
Canine neonatally induced coarctation hypertension in the second ...,https://www.ahajournals.org/doi/pdf/10.1161/01.HYP.5.3.328
4217.full.pdf - The Journal of Immunology,http://www.jimmunol.org/content/jimmunol/175/7/4217.full.pdf
[PDF] Bronchial hyperresponsiveness in asthmatic adults – A long-term ...,https://www.europeanreview.org/wp/wp-content/uploads/164.pdf
[PDF] Hyperresponsiveness of airway muscle to acetylcholine in asthmatic ...,https://www.europeanreview.org/wp/wp-content/uploads/197.pdf
P1.01-08 Hyperresponsive Disease - Journal of Thoracic Oncology,https://www.jto.org/article/S1556-0864(18)31522-3/pdf
[PDF] Decreased airway narrowing and smooth muscle contraction in ...,https://citeseerx.ist.psu.edu/viewdoc/download%3Fdoi%3D10.1.1.898.5768%26rep%3Drep1%26type%3Dpdf
[PDF] Beclomethasone dipropionate and formoterol fumarate ...,https://respiratory-research.biomedcentral.com/track/pdf/10.1186/s12931-018-0770-7.pdf
"Airway Hyperresponsiveness, Prevalence of Chronic Respiratory ...",https://www.jstor.org/stable/27730035
Peak Expiratory Flow Variability and Exercise Responsiveness in ...,https://www.tandfonline.com/doi/pdf/10.1081/JAS-200028014
[PDF] Relations between Sensory Responsiveness and Features ... - MDPI,https://www.mdpi.com/2076-3425/10/11/775/pdf
Airways of a hyperresponsive rat strain show decreased relaxant ...,https://journals.physiology.org/doi/pdf/10.1152/ajplung.1995.269.1.L85
Aquaporin 5-deficient mouse lungs are hyperresponsive to ... - PNAS,https://www.pnas.org/doi/pdf/10.1073/pnas.231273398
Pressor hyperresponsiveness in saline-infused rabbits. - AHA Journals,https://www.ahajournals.org/doi/pdf/10.1161/01.HYP.6.4.503
Calcium and growth responses of hyperresponsive airway smooth ...,https://cdnsciencepub.com/doi/pdf/10.1139/y00-069
Diversity of methacholine dose-response curves among ...,https://www.resmedjournal.com/article/S0954-6111(17)30341-4/pdf
Mechanism for markedly hyperresponsive insulin-stimulated ...,https://www.jbc.org/article/S0021-9258(18)61162-7/pdf
Opportunistic Pathogens in the Immunologically Hyperresponsive Host,http://www.amjmed.com/article/0002-9343(73)90269-6/pdf
s Sarcoma-Associated Herpesvirus Latency Locus Renders B Cells ...,https://journals.asm.org/doi/pdf/10.1128/jvi.01138-18
[PDF] Small Airway Impairment and Bronchial Hyperresponsiveness in ...,https://m.e-aair.org/Synapse/Data/PDFData/9999AAIR/aair-6-242.pdf
Airway Hyperresponsiveness to Methacholine in Subjects with ...,http://journal.chestnet.org/article/S0012-3692(15)46482-7/pdf
Biliary Epithelial Cells from Mice with Congenital Polycystic Kidney ...,https://www.nature.com/articles/pr1995119.pdf%3Forigin%3Dppub
Lung Function and Airway Hyperresponsiveness in Adult Patients ...,https://www.amjmedsci.com/article/S0002-9629(15)32735-X/pdf
Prevalence of airway hyperresponsiveness and its seasonal ...,https://www.pediatr-neonatol.com/article/S1875-9572(17)30322-4/pdf
Immunologic Correlates of the Hyperresponsive Syndrome of Loiasis,https://academic.oup.com/jid/article-pdf/157/3/544/2555165/157-3-544.pdf
[PDF] World Trade Center Fine Particulate Matter Causes Respiratory ...,https://cfpub.epa.gov/ncer_abstracts/index.cfm/fuseaction/display.files/fileID/13027
Hyperresponsiveness of Hypothalamic-Pituitary-Adrenal - Biological ...,https://www.biologicalpsychiatryjournal.com/article/S0006-3223(02)01395-1/pdf
Divergent mechanisms for the insulin resistant and hyperresponsive ...,https://www.jci.org/articles/view/113649/version/1/pdf/render.pdf
dc210460.pdf - American Diabetes Association,https://diabetesjournals.org/care/article-pdf/44/9/1961/633295/dc210460.pdf
Hyperresponsive B Cells in CD22-Deficient Mice,https://science.sciencemag.org/content/sci/274/5288/798.full.pdf
cs068060pa.pdf - Portland Press,https://portlandpress.com/clinsci/article-pdf/68/s11/60P/818471/cs068060pa.pdf
Hyperresponsiveness of platelets in ischemic stroke - Thieme Connect,https://www.thieme-connect.com/products/ejournals/pdf/10.1160/TH06-12-0725.pdf
