Effect of obstructive sleep apnea on glucose metabolism in,https://eje.bioscientifica.com/view/journals/eje/186/4/EJE-21-1025.xml
Increased prevalence of obstructive sleep apnea in patients with ...,https://eje.bioscientifica.com/view/journals/eje/176/3/267.xml
Improvement of obstructive sleep apneas caused by hydrocephalus ...,https://thejns.org/pediatrics/view/journals/j-neurosurg-pediatr/6/4/article-p336.xml
Obstructive Sleep Apnea (Adult) | My Doctor Online,https://mydoctor.kaiserpermanente.org/ncal/structured-content/Condition_Obstructive_Sleep_Apnea_Adult_-_Head_and_Neck_Surgery.xml%3Fco%3D/regions/ncal
Sleep Apnea | My Doctor Online,https://mydoctor.kaiserpermanente.org/mas/structured-content/Condition_Sleep_Apnea.xml%3Fco%3D/regions/mas
Identification of Apnea Events Using a Chest-Worn Monitor ...,https://journals.humankinetics.com/view/journals/jmpb/2/2/article-p103.xml
Identification of Apnea Events Using a ... - Human Kinetics Journals,https://journals.humankinetics.com/downloadpdf/journals/jmpb/2/2/article-p103.xml
"Effect of mandible advancement splints in mild, moderate, and ...",https://ejo.oxfordjournals.org/content/early/2016/12/20/ejo.cjw068.source.xml
Therapeutic approaches of obstructive sleep apnea in China - Sciendo,https://www.degruyter.com/view/j/jtim.2018.6.issue-1/jtim-2018-0004/jtim-2018-0004.xml
"[PDF] A New Wearable System for Home Sleep Apnea Testing, Screening ...",https://journals.scholarsportal.info/pdf/14248220/v20i0024/nfp_anwsfhsatsac.xml
