MANAGEMENT OF ENDOCRINE DISEASE: Flushing,https://eje.bioscientifica.com/view/journals/eje/177/5/EJE-17-0295.xml
[PDF] Estimating the Relative Abundance of Flush Shoots in Citrus with ...,https://journals.ashs.org/hortsci/downloadpdf/journals/hortsci/42/2/article-p364.xml
Fruit Yield and Quality as Related to Flushes of Bearing Shoots in ...,https://journals.ashs.org/jashs/view/journals/jashs/133/2/article-p284.xml
FILE.FLUSH Method - Alpha Anywhere Documentation,https://documentation.alphasoftware.com/pages/Ref/Api/Objects/System/File/FILE.FLUSH%2520Method.xml
Development and Flight Test Results of a Small UAS ... - AMS Journals,https://journals.ametsoc.org/view/journals/atot/35/5/jtech-d-17-0192.1.xml
Wind Tunnel Results for a Distributed Flush Airdata System in,https://journals.ametsoc.org/view/journals/atot/34/7/jtech-d-16-0242.1.xml
Effect of catheter diameter and injection rate of flush solution on ...,https://avmajournals.avma.org/view/journals/ajvr/80/9/ajvr.80.9.825.xml
"Effects of visual stimuli, substrate-borne vibrations and air current ...",https://brill.com/view/journals/beh/143/3/article-p303_3.xml%3Flanguage%3Den
Untitled,https://bmjopen.bmj.com/content/early/2011/02/16/bmjopen-2010-000047.download.xml
