Increase Your Chances of Pregnancy - My Doctor Online,https://mydoctor.kaiserpermanente.org/ncal/structured-content/Health_Topic_Increase_Your_Chance_of_Pregnancy_-_REI.xml%3Fco%3D/regions/ncal
New insights of the role of β-NGF in the ovulation mechanism of ...,https://rep.bioscientifica.com/view/journals/rep/157/5/REP-18-0305.xml
"Ovulation, fertilization and early embryonic development in the bitch ...",https://rep.bioscientifica.com/view/journals/rep/93/1/jrf_93_1_024.xml
Effects of flunixin meglumine on postponement of ovulation in mares in,https://avmajournals.avma.org/view/journals/ajvr/80/3/ajvr.80.3.306.xml
Shape and texture changes in the face during the menstrual cycle in,https://akjournals.com/view/journals/1126/10/4/article-p163.xml
A central role for cAMP/EPAC/RAP/PI3K/AKT/CREB signaling in LH ...,https://bioone.org/journals/biology-of-reproduction/volume-105/issue-2/ioab077/A-central-role-for-cAMP-EPAC-RAP-PI3K-AKT-CREB/10.1093/biolre/ioab077.xml
Treatment of Experimental and Clinical Schistosomiasis with ...,https://www.ajtmh.org/view/journals/tpmd/16/4/article-p497.xml
[PDF] Estradiol-17β Injection Induces Ovulation in Llamas,https://journals.scholarsportal.info/pdf/22971769/v7inone/nfp_eiioil.xml
