Chapter 7: Developing and Maintaining Trust in Work Relationships,https://sk.sagepub.com/books/trust-in-organizations/n7.xml
Chapter 14 Maintaining and Managing Public Infrastructure Assets in,https://www.elibrary.imf.org/abstract/books/071/28328-9781513511818-en/ch014.xml
Mid-career and Senior Faculty: Maintaining Vitality and Productivity in,https://journals.ashs.org/hortsci/view/journals/hortsci/32/1/article-p44.xml
Roles of Sea Ice–Surface Wind Feedback in Maintaining the Glacial ...,https://journals.ametsoc.org/view/journals/clim/33/8/jcli-d-19-0431.1.xml
Establishing and Maintaining a Modified Youth Sport Program,https://journals.humankinetics.com/view/journals/ssj/15/4/article-p326.xml
Utility of a Brief Athlete-Specific Stress Assessment Protocol in,https://journals.humankinetics.com/view/journals/jcsp/13/1/article-p41.xml
Enslaved Labor and Trade in Roman Philippi in - Brill,https://brill.com/view/book/9789004469334/BP000017.xml%3Flanguage%3Den
Maintaining the male germline: regulation of spermatogonial stem ...,https://joe.bioscientifica.com/view/journals/joe/205/2/133.xml
"21 Maintaining Sterility, Purity, and Stability of Dispensed and ...",https://publications.ashp.org/view/book/9781585284856/ch021.xml
