[PDF] shrinkage cracks: desiccation or synaeresis? 1 - CiteSeerX,https://citeseerx.ist.psu.edu/viewdoc/download%3Fdoi%3D10.1.1.885.68%26rep%3Drep1%26type%3Dpdf
Kinetics of Mechanical Floccule Synaeresis,https://link.springer.com/content/pdf/10.1134%252FS1062739148020165.pdf
an ei.ectron microscope and x-ray study ()f the synaeresis ()f act ...,http://www.sciencedirect.com/science/article/pii/0006300248900870/pdf%3Fmd5%3D5aa65fa904a9c508586b222d1593a77d%26pid%3D1-s2.0-0006300248900870-main.pdf
[PDF] Interstratal dewatering origin for polygonal patterns of sand-®lled ...,https://core.ac.uk/download/pdf/1592560.pdf
Microbial mats implicated in the generation of intrastratal shrinkage ...,https://onlinelibrary.wiley.com/doi/pdf/10.1111/sed.12044
Diastasis cracks - Wiley Online Library,https://onlinelibrary.wiley.com/doi/pdf/10.1111/j.1365-3091.1992.tb01999.x
The origin and occurrence of subaqueous sedimentary cracks,https://sp.lyellcollection.org/content/specpubgsl/448/1/285.full.pdf
"Synaeresis Features and Genesis of Siderite Concretions, Kiowa ...",https://archives.datapages.com/data/sepm/journals/v38-41/data/039/039002/pdfs/0799a.pdf
Petrarch's Use of the Metric Figures in the Canzoniere - jstor,https://www.jstor.org/stable/2906413
[PDF] Proceedings of the Indiana Academy of Science - Journals at IUPUI,https://journals.iupui.edu/index.php/ias/article/download/8732/8789/14964
