Biotelemetry of New World thrushes during migration - BioOne,https://bioone.org/journals/integrative-and-comparative-biology/volume-45/issue-2/45.2.295/Biotelemetry-of-New-World-thrushes-during-migration--Physiology-energetics/10.1093/icb/45.2.295.xml
Reduced diurnal activity and increased stopover duration by molting ...,https://bioone.org/journals/ornithology/volume-139/issue-2/ukab083/Reduced-diurnal-activity-and-increased-stopover-duration-by-molting-Swainsons/10.1093/ornithology/ukab083.xml
Song Thrush - AskAboutIreland.ie,http://ams2-aai-web-1.anu.net/learning-zone/primary-students/1st-%2B-2nd-class/1st-2nd-class-environment/feathered-friends/thrush/index.xml
Spatial pattern of syllable sharing in white-throated thrushes - Brill,https://brill.com/view/journals/beh/152/6/article-p775_4.xml%3Flanguage%3Den
The Food Searching Behaviour of Two European Thrushes in - Brill,https://brill.com/view/journals/beh/48/1-4/article-p276_15.xml%3Flanguage%3Den
Orientation and migratory activity of Song Thrushes () in northern Italy,http://www.degruyter.com/view/j/ring.2004.26.issue-1/v10050-008-056-4/v10050-008-056-4.xml
Timing of Song Thrush Turdus philomelos on pre-nuptial migration ...,https://www.degruyter.com/view/j/orhu.2017.25.issue-1/orhu-2017-0008/orhu-2017-0008.xml
To cross or not to cross – thrushes at the German North Sea coast ...,https://journals.scholarsportal.info/details/20513933/v7inone/nfp_tcontcrtwcia.xml
"March 4, 2022 Spring Arbor at Florida National - Continental Athletic ...",https://continentalathletics.com/sports/sball/2021-22/boxscores/20220304_0czd.xml
