Macedonian President Urges Boycott Of Name Referendum,https://www.theuknews.com/news/258052102/oct04v40.flv
Top Republican Lawmaker Calls For Stronger U.S. Action Against ...,https://www.irishsun.com/news/257987129/oct04v56.flv
Trump Signs Order Reimposing Sanctions On Iran,https://www.stpetersburgstar.com/news/257796220/feb24v21.flv
US First Lady in Cairo on Final Leg of Africa Trip,https://www.internationaltravelnews.com/news/258088976/oct04v56.flv
"US, South Korea Seem to Scale Back War Games",https://www.northkoreatimes.com/news/254426694/oct04v56.flv
"Welcome to Makhanda, formerly known as Grahamstown - News24",https://www.kenyastar.com/news/258075653/oct04v56.flv
Trump Calls On U.S. Attorney General To End Russia Probe 'Right ...,https://www.europesun.com/news/257774538/oct04v56.flv
SAHRC condemns violent protest action in the North West - News24,https://www.sierraleonetimes.com/news/257077398/oct04v56.flv
"Russia, Saudi Arabia 'Quietly' Agree To Lift Oil Production",https://www.illinoisintelligencer.com/news/258080967/oct04v40.flv
Turkey's Currency Dips Again,https://www.ohiostandard.com/news/257831990/oct04v56.flv
Search Resumes for Missing From Sunken Thai Boat,https://www.pekingpress.com/news/257628389/oct04v56.flv
"Trump, U.S. Allies Exchange Barbs Amid Growing Fears Of Trade War",https://www.southamericatimes.com/news/257397491/oct04v56.flv
Boy in Syria photographed covered in blood and dust loses ten year ...,https://www.israelherald.com/news/246919765/oct04v40.flv
EU Lays Out Accession Path For Balkan Countries,https://www.dublinnews.com/news/256383024/oct04v40.flv
EU Again Urges Moscow To Release Ukrainian Sailors - Google News,https://www.malaysiasun.com/news/259295951/feb24v21.flv
"Farmers pelted stones, wielded lathis: Delhi Police",https://www.indiagazette.com/news/258072866/feb24v21.flv
HRW Urges Thailand Not to Return Saudi Asylum-Seeker,https://www.traveltrade.org/news/258847722/feb24v21.flv
Ex-French President Sarkozy held in Gaddafi funding probe,https://www.johannesburglife.com/news/256794018/oct04v40.flv
Asiad medallist struggling for govt job despite assurance,https://www.southeastasiapost.com/news/258077992/oct04v40.flv
Hundreds join peace assembly in Isabela City - Myanmar News,https://www.vietnamtribune.com/news/259078556/feb24v21.flv
