Margo Martindale says imagination key to her career - Toledo Blade,https://www.toledoblade.com/TV-Radio/2017/01/22/Margo-Martindale-says-imagination-key-to-her-career/stories/feed/feed/index.rss
Exhibit defies the imagination - Toledo Blade,https://www.toledoblade.com/local/2011/01/21/Exhibit-defies-the-imagination/stories/feed/index.rss
Radical Imagination - Buzzsprout,https://feeds.buzzsprout.com/438814.rss
Imagination Travel & Tips - Buzzsprout,https://feeds.buzzsprout.com/928210.rss
Puffin Podcast: Mission Imagination - Acast,https://audioboom.com/channels/5020538.rss
Imagining The Past - Audioboom,https://audioboom.com/channels/4910636.rss
Joy of Living Creatively: Tapping Your Innovation and Imagination,https://www.subscribeonandroid.com/podcasts.personallifemedia.com/podcasts/227-joy-of-living-creatively/feedburner.rss
Joy of Living Creatively: Tapping Your ... - Personal Life Media,https://podcasts.personallifemedia.com/podcasts/227-joy-of-living-creatively/feedburner.rss
Joy of Living Creatively: Tapping Your Innovation and Imagination,https://www.subscribebyemail.com/podcasts.personallifemedia.com/podcasts/227-joy-of-living-creatively/feedburner.rss
