"Full text of ""The use of blue on Chinese porcelain of the Ming ...",https://archive.org/stream/TheUseOfBlueOnChinesePorcelainOfTheMingDynasty1368-1644/A0004144_djvu.txt
41952.txt - Project Gutenberg,https://www.gutenberg.org/files/41952/41952.txt
"Small Dishes, Mashiko-yaki, by Tagami Munetoshi||||Small Dishes ...",https://images3.trocadero.com/stores/wasabidou/items/1207687/contents.txt
251080 2022-02-10 11:23:50 Major ceramic artists combine for ...,http://citynews.com.au/wp-content/uploads/lncontent/archive/251080.txt
Glueable Chip Resistor GCR Series * * * * * * Suitable for conductive ...,https://pdf.support/cef55929/welwyn-tt.com/GCR2512P-95K3FT18.txt
"D../CRCW....-HR Vishay Lead (Pb)-bearing Thick Film, Rectangular ...",https://pdf.datasheet.live/865a331d/vishay.com/CRCW080568M0JPTL.txt
