The Fire Pit with Matt Ginella,https://omnycontent.com/d/playlist/e73c998e-6e60-432f-8610-ae210140c5b1/BF944F94-DCD4-43EF-B7BD-AE310056AFA6/F7DF095B-9D5C-41AF-BF8F-AE310056AFB0/podcast.rss
Smooth skating so far for Temperance bowling alley - The Toledo ...,https://www.toledoblade.com/Retail/2015/01/25/Smooth-skating-so-far-for-Temperance-bowling-alley/stories/feed/index.rss
"Naps, Tiki Drinks and Cupcakes - Buzzsprout",https://feeds.buzzsprout.com/1705810.rss
That's A Good Question! Podcast - Buzzsprout,https://feeds.buzzsprout.com/1682284.rss
Czechs involved in the archeological research in Duqm,https://www.mzv.cz/riyadh/en/culture_and_events/omn/czechs_involved_in_the_archeological.rss
Stuff with Shanon - Audioboom,https://audioboom.com/channels/4903020.rss
Homophilia - Anchor,https://omny.fm/shows/homophilia/playlists/podcast.rss
The Unusual History of Every Thing - Libsyn,https://pod.link/1350648566.rss
Lie Down on the Floor and Stay Calm - Punkvert.tv,https://punkvert.tv/blogs/article-in-the-the-tonic.rss
