Detection of SST Fronts from a High-Resolution Model and Its ...,https://journals.ametsoc.org/view/journals/atot/38/2/JTECH-D-20-0118.1.xml
"Automated Detection, Classification, and Tracking of Internal Wave ...",https://journals.ametsoc.org/view/journals/atot/38/4/JTECH-D-20-0129.1.xml
First Detections of Culiseta longiareolata (Diptera: Culicidae) in ...,https://bioone.org/journals/journal-of-medical-entomology/volume-58/issue-6/tjab127/First-Detections-of-Culiseta-longiareolata-Diptera--Culicidae-in-Belgium/10.1093/jme/tjab127.xml
Lung nodule detection in chest X‑rays using synthetic ground‑truth ...,https://journals.scholarsportal.info/pdf/20452322/v11inone/nfp_lndicxccdthp.xml
noaaSanctSound_SB01_12_fin... - CoastWatch-West Coast,https://coastwatch.pfeg.noaa.gov/erddap/metadata/iso19115/xml/noaaSanctSound_SB01_12_finwhale_1d_iso19115.xml
Nasopharyngeal Viral and Bacterial Co-Detection among Children ...,https://www.ajtmh.org/view/journals/tpmd/106/4/article-p1086.xml
Nasopharyngeal Viral and Bacterial Co-Detection among Children ...,https://www.ajtmh.org/abstract/journals/tpmd/106/4/article-p1086.xml
Abstract - bioRxiv,https://www.biorxiv.org/content/biorxiv/early/2022/01/12/2022.01.10.475709.source.xml
Code-free machine learning for object detection in surgical video,https://thejns.org/focus/view/journals/neurosurg-focus/52/4/article-pE11.xml
Transition Detection for Automatic Segmentation of Wrist-Worn ...,https://journals.humankinetics.com/view/journals/jmpb/3/1/article-p19.xml
