quadriplegia,https://thejns.org/downloadpdf/journals/j-neurosurg/39/5/article-p596.xml
Quadriplegia in a patient who underwent posterior fossa surgery in ...,https://thejns.org/spine/view/journals/j-neurosurg-spine/96/1/article-p101.xml
Physiological Responses of Quadriplegic and Able-Bodied Men ...,https://journals.humankinetics.com/view/journals/apaq/5/2/article-p130.xml
Anaerobic Performance of Active and Sedentary Male Individuals ...,https://journals.humankinetics.com/view/journals/apaq/22/3/article-p253.xml
Priorities of desired functional recovery in Indian spinal cord injury ...,https://europepmc.org/articles/pmc7452300/bin/mmc1.xml
Today's News | KYStandard.com,https://www.kystandard.com/news/todaysnews/rss.xml%3Fpage%3D1826%26mini%3Dcalendar-date%2525252F2013-10
Background - PLOS,http://open-repository.kisti.re.kr/cube/bitstream/open_repository/78767/1/journal.pone.0019177.xml
Bone densitometry in pediatric patients treated with pamidronate,https://journals.scholarsportal.info/details/03010449/v35i0005/511_bdipptwp.xml
[PDF] prognostic factors in patients with pressure sores in a university ...,https://journals.scholarsportal.info/pdf/14137852/v25i0006/243_pfipwpauhisb.xml
