[PDF] Little Girls Can Be Mean: - Northern Illinois University,https://www.niu.edu/clas/psychology/_pdf/ppab/book-reviews/website_49991%2520little%2520girls%2520can%2520be%2520mean.pdf
[PDF] Read Online Little Girls Can Be Mean Four Steps To Bully Proof ...,https://mobile.waldenu.edu/adward/database/Little%2520Girls%2520Can%2520Be%2520Mean%2520Four%2520Steps%2520To%2520Bully%2520Proof%2520Girls%2520In%2520The%2520Early%2520Grades/BZQB1V
[PDF] Get Free Little Girls Can Be Mean Four Steps To Bully Proof Girls In ...,https://mobile.waldenu.edu/adward/database/Little%2520Girls%2520Can%2520Be%2520Mean%2520Four%2520Steps%2520To%2520Bully%2520Proof%2520Girls%2520In%2520The%2520Early%2520Grades/NXBMQ2
Be Mean or Be Nice? Understanding the Effects of Aggressive and ...,https://www.tandfonline.com/doi/pdf/10.1080/10410236.2018.1471337
Young Korean-American children's conflicts and references to frien,https://journals.sagepub.com/doi/pdf/10.1177/1476718X14538591
A Poem Should Not Be Mean But Behave: Good Breeding for Poems,https://www.jstor.org/stable/23561688
Why Must You Be Mean to Me? Crime and the Online Persona - jstor,https://www.jstor.org/stable/10.1525/nclr.2010.13.3.485
Simon * Asset pricing models often predict that some benchmark ...,https://www.sciencedirect.com/science/article/pii/0304405X89900615/pdf%3Fmd5%3D5e4dd4b88e55b930067aee1a92038a47%26pid%3D1-s2.0-0304405X89900615-main.pdf
The Market Portfolio May Be Mean/Variance Efficient After All,https://academic.oup.com/rfs/article-pdf/23/6/2464/24430070/hhp119.pdf
"[PDF] Don't be mean, be above average: Understanding data distribution ...",https://scholarworks.iupui.edu/bitstream/handle/1805/26344/Herbst2020Mean-AAM.pdf%3Fsequence%3D1%26isAllowed%3Dy
