Thermal Impacts of Apicultural Practice and Products on the Honey ...,https://bioone.org/journals/journal-of-economic-entomology/volume-114/issue-2/toab023/Thermal-Impacts-of-Apicultural-Practice-and-Products-on-the-Honey/10.1093/jee/toab023.xml
Evaluation of the apicultural value of sunflower hybrids - AKJournals,https://akjournals.com/downloadpdf/journals/014/56/1/article-p91.xml
Evaluation of the apicultural value of sunflower hybrids in - AKJournals,https://akjournals.com/view/journals/014/56/1/article-p91.xml
Efficacies of two alarm substances of the honey bee,https://journals.scholarsportal.info/details/00221910/v16i0001/17_eotasothb.xml
Antibacterial effect and clinical potential of honey collected from ...,https://resolver.scholarsportal.info/resolve/00218839/v60i0002/308_aeacpoamlatm.xml
Apiculture - MoreBooks!,https://www.morebooks.de/gb/search.xml%3Fq%3DApiculture
sitemap.xml,http://www.apiculturalcenter.org/sitemap.xml
Recent Case-Law of the European Court of Justice and the ... - Brill,https://brill.com/view/journals/jeep/9/3-4/article-p303_5.xml%3Flanguage%3Den
