Endicott Athletics and Recreation,https://www.ecgulls.com/information/student_athlete_services/strength_and_conditioning/videos/Plank-20to-20All-20Sides.flv
Women's Lacrosse Meet the Monks Video - Saint Joseph's College ...,https://www.gomonks.com/sports/wlax/2010-11/videos/Womens_lax_meet_the_monks.flv
Women's Basketball GNAC Quarterfinals - Saint Joseph's College of ...,https://www.gomonks.com/sports/wbkb/2010-11/videos/Girls_Quarterfinals.flv
Mexico invites tenders for major Veracruz port expansion plan,https://www.northkoreatimes.com/news/228900215/oct04v40.flv
FLV* * * onMetaData***duration@ =q*width@ *height ...,https://upcommons.upc.edu/bitstream/handle/2099.2/501/EAD_Sande_4__VP6_1Mbps.flv%3Fsequence%3D4
4.0 Opening Plenary- Provost Lecture (New)_001.flv - DSpace ...,https://ir.stonybrook.edu/xmlui/flashstreamview/bitstream/handle/11401/10797/4.0%2520Opening%2520Plenary-%2520Provost%2520Lecture%2520%2528New%2529_001.flv%3Fsequence%3D1
Request a copy of the document - IDRC Digital Library,https://idl-bnc-idrc.dspacedirect.org/bitstream/handle/10625/50544/IDL-50544.flv%3Fsequence%3D1%26isAllowed%3Dn
Praveen Kumar bids adieu to cricket - Big News Network.com,https://www.vietnamtribune.com/news/258149498/feb24v21.flv
