Caput epididymitis but not orchitis was induced by vasectomy in a ...,https://rep.bioscientifica.com/view/journals/rep/135/6/859.xml
Caput epididymitis but not orchitis was induced by vasectomy in a ...,https://rep.bioscientifica.com/downloadpdf/journals/rep/135/6/859.xml
Bancroftian Filariasis in the Etiology of Funiculo-Epididymitis ...,https://www.ajtmh.org/view/journals/tpmd/6/4/article-p739.xml
Testicular Mass in a 40-Year-Old Man - Oxford Academic,https://labmed.oxfordjournals.org/content/42/7/388.source.xml
Amiodarone induced epididymo-orchitis - Europe PMC,https://europepmc.org/articles/pmc6556547/bin/mmc1.xml
1. Introduction - Hindawi.com,http://downloads.hindawi.com/journals/criu/2013/645787.xml
Untitled,https://www.auanet.org/x3365.xml
What Is Your Diagnosis? in - AVMA Journals,https://avmajournals.avma.org/abstract/journals/javma/228/4/javma.228.4.515.xml
"[PDF] Presentation delay, misdiagnosis, inter-hospital transfer times and ...",https://journals.scholarsportal.info/pdf/16775538/v46i0006/972_pdmittscsfcb.xml
