"Myotonic dystrophy type 1 with diabetes mellitus, mixed ...",https://edm.bioscientifica.com/view/journals/edm/2018/1/EDM17_0143.xml
Pubertal induction in adolescents with DMD is associated with high ...,https://eje.bioscientifica.com/view/journals/eje/184/1/EJE-20-0709.xml
Fuchs' Dystrophy - My Doctor Online - Kaiser Permanente,https://mydoctor.kaiserpermanente.org/ncal/structured-content/Condition_Fuchs_Dystrophy.xml%3Fco%3D/regions/ncal
[PDF] Epigenetic modifications in muscle regeneration and progression of ...,https://journals.scholarsportal.info/pdf/18687075/v13inone/nfp_emimrapodmd.xml
Martial Arts Training for Boys With Duchenne Muscular Dystrophy in,https://journals.humankinetics.com/view/journals/pes/aop/article-10.1123-pes.2021-0117/article-10.1123-pes.2021-0117.xml
The Role of Exercise as a Therapy for Children with Duchenne ...,https://journals.humankinetics.com/view/journals/pes/12/1/article-p23.xml
Complex biomechanical research methods used for pediatric ...,https://akjournals.com/view/journals/2066/1/1/article-p11.xml
Clinical progression of X-linked muscular dystrophy in two German ...,https://avmajournals.avma.org/abstract/journals/javma/238/2/javma.238.2.207.xml
"Evaluation of epidemiological, clinical, and pathological features of ...",https://avmajournals.avma.org/view/journals/javma/239/6/javma.239.6.823.xml
