Hierarchies - general guidance - IATI Connect,https://discuss.iatistandard.org/t/hierarchies-general-guidance/861.rss
Co-owner of Packo's asks court for receiver - Toledo Blade,https://www.toledoblade.com/local/2010/07/29/Co-owner-of-Packo-s-asks-court-for-receiver/stories/feed/index.rss
Columbia Gas center to become office space | The Blade,https://www.toledoblade.com/business/2011/04/02/Columbia-Gas-center-to-become-office-space/stories/feed/feed/index.rss
The Czech Republic will help Greece with the consequences of the ...,https://www.mzv.cz/jnp/en/issues_and_press/press_releases/x2020_09_16_help_Greece_Lesbos.rss
The 45th - Audioboom,https://audioboom.com/channels/4903323.rss
Investing in Real Estate with Clayton Morris - Audioboom,https://audioboom.com/channels/4906113.rss
IMF Podcasts - Libsyn,https://pod.link/1029134681.rss
The Rundown with Kansas Legislative Division of Post Audit,https://feeds.buzzsprout.com/442243.rss
Airport comments for Spain - OurAirports,https://ourairports.com/countries/ES/comments.rss
