The Inveterate Theatre-Goer - JSTOR,https://www.jstor.org/stable/25114244
"Inveterate Headache, with Cases",https://www.nejm.org/doi/pdf/10.1056/NEJM188807261190402
The Inveterate Invertebrates,https://www.journals.uchicago.edu/doi/pdf/10.1086/405631
Treatment of Inveterate Cicatricial Strictures in the Esophagus,https://www.tandfonline.com/doi/pdf/10.3109/00016485409126873
Endoscopic management of inveterate esophageal perforations and ...,https://link.springer.com/content/pdf/10.1007/BF00188486.pdf
"Flexible learning, rather than inveterate innovation or copying ...",https://www.science.org/doi/pdf/10.1126/sciadv.aaz0286
13. Memoir of an Inveterate Writer - SAGE Journals,https://journals.sagepub.com/doi/pdf/10.1177/000276425800100413
The Inveterate Paradox of Dreaming - JAMA Network,https://jamanetwork.com/journals/NEUR/articlepdf/584538/archneur_42_9_021.pdf
[PDF] Case Report - Inveterate adult congenital clubfoot in a patient with ...,https://jfootankle.com/JournalFootAnkle/article/download/1588/1807
Results of talectomy for inveterate or recurrent clubfoot,https://www.sciencedirect.com/science/article/pii/S1877056821004114/pdf%3Fmd5%3D950546389ab468e8b867b7e188920f8b%26pid%3D1-s2.0-S1877056821004114-main.pdf
[PDF] Anne Finch'in “Ardelia to Melancholy” ile Sabahattin Ali ... - DergiPark,https://dergipark.org.tr/tr/download/article-file/1849695
[PDF] (1992) The Inveterate Invertebrate Reporter - the WAC Clearinghouse,https://clearinghouse.colostate.edu/journal/vol8/spencer.pdf
"Living with habitual ableism in Prince George, British Columbia",https://onlinelibrary.wiley.com/doi/pdf/10.1111/cag.12254
"A Narrative Medicine Approach to Teaching Dostoevsky's ""A Gentle",https://muse.jhu.edu/article/395562/pdf
"prejudices, by their status as inveterate collectors. This in turn ...",https://academic.oup.com/fs/article-pdf/64/1/93/1441892/knp228.pdf
[PDF] ZMR modular system arthroplasty for correction of Putti's osteotomy ...,https://jorthoptraumatol.springeropen.com/track/pdf/10.1007/s101950300009.pdf
[PDF] Inveterate Posterior Shoulder Dislocation Treated by Sub-Scapular ...,https://pdfs.semanticscholar.org/dd56/c5a09bbcb539c34b6c4014da179388bed23d.pdf
Enhancement of an Inveterate Method for Measuring Eyebar Tension,https://ndtlibrary.asnt.org/scholar/access/2012/EnhancementofanInveterateMethodforMeasuringEyebarTension.pdf
NICOTINE MAINTENANCE FOR INVETERATE SMOKERS,http://www.ingentaconnect.com/contentone/cog/tech/1999/00000006/F0030001/art00005%3Fcrawler%3Dtrue%26mimetype%3Dapplication/pdf
