1. Introduction - Hindawi.com,https://downloads.hindawi.com/journals/ecam/2021/3254707.xml
1. Introduction - Hindawi.com,https://downloads.hindawi.com/journals/ogi/2022/9352540.xml
Untitled,https://www.scirp.org/xml/81305.xml
Suckling and Weaning in Captive White-Tailed and Fallow Deer in,https://brill.com/view/journals/beh/94/1-2/article-p128_6.xml%3Flanguage%3Den
The effect of epidural analgesia on postpartum urinary retention in ...,https://journals.scholarsportal.info/details/0959289x/v11i0003/164_teoeaoriwwdv.xml
PROBABILITY OF SPONTANEOUS ABORTION IN MULTIPARAE in,https://rep.bioscientifica.com/view/journals/rep/7/1/jrf_7_1_011.xml
Influence of Habitual Physical Activity During Late Pregnancy on the ...,https://journals.humankinetics.com/downloadpdf/journals/jpah/14/3/article-p203.xml
Analysis of socio-demographic and obstetric characteristics.,https://clinmedjournals.org/articles/rmi/reproductive-medicine-international-rmi-4-015.xml
Plasmodium Falciparum Associated Placental Pathology: A Light ...,https://www.ajtmh.org/view/journals/tpmd/41/2/article-p161.xml
"PLINY THE ELDER, Natural History | Loeb Classical Library",https://www.loebclassics.com/view/pliny_elder-natural_history/1938/pb_LCL353.565.xml
