On Soviets - Brill,https://brill.com/downloadpdf/book/edcoll/9789004421653/BP000005.xml
The Soviet Approach to the Right of Peoples to Self-determination,https://brill.com/view/journals/jhil/19/2/article-p200_4.xml%3Flanguage%3Den
Soviet Union in World War II - International Relations - Oxford ...,https://www.oxfordbibliographies.com/view/document/obo-9780199743292/obo-9780199743292-0077.xml
The Soviet Arctic Stations on Novaya Zemlya in - AMS Journals,https://journals.ametsoc.org/view/journals/bams/18/11/1520-0477-18_11_353.xml
A Study of the Soviet Economy. 3-volume set - IMF eLibrary,https://www.elibrary.imf.org/view/books/071/00119-9789264134683-en/00119-9789264134683-en-book.xml
What We Can Learn from the Soviet Collapse in - IMF eLibrary,https://www.elibrary.imf.org/view/journals/022/0031/004/article-A001-en.xml
Russia_1918.xml - Constitute Project,https://www.constituteproject.org/constitution/Russia_1918.xml
New York Times Coverage of the Soviet Union's Entrance into the ...,https://journals.humankinetics.com/previewpdf/journals/shr/38/1/article-p55.xml%3FpdfJsInlineViewToken%3D1341939424%26inlineView%3Dtrue
The Concept of the “Field” in Early Soviet Ethnography in,https://www.berghahnjournals.com/view/journals/sibirica/16/1/sib160103.xml
"Ethnicity, Nationalism and Conflict in and after the Soviet Union",https://sk.sagepub.com/books/ethnicity-nationalism-and-conflict-in-and-after-the-soviet-union/n2.xml
