Senior Cory Mehl and Head Coach Rob Miller Preview Fall Season ...,https://www.santaclarabroncos.com/sports/m-golf/2011-12/videos/GolfSeasonPreview.flv
Bryce Miller: A Tale of Two Sports - UC Santa Barbara,https://www.ucsbgauchos.com/sports/m-volley/2011-12/videos/Bryce_Miller_Feature.flv
Boilermaker Union News and Updates | Page 20 | International ...,https://boilermakers.org/news/video.flv%3Fpage%3D19
Former Softball Player Jenna Lamoreaux Reflects About Emory,https://www.emoryathletics.com/sports/sball/video/Lamoreaux_Talks_Emory.flv
Yale Doubles Up St. Lawrence - ECAC Hockey,https://www.ecachockey.com/men/video/2012-13/20121011_Yale_StLawrence-desktop.flv
Yale Skates Past Brown - ECAC Hockey,https://www.ecachockey.com/women/video/2012-13/20131701_Yale_Brown-desktop.flv
Chemicals to Syrian militants may have come from al-Qaeda,https://www.malaysiasun.com/news/217228047/oct04v56.flv
Men's Tennis Postmatch Interviews vs. Adelphi (NE-10 Tournament ...,https://www.stonehillskyhawks.com/sports/mten/2011-12/videos/mtnADE041712a.flv%3Flist%3D/sports/mten/video/index
Tom Hardy says “Mad Max: Fury Road” sequel “a matter of when”,https://www.northkoreatimes.com/news/251017045/oct04v56.flv
The matches that made Alastair Cook a record-breaker - ESPNcricinfo,https://www.jamaicantimes.com/news/257935754/oct04v40.flv
