"Baby, it's cold outside | The Blade",https://www.toledoblade.com/local/2017/01/05/Baby-it-s-cold-outside-5/stories/feed/feed/index.rss
"What is the scope of biomedical , Pharmacy and Biochemistry? What ...",http://www.counselling.meracareerguide.com/t/what-is-the-scope-of-biomedical-pharmacy-and-biochemistry-what-type-of-job-can-i-get-and-pakages/1412.rss
Every Thought Captive Podcast - Libsyn,http://feeds.soundcloud.com/users/soundcloud:users:289260217/sounds.rss
DEFCON 8 [Video] Speeches from the Hacker Convention.,https://media.defcon.org/DEF%2520CON%2520rss/defcon-8-video.rss
the morning shakeout podcast - Acast,https://pod.link/1320788737.rss
Knowledge For Men - Libsyn,https://audioboom.com/channels/2728322.rss
The Dominate Test Prep Podcast - Buzzsprout,https://feeds.buzzsprout.com/548431.rss
The Breaking Addictions Podcast W/ Ronnie Landis - Buzzsprout,https://feeds.buzzsprout.com/38467.rss
Scribbling Inner Voice (SIV) - Anchor,https://feeds.hubhopper.com/c27b4e5a01baf6dbebf9a902f0a0e2a6.rss
Chulbuli Tales Podcast,https://www.omnycontent.com/d/playlist/6244f5b5-c2fb-44f4-86cd-ab6b008158ba/cf2e7d48-2253-49e4-b46c-ac1d0061c7f0/0269ec49-84fd-4001-86d8-ac1d006a0bac/podcast.rss
