IDHS Office Closure 2/8/19 - dhs.state.il.us,https://www.dhs.state.il.us/page.aspx/FACT_1WhatIsVR.flv%3Fitem%3D116253%26newssidebar%3D27897%26postdate%3D1/22/2018
IDHS Office Closure 2/8/19,https://www.dhs.state.il.us/page.aspx/FACT_1WhatIsVR.flv%3Fitem%3D116253%26postdate%3D5/2/2022%26approval%3D4%26newsitemid%3D144120%26getpreviousnews%3Dtrue%26newssidebar%3D27897
New UN Rights Chief Voices Concern About Abuses Worldwide,https://www.beijingbulletin.com/news/257959534/feb24v21.flv
Russia's Soccer Victory Sparks Street Celebrations - Radio Free ...,https://www.londonmercury.com/news/257596308/oct04v40.flv
EU Gears Up for Trade War as Populist Challenge Grows,https://www.madagascarsun.com/news/257470968/oct04v56.flv
Fire guts Storms River mouth restaurant and shop - News24,https://www.johannesburglife.com/news/249711041/oct04v56.flv
Turbulence at Treasury: A short history - News24,https://www.johannesburglife.com/news/258095885/oct04v56.flv
TWU Vic/Tas,http://old.twu.asn.au/index.php/news/8-news/images/document/Whispers.flv
Eurotunnel calls for action by French government after migrants ...,https://www.irishsun.com/news/234457757/oct04v56.flv
Walmart Canada acquiring several Target stores,https://www.irishsun.com/news/232691065/oct04v56.flv
