Potters' Marks and Incised Signs - Brill,https://brill.com/previewpdf/book/9789004409101/BP000011.xml
Chapter 8 Potters' Marks and Incised Signs in - Brill,https://brill.com/view/book/9789004409101/BP000011.xml
Bank and near-bank processes in an incised channel,https://journals.scholarsportal.info/details/0169555x/v35i3-4/193_banpiaic.xml
Mechanical properties and function of the spinal pia mater in,https://thejns.org/spine/view/journals/j-neurosurg-spine/1/1/article-p122.xml
Fluvial Landscapes and Stratigraphy in a Flume,https://thesedimentaryrecord.scholasticahq.com/article/30117.xml
Geologic Map of the east half of the Black Canyon City 7.5 ...,http://repository.azgs.az.gov/uri_gin/azgs/dlio/617/fgdc.xml
Structural integrity criteria for existing CCR surface impoundments.,https://www.govinfo.gov/content/pkg/CFR-2015-title40-vol25/xml/CFR-2015-title40-vol25-sec257-73.xml
RC Wolf - Bioscientifica,https://eje.bioscientifica.com/downloadpdf/journals/eje/71/1_Suppl/acta_71_Suppl_166_025.xml
Summary - medRxiv,https://www.medrxiv.org/content/medrxiv/early/2020/10/10/2020.09.15.20193037.source.xml
