Physicochemical Fruit Characteristics of Cornelian Cherry (Cornus ...,https://journals.ashs.org/hortsci/view/journals/hortsci/46/6/article-p849.xml
'Ntoulia 1' and 'Ntoulia 2' Cornelian Cherries (Cornus mas L.) in,https://journals.ashs.org/hortsci/view/journals/hortsci/46/6/article-p955.xml
A Cornelian Seal from Nymphaeum and a Question of Archaizing in ...,https://brill.com/abstract/book/edcoll/9789004494572/B9789004494572_s017.xml
Basic nutritional properties of cornelian cherry (Cornus mas L ...,https://akjournals.com/view/journals/066/44/3/article-p357.xml
Evaluation of antioxidant activity of cornelian cherry (Cornus Mas L.) in,https://akjournals.com/view/journals/066/34/2/article-p193.xml
[PDF] antioxidants - Semantic Scholar,https://journals.scholarsportal.info/pdf/20763921/v08i0009/nfp_eoaaapocmlfj.xml
TSWJ The Scientific World Journal 1537-744X 2356-6140 Hindawi ...,http://downloads.hindawi.com/journals/tswj/2014/847368.xml
Tasmanian A-League stadium A Tasmanian A-League team could ...,https://www.abc.net.au/news/ajax/19938/markers.xml
CJFST Croat J Food Sci Technol Croatian Journal of Food Science ...,https://hrcak.srce.hr/xml/16885/CJFST%252010-2-197.XML
