Visas to Brazil - Consulado-Geral do Brasil em Londres,http://cglondres.itamaraty.gov.br/en-us/visas_to_brazil.xml
Visas,http://losangeles.itamaraty.gov.br/en-us/visas.xml
"Embassy of Brazil in Washington, DC",https://sistemas.mre.gov.br/kitweb/datafiles/Washington/en-us/Main.xml
Consulate General of Brazil in Boston,https://sistemas.mre.gov.br/kitweb/datafiles/Boston/en-us/Main.xml
IMF Staff Country Reports Volume 2016 Issue 349: Brazil,https://www.elibrary.imf.org/view/journals/002/2016/349/002.2016.issue-349-en.xml
Brazil's Role in Latin America's Regionalism - Brill,https://brill.com/downloadpdf/journals/gg/27/1/article-p25_2.xml
Brazil indigenous lands - ArcGIS Online,https://www.arcgis.com/sharing/rest/content/items/322d13636595466883421d553f2af65a/info/metadata/metadata.xml%3Fformat%3Ddefault%26output%3Dhtml
Overall and Leisure-Time Physical Activity Among Brazilian Adults,https://journals.humankinetics.com/view/journals/jpah/15/3/article-p212.xml
Frontal Influences on Northeast Brazil in - AMS Journals - American ...,https://journals.ametsoc.org/view/journals/mwre/107/9/1520-0493_1979_107_1140_fionb_2_0_co_2.xml
