File:Fr-des raisins secs.ogg - Wikimedia Commons,https://commons.wikimedia.org/wiki/File:Fr-des_raisins_secs.ogg
File:En-us-raisin.ogg - Wikimedia Commons,https://commons.wikimedia.org/wiki/File:En-us-raisin.ogg
File:en-us-raisin.ogg - Wiktionary,https://en.wiktionary.org/wiki/File:en-us-raisin.ogg
"File:Fr-raisin.ogg - Wikibooks, open books for an open world",https://en.wikibooks.org/wiki/File:Fr-raisin.ogg
Timed text for this file is hosted on Wikimedia Commons - Wikibooks,https://en.wikibooks.org/wiki/TimedText:Fr-raisin.ogg
Galio/LoL/Audio | League of Legends Wiki - Fandom,http://leagueoflegends.wikia.com/wiki/File:Galio.move34.ogg
