Panda's Platinum Chase - Buzzsprout,https://feeds.buzzsprout.com/1788219.rss
Our Leadership Voices: Uncut - Buzzsprout,https://feeds.buzzsprout.com/1774812.rss
Dish Nation - Audioboom,https://audioboom.com/channels/4905674.rss
Unofficial Emerald Isle ambassaador bleeds green - The Blade ...,https://www.toledoblade.com/frontpage/2002/03/18/Unofficial-Emerald-Isle-ambassaador-bleeds-green/stories/feed/feed/index.rss
Fox News Channel hires James Carville - Toledo Blade,https://www.toledoblade.com/a-e/tv-radio/2014/02/06/Fox-News-Channel-hires-James-Carville-1/stories/feed/feed/index.rss
Chicago Baseball Week In Review - Spreaker,https://feeds.podcastpass.net/8b8f4cf57155add5e8ec3132bcfe85a8.rss
