"As If We Were Codgers: Flattery, Parrhēsia and Old Man Demos in ...",https://brill.com/view/journals/agpt/29/1/article-p108_6.xml%3Flanguage%3Den
Polis: The Journal for Ancient Greek and Roman Political ... - Brill,https://brill.com/view/journals/agpt/29/1/agpt.29.issue-1.xml%3Flanguage%3Den
United States Government Publishing Office publisher pbl distributor ...,https://www.govinfo.gov/metadata/pkg/USCOURTS-azb-2_06-ap-00922/mods.xml
Latest From the Blogs | Wild at Heart,https://wildatheart.org/blogs/landing/atom.xml%3Fpage%3D18
"ARISTOPHANES, Wealth | Loeb Classical Library",https://www.loebclassics.com/view/aristophanes-wealth/2002/pb_LCL180.501.xml
Happiness - SAGE Reference - The SAGE Encyclopedia of Lifespan ...,https://sk.sagepub.com/reference/the-sage-encyclopedia-of-lifespan-human-development/i12820.xml
SAGE Reference - The Social History of the American Family,https://sk.sagepub.com/reference/the-social-history-of-the-american-family/n1.xml
Camden Community Radio: MusicShowcases,https://podcast.canstream.co.uk/camden/audio/MusicShowcases-rss.xml
IN SIMPKINSVILLE; Character Tales: Electronic Edition.,https://docsouth.unc.edu/southlit/stuart/stuart.xml
