East Toledo man accused of raping woman | The Blade,https://www.toledoblade.com/Police-Fire/2018/07/25/East-Toledo-man-charged-with-raping-woman-at-gunpoint/stories/feed/index.rss
"West Toledo man accused of beating woman, breaking into her ...",https://www.toledoblade.com/Police-Fire/2018/04/20/West-Toledo-man-accused-of-breaking-into-womans-home-beating-her/stories/feed/feed/index.rss
Late Night Woman's Hour - Subscribe on Android,https://subscribeonandroid.com/podcasts.files.bbci.co.uk/p05nrmhm.rss
Youngest woman to fly solo around the world chose an ultralight of ...,https://www.mzv.cz/singapore/en/czechia_and_singapore/zara.rss
SoulTalk by Mdrn Woman - PodServe.fm,https://www.podserve.fm/series/rss/2358/soultalk-by-mdrn-woman.rss
Toledo woman arraigned after N-word spray-painted on neighbor's ...,https://www.theblade.com/Courts/2018/07/16/Toledo-woman-arraigned-after-N-word-spray-painted-on-neighbor-s-home/stories/feed/index.rss
Soulful Woman - Buzzsprout,https://feeds.buzzsprout.com/1762779.rss
Wander Woman: A Travel Podcast - Buzzsprout,https://feeds.buzzsprout.com/290348.rss
