Notice of Effectiveness - SEC.gov,https://www.sec.gov/Archives/edgar/data/1844255/999999999521004556/xslEFFECTX01/primary_doc.xml
Series [Axis] Milliman 6-Month Buffered S&P 500 with Par Up ...,https://www.sec.gov/Archives/edgar/data/1844255/000138713122000228/mvit-20220111_lab.xml
Today's News | LaRueCountyHerald.com,https://www.laruecountyherald.com/news/todaysnews/rss.xml%3Fpage%3D3077
Sights from Round 2 of the US Senior Women's Amateur - USGA,https://www.usga.org/content/usga/home-page/championships/2019/u-s--senior-women-s-amateur/galleries/sights-from-round-2-of-the-u-s--senior-women-s-amateur-golf-photos-cedar-rapids/_jcr_content/photoDetails.data.xml
Survey of How Hanging Baskets Influence the Light Environment at ...,https://journals.ashs.org/horttech/view/journals/horttech/23/6/article-p823.xml
Growth and Appearance Quality of Four Microgreen Species under ...,https://journals.ashs.org/hortsci/view/journals/hortsci/55/9/article-p1399.xml
Tiger stretches PGA lead - ABC,http://www.abc.net.au/xmlcontent/200708/2002671.xml
Tagore and Yeats: A Postcolonial Re-​envisioning - Brill,https://brill.com/downloadpdf/book/9789004515154/BP000010.xml
BETWEEN SYSTEM AND SENSATION FREDERIK TYGSTRUP - Brill,https://brill.com/downloadpdf/book/edcoll/9789004333031/B9789004333031-s017.xml
