CHICHIKOV DIS-COURSED: DISCURSIVE DOMINANCE AND ...,https://brill.com/view/journals/spsr/28/1-2/article-p197_18.xml%3Flanguage%3Den
Variations in location of the arteries coursing between the brain stem ...,https://thejns.org/downloadpdf/journals/j-neurosurg/76/6/article-p973.xml
Microsurgical anatomy of the extracranial-extradural origin of the ...,https://thejns.org/focus/view/journals/neurosurg-focus/7/2/article-pE2.xml
xml - GovInfo,https://www.govinfo.gov/bulkdata/BILLS/117/1/hr/BILLS-117hr3335ih.xml
Anterior (a) and posterior (b) views of dextrocardia with situs ...,https://clinmedjournals.org/articles/iavm/international-archives-of-vascular-medicine-iavm-4-008.xml
US hopes arms surge will sap Putin's will - The Washington Post,https://www.washingtonpost.com/page/2010-2019/WashingtonPost/2013/05/05/National-Politics/Polling/release_233.xml%3Fuuid%3D78ncRrXFEeK1aGkX9qxtnQ%26itid%3Dlk_inline_manual_11
"Breaking News, World, US, DC News and ... - The Washington Post",https://www.washingtonpost.com/page/2010-2019/WashingtonPost/2016/07/20/National-Politics/Polling/question_16576.xml%3Fuuid%3D6xFTek5oEea_J0BRBoNvlg%26itid%3Dlk_inline_manual_13
"ARISTOTLE, History of Animals | Loeb Classical Library",https://www.loebclassics.com/view/aristotle-history_animals/1965/pb_LCL438.339.xml%3FreadMode%3Drecto
Jackal Coursing - MoreBooks!,https://www.morebooks.de/gb/search.xml%3Fq%3DJackal%2BCoursing
