Entry Turning Point Analysis - SAGE Knowledge,https://sk.sagepub.com/reference/the-sage-encyclopedia-of-communication-research-methods/i14963.xml
Turning Ocean Mixing Upside Down in - AMS Journals,https://journals.ametsoc.org/view/journals/phoc/46/7/jpo-d-15-0244.1.xml
Turning Points in the Assessment and Clinical Applications of ...,https://www.oxfordbibliographies.com/view/document/obo-9780199828340/obo-9780199828340-0271.xml
Chapter 3 Turning Earth to Gold: The Early Yogācāra Understanding ...,https://brill.com/abstract/book/edcoll/9789004440913/BP000005.xml
The Directed Head Turning Response and Allied Movements of the ...,https://brill.com/view/journals/beh/13/3-4/article-p212_2.xml%3Flanguage%3Den
Virtual learning during the COVID-19 pandemic: a turning point in ...,https://thejns.org/focus/view/journals/neurosurg-focus/49/6/article-pE18.xml
Turning the Closets Inside/Out: Towards a Queer-Feminist Theory in ...,https://journals.humankinetics.com/view/journals/ssj/15/2/article-p154.xml
Turning Science Into Effective Policy Advocacy—The Foundations ...,https://journals.humankinetics.com/view/journals/jpah/16/10/article-p809.xml
'Turning Human Beings into Lawyers' in - Berghahn Journals,https://www.berghahnjournals.com/view/journals/jla/2/2/jla020210.xml
