Intraneural Ganglionic Cyst of the Peroneal Nerve,https://thejns.org/previewpdf/journals/j-neurosurg/32/6/article-p692.xml
Intraneural Ganglionic Cyst of the Peroneal Nerve in,https://thejns.org/view/journals/j-neurosurg/32/6/article-p692.xml
Intolerance to antibiotics: a ganglionic cyst. A case report in: Journal ...,https://japmaonline.org/view/journals/apms/58/3/87507315-58-3-135.xml
The cholinergic influence on the mesenteric ganglion affects the ...,https://joe.bioscientifica.com/view/journals/joe/191/3/1910587.xml
Pregnancy in rats is modulated by ganglionic cholinergic action in,https://rep.bioscientifica.com/view/journals/rep/131/6/1311151.xml
Cyclic GMP-dependent protein phosphorylation in relation to ...,https://journals.scholarsportal.info/details/01651838/v33i0002/162_cgppirtmgtim.xml
Abstract - medRxiv,https://www.medrxiv.org/content/medrxiv/early/2022/06/16/2022.06.15.22276240.source.xml
Untitled,https://www.scirp.org/xml/93099.xml
Untitled,https://www.biorxiv.org/content/biorxiv/early/2021/05/14/2021.05.13.444045.source.xml
