Pristine Nocturnal Convective Initiation: A Climatology and ...,https://journals.ametsoc.org/view/journals/wefo/32/4/waf-d-16-0222_1.xml
Pristine Nocturnal Convective Initiation: A Climatology and ...,https://journals.ametsoc.org/abstract/journals/wefo/32/4/waf-d-16-0222_1.xml
Laboratory Performance Evaluation of Pristine and Used Headgear ...,https://journals.humankinetics.com/view/journals/jab/35/4/article-p297.xml
Laboratory Performance Evaluation of ... - Human Kinetics Journals,https://journals.humankinetics.com/downloadpdf/journals/jab/35/4/article-p297.xml
"A World Trimmed with Fur: Wild Things, Pristine Places, and ... - Brill",https://brill.com/view/journals/inas/19/2/article-p318_318.xml%3Flanguage%3Den
Conclusion: The Search for Pristine Purity Wesley's quotation ... - Brill,https://brill.com/previewpdf/book/9789401204958/B9789401204958-s010.xml
Arthropod diversity in pristine vs. managed beech forests in ...,https://journals.scholarsportal.info/details/23519894/v3icomplete/72_adipvmbfitu.xml
Diversified Midstream LLC v. Pristine Clean Energy LLC et al,https://www.govinfo.gov/metadata/pkg/USCOURTS-kyeb-5_21-ap-05091/mods.xml
Biocompatibility of pristine graphene for neuronal interface in,https://thejns.org/pediatrics/view/journals/j-neurosurg-pediatr/11/5/article-p575.xml
