[PDF] An Introductory Investigation Into Bidialectalism - ScholarlyCommons,http://repository.upenn.edu/cgi/viewcontent.cgi%3Farticle%3D1468%26context%3Dpwpl
Bidialectalism: A New Book and Some Old Issues - JSTOR,https://www.jstor.org/stable/3087834
[PDF] DOCUMENT RESUME AUTHOR Bidialectalism vis-a-vis ... - ERIC,https://files.eric.ed.gov/fulltext/ED408852.pdf
[PDF] Teaching to Enhance Bidialectalism: Some Theoretical and Practical ...,https://files.eric.ed.gov/fulltext/ED141800.pdf
[PDF] TEACHERS' PERCEPTIONS OF BILINGUALISM AND ... - CORE,https://core.ac.uk/download/pdf/10200904.pdf
ANN-MARIE IVARS Bidialectalism and Identity - De Gruyter,https://www.degruyter.com/document/doi/10.1515/9783110852622.203/pdf
Bidialectalism for the Disadvantaged Student,https://www.tandfonline.com/doi/pdf/10.1080/00193089.1973.10533470
Bidialectalism and primary school achievement in a dutch dialect area,https://www.tandfonline.com/doi/pdf/10.1080/09500788809541226
The effect of bidialectalism on executive function - SAGE Journals,https://journals.sagepub.com/doi/pdf/10.1177/1367006918763132
