Python-Ethical-Hacking/entry_points.txt at master · Scunnered ...,https://github.com/Scunnered/Python-Ethical-Hacking/blob/master/venv/Lib/site-packages/pip-20.1.1.dist-info/entry_points.txt
Python-Ethical-Hacking/LICENSE.txt at master - GitHub,https://github.com/Scunnered/Python-Ethical-Hacking/blob/master/venv/Lib/site-packages/pip-20.1.1.dist-info/LICENSE.txt
Fightin' Dominies and Form: Politics & Narrative in Some Modern ...,https://dspace.stir.ac.uk/bitstream/1893/2778/3/Fightin_Dominies.pdf.txt
Which Cultural Policy? Whose Cultural Policy? Players and ...,https://dspace.stir.ac.uk/bitstream/1893/1226/3/B%2520McConnell%2520-%2520Thesis%2520-%2520Final%2520Edit.pdf.txt
40751-0.txt - Project Gutenberg,https://www.gutenberg.org/files/40751/40751-0.txt
The Daughter of Time - Project Gutenberg Australia,http://gutenberg.net.au/ebooks09/0900271.txt
