Balance Perturbations as a Measurement Tool for Trunk Impairment ...,https://journals.humankinetics.com/view/journals/apaq/36/1/article-p61.xml
Role of Mesoscale Eddies in Cross-Frontal Transport of Heat and ...,https://journals.ametsoc.org/view/journals/phoc/45/12/jpo-d-14-0240.1.xml
Symmetric Instability in Cross-Equatorial Western Boundary ...,https://journals.ametsoc.org/view/journals/phoc/51/6/JPO-D-20-0273.1.xml
Chapter 21 | Ethical Issues in Cross-Cultural Psychology,https://methods.sagepub.com/book/the-handbook-of-social-research-ethics/n21.xml
Moral Objectivism in Cross-Cultural Perspective in - Brill,https://brill.com/view/journals/jocc/15/3-4/article-p386_9.xml%3Flanguage%3Den
Chapter 13 Wulaya 'Head' in Yanyuwa in - Brill,https://brill.com/view/book/edcoll/9789004392410/BP000016.xml
the role of community enterprise in cross-sector work for sustainability,https://www.elgaronline.com/view/edcoll/9781839105333/9781839105333.00014.xml
Chapter 6: Methodological issues in cross-cultural research,https://www.elgaronline.com/abstract/edcoll/9781788978538/9781788978538.00013.xml
A Fresh Look at the Relationship between TSH and Free Thyroxine ...,https://etj.bioscientifica.com/view/journals/etj/4/1/ETJ369796.xml
