Faktor-faktor Ini Akan Pengaruhi Sentimen Bursa Pekan Ini,https://money.kompas.com/read/2017/01/09/085214626/faktor-faktor.ini.akan.pengaruhi.sentimen.bursa.pekan.ini%3Fpage%3Dall
Bursa Saham di Kawasan Asia Bergairah pada Pagi Ini,https://travel.kompas.com/read/2014/06/30/1149017/Bursa.Saham.di.Kawasan.Asia.Bergairah.pada.Pagi.Ini
Napoli Pertahankan Pemain Incaran Manchester United Ini - Juara.Net,http://www.juara.net/read/sepak-bola/italia/174924-napoli.pertahankan.pemain.incaran.manchester.united.ini
Liverpool Berduel dengan Man United untuk Jasa Prospek Muda Ini,http://www.juara.net/read/sepak-bola/inggris/130869-liverpool.berduel.dengan.man.united.untuk.jasa.prospek.muda.ini
Bek Anyar Inter Milan Ungkap Target Klubnya Musim Ini,https://www.bolasport.com/read/bola/italia/193612-bek.anyar.inter.milan.ungkap.target.klubnya.musim.ini
Multi Bintang Pimpin Saham Paling Bersinar Siang Ini - Netralnews ...,https://archive.netralnews.com/news/ekonomi/read/31333/multi.bintang.pimpin.saham.paling.bersinar.siang.ini
[PDF] WALIKOTA TERNATE PROVINSI MALUKU UTARA PERATURAN ...,https://jdih.ternatekota.go.id/read.ini%3F16540181397oqh4uss1kgt0ihxc397g
Ini Enam Saham Pilihan Hari Ini,https://news.allauction.live/host-http-bisniskeuangan.kompas.com/read/2016/02/15/085044926/Ini.Enam.Saham.Pilihan.Hari.Ini
