Â Information Clearing House - ICH.flv - Internet Archive,https://archive.org/details/InformationClearingHouse-Ich.flv
Australian Filmmaker Granted Pardon in Cambodia - Radio Free Asia,https://www.northkoreatimes.com/news/258025823/oct04v56.flv
"Report: South Sudan troops raped, killed while peace pursued",https://www.northkoreatimes.com/news/258014980/oct04v56.flv
"After Mosul and Raqqa Fall, Where Will Next Battle With IS Be?",https://www.parisguardian.com/news/253809973/oct04v56.flv
US Prepares for Return of War Dead Remains from North Korea,https://www.illinoisintelligencer.com/news/257521166/oct04v40.flv
Taliban Political Chief Baradar To Attend Afghan Peace Talks In Qatar,https://www.calgarymonitor.com/news/259685681/feb24v21.flv
Monday's weather: A hot start to the new week - News24,https://www.sierraleonetimes.com/news/259685322/feb24v21.flv
World Bank clears $250 million loan for making Indian youth more ...,https://www.malaysiasun.com/news/253744978/oct04v56.flv
Chapter 5: AcuServer Functions - Die Blumengalerie,https://www.blumengalerie.at/videos/VTS_02_1.flv
心情日记| 红楼阁REDdist,https://www.reddist.com/taxonomy/term/13/sample.FLV%3Fpage%3D225
online work for earn money at home,https://finanspres.com/article/finance/497wu/nmrkj/assets/media/VH_videoAsset.flv
Emotional Freedom Technique (EFT) Introduction.flv - Metoda EFT ...,"https://chomikuj.pl/MetalMario/Masa*c5*bc%2BVideo/Metoda%2BEFT/Emotional%2BFreedom%2BTechnique%2B(EFT)%2BIntroduction,6534633778.flv"
Memory Release with Emotional Freedom Technique (EFT).flv - EFT ...,"https://chomikuj.pl/zgo/Zdrowie%2B-%2Bhas*c5*82em%2Bnazwa%2Bfolderu/EFT/Memory%2BRelease%2Bwith%2BEmotional%2BFreedom%2BTechnique%2B(EFT),4871965219.flv"
