[PDF] BENZAL CHLORIDE CAS Number - NJ.gov,http://nj.gov/health/eoh/rtkweb/documents/fs/0195.pdf
Acidity of hydrocarbons. XXIX. Kinetic acidities of benzal fluoride ...,https://pubs.acs.org/doi/pdf/10.1021/ja01011a056
Electrocatalytic Reduction of Benzal Chloride by Cobalt(I)(salen). A,https://pubs.acs.org/doi/pdf/10.1021/jo00070a030
[PDF] BENZAL CHLORIDE - CAMEO Chemicals,https://cameochemicals.noaa.gov/chris/BZL.pdf
The reaction of benzotrihalides and benzal halides with magnesium ...,https://www.sciencedirect.com/science/article/pii/0022328X9085094F/pdf%3Fmd5%3D1f6b089b24e5038287b366e15f4c5f91%26pid%3D1-s2.0-0022328X9085094F-main.pdf
"For the detection of benzyl and benzal chloride in air, a method has ...",https://www.sciencedirect.com/science/article/pii/0026265X71900336/pdf%3Fmd5%3D77de3dd10aa4a1ebd763dcada04ee32d%26pid%3D1-s2.0-0026265X71900336-main.pdf
"Failure of β-Benzal Butyramide, a Recently Reported ... - AHA Journals",https://www.ahajournals.org/doi/pdf/10.1161/01.CIR.27.6.1138
[PDF] THE MECHANISM OF THE HYDROLYSIS OF BENZAL CHLORIDE,https://eprints.lib.hokudai.ac.jp/dspace/bitstream/2115/24785/1/12(3)_P223-229.pdf
Electrochemical Reduction of Benzal Chloride in the Presence of ...,https://iopscience.iop.org/article/10.1149/1.2129051/pdf
[PDF] Benzal Chloride - VWR,https://us.vwr.com/store/asset%3FassetURI%3Dhttps://us.vwr.com/stibo/hi_res/eng_us/93/64/8239364.pdf
