sitemap.xml - Newsstand,https://www.newsstand.co.uk/sitemap.xml
SAGE Reference - Dictionary of Marketing Communications,https://sk.sagepub.com/reference/dictionary-of-marketing-communications/n3551.xml
NewsStand/popup_panel.xml at master · CAntol/NewsStand - GitHub,https://github.com/CAntol/NewsStand/blob/master/res/layout/popup_panel.xml
"Essays, Arguments, and Opinions from around the World",https://journals.scholarsportal.info/details/00157228/v2006i0152/86_gneaaofatw.xml
Infrastructure and Agency in: Periodical Studies Today - Brill,https://brill.com/view/book/9789004468313/BP000025.xml
Multimodality in: Periodical Studies Today - Brill,https://brill.com/view/book/9789004468313/BP000018.xml
sitemap.xml - Colectivo Coffee,http://colectivocoffee.com/sitemap.xml
"84 Video/Newsstand, Inc. et al v. Sartini et al",https://www.gpo.gov/fdsys/granule/USCOURTS-ohnd-1_07-cv-03190/USCOURTS-ohnd-1_07-cv-03190-0/mods.xml
How to Move iOS Apps Into the Newsstand Folder,http://cairo.lti.cs.cmu.edu/~hector/wikihow_xml/categorized/Computers%2520and%2520Electronics/Phones%2520and%2520Gadgets/Mobile%2520Operating%2520Systems/Apple%2520iOS/Move-iOS-Apps-Into-the-Newsstand-Folder.html.xml
