"Oldrich Kral, famous Czech sinologist, dies at 87 - MZV",https://www.mzv.cz/beijing/en/culture_and_sports/oldrich_kral_famous_czech_sinologist.rss
"Oldrich Kral, famous Czech sinologist, dies at 87 | Embassy of the ...",https://www.mzv.cz/beijing/en/culture_and_sports/oldrich_kral_famous_czech_sinologist.rss%3Fnotify%3D1
The Current - CBC,http://audioboom.com/channels/2409157.rss
EU-China Podcast - Buzzsprout,https://feeds.buzzsprout.com/1755113.rss
The Drunken Boxing Podcast - Anchor,http://feeds.soundcloud.com/users/soundcloud:users:666579347/sounds.rss%3Ffbclid%3DIwAR0mxg2KKoh1aQXk_1-ef6BGaQgKsnAunci4dtXJtiEWdKOJduTKKzUeLEU
The Little Red Podcast - Omny Studio,https://www.omnycontent.com/d/playlist/a7b4f8fe-59d9-4afc-a79a-a90101378abf/bf2c1d80-3656-4449-9d00-a903004e8f84/efbff746-e7c1-463a-9d80-a903004e8f8f/podcast.rss
Latest Mandarin language Podcast Episodes - Pod.casts,https://pod.casts.io/topics/mandarin%2520language/new-episodes.rss
Wealth Without Borders Podcast - Libsyn,https://pod.link/1512549520.rss
The China History Podcast - RedCircle,https://pod.link/489369498.rss
