Labor feud leaves Cedar Point stalled | The Blade,https://www.toledoblade.com/local/2001/03/23/Labor-feud-leaves-Cedar-Point-stalled/stories/feed/index.rss
Bone-cold Bush protesters hot under the collar - Toledo Blade,https://www.toledoblade.com/local/politics/2004/01/22/Bone-cold-Bush-protesters-hot-under-the-collar/stories/feed/index.rss
And That's Why We Drink - Simplecast,https://audioboom.com/channels/4911419.rss
The Constant: A History of Getting Things Wrong - Megaphone,https://pod.link/1321926387.rss
Delaware Valley Journal - Buzzsprout,https://feeds.buzzsprout.com/1038646.rss
Decarbonize: The Clean Energy Podcast - Buzzsprout,https://feeds.buzzsprout.com/793241.rss
ThisWeek Community News: Marching Orders - Omny Studio,https://www.omnycontent.com/d/playlist/a858b0a5-e5e6-4a14-9717-a70b010facc1/0192ece4-efaa-4bc5-97d1-a89500da167f/3eae7dfa-8e99-4133-83c3-a91b010589c4/podcast.rss
Philadelphia's Morning Answer with Chris Stigall Podcast,https://www.omnycontent.com/d/playlist/5e27a451-e6e6-4c51-aa03-a7370003783c/3791a066-0c09-420e-ace2-aafc0105c100/1acab615-4763-4c92-b558-aafc0105e4d8/podcast.rss
Fred LeFebvre and the Morning News - The Podcast Discovery ...,https://pod.casts.io/podcasts/fred-lefebvre-and-the-morning-news.rss
