2022 ETA Consensus Statement: What are the indications for post ...,https://etj.bioscientifica.com/view/journals/etj/11/1/ETJ-21-0046.xml
Operative treatment of prolactinomas: indications and results in a ...,https://eje.bioscientifica.com/view/journals/eje/158/1/11.xml
State of the union: a review of lumbar fusion indications and ...,https://thejns.org/spine/view/journals/j-neurosurg-spine/31/1/article-p1.xml
"Indications, complications, and mortality rate following craniotomy or ...",https://avmajournals.avma.org/abstract/journals/javma/260/9/javma.21.04.0189.xml
"Indications, complications, and outcomes associated with subdermal ...",https://avmajournals.avma.org/view/journals/javma/255/8/javma.255.8.933.xml
Indications of a Decrease in the Depth of Deep Convective Cores ...,https://journals.ametsoc.org/view/journals/atsc/79/3/JAS-D-21-0119.1.xml
Indications for Breast MRI in the Patient with Newly Diagnosed ...,https://jnccn.org/view/journals/jnccn/7/2/article-p193.xml
Indications of Editorial Alteration and Adaptation in the Massoretic ...,https://brill.com/view/journals/vt/11/1/article-p201_16.xml%3Flanguage%3Den
Indications for ocular evisceration and orbital implant related ...,https://akjournals.com/view/journals/2066/3/2/article-p39.xml
