Improving a Sense of Belonging - Kentucky Department of Education,https://education.ky.gov/school/Documents/Improving%2520a%2520Sense%2520of%2520Belonging%2520Transcript.txt
Belong R.E.M. Chords and Lyrics for Guitar - Chordie,https://www.chordie.com/chord.pere/zenandjuice.com/music/rem/guitar/belong.txt
NPI:1912482787 | National Provider Identifier Registry - HIPAASpace,http://www.hipaaspace.com/medical_billing/coding/national_provider_identifier/codes/npi_1912482787.txt
NPI:1619591179 | National Provider Identifier Registry | Medical ...,https://www.hipaaspace.com/medical_billing/coding/national_provider_identifier/codes/npi_1619591179.txt
Personal items belonging to 1974 murder victim found in Manhattan,http://www.dailychronicle.com/articles/2005/10/13/news/01murderevidence.txt
EGL_EXT_platform_base,https://www.khronos.org/registry/EGL/extensions/EXT/EGL_EXT_platform_base.txt
Both Belong (the Grays) - Jason Falkner,https://jasonfalkner.com/tabs/bothbelong.txt
"The Open Door Note, 1899",http://bev.berkeley.edu/fp/readings/OpenDoorNote.txt
"Full text of ""[ Anthony P. Cohen] Belonging Identity And Social (""",https://archive.org/stream/AnthonyP.CohenBelongingIdentityAndSocial/Jeanne_Favret-Saada_Deadly_Words_Witchcraft_in_the_Bocage__1981_djvu.txt
We Belong Together (Remix) - OHHLA.com,https://ohhla.com/anonymous/misc/r_and_b/we_b_rmx.mrh.txt
