Journal of Belonging and Human Connection | Brill,https://brill.com/view/journals/jbhc/jbhc-overview.xml%3Flanguage%3Den
Belonging - Geography - Oxford Bibliographies,https://www.oxfordbibliographies.com/view/document/obo-9780199874002/obo-9780199874002-0150.xml
Belonging - Universität Bielefeld,https://www.uni-bielefeld.de/einrichtungen/cias/publikationen/wiki/b/belonging.xml
The Situated Politics of Belonging - SAGE Books,https://sk.sagepub.com/books/the-situated-politics-of-belonging/n2.xml
Sharedness as Belonging in - Berghahn Journals,https://www.berghahnjournals.com/view/journals/religion-and-society/12/1/arrs120115.xml
Boyhood and Belonging in - Berghahn Journals,https://www.berghahnjournals.com/view/journals/boyhood-studies/12/2/bhs120201.xml
Belonging through Social Emotional Learning in - NCTM,https://pubs.nctm.org/view/journals/mtlt/114/7/article-p556.xml
Creating a Sense of Belonging for Hispanic Farmers and ...,https://journals.ashs.org/horttech/view/journals/horttech/29/4/article-p476.xml
Chapter 13: Co-constructions of family and belonging in the politics ...,https://www.elgaronline.com/view/edcoll/9781788117227/9781788117227.00020.xml
