Pairing-Friendly Curves - IETF Tools,https://tools.ietf.org/id/draft-irtf-cfrg-pairing-friendly-curves-07.xml
Pairing-Friendly Curves - IETF Tools,https://tools.ietf.org/id/draft-irtf-cfrg-pairing-friendly-curves-02.xml
Deligne pairings and families of rank one local systems on algebraic ...,https://projecteuclid.org/journals/journal-of-differential-geometry/volume-115/issue-3/Deligne-pairings-and-families-of-rank-one-local-systems-on/10.4310/jdg/1594260017.xml
Twisted cohomology pairings of knots III; triple cup products,https://projecteuclid.org/journals/hiroshima-mathematical-journal/volume-50/issue-2/Twisted-cohomology-pairings-of-knots-III-triple-cup-products/10.32917/hmj/1595901628.xml
PAIRINGS OF ETHANOL SIPPER WITH FOOD INDUCES ...,https://alcalc.oxfordjournals.org/content/37/6/547.source.xml
PAIRINGS OF MEN AND WOMEN IN LUKE-ACTS Allen Black ... - Brill,https://brill.com/previewpdf/book/edcoll/9789047442011/Bej.9789004167476.i-504_012.xml%3FpdfJsInlineViewToken%3D1509349649%26inlineView%3Dtrue
“Your sons and your daughters will prophesy . . .”: Pairings of men ...,https://brill.com/view/book/edcoll/9789047442011/Bej.9789004167476.i-504_012.xml
Device Pairing Design Issues - WaterSprings.ORG,http://www.watersprings.org/pub/id/draft-ietf-dnssd-pairing-info-02.xml
The Effect of Two Pairing Techniques on Specific Feedback and ...,https://journals.humankinetics.com/view/journals/jtpe/12/3/article-p286.xml
