"Journal of Thermal Analysis, VoL 33 (1988) 1225-1229 - AKJournals",https://akjournals.com/previewpdf/journals/10973/33/4/article-p1225.xml%3FpdfJsInlineViewToken%3D1205841967%26inlineView%3Dtrue
Journal of Thermal Analysis and Calorimetry - AKJournals,https://akjournals.com/abstract/journals/10973/34/3/article-p783.xml
"[PDF] IDX - Basic Concepts in Medicinal Chemistry, 2nd edition",https://publications.ashp.org/downloadpdf/book/9781585286027/back-2.xml
Perspective on Fluorocarbon Chemistry. | Scholars Portal Journals,https://resolver.scholarsportal.info/resolve/09317597/v35i0017/nfp_pofc.xml
Synthesis of Peroxide Compounds by the BF3-Catalyzed Reaction ...,https://journals.scholarsportal.info/details/09317597/v36i0002/nfp_sopcbtaaeewh.xml
BIOLOGICAL ACTIVITIES OF 3-CYCLOPENTYL ETHERS OF ...,https://eje.bioscientifica.com/view/journals/eje/40/3_Suppl/acta_40_Suppl_67_089.xml
21 Food and Drugs 3 2013-04-01 2013-04-01 false Preservatives ...,https://www.govinfo.gov/content/pkg/CFR-2013-title21-vol3/xml/CFR-2013-title21-vol3-sec178-3800.xml
Excellent Homogeneous Catalysts for Cyclic Alcohol Oxidation in ...,https://www.degruyter.com/view/journals/tsd/57/4/article-p298.xml
AJAC American Journal of Analytical Chemistry 2156-8251 ...,http://file.scirp.org/xml/AJAC_2014102909552178.xml
High voltage research (breakdown strengths of gaseous and liquid ...,https://digital.library.unt.edu/ark:/67531/metadc1406451/metadata.untl.xml
"SECTION C CHEMISTRY METALLURGY In section C, the ...",http://www.wipo.int/ipc/itos4ipc/ITSupport_and_download_area/IPC6/subclass/core/en/xml/C07D.xml
"SECTION C CHEMISTRY METALLURGY In section C, the ...",https://www.wipo.int/ipc/itos4ipc/ITSupport_and_download_area/IPC4/subclass/core/en/xml/C06B.xml
1. Introduction - Hindawi.com,https://downloads.hindawi.com/archive/2014/547325.xml
"Elsevier,Elsevier Ltd UF batch Elsevier xml to mets convertor v0.1 ...",https://ufdcimages.uflib.ufl.edu/LS/00/52/41/75/00001/LS00524175_00001.mets.xml
Synthesis and Characterization of Thermotropic Liquid Crystalline ...,http://www.sphinxsai.com/2017/ch_vol10_no10/1/(216-224)V10N10CT.xml
"INDIRECT FOOD ADDITIVES: ADJUVANTS, PRODUCTION AIDS ...",http://www.gpo.gov/fdsys/pkg/CFR-2012-title21-vol3/xml/CFR-2012-title21-vol3-part178.xml
biorxiv BIORXIV bioRxiv bioRxiv Cold Spring Harbor Laboratory ...,https://www.biorxiv.org/content/biorxiv/early/2021/08/09/2021.08.09.455471.source.xml
biorxiv BIORXIV bioRxiv bioRxiv Cold Spring Harbor Laboratory ...,https://www.biorxiv.org/content/biorxiv/early/2019/05/02/625343.source.xml
ENVIRONMENTAL PROTECTION AGENCY [EPA-HQ-OPPT-2016 ...,https://www.federalregister.gov/documents/full_text/xml/2017/03/10/2017-04772.xml
