British royal couple expecting second child; Kate being treated for ...,https://www.toledoblade.com/a-e/culture/2014/09/08/British-royal-couple-expecting-second-child-Kate-being-treated-for-morning-sickness/stories/feed/index.rss
The Social Sickness Podcast - Buzzsprout,https://feeds.buzzsprout.com/1777186.rss
TOXIC SICKNESS RADIO SHOWS - Pod.casts,https://pod.casts.io/podcasts/toxic-sickness-radio-shows-label-releases.rss
Bodies - KCRW,https://pod.link/1408856271.rss
Abhayagiri Talks,https://www.abhayagiri.org/talks.rss
Ministries | Government of the Czech Republic,https://www.mzv.cz/copenhagen/da/kort_om_den_tjekkiske_republik/de_tjekkiske_ministerier/index.rss
Let the Bible Speak,https://www.cloverdalefpc.ca/media.rss
No Such Thing As A Fish - Audioboom,https://audioboom.com/channels/2399216.rss
