Electron Microscopical Studies On the Anterior End of Panagrellus ...,https://brill.com/view/journals/nema/14/4/article-p554_11.xml%3Flanguage%3Den
LIGHT AND ELECTRON MICROSCOPICAL STUDY OF THE ...,https://eje.bioscientifica.com/view/journals/eje/56/3/acta_56_3_004.xml
and electron-microscopical observations on the pars tuberalis of the ...,https://joe.bioscientifica.com/downloadpdf/journals/joe/54/3/joe_54_3_014.xml
Copro-microscopical and immunological diagnosis of ...,https://journals.scholarsportal.info/details/09717196/v44i0003/654_caidocsrttcp.xml
Microscopical and microchemical studies of osteochondral articular ...,https://journals.scholarsportal.info/details/00080594/v04i0001/107_mamsooad.xml
Agreement between Microscopical Diagnosis and Indirect ...,https://www.ajtmh.org/view/journals/tpmd/20/1/article-p10.xml
Light microscopical observations of the sigmoid species of ... - Sciendo,https://www.degruyter.com/view/j/cszma.2014.63.issue-1/cszma-2014-0001/cszma-2014-0001.xml
THERMAL ANALYSIS AND MICROSCOPICAL ...,https://akjournals.com/downloadpdf/journals/10973/82/2/article-p331.xml
Investigation of an outbreak of besnoitiosis in donkeys in ...,https://avmajournals.avma.org/abstract/journals/javma/240/11/javma.240.11.1329.xml
