the role of stimulus female novelty in the rearousal of copulation in ...,https://www.sciencedirect.com/science/article/pii/0003347270900540/pdf%3Fmd5%3D9465cbbd5141007ad419c64efb0e5f52%26pid%3D1-s2.0-0003347270900540-main.pdf
RAT (RA TTUS NOR VEGICUS) - ScienceDirect.com,https://www.sciencedirect.com/science/article/pii/S0003347274800096/pdf%3Fmd5%3D7f802404adc9cb36310a419ab2e4c15c%26pid%3D1-s2.0-S0003347274800096-main.pdf
The orienting response and direction of stimulus change - Springer,http://link.springer.com/content/pdf/10.3758/BF03331231.pdf
Effect of unconditioned stimulus linked subconvulsive current in chicks',https://link.springer.com/content/pdf/10.3758/BF03332680.pdf
The Psychological Background of the Doctoral Candidate - jstor,https://www.jstor.org/stable/1416431
The Inner World of Choice,https://psychotherapy.psychiatryonline.org/doi/pdf/10.1176/appi.psychotherapy.1963.17.2.324
[PDF] THE PSYCHOLOGY OF CHARACTER* I. - NCBI,https://www.ncbi.nlm.nih.gov/pmc/articles/PMC1068399/pdf/jnpsycho00041-0048.pdf
[PDF] Outline/Overview Psychodynamic model,http://facstaff.bloomu.edu/jleitzel/classes/psychdis/ch03.pdf
Ventilation During Sleep Onset in Young Adult Females,https://academic.oup.com/sleep/article-pdf/13/6/491/13659337/130603.pdf
