Introduction. The Fairy Godmother - De Gruyter,https://www.degruyter.com/princetonup/view/book/9781400827657/10.1515/9781400827657.1.xml
"The vanishing godmother in: Tales of magic, tales in print",https://www.manchesterhive.com/abstract/9781526129703/9781526129703.00012.xml
Chapter 7 Cinderboy and Snow White and the Seven Aliens - Brill,https://brill.com/view/book/9789004418998/BP000009.xml%3Flanguage%3Den
Too Good to Be True: Virtue Rewarded in Cinderella Elaine Pigeon,https://brill.com/downloadpdf/book/edcoll/9781848883178/BP000005.xml
index.xml,https://edition.cnn.com/video/data/3.0/video/us/2021/01/04/mom-gives-birth-intubated-icu-nurse-godmother-acfc-full-episode-vpx.cnn/index.xml
index.xml,https://edition.cnn.com/video/data/3.0/video/bestoftv/2013/04/09/exp-erin-outtake-kate-middleton-named-godmother-of-cruise-ship.cnn/index.xml
Italian families strike back at Godmother Throw Down - Shaw Local,https://www.mysuburbanlife.com/articles/2013/08/27/602b58bb54f14261a310f0c3f2806c30/index.xml
How to Make Marshmallow Treats Like Sally from the Scary ...,http://cairo.lti.cs.cmu.edu/~hector/wikihow_xml/categorized/Food%2520and%2520Entertaining/Recipes/Chocolate%2520and%2520Candy/Marshmallow%2520Treats/Make-Marshmallow-Treats-Like-Sally-from-the-Scary-Godmother-2.html.xml
Narrative and Social Control: Critical Perspectives - SAGE Books,https://sk.sagepub.com/books/narrative-and-social-control-critical-perspectives/n3.xml
"Patricia Heptig obituary: Patricia Heptig's Obituary, Council Grove",http://www.penwellgabelcouncilgrove.com/viewobitmessages/106159/Patricia-Heptig/rss.xml
