Entry Interdependent Self-Construals - SAGE Knowledge,https://sk.sagepub.com/reference/socialpsychology/n290.xml
SAGE Reference - Encyclopedia of Social Psychology,https://sk.sagepub.com/reference/socialpsychology/n289.xml
Understanding Interdependent Climate Change Risks Using a ...,https://journals.ametsoc.org/view/journals/bams/101/8/bamsD190177.xml
A Representative Democracy to Reduce Interdependency in a ...,https://journals.ametsoc.org/view/journals/clim/28/13/jcli-d-14-00362.1.xml
Oil Exporters' Economic Development in an Interdependent World,https://www.elibrary.imf.org/view/book/9781557750785/9781557750785.xml
VI The Imperatives of Energy Interdependence in - IMF eLibrary,https://www.elibrary.imf.org/abstract/book/9781557750785/ch06.xml
"Language, Culture and Mind: Independence or Interdependence? in",https://brill.com/view/book/9789004349094/B9789004349094_002.xml
"Interdependence, Mutuality, and Collective Action in Sport in",https://journals.humankinetics.com/view/journals/jsm/28/1/article-p1.xml
I is for interdependence in: The ABC of the projectariat,https://www.manchesterhive.com/view/9781526161345/9781526161345.00049.xml
