Entry Altruistic Fear - SAGE Reference - Encyclopedia of ...,https://sk.sagepub.com/reference/criminologicaltheory/n10.xml
SAGE Reference - Encyclopedia of Social Psychology,https://sk.sagepub.com/reference/socialpsychology/n16.xml
The Social Media Response From Athletes and Sport Organizations ...,https://journals.humankinetics.com/view/journals/ijsc/13/3/article-p474.xml
"Altruism, costly signaling, and withholding information in a sport ...",https://akjournals.com/view/journals/2050/17/1/article-p10.xml
Copyright in: Altruism or the Other as the Essence of Existence - Brill,https://brill.com/view/book/9789004448391/front-5.xml%3Flanguage%3Den
Confucian Ethics: Altruistic? Egoistic? Both? Neither? in - Brill,https://brill.com/view/journals/fphc/13/2/article-p217_8.xml%3Flanguage%3Den
Empathy and Altruism - Psychology - Oxford Bibliographies,https://www.oxfordbibliographies.com/view/document/obo-9780199828340/obo-9780199828340-0260.xml
Transmission-Blocking Preventive Measures for Infectious Diseases,https://www.ajtmh.org/view/journals/tpmd/104/5/article-p1609.xml
Pure Altruistic Gift and the Ethics of Transplant Medicine,https://journals.scholarsportal.info/details/11767529/v17i0001/95_pagateotm.xml
