1138551.txt - Veterans Affairs,http://www.va.gov/vetapp11/files4/1138551.txt
1110543.txt - Veterans Affairs,http://www.va.gov/vetapp11/files2/1110543.txt
Complex signatures of selection for the melanogenic loci TYR ...,https://europepmc.org/articles/pmc2292700/bin/1471-2148-8-74-s3.txt
Integumentary system (Integumentum commune) = Skin and ...,https://is.muni.cz/el/med/podzim2019/aZLHE0322p/um/Lecture_Skin_Appendages_ENG.txt%3Flang%3Den
1471-2121-6-18.pdf.txt - Digital CSIC,https://digital.csic.es/bitstream/10261/1445/4/1471-2121-6-18.pdf.txt
Oral melanoma: An unusual presentation - eScholarship.org,https://dermatology.cdlib.org/141/case_presentations/oralmm/atunes.txt
Segmental neurofibromatosis in association with a large congenital ...,https://dermatology.cdlib.org/127/case_presentations/neurofibroma/doherty.txt
ID MEL-CLS-1 AC CVCL_5619 SY FO-1; FO #1; FO 1 DR BTO; BTO ...,https://web.expasy.org/cellosaurus/CVCL_5619.txt
<http://dx.doi.org/10.14288/1.0167641> <http://vivoweb.org/ontology ...,https://open.library.ubc.ca/media/download/rdf-ntriples/24/1.0167641/0.txt
