Chapter 9 Centring Women or Rehabilitating Masculinity? Gender ...,https://brill.com/view/book/9789004459397/BP000021.xml%3Flanguage%3Den
Some Thoughts on Centring Pan-African Epistemic in the Teaching ...,https://brill.com/abstract/journals/iclr/21/2/article-p170_4.xml%3Frskey%3DAw91HK%26result%3D1
Chapter 5: Borders as resources: towards a centring of the concept,https://www.elgaronline.com/view/edcoll/9781788972734/9781788972734.00012.xml
Chapter 5: Borders as resources: towards a centring of the concept in,https://www.elgaronline.com/abstract/edcoll/9781788972734/9781788972734.00012.xml
Navigating the digital va-vā: Centring Moana/Pacific values in online ...,https://www.journalofglobalindigeneity.com/article/19436.xml
Canal Centring Ability of ProTaper and Mtwo Rotary Systems in ...,https://www.degruyter.com/view/j/bjdm.2014.18.issue-2/bjdm-2015-0014/bjdm-2015-0014.xml
Ruskin and Dante: centrality and de-centring in: Bulletin of the John ...,https://www.manchesterhive.com/view/journals/bjrl/73/1/article-p119.xml%3Frskey%3DiVuZCQ%26result%3D8
Coordinates of body and place in: Framing cosmologies,https://www.manchesterhive.com/view/9781847799098/9781847799098.00011.xml
A theoretical and experimental study of lens centring errors and their ...,https://journals.scholarsportal.info/details/05083443/v17i0001/33_ataesotiooiq.xml
"De-centring White ruralities: Ethnic diversity, racialisation and ...",https://journals.scholarsportal.info/details/07430167/v25i0004/355_dwredraic.xml
