Are There Two Types of Escapism? Exploring a Dualistic Model of ...,https://journals.scholarsportal.info/details/26896567/v10i0003/319_atttoeidgaos.xml
Escapism in literature and life - AKJournals,https://akjournals.com/downloadpdf/journals/11059/4/3-4/article-p377.xml
SAGE Reference - The SAGE Glossary of the Social and Behavioral ...,https://sk.sagepub.com/reference/behavioralsciences/n913.xml
rss2.xml - ESCAPISM - Podomatic,https://zackmiamusic.podomatic.com/rss2.xml
The Korean Wave Hallyu in Looking at Escapism in Peruvian ... - Brill,https://brill.com/view/journals/pgdt/13/3/article-p332_3.xml%3Flanguage%3Den
Chapter 3 Colonies of Concord: Religious Escapism and ... - Brill,https://brill.com/view/book/edcoll/9789004389397/BP000012.xml
"The Art of Escapism Cooking - A Survival Story, with Intensely Good ...",https://www.exhibitionsinternational.be/documents/catalog/9780062802378.xml%3Flang%3Dfr%26
Ironic Escapism in the Symbolic Spread of Gothic Materialist ...,https://www.manchesterhive.com/view/journals/gs/10/2/article-p18.xml
ESCAPISM with Carlos de Matos - Subscribe on Android,https://www.subscribeonandroid.com/djbala.podomatic.com/rss2.xml
