WBB vs. Bay Path Highlights - Mitchell College,https://www.mitchellathletics.com/sports/wbkb/2011-12/videos/copy_of_Mitchell_WBB_vs_Baypath.flv
Pink Out Game (Video) - Bay Path,https://athletics.baypath.edu/sports/wbkb/2012-13/videos/Pink_out_game.flv
President's path will not be easy | News24,https://www.northkoreatimes.com/news/256773857/oct04v40.flv
"Field Hockey: Elms 3, Bay Path 1 - Elms",https://www.ecblazers.com/sports/fh/2011-12/videos/LyonsLeonard_Interview.flv
NECC WVBALL First Round: Regis at Bay Path - NECC Athletics,https://neccathletics.com/video/VBall_BPC_vs_Regis.flv
EU Lays Out Accession Path For Balkan Countries - Radio Free ...,https://www.dublinnews.com/news/256383024/oct04v40.flv
com.flazr.io.flv java code examples | Tabnine,https://www.tabnine.com/code/java/packages/com.flazr.io.flv
Search - Threat Encyclopedia - Trend Micro,https://www.trendmicro.com/vinfo/us/threat-encyclopedia/archive/malware/vbs_agent.flv
Boilermaker Union News and Updates | Page 152 | International ...,https://boilermakers.org/news/video.flv%3Fpage%3D151
