Contact Lenses | My Doctor Online,https://mydoctor.kaiserpermanente.org/ncal/structured-content/Health_Topic_Contact_Lenses_-_Optometry.xml%3Fco%3D/regions/ncal
Glasses | My Doctor Online - Kaiser Permanente,https://mydoctor.kaiserpermanente.org/ncal/structured-content/Health_Topic_Glasses_-_Optometry.xml%3Fco%3D/regions/ncal
Contact Lenses - Maine Optometric Association,https://ww.excelod.com/patients-and-public/caring-for-your-vision/contact-lenses.xml
Turbulence within Rain-Formed Fresh Lenses during the SPURS-2 ...,https://journals.ametsoc.org/view/journals/phoc/51/5/JPO-D-20-0303.1.xml
Large Lenses of Highly Saline Mediterranean Water in - AMS Journals,https://journals.ametsoc.org/view/journals/phoc/14/10/1520-0485_1984_014_1560_llohsm_2_0_co_2.xml
"Starting April 1, patients must acknowledge receipt of their contact ...",http://www.aoa.org/x4749.xml
Chapter 22 | Five Lenses for the Reflexive Interviewer,https://methods.sagepub.com/book/handbook-of-interview-research-2e/n23.xml
"Inside Interviewing: New Lenses, New Concerns",https://methods.sagepub.com/book/inside-interviewing/n1.xml
Optical Lenses in: T'oung Pao Volume 16 Issue 1 (1915) - Brill,https://brill.com/view/journals/tpao/16/1/article-p169_7.xml%3Flanguage%3Den
