"Full text of ""Short description of the reredos, wood carvings and ...",https://archive.org/stream/shortdescription00gill/shortdescription00gill_djvu.txt
"Full text of ""The chancel of English Churches : the altar, reredos ...",https://archive.org/stream/chancelofenglish00bonduoft/chancelofenglish00bonduoft_djvu.txt
aeolian-skinner.christ-church.st-louis.mo.us.1965.txt,http://www.osiris.nobachaloud.com/aeolian-skinner.christ-church.st-louis.mo.us.1965.txt
The Project Gutenberg EBook of Bell's Cathedrals: Chichester (1901 ...,https://www.gutenberg.org/files/13331/13331-8.txt
"186 St. Paul's Cathedral. surpassing, if it were possible, the delicate ...",https://ufdcimages.uflib.ufl.edu/UF/00/07/86/68/00001/00202.txt
Wager_washington_0250E_188... - Scholarly Publishing Services,https://digital.lib.washington.edu/researchworks/bitstream/1773/42347/2/Wager_washington_0250E_18846.pdf.txt
Delaware Co. PAGenWeb Archives Cemeteries - Church of the ...,http://files.usgwarchives.net/pa/delaware/cemeteries/churchofredeemere.txt
All Saints Day Services And Cemetery Hours,http://files.usgwarchives.net/la/orleans/newspapers/00000155.txt
John Wythe the Elder will 14 April1501 prove 3MAY1501 ...,https://www.familysearch.org/service/records/storage/das-mem/patron/v2/TH-904-69167-1095-42/dist.txt%3Fctx%3DArtCtxPublic
"Welcome to Genuki, Lincolnshire A Description of Brant Broughton ...",https://www.genuki.org.uk/sites/default/files/media/images/big/eng/LIN/BrantBroughton/brant_broughton_church.txt
The Beast with Five Fingers - Project Gutenberg Australia,https://gutenberg.net.au/ebooks06/0609231.txt
james-barchester-00 - Project Gutenberg Canada,https://gutenberg.ca/ebooks/james-barchester/james-barchester-00-t.txt
The relationship between Science and Arts has kept during the ...,https://m.riunet.upv.es/bitstream/handle/10251/3402/tesisUPV2829_EnglishAbstract.txt%3Fsequence%3D3%26isAllowed%3Dy
pyramid.rev.txt - SynTax,http://www.syntax2000.co.uk/issues/17/pyramid.rev.txt
FULLTEXT02.txt - DiVA,https://www.diva-portal.org/smash/get/diva2:1225993/FULLTEXT02.txt
Index to Subjects Acreage I 27. 77. 95. 139. 183. 291. 311 IV 10. 125 ...,http://www.luppitt.net/images/data/res/luppittnotes/indexsubjects.txt
Entry from Kelly's Trade Directory for 1900 BURTON-UPON ...,https://sites.rootsweb.com/~englin/B/burtonstather1900.txt
"BEGIN PRIVACY-ENHANCED MESSAGE----- Proc-Type: 2001,MIC ...",https://www.sec.gov/Archives/edgar/data/1005882/0001005150-96-000304.txt
scarers sheughs raggees hocused shadows redraws decreer ...,https://keyboard-design.com/typing-lessons//kurriss.en.ansi_week2_day5.txt
aalborg aaronic abalone abashed abatage abdomen abelian ...,http://4umi.com/play/words/7.txt
