The Structure of the Anterior Feeding Apparatus in Members of ... - Brill,https://brill.com/view/journals/nema/20/4/article-p419_4.xml%3Flanguage%3Den
THE STRUCTURE OF THE ANTERIOR FEEDING APPARATUS IN ...,https://brill.com/previewpdf/journals/nema/20/4/article-p419_4.xml
Psychodidae): A Natural Host-Parasite Association in - American ...,https://www.ajtmh.org/abstract/journals/tpmd/40/1/article-p19.xml
Host-Parasite Relationship of Leishmania mexicana mexicana and ...,https://www.ajtmh.org/view/journals/tpmd/36/2/article-p294.xml
Impaired development of a miltefosine-resistant Leishmania ...,https://europepmc.org/articles/pmc6804374/bin/mmc1.xml
biorxiv BIORXIV bioRxiv bioRxiv Cold Spring Harbor Laboratory ...,https://www.biorxiv.org/content/biorxiv/early/2020/08/12/2020.08.12.245936.source.xml
