"Gammarus liuruiyui sp. nov. (Amphipoda, Gammaridae), a new blind ...",https://brill.com/view/journals/cr/93/11-12/article-p1485_16.xml%3Flanguage%3Den
A Remarkably Variable Phreatic Amphipod from Mallorca ... - Brill,https://brill.com/view/journals/btd/48/1/article-p89_8.xml%3Flanguage%3Den
"<i>Sarothrogammarusyiiruae</i>, a new species of Amphipoda ...",https://europepmc.org/articles/pmc6629710/bin/zookeys.861.35538-treatment1.xml
A new species of Hyalella from the High Andes of Ecuador ...,https://europepmc.org/articles/pmc5672562/bin/zookeys.686.12223-treatment1.xml
biorxiv BIORXIV bioRxiv bioRxiv Cold Spring Harbor Laboratory ...,https://www.biorxiv.org/content/biorxiv/early/2018/08/29/403592.source.xml
1503.xml - iNaturalist,http://www.inaturalist.org/guides/1503.xml
Azman B.A.R. Othman B.H.R. Shallow water marine gammaridean ...,https://www.researchgate.net/publication/294931551_XML_Treatment_for_Cymadusa_vadosa/data/56c60d3108ae8cf828fe9ec0/zookeys3355567-treatment3.xml
"Tanaidacea), with Description of a New Species - Scholars Portal ...",https://journals.scholarsportal.info/details/17385261/v53i0004/641_romdcowdoans.xml
1. Introduction - Hindawi.com,https://downloads.hindawi.com/archive/2012/979765.xml
