HYPOXIA AND REPRODUCTIVE HEALTH: Hypoxia and labour in,https://rep.bioscientifica.com/view/journals/rep/161/1/REP-20-0327.xml
Myometrial cytokines and their role in the onset of labour in,https://joe.bioscientifica.com/view/journals/joe/231/3/R101.xml
"The Dialectics of Waged and UnwagedWork:Waged Work, Domestic ...",https://brill.com/downloadpdf/book/9789004291560/BP000013.xml
Chapter 1 Labour Activism and Organisational Bricolage among ...,https://brill.com/abstract/book/9789004464964/BP000008.xml
Interpreting the Labour Party - Manchester Open Hive,https://www.manchesteropenhive.com/view/9781526137456/9781526137456.xml
Making work more equal – A new labour market segmentation ...,https://www.manchesteropenhive.com/view/9781526125972/9781526125972.xml
Work and Labour Relations in Global Platform Capitalism - Elgaronline,https://www.elgaronline.com/view/edcoll/9781802205121/9781802205121.xml
Handbook on Globalisation and Labour Standards | Elgar Online,https://www.elgaronline.com/view/edcoll/9781788977364/9781788977364.xml
Revisiting Divisions of Labour - manchester hive,https://www.manchesterhive.com/view/9781526116239/9781526116239.xml
