A Remark on Nonatomic Measures - Project Euclid,https://projecteuclid.org/journals/annals-of-mathematical-statistics/volume-43/issue-1/A-Remark-on-Nonatomic-Measures/10.1214/aoms/1177692735.xml
Invariance of nonatomic measures on effect algebras in - De Gruyter,https://www.degruyter.com/view/journals/ms/68/2/article-p311.xml%3Flanguage%3Den
Sequences of Generous and Nonatomic Quasi-Measures on ...,https://akjournals.com/downloadpdf/journals/10473/92/4/article-p299.xml
mPOS-SDK-iOS/Tokens1.xml at master - GitHub,https://github.com/xmartlabs/mPOS-SDK-iOS/blob/master/Documentation/com.payleven.Payleven-mPOS-SDK.docset/Contents/Resources/Tokens1.xml
tealium-tvos/Tokens1.xml at master · Tealium/tealium-tvos · GitHub,https://github.com/Tealium/tealium-tvos/blob/master/Documentation/docset/Contents/Resources/Tokens1.xml
On pure stationary almost Markov Nash equilibria in nonzero-sum ...,https://journals.scholarsportal.info/details/14322994/v81i0002/169_opsamneinasg.xml
Eberle on Nominalism in Non-Atomic Systems | Scholars Portal ...,https://journals.scholarsportal.info/details/00294624/v03i0004/427_eonins.xml
Cores of Non-Atomic Market Games - SocioRePEc,https://sociorepec.org/publication.xml%3Fh%3Drepec:cca:wpaper:13%26l%3Den
project.xml - Universität Augsburg (Informatik),http://www.informatik.uni-augsburg.de/swt/projects/tl/Treiber-Stack-hazard-ext/project.xml
