A new trehala-constructing Larinus Dejean (Coleoptera,https://www.tandfonline.com/doi/pdf/10.1080/09397140.2015.1069240
New Data on Conorhynchus hololeucus (Coleoptera: Curculionidae),https://bioone.org/journals/florida-entomologist/volume-95/issue-2/024.095.0241/New-Data-on-Conorhynchus-hololeucus-Coleoptera-Curculionidae/10.1653/024.095.0241.pdf
Manna and Its Sources - jstor,https://www.jstor.org/stable/4109433
Food and Drugs - RSC Publishing,https://pubs.rsc.org/en/content/articlepdf/1943/an/an943680373b
[PDF] Determination of the Phenolic Content in Iranian Trehala Manna and ...,https://downloads.hindawi.com/journals/ecam/2021/8570162.pdf
The Earliest Mention of a Manniparous Insect,https://www.journals.uchicago.edu/doi/pdfplus/10.1086/347964
Percentage of total protein - Nature,https://www.nature.com/articles/152414a0.pdf%3Forigin%3Dppub
[PDF] the Yin and Yang of trehalose - Lindquist Lab,http://lindquistlab.wi.mit.edu/PDFs/Singer1998TrendsBiotech.pdf
TREHALOSES BY GORDON G. BIRCH* I. INTRODUCTION,https://www.sciencedirect.com/science/article/pii/S009653320860243X/pdf%3Fmd5%3D180db0a270896b88f8c7cbc3e948bed6%26pid%3D1-s2.0-S009653320860243X-main.pdf
