Potential negative effects of anti-histamines on male reproductive ...,https://rep.bioscientifica.com/view/journals/rep/155/5/REP-17-0685.xml
Histamine inhibits adrenocortical cell proliferation but does not affect ...,https://joe.bioscientifica.com/view/journals/joe/221/1/15.xml
Effects of morphine on histamine release from two cell lines of ...,https://avmajournals.avma.org/view/journals/ajvr/82/12/ajvr.20.08.0137.xml
Effect of histamine on lung contractile elements in growing cattle,https://avmajournals.avma.org/downloadpdf/journals/ajvr/64/7/ajvr.64.7.819.xml
AZD5213: a novel histamine H3 receptor antagonist permitting high ...,https://ijnp.oxfordjournals.org/content/16/6/1231.ref-links.xml
Tussock Moth Dermatitis: Evidence for Histamine Involvement in,https://www.degruyter.com/view/journals/reveh/9/1/article-p11.xml%3Flanguage%3Den
Altered response to histamine in brain tumor vessels,https://thejns.org/view/journals/j-neurosurg/79/5/article-p722.xml
Modulation of ConA-induced inflammatory ascites by histamine,https://akjournals.com/view/journals/030/62/1/article-p87.xml
[PDF] Sleep and Microdialysis: An Experiment and a Systematic Review of ...,https://journals.scholarsportal.info/pdf/17403391/v17inone/nfp_samaeaohasaa.xml
