Union Coercion Prevention Act - Govinfo.gov,https://www.govinfo.gov/bulkdata/BILLSUM/113/hr/BILLSUM-113hr1815.xml
Employee Rights Act - Govinfo.gov,https://www.govinfo.gov/bulkdata/BILLSUM/113/s/BILLSUM-113s1712.xml
Microstructure and mechanical properties of a new cast nickel ...,https://journals.scholarsportal.info/details/00222461/v54i0004/3558_mampoabgtawp.xml
On Walter Benjamin's Concept of New Barbarism - Brill,https://brill.com/downloadpdf/book/edcoll/9789004309272/B9789004309272-s015.xml
Chapter One The Moment of Reading 'Capital' - Brill,https://brill.com/downloadpdf/book/9789047443025/Bej.9789004167711.i-478_002.xml
biorxiv BIORXIV bioRxiv bioRxiv Cold Spring Harbor Laboratory ...,https://www.biorxiv.org/content/biorxiv/early/2022/01/28/2022.01.28.478258.source.xml
l e m e . l i b r a r y . u t o r o n t o . c a s t c 2 5 9 6 2 v e r . 1 . 0 ( 2 0 1 ...,https://tspace.library.utoronto.ca/bitstream/1807/102274/1/392_Woodall_The%2520Surgeon%2527s%2520Mate_1617_final.xml
Maria-Esther Vidal TIB Leibniz Information Centre for Science and ...,https://dblp.org/pid/92/654.xml
rows.xml - Open Data NY,https://data.ny.gov/api/views/x8bw-q2g6/rows.xml%3FaccessType%3DDOWNLOAD
also a short description of the spaws at Malton and Knarsbrough ...,https://ota.bodleian.ox.ac.uk/repository/xmlui/bitstream/handle/20.500.12024/A60267/A60267.xml%3Fsequence%3D6%26isAllowed%3Dy
