Heterocyst differentiation and pattern formation in cyanobacteria,https://onlinelibrary.wiley.com/doi/pdf/10.1111/j.1365-2958.2005.04979.x
THE INFLUENCE OF NITROGEN ON HETEROCYST ... - ASLO,https://aslopubs.onlinelibrary.wiley.com/doi/pdf/10.4319/lo.1969.14.3.0342
Cyanobacterial Heterocysts - Cold Spring Harb Perspect Biol,https://cshperspectives.cshlp.org/content/2/4/a000315.full.pdf
Heterocyst differentiation: from single mutants to global approaches,https://www.cell.com/trends/microbiology/pdf/S0966-842X(12)00121-7.pdf
The Permeability of Heterocysts to the Gases Nitrogen and Oxygen,https://www.jstor.org/stable/36152
Heterocyst Differentiation and Polarity in Calothrix - jstor,https://www.jstor.org/stable/2433858
Genetic and cytological evidence that heterocyst patterning ... - PNAS,https://www.pnas.org/doi/pdf/10.1073/pnas.0909152106
A second nitrogenase in vegetative cells of a heterocyst - PNAS,https://www.pnas.org/content/92/20/9358.full.pdf
"Heterocyst envelope thickness, heterocyst frequency and ...",https://www.microbiologyresearch.org/content/journal/micro/10.1099/00221287-138-12-2673%3Fcrawler%3Dtrue%26mimetype%3Dapplication/pdf
Heterocyst Differentiation in the Cyanobacterium Mastigocladus,https://journals.asm.org/doi/pdf/10.1128/jb.157.2.514-525.1984
