Lumbar Spinal Stenosis | My Doctor Online,https://mydoctor.kaiserpermanente.org/ncal/structured-content/Condition_Lumbar_Spinal_Stenosis_-_PMR.xml%3Fco%3D/regions/ncal
Cervical Spinal Stenosis | My Doctor Online,https://mydoctor.kaiserpermanente.org/ncal/structured-content/Condition_Cervical_Spinal_Stenosis_-_Spine_Surgery.xml%3Fco%3D/regions/ncal
Management of degenerative lumbar spinal stenosis: an evidence ...,https://eor.bioscientifica.com/view/journals/eor/1/7/2058-5241.1.000030.xml
Lumbar canal stenosis: analyzing the role of stabilization and the ...,https://thejns.org/focus/view/journals/neurosurg-focus/46/5/article-pE7.xml
Redefining lumbar spinal stenosis as a developmental syndrome ...,https://thejns.org/spine/view/journals/j-neurosurg-spine/29/6/article-p654.xml
Early rectal stenosis following stapled rectal mucosectomy for ...,https://journals.scholarsportal.info/pdf/14712482/v4inone/6_ersfsrmfh.xml
Caudal vs Transforaminal Epidural Steroid Injections as Short-Term ...,https://painmedicine.oxfordjournals.org/content/15/3/379.ref-stubs.xml
Interventional treatment of benign nasopharyngeal stenosis and ...,https://avmajournals.avma.org/view/journals/javma/253/10/javma.253.10.1300.xml
[PDF] The Professor Position and the Single-Stance Flexion Test May ...,https://japmaonline.org/downloadpdf/journals/apms/103/2/1030156.xml
Cervical Spinal Stenosis: Understanding the Debate,https://journals.humankinetics.com/previewpdf/journals/ijatt/1/2/article-p53.xml%3FpdfJsInlineViewToken%3D53673940%26inlineView%3Dtrue
