Anti-aliasing and dithering in the 'Freiburg Visual Acuity Test ... - Brill,https://brill.com/previewpdf/journals/sv/11/1/article-p85_8.xml
Quantization and dithering techniques applied to digital microscopy,https://journals.scholarsportal.info/details/09684328/v25i0004/309_qadtatdm.xml
Dynamic dithering algorithm and frame rate control technique for ...,https://journals.scholarsportal.info/details/1523553x/v2inone/740_ddaafrtflcdc.xml
Iterative Method and Dithering with Averaging used for Correction of ...,https://www.degruyter.com/view/j/msr.2009.9.issue-4/v10048-009-0019-1/v10048-009-0019-1.xml
on the European single market and its regulatory model - Elgaronline,https://www.elgaronline.com/view/edcoll/9781788977968/9781788977968.00015.xml
Chapter 7: UK dithering over Brexit: on the European single market ...,https://www.elgaronline.com/abstract/edcoll/9781788977968/9781788977968.00015.xml
glSampleCoverage,https://www.khronos.org/registry/OpenGL-Refpages/es1.1/xhtml/glSampleCoverage.xml
HVACmanagement/thresholds.xml at master · ManiAm ... - GitHub,https://github.com/ManiAm/HVACmanagement/blob/master/ImageMagick-6.8.2-10/thresholds.xml
MathML version of the relative luminance definition,https://www.w3.org/TR/WCAG21/relative-luminance.xml
