Heparin in the treatment of aneurysmal subarachnoid hemorrhage,https://thejns.org/focus/view/journals/neurosurg-focus/52/3/article-pE9.xml
Continuous infusion of low-dose unfractionated heparin after ...,https://thejns.org/view/journals/j-neurosurg/130/5/article-p1460.xml
Anti-Xa (Unfractionated Heparin and Low Molecular Weight Heparin),https://umc.edu/som/Departments%2520and%2520Offices/SOM%2520Departments/Pathology/UMMC%2520Lab%2520Services/Lab%2520Test%2520List/Laboratory/Tests/Anti-Xa--Unfractionated-Heparin-and-Low-Molecular-Weight-Heparin-.xml
Heparin Anti-Xa - University of Mississippi Medical Center,https://www.umc.edu/som/Departments%2520and%2520Offices/SOM%2520Departments/Pathology/UMMC%2520LAb%2520Services/Lab%2520Test%2520List/Laboratory/Tests/Heparin%2520Anti-Xa.xml
Heparin Sodium in: ASHP® Injectable Drug Information™,https://publications.ashp.org/view/book/9781585286850/ch190.xml
[PDF] Heparin Sodium - Ashp Publications,https://publications.ashp.org/previewpdf/book/9781585286850/ch190.xml%3FpdfJsInlineViewToken%3D969232416%26inlineView%3Dtrue
Heparin-Induced Thrombocytopenia in Cancer in - JNCCN,https://jnccn.org/view/journals/jnccn/9/7/article-p781.xml
Anticoagulant effects of repeated subcutaneous injections of high ...,https://avmajournals.avma.org/view/journals/ajvr/62/12/ajvr.2001.62.1887.xml
Negative Heparin-Induced Thrombocytopenia Test Result After ...,https://ajcp.oxfordjournals.org/content/145/5/717.source.xml
