The Wild Flower Bee Farm - PodServe.fm,https://www.podserve.fm/series/rss/823/the-wild-flower-bee-farm.rss
Hive Mind the podcast for Beekeepers by a Beekeeper - Buzzsprout,https://feeds.buzzsprout.com/180391.rss
In The Hive | With Michele Bee - Buzzsprout,https://feeds.buzzsprout.com/194585.rss
Deciding on what type of hive to get | Beekeeping & Apiculture Forum,https://beekeepingforum.co.uk/blogs/authors/13308/index.rss
万博下载手机客户端-万博平台登录,https://www.finques-tarragones.com/forums/feed/2655/topic.rss
Halle Berry OK after suffering minor head injury | The Blade,https://www.toledoblade.com/Culture/2012/07/18/Halle-Berry-OK-after-suffering-minor-head-injury/stories/feed/feed/index.rss
35 Years of the Digital Camera | Computerworld,https://www.techhive.com/article/213254/35_years_of_the_digital_camera.rss
Broadband Caps Coming to AT&T - PCWorld,https://www.techhive.com/article/153312/broadband_caps_coming_to_atandt.rss
Queen Bees with Jane Horrocks and Esther Coles - Acast,https://pod.link/1524483546.rss
will they re-locate? | Beekeeping & Apiculture Forum,https://beekeepingforum.co.uk/blogs/authors/12609/index.rss
rogercj.spaces.live.com/feed.rss,http://rogercj.spaces.live.com/feed.rss
