State Employment Benefits - IDHS,https://www.dhs.state.il.us/page.aspx/FACT_Intro.flv%3Fitem%3D135214
Analysts: Looming Idlib Conflict Threatens Turkey's Syria Strategy,https://www.beijingbulletin.com/news/257977642/oct04v56.flv
Syrian Government Vows to 'Liberate' Idlib from 'Terrorists',https://www.northkoreatimes.com/news/258001135/oct04v56.flv
Search Resumes for Missing From Sunken Thai Boat,https://www.pekingpress.com/news/257628389/oct04v56.flv
EU Gears Up for Trade War as Populist Challenge Grows,https://www.madagascarsun.com/news/257470968/oct04v56.flv
U.S. Slams European Plan To Help Iran Sidestep U.S. Sanctions,https://www.malaysiasun.com/news/258044043/oct04v56.flv
"Russia-Friendly Party, Populists Top Latvian Elections",https://www.malaysiasun.com/news/258094343/oct04v56.flv
Egypt Sentences 75 to Death Over 2013 Sit-In Violence,https://www.sierraleonetimes.com/news/257959185/oct04v40.flv
Turkey's Currency Dips Again,https://www.ohiostandard.com/news/257831990/oct04v56.flv
Flurry of Syrian Death Notices Shows Fate of Government Detainees,https://www.mediterraneantimes.com/news/257765309/oct04v56.flv
