Insect Bites and Stings | My Doctor Online,https://mydoctor.kaiserpermanente.org/mas/structured-content/Health_Topic_Insect_Bites_and_Stings_-_Pediatrics.xml%3Fco%3D/regions/mas
Factors Affecting Human-Directed Aggression Resulting in Dog Bites,https://brill.com/view/journals/soan/aop/article-10.1163-15685306-bja10066/article-10.1163-15685306-bja10066.xml
"Prevention of Bug Bites, Stings, and Disease - BioOne",https://journals.scholarsportal.info/pdf/00154040/v92i0004/677_pobbsad.xml
Animal bites in - AVMA Journals,https://avmajournals.avma.org/view/journals/javma/234/3/javma.234.3.336.xml
Snake-Bite Accidents in Louisana: With Data on 306 Cases in,https://www.ajtmh.org/view/journals/tpmd/s1-30/4/article-p575.xml
Endocrine and Metabolic Manifestations of Snakebite Envenoming in,https://www.ajtmh.org/view/journals/tpmd/103/4/article-p1388.xml
Sodexo at Champlain College,https://www.champlain.edu/x2130.xml
A Case of Biting Humans by Nabis americoferus (Heteroptera ...,https://jme.oxfordjournals.org/content/53/1/230.source.xml
rss.xml - philosophy bites,https://philosophybites.com/rss.xml
