Pavement work to cause lane closures | The Blade,https://www.toledoblade.com/local/2018/05/31/Pavement-work-to-cause-lane-closures/stories/feed/feed/index.rss
Pavement work to cause lane closings in South Toledo | The Blade,https://www.toledoblade.com/local/2018/07/29/Pavement-work-to-cause-lane-closings-in-South-Toledo/stories/feed/index.rss
Ear to the Pavement,http://eartothepavement.com/podcast.rss
Apple | Accounting Today,https://www.taxprotoday.com/organization/apple.rss
The Matador Revisionist History Podcast - Audioboom,https://audioboom.com/channels/5075989.rss
CON/AGG Radio: Construction Business Insights For Contractors,https://pod.link/1124300839.rss
Airport comments for the Bahamas - OurAirports,https://ourairports.com/countries/BS/comments.rss
Comments for Costa Rica @ OurAirports,https://ourairports.com/countries/CR/comments.rss
Indie 102.3 Sessions - Colorado Public Radio,https://www.cpr.org/rss/indie-102-3-sessions.podcast.rss
