THE ASSOCIATION BETWEEN CELLULOSE CRYSTALLITE WIDTH ...,https://brill.com/downloadpdf/journals/iawa/22/3/article-p235_3.xml
THE ASSOCIATION BETWEEN CELLULOSE CRYSTALLITE WIDTH ...,https://brill.com/view/journals/iawa/22/3/article-p235_3.xml%3Flanguage%3Den
Characterization of PbTiO3 crystallites in-situ confined grown in ...,https://journals.scholarsportal.info/details/07315171/v19i3-4/113_copcicgias.xml
Crystallinity of wood and the size of cellulose crystallites in Norway ...,https://journals.scholarsportal.info/details/14350211/v49i0006/531_cowatsccinsa.xml
MSA Materials Sciences and Applications 2153-117X Scientific ...,https://www.scirp.org/xml/56800.xml
101535104 38224 Adv Powder Technol Adv Powder Technol ...,https://stacks.cdc.gov/view/cdc/50431/cdc_50431_DS3.xml
Oxidation kinetics of nickel nano crystallites obtained by controlled ...,https://akjournals.com/view/journals/10973/100/2/article-p733.xml
Debye function analysis of nanocrystalline gallium oxide γ-Ga2O3,https://nsu.ru/rs/mw/link/Https://www.degruyter.com/view/j/zkri.2016.231.issue-5/zkri-2015-1895/zkri-2015-1895.xml%3Fformat%253DINT
Related Articles - Europe PMC,https://europepmc.org/articles/pmc7494674/bin/mmc2.xml
CALORIMETRIC STUDY OF THE NATIVE AND POSTDENATURED ...,https://akjournals.com/downloadpdf/journals/10973/92/3/article-p677.xml
