Management of carcinoid syndrome: a systematic review and meta ...,https://erc.bioscientifica.com/view/journals/erc/26/3/ERC-18-0495.xml
Genetics of neuroendocrine and carcinoid tumours,https://erc.bioscientifica.com/downloadpdf/journals/erc/10/4/14713256.xml
Brain carcinoid metastases: outcomes and prognostic factors in,https://thejns.org/view/journals/j-neurosurg/118/4/article-p889.xml
Lumbar intradural metastasis of a primary carcinoid tumor of the ...,https://thejns.org/spine/view/journals/j-neurosurg-spine/2/2/article-p231.xml
Systemic Therapy for Advanced Carcinoid Tumors - JNCCN,https://jnccn.org/view/journals/jnccn/10/6/article-p785.xml
[PDF] Spotlight on telotristat ethyl for the treatment of carcinoid syndrome ...,https://journals.scholarsportal.info/pdf/11791322/v11inone/7537_soteftdpsaro.xml
international-journal-of-pathology-and-clinical-research-ijpcr-4-077 ...,https://clinmedjournals.org/articles/ijpcr/international-journal-of-pathology-and-clinical-research-ijpcr-4-077.xml
A case of hepatic carcinoid in a red deer hind (Cervus elaphus) in,https://akjournals.com/view/journals/004/59/3/article-p319.xml
Abstract - medRxiv,https://www.medrxiv.org/content/medrxiv/early/2021/05/23/2021.05.20.21257521.source.xml
