Laypeople's Beliefs Affect their Reports about the Subjective ... - Brill,https://brill.com/view/journals/time/7/1/article-p15_15.xml%3Flanguage%3Den
Layperson Versus Professional: Is the Neighbor More Helpful to ...,https://journals.scholarsportal.info/details/15540138/v56i0052/6_lvpitnhtvttd.xml
Layperson's Preference Regarding Orientation of Transverse ...,https://journals.scholarsportal.info/details/21688184/v12i0001/nfp_lprootacdacs.xml
Professionals' and laypersons' appreciation of various options for ...,https://ejo.oxfordjournals.org/content/32/4/395.source.xml
How Do Laypeople Evaluate the Degree of Certainty in a Weather ...,https://journals.ametsoc.org/view/journals/wcas/6/3/wcas-d-12-00054_1.xml
Significance Statements Communicate Our Science More Widely in,https://journals.ametsoc.org/view/journals/clim/33/24/jcliD200801.xml
Objective - BMJ Open,https://bmjopen.bmj.com/content/6/5/e010770.download.xml
Untitled,https://le.utah.gov/xcode/Title62A/Chapter15/C62A-15-S102_2022050420220701.xml
"Cleary (Mich.) at Siena Heights - March 29, 2022 - Box Score",https://clearycougars.com/sports/bsb/2021-22/boxscores/20220329_leca.xml
