Entry Containment Theory - SAGE Knowledge,https://sk.sagepub.com/reference/encyclopedia-of-social-deviance/n56.xml
High containment API and drug processing facility - PM Group,https://www.magnetgroup.be/our-work/takeda-api/index.xml
The Design and Operation of Containments for Tritium Experiments ...,https://journals.scholarsportal.info/details/07481896/v21i2p2/352_tdaoocagdsie.xml
The Role of Case Containment Centers in the Eradication of ...,https://www.ajtmh.org/view/journals/tpmd/79/5/article-p722.xml
Safety-Related Steel Structures and Steel-Plate ... - Govinfo.gov,https://www.govinfo.gov/metadata/granule/FR-2021-09-13/2021-19621/mods.xml
Safety-Related Steel Structures and Steel-Plate ... - Govinfo.gov,https://www.govinfo.gov/metadata/granule/FR-2021-02-10/2021-02720/mods.xml
Untitled,https://www.ecfr.gov/api/versioner/v1/full/2022-04-05/title-10.xml%3Fpart%3D50%26section%3D50.44
OIL OR HAZARDOUS MATERIAL POLLUTION PREVENTION ...,https://www.gpo.gov/fdsys/pkg/CFR-2017-title33-vol2/xml/CFR-2017-title33-vol2-part155.xml
Assessing and Managing Severe Accidents in Nuclear ... - gnssn,https://gnssn.iaea.org/NSNI/EaT/TM/lectures/MtU/d4p2-tuomisto-assessing/data/srchdata.xml
mycroft-gui-mark-2/main.xml at master · MycroftAI/mycroft ... - GitHub,https://github.com/MycroftAI/mycroft-gui-mark-2/blob/master/containments/mark2/package/contents/config/main.xml
Back Matter in: IMF Working Papers Volume 2020 Issue 214 (2020),https://www.elibrary.imf.org/view/journals/001/2020/214/article-A999-en.xml
Liner-concrete heat transfer study for nuclear power plant ...,https://digital.library.unt.edu/ark:/67531/metadc1070740/metadata.untl.xml
Reliability assessment of nuclear structural systems - UNT Digital ...,https://digital.library.unt.edu/ark:/67531/metadc1114188/metadata.untl.xml
Untitled,https://www.federalregister.gov/documents/full_text/xml/2021/09/07/2021-19178.xml
1. Introduction - Hindawi.com,http://downloads.hindawi.com/journals/stni/2014/841895.xml
1. Introduction - Hindawi.com,https://downloads.hindawi.com/journals/stni/2019/9417954.xml
Occupational Health and Safety Regulation - BC Laws,https://www.bclaws.gov.bc.ca/civix/document/LOC/loo72/loo72/--%2520W%2520--/Workers%2520Compensation%2520Act%2520%5BRSBC%25201996%5D%2520c.%2520492/14_296_97%2520-%2520Occupational%2520Health%2520and%2520Safety%2520Regulation/296_97_04.xml
ICRA Best Practices in Healthcare Construction,http://www.centralsouthcarpenters.org/BrochICRA.xml
240045.xml - Biblioteka Nauki,https://bibliotekanauki.pl/articles/240045.xml
CFD modeling of passive autocatalytic recombiners - Sciendo,https://sciendo.com/view/journals/nuka/60/2/article-p347.xml%3Flanguage%3Den
