齐物论 Qiwulun—The Equality of Things: Making the Spirit ... - Brill,https://brill.com/downloadpdf/book/9789004310230/BP000003.xml
Contexts of Midwifery Practice - SAGE Books,https://sk.sagepub.com/books/contexts-of-midwifery-practice/i97.xml
"or, A letter written, to all the saints of God in Scotland fellow-heirs of ...",https://ota.bodleian.ox.ac.uk/repository/xmlui/bitstream/handle/20.500.12024/A66947/A66947.xml%3Fsequence%3D6%26isAllowed%3Dy
"Articles to be enquired in the visitation, in the firste yere of the raigne ...",https://ota.bodleian.ox.ac.uk/repository/xmlui/bitstream/handle/20.500.12024/A00125/A00125.xml%3Fsequence%3D6%26isAllowed%3Dy
A00267/A00267.xml at master · textcreationpartnership/A00267 ...,https://github.com/textcreationpartnership/A00267/blob/master/A00267.xml
sitemap-paper-0004425.xml - Semantic Scholar,https://www.semanticscholar.org/sitemap-paper-0004425.xml
