A relaxing and rewarding endeavor for Westmoreland couple | The ...,https://www.toledoblade.com/a-e/Gardening/2013/06/12/A-relaxing-and-rewarding-endeavor-for-Westmoreland-couple/stories/feed/index.rss
Talent rewarded - Toledo Blade,https://www.toledoblade.com/Education/2003/03/22/Talent-rewarded/stories/feed/feed/index.rss
Canyon Ridge Baptist Church - Sermon Audio,http://www.sermonaudio.com/rss_source.rss%3Fsourceid%3Dcanyonridge
Financial wellness | American Banker,https://www.cujournal.com/tag/financial-wellness.rss
Which of these courses have a greater scope CA-CFA? - Career Guide,http://www.counselling.meracareerguide.com/t/which-of-these-courses-have-a-greater-scope-ca-cfa/2242.rss
I want to become a professor of Biology. What is the eligibility criteria ...,http://www.counselling.meracareerguide.com/t/i-want-to-become-a-professor-of-biology-what-is-the-eligibility-criteria-for-that/5404.rss
The Synopsis - Audioboom,https://audioboom.com/channels/5053343.rss
Careers in Canberra Cyber - Omny.fm,https://omny.fm/shows/careers-in-cyber/playlists/podcast.rss
Jobs Outside the Box - Buzzsprout,https://feeds.buzzsprout.com/1761594.rss
