Wild Frenchmen and Frenchified Indians: Material Culture and Race ...,https://www.jstor.org/stable/10.5309/willmaryquar.71.1.0153
"White, Sophie. Wild Frenchmen and Frenchified Indians, Material ...",https://www.jstor.org/stable/43489224
"Sophie White, Wild Frenchmen and Frenchified Indians",https://www.journals.uchicago.edu/doi/pdf/10.1086/683051
Wild Frenchmen and FrenchiFied indians - De Gruyter,https://www.degruyter.com/document/doi/10.9783/9780812207170.fm/pdf
"ALH Online Review, Series VI 1 Sophie White, Wild Frenchmen and ...",https://academic.oup.com/DocumentLibrary/ALH/Online%2520Review%2520Series%25206/Gordon%2520Sayre%2520Online%2520Review%2520VI.pdf
[PDF] to frenchify - Bab.la,https://pt.bab.la/verbo/ingles/frenchify/pdf
to frenchify,https://www.babla.cn/%25E5%258F%2598%25E4%25BD%258D/%25E8%258B%25B1%25E8%25AF%25AD/frenchify/pdf
Women and Political Culture in Early National Philadelphia,https://www.tandfonline.com/doi/pdf/10.1080/03612759.2002.10526007
"sophie white, wild frenchmen and frenchified indians. - Cairn",https://www.cairn.info/load_pdf.php%3FID_ARTICLE%3DRHMC_603_0197%26download%3D1
Tom Stoppard's Arcadia,https://www.ams.org/notices/199511/arcadia.pdf
