Effects of cytidine 5'-diphosphocholine administration on basal,https://eje.bioscientifica.com/downloadpdf/journals/eje/124/5/acta_124_5_011.xml
Epstein-Barr Virus Induced Cytidine Metabolism Roles in ...,https://journals.scholarsportal.info/pdf/21507511/v12i0004/nfp_evicmritbgas.xml
A role for Tau protein in maintaining ribosomal DNA stability and ...,https://journals.scholarsportal.info/details/20411723/v8inone/nfp_arftpisacdcs.xml
Thermophysical properties of cytidine and deoxycytidine mono,https://akjournals.com/view/journals/10973/45/4/article-p767.xml
Neuroprotective effects of citicoline on brain edema and blood ...,https://thejns.org/view/journals/j-neurosurg/92/3/article-p448.xml
Untitled,https://www.biorxiv.org/content/biorxiv/early/2021/11/13/2021.11.12.468326.source.xml
Untitled,https://www.biorxiv.org/content/biorxiv/early/2022/03/22/2022.03.22.485351.source.xml
"Synthesis, Solution Conformation, and Some Biological Properties in",https://www.degruyter.com/view/journals/znc/42/5/article-p589.xml%3Flanguage%3Den
XML - PLOS,https://www.tools.wmflabs.org/opendatasets/plos/extracted/pbio.0020226.xml
is deamination key to active DNA demethylation? in - Reproduction,https://rep.bioscientifica.com/view/journals/rep/142/5/621.xml
