"The Evolution, Ontogeny and Quantitative Control of the Settling ...",https://brill.com/view/journals/beh/16/3-4/article-p188_2.xml%3Flanguage%3Den
Quantifying Wing Shape and Size of Saturniid Moths with Geometric ...,https://journals.scholarsportal.info/details/00240966/v70i0002/99_qwsasosmwgm.xml
Saturniidae) Defoliation on Growth of Ponderosa Pine in Arizona ...,https://jee.oxfordjournals.org/content/82/6/1682.source.xml
A new species of Cotesia Cameron (Hymenoptera ... - Europe PMC,https://europepmc.org/articles/pmc5904485/bin/zookeys.740.242226-treatment1.xml
"Description of three new species of <i>Automeris</i> Hübner, 1819 ...",https://europepmc.org/articles/pmc8062386/bin/zookeys.1031.56035-treatment1.xml
biorxiv BIORXIV bioRxiv bioRxiv Cold Spring Harbor Laboratory ...,https://www.biorxiv.org/content/biorxiv/early/2022/04/04/2022.03.29.486224.source.xml
Literature Cited - De Gruyter,https://www.degruyter.com/cornellup/view/book/9781501738005/10.1515/9781501738005-016.xml
[The American Journal of Tropical Medicine and Hygiene] THE ...,https://www.ajtmh.org/pdfviewer/full/journals/tpmd/72/3/article-p347.xml%3Fbg%3DGREY_COLOR_LIGHT_VARIANT%26mgs%3DPRIMARY_COLOR%26mge%3DPRIMART_COLOR_DARK_VARIANT
cDNA structure of an insulin-related peptide in the Pacific oyster and ...,https://joe.bioscientifica.com/view/journals/joe/187/1/1870055.xml
Saturniidae): Evidence from two nuclear genes in: Insect ... - Brill,https://brill.com/view/journals/ise/33/1/article-p9_2.xml%3Flanguage%3Den
