Management of postoperative internal carotid artery intimal flap after ...,https://thejns.org/view/journals/j-neurosurg/136/3/article-p647.xml
Angiographic findings of in-stent intimal hyperplasia after stent ...,https://thejns.org/view/journals/j-neurosurg/124/2/article-p328.xml
Local application of advanced glycation end products and intimal ...,https://cardiovascres.oxfordjournals.org/content/47/1/173.ref-links.xml
Lower plasma adiponectin is a marker of increased intima-media ...,https://eje.bioscientifica.com/view/journals/eje/156/3/1560387.xml
"Increased intima-media thickness of the carotid artery wall, normal ...",https://eje.bioscientifica.com/view/journals/eje/147/4/453.xml
[PDF] Natural History of Atherosclerosis and Abdominal Aortic Intima ...,https://journals.scholarsportal.info/pdf/20770383/v08i0008/nfp_nhoaaadoaity.xml
The Role of Carotid Intimal Thickness Testing and Risk Prediction in ...,https://journals.scholarsportal.info/details/15233804/v15i0003/1_trocititdoca.xml
international-journal-of-respiratory-and-pulmonary-medicine-ijrpm-5 ...,https://clinmedjournals.org/articles/ijrpm/international-journal-of-respiratory-and-pulmonary-medicine-ijrpm-5-083.xml
Untitled,https://www.biorxiv.org/content/biorxiv/early/2020/09/29/2020.07.20.212027.source.xml
