In Situ Observations of Cirrus Cloud Microphysical Properties Using ...,https://journals.ametsoc.org/view/journals/atot/10/3/1520-0426_1993_010_0294_isoocc_2_0_co_2.xml
Performance of a Counterflow Virtual Impactor in the NASA Icing ...,https://journals.ametsoc.org/view/journals/atot/20/6/1520-0426_2003_020_0781_poacvi_2_0_co_2.xml
Drag reduction analysis of counterflow jets in a short penetration mode,https://journals.scholarsportal.info/details/12709638/v106icomplete/nfp_draocjiaspm.xml
Computational Study of Drag Reduction at Various Freestream ...,https://journals.scholarsportal.info/details/19942060/v04i0001/150_csodracjfahc.xml
Inhomogeneous vortex tangles in counterflow superfluid turbulence,https://www.degruyter.com/view/j/caim.2015.7.issue-2/caim-2016-0010/caim-2016-0010.xml
FORM D - SEC.gov,https://www.sec.gov/Archives/edgar/data/1730246/000173024618000001/xslFormDX01/primary_doc.xml
1. Introduction - Hindawi.com,http://downloads.hindawi.com/journals/jc/2014/484372.xml
"Naruki Hiranuma (aka, Seonggi Moon), Ph.D.",https://www.wtamu.edu/academics/college-agriculture-natural-sciences/department-life-earth-environmental-sciences/faculty/naruki-hiranuma.xml
Intellectual flows and counterflows in: Colonial exchanges,https://www.manchesterhive.com/view/9781526126290/9781526126290.00007.xml
