"Egypt says it fights fake news, critics see new crackdown | News24",https://www.iranherald.com/news/258000999/oct04v56.flv
Majlis Podcast: China's Security Interests In Central Asia,https://www.birminghamstar.com/news/259685683/feb24v21.flv
"Apple to host event on September 12, iPhone launch expected",https://www.sierraleonetimes.com/news/257923502/oct04v40.flv
"Trump Says He, Kim Jong Un 'in Love' - Other Media news",https://www.northkoreatimes.com/news/258063237/oct04v56.flv
EU-Armenia Partnership Council wraps in Brussels,https://www.northkoreatimes.com/news/257532550/oct04v56.flv
"Gazwat Uhud ""la batalla de Uhud"" - III - Ramadan - Islamweb",https://www.islamweb.net/ramadanS/articles/144835/flv/rv4.flv
[HOT!] Sniper Ghost Warrior [PC GAME] UPDATE MARCH 2011.flv ...,https://jushiung.pixnet.net/blog/post/29493666-%255Bhot%2521%255D-sniper-ghost-warrior-%255Bpc-game%255D-update-march-2011.flv
Maciek z klanu siłowanie przeróbka YouTube.flv - Śmieszne filmiki ...,"http://chomikuj.pl/karol.s.k/*c5*9amieszne/*c5*9amieszne%2Bfilmiki/Maciek%2Bz%2Bklanu%2Bsi*c5*82owanie%2Bprzer*c3*b3bka%2B-%2BYouTube,1865308960.flv"
Nearly fight between Nicki Pedersen Hans Andersen. YouTube.flv ...,"http://chomikuj.pl/karol.s.k/Speedway/Najlepsze%2Bbiegi%2B*c5*bcu*c5*bclowe/Nearly%2Bfight%2Bbetween%2BNicki%2BPedersen%2B%2B%2BHans%2BAndersen.%2B-%2BYouTube,1855227765.flv"
