Eggnog adds to recipes: use holiday drink in baking and desserts,https://www.toledoblade.com/Food/2009/12/22/Eggnog-adds-to-recipes-use-holiday-drink-in-baking-and-desserts/stories/feed/feed/index.rss
Eggnog Bundt Cake with Cranberry-Pecan Filling - Toledo Blade,https://www.toledoblade.com/Food/2009/12/22/Eggnog-Bundt-Cake-with-Cranberry-Pecan-Filling/stories/feed/index.rss
GeauxEATS! - Buzzsprout,https://feeds.buzzsprout.com/1602430.rss
Food Is Your Friend - Buzzsprout,https://feeds.buzzsprout.com/1658839.rss
Czech Christmas Market Grows in Popularity,https://www.mzv.cz/washington/en/culture_events/news/czech_christmas_market_grows_in.rss
Let's Talk About Texts! - Megaphone,https://audioboom.com/channels/4954831.rss
Bah & The Humbugs Christmas Eve Podcast - Fjordstone.com,http://www.fjordstone.com/bah/bahcast.rss
