pyrpio/pytest.ini at master 路 Samtec-ASH/pyrpio 路 GitHub,https://github.com/Samtec-ASH/pyrpio/blob/master/pytest.ini
DAHAKA-s-ENB/018 COT ash.ini at master - GitHub,https://github.com/FKPX3118/DAHAKA-s-ENB/blob/master/00%2520-%2520Core/DAHAKA's%2520ENB/enbseries/018%2520COT%2520ash.ini
"This file is automatically generated. If you edit it, your # edits will be ...",http://web.mit.edu/cygwin/cygwin_v1.3.2/setup.ini
tox.ini 路 4020bed2f430ab7f29b242e1bcf3929911f09d49 路 Piboonsak ...,https://git.g-able.com/006763/airflow/-/blob/4020bed2f430ab7f29b242e1bcf3929911f09d49/tox.ini
Arab Saudi Sarankan Jemaah Tunda Rencana Haji Tahun Ini,https://pemilu.kompas.com/read/2013/06/16/2138553/Arab.Saudi.Sarankan.Jamaah.Tunda.Rencana.Haji.Tahun.Ini
Arab Saudi Sarankan Jemaah Tunda Rencana Haji Tahun Ini ...,https://amp.kompas.com/ekonomi/read/2013/06/16/2138553/arab.saudi.sarankan.jemaah.tunda.rencana.haji.tahun.ini
