1. Introduction - Hindawi.com,http://downloads.hindawi.com/archive/2014/405626.xml
1. Introduction - Hindawi.com,https://downloads.hindawi.com/archive/2013/320510.xml
XML - Scientific Research Publishing,https://www.scirp.org/xml/74365.xml
Untitled,http://www.sphinxsai.com/2015/ch_vol8_no12/2/(411-417)V8N12CT.xml
Appendix A Table of Dyestuffs and Related Chemicals in: Montreal ...,https://brill.com/view/book/edcoll/9789004415393/BP000012.xml
The Fashionable Atlantic: Innovation and Consumption - Brill,https://brill.com/previewpdf/book/9789004336087/B9789004336087_004.xml%3FpdfJsInlineViewToken%3D605707275%26inlineView%3Dtrue
Development of functional wool fabric by treatment with aqueous ...,https://journals.scholarsportal.info/details/15440478/v17i0004/472_dofwfbeoccpl.xml
International schedule of classes of goods and services. - Govinfo.gov,https://www.govinfo.gov/content/pkg/CFR-2008-title37-vol1/xml/CFR-2008-title37-vol1-sec6-1.xml
CLASSIFICATION OF GOODS AND SERVICES UNDER ... - GovInfo,https://www.govinfo.gov/content/pkg/CFR-2005-title37-vol1/xml/CFR-2005-title37-vol1-part6-id659.xml
