"March 7, 2022, The Community Advisory Council on Homelessness",https://www.dhs.state.il.us/page.aspx/FACT_1WhatIsVR.flv%3Fitem%3D141826%26postdate%3D2/9/2022%26approval%3D4%26newsitemid%3D141418%26getpreviousnews%3Dtrue%26newssidebar%3D27897
U.S. Calls On Russia To Comply With UN Sanctions On North Korea,https://www.orangecountysun.com/news/257786499/oct04v56.flv
Iran Urges UN Court To Halt 'Economic Aggression' By U.S.,https://www.illinoisintelligencer.com/news/257900592/oct04v56.flv
"??璇?俊??/title> <meta name=""viewport"" content=""width ... - 网站首页",http://www.sdhdsc.com/Templates/zeekencn/images/qyxcp1.flv
浣?璁块????椤甸???瀛???/title> <meta content ... - opebet体育滚球,http://m.m.m.m.firstdvdmart.com/abc/zjw067-f.flv
Lawyers to Challenge Sessions' Ruling In Asylum Case - Voice of ...,https://www.raleightimes.com/news/257483013/oct04v40.flv
Chinese sex toy maker launches app to 'share girlfriends' - Big News ...,https://www.chinanationalnews.com/news/254735097/feb24v21.flv
RAK Ceramics to exit Sudan business - Big News Network.com,https://www.kansascitypost.com/news/228861189/oct04v40.flv
TROJ_EXPLOYT.FLV - Threat Encyclopedia - Trend Micro MY,https://www.trendmicro.com/vinfo/my/threat-encyclopedia/malware/troj_exployt.flv
Electromagnetism and Circular Motion in a Cyclotron | TRIUMF,http://www.triumf.info/public/students/videos/flv/triumf_lesson_6%2520beam%2520production%2520and%2520filtering_revised_may_14.flv
