sitemap_images.xml - WasteCare Corporation,https://www.wastecare.com/sitemap_images.xml
Occupations involved in the operation of paper-products machines ...,https://www.govinfo.gov/content/pkg/CFR-2005-title29-vol3/xml/CFR-2005-title29-vol3-sec570-63.xml
A Hybrid Space Compactor for Adaptive X-Handling,https://journals.scholarsportal.info/details/23782250/v2019inone/1_ahscfax.xml
How to Choose the Best Trash Compactors on the Market,http://cairo.lti.cs.cmu.edu/~hector/wikihow_xml/categorized/Home%2520and%2520Garden/Choose-the-Best-Trash-Compactors-on-the-Market.html.xml
Untitled,https://h-cpc.cat.com/cmms/files/xml/en/290/106381_en.xml
Dual Pump Propel System - H-CPC,https://h-cpc.cat.com/cmms/files/xml/en/290/1000031137_en.xml
XML,https://data.austintexas.gov/api/views/bvdj-b937/rows.xml%3FaccessType%3DDOWNLOAD
A comparison of industrial lactose obtained by roller compaction ...,https://jefc.scholasticahq.com/article/9639.xml
Untitled,https://edition.cnn.com/video/data/3.0/video/us/2016/03/27/newborn-baby-found-garbage-compactor-pkg.komo/index.xml
