MOSES AS THEY SAW HIM by S. A. NIGOSIAN Toronto ... - Brill,https://brill.com/downloadpdf/journals/vt/43/3/article-p339_4.xml
Global Social Policy: International Organizations and ... - SAGE Books,https://sk.sagepub.com/books/global-social-policy/n6.xml
Out of Sight Out of Mind: Perceived Physical Distance Between the ...,https://journals.scholarsportal.info/pdf/16641078/v9inone/nfp_oosoompsoner.xml
"Tour in England, Ireland, and France, in the years 1826, 1827, 1828 ...",https://www.ucc.ie/celt/texts/T820002-001.xml
SiteMap - contrib.com Contrib.com,https://www.contrib.com/sitemap/home.xml
sitemap_57.xml - VivaLanka.com,http://www.vivalanka.com/sitemap_57.xml
