Relations Among Linear and Circulur Polarization Parameters ...,https://journals.ametsoc.org/view/journals/atot/4/4/1520-0426_1987_004_0634_ralacp_2_0_co_2.xml
Raindrop Canting in - AMS Journals,https://journals.ametsoc.org/view/journals/atsc/40/2/1520-0469_1983_040_0448_rc_2_0_co_2.xml
A re-entrant canted antiferromagnetic state in the Mn site substituted ...,https://journals.scholarsportal.info/details/02955075/v84i0003/37008_arcasimlsmco.xml
"Coexistence of blocked, metamagnetic and canted ferrimagntic ...",https://journals.scholarsportal.info/details/07496036/v84icomplete/165_cobmachticfn.xml
Canting terms in the Early English Prose Fiction Corpus - Brill,https://brill.com/downloadpdf/book/edcoll/9789004334113/B9789004334113-s009.xml
The origin of 17 th century canting terms - Brill,https://brill.com/view/book/9789004489349/B9789004489349_s008.xml
Front End Designs for the Advanced Photon Source ... - JACoW.org,https://accelconf.web.cern.ch/medsi2018/export/THPH24.xml
Airworthiness Directives; Boeing Model 767 Series ... - Govinfo.gov,https://www.govinfo.gov/metadata/granule/FR-2003-04-24/03-10117/mods.xml
01.xml - LevelSkip,https://levelskip.com/sitemaps/ContentArticle/2019/01.xml
