The Breviaries and Missals Printed by Plantin for the Spanish Crown in,https://brill.com/abstract/book/edcoll/9789004316638/B9789004316638-s003.xml
The Breviaries and Missals Printed by Plantin for the Spanish Crown,https://brill.com/previewpdf/book/edcoll/9789004316638/B9789004316638-s003.xml
Description of University of Pennsylvania Ms. Codex 690: Breviary,https://openn.library.upenn.edu/Data/0002/mscodex690/data/mscodex690_TEI.xml
Description of University of Pennsylvania Misc Mss (Large ... - OPenn,https://openn.library.upenn.edu/Data/0002/miscmsslarge_catholicchurchbreviary/data/miscmsslarge_catholicchurchbreviary_TEI.xml
Untitled,https://digitalcollections.tcd.ie/export/dublinCore.xml%3Fid%3Dkw52jd037
Untitled,http://findingaids.library.umass.edu/ead/mums570.xml
The Use of Sarum and Other Liturgical Uses in Later Medieval Britain,https://www.oxfordbibliographies.com/view/document/obo-9780195396584/obo-9780195396584-0289.xml
posts-17.xml - Casetext,https://casetext.com/sitemaps/posts-17.xml
Center for Digital Initiatives - The University of Vermont,http://www.kenyalaw.org:8181/exist/cluster.xml
