Measuring and Analysing De Facto Decentralisation in Vietnam in,https://brill.com/view/journals/ejea/3/2/article-p307_6.xml%3Flanguage%3Den
"Non-Transitive Parthood, Leveled Mereology, and the ... - Brill",https://brill.com/view/journals/gps/91/1/article-p165_8.xml%3Flanguage%3Den
Leveling the Playing Field for Black or African American Students in,https://journals.humankinetics.com/view/journals/jtpe/41/2/article-p204.xml
Leveling the Nipples | Aesthetic Surgery Journal - Oxford Academic,http://asj.oxfordjournals.org/content/31/7/839.source.xml
Association of tibial plateau leveling osteotomy with proximal tibial ...,https://avmajournals.avma.org/view/journals/javma/253/6/javma.253.6.752.xml
Double-cut center of rotation of angulation–based leveling ...,https://avmajournals.avma.org/view/journals/javma/259/8/javma.259.8.885.xml
A1 Concrete Leveling,https://www.a1concretebuffalo.com/blog-feed.xml
An Automatic Headlamp Leveling System based on the Ramp ...,https://journals.scholarsportal.info/details/26896621/v5inone/1138_aahlsbotrd.xml
how video game litigation in the US has evolved since the advent of ...,https://www.elgaronline.com/abstract/journals/ielr/1-2/ielr.2018.02.02.xml
