kurtosis - SAGE Research Methods,https://methods.sagepub.com/reference/the-sage-dictionary-of-statistics/n283.xml
kurtosis - SAGE Research Methods - Sage Publications,http://methods.sagepub.com/base/download/ReferenceEntry/the-sage-dictionary-of-statistics/n283.xml
The Role of Shearwise and Transverse Quasigeostrophic Vertical ...,https://journals.ametsoc.org/view/journals/mwre/134/4/mwr3114.1.xml
Histopathological Changes Produced by Implanted Electrodes in ...,https://thejns.org/view/journals/j-neurosurg/14/3/article-p302.xml
A novel pathogenic missense ADAMTS17 variant that impairs ...,https://journals.scholarsportal.info/pdf/20452322/v10inone/nfp_anpmavswvdhf.xml
"Susan Keech McIntosh, Daphne Gallagher & Roderick J ... - Brill",https://brill.com/downloadpdf/journals/jaa/1/2/article-p171_2.xml
The Hakka pantry - De Gruyter,https://www.degruyter.com/california/downloadpdf/book/9780520953444/10.1525/9780520953444-013.xml
biorxiv BIORXIV bioRxiv bioRxiv Cold Spring Harbor Laboratory ...,https://www.biorxiv.org/content/biorxiv/early/2020/01/17/2020.01.17.909663.source.xml
A new species of Dactylolabis subgenus Dactylolabis Osten Sacken ...,https://europepmc.org/articles/pmc8257563/bin/zookeys.1047.62033-treatment1.xml
