Stress crazing of some amorphous thermoplastics | Scholars Portal ...,https://journals.scholarsportal.info/details/00218995/v06i0023/585_scosat.xml
The role of water sorption in the solvent crazing of acrylic resins: Part ...,https://journals.scholarsportal.info/details/00450421/v13i0004/265_trowsicoarpi.xml
Cranial and Dental Anomalies in Three Species of Platyrrhine ... - Brill,https://brill.com/view/journals/ijfp/28/1/article-p1_1.xml
Fads and Fashions - SAGE Knowledge,https://sk.sagepub.com/reference/processes/n83.xml
"Standard No. 108; Lamps, reflective devices, and associated ...",https://www.govinfo.gov/content/pkg/CFR-2004-title49-vol5/xml/CFR-2004-title49-vol5-sec571-108.xml
DSC and X-ray study of structure and phase transitions ... - AKJournals,https://akjournals.com/downloadpdf/journals/10973/38/5/article-p1311.xml
DSC and X-ray study of structure and phase transitions ... - AKJournals,https://akjournals.com/view/journals/10973/38/5/article-p1311.xml
"Witchcraft narratives in Germany – Rothenburg, 1561–1652",https://www.manchesteropenhive.com/view/9781526137982/9781526137982.xml
gapines.org/opac/en-US/skin/default/xml/rdetail.xm...,http://gapines.org/opac/en-US/skin/default/xml/rdetail.xml%3Fr%3D54233%26t%3DSevern%252C%2520Bill.%26tp%3Dauthor%26l%3D7%26d%3D2%26hc%3D3%26rt%3Dauthor
