Quid rides?: Targets and referents of RoastMe insults in: HUMOR ...,https://www.degruyter.com/view/journals/humr/ahead-of-print/article-10.1515-humor-2019-0070/article-10.1515-humor-2019-0070.xml%3Flanguage%3Den
Recipe: Pan Roasted Chicken - AskAboutIreland.ie,http://ams2-aai-web-1.anu.net/reading-room/life-society/traditional-irish-cooking/traditional-irish-cooking/poultry-game/recipe-pan-roasted-chicke/index.xml
"Playboy, Roasted à la Edo in: Manga from the Floating World - Brill",https://brill.com/view/book/9781684176083/BP000012.xml
The Thinking of Students: Make Mine Lemon-Roasted in - NCTM,https://pubs.nctm.org/abstract/journals/mtms/6/2/article-p100.xml
sitemap_blogs_1.xml - Maille,https://us.maille.com/sitemap_blogs_1.xml
Modeling the Secondary Shelf Life of Ground Roasted Coffee,https://journals.scholarsportal.info/details/00218561/v54i0015/5571_mtsslogrc.xml
Effect of raw or roasted whole soybeans on early lactational ...,https://journals.scholarsportal.info/details/00218596/v145i0005/529_eororwabmiic.xml
sitemap_products_1.xml - Grandy Organics,https://www.grandyoats.com/sitemap_products_1.xml%3Ffrom%3D8787736707%26to%3D740885004385
09.xml - Parade,https://parade.com/sitemaps/ContentRecipe/2013/09.xml
