WAG 26-04-03-a: How to Complete HFS 222 - DHS,https://www.dhs.state.il.us/page.aspx/FACT_1WhatIsVR.flv%3Fitem%3D19022
"US Intelligence Chief is Tough on Russia, at Odds with Trump",https://www.northkoreatimes.com/news/257699972/oct04v56.flv
Trump Touts Excellent Progress in Talks With Xi,https://www.northkoreatimes.com/news/255305981/oct04v56.flv
U.S. Security Adviser: Washington Not Pushing Iran 'Regime Change',https://www.irishsun.com/news/257260987/oct04v56.flv
Officials: Trump Pressed Idea of Invading Venezuela,https://www.illinoisintelligencer.com/news/257615938/feb24v21.flv
Netflix Taken to Court in India Over Portrayal of Former PM,https://www.indiagazette.com/news/257665852/oct04v40.flv
"The Week In Russia: Spies, 'Scumbags,' And Senior Citizens",https://www.austinglobe.com/news/258086108/oct04v40.flv
Programs - > The Israel Center for Social & Economic Progress,http://www.icsep.org.il/MiltonFriedmanEng.flv
Trump Calls On U.S. Attorney General To End Russia Probe 'Right ...,https://www.europesun.com/news/257774538/oct04v56.flv
Death Of Outspoken Srebrenica Mother Mocked By Top Serbian ...,https://www.swedensun.com/news/257736575/oct04v40.flv
Analysts: Looming Idlib Conflict Threatens Turkey's Syria Strategy,https://www.beijingbulletin.com/news/257977642/oct04v56.flv
"Russia-Friendly Party, Populists Top Latvian Elections",https://www.malaysiasun.com/news/258094343/oct04v56.flv
Top Pakistani Court Upholds Christian Woman's Blasphemy Acquittal,https://www.kenyastar.com/news/259282418/feb24v21.flv
Iran's Parliament Passes Bill Against Funding Terrorism,https://www.philippinetimes.com/news/258095659/oct04v56.flv
Divide And Rule? Complex Ethnic Problems Dominate Bosnian ...,https://www.northernirelandnews.com/news/258088992/oct04v40.flv
"[PDF] Parsi Theater, Urdu Drama, and the Communalization of Knowledge",https://minio.la.utexas.edu/colaweb-prod/profile/custom_pages/0/119/parsi_theater_urdu_drama_and_the_communa_51b7a927-cb02-4217-9c55-0726dcb7b8bf.flv
"Merkel, Algerian Officials Discuss Migration, Libya",https://www.nigeriasun.com/news/258001134/oct04v40.flv
Fostering Fear: Anti-Immigration Hysteria and Islamaphobia ...,https://archive.org/details/fostering_fear.flv
Flurry of Syrian Death Notices Shows Fate of Government Detainees,https://www.mediterraneantimes.com/news/257765309/oct04v56.flv
Russia Dumped U.S. Bond Holdings This Year Amid U.S. Sanctions ...,https://www.bangladeshsun.com/news/257703785/oct04v40.flv
National Library of Korea receives Philippine cookbooks stamps,https://www.manilametro.com/news/249369631/oct04v56.flv
Turkey's Erdogan Wins New Term In Poll Criticized By Monitors,https://www.southamericatimes.com/news/257556113/oct04v56.flv
Chapter 5: AcuServer Functions - Die Blumengalerie,https://www.blumengalerie.at/videos/VTS_02_1.flv
online work for earn money at home,https://finanspres.com/article/finance/497wu/nmrkj/assets/media/VH_videoAsset.flv
中文| 红楼阁REDdist,https://www.reddist.com/taxonomy/term/169/sample.FLV%3Fpage%3D206
Эксклюзивные НОВИНКИ и РЕЛИЗЫ - 24Warez.ru,https://24warez.ru/uploads/video/driver.flv
