“Like a Throne of Glory:” The Apotropaic Potential of Ṣîṣîṯ in ... - Brill,https://brill.com/downloadpdf/journals/rrj/21/2/article-p176_2.xml
THE QUMRAN ARAMAIC TEXTS AND THE QUMRAN COMMUNITY ...,https://brill.com/previewpdf/book/edcoll/9789047423096/Bej.9789004162921.i-836_013.xml%3FpdfJsInlineViewToken%3D1388677437%26inlineView%3Dtrue
"Religion, war and Israel's secular millennials: Being reasonable?",https://www.manchesterhive.com/downloadpdf/9781526149992/9781526149992.00013.xml
"<hi rend=""bold"">St. Elmo. A Novel:</hi> Electronic Edition.",https://docsouth.unc.edu/southlit/evans/evans.xml
The History of the Jews in New Zealand,http://nzetc.victoria.ac.nz/tei-source/GolHist.xml
sitemap_1354.xml - Trademarkia,http://www.trademarkia.com/sitemap_xml/sitemap_1354.xml
