"Harvest celebrates open minds, open hearts | The Blade",https://www.toledoblade.com/Religion/2006/08/26/Harvest-celebrates-open-minds-open-hearts/stories/feed/index.rss
"Harvest celebrates open minds, open hearts | The ... - Toledo Blade",https://www.toledoblade.com/Religion/2006/08/26/Harvest-celebrates-open-minds-open-hearts/stories/feed/feed/index.rss
"Two Minutes in the Garden: Gardening Tips, Science, Myths",https://empressofdirt.net/briefing/full.rss
Your Daily Cup of Inspiration with Dianna Hobbs - Buzzsprout,https://www.buzzsprout.com/56406.rss
Hunt Harvest Health - Megaphone,https://feeds.buzzsprout.com/70360.rss
Pastor Tony Collins - Cornerstone Church - Podcasts,http://podcasts.subsplash.com/ac5fc5e/podcast.rss
American Family Farmer - Spreaker,http://podcast.radioamerica.org/americanfamilyfarmer.rss
Gardenerd Tip of the Week,http://audioboom.com/channels/2851879.rss
Becoming A Divine Lady - Audioboom,https://audioboom.com/channels/5011659.rss
