Morphologic Significance of Bifid Uvula,https://pediatrics.aappublications.org/content/75/3/553.full.pdf
Submucous Cleft Palate with Bifid Uvula,https://www.jpeds.com/article/S0022-3476(14)00484-3/pdf
[PDF] Automated Ciphertext-Only Cryptanalysis of the Bifid Cipher - DCC,https://www.dcc.fc.up.pt/Pubs/TR06/dcc-2006-01.pdf
Sonography and MR Imaging of Bifid Median Nerve with Anatomic ...,https://www.ajronline.org/doi/pdf/10.2214/ajr.175.6.1751721
Bifid Epiglottis - SAGE Journals,https://journals.sagepub.com/doi/pdf/10.1177/000348949610500211
Clinical electrocardiographic studies of bifid T waves - Heart (BMJ),https://heart.bmj.com/content/heartjnl/52/2/207.full.pdf
Familial incidence of bifid and double ureters - Archives of Disease ...,https://adc.bmj.com/content/archdischild/49/5/390.full.pdf
congenital bifid femur - b. aalami-harandi,https://www.tandfonline.com/doi/pdf/10.3109/17453677608988713
Bifid Ribs and Unusual Vertebral Anomalies Diagnosed in an ...,https://onlinelibrary.wiley.com/doi/pdf/10.1002/ajmg.a.31418
