[PDF] Effect of Aerobic Exercise Training and Deconditioning on Oxidative ...,https://journals.scholarsportal.info/pdf/20770383/v09i0010/nfp_eoaetamiyaei.xml
Multi-System Deconditioning in 3-Day Dry Immersion without Daily ...,https://journals.scholarsportal.info/pdf/1664042x/v8inone/nfp_mdi3diwdr.xml
References - ClinMed International Library,https://clinmedjournals.org/articles/jgmg/journal-of-geriatric-medicine-and-gerontology-jgmg-7-112.xml
Changes in cardiac dimensions and indices of ... - AVMA Journals,https://avmajournals.avma.org/view/journals/ajvr/61/12/ajvr.2000.61.1553.xml
Changes in cardiac dimensions and indices of cardiac function ...,https://avmajournals.avma.org/abstract/journals/ajvr/61/12/ajvr.2000.61.1553.xml
Deep Water Running for Injured Runners - Human Kinetics Journals,https://journals.humankinetics.com/previewpdf/journals/ijatt/12/2/article-p8.xml
Promoting Physical Activity During the COVID-19 Pandemic,https://journals.humankinetics.com/view/journals/jpah/17/7/article-p685.xml
Identification of Exertional Hypoxia and Its Implications in SARS ...,https://www.ajtmh.org/view/journals/tpmd/103/4/article-p1742.xml
Untitled,https://openheart.bmj.com/content/3/1/e000381.download.xml
