"[PDF] thioridazine hydrochloride tablet, film - DailyMed",https://dailymed.nlm.nih.gov/dailymed/getFile.cfm%3Fsetid%3D56b3f4c2-52af-4947-b225-6808ae9f26f5%26type%3Dpdf
[PDF] thioridazine hydrochloride oral solution usp 30mg/ml (concentrate),https://www.accessdata.fda.gov/drugsatfda_docs/anda/97/040187ap.pdf
"[PDF] Informed Consent for Medication, thioridazine",https://www.dhs.wisconsin.gov/forms1/f2/f24277ti-thioridazine.pdf
[PDF] Chlorpromazine (Thorazine)? Thioridazine (Mellaril) Tamoxifen ...,https://www.aao.org/Assets/be5a5e1e-e49a-4ffb-b3cc-42f6558aadc7/637153836951370000/r62u-pdf%3Finline%3D1
[PDF] Thioridazine | Memorial Sloan Kettering Cancer Center,https://www.mskcc.org/pdf/cancer-care/patient-education/thioridazine-01%3F_wrapper_format%3Dhtml%26mode%3Dlarge
a controlled study of the use of thioridazine* in the ... - SAGE Journals,https://journals.sagepub.com/doi/pdf/10.1177/070674376400900308
Thioridazine as Chemotherapy for Mycobacterium avium Complex ...,https://journals.asm.org/doi/pdf/10.1128/AAC.02985-15
Has thioridazine a role in the treatment of anxious depressed ...,https://onlinelibrary.wiley.com/doi/pdf/10.1002/ddr.430030312
ANALYTICAL PROFILE THIORIDAZINE ... - ScienceDirect.com,https://www.sciencedirect.com/science/article/pii/S0099542808606796/pdf%3Fmd5%3D521291dd09eb9d909a6c14b4daacf768%26pid%3D1-s2.0-S0099542808606796-main.pdf
Concomitant use of thioridazine Mth risperidone For Someone Who ...,https://academic.oup.com/ajhp/article-pdf/52/9/1012/28476118/ajhp1012.pdf
Is thioridazine retinopathy progressive? Relationship ofpigmentary ...,https://bjo.bmj.com/content/bjophthalmol/74/12/739.full.pdf
[PDF] Protocol for the use of Unlicensed Thioridazine | MyPsych,https://mypsych.nhsggc.org.uk/media/1506/mhs-mrg-20-protocol-for-the-use-of-unlicensed-thioridazine.pdf
"Thioridazine, an antipsychotic drug, elicits potent antitumor effects in ...",https://www.spandidos-publications.com/10.3892/or.2014.3068/download
"AStudy of Thioridazine and Its Side-Chain Derivative, Mesoridazine ...",https://accp1.onlinelibrary.wiley.com/doi/pdf/10.1177/009127006600600605
Effects of Thioridazine (Mellaril) on Ventricular Electrophysiologic ...,https://www.ajconline.org/article/0002-9149(79)90147-4/pdf
126.full.pdf - Journal of Pharmacology and Experimental Therapeutics,https://jpet.aspetjournals.org/content/jpet/250/1/126.full.pdf
[PDF] Reversible Thioridazine-Induced Magnetic Resonance imaging ...,https://www.endocrinepractice.org/article/S1530-891X(20)41905-6/pdf
A Comparative Trial of Haloperidol and Thioridazine,https://www.tandfonline.com/doi/pdf/10.3109/00048677309161477
Clinical Investigations and Computer Analysis of EEG Effects of ...,https://www.karger.com/Article/Pdf/283237
Thioridazine inhibits self-renewal in breast cancer cells via DRD2 ...,https://www.jbc.org/article/S0021-9258(20)35137-1/pdf
