Conjugational Recombination in E. coli: Myths and Mechanisms ...,https://www.sciencedirect.com/science/article/pii/009286749190205D/pdf%3Fmd5%3Dd57614f13bbb1fda914f55fdb2e10a7d%26pid%3D1-s2.0-009286749190205D-main.pdf
Increasein Conjugational Transmission Frequency ... - Science,https://www.science.org/doi/pdf/10.1126/science.322280
[PDF] ge136117.pdf - NCBI,https://www.ncbi.nlm.nih.gov/pmc/articles/PMC1205768/pdf/ge136117.pdf
Evidence of Conjugational Variation in the Parallelization ... - JSTOR,https://www.jstor.org/stable/543473
"Language change, conjugational morphology and the Sino-Tibetan ...",https://www.tandfonline.com/doi/pdf/10.1080/03740463.1993.10415452
Conjugational Transfer Kinetics of pLS20 between Bacillus subtilis ...,https://www.tandfonline.com/doi/pdf/10.1271/bbb.70.740
Conjugational Recombination in Escherichia coli,https://academic.oup.com/genetics/article-pdf/139/3/1123/34604575/genetics1123.pdf
genetics1243.pdf,https://academic.oup.com/genetics/article-pdf/163/4/1243/42046804/genetics1243.pdf
Genes of the RecE and RecF Pathways of Conjugational ...,http://symposium.cshlp.org/content/49/453.full.pdf
Evidence of Conjugational Variation in the Parallelization of ...,https://www.journals.uchicago.edu/doi/pdf/10.1086/372224
types of conjugational forms in chadic - De Gruyter,https://www.degruyter.com/document/doi/10.1515/9783111356167.399/pdf
Conjugational Transmission and Replicative Properties of Plasmid ...,https://www.jstage.jst.go.jp/article/jjphytopath1918/51/4/51_4_426/_pdf
Conjugational recombination in resolvase-deficient ruvC mutants of ...,https://journals.asm.org/doi/pdf/10.1128/jb.173.17.5414-5418.1991
Conjugational Complementation Analysis of Transfer-Deficient ...,https://journals.asm.org/doi/pdf/10.1128/jb.110.3.831-842.1972
Impact of antibiotics on conjugational resistance gene transfer in <i ...,https://sfamjournals.onlinelibrary.wiley.com/doi/pdf/10.1046/j.1462-2920.2003.00459.x
Conjugational Behaviour of N Plasmids - in Escherichia coli K12,https://link.springer.com/content/pdf/10.1007/BF00264802.pdf
Steric and conjugational electronic effects on the configuration of ...,https://pubs.acs.org/doi/pdf/10.1021/ja00275a038
Highly conductive carbon nanotube buckypapers with improved ...,http://iopscience.iop.org/article/10.1088/0957-4484/22/48/485708/pdf
Conjugational Patterns and Text Categories in the LOB Corpus - Brill,https://brill.com/downloadpdf/book/edcoll/9789004334205/B9789004334205-s003.xml
[PDF] Romance Conjugational Classes - OhioLINK ETD Center,https://etd.ohiolink.edu/apexprod/rws_etd/send_file/send%3Faccession%3Dosu1293724168%26disposition%3Dinline
Transcriptional organization of the Tra2 region controlling ...,https://www.cambridge.org/core/services/aop-cambridge-core/content/view/5D8C514F30CA62D9BAF30251A8A0A550/S0016672300022059a.pdf/transcriptional_organization_of_the_tra2_region_controlling_conjugational_transfer_of_the_narrow_host_range_pseudomonas_aeruginosa_plasmid_r915.pdf
Conjugational Fertility and Location of Chloramphenicol ...,https://www.microbiologyresearch.org/content/journal/micro/10.1099/00221287-132-5-1327%3Fcrawler%3Dtrue%26mimetype%3Dapplication/pdf
[PDF] The separate life cycles of prefix classes vs tone ablaut ... - Amerindia,https://amerindia.cnrs.fr/wp-content/uploads/2021/02/Woodbury-A.-Conjugational-double-classification-The-separate-life-cycles-of-prefix-classes-vs-tone-ablaut-classes-in-aspectmood-inflection-in-the-Chatino-languages-of-Oaxaca-Mexico.pdf
[PDF] Genetic Requirements for Conjugational Recombination in ... - FULIR,http://fulir.irb.hr/2702/1/Bace_FTB_2002_40_261.pdf
[PDF] Transposon stability and a role for conjugational transfer in adaptive ...,https://web.northeastern.edu/mutation/wp-content/uploads/PNAS_2000.pdf
Balancing Conjugational Stabilization and Torsional Strain. The ...,https://journals.iucr.org/c/issues/1996/11/00/ka1196/ka1196.pdf
[PDF] Conjugational transfer and survival of plasmid - Academic Journals,https://academicjournals.org/journal/JBR/article-full-text-pdf/838568D8984
[PDF] Black Mountain Conjugational Morphology 9 Pro to,https://www.isw.unibe.ch/ueber_uns/e41180/e523709/e547690/1995a_ger.pdf
[PDF] s13213-018-1382-7.pdf - Annals of Microbiology,https://annalsmicrobiology.biomedcentral.com/track/pdf/10.1007/s13213-018-1382-7.pdf
