"Volume XV, Issue III - July 2021 - IDHS",https://www.dhs.state.il.us/page.aspx/FACT_Intro.flv%3Fitem%3D136840
Grant Accountability and Transparency Act (GATA) - DHS,https://www.dhs.state.il.us/page.aspx/FACT_Intro.flv%3Fitem%3D118082
Arizona's Sen. Flake Takes GOP to Task Over Trump - Voice of ...,https://www.phoenixherald.com/news/254195000/oct04v40.flv
China Rebuffs Trump's Blame in North Korea Denuclearization Fallout,https://www.northkoreatimes.com/news/257651848/oct04v56.flv
"Linscott Mansion, the motif of a doctor in literature - The Black Dahlia |",https://www.theblackdahliamovie.net/swf/media/linscottmansion.flv
Electromagnetism and Circular Motion in a Cyclotron | TRIUMF,http://www.triumf.info/public/students/videos/flv/triumf_lesson_6%2520beam%2520production%2520and%2520filtering_revised_may_14.flv
[PDF] 12 October 2009 Dear GNSO Council Members: ICANN Staff is ...,https://lists.ncuc.org/pipermail/ncuc-discuss/attachments/20091014/4808dc99/attachment.flv
Indonesian Groups Call for Minority Religious Protections - Voice of ...,https://www.beijingbulletin.com/news/257993035/oct04v56.flv
Ethics before making money - Mogoeng tells lawyers - News24,https://www.johannesburglife.com/news/246846291/feb24v21.flv
Lawyers to Challenge Sessions' Ruling In Asylum Case - Voice of ...,https://www.raleightimes.com/news/257483013/oct04v40.flv
Republican Advisers Weigh Trump Foreign Policy Risks,https://www.irishsun.com/news/243852805/oct04v56.flv
Slovakia Detains Suspects In Slain Journalist Case,https://www.irishsun.com/news/258049965/oct04v56.flv
Trump Calls On U.S. Attorney General To End Russia Probe 'Right ...,https://www.europesun.com/news/257774538/oct04v56.flv
At Least 74 People Killed In Forest Fires Near Athens - Radio Free ...,https://www.europesun.com/news/257726845/oct04v40.flv
[PDF] Indian Folk Traditions and - the Modern Theatre,https://minio.la.utexas.edu/colaweb-prod/profile/custom_pages/0/119/indian_folk_traditions_and_the_modern_th_ea595889-23ff-42e8-b4e6-0640896eeacc.flv
Taiwan Says China 'Out of Control' as It Loses El Salvador to Beijing,https://www.sierraleonetimes.com/news/257872106/oct04v40.flv
Rastafarian lawyer Gareth Prince on the decriminalisation of weed,https://www.sierraleonetimes.com/news/258080925/oct04v56.flv
Kaspersky Lab warns about financial cyberthreats in Asia Pacific,https://www.malaysiasun.com/news/248606083/oct04v56.flv
Iranian UN Envoy Condemns Israel's 'Racist' Law - Politics news,https://www.iranherald.com/news/257730691/oct04v56.flv
Virgin Trains to continue restocking Daily Mail - Nigeria Sun,https://www.entertainmentsun.com/news/256094535/feb24v21.flv
