Hybrid Geographies: Natures Cultures Spaces - SAGE Books,https://sk.sagepub.com/books/hybrid-geographies/d40.xml
"Heritage, Memory & Identity - SAGE Books",https://sk.sagepub.com/books/heritage-memory-and-identity/n11.xml
"The Return of Joseph Jefferson Jackson, a Study in American Myth in",https://brill.com/view/book/9789004487901/B9789004487901_s010.xml%3Flanguage%3Den
Journal of Flow Chemistry Volume 6 Issue 3 (2016) - AKJournals,https://akjournals.com/view/journals/1846/6/3/article-p260.xml
Photo-Induced Copper-Mediated Acrylate Polymerization in ...,https://akjournals.com/downloadpdf/journals/1846/6/3/article-p260.xml
Introduction - PLOS,http://open-repository.kisti.re.kr/cube/bitstream/open_repository/106843/1/journal.pone.0114207.xml
Reviews in: Anthropological Journal of European Cultures Volume ...,https://www.berghahnjournals.com/view/journals/ajec/30/2/ajec300211.xml
F*ck the Police! - Berghahn Journals,https://www.berghahnjournals.com/downloadpdf/journals/focaal/2021/91/fcl910108.xml
Digital Humanities: On Finding the Proper Balance between ...,http://www.digitalhumanities.org/dhq/vol/7/3/000167.xml
