Shoulder Impingement - My Doctor Online - Kaiser Permanente,https://mydoctor.kaiserpermanente.org/ncal/structured-content/Treatment_Shoulder_Impingement_Therapy_-_Physical_Therapy.xml%3Fco%3D/regions/ncal
Stretching Exercises for Subacromial Impingement Syndrome,https://journals.humankinetics.com/view/journals/jsr/27/2/article-p132.xml
Conservative Management of Shoulder Impingement Syndrome in ...,https://journals.humankinetics.com/view/journals/jsr/8/3/article-p230.xml
Impingement around the hip: beyond cam and pincer in,https://eor.bioscientifica.com/view/journals/eor/3/2/2058-5241.3.160068.xml
Hip arthroscopy for femoroacetabular impingement in,https://eor.bioscientifica.com/view/journals/eor/3/4/2058-5241.3.170041.xml
Posterior Ankle Impingement Syndrome in Non-athletic Population,https://japmaonline.org/view/journals/apms/aop/21-001/21-001.xml
Calculation of the Impingement of Cloud Droplets in a Cylinder by ...,https://journals.ametsoc.org/view/journals/atsc/38/5/1520-0469_1981_038_1027_cotioc_2_0_co_2.xml
Comments on “Calculation of the Impingement of Cloud Droplets on ...,https://journals.ametsoc.org/view/journals/atsc/42/3/1520-0469_1985_042_0306_cootio_2_0_co_2.xml
[PDF] Effects of eccentric exercise in patients with subacromial ...,https://journals.scholarsportal.info/pdf/14712474/v20inone/nfp_eoeeipsasram.xml
