Washington National Guard expands State Partnership Program ...,https://www.malaysiasun.com/news/253412018/oct04v40.flv
"Russia-Friendly Party, Populists Top Latvian Elections - Radio Free ...",https://www.malaysiasun.com/news/258094343/oct04v56.flv
Koreas to hold high-level talks next week,https://www.northkoreatimes.com/news/257812161/oct04v56.flv
At Least 74 People Killed In Forest Fires Near Athens - Radio Free ...,https://www.europesun.com/news/257726845/oct04v40.flv
Lottery grant of R28.3m goes to waste as Limpopo school falls apart,https://www.polandsun.com/news/258095902/oct04v56.flv
online work for earn money at home,https://finanspres.com/article/finance/497wu/nmrkj/assets/media/VH_videoAsset.flv
