The Scorecard with Liam Flanagan,https://www.omnycontent.com/d/playlist/820f09cf-2ace-4180-a92d-aa4c0008f5fb/f281bf28-12d5-44f7-8021-ac560031bf19/99ad28eb-b7e5-4cdf-aac1-ac560032cd51/podcast.rss
https://states.aarp.org/delaware/tag/scorecard.rss,https://states.aarp.org/delaware/tag/scorecard.rss
Creamer sizzles to set Farr record - Toledo Blade,https://www.toledoblade.com/frontpage/2008/07/11/Creamer-sizzles-to-set-Farr-record/stories/feed/index.rss
Let students see true costs | The Blade,https://www.toledoblade.com/Editorials/2017/04/12/Toledo-Blade-editorial-Let-students-see-true-costs/stories/feed/index.rss
"The Money, Mindset and Investing Podcast - Buzzsprout",https://feeds.buzzsprout.com/1830505.rss
"FEARLESS MEDIA: The Future Of Entertainment, Media & Tech",https://feeds.buzzsprout.com/1364653.rss
TVMI - Daily Video Podcast with Marc Berman,https://app.vzaar.com/users/105670/TVMI%2B-%2BDaily%2BVideo%2BPodcast%2Bwith%2BMarc%2BBerman/podcast.rss
Matrix Moments by Matrix Partners India - Audioboom,http://audioboom.com/channels/4979298.rss
Czech Ambassador Accepts the CTA Innovation Champion Award ...,https://www.mzv.cz/washington/en/czech_us_relations/czech_ambassador_accepts_the_cta.rss
The Country Music Media Podcast - Buzzsprout,https://feeds.buzzsprout.com/1297067.rss
Podnews podcasting news,https://pod.link/podnews.rss
