Thao Triplication - jstor,https://www.jstor.org/stable/3623444
"Ureteral Triplication, Occasionally an Isolated Anomaly",https://www.karger.com/Article/Pdf/282826
Triplication of a four-gene set during evolution of the goat f8-globin ...,https://www.pnas.org/doi/pdf/10.1073/pnas.81.21.6589
Ureteral Triplication,https://pubs.rsna.org/doi/pdf/10.1148/108.3.533
[PDF] Triplicated P-wave measurements for waveform tomography of the ...,https://se.copernicus.org/articles/3/339/2012/se-3-339-2012.pdf
Thao Triplication,https://muse.jhu.edu/article/25429/pdf
Intrachromosomal triplication for the distal part of chromosome 15q,https://onlinelibrary.wiley.com/doi/pdf/10.1002/ajmg.a.30745
Triplication of 15q11-q13 with inv dup(15) in a,https://jmg.bmj.com/content/jmedgenet/35/5/425.full.pdf
"Thirty Years Later, Case Closed: A Case of PMP22 Triplication From ...",https://www.mayoclinicproceedings.org/article/S0025-6196(16)00072-0/pdf
"Ureteral Triplication, Contralateral Duplication and Bilateral Extra ...",https://www.auajournals.org/doi/pdf/10.1016/S0022-5347%252817%252947280-6
Jaundice and alpha gene triplication in beta-thalassemia,https://www.tandfonline.com/doi/pdf/10.1080/1024533050069882
Colonic triplication associated with anorectal malformation,https://www.jpedsurg.org/article/S0022-3468(06)00212-0/pdf
Tooth 1A patient with PMP22 triplication - Nature,https://www.nature.com/articles/jhg2014102.pdf%3Forigin%3Dppub
TRIPLICATION OF THE GALLBLADDER - AJR Online,https://www.ajronline.org/doi/pdf/10.2214/ajr.104.3.656
[PDF] On shear-wave triplication in transversely isotropic media,http://deltageophysics.net/biblio/ThomsenDellinger_02.pdf
A lower mantle S-wave triplication and the shear velocity structure of ...,https://academic.oup.com/gji/article-pdf/75/3/799/1847592/75-3-799.pdf
Chromosome triplication found across the tribe Brassiceae,http://genome.cshlp.org/content/15/4/516.full.pdf
Upper Limb Triplication with Radial Dimelia - SAGE Journals,https://journals.sagepub.com/doi/pdf/10.1016/S0266-7681%252897%252980025-3
[PDF] De novo triplication of 11q12.3 in a patient with developmental delay ...,https://molecularcytogenetics.biomedcentral.com/track/pdf/10.1186/1755-8166-6-15.pdf
TYPE II URETERAL TRIPLICATION ASSOCIATED WITH ECTOPIC ...,http://www.sciencedirect.com/science/article/pii/S0090429596003238/pdf%3Fmd5%3Dfa3ce9b2b23d095e68e791995bd6a804%26pid%3D1-s2.0-S0090429596003238-main.pdf
