DuMonde Feat. Evil Iris See The Light (Club Rotation Edit) (1999).mkv,https://archive.org/details/DuMonde_Feat._Evil_Iris_See_The_Light_Club_Rotation_Edit_1999.mkv
Modified Endoscope Holder for Two Handed Endoscopic Ear Surgery,https://europepmc.org/articles/pmc7374685/bin/12070_2020_1841_moesm1_esm.mkv
Endoscopic Management of Tympanic Membrane Retraction Pockets,https://europepmc.org/articles/pmc6838262/bin/12070_2019_1682_moesm1_esm.mkv
Download Offline music player | GameLoop Official,https://www.gameloop.com/game/video-players-editors/com.offlinemusicplayer.mediaplayer.mkv
Descargar Offline music player en PC | GameLoop Oficial,https://www.gameloop.com/co/game/video-players-editors/com.offlinemusicplayer.mediaplayer.mkv
Hot.Neighbors.2016.720p.HDRip.x264.AAC-KaoRi.mkv 65 min,https://in.xvideo.sc/video17982533/hot.neighbors.2016.720p.hdrip.x264.aac-kaori.mkv%3Fpl%3D7618950%26plname%3Dpending
Expert PDF Home | Home | 1 appareil | 1 Usager | PC - Amazon,http://www.multiup.org/fichiers/download/25b13cd0cb2e3045f79abe85ac3ca42a__DragonMax__Juliette_Je_T_Aime___40.mkv%3F_locale%3Dfr
