A Moral Intervention Reduces Doping Likelihood in British and ...,https://journals.humankinetics.com/view/journals/jsep/43/2/article-p125.xml
Violence and Doping in Sport - Brill,https://brill.com/downloadpdf/book/9789004464711/BP000008.xml
Medical consequences of doping with anabolic androgenic steroids ...,https://eje.bioscientifica.com/view/journals/eje/173/2/R47.xml
Medical consequences of doping with anabolic androgenic steroids,https://eje.bioscientifica.com/downloadpdf/journals/eje/173/2/R47.xml
The actor-network of doping in: Sport and technology - Manchester ...,https://www.manchesteropenhive.com/view/9781784995201/9781784995201.00008.xml
United States Anti-Doping Agency Reauthorization Act - Govinfo.gov,https://www.govinfo.gov/bulkdata/BILLSUM/113/s/BILLSUM-113s2338.xml
Doping Attitudes and Covariates of Potential Doping Behaviour in ...,https://www.jssm.org/abstresearchajssm-15-606.xml.xml
Sport and Society: A Student Introduction - SAGE Books,https://sk.sagepub.com/books/sport-and-society/n17.xml
Racetrack safety regulations submitted for federal review,https://avmajournals.avma.org/view/post/news/racetrack-safety-regulations-submitted-for-federal-review.xml
Controlling Molecular Doping in Organic Semiconductors,https://journals.scholarsportal.info/details/09359648/v29i0042/na_cmdios.xml
Doping : Encyclopedia of Sport Management - Elgaronline,https://www.elgaronline.com/view/nlm-book/9781800883277/b-9781800883284-93.xml
[PDF] Improvement of Flux Pinning Properties of RE123 Materials by ...,https://journals.scholarsportal.info/pdf/17426588/v43i0001/235_iofppormbcd.xml
Doping in Sport-Should it be a Crime? - Sports Law and ...,https://slgj.scholasticahq.com/article/6477.xml
Anti-doping Convention - The Faculty of Law - Det juridiske fakultet,https://www.jus.uio.no/english/services/library/treaties/03/3-03/anti-doping.xml
xml - Congress.gov,https://www.congress.gov/116/bills/hr1754/BILLS-116hr1754rds.xml
3: Implementation of the World Anti-Doping Code in the Uk,https://www.bloomsburyprofessionalonline.com/view/sport_law_practice/SPLP-0034434.xml
Stoichiometric ratio and doping effects on the thermal properties of ...,https://akjournals.com/downloadpdf/journals/10973/39/3/article-p301.xml
index.xml - CNN,https://www.cnn.com/video/data/3.0/video/tv/2022/02/15/winter-olympics-russia-doping-kamila-valieva-bryan-fogel.cnn/index.xml
III. The Adsorption of Water Vapor on “Doped” Silver Iodide in,https://journals.ametsoc.org/view/journals/atsc/24/5/1520-0469_1967_024_0530_tscocn_2_0_co_2.xml
Introduction - BMJ Open,https://bmjopen.bmj.com/content/11/6/e047548.download.xml
