Antiviral Therapy Improves Hepatocellular Cancer Survival in - JNCCN,https://jnccn.org/view/journals/jnccn/19/3.5/article-pCLO21-023.xml
Antiviral therapy reduces rebleeding rate in patients with hepatitis B ...,https://journals.scholarsportal.info/pdf/1471230x/v19inone/nfp_atrrriwavbae.xml
[PDF] Effectiveness of potential antiviral treatments in COVID-19 ...,https://journals.scholarsportal.info/pdf/20955162/v10inone/nfp_eopatictcams.xml
Sexual dysfunction in males with chronic hepatitis C and antiviral ...,https://joe.bioscientifica.com/view/journals/joe/185/2/1850345.xml
(B) Schematic of the main structure of coronavirus [7]. - ClinMed ...,https://clinmedjournals.org/articles/jide/journal-of-infectious-diseases-and-epidemiology-jide-7-201.xml
Distribution of Severe Fever with Thrombocytopenia Syndrome Virus ...,https://www.ajtmh.org/view/journals/tpmd/106/5/article-p1547.xml
Can chlorine dioxide prevent the spreading of coronavirus or other ...,https://akjournals.com/view/journals/2060/107/1/article-p1.xml
Infect Dis Obstet Gynecol Infect Dis Obstet Gynecol IDOG Infectious ...,https://stacks.cdc.gov/view/cdc/26519/cdc_26519_DS4.xml
