Freedom's Disciple - Megaphone,https://omny.fm/shows/freedoms-disciple/playlists/podcast-1.rss
Seizing Freedom - Megaphone,https://omny.fm/shows/seizing-freedom/playlists/podcast.rss
Article notification: HRC31: Czech Republic supports freedoms of ...,https://www.mzv.cz/mission.geneva/en/about_us/statements_delivered/hrc31_czech_republic_supports_freedoms.rss%3Fnotify%3D1
HRC29: Czech Republic speaks for freedoms of assembly ...,https://www.mzv.cz/mission.geneva/en/about_us/statements_delivered/hrc29_czech_republic_speaks_for_freedoms.rss
"This Memorial Day, remember to use freedom well | The Blade",https://www.toledoblade.com/opinion/editorials/2018/05/27/This-Memorial-Day-remember-to-use-freedom-well/stories/feed/feed/index.rss
Dr. Thomas Lane Butts: Another Aspect of Freedom | Day 1,https://day1.org/1415-dr_thomas_lane_butts_another_aspect_of_freedom.rss
Greater Freedom | Day 1,https://day1.org/7648-greater_freedom.rss
Freedom Life Fellowship Podcast - Audioboom,https://audioboom.com/channels/4947401.rss
Freedom Church - Podcasts,https://podcasts.subsplash.com/bdchbn8/podcast.rss
