SEC FORM D - SEC.gov,https://www.sec.gov/Archives/edgar/data/1589673/000158967313000001/xslFormDX01/primary_doc.xml
"Letter from John Henderson to his father, Archibald Henderson ...",https://docsouth.unc.edu/unc/unc09-10/unc09-10.xml
Moral Panic - SAGE Books - Key Concepts in Media and ...,https://sk.sagepub.com/books/key-concepts-in-media-and-communications/n32.xml
BOOK REVIEWS Arrest of Ships Volume 7 (The Arrest of Ships ... - Brill,https://brill.com/downloadpdf/journals/alq/4/3/article-p260_14.xml
Accountability for Human Rights Violations by International ... - Brill,https://brill.com/downloadpdf/journals/iolr/8/1/article-p273_12.xml
sitemap.xml - Down Under Yoga,https://www.downunderyoga.com/sitemap.xml
Scottish Ethnic Minorities Lawyers' Association,https://www.semla.org.uk/blog-feed.xml
"In this 17th century treatise, Flavel lays out an extensive biblical and ...",https://www.ccel.org/ccel/f/flavel/pneum.xml
sitemap-oh-offmarket-22.xml - RE/MAX,https://www.remax.com/sitemaps/sitemap-oh-offmarket-22.xml
