[PDF] Interrelationships between Seed Yield and 16 Related Traits of 81 ...,https://journals.ashs.org/hortsci/downloadpdf/journals/hortsci/53/7/article-p946.xml
Interrelationships between Seed Yield and 16 Related Traits of 81 ...,https://journals.ashs.org/hortsci/view/journals/hortsci/53/7/article-p946.xml
"Mechanism and Regulation of Silique Dehiscence, Which Affects Oil ...",https://journals.scholarsportal.info/details/1664462x/v11inone/nfp_marosdwaosp.xml
Notes on the generic position of Brassica deserti (Brassicaceae) - Brill,https://brill.com/downloadpdf/journals/ijps/66/1-2/article-p89_89.xml
[PDF] the initial analysis of the ability for the generative - Sciendo,https://sciendo.com/downloadpdf/journals/johr/21/2/article-p109.xml
Abstract - bioRxiv,https://www.biorxiv.org/content/biorxiv/early/2019/05/12/634550.source.xml
biorxiv BIORXIV bioRxiv bioRxiv Cold Spring Harbor Laboratory ...,https://www.biorxiv.org/content/biorxiv/early/2019/03/16/579714.source.xml
"Differential expression of PRLIPs, a pathogenesis-related gene ...",https://akjournals.com/view/journals/018/61/10001/article-p156.xml
2017-01-20T07:30:21Z 2018-04-26T03:48:27Z Petits ARN non ...,http://www.theses.fr/2016STRAJ104.xml
