Acta Biologica Hungarica Volume 52 Issue 4 (2005) - AKJournals,https://akjournals.com/view/journals/018/52/4/article-p457.xml
Localization of a Cuticular Protein During the Postembryonal ...,https://journals.scholarsportal.info/details/02365383/v52i0004/457_loacpdtpdoms.xml
[PDF] Function and Evolution of Nuclear Receptors in Environmental ...,https://journals.scholarsportal.info/pdf/2296634x/v9inone/nfp_faeonriepd.xml
Disseminated Cysticercosis due to Intentional Ingestion of Parasitic ...,https://www.ajtmh.org/view/journals/tpmd/106/2/article-p710.xml
Untitled,https://www.biorxiv.org/content/biorxiv/early/2020/10/02/2020.09.30.320200.source.xml
Untitled,https://www.biorxiv.org/content/biorxiv/early/2022/03/11/2022.03.10.483888.source.xml
EARLY POST-EMBRYONIC DEVELOPMENT OF MARINE ... - Brill,https://brill.com/previewpdf/journals/cr/84/7/article-p869_6.xml%3FpdfJsInlineViewToken%3D1592558945%26inlineView%3Dtrue
PRESENCE OF ABDOMINAL APPENDAGES IN FEMALES OF ... - Brill,https://brill.com/downloadpdf/journals/cr/85/1/article-p71_5.xml
"New species of Homidia (Collembola, Entomobryidae ... - Europe PMC",https://europepmc.org/articles/pmc3234423/bin/zookeys.152.1455-treatment1.xml
