Chapter 5 The Grammar of Baal's Epithets in - Brill,https://brill.com/view/book/edcoll/9789004437678/BP000016.xml
Divine Epithets in the Ugaritic Alphabetic Texts - Brill,https://brill.com/view/book/9789047423003/Bej.9789004157699.i-450_002.xml
"Abraham, compared to Agamemnon, 127 Achaeans, 116; in epithet ...",https://www.degruyter.com/chicago/downloadpdf/book/9780226137995/10.7208/9780226137995-016.xml
SAGE Reference - Multicultural America: A Multimedia Encyclopedia,https://sk.sagepub.com/reference/multicultural-america/n297.xml
A NEW IMPERIAL EPITHET OF THE COHORS VII BREUCORUM,https://akjournals.com/downloadpdf/journals/072/56/1-3/article-p245.xml
"OVID, Metamorphoses, Volume II | Loeb Classical Library",https://www.loebclassics.com/view/LCL043/1916/pb_LCL043.497.xml
"OVID, Metamorphoses, Volume II | Loeb Classical Library",https://www.loebclassics.com/view/LCL043/1916/pb_LCL043.477.xml
International Registration of Cultivar Names for Unassigned Woody ...,https://journals.ashs.org/hortsci/view/journals/hortsci/53/8/article-p1232.xml
dwc.xml,https://tdwg.github.io/tapir/cs/dwc/1.0/model/dwc.xml
