Becoming Fosters - Buzzsprout,https://feeds.buzzsprout.com/264862.rss
Fosters needed for displaced dogs - Toledo Blade,https://www.toledoblade.com/local/2018/09/11/Fosters-needed-for-displaced-dogs/stories/feed/feed/index.rss
Fosters needed for displaced dogs | The Blade,https://www.toledoblade.com/local/2018/09/11/Fosters-needed-for-displaced-dogs/stories/feed/index.rss
"Devotion - Adult Foster Care, Senior Living, Health Care",https://devotion.secureserversites.net/f.rss
From the Newsroom: Seacoastonline - Fosters.com,https://www.omnycontent.com/d/playlist/a858b0a5-e5e6-4a14-9717-a70b010facc1/a103bfb2-2de8-474b-a711-a70d0129bcfe/31aa14f4-6ca0-4db9-84b8-a70d012af91a/podcast.rss
Passports for Czech children in foster care or adopted in the United ...,https://www.mzv.cz/london/en/visa_and_consular_information/consular_information/passports_for_czech_children_in_foster/index%241325.rss%3Faction%3DsetMonth%26year%3D2021%26month%3D10%26day%3D1
ENR Critical Path Podcast,https://www.enr.com/media/podcasts/781-enr-critical-path-podcast.rss
https://talk.collegeconfidential.com/t/fosters-sch...,https://talk.collegeconfidential.com/t/fosters-school-of-business-at-uw/1176228.rss
"Step Change Podcast with Mike Foster, The Entrepreneurs Mentor",https://pod.link/step-change-podcast.rss
