[PDF] Luteolin supplements: All that glitters is not gold - The Mast Cell Master,https://www.mastcellmaster.com/documents/2021-01/Luteolin-supplements-All-that-glitters-is-not-gold-Biofactors-2020.pdf
Luteolin as a modulator of skin aging and inflammation,https://iubmb.onlinelibrary.wiley.com/doi/pdf/10.1002/biof.1699
[PDF] Therapeutic Potential of Luteolin on Impaired Wound Healing in ...,https://www.mdpi.com/2227-9059/9/7/761/pdf
[PDF] Anti-Inflammatory and Active Biological Properties of the Plant ...,https://www.mdpi.com/2072-6643/14/6/1155/pdf%3Fversion%3D1646823674
"Flavonoid (Myricetin, Quercetin, Kaempferol, Luteolin, and Apigenin ...",https://pubs.acs.org/doi/pdf/10.1021/jf000892m
[PDF] Flavonoid Content of Vegetables - USDA ARS,https://www.ars.usda.gov/ARSUserFiles/80400525/Articles/AICR03_VegFlav.pdf
Total synthesis of luteolin - SAGE Journals,https://journals.sagepub.com/doi/pdf/10.3184/174751914X13867643876192
Pharmacokinetics of Luteolin and Metabolites in Rats - SAGE Journals,https://journals.sagepub.com/doi/pdf/10.1177/1934578X0800301218
Luteolin Inhibits an Endotoxin-Stimulated Phosphorylation Cascade ...,https://jpet.aspetjournals.org/content/jpet/296/1/181.full.pdf
Luteolin induces apoptotic cell death via antioxidant activity in ...,https://www.spandidos-publications.com/10.3892/ijo.2017.4091/download
[PDF] Luteolin - PRODUCT INFORMATION,https://www.caymanchem.com/pdfs/10004161.pdf
"[PDF] Luteolin, quercetin, genistein and quercetagetin inhibit the effects of ...",https://cmbl.biomedcentral.com/track/pdf/10.1186/s11658-017-0047-z.pdf
Luteolin Inhibits Protein Kinase Cε and c-Src Activities and UVB ...,http://cancerres.aacrjournals.org/content/70/6/2415.full-text.pdf
[PDF] Chrysoeriol and Luteolin Released from Alfalfa Seeds Induce nod ...,https://www.ncbi.nlm.nih.gov/pmc/articles/PMC1062256/pdf/plntphys00674-0130.pdf
Luteolin and sorafenib combination kills human hepatocellular ...,https://www.spandidos-publications.com/10.3892/ol.2018.8640/download
Food-Derived Compounds Apigenin and Luteolin Modulate mRNA ...,https://www.cell.com/iscience/pdf/S2589-0042(19)30483-3.pdf
Luteolin as an Anti-inflammatory and Anti-allergic Constituent of ...,https://www.jstage.jst.go.jp/article/bpb/25/9/25_9_1197/_pdf
ALSUntangled No. 10: Luteolin and Lutimax,https://www.tandfonline.com/doi/pdf/10.3109/17482968.2011.578872
"Dietary flavonoids, quercetin, luteolin and genistein, reduce ...",https://www.sciencedirect.com/science/article/pii/S0304383597002619/pdf%3Fmd5%3D295eb2f2097378f798092e3f14a34393%26pid%3D1-s2.0-S0304383597002619-main.pdf
A Practical and Efficient Conversion of Luteolin into Luteoloside,https://www.thieme-connect.com/products/ejournals/pdf/10.1055/a-1531-2385.pdf
"A Plant Flavone, Luteolin, Induces Expression of <italic ... - Science",https://www.science.org/doi/pdf/10.1126/science.3738520
[PDF] Luteolin: a novel approach to attenuating the glaucoma via ...,https://e-century.us/files/ijcep/10/5/ijcep0040610.pdf
Dietary luteolin activates browning and thermogenesis in mice ...,https://www.nature.com/articles/ijo2016108.pdf%3Forigin%3Dppub
"[PDF] Flavones (Apigenin, Luteolin, Chrysin) and Their Importance for Health",https://dergipark.org.tr/tr/download/article-file/1176138
[PDF] Luteolin and luteolin-7-O-glucoside inhibit lipopolysaccharide ...,https://www.e-nrp.org/Synapse/Data/PDFData/0161NRP/nrp-7-423.pdf
"A Novel Immunosuppressant, Luteolin, Modulates Alloimmunity and ...",https://www.jimmunol.org/content/early/2019/11/14/jimmunol.1900612.full.pdf%3Fwith-ds%3Dyes
Biological Activity of Luteolin Glycosides and Tricin from Sasa ...,https://iv.iiarjournals.org/content/invivo/25/5/757.full-text.pdf
Luteolin reduces IL-6 production in microglia by inhibiting JNK ...,https://www.pnas.org/content/105/21/7534.full.pdf
[PDF] Therapeutic Effect Of Luteolin Natural Extract Versus - Clinical Trials,https://clinicaltrials.gov/ProvidedDocs/98/NCT03288298/Prot_SAP_000.pdf
The small molecule luteolin inhibits N-acetyl,https://www.jbc.org/article/S0021-9258(20)32696-X/pdf
