Legal Insights - Eversheds Sutherland(US) LLP,https://us.eversheds-sutherland.com/rss.rss%3FfeedName%3DMultimediaAudio%26filter%3DPodcast
Publications & Resources | Legal Momentum,https://www.legalmomentum.org/materials/rss2_0/stories.rss%3Fbody_value%3D%26field_tags_tid_1%3D%26page%3D28
Hired: A Legal Career Podcast - Wake Forest Law,https://law.wfu.edu/podcasts/hired/rss/hired.rss
Legal Services | Consulate General of the Czech Republic in New ...,https://www.mzv.cz/consulate.newyork/en/trade_and_economy/legal_services_1/index.rss
"legal assistance, inheritance, searching for relatives ... - MZV",https://www.mzv.cz/losangeles/en/consular_information/legal_assistance_inheritance_searching/index.rss
Compliance & Legal Risk - Buzzsprout,https://feeds.buzzsprout.com/1737484.rss
The Legal Community Podcast - Buzzsprout,https://feeds.buzzsprout.com/1762284.rss
Legal AF by MeidasTouch - Megaphone,https://pod.link/1580828595.rss
Here's How the Legal Battle Between Donald Sterling and the NBA ...,https://www.businessinsider.com/heres-the-biggest-legal-weapon-the-nba-can-use-against-donald-sterling-2014-5/comments.rss
