F8 | The Photographers Perspective - Audioboom,https://audioboom.com/channels/4994051.rss
Sony Alpha Photographers - Libsyn,https://feeds.buzzsprout.com/942601.rss
Is photography career is good for girls?,http://www.counselling.meracareerguide.com/t/is-photography-career-is-good-for-girls/2617.rss
Do I need to be good at my interpersonal skills to be a Photographer?,http://www.counselling.meracareerguide.com/t/do-i-need-to-be-good-at-my-interpersonal-skills-to-be-a-photographer/4316.rss
Studio photographers say home scanners hurt their livelihoods | The ...,https://www.toledoblade.com/local/2005/01/11/Studio-photographers-say-home-scanners-hurt-their-livelihoods/stories/feed/index.rss
Blade photographers win multiple ONPA awards | The Blade,https://www.toledoblade.com/local/2018/04/16/Blade-photographers-win-multiple-awards/stories/feed/index.rss
"Josip Pelikan (1885-1977), Slovenian photographer of Czech origin ...",https://www.mzv.cz/ljubljana/en/czech_traces_in_slovenia/josip_pelikan_1885_1977_slovenian.rss
So you want to be a photographer - Omny Studio,https://www.omnycontent.com/d/playlist/6f39ce8c-a11f-4ae5-a3fe-a74d0051beeb/04f049e8-0823-4bca-beb9-a74d00651140/97241c8e-f511-440d-aa52-a74d0065114a/podcast.rss
Search Results | VolcanoDiscovery,https://www.volcanodiscovery.com/nachrichten.rss
