Kinetic Energy Transfers between Mesoscale and Submesoscale ...,https://journals.ametsoc.org/view/journals/phoc/52/1/JPO-D-21-0099.1.xml
Dynamics of the Layered Circulation Inferred from Kinetic Energy ...,https://journals.ametsoc.org/view/journals/phoc/51/5/JPO-D-20-0226.1.xml
Kinematic Correlates of Kinetic Outcomes Associated With Running ...,https://journals.humankinetics.com/view/journals/jab/35/2/article-p123.xml
[PDF] Kinetic modeling of 68Ga-PSMA-11 and validation of simplified ...,https://journals.scholarsportal.info/pdf/2191219x/v10inone/nfp_kmo6avqippcp.xml
An overview of computational methods for chemical equilibrium and ...,https://journals.scholarsportal.info/pdf/00334545/v89i0005/597_aoocmffgartm.xml
Kinematic and kinetic analyses of the gait of horses wearing novel ...,https://avmajournals.avma.org/view/journals/ajvr/82/1/ajvr.82.1.48.xml
"kinetic study of NMC-A β-lactamase, an Ambler class A ...",https://femsle.oxfordjournals.org/content/143/1/29.ref-stubs.xml
KINETIC CONDITION AND THE GIBBS FUNCTION - Project Euclid,https://projecteuclid.org/journals/taiwanese-journal-of-mathematics/volume-4/issue-1/KINETIC-CONDITION-AND-THE-GIBBS-FUNCTION/10.11650/twjm/1500407200.xml
Foot Kinetic and Kinematic Profile in Type 2 Diabetes Mellitus with ...,https://japmaonline.org/view/journals/apms/109/1/17-059.xml
