Left or Right: Whose Side Is History On?,https://www.calgarymonitor.com/news/258088644/oct04v40.flv
Russian Minority Party Wins Latvian Vote; Populists Surge,https://www.kenyastar.com/news/258095706/oct04v56.flv
BBC Radio 4 Appeal - Global Witness,https://www.globalwitness.org/sites/default/files/import/radio4appeal_hi.flv
Guatemalans Protest Against Pressure on Anti-graft Body,https://www.santabarbarapost.com/news/257972291/oct04v40.flv
"Russia-Friendly Party, Populists Top Latvian Elections - Radio Free ...",https://www.malaysiasun.com/news/258094343/oct04v56.flv
North Korea Ridicules UN Chief's Presidential Ambitions,https://www.northkoreatimes.com/news/250400683/oct04v56.flv
Istanbul police detain 8 suspects over nightclub attack - News24,https://www.irishsun.com/news/250608455/feb24v21.flv
"Russia, Saudi Arabia 'Quietly' Agree To Lift Oil Production",https://www.illinoisintelligencer.com/news/258080967/oct04v40.flv
New UN Rights Chief Voices Concern About Abuses Worldwide,https://www.beijingbulletin.com/news/257959534/feb24v21.flv
