Postoperative Care of Suture Wounds after Punch Biopsy,https://www.umc.edu/Healthcare/ENT/Patient-Handouts/Adult/PSCSC/Punch_Biopsy.xml
"A review of the management of single-suture craniosynostosis, past ...",https://thejns.org/pediatrics/view/journals/j-neurosurg-pediatr/24/6/article-p622.xml
Fusion patterns of major calvarial sutures on volume-rendered CT ...,https://thejns.org/pediatrics/view/journals/j-neurosurg-pediatr/25/5/article-p519.xml
Evaluation of a continuous locking novel epitendinous suture pattern ...,https://avmajournals.avma.org/view/journals/ajvr/82/4/ajvr.82.4.302.xml
Comparison of three purse-string suture techniques for prevention of ...,https://avmajournals.avma.org/view/journals/ajvr/83/3/ajvr.21.03.0050.xml
Strength of Braided Polyblend Polyethylene Sutures versus Braided ...,https://japmaonline.org/view/journals/apms/100/3/1000185.xml
Variation in Ontogenetic Facial Suture Fusion Patterns in ... - Brill,https://brill.com/view/journals/ijfp/92/5-6/article-p276_4.xml
Lasers: The Future of Suture | SPIE Membership,https://spie.org/x41087.xml
Pecan Nut Suture Splits Are Positively Related to Kernel Moisture ...,https://journals.ashs.org/horttech/view/journals/horttech/24/2/article-p238.xml
