Iconic Planning Distresses: From Archistars' Projects to Public Art ...,https://brill.com/abstract/book/edcoll/9781848881037/BP000012.xml
Pavement distress detection using terrestrial laser scanning point ...,https://journals.scholarsportal.info/details/26673932/v3icomplete/nfp_pddutlcaeaac.xml
[PDF] s40337-021-00405-9.pdf - Journal of Eating Disorders,https://journals.scholarsportal.info/pdf/20502974/v9inone/nfp_pdaafodtcd2p.xml
"PHILO, On Rewards and Punishments | Loeb Classical Library",https://www.loebclassics.com/view/philo_judaeus-rewards_punishments/1939/pb_LCL341.387.xml%3Fresult%3D137%26rskey%3DuKYI2w%26readMode%3Drecto
MPE Mathematical Problems in Engineering 1563-5147 1024-123X ...,http://downloads.hindawi.com/journals/mpe/2019/7910752.xml
Front Matter in: IMF Working Papers Volume 2016 Issue 253 (2016),https://www.elibrary.imf.org/view/journals/001/2016/253/article-A000-en.xml
Lost and Found in: IMF Working Papers Volume 2016 Issue 253 ...,https://www.elibrary.imf.org/view/journals/001/2016/253/article-A001-en.xml
Pavement Condition Index (PCI) Survey Procedure,https://www.codot.gov/content/programs/aeronautics/PCI/data/pci_procedure/__pci_procedure_index.xml
recast-jats-build e082d6219a bmjgh BMJ Global Health bmjgh BMJ ...,https://gh.bmj.com/content/5/7/e002304.download.xml
