sitemap.xml - Wood Stain & Finish Supply Center,http://www.wood-deck-stain-finishes.com/sitemap.xml
"Boys Basketball: Josh Preston, Geneva inside game finishes off ...",http://www.mysuburbanlife.com/articles/2019/12/06/7661356f580642b3993ff1c581a0106c/index.xml
Pset_ConcreteElementSurfaceFi...,https://standards.buildingsmart.org/IFC/RELEASE/IFC2x3/TC1/HTML/psd/IfcStructuralElementsDomain/Pset_ConcreteElementSurfaceFinishQuantityGeneral.xml
An Effect of Washing on Durability of Hydrophobic Finishes of ...,http://www.degruyter.com/view/j/aut.2018.18.issue-2/aut-2017-0028/aut-2017-0028.xml
UW-Whitewater finishes sixth in Directors' Cup standing,https://www.uww.edu/x2125.xml
ABC: 30 1-2-3 finishes lead Lady Pirates to 2nd - Shaw Local,http://www.mywebtimes.com/articles/2018/04/14/c87c3a6dd1e14fe695bce880fcbd7dd4/index.xml
AUTO BIOGRAPHY: Eplin finishes his 'something different',https://www.mywebtimes.com/articles/2018/06/26/86784107c01d448d87a7129a806a0fe5/index.xml
Fulton senior Pannell finishes dominant run through state with title,http://www.saukvalley.com/articles/2019/02/17/bc6a5b2da9384a6fb29ab090bed37103/index.xml
"Boys basketball: Gazette starts strong, finishes stronger in Classic win",https://www.saukvalley.com/articles/2014/06/20/39dfe7a71a3d46269f915da7b7a2bc03/index.xml
