Untitled,https://minio.la.utexas.edu/colaweb-prod/profile/custom_pages/0/119/indian_folk_traditions_and_the_modern_th_ea595889-23ff-42e8-b4e6-0640896eeacc.flv
"Russia, Saudi Arabia 'Quietly' Agree To Lift Oil Production",https://www.illinoisintelligencer.com/news/258080967/oct04v40.flv
EU Lays Out Accession Path For Balkan Countries,https://www.dublinnews.com/news/256383024/oct04v40.flv
"Troubled with pollution, Indian capital bans fireworks - Nigeria Sun",https://www.santabarbarapost.com/news/254975325/oct04v40.flv
Adda52 announces Chris Gayle as brand ambassador,https://www.bangladeshsun.com/news/257794938/oct04v56.flv
Jimi Hendrix Sets Guitar On Fire at Monterey Pop Festival 1967 ...,https://sonichits.com/video/Bali_Hai/Jimi_Hendrix_Sets_Guitar_On_Fire_at_Monterey_Pop_Festival_1967_-_YouTube.flv
