Czech Chairmanship at the CoE Website,https://www.mzv.cz/coe.strasbourg/en/chairmanship_2017/index.rss
The Generation Why Podcast - Art19.com,https://pod.link/541481026.rss
WSIS TalkX (World Summit on the Information Society Conversations),https://feeds.buzzsprout.com/861820.rss
The Remote Pathways Podcast - Buzzsprout,https://feeds.buzzsprout.com/705708.rss
Latest Brussels Podcast Episodes - Pod.casts,https://pod.casts.io/topics/brussels/new-episodes.rss
Robins on the Wire - Global,https://audioboom.com/channels/4930804.rss
News - Zentrum für Afrikastudien Basel,https://zasb.unibas.ch/de/news/587/feed.rss
