LOOMING AND MULTIPLE HORIZONS in: Monthly Weather Review ...,https://journals.ametsoc.org/view/journals/mwre/53/7/1520-0493_1925_53_313b_lamh_2_0_co_2.xml
A STRIKING CASE OF LOOMING OVER THE SEA in - AMS Journals,https://journals.ametsoc.org/view/journals/bams/7/8-9/1520-0477-7_8-9_109.xml
A Looming Crisis in Health-Care Finance–and the Emergence of ...,https://journals.humankinetics.com/view/journals/ijatt/8/1/article-p1.xml
Auditory Motion in Depth is Preferentially 'Captured' by Visual ... - Brill,https://brill.com/view/journals/sp/25/1/article-p71_5.xml%3Flanguage%3Den
Five Nobel Prize winners discuss what they each see as the biggest ...,https://www.elibrary.imf.org/view/journals/022/0051/003/article-A005-en.xml
Looming ahead: Five Nobel Prize winners discuss what they each ...,https://www.elibrary.imf.org/abstract/journals/022/0051/003/article-A005-en.xml
Is the Battle Over Bevacizumab Coverage Looming? in - JNCCN,https://jnccn.org/view/journals/jnccn/9/3/article-p261.xml
Javascript must be enabled for the correct page display Skip to main ...,https://sk.sagepub.com/navigator/water-security/n6.xml
The Looming Central and Eastern European Real Convergence ...,http://www.degruyter.com/view/j/danb.2019.10.issue-1/danb-2019-0004/danb-2019-0004.xml
