Academic Colleagueship and Teaching - jstor,https://www.jstor.org/stable/4611515
Wanted: Colleagueship in Nursing - JStor,https://www.jstor.org/stable/26805368
"[PDF] What is colleagueship, actually? – A look at 25 years of research",https://research.utu.fi/converis/getfile%3Fid%3D44200875%26portal%3Dtrue
Colleagueship in different types of post-secondary institutions,http://www.tandfonline.com/doi/pdf/10.1080/03075079.2016.1255938
Problems of colleagueship for women entering the medical profession,https://link.springer.com/content/pdf/10.1007/BF00290041.pdf
"[PDF] Promoting Partnership, Cultivating Colleagueship: The SUMMIT-P ...",https://scholarscompass.vcu.edu/cgi/viewcontent.cgi%3Farticle%3D1380%26context%3Djmsce_vamsc
[PDF] Mathematics teacher educators' critical colleagueship,https://hal.archives-ouvertes.fr/hal-02422559/document
Collaboration for Colleagueship: - ASCD,https://www.ascd.org/ASCD/pdf/journals/ed_lead/el_198602_nelson.pdf
Shifting the Conversation around Teaching Sensitive Topics,https://ila.onlinelibrary.wiley.com/doi/pdf/10.1002/jaal.1186
The use of faculty policy teams for advancing policy advocacy and ...,https://onlinelibrary.wiley.com/doi/pdf/10.1111/nuf.12473
