[PDF] Anatomy and Physiology of the Skin,https://www.ons.org/sites/default/files/publication_pdfs/1%2520SS%2520Skin%2520Cancer_chapter%25201.pdf
Structure and function of the epidermal barrier,https://www.ajicjournal.org/article/S0196-6553(06)00950-3/pdf
Epidermal structure and differentiation,https://www.cell.com/current-biology/pdf/S0960-9822(20)30004-X.pdf
Epidermis: the formation and functions of a fundamental plant tissue,https://nph.onlinelibrary.wiley.com/doi/pdf/10.1111/j.1469-8137.2010.03514.x
[PDF] Variation in Epidermal Morphology in Human Skin at Different Body ...,https://www.medicaljournals.se/acta/download/10.2340/00015555-0875/
Epidermis,https://link.springer.com/content/pdf/10.1007%252F978-3-319-77315-5_9.pdf
The differentiation of epidermis,https://journals.biologists.com/dev/article-pdf/17/1/107/1571990/17-1-107.pdf
[PDF] Effects of Epidermal Cell Shape and Pigmentation on Optical ... - NCBI,https://www.ncbi.nlm.nih.gov/pmc/articles/PMC158014/pdf/1120879.pdf
Examination of the Epidermis by the Strip Method - ScienceDirect.com,https://www.sciencedirect.com/science/article/pii/S0022202X1548371X/pdf%3Fmd5%3Dcb4c7e8699be35c30e0c44db22e701b3%26pid%3D1-s2.0-S0022202X1548371X-main.pdf
The innervation of human epidermis - ScienceDirect.com,https://www.sciencedirect.com/science/article/pii/0022510X9390223L/pdf%3Fmd5%3D396444278fba7c70ccc2b9c7d00dab56%26pid%3D1-s2.0-0022510X9390223L-main.pdf%26_valck%3D1
