"Chronic Myeloid Leukemia, Version 2.2021, NCCN Clinical Practice ...",https://jnccn.org/view/journals/jnccn/18/10/article-p1385.xml
Taking the chronic out of enteropathies - AVMA Journals,https://avmajournals.avma.org/view/post/news/taking-the-chronic-out-of-enteropathies.xml
Chronic Pain: Causes and Care Plans - My Doctor Online,https://mydoctor.kaiserpermanente.org/ncal/structured-content/Treatment_Treating_Chronic_Pain_with_Opioid_Therapy_-_Medicine.xml%3Fco%3D/regions/ncal
Chronic Headaches - My Doctor Online - Kaiser Permanente,https://mydoctor.kaiserpermanente.org/ncal/structured-content/Condition_Chronic_Headaches.xml%3Fco%3D/regions/ncal
Patients with chronic autoimmune thyroiditis are not at higher risk for ...,https://eje.bioscientifica.com/view/journals/eje/183/3/EJE-20-0350.xml
Acute and chronic leptin reduces food intake and body weight in ...,https://joe.bioscientifica.com/view/journals/joe/188/3/1880513.xml
Chronic Obstructive Pulmonary Disease (COPD) - UI Health,https://hospital.illinois.edu/x3219.xml
Chronic gastrointestinal inflammation | Pathogens and Disease,https://femsim.oxfordjournals.org/content/24/2/161.source.xml
Global Public Health Guidelines on Physical Activity and Sedentary ...,https://journals.humankinetics.com/view/journals/jpah/18/1/article-p76.xml
