Resisting McDonaldization - SAGE Books,https://sk.sagepub.com/books/resisting-mcdonaldization/n4.xml
Transfers] Interplaced Mobility in the Age of “Digital Gestell”.pdf,https://www.berghahnjournals.com/pdfviewer/full/journals/transfers/7/1/trans070102.xml%3Fbg%3DGREY_COLOR_LIGHT_VARIANT%26mgs%3DPRIMARY_COLOR%26mge%3DPRIMART_COLOR_DARK_VARIANT
Interplaced Mobility in the Age of “Digital Gestell” in - Berghahn ...,https://www.berghahnjournals.com/abstract/journals/transfers/7/1/trans070102.xml
The Subversive Plasticity of Posthuman Womanhood in the ... - Brill,https://brill.com/downloadpdf/book/9781848881631/BP000018.xml
RECONSIDERING EDUCATIONAL LEADERSHIP AS ... - Brill,https://brill.com/previewpdf/book/9789462094765/BP000010.xml
Global bioethical challenges of medicalising psychedelics,https://akjournals.com/downloadpdf/journals/2054/aop/article-10.1556-2054.2021.00188/article-10.1556-2054.2021.00188.xml
Global bioethical challenges of medicalising psychedelics in,https://akjournals.com/view/journals/2054/5/2/article-p57.xml
Decentred Sensemaking in the Meshwork of Life - Scholars Portal ...,https://journals.scholarsportal.info/details/01708406/v40i0005/745_otmosisitmol.xml
Discrepancies between Different Northern Hemisphere Summer ...,https://journals.ametsoc.org/view/journals/clim/19/7/jcli3643.1.xml
