Partiality and Weighing Harm to Non-Combatants - Brill,https://brill.com/downloadpdf/journals/jmp/6/3/article-p298_3.xml
The Reintegration of Aceh's Female Ex-combatants in - Brill,https://brill.com/view/book/9789004498471/BP000003.xml%3Flanguage%3Den
Lawful combatants in: The contemporary law of armed conflict,https://www.manchesterhive.com/view/9781526130907/9781526130907.00014.xml
Diverse wars and combatants in: Living politics after war,https://www.manchesterhive.com/view/9781526144904/9781526144904.00006.xml
"Seeking Recognition, Becoming Citizens in - Berghahn Journals",https://www.berghahnjournals.com/view/journals/conflict-and-society/5/1/arcs050111.xml
Untitled,https://www.govinfo.gov/content/pkg/BILLS-107hr5684ih/xml/BILLS-107hr5684ih.xml
SAGE Reference - Encyclopedia of Prisons & Correctional Facilities,https://sk.sagepub.com/Reference/prisons/n111.xml%3FPageNum%3D289
Passing and Identity Among Ex-Combatants in Colombia,https://journals.scholarsportal.info/details/10781919/v22i0001/52_tdbodpaiaeic.xml
Chapter 5: Protection of combatants hors de combat in - Elgaronline,https://www.elgaronline.com/view/9781781002728.00009.xml
