Zippy the Wonder Snail - OFB.biz,https://ofb.biz/safari/index.rss
#snail - Mastodon - tchncs.de,https://social.tchncs.de/tags/snail.rss
Nature Republic - Official USA | K-Beauty Skincare and Makeup,https://www.naturerepublicshop.com/index.rss
Airport comments for Tonga - OurAirports,https://ourairports.com/countries/TO/comments.rss
Turtle Island plan moving at a snail's pace - The Blade | Toledo's ...,https://www.toledoblade.com/frontpage/2004/05/07/Turtle-Island-plan-moving-at-a-snail-s-pace/stories/feed/index.rss
Storytime! Children's books - Spreaker,https://feeds.buzzsprout.com/1290398.rss
Looking California and Feeling Minnesota - Buzzsprout,https://feeds.buzzsprout.com/802871.rss
Real Life Law with Leeja Miller - Audioboom,https://audioboom.com/channels/5061780.rss
The Matador Revisionist History Podcast - Audioboom,https://audioboom.com/channels/5075989.rss
