COG907130: Dispensations - Wording of Dispensations and ...,https://www.bloomsburyprofessionalonline.com/view/compliance_operational_guidance/COG907130.xml
EIM30075: Dispensations: professional membership fees and ...,https://www.bloomsburyprofessionalonline.com/view/employment_income_manual/EIM30075.xml
The Uncertain Soteriology of the Scofield Reference Bible - Brill,https://brill.com/downloadpdf/journals/evqu/74/1/article-p3_1.xml
Classical Dispensationalism and the Eclipse of Biblical Eschatology ...,https://brill.com/downloadpdf/book/9789004397132/B9789004397132_s007.xml
recast-jats-build e082d6219a bmjopen BMJ Open bmjopen BMJ ...,https://bmjopen.bmj.com/content/9/11/e033599.download.xml
Objective - BMJ Open Diabetes Research & Care,https://drc.bmj.com/content/7/1/e000759.download.xml
gb109-f THE FACULTY OFFICE Lambeth Palace Library 03/10/2019 ...,https://archiveshub.jisc.ac.uk/files/lambeth/F.xml
A brief examination of Scripture testimony on the institution of ... - Loc,https://tile.loc.gov/storage-services/service/rbc/rbaapc/28100/28100.xml
[PDF] ORIGINAL RESEARCH Adherence to risk evaluation and mitigation ...,https://journals.scholarsportal.info/pdf/17451981/v4inone/nfp_atreamfmtolf.xml
