Study of the cervical plexus innervation of the trapezius muscle in,https://thejns.org/spine/view/journals/j-neurosurg-spine/14/5/article-p626.xml
Heuristic map of myotomal innervation in humans using direct ...,https://thejns.org/spine/view/journals/j-neurosurg-spine/15/1/article-p64.xml
"Structure, innervation, mechanical properties and reflex activation of ...",https://rep.bioscientifica.com/view/journals/rep/137/2/371.xml
Serotonergic innervation of the rat testis in - Reproduction,https://rep.bioscientifica.com/view/journals/rep/88/2/jrf_88_2_009.xml
Innervation Patterns of the Lumbrical Muscles of the Foot in Human ...,https://japmaonline.org/view/journals/apms/110/3/i8750-7315-110-3-article_8.xml
[PDF] Innervation Patterns of the Lumbrical Muscles of the Foot in Human ...,https://japmaonline.org/downloadpdf/journals/apms/110/3/i8750-7315-110-3-article_8.xml
Evaluation of innervation of the mitral valves and ... - AVMA Journals,https://avmajournals.avma.org/view/journals/ajvr/71/2/ajvr.71.2.194.xml
The Effects of Skill Level on EMG Activity during Internal and ...,https://journals.humankinetics.com/view/journals/jsep/8/2/article-p105.xml
Myocardial innervation imaging: MIBG in clinical practice in,https://akjournals.com/view/journals/1647/13/2/article-p87.xml
