"Condensin, Chromatin Crossbarring and Chromosome Condensation",https://www.cell.com/current-biology/pdf/S0960-9822(12)01208-0.pdf
[PDF] leowlpdf.pdf - CT.gov,https://portal.ct.gov/-/media/DEEP/wildlife/pdf_files/outreach/fact_sheets/leowlpdf.pdf
[PDF] About some Benefits of a Crossbearing TMA (XTMA) - EMIS,https://subs.emis.de/LNI/Proceedings/Proceedings110/gi-proc-110-019.pdf
"adults to the adult plumage of C. ruficollis, the cross-barring",https://onlinelibrary.wiley.com/doi/pdf/10.1111/j.1474-919X.1882.tb07435.x
[PDF] Sharp-shinned Hawk - Introduction Description,https://www.hww.ca/assets/pdfs/factsheets/sharp-shinned-hawk-EN.pdf
The Status of Eleutherodactylus pinarensis and a New Species of ...,https://www.jstor.org/stable/3889416
The Geographical Distribution and Constancy of the semifasciata ...,https://www.jstor.org/stable/3889929
Condensin targets and reduces unwound DNA structures ... - Nature,https://www.nature.com/articles/ncomms8815.pdf%3Forigin%3Dppub
Real-time imaging of DNA loop extrusion by condensin - Science,https://www.science.org/cms/asset/7c4622eb-7771-4576-ad78-92534080e68c/pap.pdf
