Google TechTalks - YouTube,https://m.youtube.com/user/GoogleTechTalks/talks/54665/edited/1551_0001.flv
British Mining Venture Signs Exploration Deal in Afghanistan,https://www.cardiffstar.com/news/258088814/oct04v40.flv
Tyler Z (@tyler.flv) TikTok | Watch Tyler Z's Newest TikTok Videos,https://www.tiktok.com/%40tyler.flv
mr robot eps1.6_v1ew-s0urce.flv | Explore Tumblr Posts and Blogs,https://www.tumgir.com/tag/mr%2520robot%25C2%25A0eps1.6_v1ew-s0urce.flv
Browse Videos | MDX,http://mdx2.plm.automation.siemens.com/video/5.flv%3Fpage%3D6%252C7
Our Work | Intrigue Development,https://www.intriguedevelopment.com/our-work/Final_2.flv
"February 10, 2022, Illinois Autism Task Force Meeting - DHS",https://www.dhs.state.il.us/page.aspx/FACT_1WhatIsVR.flv%3Fitem%3D141237%26newssidebar%3D27897%26postdate%3D4/7/2021
Newest 'flv' Questions - Stack Overflow,https://stackoverflow.com/questions/tagged/.flv
World Tourism Day: harnessing new technologies to transform travel,https://www.northkoreatimes.com/news/258052055/oct04v56.flv
AP Source: Mueller OK with Some Written Responses from Trump,https://www.irishsun.com/news/257943324/oct04v56.flv
