Dinner Tonight: Chickpea Tabbouleh | The Blade,https://www.toledoblade.com/Dinner-Tonight/2014/06/16/Dinner-Tonight-Chickpea-Tabbouleh/stories/feed/index.rss
Dinner Tonight: Baked Quinoa with Roasted Kale and Chickpeas ...,https://www.toledoblade.com/A-E/Dinner-Tonight/2014/09/17/Dinner-Tonight-Baked-Quinoa-with-Roasted-Kale-and-Chickpeas-1/stories/feed/index.rss
Untitled,https://tamil.webdunia.com/rss/miscellaneous-and-others-104.rss
UNSEEN: The Trafficked Truth Podcast - Buzzsprout,https://feeds.buzzsprout.com/1247483.rss
The Little Ferraro Kitchen - Buzzsprout,https://feeds.buzzsprout.com/1045927.rss
The blind vegan - Pod.casts,https://pod.casts.io/podcasts/cooking-with-chenelle-the-visually-impaired-way.rss
Tommy's Brownload - Audioboom,https://audioboom.com/channels/4981355.rss
Czech healthy food products score high in Mongolia - MZV,https://www.mzv.cz/ulaanbaatar/en/business_and_trade/news_from_economic_section/ceske_vyrobky_v_oblasti_zdrave_vyzivy.rss
Meatless: A Podcast About Eating - Libsyn,https://pod.link/1392676509.rss
