How to Cook Chickpeas,http://cairo.lti.cs.cmu.edu/~hector/wikihow_xml/categorized/Food%2520and%2520Entertaining/Recipes/Rice%2520and%2520Beans/Cook-Chickpeas.html.xml
The history of chickpea cultivation and breeding in Israel in - Brill,https://brill.com/view/journals/ijps/65/3-4/article-p186_186.xml%3Flanguage%3Den
Chickpeas at a Shalom Zakhar in: Zutot - Ahead of print - Brill,https://brill.com/view/journals/zuto/aop/article-10.1163-18750214-bja10022/article-10.1163-18750214-bja10022.xml
Noctuidae) in Chickpea: Role of Oxalic Acid m Leaf Exudate as an ...,http://jee.oxfordjournals.org/content/88/6/1783.source.xml
"Preliminary results on evaluation of chickpea, Cicer arietinum ...",https://jinsectscience.oxfordjournals.org/content/9/1/58.ref-stubs.xml
Genome Size and Seed Mass Analyses in Cicer arietinum ...,https://journals.ashs.org/hortsci/view/journals/hortsci/50/12/article-p1751.xml
Gluten-Free Pasta: Replacing Wheat with Chickpea,https://journals.scholarsportal.info/details/15428052/v17i0001/1_gprwwc.xml
Incorporating sprouted chickpea flour in pasta increases brachial ...,https://akjournals.com/view/journals/2060/106/3/article-p207.xml
BROADLEAF WEED CONTROL IN CHICKPEAS (CICER ...,https://akjournals.com/downloadpdf/journals/014/51/4/article-p437.xml
