[PDF] Penumbral Reasoning on the Right,https://scholarship.law.upenn.edu/cgi/viewcontent.cgi%3Farticle%3D3696%26context%3Dpenn_law_review
The properties of penumbral microjets inclination,https://www.aanda.org/articles/aa/pdf/2008/35/aa10333-08.pdf
Structure of sunspot penumbral filaments - Astronomy & Astrophysics,https://www.aanda.org/articles/aa/pdf/2013/09/aa21391-13.pdf
THE ORIGIN OF PENUMBRAL STRUCTURE IN SUNSPOTS,http://iopscience.iop.org/article/10.1086/380091/pdf
Penumbral tissues salvaged by reperfusion following middle ...,https://www.ahajournals.org/doi/pdf/10.1161/01.STR.23.4.552%3Fdownload%3Dtrue
[PDF] Constitutional Sources of the Penumbral Right to Privacy,https://digitalcommons.law.villanova.edu/cgi/viewcontent.cgi%3Farticle%3D2046%26context%3Dvlr
Penumbral Effects on Sunlight Penetration in Plant Communities,https://www.jstor.org/stable/1938093
Penumbral Rock Communities in Campo Rupestre Sites in Brazil,https://www.jstor.org/stable/3235594
"Penumbral salvage and thrombolysis outcome: a drop of brain, a ...",https://academic.oup.com/brain/article-pdf/140/3/519/18245344/awx020.pdf
[PDF] Resolving hot spot microstructure using x-ray penumbral imaging ...,https://www.osti.gov/pages/servlets/purl/1466905
