Effects of high-frequency biphasic shocks on ventricular vulnerability ...,https://europepmc.org/articles/pmc7194403/bin/pone.0232529.s001.7z
Spectroscopic photoacoustic imaging of cervical tissue composition ...,https://europepmc.org/articles/pmc7928441/bin/pone.0247385.s001.7z
Flux-density measurements of some radio sources at 1-5 MM,https://adsabs.harvard.edu/full/1975SvAL....1....7Z
Rokenbok CD Vol 2.7z - Internet Archive,https://archive.org/details/rokenbok-cd-vol-2.7z
Download Com.neptune.domino.7z APK fyrir Android - APK4K,https://apk4k.fun/is/apps/Com.neptune.domino.7z
Unduh Com.neptune.domino.7z APK untuk Android - APK4K,https://apk4k.fun/id/apps/Com.neptune.domino.7z
Wrath of the Blood Ravens 2.4 - Warhammer 40000: Dawn of War II,https://gamefront.online/files/17451974/wrathofthebloodravens24.7z
Grand Theft Auto Mods - GTALand.net - GTA Mods,https://gtaland.net/wp-content/uploads/2020/04/1585141839_mercedes-benz-g63-amg-6x6_GTALand.net.7z
Browser Launch Page,http://175.96.49.175/login-redirect/test.7z
