"Owners of aging vehicles face long wait for parts, area techs say",https://www.toledoblade.com/Automotive/2002/10/10/Owners-of-aging-vehicles-face-long-wait-for-parts-area-techs-say/stories/feed/index.rss
Auto-parts retailer championed service - Toledo Blade,https://www.toledoblade.com/Deaths/2008/02/16/Auto-parts-retailer-championed-service/stories/feed/index.rss
Anthony Bourdain: Parts Unknown - Omny.fm,https://omny.fm/shows/anthony-bourdain-parts-unknown/playlists/podcast.rss
"JBs Powercast - Automotive industry news, Events, Performance ...",https://feeds.buzzsprout.com/819709.rss
JACK ARUTE'S WIND TUNNEL PRESENTED BY ADVANCE AUTO ...,https://feeds.buzzsprout.com/1554395.rss
Vintage TVs unltd: Vintage TVs & Television Parts and Accessories,http://vintagetvsunltd.com/popular.rss
Data Science Storytime - Heavybit,https://www.heavybit.com/category/library/podcasts/data-science-storytime/feed/feed.rss
Pressurised waterjet slices open car parts with extreme ease,https://www.businessinsider.com/pressurised-waterjet-slices-open-car-battery-alternator-bowling-ball-pumpkin-abrasive-2016-11/uk.rss
Temporary importation of firearms to the Czech Republic - MZV,https://www.mzv.cz/london/en/visa_and_consular_information/consular_information/temporary_importation_of_firearms_to_the/index%241325.rss%3Faction%3DsetMonth%26year%3D2022%26month%3D2%26day%3D1
