Anthrax in - AVMA Journals - American Veterinary Medical Association,https://avmajournals.avma.org/view/journals/javma/233/1/javma.233.1.63.xml
Review: The risk of contracting anthrax from spore-contaminated soil,https://akjournals.com/view/journals/1886/10/2/article-p29.xml
"Recurrent Anthrax Outbreaks in Humans, Livestock, and Wildlife in ...",https://www.ajtmh.org/view/journals/tpmd/99/4/article-p833.xml
A Case of Malignant Cutaneous Anthrax Localized to the Eyelid in,https://www.ajtmh.org/view/journals/tpmd/106/4/article-p995.xml
wcms-auto-sitemap.xml,https://www.cdc.gov/anthrax/wcms-auto-sitemap.xml
"A Huge Bacterial Bubble: Anthrax in Industry Origins, incidence and ...",https://brill.com/previewpdf/book/9789004333482/B9789004333482-s007.xml%3FpdfJsInlineViewToken%3D525694341%26inlineView%3Dtrue
A Huge Bacterial Bubble: Anthrax in Industry - Brill,https://brill.com/downloadpdf/book/9789004333482/B9789004333482-s007.xml
Anthrax - SAGE Reference - Encyclopedia of Terrorism,https://sk.sagepub.com/reference/terrorism/n36.xml
xml - GovInfo,https://www.govinfo.gov/bulkdata/BILLS/117/1/hres/BILLS-117hres726ih.xml
