"Bonaventure on Grace, Hierarchy, and the Symbol of Jacob's Ladder",https://brill.com/downloadpdf/book/edcoll/9789004341159/B9789004341159-s012.xml
Four ST. THOMAS AQUINAS AND THOMISM - Brill,https://brill.com/downloadpdf/book/9789401205221/B9789401205221-s005.xml
Ci Commence la Messe de Nostre Dame - Oxford History of Western ...,https://www.oxfordwesternmusic.com/view/Volume1/actrade-9780195384819-div1-009011.xml%3Fprint
treatise on sacred doctrine (q[1]) - Christian Classics Ethereal Library,https://www.ccel.org/ccel/a/aquinas/summa.xml
Chapter 5 Between the Mirror and the Face: Gregory of Nazianzus ...,https://www.schoeningh.de/view/book/9783657703487/BP000011.xml
https://www.aftermath-music.com/ daily https://www.aftermath-music ...,https://www.aftermath-music.com/sitemap_products_1.xml%3Ffrom%3D6761547169928%26to%3D6893977501832
AIRoboForm_PAD.xml,https://www.roboform.com/descr/AIRoboForm_PAD.xml
A discourse concerning the idolatry practised in the Church of Rome ...,https://ota.bodleian.ox.ac.uk/repository/xmlui/bitstream/handle/20.500.12024/A61540/A61540.xml%3Fsequence%3D7%26isAllowed%3Dy
Practical discourses upon several divine subjects written by John ...,https://ota.bodleian.ox.ac.uk/repository/xmlui/bitstream/handle/20.500.12024/A52426/A52426.xml%3Fsequence%3D7%26isAllowed%3Dy
