Cranioplasty using custom-made hydroxyapatite versus titanium,https://thejns.org/view/journals/j-neurosurg/126/1/article-p175.xml
Use of porous hydroxyapatite graft containing recombinant human ...,https://thejns.org/spine/view/journals/j-neurosurg-spine/90/2/article-p224.xml
Phosphorus Bioavailability and Migration of Hydroxyapatite in ...,https://journals.ashs.org/hortsci/view/journals/hortsci/56/9/article-p1112.xml
Calcium hydroxyapatite crystal deposition with intraosseous ...,https://journals.scholarsportal.info/details/09406719/v26inone_1/53_chcdwipuconp.xml
Bone regeneration in the presence of a synthetic hydroxyapatite ...,https://journals.scholarsportal.info/details/09057161/v22i0005/506_britpoaxhbsm.xml
Characterization and adhesion strength of porous electrosprayed ...,https://akjournals.com/view/journals/2051/3/2/article-p17.xml
Optimization of Hydroxyapatite Synthesis and Microplasma Spraying ...,https://www.degruyter.com/view/j/adms.2018.18.issue-3/adms-2017-0043/adms-2017-0043.xml
Evaluation of the biomedical properties of hydroxyapatite obtained ...,https://www.degruyter.com/view/j/pjct.2009.11.issue-1/v10026-009-0010-5/v10026-009-0010-5.xml
Hydroxyapatite as a bone substitute in - Journal of the American ...,https://japmaonline.org/view/journals/apms/89/8/87507315-89-8-392.xml
[PDF] Lower-Extremity Osteomyelitis Treatment Using Calcium Sulfate ...,https://japmaonline.org/downloadpdf/journals/apms/108/3/16-096.xml
