Chapter Five The Demarcation of Natural and Cultural Science in,https://brill.com/abstract/book/9789047409793/B9789047409793_s008.xml
From North-South to East-West: The Demarcation and Reunification ...,https://brill.com/view/journals/jmh/7/2/article-p111_111.xml
COLREGS Demarcation Lines - ArcGIS Online,https://www.arcgis.com/sharing/rest/content/items/eadd81d46a1642ee86d597201209cf92/info/metadata/metadata.xml%3Fformat%3Ddefault%26output%3Dhtml
Scientificity and The Law of Theory Demarcation | Scholars Portal ...,https://journals.scholarsportal.info/details/25609068/v2inone/55_satlotd.xml
Usefulness of Demarcation of Differentiated-Type Early Gastric ...,https://journals.scholarsportal.info/details/00122823/v98i0003/175_uododebmewni.xml
Value-based demarcation between the public and the private ...,https://www.elgaronline.com/view/edcoll/9781785369544/9781785369544.00007.xml
Untitled,https://www.govinfo.gov/content/pkg/BILLS-110s3017rs/xml/BILLS-110s3017rs.xml
Contents - De Gruyter,https://www.degruyter.com/chicago/view/book/9780226051826/10.7208/9780226051826-toc.xml
Lessons in Teaching Grammar in Primary Schools - SAGE Books,https://sk.sagepub.com/books/lessons-in-teaching-grammar-in-primary-schools/i204.xml
