"Seed Germination of Arbutus unedo, A. andrachne and Their ...",https://journals.ashs.org/hortsci/view/journals/hortsci/48/3/article-p347.xml
"Micropropagation of Texas Madrone, Arbutus xalapensis HBK in",https://journals.ashs.org/hortsci/view/journals/hortsci/31/6/article-p1028.xml
statement of changes in beneficial ownership - SEC FORM 4,https://www.sec.gov/Archives/edgar/data/0001447028/000144702821000064/xslF345X03/wf-form4_163671611466902.xml
Polyphenolic profile and biological properties of Arbutus unedo root ...,https://journals.scholarsportal.info/details/18763820/v42icomplete/nfp_ppabpoaure.xml
Relationship between markers of botanical origin in nectar and ...,https://journals.scholarsportal.info/details/00218839/v54i0004/342_rbmoboyaidga.xml
"[PDF] Diversity in phenolic compounds, biochemical and ... - Sciendo",https://sciendo.com/downloadpdf/journals/fhort/30/1/article-p139.xml
"Diversity in phenolic compounds, biochemical and pomological ...",https://www.degruyter.com/view/j/fhort.ahead-of-print/fhort-2018-0014/fhort-2018-0014.xml
E2zUOx3Y.xml - Arbutus Arts,http://www.arbutusarts.com/E2zUOx3Y.xml
"ModernaTX, Inc. v. Arbutus Biopharma Corporation - Govinfo.gov",https://www.govinfo.gov/metadata/pkg/USCOURTS-ca13-20-01184/mods.xml
