RBN Energy Blogcast,http://rbnenergy.com/blogcast.rss
The People and Place Podcast - Buzzsprout,https://feeds.buzzsprout.com/990274.rss
Content Is Profit - Megaphone,https://feeds.buzzsprout.com/940729.rss
Growth Stacking Show with Dan Martell - The Podcast Discovery ...,https://pod.casts.io/podcasts/saas-growth-stacking-with-dan-martell.rss
Latest Thinkers Podcast Episodes,https://pod.casts.io/topics/thinkers/new-episodes.rss
Slam City - Audiomack,https://audiomack.com/rss/slamcityradio/podcast.rss
