Bad Sports | Stoked Wiki | Fandom,https://stoked.wikia.com/wiki/File:Stoked_Season_2_Episode_16_-_Bad_Sports.flv
"At least 4 dead, 9 injured, in Florida bridge collapse - News24",https://www.chinanationalnews.com/news/256756267/oct04v56.flv
The facts of Modern Monetary Theory - Independent Australia,https://www.australianherald.com/news/257990463/oct04v56.flv
mallu actress in fucking mood.wmv.flv Mp4 3GP Video & Mp3 ...,http://www.mxtube.net/videos/search/mallu%2520actress%2520in%2520fucking%2520mood.wmv.flv
心情日记| 红楼阁REDdist,https://www.reddist.com/taxonomy/term/13/sample.FLV%3Fpage%3D223
心情日记| 红楼阁REDdist,https://www.reddist.com/taxonomy/term/13/sample.FLV%3Fpage%3D286
"Eye Mefe.flv | Moses Ok Lyrics, Song Meanings, Videos ... - SonicHits",https://sonichits.com/video/Moses_Ok/Eye_Mefe.flv
Egomaniac (English Edition) Format Kindle - Vi Keeland - Amazon,http://www.multiup.org/fichiers/download/f0a03f68922edb906e06d99b76064e4c_Bivouac_-_France_2_-_15_Janvier_2013_-_0h40_-_704x400.flv%3F_locale%3Den
