"Application of osmometric methods to the study of lipids, lipoproteins ...",https://www.jlr.org/article/S0022-2275(20)38738-1/pdf
THE OSMOMETRIC METHOD OF DETERMINING THE ...,https://pubs.acs.org/doi/pdf/10.1021/ja01409a024
[PDF] Membrane Osmometry - Willson Research Group,http://willson.cm.utexas.edu/Teaching/Chem367L392N/Files/Membrane%2520Osmometry.pdf
Osmometry. 1. Terminology and principles of measurement,https://associationofanaesthetists-publications.onlinelibrary.wiley.com/doi/pdf/10.1111/j.1365-2044.1978.tb08496.x
Viscometric and osmometric determination of molecular masses of ...,https://onlinelibrary.wiley.com/doi/pdf/10.1002/app.1973.070170228
[PDF] Chapter 12,https://www.uky.edu/~mbardo/psy627_files/Ingestive%2520Behavior%2520Chapte%252012%25202010.pdf
Osmometric study of commercial surfactants,https://link.springer.com/content/pdf/10.1007/BF02544974.pdf
Osmometric behavior of blood cells and of whole body cells,https://journals.physiology.org/doi/pdf/10.1152/ajplegacy.1962.202.6.1195
The Osmometric Behavior of Human Erythrocytesl - ScienceDirect.com,https://www.sciencedirect.com/science/article/pii/001122407990018X/pdf%3Fmd5%3Dd46fe8b0608207abbcf8ebfcecd7450a%26pid%3D1-s2.0-001122407990018X-main.pdf
OSMOMETRIC STUDIES OF HUMAN IMMUNOGLOBULIN G In ...,https://www.sciencedirect.com/science/article/pii/002217597890039X/pdf%3Fmd5%3D17316e7665a3d7a9c065f1984ebba12d%26pid%3D1-s2.0-002217597890039X-main.pdf
