PLAT/shout bobbin knoter iii/line knoter-Fishing Tackle Store-en,https://www.plat.co.jp/shop/catalog/product_info/language/en/products_id/1710/cPath/32_1350/fishing-gear-accessories/Bobbin-knotter.flv
PLAT/auto king gaff 500 gunmeta/eging accessories-Fishing Tackle ...,https://www.plat.co.jp/shop/catalog/product_info.php/language/en/products_id/6372/cPath/22_81_0_24_1023/river-lake-fishing-freshwater/Auto-king-gaff-500.flv
Brazil's Olympic Legacy: Teen Girls Tackle Taboos Through Sport,https://www.malaysiasun.com/news/248463477/oct04v40.flv
We Want to Hear From You! - IDHS,https://www.dhs.state.il.us/page.aspx/FACT_Intro.flv%3Fitem%3D136976%26date%3D8/1/2021%26calendar%3D104689
BBC Radio 4 Appeal - Global Witness,https://www.globalwitness.org/sites/default/files/import/radio4appeal_hi.flv
Czech Leader Opposes Merkel's Idea of EU Immigration 'Flexibility',https://www.munichmetro.com/news/257418721/oct04v40.flv
Bok ratings: Pieter-Steph's tears told it all | Sport - News24,https://www.sierraleonetimes.com/news/257993273/oct04v40.flv
Zimbabwe crisis: What you need to know - News24,https://www.sierraleonetimes.com/news/259033305/feb24v21.flv
Hong Kong Charity Diverts Annual Mooncake Waste,https://www.northkoreatimes.com/news/258038992/oct04v56.flv
