"Obesity, stem cell researchers possible contenders for Nobel prize ...",https://www.toledoblade.com/news/medical/2011/10/02/Obesity-stem-cell-researchers-possible-contenders-for-Nobel-prize-in-medicine/stories/feed/index.rss
9 surprising reasons you're always hungry - Insider,https://www.thisisinsider.com/why-am-i-always-hungry-2018-5/health.rss
The Vox Markets Podcast - Audioboom,https://audioboom.com/channels/5051662.rss
Environment – The Why Files,https://whyfiles.org/category/grades-5-8/science-in-personal-and-social-perspectives/environment-2/feed/index.rss
Healthier Together - Liz Moody,https://pod.link/1398442165.rss
The Mind Muscle Connection - Buzzsprout,https://feeds.buzzsprout.com/1508401.rss
"Body Signals, a Signos Podcast - Buzzsprout",https://feeds.buzzsprout.com/1568788.rss
The No Cap Health Show - Captivate,https://omny.fm/shows/the-no-cap-health-show/playlists/podcast.rss
Get Fitter While Enjoying Life - Strength & Scotch,http://feeds.soundcloud.com/users/soundcloud:users:121170139/sounds.rss
Latest Nutrition Podcast Episodes,https://pod.casts.io/categories/nutrition/new-episodes.rss
