Hipnotize.avi - Fandom - Creepypasta Wiki,https://creepypasta.fandom.com/pl/wiki/Hipnotize.avi%3Fli_source%3DLI%26li_medium%3Dwikia-footer-wiki-rec
Spiderman.avi | Pasty dla PG Wikia - Wiki Index | | Fandom,https://pasty-dla-pg.fandom.com/pl/wiki/Spiderman.avi%3FcommentId%3D4400000000000115371%26replyId%3D4400000000000293980
Polecane another huge shot glass filming cum slut.avi VR filmy ...,https://pl.amp.xhamster.com/search/another%2Bhuge%2Bshot%2Bglass%2Bfilling%2Bcum%2Bshot.avi%3Fquality%3Dvr
Fotogalerie: 8. kolo KP: SK Holice – TJ Svitavy 4:1 (2:1) -- TJ Svitavy,http://www.tjsvitavy.net/index.php/zpravy_oddilu/zpravy_oddilu/video/02-05-2004-sy_stolany_1.avi%3Fpage%3D81%26idfotogalerie%3D386
"Áčko prohrálo v Holicích, když neproměnilo řadu šancí -- TJ Svitavy ...",http://www.tjsvitavy.net/index.php/zpravy_oddilu/zpravy_oddilu/video/02-05-2004-sy_stolany_1.avi%3Fpage%3D11%26clanek_id%3D2270
"Závěrečná práce: Bc. Lukáš Kobrle, učo 11753: Od básně k divadlu",https://is.jamu.cz/th/gwvxj/Priloha_3_video.avi%3Finfo
Barbie.avi | Creepypasta Wiki | Fandom,http://pl.creepypasta.wikia.com/wiki/Barbie.avi%3Fli_source%3DLI%26li_medium%3Dwikia-footer-wiki-rec
