亚搏在线_亚搏在线娱乐平台_亚搏国际在线官网,https://www.baooytra.com/knowledge/feed/47560/topic.rss
Movie review: Super Size Me **** | The Blade,https://www.toledoblade.com/a-e/movies/2004/08/27/Movie-review-Super-Size-Me/stories/feed/index.rss
God Awful Movies - Audioboom,https://audioboom.com/channels/4829841.rss
Our American Stories - Megaphone,https://feeds.buzzsprout.com/558355.rss
You Love to See It - Megaphone,https://pod.link/1516367089.rss
Hoffmann2111 shared items on The Old Reader (RSS),https://theoldreader.com/profile/5142d395da564ddc2b000001.rss
En podd om teknik - Libsyn,http://enpoddomteknik.se/avsnitt.rss
