"Camouflaging Truth: A Biological, Argumentative and ... - Brill",https://brill.com/view/journals/jocc/14/1-2/article-p65_4.xml%3Flanguage%3Den
"Camouflaging Truth: A Biological, Argumentative and ... - Brill",https://brill.com/downloadpdf/journals/jocc/14/1-2/article-p65_4.xml
Chapter 4 Death Denial: Hiding and Camouflaging Death - SAGE ...,https://sk.sagepub.com/reference/death/n4.xml
Camouflage Phenomenon in Several Species of Triatominae ...,http://jme.oxfordjournals.org/content/10/2/209.source.xml
Germany in the Interbellum: Camouflaging Sovereign Debt in,https://www.elibrary.imf.org/abstract/books/071/28327-9781513511795-en/ch006.xml
Germany in the Interbellum: Camouflaging Sovereign Debt in,https://www.elibrary.imf.org/view/books/071/28327-9781513511795-en/ch006.xml
The Permeable Olympic Fortress in - Berghahn Journals,https://www.berghahnjournals.com/view/journals/conflict-and-society/6/1/arcs060107.xml
The Permeable Olympic Fortress - Berghahn Journals,https://www.berghahnjournals.com/downloadpdf/journals/conflict-and-society/6/1/arcs060107.xml
Titania-Coated Magnetite and Ni-Ferrite Nanocomposite-Based ...,https://journals.scholarsportal.info/details/03602559/v54i0014/1483_tmannramfca.xml
