David Miller PROPENSITIES AND INDETERMINISM 1. Prefatory ...,https://brill.com/downloadpdf/book/edcoll/9789401205030/B9789401205030-s011.xml
From Newtonian determinism to branching-space-time ... - Brill,https://brill.com/view/book/edcoll/9783969750629/BP000003.xml
xi. determinism and falsification - De Gruyter,https://www.degruyter.com/princetonup/downloadpdf/book/9781400867295/10.1515/9781400867295-013.xml
unit.xml - Universität Augsburg (Informatik),http://www.informatik.uni-augsburg.de/swt/projects/BTree/specs/btree-delete/export/unit.xml
A Wold-Like Decomposition of Two-Dimensional Discrete ...,https://projecteuclid.org/journals/annals-of-applied-probability/volume-5/issue-1/A-Wold-Like-Decomposition-of-Two-Dimensional-Discrete-Homogeneous-Random/10.1214/aoap/1177004839.xml
Chisholm on freedom | Scholars Portal Journals,https://journals.scholarsportal.info/details/00261068/v34i0005/630_cof.xml
Three-Dimensional Textured Image Blocks Model Based on Wold ...,https://journals.scholarsportal.info/details/1053587x/v55inone/3247_ttibmbowd.xml
Free Will and Abilities to Act in: Streit um die Freiheit - Ferdinand ...,https://www.schoeningh.de/abstract/book/edcoll/9783657792160/BP000010.xml
Induction without Probabilities John D Norton author A simple ...,http://d-scholarship.pitt.edu/cgi/export/2678/MODS/d-scholarship-2678.xml
1. Introduction - Hindawi.com,https://downloads.hindawi.com/journals/jmath/2022/8411876.xml
