Chapter 9: The Socially Constructed Body - SAGE Knowledge,https://sk.sagepub.com/books/illuminating-social-life-6e/n11.xml
The Body and Social Theory - SAGE Books,https://sk.sagepub.com/books/the-body-and-social-theory-2e/n4.xml
Kinesiology's Role and Responsibility in Disrupting the Status Quo in,https://journals.humankinetics.com/view/journals/krj/aop/article-10.1123-kr.2021-0059/article-10.1123-kr.2021-0059.xml
Activist and Socially Engaged Art - Art History - Oxford Bibliographies,https://www.oxfordbibliographies.com/view/document/obo-9780199920105/obo-9780199920105-0160.xml
Chapter Three Socially Necessary Labour Time - Brill,https://brill.com/previewpdf/book/9789004256262/B9789004256262_006.xml
Part 1 Higher Education and Civic Space for Learning in - Brill,https://brill.com/view/book/edcoll/9789004459076/BP000010.xml%3Flanguage%3Den
13 CFR Part 124 -- 8(a) Business Development/Small ... - eCFR,https://www.gpo.gov/fdsys/pkg/CFR-2018-title13-vol1/xml/CFR-2018-title13-vol1-part124.xml
The impact of physical distancing on socially vulnerable people ...,https://bristoluniversitypressdigital.com/view/journals/ijcc/6/1-2/article-p123.xml
Performing care - Manchester Open Hive,https://www.manchesteropenhive.com/view/9781526146816/9781526146816.xml
