Fainting (Syncope) - My Doctor Online - Kaiser Permanente,https://mydoctor.kaiserpermanente.org/ncal/structured-content/Symptom_Fainting_Syncope_-_Hospital_Medicine.xml%3Fco%3D/regions/ncal
Fainting in Children - My Doctor Online - Kaiser Permanente,https://mydoctor.kaiserpermanente.org/ncal/structured-content/Symptom_Fainting_in_Children_-_Pedi_Cardio.xml%3Fco%3D/regions/ncal
"Faint Impressions, Forceful Ideas in - Brill",https://brill.com/view/journals/hpla/24/2/article-p326_4.xml
"Faint Impressions, Forceful Ideas in - Brill",https://brill.com/view/journals/hpla/aop/article-10.30965-26664275-bja10050/article-10.30965-26664275-bja10050.xml
Long QT syndrome patients may faint due to neurocardiogenic ...,https://europace.oxfordjournals.org/content/5/4/367.source.xml
Untitled,https://edition.cnn.com/video/data/3.0/video/health/2017/10/31/wendy-williams-faints-on-live-tv-orig-vstop-aa.cnn/index.xml
DIURNAL WINDS ON FAINT GRADIENT IN NORTH-WESTERN ...,https://journals.ametsoc.org/view/journals/mwre/29/7/1520-0493_1901_29_299_dwofgi_2_0_co_2.xml
It's All in the Area ————————————————— J. Todd Lee,https://pubs.nctm.org/downloadpdf/journals/mt/92/8/article-p670.xml
Aneurysm of the Internal Carotid Artery Associated with ...,https://thejns.org/view/journals/j-neurosurg/3/1/article-p81.xml
