Radio Broadcasts - Living God Ministries,https://www.livinggodministries.net/rss/podcast.rss
Beth in Israel,https://bethcrosby.com/blogs/beth-in-israel.rss
Maidenbower Baptist Church - Sermon Audio,http://www.sermonaudio.com/rss_source.rss%3Fsourceid%3Dmbc
Radio Free Nashville's Mystic-Skeptic Radio Show/Podcast with ...,https://www.buzzsprout.com/84561.rss
The Hickory Rock Baptist Church Podcast - Buzzsprout,https://feeds.buzzsprout.com/851137.rss
First Baptist Church Cola - Pod.casts - The Podcast Discovery Service,https://pod.casts.io/podcasts/first-baptist-church-cola.rss
