Histology and Distribution of Cutaneous Touch Corpuscles in Some ...,https://www.jstor.org/stable/1563285
"[PDF] Toulouse, France corpuscles. They also described rhythmic ... - NCBI",https://www.ncbi.nlm.nih.gov/pmc/articles/PMC1357117/pdf/jphysiol01187-0095.pdf
Lamellar cells in Pacinian and Meissner corpuscles are touch sensors,https://www.science.org/doi/pdf/10.1126/sciadv.abe6393
A quantitative study of Meissner's corpuscles in man - Neurology,https://n.neurology.org/content/neurology/16/1/1.full.pdf
THE FINE STRUCTURE OF MEISSNER'S TOUCH CORPUSCLES ...,https://rupress.org/jcb/article-pdf/8/2/467/1075010/467.pdf
[PDF] Printing a Pacinian Corpuscle: Modeling and Performance - MDPI,https://www.mdpi.com/2072-666X/12/5/574/pdf
Salivary corpuscle activity - ScienceDirect.com,https://www.sciencedirect.com/science/article/pii/S0002817764830063/pdf%3Fmd5%3Ddee5a74b5884cdecae13646f0d23d4ed%26pid%3D1-s2.0-S0002817764830063-main.pdf
Pacinian Corpuscles in the Human Fetal Finger and Thumb: A Study ...,https://anatomypubs.onlinelibrary.wiley.com/doi/pdf/10.1002/ar.23707
Distribution of Human Pacinian Corpuscles in the Hand,https://journals.sagepub.com/doi/pdf/10.1016/S0266-7681(98)80060-0
