World Traveler | Lifestyles | journaltimes.com,http://www.journaltimesonline.com/articles/2009/02/01/family/doc4986264f0a2bb308757404.txt
Still grooving on vinyl | Lifestyles - parispi.net,http://www.parispi.net/articles/2014/01/07/lifestyles/society/doc52cc2c2eca028066673664.txt
All Lifestyles - The Original Hip-Hop (Rap) Lyrics Archive,https://ohhla.com/anonymous/beastie/to_the_5/all_life.bst.txt
One of my favorite columns | Lifestyle - Elk Grove Citizen,http://www.egcitizen.com/articles/2015/07/14/lifestyle/doc55a59db17ce38065612560.txt
Hamptons Lifestyle Llc Stock / Securites Offering Form D - SEC Report,https://sec.report/Document/1891255/000189125521000001/0001891255-21-000001.txt
OCAF art show studies war | Lifestyles | oconeeenterprise.com,http://www.oconeeenterprise.com/articles/2012/05/16/lifestyles/doc4fa81b3a0dfa6594119065.txt
LIFESTYLES OF THE RICH & THE FAMOUS GOOD CHARLOTTE,https://www.guitarsongs.info/ROCK/lifestyles.txt
Exercise a game of numbers | Lifestyle | galtheraldonline.com,http://www.galtheraldonline.com/articles/2012/02/15/lifestyle/doc4f330b708d246198864282.txt
A walk through railroad history | Lifestyles - TheTandD.com,http://www.timesanddemocrat.com/articles/2008/01/21/features/lifestyles/12921868.txt
