Human Experiments and the Material Culture of Medical Electricity ...,https://brill.com/view/book/edcoll/9789004286719/B9789004286719-s006.xml%3Flanguage%3Den
Chapter 5 'This Shocking Lobster': Understanding the Fantastic ...,https://brill.com/abstract/book/edcoll/9789004409460/BP000008.xml
THE EFFECT OF COLD SHOCK AND DEEP-FREEZING ON THE ...,https://rep.bioscientifica.com/view/journals/rep/12/2/jrf_12_2_004.xml
IMF Working Papers Volume 2006 Issue 083: Shocking Aspects of ...,https://www.elibrary.imf.org/view/journals/001/2006/083/001.2006.issue-083-en.xml
Chapter 2 | Ethics in Research: Some Shocking Cases,https://methods.sagepub.com/book/understanding-research-methods-and-statistics-in-psychology/n2.xml
FORM D - SEC.gov,https://www.sec.gov/Archives/edgar/data/1398021/000139802110000006/xslFormDX01/primary_doc.xml
"Historical Trauma, National Cinema, and the Modern Horror Film, by ...",https://journals.scholarsportal.info/details/00151386/v61i0001/89_srhtncp2cp2p.xml
The shocking consequences of defective ionic translocation in ...,https://journals.scholarsportal.info/details/03069877/v01i0003/118_tscoditim.xml
Shock therapy used on students? A Massachusetts school defends ...,https://edition.cnn.com/video/data/3.0/video/us/2012/05/23/ac-shocking-treatment-of-students.cnn/index.xml
