Search results for matsuura - UNESCO Mediabank,https://en.unesco.org/mediabank/cgi/search/archive/simple/export_mediabank_RSS.rss%3Fexp%3D0%257C1%257C%257Carchive%257C-%257Cq%253A%253AALL%253AIN%253Amatsuura%257C-%257C%26screen%3DSearch%26_action_search%3D1%26order%3D%26search_offset%3D160
Search results for matsuura - UNESCO Mediabank,https://en.unesco.org/mediabank/cgi/search/archive/simple/export_mediabank_RSS.rss%3F_action_search%3D1%26screen%3DSearch%26order%3D%26exp%3D0%257C1%257C%257Carchive%257C-%257Cq%253A%253AALL%253AIN%253Amatsuura%257C-%257C%26search_offset%3D180
Avalon Features Czech Director for DC Debut - MZV,https://www.mzv.cz/washington/en/culture_events/news/avalon_features_czech_director_for_dc.rss%3Fnotify%3D1
Your American Lands,https://www.blm.gov/media/podcasts/yal.rss
The Screen Show - ABC,https://pod.link/602968006.rss
Perrysburg law director resigns | The Blade,https://www.toledoblade.com/local/2018/07/20/Perrysburg-law-director-resigns/stories/feed/index.rss
RON Ag Perspectives with Ron Hays on RON (Radio Oklahoma ...,http://oklahomafarmreport.com/wire/featurespodcast.rss
Remembering a zombie genius: Director George Romero | The Blade,https://www.toledoblade.com/Opinion/Editorials/2017/07/21/Remembering-a-zombie-genius-Director-George-Romero/stories/feed/index.rss
