Approaches to control the quality of cementitious PFA grouts for ...,https://journals.scholarsportal.info/details/00325910/v174i1-2/56_atctqopgfnwe.xml
Sorption and diffusion studies in cementitious grouts,https://journals.scholarsportal.info/details/0956053x/v12i2-3/289_sadsicg.xml
1. Introduction - Hindawi.com,https://downloads.hindawi.com/journals/geofluids/2021/7126013.xml
AMSE Advances in Materials Science and Engineering 1687-8442 ...,https://downloads.hindawi.com/journals/amse/2019/7968240.xml
Experimental data of cement grouting in coarse soils with different ...,https://europepmc.org/articles/pmc7200773/bin/mmc1.xml
Numerical Simulation and Optimization of Hole Spacing for Cement ...,https://projecteuclid.org/journals/journal-of-applied-mathematics/volume-2013/issue-SI13/Numerical-Simulation-and-Optimization-of-Hole-Spacing-for-Cement-Grouting/10.1155/2013/135467.xml
Steering Parameters for Rock Grouting - Project Euclid,https://projecteuclid.org/journals/journal-of-applied-mathematics/volume-2013/issue-SI13/Steering-Parameters-for-Rock-Grouting/10.1155/2013/269594.xml
ABSTRACT - International Structural Engineering and Construction ...,https://www.isec-society.org/ISEC_PRESS/ASEA-SEC_02/html/M-11.xml
Chemical Grouting Lost-Circulation Zones with ... - UNT Digital Library,https://digital.library.unt.edu/ark:/67531/metadc792581/metadata.untl.xml
