catcher/pom.xml at master · jhomlala/catcher - GitHub,https://github.com/jhomlala/catcher/blob/master/backend/pom.xml
catcher/pom.xml at master · anderskristian/catcher · GitHub,https://github.com/anderskristian/catcher/blob/master/pom.xml
Age-Related Differences in Throwing Techniques Used by the ...,https://journals.humankinetics.com/view/journals/pes/6/3/article-p225.xml
Lower Extremity Muscle Activation and Kinematics of Catchers ...,https://www.jssm.org/researchjssm-14-484.xml.xml
"Soul Catcher: Java's Fiery Prince Mangkunagara I, 1726–1795, by ...",https://brill.com/view/journals/bki/175/2-3/article-p394_20.xml%3Flanguage%3Den
SMOKED GLASS AS RAIN TRACE-CATCHER in - AMS Journals,https://journals.ametsoc.org/view/journals/bams/10/8-9/1520-0477-10_8-9_163b.xml
SeaGlass: Enabling City-Wide IMSI-Catcher Detection - Sciendo,https://www.degruyter.com/view/j/popets.2017.2017.issue-3/popets-2017-0027/popets-2017-0027.xml%3Fformat%3DINT
'Dream Catcher' and 'First Lady' Flowering Cherry in - Journal of the ...,https://journals.ashs.org/hortsci/view/journals/hortsci/42/1/article-p174.xml
SAGE Reference - American Masculinities: A Historical Encyclopedia,https://sk.sagepub.com/reference/masculinities/n41.xml
