Importance of Timing of Preprandial Subcutaneous Insulin ...,https://diabetesjournals.org/care/article-pdf/6/4/374/496017/6-4-374.pdf
A Comparison of Postprandial and Preprandial Administration of ...,https://diabetesjournals.org/care/article-pdf/26/8/2359/661036/dc0803002359.pdf
Efficacy Comparison Between Preprandial and Postprandial Insulin ...,https://www.sciencedirect.com/science/article/pii/S0149291804802959/pdf%3Fmd5%3D7fcd3cb62ea94871f8742e298d69359b%26pid%3D1-s2.0-S0149291804802959-main.pdf
Postprandial versus Preprandial Blood Glucose Monitoring in ...,https://www.nejm.org/doi/pdf/10.1056/NEJM199511093331901
Preprandial versus postprandial blood glucose monitoring in type 1 ...,https://www.ajog.org/article/S0002-9378(03)00497-6/pdf
Relative contributions of preprandial and postprandial glucose ...,https://www.nature.com/articles/s41387-018-0047-8.pdf%3Fproof%3DtExtended
[PDF] Targeting Plasma Glucose: Preprandial Versus Postprandial,https://citeseerx.ist.psu.edu/viewdoc/download%3Fdoi%3D10.1.1.603.9424%26rep%3Drep1%26type%3Dpdf
Influence of preprandial vs. postprandial insulin glulisine on weight ...,https://dom-pubs.onlinelibrary.wiley.com/doi/pdf/10.1111/j.1463-1326.2011.01478.x
Postprandial versus preprandial dosing of biphasic insulin aspart in ...,https://www.diabetesresearchclinicalpractice.com/article/S0168-8227(04)00054-3/pdf
Interaction between preprandial and postprandial rectal ... - Gut,http://gut.bmj.com/content/early/2013/10/18/gutjnl-2013-305853.full.pdf%3Fgutjnl-2013-305853v1
