Victorian Faddishness: The Dolly Varden from Dickens to Patience,https://academic.oup.com/jvc/article-pdf/26/2/153/38891333/vcab006.pdf
The constant causes of never-ending faddishness in the behavioral ...,https://papers.ssrn.com/sol3/Delivery.cfm%3Fabstractid%3D1800427
"Fads, Success Stories, and Adaptive Emulation - The University of ...",https://www.journals.uchicago.edu/doi/pdfplus/10.1086/323039
"dia influence is in vogue, and admirably, Epstein's interpretive ...",https://www.jstor.org/stable/2131057
[PDF] Publishing in top journals – a never-ending fad? - Professor Stuart ...,http://www.stuartmacdonald.uk.com/wp-content/uploads/2014/02/topjournals.pdf
[PDF] slang analysis,http://sc.syekhnurjati.ac.id/esscamp/risetmhs/BAB459430510.pdf
"[PDF] Fads, Success Stories, and Adaptive Emulation",http://people.soc.cornell.edu/strang/articles/In%2520Search%2520of%2520Excellence.pdf
"'Between Two Evils, I Refuse To Choose The Lesser'",https://www.tandfonline.com/doi/pdf/10.1080/0950238032000083845
The Self-Referential Bases of Psychological Research and Theory,https://journals.sagepub.com/doi/pdf/10.1037/1089-2680.9.4.358
[PDF] An Agent-Based Model of Consultant-Driven Innovation - McGill ...,https://www.mcgill.ca/desautels/files/desautels/strang-david-akhlaghpour-american-journal-of-sociology-2014_0.pdf
