[PDF] refound - Bab.la,https://www.babla.gr/%25CF%2581%25CE%25B7%25CE%25BC%25CE%25B1%25CF%2584%25CE%25B1/%25CE%25B1%25CE%25B3%25CE%25B3%25CE%25BB%25CE%25B9%25CE%25BA%25CE%25B1/refound/pdf
[PDF] to refound - Bab.la,https://it.bab.la/coniugazione/inglese/refound/pdf
The Refounding Process in Business - SAGE Journals,https://journals.sagepub.com/doi/pdf/10.1177/002224296603000401
"[PDF] Culture, Chaos, And Refounding - Catholic Health Association",https://www.chausa.org/docs/default-source/health-progress/culture-chaos-and-refounding-pdf.pdf%3Fsfvrsn%3D0
4. ''Time Refound'' - De Gruyter,https://www.degruyter.com/document/doi/10.1515/9780823237753-010/pdf
Lost knowledge refound: sharpened FIR filters - IEEE Xplore,https://ieeexplore.ieee.org/iel5/79/27727/01236773.pdf
Lost Knowledge Refound: Sharpened FIR Filters - Wiley Online Library,https://onlinelibrary.wiley.com/doi/pdf/10.1002/9781118316948.ch1
"James Limestone, northeastern Gulf of Mexico - GeoScienceWorld",https://pubs.geoscienceworld.org/aapgbull/article-pdf/86/3/381/3359922/381.pdf
Eidamella spinosa (Matruchot and Dassonville) Refound - jstor,https://www.jstor.org/stable/3754509
Pestalotia distincta Refound in Japan - jstor,https://www.jstor.org/stable/3758595
