Subsampling with mark and recapture for estimating abundance of ...,https://journals.scholarsportal.info/details/11804009/v05i0002/191_swmarfeaomap.xml
What Is Your Diagnosis? - AVMA Journals,https://avmajournals.avma.org/downloadpdf/journals/javma/234/4/javma.234.4.455.xml
What Is Your Diagnosis? in: Journal of the American Veterinary ...,https://avmajournals.avma.org/view/journals/javma/234/4/javma.234.4.455.xml%3Frskey%3DpaUBdC%26result%3D401
Biophysical Evaluation of Land-Cover Products for Land–Climate ...,https://journals.ametsoc.org/downloadpdf/journals/eint/13/6/2009ei276.1.xml
The Stem Age Required for Floral Induction of Synchronized Mango ...,https://journals.ashs.org/hortsci/view/journals/hortsci/45/10/article-p1453.xml
and myography - Brill,https://brill.com/previewpdf/journals/njz/24/4/article-p323_1.xml
SOCIAL BEHAVIOUR OF THE ARCTIC GROUND SQUIRREL ... - Brill,https://brill.com/downloadpdf/journals/beh/50/1-2/article-p77_4.xml
Untitled,https://www.biorxiv.org/content/early/2020/01/17/2020.01.17.910208.source.xml
"VI. Alps-Adria Scientific Workshop Obervellach, Austria, 2007. DOI ...",https://akjournals.com/previewpdf/journals/0806/35/2/article-p309.xml%3FpdfJsInlineViewToken%3D1198406819%26inlineView%3Dtrue
