Attaching - FrameNet!,https://framenet2.icsi.berkeley.edu/fnReports/data/frame/Attaching.xml
A method for attaching the funnel to the flask for use in the Seinhorst ...,https://brill.com/view/journals/nema/6/4/article-p336_10.xml
Attaching Multiple Prepositional Phrases: Backed-off Estimation ...,https://aclanthology.coli.uni-saarland.de/papers/W97-0317/w97-0317.xml
How to Take and Send Photos to Your Doctor,https://mydoctor.kaiserpermanente.org/ncal/structured-content/Health_Topic_How_to_Take_and_Send_Photos_to_Your_Doctor.xml%3Fco%3D%252Fregions%252Fncal
dd4005cd-bc38-4962-8b74-0a612cd8b752.xml,https://cdn.cnetcontent.com/dd/40/dd4005cd-bc38-4962-8b74-0a612cd8b752.xml
Prevalence and characteristics of attaching and effacing strains of ...,https://avmajournals.avma.org/downloadpdf/journals/ajvr/63/2/ajvr.2002.63.262.xml
Prevalence and characteristics of attaching and effacing strains of ...,https://avmajournals.avma.org/view/journals/ajvr/63/2/ajvr.2002.63.262.xml
mail.attach,https://docs.deistercloud.com/content/Axional%2520development%2520tools.15/Axional%2520Studio.4/Development%2520Guide.10/Languages%2520reference.16/XSQL%2520Script.10/Packages.40/mail/mail.attach.021.xml%3Fembedded%3Dtrue
Pressure ulcer on toe because of attaching patient's toe to bolt of ...,https://journals.scholarsportal.info/details/17424801/v11i0003/339_puotbottboib.xml
