Dragonflies and Damselflies (Odonata)- State Hygienic Lab,http://www.shl.uiowa.edu/env/limnology/odonata.xml
Odonate Threats and Conservation - De Gruyter,https://www.degruyter.com/princetonup/abstract/book/9781400839667/10.1515/9781400839667.40.xml
"seasons, habitat structure and water pollution changes damselfly ...",https://brill.com/downloadpdf/journals/ab/66/3-4/article-p305_7.xml
SEC FORM 4,https://www.sec.gov/Archives/edgar/data/1717452/000120919120065664/xslF345X03/doc4.xml
FilingSummary.xml - SEC.gov,https://www.sec.gov/Archives/edgar/data/1717452/000156459019012891/FilingSummary.xml
International Academy of Ecology and Environmental Sciences ...,http://www.iaees.org/publications/journals/arthropods/articles/2022-11(1)/arthropods20220110103-PubMed.xml
biorxiv BIORXIV bioRxiv bioRxiv Cold Spring Harbor Laboratory ...,https://www.biorxiv.org/content/biorxiv/early/2020/08/04/2020.04.23.056911.source.xml
Factors Affecting the Spatial Distribution of Oviposition Sites for ...,http://jinsectscience.oxfordjournals.org/content/15/1/54.ref-links.xml
"Butterfly, Dragonfly and Damselfly Species at Harvard Forest since ...",http://harvardforest.fas.harvard.edu/data/eml/hf287.xml
