Characterization of insulin-binding to the hepatoma cell line H35,https://eje.bioscientifica.com/downloadpdf/journals/eje/112/4/acta_112_4_015.xml
Non-receptor-mediated actions are responsible for the lipid-lowering ...,https://joe.bioscientifica.com/view/journals/joe/210/1/59.xml
In Vitro Infectivity of Irradiated Plasmodium Berghei Sporozoites to ...,https://www.ajtmh.org/view/journals/tpmd/33/4/article-p544.xml
Complete Development of the Liver Stage of Plasmodium falciparum ...,https://www.ajtmh.org/view/journals/tpmd/53/6/article-p607.xml
"Phenobarbital, dexamethasone and benzanthracene induce several ...",https://journals.scholarsportal.info/details/00145793/v233i0001/37_pdabispmirhc.xml
1. Introduction - Hindawi.com,https://downloads.hindawi.com/journals/cmmm/2021/4439505.xml
Journal of Radioanalytical and Nuclear Chemistry - AKJournals,https://akjournals.com/view/journals/10967/274/2/article-p429.xml
Oxidative metabolism and glycolysis in benign brain tumors in,https://thejns.org/view/journals/j-neurosurg/67/3/article-p336.xml
ABSTRACT - bioRxiv,https://www.biorxiv.org/content/early/2018/03/01/274050.source.xml
