Ultrastructure of the Tegument and Associated Structures of ... - jstor,https://www.jstor.org/stable/3277967
The Fine Structure of the Tegument of Adult Echinococcus ... - JSTOR,https://www.jstor.org/stable/3276351
Role of the tegument and gut in nutrient uptake by parasitic ...,https://cdnsciencepub.com/doi/pdf/10.1139/z03-213
[PDF] Functions of the tegument of schistosomes: Clues from the proteome ...,https://citeseerx.ist.psu.edu/viewdoc/download%3Fdoi%3D10.1.1.1085.6643%26rep%3Drep1%26type%3Dpdf
Volatile Constituents of the Seed Teguments of Abelmoschus ...,https://www.tandfonline.com/doi/pdf/10.1080/10412905.1999.9701211
Comparative proteome analysis of the tegument of male and female ...,https://www.nature.com/articles/s41598-022-11645-3.pdf%3Forigin%3Dppub
[PDF] Role of tegument proteins in herpesvirus assembly and egress,http://www.ibp.cas.cn/sourcedb_ibp_cas/tsg/thesis/202105/P020210615596047877565.pdf
Development of the tegument and alimentary tract in a trematode ...,https://www.cambridge.org/core/services/aop-cambridge-core/content/view/8ECA6AD6184B82D3B5DCA4ADCFC82084/S0031182000049131a.pdf/development_of_the_tegument_and_alimentary_tract_in_a_trematode_fellodistomum_fellis.pdf
Insights into Herpesvirus Tegument Organization from Structural ...,https://www.jbc.org/article/S0021-9258(19)81978-6/pdf
The interaction of HSV-1 tegument proteins pUL36 and pUL37,https://www.futuremedicine.com/doi/pdf/10.2217/fvl.14.56
