Effect of subthalamic nucleus stimulation on obsessive—compulsive ...,https://thejns.org/view/journals/j-neurosurg/100/6/article-p1084.xml
Obsession - SAGE Reference - Encyclopedia of Consumer Culture,https://sk.sagepub.com/reference/consumerculture/n389.xml
13 Transcending Contemporary Obsessions in - Brill,https://brill.com/view/book/9789004418967/BP000024.xml
Existential concerns in OCD with aggressive and sexual obsessions,https://journals.scholarsportal.info/details/22113649/v32icomplete/nfp_eciowaaso.xml
Treatment of patients with intractable obsessive—compulsive ...,https://thejns.org/view/journals/j-neurosurg/98/5/article-p1104.xml
A potential role for psilocybin in the treatment of obsessive ...,https://akjournals.com/view/journals/2054/4/2/article-p77.xml
