Effectiveness of administration of phenylbutazone ... - AVMA Journals,https://avmajournals.avma.org/view/journals/ajvr/69/2/ajvr.69.2.167.xml
Association between the administration of phenylbutazone prior to ...,https://avmajournals.avma.org/view/journals/javma/257/6/javma.257.6.642.xml
Effects of phenylbutazone on thyroid iodine metabolism in vitro,https://eje.bioscientifica.com/downloadpdf/journals/eje/94/1/acta_94_1_010.xml
THE EFFECTS OF PHENYLBUTAZONE ON THYROID FUNCTION in,https://eje.bioscientifica.com/view/journals/eje/72/2/acta_72_2_006.xml
Untitled,https://www.govinfo.gov/content/pkg/CFR-2018-title21-vol6/xml/CFR-2018-title21-vol6-sec520-1720e.xml
Stability studies of phenylbutazone and phenylbutazone‐antacid ...,https://journals.scholarsportal.info/details/00223549/v67i0005/646_ssopapof.xml
Phenylbutazone for nonspecific inflammations in: Journal of the ...,https://japmaonline.org/view/journals/apms/56/3/87507315-56-3-124.xml
SYNTHESIS AND ANALYSIS OF [4 t4 C] PHENYLBUTAZONE,https://akjournals.com/downloadpdf/journals/10967/20/2/article-p463.xml
236354 - RxNav,https://rxnav.nlm.nih.gov/REST/rxcui/236354/allProperties.xml%3Fprop%3Dall
