A 'Thank You' To Our Gaucho Fund Donors - UC Santa Barbara,https://www.ucsbgauchos.com/video/06-2011_ThankYouGFD.flv
Spanish (Lo-res) - media library - global witness,https://www.globalwitness.org/sites/default/files/import/spanish_stream_sm.flv
Boilermaker Union News and Updates | Page 86,https://boilermakers.org/news/video.flv%3Fpage%3D85
Palestinian Refugees Fear for Future After US Pulls Funds,https://www.illinoisintelligencer.com/news/257940416/oct04v56.flv
Closing Africa's wealth gap | Africa Renewal - the United Nations,https://www.parisguardian.com/news/255795881/oct04v56.flv
UN Palestinian Refugee Agency Narrows Shortfall after US Cuts,https://www.jamaicantimes.com/news/258052369/oct04v56.flv
Dubai Cares announces 2-year deworming program for school ...,https://www.irishsun.com/news/248385141/oct04v56.flv
Trump Signs Order Reimposing Sanctions On Iran,https://www.stpetersburgstar.com/news/257796220/feb24v21.flv
UNICEF counts a world of malnourished children,https://www.australianherald.com/news/214923676/oct04v40.flv
"New name, same flaws in eSwatini election, say critics - News24",https://www.sierraleonetimes.com/news/258012514/oct04v56.flv
