English Sound Building - British Pronunciation - Buzzsprout,https://feeds.buzzsprout.com/1579069.rss
https://www.wer-weiss-was.de/t/frage-zum-diphthong...,https://www.wer-weiss-was.de/t/frage-zum-diphthong-im-englischen/9366216.rss
The Skepticrat - Audioboom,https://audioboom.com/channels/4846754.rss
how to improve your listening and speaking skills,https://pod.link/939927416.rss
Acting without the Drama - Podcast Machine,https://feed.podcastmachine.com/podcasts/4444/ipodvideolarge.rss
Lexicon Valley from Booksmart Studios - Substack,https://api.substack.com/feed/podcast/366168/s/2522.rss
