"Anatomy and Pharmacognosy of Leptadenia Reticulata, an ...",https://akjournals.com/view/journals/034/54/1-2/article-p91.xml
"M. DENNI1, D. MAMMEN2 and S. RAMESH3 - AKJournals",https://akjournals.com/downloadpdf/journals/034/54/1-2/article-p91.xml
Faculty Spotlight: Dr. Kevin Tidgewell | Duquesne University,https://duq.edu/x142933.xml
"Part III, Pharmacognosy. English translation. Consultants Bureau ...",https://journals.scholarsportal.info/details/00959553/v49i0005/334_sripcpp1picc.xml
The American Journal of Tropical Medicine and Hygiene Volume 5 ...,https://www.ajtmh.org/view/journals/tpmd/5/2/tpmd.5.issue-2.xml
Sitemap - Research Journal of Pharmacognosy,http://www.rjpharmacognosy.ir/sitemap.xml%3Fusr
gb159-ms246 Reminiscences of Professor George E. Trease (1902 ...,https://archiveshub.jisc.ac.uk/files/nottingham/gb159-ms246.xml
dFMG-x.xml - AiS2,http://ais2.uniba.sk/repo2/repository/default/ais/statnicovepredmety/2019-2020/FaF/EN/dFMG-x.xml
02222nam 2200433Ia 4500 AA00053429_00001 ...,https://ufdcimages.uflib.ufl.edu/AA/00/05/34/29/00001/marc.xml
