SAGE Reference - The SAGE Encyclopedia of the Sociology of ...,https://sk.sagepub.com/reference/the-sage-encyclopedia-of-sociology-of-religion/i1578.xml
CQ Press - Encyclopedia of Religion in America - SAGE Knowledge,https://sk.sagepub.com/cqpress/encyclopedia-of-religion-in-america/n318.xml
Freemasonry and New Religious Movements - Brill,https://brill.com/previewpdf/book/edcoll/9789004273122/B9789004273122-s017.xml
The Chinese Government's Response to Protestant-related New ...,https://brill.com/downloadpdf/book/9789004297258/B9789004297258_006.xml
Untitled,https://www.govinfo.gov/content/pkg/BILLS-112sres232is/xml/BILLS-112sres232is.xml
BRITISH AND AMERICAN RESPONSES TO NEW RELIGIOUS ...,https://www.manchesterhive.com/downloadpdf/journals/bjrl/70/3/article-p209.xml
Untitled,http://lanstad.com/epublishing/lanstaddoc/newdocbook/245237/finaloutput/output_file_newtest.xml
From Sectarians to Extremists: The Language of Marginalization in ...,https://www.schoeningh.de/view/journals/spsr/46/2/article-p105_105.xml%3Flanguage%3Den
The SAGE Encyclopedia of the Sociology of Religion,https://sageebook-du.refread.com/Reference/the-sage-encyclopedia-of-sociology-of-religion/.xml%3FPageNum%3D1
