"but the proclivities of the trophoblast cells, but by rec - Bioscientifica",https://rep.bioscientifica.com/downloadpdf/journals/rep/10/3/jrf_10_3_006.xml
Expression of antigenically distinct fimbriae with hemagglutination ...,http://femsim.oxfordjournals.org/content/9/2/143.source.xml
biorxiv BIORXIV bioRxiv bioRxiv Cold Spring Harbor Laboratory ...,https://www.biorxiv.org/content/biorxiv/early/2022/01/04/2022.01.03.474869.source.xml
biorxiv BIORXIV bioRxiv bioRxiv Cold Spring Harbor Laboratory ...,https://www.biorxiv.org/content/biorxiv/early/2019/02/15/346726.source.xml
First flu-related death in Iowa - State Hygienic Laboratory,http://shl.uiowa.edu/publications/lablink/201612/firstflu2016.xml
Keywords: - CDC stacks,https://stacks.cdc.gov/view/cdc/107962/cdc_107962_DS6.xml
GFAP-GFP neural progenitors are antigenically homogeneous and ...,https://journals.scholarsportal.info/details/08941491/v57i0001/66_gnpaahaitemn.xml
Immunity Induced by Influenza Virus Neuraminidase - PLOS,http://open-repository.kisti.re.kr/cube/bitstream/open_repository/95602/1/journal.pmed.0040091.xml
These highlights do not include all the information needed to use ...,https://www.accessdata.fda.gov/spl/data/638284a4-c749-45cf-b72b-0b586ba4a8e9/638284a4-c749-45cf-b72b-0b586ba4a8e9.xml
