Encystation: the most prevalent and underinvestigated differentiation ...,https://www.microbiologyresearch.org/content/journal/micro/10.1099/mic.0.000653%3Fcrawler%3Dtrue%26mimetype%3Dapplication/pdf
[PDF] Encystation,http://www.bio.umass.edu/micro/klingbeil/590s/Lectures/12590Lect04Xtra.pdf
Although encystment - The University of Chicago Press: Journals,https://www.journals.uchicago.edu/doi/pdf/10.2307/1536630
The release of secretory vesicle in encysting Giardia lamblia,https://academic.oup.com/femsle/article-pdf/235/1/81/19115731/235-1-81.pdf
"[PDF] University of Dundee Encystation Schaap, Pauline; Schilde, Christina",https://discovery.dundee.ac.uk/files/20650300/SchaapFullMS_Figures.pdf
Cyst and encystment in protozoan parasites: optimal targets for new ...,https://www.cell.com/trends/parasitology/pdf/S1471-4922(11)00118-8.pdf
Encystment and germination in Azotobacter vinelandii - ASM Journals,https://journals.asm.org/doi/pdf/10.1128/br.39.4.516-539.1975
"On the occurrence of encystation in trypanosoma grayi novy, with ...",https://royalsocietypublishing.org/doi/pdf/10.1098/rspb.1907.0005%3Fdownload%3Dtrue
The Fine Structure of the Encysting Salt Marsh Heterotrich Ciliate,https://onlinelibrary.wiley.com/doi/pdf/10.1002/jmor.1052050308
