"Chapter 4 Sarah, Rebekah and Rachel: Beautiful and Barren in - Brill",https://brill.com/view/book/9789004366305/BP000014.xml
"Sarah, Rebekah and Rachel: Beautiful and Barren - Brill",https://brill.com/previewpdf/book/9789004366305/BP000014.xml
Denning Ecology of Barren-Ground Grizzly Bears in the Central Arctic,https://jmammal.oxfordjournals.org/content/83/1/188.source.xml
COLLAGEN CONTENT OF BARREN AND PREVIOUSLY ...,https://rep.bioscientifica.com/view/journals/rep/6/3/jrf_6_3_009.xml
The Barrens: Central Pennsylvania's Year-Round Deep Freeze in,https://journals.ametsoc.org/view/journals/bams/61/11/1520-0477_1980_061_1368_tbcpyr_2_0_co_2.xml
"Characterization of barren, granitic soils from the Nubian Desert (SW ...",https://www.degruyter.com/view/j/mipo.2013.44.issue-1-2/mipo-2013-0004/mipo-2013-0004.xml
SAR Barren-ground Caribou,https://www.maps.geomatics.gov.nt.ca/Geocortex/Essentials/rest/sites/CIMP_ILC_Webmap/VirtualDirectory/metadataviewer/xmldata/barren%2520ground%2520caribou.xml
Metadata Document,https://www.arcgis.com/sharing/rest/content/items/7692463b600846e0816ae8e70d438f4b/info/metadata/metadata.xml%3Fformat%3Ddefault%26output%3Dhtml
LandLandcov_NLCDVT - Vermont Center for Geographic Information,http://maps.vcgi.vermont.gov/gisdata/metadata/archived/LandLandcov_NLCDVT.xml
