Current Movement Follows Previous Nontarget Movement With ...,https://journals.humankinetics.com/abstract/journals/mcj/25/4/article-p553.xml
Current Movement Follows Previous Nontarget Movement With ...,https://journals.humankinetics.com/view/journals/mcj/25/4/article-p553.xml
Efficacy and Nontarget Effects of Net Exclusion Enclosures on Apple ...,https://bioone.org/journals/journal-of-economic-entomology/volume-114/issue-4/toab094/Efficacy-and-Nontarget-Effects-of-Net-Exclusion-Enclosures-on-Apple/10.1093/jee/toab094.xml
Nontarget Impacts of Herbicides on Spiders in Orchards - BioOne,https://bioone.org/journals/journal-of-economic-entomology/volume-115/issue-1/toab228/Nontarget-Impacts-of-Herbicides-on-Spiders-in-Orchards/10.1093/jee/toab228.xml
Nontarget Arthropod Abundance in Areawide-Managed Corn ...,https://jee.oxfordjournals.org/content/98/6/1957.source.xml
Nontarget insect data requirements. - Govinfo.gov,https://www.govinfo.gov/content/pkg/CFR-2013-title40-vol25/xml/CFR-2013-title40-vol25-sec161-590.xml
Nontarget plant protection data requirements table. - Govinfo.gov,https://www.govinfo.gov/content/pkg/CFR-2013-title40-vol25/xml/CFR-2013-title40-vol25-sec158-660.xml
Nontarget Metabolomics of Grape Seed Metabolites Produced by ...,https://journals.ashs.org/jashs/view/journals/jashs/145/4/article-p247.xml
