Extreme Precipitation on Consecutive Days Occurs More Often in a ...,https://journals.ametsoc.org/view/journals/bams/103/4/BAMS-D-21-0140.1.xml
How Often Does It Rain? in - AMS Journals,https://journals.ametsoc.org/view/journals/clim/19/6/jcli3672.1.xml
Interferential Current Therapy: Often Used but Misunderstood in,https://journals.humankinetics.com/view/journals/ijatt/11/4/article-p29.xml
Interferential Current therapy: often Used but Misunderstood,https://journals.humankinetics.com/previewpdf/journals/ijatt/11/4/article-p29.xml
Basics: What Is Direct Investment? - Investors often seek profits from ...,https://www.elibrary.imf.org/view/journals/022/0052/003/article-A011-en.xml
[PDF] National goals for reducing fossil fuel use often conflict with policies ...,https://www.elibrary.imf.org/downloadpdf/journals/022/0055/003/article-A007-en.xml
Chapter 3 Ovid (Often) Moralised: the Middle Ages in - Brill,https://brill.com/abstract/book/9789004400948/BP000011.xml
'It Is Often a Shot in the Dark' in: Logos Volume 31 Issue 1 (2020) - Brill,https://brill.com/view/journals/logo/31/1/article-p35_35.xml%3Flanguage%3Den
How Often Can We Contact the Sample to Get Them to Participate?,https://methods.sagepub.com/book/100-questions-and-answers-about-survey-research/i925.xml
Earlier Effects Are More Often Perceived as One's Own Action ... - Brill,https://brill.com/view/journals/time/5/3-4/article-p228_228.xml%3Flanguage%3Den
