Neurological events due to pedicle screw malpositioning with lateral ...,https://thejns.org/spine/view/journals/j-neurosurg-spine/33/6/article-p806.xml
Revisions for screw malposition and clinical outcomes after robot ...,https://thejns.org/focus/view/journals/neurosurg-focus/42/5/article-pE12.xml
Duodenal obstruction caused by malposition of the gallbladder in a ...,https://avmajournals.avma.org/view/journals/javma/223/10/javma.2003.223.1475.xml
Acellular Dermal Matrix Inlays to Correct Significant Implant ...,https://asj.oxfordjournals.org/content/31/7_Supplement/85S.source.xml
"Incidence, predictors, and outcome of inadvertent malposition of ...",https://europace.oxfordjournals.org/content/18/7/1049.source.xml
The Malposition of the Pacing Lead in the Left Ventricle through an ...,https://journals.scholarsportal.info/details/17355370/v16i0002/92_tmotplvtaasd.xml
Prevention of Implant Malposition in Inframammary Augmentation ...,https://journals.scholarsportal.info/details/22346163/v41i0004/407_poimiiam.xml
Patient-specific instrumentation for total shoulder arthroplasty in,https://eor.bioscientifica.com/view/journals/eor/1/5/2058-5241.1.000033.xml
Malpositioned endotracheal tube,http://mirc.luriechildrens.org/storage/ss2/docs/20050902160746981/Malpositioned_ET_and_UVC.xml
