Online Videos - Certified Crop Adviser,https://www.certifiedcropadviser.org/videos/play/certified/education/cover-crops-soil-health.flv
"Volume XI, Issue XXXIX - June 2018 - IDHS",https://www.dhs.state.il.us/page.aspx/FACT_Intro.flv%3Fitem%3D106162
"[PDF] Parsi Theater, Urdu Drama, and the Communalization of Knowledge",https://minio.la.utexas.edu/colaweb-prod/profile/custom_pages/0/119/parsi_theater_urdu_drama_and_the_communa_51b7a927-cb02-4217-9c55-0726dcb7b8bf.flv
"After Summit, Trump Says North Korea 'No Longer A Nuclear Threat'",https://www.shanghaisun.com/news/257478756/oct04v40.flv
Newest 'flv' Questions - Stack Overflow,https://stackoverflow.com/questions/tagged/.flv
justACRO D-Bag courses in Switzerland!,https://justacro.com/news/icare-clip09.flv%3Fpage%3D48
hard disk repair course lesson 2.flv - آپارات,https://www.aparat.com/result/hard_disk_repair_course_lesson_2.flv
OneRepublic to perform In Mumbai - Peking Press,https://www.beijingbulletin.com/news/256745236/oct04v40.flv
Prawy do lewego Kayah & Bregović.flv - video karaoke -karaoke,"https://chomikuj.pl/nuja/Video%2B-karaoke/video%2Bkaraoke/Prawy%2Bdo%2Blewego%2B-%2BKayah%2B*26%2BBregovi*c4*87,4650496445.flv"
Nim stanie się tak Kasia Nosowska & Voo Voo.flv - karaoke - Chomikuj,"https://chomikuj.pl/SuperSajyan/karaoke/Nim%2Bstanie%2Bsi*c4*99%2Btak%2B-%2BKasia%2BNosowska%2B*26%2BVoo%2BVoo,2561606156.flv"
