"Chapter 1 Function, Meaning and Form of Gestures in - Brill",https://brill.com/view/book/9789004449794/BP000002.xml%3Flanguage%3Den
"Addressing, Greeting and Related Gestures in the Opening ... - Brill",https://brill.com/view/journals/jocp/aop/article-10.1163-26660393-bja10042/article-10.1163-26660393-bja10042.xml
Gestures - Linguistics - Oxford Bibliographies,https://www.oxfordbibliographies.com/view/document/obo-9780199772810/obo-9780199772810-0018.xml
Eye Tracking: Evaluating the Impact of Gesturing during Televised ...,https://journals.ametsoc.org/view/journals/bams/96/3/bams-d-13-00217.1.xml
Key Concepts in Body and Society - SAGE Books,https://sk.sagepub.com/books/key-concepts-in-body-and-society/n21.xml
Nonverbal Communication: Science and Applications - SAGE Books,https://sk.sagepub.com/books/nonverbal-communication/n4.xml
Early Lateralization of Gestures in Autism: Right-Handed Points ...,https://journals.scholarsportal.info/details/01623257/v50i0004/1147_elogiarppel.xml
"Amateur Elite Soccer in the Fiji Islands, 1980–1992",https://journals.humankinetics.com/downloadpdf/journals/shr/52/1/article-p22.xml
"Amateur Elite Soccer in the Fiji Islands, 1980–1992 in",https://journals.humankinetics.com/abstract/journals/shr/52/1/article-p22.xml
