The genetic crisis of the Mexican Bolson Tortoise (Gopherus ... - Brill,https://brill.com/downloadpdf/journals/amre/33/1/article-p45_5.xml
The genetic crisis of the Mexican Bolson Tortoise ... - Brill,https://brill.com/view/journals/amre/33/1/article-p45_5.xml%3Flanguage%3Den
Use of Video Analysis to Support Prospective K-8 Teachers' Noticing ...,https://pubs.nctm.org/view/journals/mte/2/2/article-p108.xml
Mathematics Teacher Educator Volume 2 Issue 2 (2014) - NCTM,https://pubs.nctm.org/view/journals/mte/2/2/mte.2.issue-2.xml
"Participation, Process and Partnerships in - Berghahn Journals",https://www.berghahnjournals.com/view/journals/aia/25/3/aia250301.xml
index.xml - CNN,https://edition.cnn.com/video/data/3.0/video/spanish/2021/01/27/incendios-argentina-bolson-sur-fuegos-perspectivas-buenos-aires.cnn/index.xml
Rhythms of Prediction in South Australian Water Resource ...,https://journals.ametsoc.org/abstract/journals/wcas/11/2/wcas-d-18-0103_1.xml
Early Adoption of Climate Information: Lessons Learned from South ...,https://journals.ametsoc.org/downloadpdf/journals/wcas/5/3/wcas-d-12-00002_1.xml
sitemap.xml - Seyfarth Shaw LLP,https://www.seyfarth.com/sitemap.xml
