Introduction in: Creating a Shared Morality - Brill,https://brill.com/view/book/9789004471078/BP000009.xml
Anatomical features of the straight sinus and its tributaries in,https://thejns.org/view/journals/j-neurosurg/44/1/article-p55.xml
SAGE Reference - Encyclopedia of Motherhood,https://sk.sagepub.com/reference/motherhood/n10.xml
Historical and Future Changes of Snowfall Events in ... - AMS Journals,https://journals.ametsoc.org/downloadpdf/journals/clim/31/15/jcli-d-17-0428.1.xml
Historical and Future Changes of Snowfall Events in China under a ...,https://journals.ametsoc.org/view/journals/clim/31/15/jcli-d-17-0428.1.xml
Password Policy for LDAP Directories - IETF,https://www.ietf.org/archive/id/draft-behera-ldap-password-policy-10.xml
Director. - GovInfo,https://www.govinfo.gov/content/pkg/FR-2005-11-30/xml/FR-2005-11-30.xml
Abstract - medRxiv,https://www.medrxiv.org/content/medrxiv/early/2022/06/18/2022.06.17.22276576.source.xml
recovery of blastocysts and induction of implantation following ...,https://rep.bioscientifica.com/downloadpdf/journals/rep/1/4/jrf_1_4_001.xml
