Refiguring Black Venus - Brill,https://brill.com/previewpdf/book/edcoll/9789004407916/BP000001.xml
To Francis Darwin 30 August [1867–70] 1,https://www.darwinproject.ac.uk/letter/DCP-LETT-7312.xml
NAGPRA and Repatriation of Native American Human Remains and ...,https://www.oxfordbibliographies.com/view/document/obo-9780199766567/obo-9780199766567-0236.xml
"The nutrition in the Paleolithic era, and the “paleodiet” today in ...",https://akjournals.com/abstract/journals/650/154/8/article-p315.xml
History of arteficial deformation of the human body. I. Artificial cranial ...,https://akjournals.com/view/journals/650/152/30/article-p1209.xml
The White mummy in: Mummified - manchester hive,https://www.manchesterhive.com/view/9781526161918/9781526161918.00012.xml
"Miley, What's Good? in: Girlhood Studies Volume 11 Issue 3 (2018)",https://www.berghahnjournals.com/view/journals/girlhood-studies/11/3/ghs110307.xml
Untitled,https://www.biorxiv.org/content/biorxiv/early/2017/12/04/229070.source.xml
