Stable Isotopes - Anthropology - Oxford Bibliographies,https://www.oxfordbibliographies.com/view/document/obo-9780199766567/obo-9780199766567-0153.xml
Chapter 7 Isotope Analysis and Radiocarbon Dating of Human ... - Brill,https://brill.com/view/book/9789004433755/BP000007.xml%3Flanguage%3Den
Subseasonal Variations of Stable Isotopes in Tropical Andean ...,https://journals.ametsoc.org/view/journals/hydr/20/5/jhm-d-18-0163_1.xml
Lead Isotopes in North American Precipitation Record the Presence ...,https://journals.ametsoc.org/view/journals/bams/103/2/BAMS-D-20-0212.1.xml
Results of Radioactive Isotope Encephalography in Patients with ...,https://thejns.org/view/journals/j-neurosurg/11/3/article-p262.xml
Isotope Cisternography in Hydrocephalus with Normal Pressure in,https://thejns.org/view/journals/j-neurosurg/29/5/article-p555.xml
A light carbon isotope composition for the Sun - Nature,https://journals.scholarsportal.info/pdf/20411723/v9inone/nfp_alcicfts.xml
Tracing lipid metabolism: the value of stable isotopes,https://joe.bioscientifica.com/downloadpdf/journals/joe/226/3/G1.xml
THE DETERMINATION OF CORTISOL AND CORTICOSTERONE ...,https://eje.bioscientifica.com/view/journals/eje/43/3/acta_43_3_011.xml
