A HOMEMADE THERMOGRAPH in: Bulletin of the American ...,https://journals.ametsoc.org/view/journals/bams/9/11/1520-0477-9_11_183b.xml
Thermographic imaging of cutaneous sensory segment in patients ...,https://thejns.org/downloadpdf/journals/j-neurosurg/62/5/article-p716.xml
Thermographic presentation of cutaneous sensory and vasomotor ...,https://thejns.org/downloadpdf/journals/j-neurosurg/62/5/article-p711.xml
Thermographic Method Based Accelerated Fatigue Limit Calculation ...,http://www.degruyter.com/view/j/pomr.2015.22.issue-4/pomr-2015-0073/pomr-2015-0073.xml
Evaluation of thermographic imaging of the limbs of healthy dogs in,https://avmajournals.avma.org/view/journals/ajvr/68/10/ajvr.68.10.1064.xml
Thermographic evaluation of the autonomic effects of nerve blocks ...,https://japmaonline.org/view/journals/apms/79/3/87507315-79-3-107.xml
Thermographic applications in podiatric medicine in,https://japmaonline.org/view/journals/apms/70/4/87507315-70-4-187.xml
Thermographic quantitative variables for diabetic foot assessment ...,https://journals.scholarsportal.info/details/21681163/v7i5-6/660_tqvfdfapr.xml
