AFFIRMATIVE ACTION APPROPRIATE UNDER TITLE VII OF THE ...,https://www.govinfo.gov/content/pkg/CFR-2012-title29-vol4/xml/CFR-2012-title29-vol4-part1608.xml
"SAGE Reference - Dictionary of Race, Ethnicity and Culture",https://sk.sagepub.com/reference/dictionary-of-race-ethnicity-and-culture/n6.xml
Women Yoga Practitioners' Experiences in the Pandemic,https://journals.humankinetics.com/view/journals/ssj/aop/article-10.1123-ssj.2020-0207/article-10.1123-ssj.2020-0207.xml
Issue 65 (Mar 2013): Toward an anthropology of affirmative action ...,https://www.berghahnjournals.com/view/journals/focaal/2013/65/focaal.2013.issue-65.xml
Is Diversity Racial Justice? Affirmative Action in Admissions and the ...,https://brill.com/abstract/book/edcoll/9789004291225/BP000005.xml
A Systematic Approach to Affirmative Action in: Journal of Sport ...,https://journals.humankinetics.com/view/journals/jsm/3/2/article-p151.xml
