sitemap.xml - Marines,http://marines.com/sitemap.xml
The United States Marine Corps - Military History - Oxford ...,https://www.oxfordbibliographies.com/view/document/obo-9780199791279/obo-9780199791279-0190.xml
The COMBLE campaign: a study of marine boundary-layer clouds in ...,https://journals.ametsoc.org/view/journals/bams/aop/BAMS-D-21-0044.1/BAMS-D-21-0044.1.xml
Diversity of Marine Heatwaves in the South China Sea Regulated by ...,https://journals.ametsoc.org/view/journals/clim/35/2/JCLI-D-21-0309.1.xml
The International Journal of Marine and Coastal Law Advance ... - Brill,https://brill.com/view/journals/estu/aop/issue.xml
"Marine Scientific Research, New Marine Technologies and the Law ...",https://brill.com/abstract/book/edcoll/9789004469372/BP000001.xml
OpenCPN Chart Plotter Navigation,http://opencpn.shoreline.fr/__OpenCPN_OA/5_Au_secour/AS_03_Trucs_et_astuces/Adapter_couleur_CM93/chartsymbols_V_4.2.xml
National Transportation Safety Board Marine Casualty Investigations,https://www.govinfo.gov/content/pkg/CFR-2016-title49-vol7/xml/CFR-2016-title49-vol7-part850.xml
50 CFR Part 222 -- General Endangered and Threatened Marine ...,https://www.gpo.gov/fdsys/pkg/CFR-2017-title50-vol10/xml/CFR-2017-title50-vol10-part222.xml
Properties and Drivers of Marine Heat Waves in the Northern South ...,https://journals.ametsoc.org/view/journals/phoc/52/5/JPO-D-21-0236.1.xml
Marine Pharmacology,https://www.midwestern.edu/departments/marinepharmacology.xml
