Articulating artfulness: Exploring the ecological potential of creative ...,https://rgs-ibg.onlinelibrary.wiley.com/doi/pdf/10.1111/tran.12398
Artfulness in the organizational playground - SAGE Journals,https://journals.sagepub.com/pb-assets/cmscontent/ARJ/Artfulness%2520in%2520the%2520organisational%2520playground%2520CFP-1561987291010.pdf
AN ANALYSIS OF THERAPEUTIC ARTFULNESS,https://ajp.psychiatryonline.org/doi/pdf/10.1176/ajp.114.8.719
"Artfulness and Artlessness, the Literary and Political Uses of ... - Cairn",https://www.cairn.info/load_pdf.php%3FID_ARTICLE%3DRFEA_127_0034%26download%3D1
Artfulness in Young Children's Spoken Narratives,https://www.tandfonline.com/doi/pdf/10.1080/10409280903440620
"[PDF] Art, Artfulness, or Artifice?: A Review of <em>The Art of Statistics",https://digitalcommons.usf.edu/cgi/viewcontent.cgi%3Farticle%3D1353%26context%3Dnumeracy
Artfulness and Style,https://muse.jhu.edu/article/721477/pdf
Artfulness in the Early South African Oral-Style Story - jstor,https://www.jstor.org/stable/2637425
The Artful Teacher: A Conceptual Model for Arts Integration in Schools,https://www.jstor.org/stable/24465459
Gender and Artfulness in Rochester's 'Song of a Young Lady to Her ...,https://www.cambridge.org/core/services/aop-cambridge-core/content/view/457926781693A59733B3C6325E75770D/stamped-9781846317644c1_p6-20_CBO.pdf/text_and_gender.pdf
The artfulness of the fake - Nature,https://www.nature.com/articles/sj.bdj.2015.199.pdf%3Forigin%3Dppub
A LINGUISTIC ANALYSIS OF SIMILE AND METAPHOR ... - ProQuest,https://search.proquest.com/openview/52265ed04ce34c59ea5e64878f9586f9/1.pdf%3Fpq-origsite%3Dgscholar%26cbl%3D18750%26diss%3Dy
Company - CITEVE,https://www.citeve.pt/filedownload.aspx%3Fschema%3D4c65f7f1-2e56-4968-a1af-585420fa64e0%26channel%3D92F2784A-AA2A-4A3D-9E7F-22D027D92BCE%26content_id%3D5855F814-F7F8-4C1E-888E-90F8DE689482%26field%3Dstorage_image%26lang%3Dpt%26ver%3D1%26filetype%3Dpdf%26dtestate%3D2020-09-21124435
"Biennial art and its rituals: value, political economy and artfulness",https://www.researchgate.net/publication/333835397_Biennial_art_and_its_rituals_value_political_economy_and_artfulness/fulltext/5d08480c458515ea1a6d7402/Biennial-art-and-its-rituals-value-political-economy-and-artfulness.pdf
[PDF] CHAPTER 3 MITCH'S ARTFULNESS This chapter will discuss about ...,http://digilib.uinsby.ac.id/18488/6/Bab%25203.pdf
[PDF] A Positive Psychology Qualitative Approach. Journal Issue - ERIC,https://files.eric.ed.gov/fulltext/EJ1087095.pdf
[PDF] Artfulness: Emergent Collectivities and Processes of Individuation,https://reclaimingparticipation.files.wordpress.com/2014/03/keynotes_abstracts.pdf
"[PDF] MATERIAL, INTEGRITY, HONESTY, BEAUTY, NATURAL ... - Girvin",https://www.girvin.com/clients/mtm-luxury-lodging-the-bardessono/
Art and artfulness in headship in rural China - Informit,https://search.informit.org/doi/pdf/10.3316/aeipt.134952
[PDF] SBS Art Club Registration Form - South Baddesley,https://www.southbaddesley.hants.sch.uk/wp-content/uploads/2019/01/Art-Club-Registration-Form-Spring-2.pdf
