Understanding the Physical Implications of Machine Learning in,https://journals.ametsoc.org/view/journals/bams/100/11/bams-d-18-0195.1.xml
Advancing Maritime Transparent Cirrus Detection Using the ...,https://journals.ametsoc.org/view/journals/atot/38/6/JTECH-D-20-0130.1.xml
A Transparent Method for Step Detection Using an Acceleration ...,https://journals.humankinetics.com/view/journals/jmpb/4/4/article-p311.xml
A Transparent Method for Step Detection Using an Acceleration ...,https://journals.humankinetics.com/abstract/journals/jmpb/aop/article-10.1123-jmpb.2021-0011/article-10.1123-jmpb.2021-0011.xml
Translucent – Diaphanum in the Medium of Stained Glass in - Brill,https://brill.com/abstract/book/edcoll/9789004395718/BP000009.xml
Counterfactuals as Transparency Tools in ADM,https://journals.scholarsportal.info/pdf/22919732/v08i0001/121_tdmotcattia.xml
FORM D - SEC.gov,https://www.sec.gov/Archives/edgar/data/1799037/000179903720000001/xslFormDX01/primary_doc.xml
2.1.2 The greenhouse effect - Earth and Climate,http://www.climate.be/textbook/chapter2_node4.xml
STRUCTURAL ELEMENTS WITH TRANSPARENT WOOD IN ...,https://akjournals.com/downloadpdf/journals/1848/9/2/article-p101.xml
