Kirk Walters: Change in scenery | The Blade,https://www.toledoblade.com/Editorial-Cartoons/2017/12/09/Kirk-Walters-5/stories/feed/feed/index.rss
Scenery is the draw of Norwegian cruise | The Blade,https://www.toledoblade.com/opinion/2003/07/20/Scenery-is-the-draw-of-Norwegian-cruise/stories/feed/index.rss
Airport comments for Iceland - OurAirports,https://ourairports.com/countries/IS/comments.rss
Airport comments for Portugal - OurAirports,https://ourairports.com/countries/PT/comments.rss
Jan Pohribný & Kirsimaria E. Törönen - Behind the Paradise Border,https://www.mzv.cz/helsinki/en/embassy_gallery/jan_pohribny_kirsimaria_e_toronen_behind.rss
Archipelago - Buzzsprout,https://feeds.buzzsprout.com/290047.rss
Covert - Audioboom,https://audioboom.com/channels/4960561.rss
Nightmare on Film Street - A Horror Movie Podcast - Acast,https://audioboom.com/channels/5016585.rss
"Hotel ZUR BURG, Kaprun, Austria | Home",http://www.hotel-zurburg.com/de/wordpress/fotogaleria/snem-kosice/album.rss%3Fdokumenty%3D7
