21 Com - photometry at Hβ. - NASA/ADS,https://adsabs.harvard.edu/full/1987CoSka..16....7Z
Comparative transcriptomics suggest unique molecular adaptations ...,https://europepmc.org/articles/pmc6652013/bin/12864_2019_5912_moesm2_esm.7z
A Volumetric Analysis of the 1 H NMR Chemical Shielding in ...,https://europepmc.org/articles/pmc8036968/bin/ijms-22-03333-s001.7z
OJJ Megapack For CTA. 7z : Smiley Guy Studios / MyClone,https://archive.org/details/ojjmegapackforcta.7z
Best Service Voice Spectral Vol. 1 - Internet Archive,https://archive.org/details/best-service-voice-spectral-vol.-1.7z
Athena Too (Selectable Female PC) - Star Wars: KotOR II - The Games,https://gamefront.online/files/6823272/athena_too_13.7z
Configuration.File,http://175.96.49.173/login_admin/website.7z
"ASP - Copyright Tektronix, Inc.",http://175.96.14.165/1759615132admin.7z
"Index of..etc - \""index.of.personal\""",http://175.96.15.152/loginok/include/sql.7z
Microsoft Site Server Analysis - i-secure,http://140.114.245.146/140_114_245_99:88.7z
Data Frame - Browser not HTTP 1.1 compatible - of /password,http://140.114.245.161/site.7z
