"Chapter 14: The right to water and its misconceptions, between ...",https://www.elgaronline.com/abstract/edcoll/9781783479603/9781783479603.00023.xml
Demagogues and Demagoguery in Hellenistic Greece - Brill,https://brill.com/downloadpdf/journals/agpt/39/1/article-p35_2.xml
"Marxism, Anarchism, and the Nietzschean Critique of Capitalism - Brill",https://brill.com/previewpdf/book/edcoll/9789004415577/BP000011.xml
The Situated Politics of Belonging - SAGE Books,https://sk.sagepub.com/books/the-situated-politics-of-belonging/n1.xml
Citizenship beyond the State - SAGE Books,https://sk.sagepub.com/books/citizenship-beyond-the-state/n1.xml
[PDF] The failure of the military coup in April 2002 (more than 80 per cent of,https://journals.scholarsportal.info/pdf/00810606/v44inone/nfp_baciv.xml
Arab politics: oriental despotism - manchester hive,https://www.manchesterhive.com/downloadpdf/9781526142924/9781526142924.00009.xml
Is Democracy Possible in Russia? in: The Soviet and Post-Soviet ...,https://www.schoeningh.de/view/journals/spsr/48/1/article-p58_4.xml%3Frskey%3DXch2f9%26result%3D4
bated elytrorrhaphy actinopterous syzygy - And then it crashed,https://blog.etianen.com/downloads/code/python-xml/books.xml
