a high-elevation small mammal endemic to the Spring Mountains in ...,https://jmammal.oxfordjournals.org/content/97/4/1033.ref-stubs.xml
"Behavioral Aspects of Spatial Organization in the Chipmunk, Tamias ...",https://brill.com/view/journals/beh/36/3/article-p215_4.xml%3Flanguage%3Den
Assessing anti-predator decisions of foraging eastern chipmunks ...,https://brill.com/view/journals/beh/154/2/article-p131_1.xml%3Flanguage%3Den
Predicting the distribution of a rare chipmunk (Neotamias ...,https://bioone.org/journals/journal-of-mammalogy/volume-101/issue-4/gyaa057/Predicting-the-distribution-of-a-rare-chipmunk-Neotamias-quadrivittatus-oscuraensis/10.1093/jmammal/gyaa057.xml
Isolation of La Crosse Virus (California Encephalitis Group) from the ...,https://www.ajtmh.org/view/journals/tpmd/24/6/article-p999.xml
Oral Infection and Transmission of La Crosse Virus by an Enzootic ...,https://www.ajtmh.org/view/journals/tpmd/34/5/article-p992.xml
Endangered Species Status for the Peñasco Least Chipmunk and ...,https://www.govinfo.gov/metadata/granule/FR-2021-09-28/2021-20934/mods.xml
golden hamster (Helle 1953) and in the chipmunk (Woodward Sc ...,https://eje.bioscientifica.com/downloadpdf/journals/eje/52/1/acta_52_1_014.xml
1. Introduction - Hindawi.com,http://downloads.hindawi.com/journals/ijz/2013/876347.xml
