Delivers First Integrated Hosted and On Premise CRM Solution,http://www.oracle.com/ocom/groups/public/%40crmondemand/documents/webcontent/6231_en.xml
FORM D - SEC.gov,https://www.sec.gov/Archives/edgar/data/1745524/000174552418000001/xslFormDX01/primary_doc.xml
"The Colonial Dénouement, Denmark's Withdrawal from Africa ... - Brill",https://brill.com/view/book/9789004231993/B9789004231993-s017.xml
Conceptually Grounded Analysis: The Elusive Facticity and Ethical ...,https://methods.sagepub.com/book/critical-management-research/n11.xml
Upshot of Food Add-Ons on the Life History and Development of ...,https://journals.scholarsportal.info/details/10213589/v25i0001/37_uofaotadotct.xml
"Manager, Federal Crop Insurance Corporation. - GovInfo.gov",https://www.govinfo.gov/content/pkg/FR-2004-07-27/xml/FR-2004-07-27.xml
sitemap-episodes.xml - DisneyNOW,https://disneynow.com/shows/big-hero-6-the-series/sitemap-episodes.xml
"TACITUS, Annals | Loeb Classical Library",https://www.loebclassics.com/view/tacitus-annals/1931/pb_LCL312.321.xml%3FmainRsKey%3DT2mi4p%26readMode%3Drecto
Inclusive co-optation and political corruption in Museveni's Uganda in,https://www.elgaronline.com/abstract/edcoll/9781788972512/9781788972512.00011.xml
