Spike's Car Radio - Audioboom,https://audioboom.com/channels/5028669.rss
Rambling About Cars by Motor1.com - Audioboom,https://audioboom.com/channels/5048375.rss
8 Best Cars of 2015 - Business Insider,https://www.thisisinsider.com/the-best-cars-of-2015-2015-9/bi.rss
2016 was year of extremes for autos | The Blade,https://www.toledoblade.com/Automotive/2016/12/31/2016-was-year-of-extremes-for-autos/stories/feed/index.rss
"Buyers look under hood for horsepower, speed - Toledo Blade",https://www.toledoblade.com/Automotive/2017/04/13/Buyers-look-under-hood-for-horsepower-speed/stories/feed/index.rss
Mick and Ori's Classic Cars - Buzzsprout,https://feeds.buzzsprout.com/1216310.rss
The Back Roads: Podcast - Buzzsprout,https://feeds.buzzsprout.com/1685185.rss
The Collector Car Podcast - Libsyn,https://pod.link/1460713022.rss
Zooming with DRIVEN - Spreaker,https://omny.fm/shows/zooming-with-driven/playlists/podcast.rss
