[PDF] A New Procedure for Calculating Immittance Characteristics Using ...,https://engineering.purdue.edu/~sudhoff/ee631/impedance5.pdf
[PDF] Audiometry Procedures Manual - CDC,https://www.cdc.gov/nchs/data/nhanes/nhanes_05_06/au.pdf
"Acoustic Immittance, Absorbance, and Reflectance in the Human ...",https://www.thieme-connect.com/products/ejournals/pdf/10.1055/s-0034-1396924.pdf
immittance characteristics of the acoustic reflex,https://pubs.asha.org/doi/pdf/10.1044/jshr.2203.480
"Synthesis of immittances with real, single poles and arbitrary zeros",https://onlinelibrary.wiley.com/doi/pdf/10.1002/cta.4490010211
Matrix-pencil approach to design super-immittances - IEEE Xplore,https://ieeexplore.ieee.org/iel7/7115433/7128969/07128985.pdf
Two-Port Characterization and Transfer Immittances of AC-DC ...,https://ieeexplore.ieee.org/iel7/8782709/9343742/09512301.pdf
Systematic synthesis of R±L and C±D immittances using single CCIII,http://www.tandfonline.com/doi/pdf/10.1080/002072100132192
Synthetic methods for floating immittances of one-ports and z and y ...,https://www.tandfonline.com/doi/pdf/10.1080/00207219308925861
[PDF] Some applications for series impedance elements in radio ...,https://nvlpubs.nist.gov/nistpubs/jres/74C/jresv74Cn3-4p79_A1b.pdf
