Westfield to buy remaining 50% in World Trade Center for $800M ...,https://www.toledoblade.com/Real-Estate/2013/12/04/Westfield-to-buy-remaining-50-in-World-Trade-Center-for-800M/stories/feed/feed/index.rss
Last remaining Czechoslovak fighter pilot General Emil Boček came ...,https://www.mzv.cz/london/en/what_s_new/last_remaining_czechoslovak_fighter.rss%3Fforce_format%3Dmobile
Last remaining Czechoslovak fighter pilot General Emil Boček ... - MZV,https://www.mzv.cz/london/en/what_s_new/last_remaining_czechoslovak_fighter%241325.rss%3Fforce_format%3Dmobile
Stress tests | American Banker,https://www.paymentssource.com/tag/stress-tests.rss
Remaining walls / Les murs qui restent / Verbliebene Mauern ...,https://www.subscribebyemail.com/api.substack.com/feed/podcast/19974.rss
"Search results for author:(Gibson, Rex) 0 10 4 http://prism ...",https://prism.librarymanagementcloud.co.uk/wolverhampton/items.rss%3Fquery%3Dauthor%253A%2528Gibson%252C%2BRex%2529%26sort%3Drelevance
NHL Fantasy on Ice - Audioboom,https://audioboom.com/channels/4975974.rss
Nepali Congress maintains lead over CPN-UML in Nepal polls,http://indiatoday.intoday.in/story/nepal-polls-nepali-congress-nepal-constitution-prachanda-ucpn-maoist-cpn-uml/1/326311.rss
