Turned Out A Punk - Audioboom,https://audioboom.com/channels/3081610.rss
Chayga Ex (@mouhamedali) | Lookbook,https://lookbook.nu/user/6146575-Chayga-E/looks/hyped.rss
"Rihanna, Pink, to perform at VMA; Sheryl Crow wants people to vote ...",https://www.toledoblade.com/Music-Theater-Dance/2008/08/22/Rihanna-Pink-to-perform-at-VMA-Sheryl-Crow-wants-people-to-vote/stories/feed/index.rss
The Gospel According to House - Buzzsprout,http://www.buzzsprout.com/8183.rss
Tide Chasers Podcast - Megaphone,https://feeds.buzzsprout.com/1726264.rss
Latest Bollywood actors Podcast Episodes - Pod.casts,https://pod.casts.io/topics/bollywood%2520actors/new-episodes.rss
Library Talks - Pod.casts - The Podcast Discovery Service,https://pod.casts.io/podcasts/library-talks-804982781.rss
Marlon and Jake Read Dead People - Simplecast,https://pod.link/1492163935.rss
Las Culturistas with Matt Rogers and Bowen Yang - Omny Studio,https://www.omnycontent.com/d/playlist/e73c998e-6e60-432f-8610-ae210140c5b1/f6816727-c503-47ac-a7ac-ae2700391b1e/935c500f-8bb0-436b-ba7f-ae2700391b49/podcast.rss
