ActivTrax,https://instructions.activtrax.com/instructions/employee/Online%2BNutrition%2BProgram%25257C5%252529%2BTracking%2BBlood%2BSugar%2BLevels.flv%3Ftype%3Dflv
Emory Track Renovation Continues,https://www.emoryathletics.com/sports/mtrack/video/Track_Renovation(0812).flv
"Video Interview: Daniel Tuttle, SCAC Men's Track Athlete-of-the-Week",https://www.southwesternpirates.com/sports/m-track/2011-12/videos/Daniel_Tuttle_4-4-12.flv
Japan to host joint missile tracking drill amid North Korea threat,https://www.northkoreatimes.com/news/255696347/oct04v56.flv
Track & field teams kick off season with wins at the SU Spring Classic,https://salisbury.prestosports.com/sports/track/2010-11/videos/TRACK_Spring_Classic_highlights_3-5-11.flv
Claremont Mudd Scripps - CMS Athletics,https://cms.prestosports.com/multimedia/videos/flash/wten_video_bios/AlleHsu.flv
University of Maine at Farmington Athletics,https://athletics.umf.maine.edu/video/varsity_sports30_a.flv
GNAC,https://www.thegnac.com/video/Around_the_GNAC_2012-8-8.flv
Great Northeast Athletic Conference - GNAC,https://www.thegnac.com/video/GNAC_DVD_8-10-10.flv
