"Copulatory Behavior, Genital Morphology, and Male ... - jstor",https://www.jstor.org/stable/2640927
Patterns of Copulatory Behavior in Male Mammals - JSTOR,https://www.jstor.org/stable/2820822
Evolution of the copulatory apparatus,https://www.tandfonline.com/doi/pdf/10.1080/11250008409439463
Patterns of Copulatory Behavior in Male Mammals,https://www.journals.uchicago.edu/doi/pdfplus/10.1086/407097
The role of the copulatory plug in reproduction of the guinea pig,https://onlinelibrary.wiley.com/doi/pdf/10.1002/jez.1401960108
COPULATORY COURTSHIP AND CRYPTIC FEMALE CHOICE IN ...,https://onlinelibrary.wiley.com/doi/pdf/10.1111/j.1469-185X.1991.tb01133.x
[PDF] Evidence to Suggest that Copulatory Vocalizations in Women Are ...,http://clok.uclan.ac.uk/1171/1/PAPER%25202%2520UPDATED%2520Vocalization%2520revision%25202.doc
Genetic and phenotypic influences on copulatory plug survival in mice,https://www.nature.com/articles/hdy201550.pdf%3Forigin%3Dppub
COPULATORY BEHAVIOUR AND DIFFERENTIAL ...,https://www.sciencedirect.com/science/article/pii/S0003347280800121/pdf%3Fmd5%3D0cf6dfa52095bf4d65cd5d19ee1b6e4e%26pid%3D1-s2.0-S0003347280800121-main.pdf
