Bulls All-Access,http://buffalo.prestosports.com/video/bullseye/ep401_pg110_02_Jeff_Quinn_on_team_BE-youtube_h.264_crop.flv
Bentley vs. Merrimack - Highlights Courtesy of Pack Network,https://www.northeast10.org/sports/mbkb/videos/MBKB-BENMER11182009.flv
"News 13 | Florida News Video | Orlando, Daytona Beach",https://ifasgallery.ifas.ufl.edu/poncho69/Pool-Safety-0608.flv
Additional Websites/Resources - IDHS,https://www.dhs.state.il.us/page.aspx/FACT_1WhatIsVR.flv%3Fitem%3D87985
"Volume XI, Issue XLI - June 2018 - IDHS",https://www.dhs.state.il.us/page.aspx/FACT_Intro.flv%3Fitem%3D106204
Universal platform WiseMote - the WiSeNet Lab,http://www.wisenetlab.ru/forum/clever_chalk1.flv%3FPage%3Dplatform
MTV Launches Drive to Get Young People to Vote,https://www.shanghaisun.com/news/257866707/oct04v56.flv
Big Red Earn Big Win at No. 9 Yale (Video courtesy of CBS Sports ...,https://www.ecachockey.com/men/video/2011-12/20110511_Yale_Cornell_CBSSports-desktop.flv
BBC Radio 4 Appeal - Global Witness,https://www.globalwitness.org/sites/default/files/import/radio4appeal_hi.flv
"Oh, blip. (404)",http://skuld.cs.umass.edu/traces/mmsys/2013/blip/Dev/AlternativeVideo/Nitaai-00001Ekachakra263.flv
"Egypt says it fights fake news, critics see new crackdown | News24",https://www.iranherald.com/news/258000999/oct04v56.flv
"Months after sale to Meredith, Time magazine sold again",https://www.iranherald.com/news/258001009/oct04v56.flv
Counselor Magazine December 2014: iClick 1 - My Digital Publication,https://counselor-digital.com/december-2014/repo30/5503/246238/uploads/Counselor_March_2015_video.flv
"Emirates cashes in, launches Edinburgh-Dubai direct flights",https://www.irishsun.com/news/257216847/oct04v56.flv
China to spend $503 billion to expand railway system,https://www.irishsun.com/news/250557517/oct04v40.flv
Malta watchdog: EBA drops anti-money-laundering probe,https://www.africaleader.com/news/258041324/oct04v40.flv
Oscars 2019: Sam Rockwell's cufflinks are a tribute to his dog Sadie,https://www.munichmetro.com/news/259687168/feb24v21.flv
Vicky Kaushal stuns in 'Sanju' - Big News Network.com,https://www.indiagazette.com/news/257602849/feb24v21.flv
Happy Birthday to me: Alia Bhatt - Big News Network.com,https://www.entertainmentsun.com/news/256745306/oct04v40.flv
7-month-old Japanese baby's hair take internet by storm,https://www.beijingbulletin.com/news/257757896/oct04v56.flv
OPPLE launches JBL ceiling light - where light meets sound,https://www.malaysiasun.com/news/258478767/feb24v21.flv
"Broncos waive former 1st-round pick Lynch, claim QB Hogan",https://www.kansascitypost.com/news/257931938/oct04v56.flv
7 year old school kid finishes the Rubik's Cube in 51 seconds,https://www.batonrougepost.com/news/258615237/feb24v21.flv
"Sudan gains, Uber challenged: Careem launches in Sudan",https://www.manufacturingmirror.com/news/257959309/oct04v56.flv
"Seeking sales boost, French brand Longchamp expands in China",https://www.israelherald.com/news/258026008/oct04v40.flv
"APC to set up biotech facility, hire 120 at its Dublin HQ",https://www.stpetersburgstar.com/news/258052048/oct04v56.flv
Massive drug bust: Heroin and crack cocaine seized,https://www.dublinnews.com/news/255829698/oct04v56.flv
Saif Ali Khan is unstoppable in 'Baazaar' trailer,https://www.nigeriasun.com/news/258041295/oct04v40.flv
"Russia-India relationship marked by trust, respect: Putin",https://www.orangecountysun.com/news/258088680/oct04v40.flv
Praveen Kumar bids adieu to cricket - Big News Network.com,https://www.vietnamtribune.com/news/258149498/feb24v21.flv
Bahraiin gets $10 billion financial aid from neighbours,https://www.middleeaststar.com/news/258088599/oct04v40.flv
Another U.S. school shooting: North Carolina student killed,https://www.santabarbarapost.com/news/258211705/feb24v21.flv
Ten injured after fire erupts at German oil refinery,https://www.tuscaloosatimes.com/news/257928641/oct04v56.flv
Israeli government to spy on social media users worldwide,https://www.tucsonpost.com/news/256255130/oct04v56.flv
What's he thinking? How Donald Trump Jr. views his father,https://www.houstonmirror.com/news/255110696/oct04v40.flv
CVMC eyes to become mega hospital by 2022,https://www.manilametro.com/news/257529014/oct04v40.flv
"Wipro defies industry slowdown, bags deal worth $1.5 billion",https://www.germanysun.com/news/257931885/oct04v56.flv
Major restrictions placed on condom ads on Indian television,https://www.londonmercury.com/news/255714461/oct04v56.flv
"Deep, undersea 8.2 magnitude earthquake strikes Fiji coast",https://www.oaklandtimes.com/news/257862711/oct04v56.flv
