98 S4879 IS: Fairness for Crime Victims Act of 2020 U.S. Senate ...,https://www.congress.gov/116/bills/s4879/BILLS-116s4879is.xml
A Dumbbell Pattern in NGO Fundraising: The Case of World Vision in,https://brill.com/view/journals/cnpr/3/1/article-p115_7.xml%3Flanguage%3Den
Relief in China credit amid reassurances - DBS Bank,https://www.dbs.com.sg/vickers/aics/templatedata/article/generic/data/en/GR/macro_strategy/102021/211022_credit.xml
sitemap-mortgage.xml - Citi Bank,https://www.online.citibank.co.in/sitemap-mortgage.xml
countries record stronger external positions - IMF staff are projecting ...,https://www.elibrary.imf.org/downloadpdf/journals/023/0029/007/article-A004-en.xml
Designing a Global Compact on Education in,https://www.elibrary.imf.org/view/journals/022/0042/002/article-A012-en.xml
ENGROSSED SECOND SUBSTITUTE HOUSE BILL 2569 State of ...,https://app.leg.wa.gov/documents/billdocs/2013-14/Xml/Bills/House%2520Bills/2569-S2.E.xml
image-sitemap-2020-11-12.xml - CNBC TV18,https://www.cnbctv18.com/image-sitemap-2020-11-12.xml
Indigenous Girls in Rural Mexico - Berghahn Journals,https://www.berghahnjournals.com/downloadpdf/journals/girlhood-studies/9/2/ghs090206.xml
