A Comparison of the Social Postures of Some Common Laboratory ...,https://brill.com/view/journals/beh/21/3-4/article-p246_4.xml%3Flanguage%3Den
Chapter 22 Rodents in Children's Literature and Audiovisual Fairy ...,https://brill.com/view/book/9789004418998/BP000026.xml
"Rodents, Rabbits and Tularemia in North America - American ...",https://www.ajtmh.org/view/journals/tpmd/s1-25/4/article-p349.xml
Leptospirosis in Man and Rodents on Taiwan in - American Journal ...,https://www.ajtmh.org/view/journals/tpmd/17/5/article-p760.xml
Voluntary exercise and depression-like behavior in rodents: are we ...,https://jme.bioscientifica.com/view/journals/jme/60/3/JME-17-0165.xml
Novel organization of the spermatozoon in two species of murid ...,https://rep.bioscientifica.com/view/journals/rep/99/1/jrf_99_1_022.xml
Ectoparasite Diversity and Exposure to Vector-Borne Disease ...,https://jme.oxfordjournals.org/content/44/2/328.source.xml
Nutritional Ecology of Microtine Rodents: Digestibility of Forage,http://jmammal.oxfordjournals.org/content/60/4/740.source.xml
Gross stomach morphology in akodontine rodents (Cricetidae,https://bioone.org/journals/journal-of-mammalogy/volume-101/issue-3/gyaa023/Gross-stomach-morphology-in-akodontine-rodents-Cricetidae--Sigmodontinae/10.1093/jmammal/gyaa023.xml
