socialfest_hack/requirements.txt at main · Signior-X/socialfest_hack ...,https://github.com/Signior-X/socialfest_hack/blob/main/requirements.txt
Much Ado About Nothing - TXT - The Folger SHAKESPEARE,https://shakespeare.folger.edu/downloads/txt/much-ado-about-nothing_TXT_FolgerShakespeare.txt
Shakespeare: First Folio The Taming of the Shrew 779 Greta ...,http://triggs.djvu.org/djvu-editions.com/SHAKESPEARE/TAMING/p0022.txt
TTOTS6.txt,ftp://hiretracknx.com/pub/cybiko/cybooks/ttots/TTOTS6.txt
Much Ado About Nothing Shakespeare homepage | Much Ado ...,http://www.cs.wpi.edu/~cs2303/c17/Resources_C17/MuchAdoAboutNothing.txt
"Author 1, training sample 1",http://www.mathcs.duq.edu/~juola/problems/problemD/Dtrain01-01.txt
William Shakespeare. The Taming Of The Shrew,http://lib.ru/SHAKESPEARE/ENGL/taming_en.txt
"The ""Master of Courtesy fragment"" - cut out from http://www ...",https://extra.shu.ac.uk/emls/editor/masterofcourtesy.txt
"Oli. When last the yong Orlando parted from you, He left a promise to ...",http://snap.stanford.edu/class/cs246-2011/hw_files/hw1q1.txt
THE TAMING OF THE SHREW ACT V ...,https://www.mylostsoul.net/~robk/Shakespeare/0081/00813.txt
