The Revival of Vivisection in the Sixteenth Century - jstor,https://www.jstor.org/stable/42628770
Claude Bernard and Vivisection - JSTOR,https://www.jstor.org/stable/24621665
[PDF] THE VIVISECTION CONTROVERSY IN AMERICA - Instituto Franklin ...,https://www.institutofranklin.net/sites/default/files/2021-03/Vivisection-in-america-Case-Study-DEF.pdf
"Vivisection, morals, medicine: commentary - Journal of Medical Ethics",https://jme.bmj.com/content/medethics/9/2/102.full.pdf
Vivisection and the True Aims of Education in Biology,https://online.ucpress.edu/abt/article-pdf/34/5/254/40581/4443923.pdf
Vivisection and the Mayos,https://www.mayoclinicproceedings.org/article/S0025-6196(12)61193-8/pdf
The Ethics of Vivisection - SAGE Journals,https://journals.sagepub.com/doi/pdf/10.1177/0040571X7507800704
Vivisection in Harvard Medical School — A Reply - New England ...,https://www.nejm.org/doi/pdf/10.1056/NEJM190003011420901
[PDF] Vivisection and Moral Introspection in Nietzsche - ScholarWorks ...,https://scholarworks.gsu.edu/cgi/viewcontent.cgi%3Farticle%3D1310%26context%3Dphilosophy_theses
Vivisection debate in nineteenth century Great Britain - Wiley Online ...,https://onlinelibrary.wiley.com/doi/pdf/10.1111/j.1751-0813.1998.tb12283.x
Sensation and Empathy in Illustrations of Vivisection in the ...,https://muse.jhu.edu/article/753555/pdf
[PDF] Sources on alternative methods to replace vivisections - UPF,https://www.upf.edu/documents/3399181/145767923/Alternative%2Bmethods%2Bv1%2BENG.pdf/65181a2e-cb1d-b5cd-f04a-f82cda80f0b3
The Revival of Vivisection in the Sixteenth Century - Springer LINK,https://link.springer.com/content/pdf/10.1007%252Fs10739-012-9326-8.pdf
[PDF] Vivisection as War: The “Moral Diseases” of Animal Experimentation ...,https://www.animalsandsociety.org/wp-content/uploads/2016/05/glaholt.pdf
[PDF] Vivisection: A Warranted Practice? - Indiana University,https://scholarworks.iu.edu/journals/index.php/iusburj/article/download/19824/25901
Cruel Knives? Vivisection and Biomedical Research in Victorian ...,https://www.utpjournals.press/doi/pdf/10.3138/cbmh.14.1.37
Vivisection: A Statement in Behalf of Science,https://www.science.org/doi/pdf/10.1126/science.3.64.421
"[PDF] VIVISECTION PAPERS. 1875-1932, 1947 (bulk 1892-1909) .75 ...",https://www.library-archives.cumc.columbia.edu/sites/default/files/finding-aids/M-0190_Vivisection%252520Papers%252520web%252520version.pdf
Celsus on Human Vivisection at Ptolemaic Alexandria - Brill,https://brill.com/previewpdf/book/edcoll/9789004418233/B9789004418233_s004.xml
[PDF] What is needed in order to end vivisection? - Americans for Medical ...,https://www.afma-curedisease.org/media/10922/whatisneededtoendvivisection.pdf
