Chapter 5 The Accepted Companions in: In Praise of the Few ... - Brill,https://brill.com/abstract/book/edcoll/9789004406971/BP000013.xml
"Decline, Reduce or Accept Loans - St. Petersburg College",https://www.spcollege.edu/x3496.xml
Meet your Orientation Leaders - Emmanuel College,https://www.emmanuel.edu/x25769.xml
Resolution and Discovery Accepted Manuscript / Online First (),https://akjournals.com/view/journals/2051/aop/issue.xml
Culture and Evolution Accepted Manuscript / Online First (),https://akjournals.com/view/journals/2055/aop/issue.xml
Apply - Curry College,https://www.curry.edu/x216.xml
Units accepted for use with the SI - Unidata,https://www.unidata.ucar.edu/software/udunits/udunits-2.2.28/udunits2-accepted.xml
Accepted Student Preview Day | Duquesne University,https://www.duq.edu/x118455.xml
An Emotional Literacy Course for High School Students,https://sk.sagepub.com/books/emotional-survival/n7.xml
