Druggist surges in contest | The Blade,https://www.toledoblade.com/business/2009/09/04/Druggist-surges-in-contest/stories/feed/index.rss
Chemist + Druggist pharmacy podcast - Subscribe by Email,https://www.subscribebyemail.com/feeds.soundcloud.com/users/soundcloud:users:178864992/sounds.rss
This Day in South Bend - Buzzsprout,https://feeds.buzzsprout.com/988828.rss
12 Noon BBC Business Update - Audioboom,https://audioboom.com/channels/3078167.rss
Here Be Monsters - Audioboom,https://audioboom.com/channels/1137711.rss
Now The End Begins Bible Study Archives - Sermon Audio,http://www.sermonaudio.com/rss_source.rss%3Fsourceid%3Dnteb
Spoken Word with Electronics - Ethan Persoff,http://www.ep.tc/swwe.rss
Forever Young Radio Show with America's Natural Doctor Podcast ...,https://pod.casts.io/podcasts/forever-young-radio-show-with-america-s-natural-doctor-podcast.rss
Latest Creator economy Podcast Episodes - Pod.casts,https://pod.casts.io/topics/creator%2520economy/new-episodes.rss
