Isolation of an Aureobasidium pullulans polysaccharide that ...,https://journals.scholarsportal.info/details/00084166/v44i0010/954_ioaappaobtwp.xml
"Arthromyces and Blastosporella, two new genera of conidia ...",https://journals.scholarsportal.info/details/09537562/v111i0005/572_aabtnglabftn.xml
Untitled,https://www.biorxiv.org/content/biorxiv/early/2018/09/27/372078.source.xml
Author Summary - PLOS,http://open-repository.kisti.re.kr/cube/bitstream/open_repository/6402/1/journal.ppat.1003335.xml
Effect of ovarian hormones on promotion of bactericidal activity by ...,https://rep.bioscientifica.com/abstract/journals/rep/79/2/jrf_79_2_024.xml
Influence of administration of ovarian steroids on the function of ...,https://joe.bioscientifica.com/view/journals/joe/112/3/joe_112_3_016.xml
Comparing Production and Efficacy of Cordyceps javanica With ...,https://bioone.org/journals/journal-of-economic-entomology/volume-115/issue-2/toac002/Comparing-Production-and-Efficacy-of-Cordyceps-javanica-With-Cordyceps-fumosorosea/10.1093/jee/toac002.xml
Virulence of the Bio-Control Fungus Purpureocillium lilacinum ...,https://bioone.org/journals/journal-of-economic-entomology/volume-115/issue-2/toab270/Virulence-of-the-Bio-Control-Fungus-Purpureocillium-lilacinum-Against-Myzus/10.1093/jee/toab270.xml
[PDF] Efficacy of the Fungus Verticillium lecanii for Suppressing Root,https://journals.ashs.org/horttech/downloadpdf/journals/horttech/9/3/article-p443.xml
