"Complications, outcomes, and management strategies of non ...",https://thejns.org/view/journals/j-neurosurg/134/5/article-p1658.xml
Penetrating Skull Wound from a Pair of Scissors in - Journal of ...,https://thejns.org/view/journals/j-neurosurg/26/6/article-p636.xml
PENETRATING RADIATION IN THE ATMOSPHERE. in,https://journals.ametsoc.org/view/journals/mwre/45/8/1520-0493_1917_45_401a_prita_2_0_co_2.xml
THE PENETRATION OF ATMOSPHERIC INVERSIONS BY HOT ...,https://journals.ametsoc.org/view/journals/atsc/16/1/1520-0469_1959_016_0030_tpoaib_2_0_co_2.xml
rjaa566.pdf - Oxford Academic,https://journals.scholarsportal.info/pdf/20428812/v2021i0001/nfp_ssmoatimaacr.xml
Penetrating head trauma: 03 rare cases and literature review,https://journals.scholarsportal.info/details/19378688/v28inone/nfp_pht0rcalr.xml
Sperm penetration in vitro of human oocytes matured in,https://rep.bioscientifica.com/downloadpdf/journals/rep/64/1/jrf_64_1_018.xml
SAGE Reference - Encyclopedia of United States National Security,https://sk.sagepub.com/reference/nationalsecurity/n494.xml
Create a penetration request,http://www2.me.rochester.edu/courses/ME204/nx_help/en_US/tdocExt/content/5/xid455055.xml
