Meat and magic: or why your dinner can be good for nature and the ...,https://brill.com/abstract/book/edcoll/9789004277946/B9789004277946-s027.xml
"April 10, 2021 Westminster (Pa.) at Bethany",https://www.bethanybison.com/sports/bsb/2020-21/boxscores/20210410_dlho.xml%3Fview%3Dplays%26inning%3D2
"Westminster (Pa.) at St. Vincent - May 6, 2021 - 2:00 PM - Box Score ...",https://www.d3baseball.com/seasons/2021/boxscores/20210506_b43t.xml
"Westminster (Pa.) at D'Youville - March 8, 2020 - 5:30 PM - Box Score",https://athletics.dyc.edu/sports/bsb/2019-20/boxscores/20200308_u64q.xml
"Westminster (Pa.) at Husson - March 9, 2020 - 5:30 PM - Box Score ...",https://www.nacathletics.com/sports/bsb/2019-20/boxscores/20200309_tmg1.xml
SEC FORM D/A,https://www.sec.gov/Archives/edgar/data/1644212/000164421215000002/xslFormDX01/primary_doc.xml
rational approach to legacy data validation when transitioning ...,https://jamia.oxfordjournals.org/content/23/5/991.source.xml
"John Carroll at Westminster (Pa.) - April 10, 2019 - 4:00 PM - Box ...",https://www.oac.org/sports/bsb/2018-19/boxscores/20190410_w982.xml
Bog bodies: Face to face with the past - [9781526150196,https://www.manchesteropenhive.com/pdfviewer/full/9781526150196/9781526150196.00008.xml%3Fbg%3DGREY_COLOR_LIGHT_VARIANT%26mgs%3DPRIMARY_COLOR%26mge%3DPRIMART_COLOR_DARK_VARIANT
