Ascorbic Acid in: ASHP® Injectable Drug Information™,https://publications.ashp.org/view/book/9781585286850/ch39.xml
[PDF] Ascorbic Acid - Ashp Publications,https://publications.ashp.org/previewpdf/book/9781585286850/ch39.xml%3FpdfJsInlineViewToken%3D64751622%26inlineView%3Dtrue
EFFECTS OF CLOMIPHENE ON OVARIAN ASCORBIC ACID AND ...,https://eje.bioscientifica.com/view/journals/eje/51/4/acta_51_4_009.xml
OVARIAN ASCORBIC ACID DEPLETION TEST FOR LUTEINIZING ...,https://eje.bioscientifica.com/view/journals/eje/56/4/acta_56_4_007.xml%3Frskey%3DE4YXoy%26result%3D45
"Ascorbic Acid, Thiamin, Riboflavin, and Vitamin B6 Contents Vary ...",https://journals.ashs.org/hortsci/view/journals/hortsci/49/11/article-p1470.xml
Stability of Expression and Concentration of Ascorbic Acid in North ...,https://journals.ashs.org/hortsci/view/journals/hortsci/39/1/article-p156.xml
[PDF] Local treatment with ascorbic acid accelerates recovery of post ...,https://journals.scholarsportal.info/pdf/0100879x/v52i0009/nfp_ltwaaaatimwr.xml
Effect of ascorbic acid on storage of Greyhound erythrocytes in,https://avmajournals.avma.org/view/journals/ajvr/76/9/ajvr.76.9.789.xml
Concentration-Dependent Antioxidant/Pro-Oxidant Activity of ...,https://www.degruyter.com/view/j/prolas.2012.66.issue-6/v10046-012-0018-8/v10046-012-0018-8.xml
