Chapter 16 The Long Cycle of Revolution and the Curse of Nihilism in,https://brill.com/view/book/9789004270954/BP000020.xml
Nietzsche's Nihilism in: Frontiers of Philosophy in China ... - Brill,https://brill.com/view/journals/fphc/11/2/article-p298_11.xml%3Flanguage%3Den
Beyond nihilism in: Adapting philosophy - ManchesterHive,https://www.manchesterhive.com/view/9781847792822/9781847792822.00010.xml
a dispatch on contradiction in international human rights law,https://www.elgaronline.com/view/edcoll/9781786438881/9781786438881.00035.xml
Encyclopedia of Philosophy and the Social Sciences,https://sk.sagepub.com/reference/encyclopedia-of-philosophy-and-the-social-sciences/n254.xml
Entry Ethical Nihilism - SAGE Knowledge,https://sk.sagepub.com/reference/ethics/n302.xml
PROTEST AND DISORDER AFTER THE GLOBAL CRASH,https://www.berghahnjournals.com/downloadpdf/journals/contention/3/2/cont030201.xml
"Desdemona's Lie: Nihilism, Perfectionism, Historicism | Scholars ...",https://journals.scholarsportal.info/details/09688005/v44i0002/225_dlnph.xml
Chapter Six. The Nihilism of Ivan Turgenev - De Gruyter,https://www.degruyter.com/yaleup/view/book/9780300144154/10.12987/9780300144154-008.xml
