Isoenzymic Specificity of Impaired Clearance in Mice Infected with ...,https://www.science.org/doi/pdf/10.1126/science.149.3685.756
Isoenzymic Analysis of Fifteen Non-Lysosomal Enzymes in Human ...,https://www.karger.com/Article/PDF/242559
Myosin isoenzyme changes in several models of rat cardiac ...,https://www.ahajournals.org/doi/pdf/10.1161/01.RES.49.2.525
Myosin Isoenzymic Distribution Correlates with Speed of Myocardial ...,https://www.sciencedirect.com/science/article/pii/0022282881902972/pdf%3Fmd5%3Dd9de63349b591dda6607981c1b784796%26pid%3D1-s2.0-0022282881902972-main.pdf
isoenzymic forms of nad-linked glycerol-3-phosphate ...,https://www.sciencedirect.com/science/article/pii/000527447990295X/pdf%3Fmd5%3Df3627f424dc34d2bad5611be4ac91d19%26pid%3D1-s2.0-000527447990295X-main.pdf
Isoenzymic changes in myosin and hypertrophy; adaptation during ...,https://academic.oup.com/eurheartj/article-pdf/3/suppl_A/75/6730296/3-suppl_A-75.pdf
Isoenzymes of Glutamate Dehydrogenase in Plants - JSTOR,https://www.jstor.org/stable/4261671
bst019236s.pdf - Portland Press,https://portlandpress.com/biochemsoctrans/article-pdf/19/2/236S/637232/bst019236s.pdf
[PDF] Isoenzyme Update: Creatine kinase and lactate dehydrogenase,https://scholarlycommons.henryford.com/cgi/viewcontent.cgi%3Farticle%3D2185%26context%3Dhfhmedjournal
[PDF] Isoenzymes of phosphofructokinase in the rat - NCBI,https://www.ncbi.nlm.nih.gov/pmc/articles/PMC1145065/pdf/biochemj00299-0059.pdf
