Nick LaCroix After 10-0 Win Over Stonehill - Franklin Pierce,https://www.fpuravens.com/video/baseball/2010-11/041711LaCroixPostgame.flv
Mike Chambers on 10-0 Win Over Stonehill - Franklin Pierce,https://fpuravens.com/video/baseball/2010-11/041711ChambersPostgame.flv
"March 7, 2022, The Community Advisory Council on Homelessness",https://www.dhs.state.il.us/page.aspx/FACT_1WhatIsVR.flv%3Fitem%3D141826%26newssidebar%3D138572
"The Week In Russia: Spies, 'Scumbags,' And Senior Citizens",https://www.austinglobe.com/news/258086108/oct04v40.flv
Russia Dumped U.S. Bond Holdings This Year Amid U.S. Sanctions ...,https://www.bangladeshsun.com/news/257703785/oct04v40.flv
Rowyo.com is for sale - Squadhelp,http://www.xuziping.com/vod/b6e6415fca49aa71df8e7b4075f1365d.flv
Zenith military watch manually wound - Uhren-Miquel,https://www.uhren-miquel.de/Zenith-military-watch-manually-wound-video-no-5377_en.flv
Glashütte Original Sport Evolution M - Uhren-Miquel,http://www.uhren-miquel.de/Glashuette-original-Sport-Evolution-M-video-no-5408_en.flv
Trump ratchets up tariff pressure on China with $200 billion hit | Fin24,https://www.chinanationalnews.com/news/258006974/oct04v56.flv
