Eclectic Improvement - Buzzsprout,https://feeds.buzzsprout.com/1978670.rss
Eclectic Stories of the Paranormal - Buzzsprout,https://feeds.buzzsprout.com/1101083.rss
Eclectic Kettle from BFF.fm,https://data.bff.fm/shows/eclectic-kettle.rss
Eclectic Stories of the Paranormal - Subscribe by Email,https://www.subscribebyemail.com/feeds.buzzsprout.com/1101083.rss
LOVE BEFORE COVID - Audioboom,https://audioboom.com/channels/5042465.rss
Questions That Need Answers: Moms and Dads Have ... - Audioboom,https://audioboom.com/channels/4959787.rss
Rambunctious Bombastic Newscast! (RBN: The voicenotes),https://pod.link/1496209175.rss
[Music] DJs and Bands from the Black and White Ball - DEFCON 12,https://defcon.org/podcast/defcon-12-music.rss
"Brava Theater, Upcoming Events in San Francisco on DoTheBay",http://do415.com/venue/brava-theater.rss
