Human Infection with Filariae of Animals in the United States in,https://www.ajtmh.org/view/journals/tpmd/14/6/article-p1010.xml
Comparative Morphology of the Skin-Inhabiting Micro-Filariae of ...,https://www.ajtmh.org/view/journals/tpmd/1/2/article-p250.xml
PLoS Negl Trop Dis plos plosntds PLoS Neglected Tropical ...,http://open-repository.kisti.re.kr/cube/bitstream/open_repository/5206/1/journal.pntd.0002565.xml
Patrick Manson and his Chinese Assistants - jstor,https://brill.com/downloadpdf/book/9789004366183/B9789004366183-s034.xml
[PDF] Standardisation of lymphatic filariasis microfilaraemia prevalence ...,https://journals.scholarsportal.info/pdf/17563305/v13inone/nfp_solfmpmasram.xml
biorxiv BIORXIV bioRxiv bioRxiv Cold Spring Harbor Laboratory ...,https://www.biorxiv.org/content/early/2020/08/16/2020.02.04.934653.source.xml
Differences in infection patterns of vector-borne blood-stage ...,https://europepmc.org/articles/pmc6657000/bin/mmc1.xml
DERMATITIS ASSOCIATED WITH Dirofilaria (Nochtiella) repens ...,https://akjournals.com/downloadpdf/journals/004/50/1/article-p63.xml
BMRI BioMed Research International 2314-6141 2314-6133 ...,https://downloads.hindawi.com/journals/bmri/2017/6436130.xml
Intraocular Filariasis: a Brief Review in - American Journal of ...,https://www.ajtmh.org/view/journals/tpmd/40/1/article-p40.xml
