in vivo endoscopic anatomy of the posterior third ventricle and its ...,https://thejns.org/downloadpdf/journals/j-neurosurg/135/1/article-p309.xml
in vivo endoscopic anatomy of the posterior third ventricle and its ...,https://thejns.org/view/journals/j-neurosurg/135/1/article-p309.xml
"VARRO, On the Latin Language | Loeb Classical Library",https://www.loebclassics.com/view/varro-latin_language/1938/pb_LCL333.9.xml
"MACROBIUS, Saturnalia | Loeb Classical Library",https://www.loebclassics.com/view/macrobius-saturnalia/2011/pb_LCL510.245.xml%3FreadMode%3Dreader
Index of Lexemes1 - Brill,https://brill.com/previewpdf/book/9789004244658/B9789004244658_015.xml%3FpdfJsInlineViewToken%3D135583468%26inlineView%3Dtrue
THE QUMRAN CONTEXT OF THE SABBATH SHIROT In the ... - Brill,https://brill.com/previewpdf/book/9789004369405/BP000006.xml
"Adytum by MJE Michael | PDF, EPUB, FB2, DjVu, AUDIO, MP3, DOC ...",http://www.uttui.com/image/14/humanities5jy/14243.xml
google_sitemap_information.xml - CharterWorld,http://www.charterworld.com/google_sitemap_information.xml
Solitude of Self. Address Delivered by Mrs. Stanton before the ... - Loc,https://tile.loc.gov/storage-services/service/rbc/rbnawsa/n8358/n8358.xml
"or, Altars of Sacrifice:</emph> Electronic Edition.",https://docsouth.unc.edu/imls/macaria/macaria.xml
