Give to the Old Newsboys | The Blade,https://www.toledoblade.com/Opinion/Editorials/2016/12/02/Toledo-Blade-editorial-Give-to-the-Old-Newsboys/stories/feed/feed/index.rss
Give to the Old Newsboys - Toledo Blade,https://www.toledoblade.com/Editorials/2016/12/02/Toledo-Blade-editorial-Give-to-the-Old-Newsboys/stories/feed/index.rss
Our Pod Is An Awesome Pod - Audioboom,https://audioboom.com/channels/5038374.rss
Connections with Mike Thom and Colleen Houde - Omny.fm,https://omny.fm/shows/connections-with-mike-thom-and-colleen-houde/playlists/podcast.rss
This Happened Today (in History) Podcast - Buzzsprout,https://feeds.buzzsprout.com/864886.rss
Jesus Freaks: Vinyl to Digital - Buzzsprout,https://feeds.buzzsprout.com/1223213.rss
The Holy Post - Libsyn,https://pod.link/591157388.rss
Reaching For Real Life with Sean Azzaro - Podcasts,http://podcasts.subsplash.com/ee409b0/podcast.rss
R. Hall's Blog - Vandalia River,https://vandaliariver.com/blogs/r-hall-s-blog.rss
