How is the typical day of a Beautician? - Career Guide,http://www.counselling.meracareerguide.com/t/how-is-the-typical-day-of-a-beautician/7293.rss
What are various job roles one can get after graduating as a ...,http://www.counselling.meracareerguide.com/t/what-are-various-job-roles-one-can-get-after-graduating-as-a-beautician/6303.rss
Big chains' push into area colors salon rivalry fierce | The Blade,https://www.toledoblade.com/Retail/2005/09/21/Big-chains-push-into-area-colors-salon-rivalry-fierce/stories/feed/index.rss
Representative Office of the Czech Republic in Ramallah,https://www.mzv.cz/ramallah/en/commerce_and_economy/index.rss
Aesthetics Mastery - Buzzsprout,https://feeds.buzzsprout.com/737156.rss
Problematic Women - Acast,https://feeds.soundcloud.com/users/soundcloud:users:342083176/sounds.rss%3Fbefore%3D350357251
Boogie in the Morning - Audioboom,https://audioboom.com/playlists/1120079-boogie-in-the-morning-best-bits.rss
Latest Construction Design Podcast Episodes - Pod.casts,https://pod.casts.io/categories/design/topics/construction/new-episodes.rss
Make Your Pitch - PodServe.fm,https://www.podserve.fm/series/rss/1954/make-your-pitch.rss
