Covariance - SAGE Research Methods,https://methods.sagepub.com/reference/encyclopedia-of-survey-research-methods/n113.xml
Covariance - SAGE Research Methods,https://methods.sagepub.com/base/download/ReferenceEntry/encyclopedia-of-survey-research-methods/n113.xml
Observation-Informed Generalized Hybrid Error Covariance Models in,https://journals.ametsoc.org/view/journals/mwre/146/11/mwr-d-18-0016.1.xml
An Ensemble Covariance Framework for Quantifying Forced Climate ...,https://journals.ametsoc.org/view/journals/clim/31/10/jcli-d-17-0719.1.xml
Analysis of Covariance (ANCOVA) - Psychology - Oxford ...,https://www.oxfordbibliographies.com/view/document/obo-9780199828340/obo-9780199828340-0256.xml
Covariance Hypotheses Which are Linear in Both ... - Project Euclid,https://projecteuclid.org/journals/annals-of-statistics/volume-16/issue-1/Covariance-Hypotheses-Which-are-Linear-in-Both-the-Covariance-and/10.1214/aos/1176350707.xml
Monotone Regression and Covariance Structure - Project Euclid,https://projecteuclid.org/journals/annals-of-statistics/volume-7/issue-5/Monotone-Regression-and-Covariance-Structure/10.1214/aos/1176344794.xml
"Covariance in: The Dictionary of Health Economics, Third Edition",https://www.elgaronline.com/view/nlm-book/9781781001752/c03_sec323.xml
The ABCs of Covariance in - NCTM - National Council of Teachers ...,https://pubs.nctm.org/view/journals/mt/112/5/article-p352.xml
