"'AL', The Fraudulent Judge, and the Coerced Conscience - Brill",https://brill.com/previewpdf/book/edcoll/9789004310438/B9789004310438_023.xml
A Collection of Some Things Established in Our Church Government,https://mpese.ac.uk/t/SMChurchGovernment1640.xml
l e m e . l i b r a r y . u t o r o n t o . c a s t c 1 3 2 2 1 v e r . 1 . 0 ( 2 0 1 ...,https://tspace.library.utoronto.ca/bitstream/1807/100251/3/Smyth_The%2520History%2520of%2520Herodian_1556_final.xml
Fruits of the Bibles in: HortScience Volume 42 Issue 5 (2007),https://journals.ashs.org/hortsci/view/journals/hortsci/42/5/article-p1072.xml
[PDF] Fruits of the Bibles - Horticulture & Landscape Architecture,https://journals.ashs.org/hortsci/downloadpdf/journals/hortsci/42/5/article-p1072.xml
A treatise concernynge the diuision betwene the spirytualtie and ...,https://ota.bodleian.ox.ac.uk/repository/xmlui/bitstream/handle/20.500.12024/A11324/A11324.xml%3Fsequence%3D6%26isAllowed%3Dy
[Godly and most necessary annotations in ye .xiij. chapyter too the ...,https://ota.bodleian.ox.ac.uk/repository/xmlui/bitstream/handle/20.500.12024/A03631/A03631.xml%3Fsequence%3D7%26isAllowed%3Dy
Bibliography in: The art of The Faerie Queene - ManchesterHive,https://www.manchesterhive.com/view/9781526134622/9781526134622.00015.xml
"the Edinburgh DOST corpus / AJ Aitken, Paul Bratley and Neil ...",http://www.ota.ahds.ac.uk/headers/0701.xml
