Watch Video Game Dos_xwing_gus_pnp - Page 61 - Shacknews,https://www.shacknews.com/ftp:/78.46.141.148/videos/dos_xwing_gus_pnp.mkv%3Fpage%3D61
Watch Video Game Dos_xwing_gus_pnp - Page 112 - Shacknews,https://www.shacknews.com/ftp:/78.46.141.148/videos/dos_xwing_gus_pnp.mkv%3Fpage%3D112
Sound vs. light: wing-based communication in Carboniferous insects,https://europepmc.org/articles/pmc8266802/bin/42003_2021_2281_moesm5_esm.mkv
How.To.Streaming.Tvos.HDR.Ne.Zha.Zhi.Mo.Tong.Jiang.Shi.mkv,https://seesaawiki.jp/degokoza/d/How.To.Streaming.Tvos.HDR.Ne.Zha.Zhi.Mo.Tong.Jiang.Shi.mkv
Alien.1979.Directors.Cut.1080p.BluRay.x264.DTS ... - Seesaa Wiki,https://seesaawiki.jp/monsbepossde/d/Alien.1979.Directors.Cut.1080p.BluRay.x264.DTS-WiKi.mkv
Unsporting: How Trans Activism and Science Denial are Destroying ...,http://www.multiup.org/fichiers/download/ee144a1553f823c65fc93db1af04393b__gtradsub__Saint_Seiya_Omega___04_HD_vostfr__10bit_.mkv
"Everything Inside: Stories Paperback - Danticat, Edwidge - Amazon.ca",http://www.multiup.org/fichiers/download/8a9ce78b66fd9b8f257723bc4e327516_161___Le_Cruel_Arrancar._La_Provocation_d_Ulquiorra.mkv
Brutes IO Game | Best Casino Bonuses | New Online Casinos 2019,http://www.bruehl.fedak.org/oda81.mkv
Cybersecurity Teams Press USA to Raise Collaboration on Hacks,https://fastdrive.io/5VPd/Insider.E15.NEXT.mkv
Ganh Xiec Rong.Travelling Circus.(Linh Viet - 1988).DVDRip.MKV ...,https://thehiddenbay.com/torrent/8482283/Ganh_Xiec_Rong.Travelling_Circus.(Linh_Viet_-_1988).DVDRip.MKV
