Phenomenal Self - SAGE Reference - Encyclopedia of Social ...,https://sk.sagepub.com/reference/socialpsychology/n398.xml
Phenomenal Concepts - Philosophy - Oxford Bibliographies,https://www.oxfordbibliographies.com/view/document/obo-9780195396577/obo-9780195396577-0254.xml
Phenomenal Conservatism - Philosophy - Oxford Bibliographies,https://www.oxfordbibliographies.com/view/document/obo-9780195396577/obo-9780195396577-0260.xml
"PHENOMENAL RAINFALL AT GUINEA, VA in - AMS Journals",https://journals.ametsoc.org/view/journals/mwre/34/9/1520-0493_1906_34_406_pragv_2_0_co_2.xml
RECORD NOVEMBER FOG PRECEDING PHENOMENAL WINTER ...,https://journals.ametsoc.org/view/journals/mwre/62/11/1520-0493_1934_62_404_rnfppw_2_0_co_2.xml
Phenomenal Structures of Space in: Phenomenology of Perception,https://brill.com/view/book/9789004332201/B9789004332201-s007.xml
Does Direct Moral Judgment Have a Phenomenal Essence?* in - Brill,https://brill.com/view/journals/jmp/10/1/article-p52_4.xml%3Flanguage%3Den
"Phenomenal Overflow, Bodily Affect, and some Varieties of Access ...",https://journals.scholarsportal.info/details/18785158/v10i0004/787_pobaasvoa.xml
PRE‐PHENOMENAL ADJUSTMENTS AND THE MÜLLER‐LYER ...,https://journals.scholarsportal.info/details/02790750/v65i0002/199_paatmi.xml
"A PHENOMENALLY HEAVY RAIN AT ALTON, ILL. in - AMS Journals",https://journals.ametsoc.org/view/journals/mwre/40/7/1520-0493-40_7_1030.xml
PHENOMENAL AND HISTORICAL SELVES in - Brill,https://brill.com/view/journals/gps/84/1/article-p217_11.xml%3Flanguage%3Den
