Early prenatal treatment of ewes with testosterone completely ...,https://eje.bioscientifica.com/view/journals/eje/113/1/acta_113_1_027.xml
Early prenatal treatment of ewes with testosterone but has no effects ...,https://eje.bioscientifica.com/downloadpdf/journals/eje/113/1/acta_113_1_027.xml
Essential Psychology: A Concise Introduction - SAGE Books,https://sk.sagepub.com/books/essential-psychology/n9.xml
Neuronal Cell Death During Sexual Differentiation and ...,https://journals.scholarsportal.info/details/01497634/v22i0006/725_ncddsdalovc.xml
Preface - Brill,https://brill.com/downloadpdf/book/9789004478640/front-3.xml
"male domination, female fury in kuwaiti - Brill",https://brill.com/downloadpdf/book/9789047442677/Bej.9789004167797.i-165_005.xml
Addicted to Affliction - ManchesterHive,https://www.manchesterhive.com/downloadpdf/journals/gs/9/1/article-p46.xml
Through a Glass Darkly - Aquarium Colonies and Nineteenth ...,https://www.manchesterhive.com/downloadpdf/journals/gs/2/3/article-p305.xml
[PDF] revolutionary nationalism and women's representation in Ngugi wa ...,https://www.manchesteropenhive.com/downloadpdf/9781526125965/9781526125965.00007.xml
