"weapons, technological determinism - Brill",https://brill.com/previewpdf/book/edcoll/9789004187344/Bej.9789004185982.i-391_003.xml
The Circulation of Weapons in Anglo-Saxon Society in - Brill,https://brill.com/abstract/book/edcoll/9789004477551/B9789004477551_s014.xml
chummer5a/amend_weapons.xml at master - GitHub,https://github.com/chummer5a/chummer5a/blob/master/Chummer/customdata/Delnar%2520Skills%2520Remake/amend_weapons.xml
The Politics of Nuclear Weapons - SAGE Books,https://sk.sagepub.com/books/the-politics-of-nuclear-weapons/i1601.xml
Can Lethal Autonomous Weapons Be Just?,https://jmt.scholasticahq.com/article/34124.xml
Autonomous Weapons Systems and the Protection of the Human ...,https://www.elgaronline.com/view/book/9781802207675/9781802207675.xml
"Weapons, International Regulations on in - Elgaronline",https://www.elgaronline.com/view/nlm-book/9781789903614/b-9781789903621.weapons.int.regs.xml
xml - GovInfo,https://www.govinfo.gov/bulkdata/BILLS/115/1/sres/BILLS-115sres116is.xml
Treaty on the Prohibition of the Emplacement of Nuclear Weapons ...,https://www.jus.uio.no/english/services/library/treaties/05/5-02/emplacement-nuclear-weapons.xml
