xxx-el-bananero-el-pete-wanda-nara-genial-video-y-cancion.flv,https://www.fastshare.cz/6234165/xxx-el-bananero-el-pete-wanda-nara-genial-video-y-cancion.flv
Las niñas con hiyabs disfrutan besándose en el parque&period;FLV,https://es.nudejet.com/video14855245/las_ninas_con_hiyabs_disfrutan_besandose_en_el_parque.flv
Las niñas con hiyabs disfrutan besándose en el parque&period;FLV ...,https://es.nudejet.com/video14855245/girls_in_hijabs_enjoy_kissing_in_the_park.flv
Follando con un bot agradable hasta la eyaculación - vietboy ...,https://es.clixtube.com/video9005313/_u_em_bot_hang_ep_en_xuat_tinh_-_vietboy_fuck_at_home_nice_cock.flv
UnerfahreneMaus - Anal - Total Genial.flv - Fileload,https://fileload.to/d592ccbfc4832570/UnerfahreneMaus_-_Anal_-_Total_Genial.flv
Bokep WOW Hasil penelusuran untuk asia.FLV - XNXX.COM,https://www.xnxx2.com/video-45lr30d/bokep_wow_hasil_penelusuran_untuk_asia.flv
Bokep WOW Hasil penelusuran untuk asia.FLV - XNXX.COM,https://www.xnxx.tv/video-45lr30d/bokep_wow_hasil_penelusuran_untuk_asia.flv
¿Cuál es tu adicción? - Ramadan - Islamweb,https://www.islamweb.net/ramadanS/articles/219694/flv/flv/rv4.flv
Sant Joan Despi - YouTube - Inmofactory,https://static.inmofactory.com/statics/inmofactory/documents/1/106317/16227435/215032159.flv%3Frule%3Doriginal
Elementos filtrados por fecha: Diciembre 2008 - Airfeu,https://www.airfeu.com/noticias/itemlist/date/2009/zenith_agua.flv%3Fstart%3D130
"Soda Stereo [Unplugged Mtv].flv | Entre caníbales Lyrics, Song ...",https://sonichits.com/video/Entre_can%25C3%25ADbales/Soda_Stereo_%255BUnplugged_Mtv%255D.flv
