Code::Blocks - SourceForge,https://qa.debian.org/watch/sf.php/codeblocks/CB_20220327_rev12765_win64.7z
Download emule X Mod from SourceForge.net,https://downloads.sourceforge.net/emulex/eMule0.49c-Lite1.5.0.0-sources.7z%3Fuse_mirror%3Djaist
Download eMule Magic Angel from SourceForge.net,https://kent.dl.sourceforge.net/project/magicangel/Magic%2520Angel/eMule%2520v0.50a%2520Magic%2520Angel%2520v4.0/eMulev0.50a-MagicAngel-v4.0-src.7z
Download 7-Zip from SourceForge.net - Compression,https://www.7-zip.org/a/7z1506-src.7z
Extensions of the probabilistic ranking metrics of ... - Europe PMC,https://europepmc.org/articles/pmc7078966/bin/bimj-62-375-s001.7z
Malaria mosquitoes use leg push-off forces to control body pitch ...,https://europepmc.org/articles/pmc6916183/bin/jez-333-38-s001.7z
"Digerati Cliparts & Cia - Ciparts, Animated Gifs, Fonts, Software",https://archive.org/details/DigeratiClipartsCia.7z
Open Source PHP Photo Gallery,https://phpgallery.beamtic.com/gallery.7z
[XLS] Bricks IV Competition,http://bricksomania.atwebpages.com/downloads/sampsah2.7z
скачать tradestation 8.7 build 3085.7z for Windows - UpdateStar.com,https://www.updatestar.com/en/topic/%25D1%2581%25D0%25BA%25D0%25B0%25D1%2587%25D0%25B0%25D1%2582%25D1%258C%2520tradestation%25208.7%2520build%25203085.7z
