Clinical Relevance of Bacteriostatic versus Bactericidal Mechanisms ...,https://academic.oup.com/cid/article-pdf/38/6/864/913456/38-6-864.pdf
[PDF] Following the Mechanisms of Bacteriostatic versus Bactericidal ...,https://www.mdpi.com/1420-3049/18/11/13188/pdf
Bacteriostatic antibiotics promote CRISPR-Cas adaptive immunity ...,https://www.cell.com/cell-host-microbe/pdfExtended/S1931-3128(21)00520-5
Bacteriostatic Versus Bactericidal Activity - ScienceDirect.com,https://www.sciencedirect.com/science/article/pii/S0891552020302762/pdf%3Fmd5%3D2d16d6d79f4e2cf8edd37efbffd42c1d%26pid%3D1-s2.0-S0891552020302762-main.pdf
[PDF] Bacteriostatic and Bactericidal Activities of Various - NCBI,https://www.ncbi.nlm.nih.gov/pmc/articles/PMC444379/pdf/aac00344-0010.pdf
Bacteriostatic and bactericidal activities of 24 antimicrobial agents ...,https://journals.asm.org/doi/pdf/10.1128/AAC.18.1.118
[PDF] Bacteriostatic Agents - IntechOpen,http://cdn.intechopen.com/pdfs/39261/InTech-Bacteriostatic_agents.pdf
a study of the bacteriostatic and bactericidal activity - ATS Journals,https://www.atsjournals.org/doi/pdf/10.1164/art.1949.59.4.461
Bacteriostatic and Bactericidal Substances Produced by a Soil ...,https://journals.sagepub.com/doi/pdf/10.3181/00379727-45-11768
