Vasodilatation in the Canine Leg caused by Intra-arterial Infusion of ...,http://cardiovascres.oxfordjournals.org/content/1/4/371.source.xml
Prostaglandin I2 mediates weak vasodilatation in human placental ...,https://bioone.org/journals/biology-of-reproduction/volume-103/issue-6/ioaa156/Prostaglandin-I2-mediates-weak-vasodilatation-in-human-placental-microvessels/10.1093/biolre/ioaa156.xml
Signaling regulation of fetoplacental angiogenesis in - Journal of ...,https://joe.bioscientifica.com/view/journals/joe/212/3/243.xml
"Altered circulating hormone levels, endothelial function and vascular ...",https://eje.bioscientifica.com/downloadpdf/journals/eje/148/1/111.xml
Eine optoelektronische Methode zur Erfassung der Vasokonstriktion ...,https://www.degruyter.com/view/j/bmte.1980.25.issue-10/bmte.1980.25.10.261/bmte.1980.25.10.261.xml%3Flang%3Den
Post-occlusion brachial artery vasodilatation after ischaemic ...,https://journals.scholarsportal.info/details/14750961/v22i0001/18_pbavaiheinom.xml
Vasodilatation of muscle microvessels induced by somatic afferent ...,https://journals.scholarsportal.info/details/03043940/v333i0002/136_vommibgpritr.xml
Increase in regional cerebral blood flow following experimental ...,https://thejns.org/view/journals/j-neurosurg/34/5/article-p665.xml
The Etiology of Acute Brain Swelling Following Experimental Head ...,https://thejns.org/view/journals/j-neurosurg/24/1/article-p47.xml
