Chapter 6 Fairness: Theory and the Effectiveness of International ...,https://brill.com/view/book/9789004439764/BP000010.xml
Fairness in Machine Learning: Against False Positive Rate Equality ...,https://brill.com/view/journals/jmp/19/1/article-p49_4.xml
Entry Procedural Versus Substantive Fairness - SAGE Reference ...,https://sk.sagepub.com/reference/the-sage-encyclopedia-of-political-behavior/i8976.xml
SAGE Reference - Encyclopedia of Management Theory,https://sk.sagepub.com/reference/encyclopedia-of-management-theory/i3250.xml
"Fairness, Morality and Ordre Public in Intellectual Property",https://www.elgaronline.com/view/edcoll/9781839104367/9781839104367.xml
Relative Criteria of Economic Fairness with Applications | Elgar Online,https://www.elgaronline.com/view/9781839108013.xml
Some Criteria for Evaluating the “Fairness” of Swimming ...,https://journals.humankinetics.com/view/journals/apaq/16/3/article-p271.xml
explaining fairness in non-cooperative bargaining games - Journals,https://journals.scholarsportal.info/pdf/20545703/v05i0002/nfp_ogafmefinbg.xml
Medicaid Generic Drug Price Fairness Act - Govinfo.gov,https://www.govinfo.gov/bulkdata/BILLSTATUS/113/s/BILLSTATUS-113s2948.xml
"7/1/2021 Renumbered and Amended by Chapter 344 , 2021 ...",https://le.utah.gov/xcode/Title63A/Chapter17/C63A-17-S710_2021050520210701.xml
