THE QUAESTIONES DISPUTATAE OF THE GLOSSATORS by ... - Brill,https://brill.com/downloadpdf/journals/lega/16/1/article-p1_1.xml
THE QUAESTIONES DISPUTATAE OF THE GLOSSATORS ... - Brill,https://brill.com/previewpdf/journals/lega/16/1/article-p1_1.xml
Richardus Anglikus als Glossator der Compilatio I. in: Archiv für ...,https://www.schoeningh.de/view/journals/ak/107/3-4/article-p575_7.xml
csg-0904.xml - e-codices,https://www.e-codices.unifr.ch/xml/tei_published/csg-0904.xml
"HIPPOCRATES OF COS, Diseases 1 - Loeb Classical Library",https://www.loebclassics.com/view/hippocrates_cos-diseases_i/1988/pb_LCL472.85.xml
"Description of Free Library of Philadelphia, Lewis E 244: Infortiatum",https://openn.library.upenn.edu/Data/0023/lewis_e_244/data/lewis_e_244_TEI.xml
Forum shopping and the evolution of rules of choice of law in,https://www.elgaronline.com/view/nlm-book/9781782547457/b7_chapter20.xml
Epilogue to “Questioning Life and Cognition” by John Stewart,https://journals.scholarsportal.info/details/10597123/v29i0005/523_etlacbjs.xml
THE RABBINIC APPROACH TO THE STUDY OF THE OLD ...,https://www.manchesterhive.com/previewpdf/journals/bjrl/34/1/article-p166.xml
