Assertion - Philosophy - Oxford Bibliographies,https://www.oxfordbibliographies.com/view/document/obo-9780195396577/obo-9780195396577-0148.xml
Asserting values for weight analyses,http://www2.me.rochester.edu/courses/ME204/nx_help/en_US/tdocExt/content/t/func_details_analy_wt_assert.xml
Assert the weight of a component or subassembly,http://www2.me.rochester.edu/courses/ME204/nx_help/en_US/tdocExt/content/1/id1383411.xml
Propositional Logic of Supposition and Assertion - Project Euclid,https://projecteuclid.org/journals/notre-dame-journal-of-formal-logic/volume-38/issue-3/Propositional-Logic-of-Supposition-and-Assertion/10.1305/ndjfl/1039700742.xml
The SAGE Dictionary of Qualitative Inquiry - SAGE Research Methods,https://methods.sagepub.com/reference/the-sage-dictionary-of-qualitative-inquiry/n373.xml
Assertion in: Pragmatics - Brill,https://brill.com/view/book/edcoll/9789004368873/BP000013.xml
Uncivilized Behaviors: How Humans Wield “Feral” to Assert Power ...,https://brill.com/view/journals/soan/aop/article-10.1163-15685306-bja10088/article-10.1163-15685306-bja10088.xml%3Flanguage%3Den
Confidentiality and Public Access to Information - GovInfo,https://www.govinfo.gov/content/pkg/CFR-2013-title40-vol32/xml/CFR-2013-title40-vol32-part720-subpartE.xml
xml - GovInfo,https://www.govinfo.gov/bulkdata/BILLS/117/1/hr/BILLS-117hr3978ih.xml
XML,https://le.utah.gov/xcode/Title78B/Chapter6/C78B-6-S1903_2014040320140513.xml
