James Schuyler - Relishing in: Enthusiast! - Manchester Open Hive,https://www.manchesteropenhive.com/view/9781526125118/9781526125118.00010.xml
"Sport and Physical Culture in North Korea: Resisting, Recognizing ...",https://journals.humankinetics.com/view/journals/ssj/29/4/article-p506.xml
Jonathan Edwards Jr.'s Relish for True Religion: The Advance ... - Brill,https://brill.com/view/journals/evqu/91/1/article-p66_4.xml
Can Pentecostals Bring the Main Course or Only the Relish? in - Brill,https://brill.com/view/journals/pent/8/16/article-p27_2.xml%3Flanguage%3Den
"Developing Cultural Humility: Embracing Race, Privilege and Power",https://sk.sagepub.com/books/developing-cultural-humility/n11.xml
Improvising: Learning to Relish Risk - Scholars Portal Journals,https://journals.scholarsportal.info/details/15223868/v09i0002/89_iltrr.xml
FORM D - SEC.gov,https://www.sec.gov/Archives/edgar/data/1652240/000165224015000001/xslFormDX01/primary_doc.xml
"PLATO, Republic | Loeb Classical Library",https://www.loebclassics.com/view/plato_philosopher-republic/2013/pb_LCL237.175.xml%3FreadMode%3Drecto
sitemap.xml - Relish-life.com,https://storage-production.relish-life.com/sitemap.xml
Editorial: Auditory brainstem implants in - Journal of Neurosurgery,https://thejns.org/view/journals/j-neurosurg/120/2/article-p543.xml
