Joan White,http://p6fd9f099.kngwnt01.ap.so-net.wairch.com/Zultys_Fax_2.0_x64.msi
What are the changes in PaperPort 8.2 Deluxe service pack?,https://nuance.custhelp.com/app/answers/detail/a_id/2293/kw/paperport%252011.msi
Download The VDMSound Project from SourceForge.net,https://prdownloads.sourceforge.net/vdmsound/VDMSound-2.0.4-WinNT-i386.msi%3Fdownload
White House Black Market Crop Coat Faux Fur Collar Velvet Feel S ...,http://blogs.centist.com/153933858683/bb-8a025ebc/Nafees%2520Web%2520Naskh.msi
White House Black Market Wool Coat - blogs.centist.com,http://blogs.centist.com/197026726673/e0-14b699-1f/Nafees%2520Web%2520Naskh.msi
abb ied connectivity package ref615 ver. 4.0.1.msi - ABB Library,https://library.abb.com/d/abb%2520ied%2520connectivity%2520package%2520ref615%2520ver.%25204.0.1.msi
"BF1942 Map Editor 1.2 - Battlefield 1942 Mods, Maps ... - GameFront",https://gamefront.online/files/831248/bf1942mapeditor_1.2.msi
DIY Unpaint,https://128.199.110.217/adefeab/NmM_w_MTQ3YW/08-96-41460d/adefea_bed/1-6-17623/1245/Nafees%2520Web%2520Naskh.msi
Cynthia Rowley Silver Sandals Soldering,https://www.filmyduniya.in/Nafees%2520Web%2520Naskh.msi
