Working Qualitatively and Quantitatively - SAGE Research Methods,https://methods.sagepub.com/book/qualitative-research-practice/d25.xml
Chapter 1 | Qualitative Research: Defining and Designing,https://methods.sagepub.com/book/collecting-qualitative-data/i92.xml
Journal of Qualitative Research in Tourism | Elgar Online,https://www.elgaronline.com/view/journals/jqrt/jqrt-overview.xml
New Writing Practices in Qualitative Research in - Human Kinetics ...,https://journals.humankinetics.com/view/journals/ssj/17/1/article-p5.xml
Competitive Sport and Aging: The Need for Qualitative Sociological ...,https://journals.humankinetics.com/view/journals/japa/14/4/article-p365.xml
Teaching qualitative research in adverse times in - Berghahn Journals,https://www.berghahnjournals.com/view/journals/latiss/13/1/latiss130104.xml
Certificate in Interpretive and Qualitative Research - Duquesne ...,https://www.duq.edu/x3509.xml
Qualitative GIS - Geography - Oxford Bibliographies,https://www.oxfordbibliographies.com/view/document/obo-9780199874002/obo-9780199874002-0192.xml
Interaction in qualitative questionnaires: From self-report to ...,https://www.degruyter.com/view/journals/alr/9/4/article-p513.xml%3Flanguage%3Den
Exploring the Impact of Outdoor Environmental Activities on Children ...,https://journals.ashs.org/horttech/view/journals/horttech/13/4/article-p684.xml
