Chapter 3 Confronting and Uniting with Divinity in Ancient Egypt in,https://brill.com/abstract/book/9789004502529/BP000004.xml
Confronting Relationship Challenges - SAGE Books,https://sk.sagepub.com/books/confronting-relationship-challenges/n2.xml
Confronting Future Models with Future Satellite Observations of ...,https://journals.ametsoc.org/view/journals/bams/102/8/BAMS-D-21-0029.1.xml
Confronting Models with Data: The GEWEX Cloud Systems Study in,https://journals.ametsoc.org/view/journals/bams/84/4/bams-84-4-455.xml
Confronting the Shadow Economy - Elgaronline,https://www.elgaronline.com/view/9781782546030.xml
Confronting and Mitigating our Biases - Midwestern University,https://www.midwestern.edu/departments/human-resources/learning-and-development/in-service-library/confronting-and-mitigating-our-biases.xml
Confronting Humanitarian Insecurity in - Manchester Open Hive,https://www.manchesteropenhive.com/view/journals/jha/2/1/article-p11.xml
Global Cooperation and the International Monetary Fund | imfsg,https://www.elibrary.imf.org/view/books/073/21643-9781498343169-en/21643-9781498343169-en-book.xml
Confronting Tyranny in a Public Health Agency in - Berghahn Journals,https://www.berghahnjournals.com/view/journals/aia/23/1/aia230105.xml
