Visual and Haptic Representations of Material Properties - Brill,https://brill.com/downloadpdf/journals/msr/26/5/article-p429_3.xml
Aratus 328: ποικίλος - Brill,https://brill.com/downloadpdf/journals/mnem/71/6/article-p1062_11.xml
Bulletin of the Center for Children's Books ... - IDEALS @ Illinois,https://www.ideals.illinois.edu/bitstream/handle/2142/12362/bulletincenterchv00001i00001_tei.xml%3Fsequence%3D1%26isAllowed%3Dy
xd/Settings.xml at master · 92RED/xd · GitHub,https://github.com/92RED/xd/blob/master/Settings.xml
biorxiv BIORXIV bioRxiv bioRxiv Cold Spring Harbor Laboratory ...,https://www.biorxiv.org/content/early/2018/04/18/303883.source.xml
biorxiv BIORXIV bioRxiv bioRxiv Cold Spring Harbor Laboratory ...,https://www.biorxiv.org/content/biorxiv/early/2022/04/10/2022.04.10.487784.source.xml
SP Scientific Programming 1875-919X 1058-9244 Hindawi 10.1155 ...,https://downloads.hindawi.com/journals/sp/2020/8856640.xml
MISY Mobile Information Systems 1875-905X 1574-017X Hindawi ...,https://downloads.hindawi.com/journals/misy/2022/4566185.xml
medrxiv MEDRXIV medRxiv medRxiv Cold Spring Harbor ...,https://www.medrxiv.org/content/early/2019/07/15/19002154.source.xml
archaic had been associated but loosely; it was Virgil's genius that ...,https://brill.com/downloadpdf/book/9789004329904/BP000005.xml
biorxiv BIORXIV bioRxiv bioRxiv Cold Spring Harbor Laboratory ...,https://www.biorxiv.org/content/biorxiv/early/2021/09/21/2021.09.21.461196.source.xml
"Brands, Consumers, Symbols, & Research - SAGE Books",https://sk.sagepub.com/books/brands-consumers-symbols-and-research/n25.xml
"Humo De Colores Png, Thumb Image, humo,Humo Colores png| Cnyr",https://cnyrcu.com/551261.xml
