Efficiency of Time Series Homogenization - AMS Journals,https://journals.ametsoc.org/view/journals/clim/34/8/JCLI-D-20-0611.1.xml
A New Approach to Homogenize Global Subdaily Radiosonde ...,https://journals.ametsoc.org/view/journals/clim/34/3/JCLI-D-20-0352.1.xml
Homogenized literary co-translation: A Hero Born and A Bond ...,https://akjournals.com/view/journals/084/23/1/article-p92.xml
Homogenization and Electronic Polarization Effects in Dielectric ...,https://projecteuclid.org/journals/taiwanese-journal-of-mathematics/volume-21/issue-2/Homogenization-and-Electronic-Polarization-Effects-in-Dielectric-Materials/10.11650/tjm/7783.xml
Large Deviations for Diffusion Processes with Homogenization and ...,https://projecteuclid.org/journals/annals-of-probability/volume-19/issue-2/Large-Deviations-for-Diffusion-Processes-with-Homogenization-and-Applications/10.1214/aop/1176990438.xml
Homogenization of Ukrainian air temperature data - Scholars Portal ...,https://journals.scholarsportal.info/details/08998418/v38i0001/497_houatd.xml
The Media and Globalization - SAGE Books,https://sk.sagepub.com/books/the-media-and-globalization/n4.xml
histochemically by light and electron microscopy or were ...,https://joe.bioscientifica.com/downloadpdf/journals/joe/36/3/joe_36_3_010.xml
Running Higher Education Institutions Should Avoid Homogenization,https://brill.com/downloadpdf/book/9789004309227/B9789004309227_021.xml
