Reasoning with realistic disjunctives,https://www.tandfonline.com/doi/pdf/10.1080/14640748408402182
Reasoning with Realistic Disjunctives - SAGE Journals,https://journals.sagepub.com/doi/pdf/10.1080/14640748408402182
[PDF] Disjunctive Mention-all Answers - Harvard University,http://scholar.harvard.edu/files/yxiang/files/disjunctive_ma_ac.pdf
Who's Afraid of Disjunctive Properties? - JSTOR,https://www.jstor.org/stable/pdf/3050521.pdf
Disjunctive Effects and the Logic of Causation - jstor,https://www.jstor.org/stable/24562865
A strategy for ordering disjunctives in the resolution method,https://link.springer.com/content/pdf/10.1007/BF01103264.pdf
A study of disjunctive reasoning,https://link.springer.com/content/pdf/10.1007/BF00308881.pdf
[PDF] A LOWER BOUND FOR THE COMPUTATIONAL COMPLEXITY OF ...,https://hal.archives-ouvertes.fr/hal-03053210/document
[PDF] MDD Propagation for Disjunctive Scheduling,https://www.aaai.org/ocs/index.php/ICAPS/ICAPS12/paper/viewFile/4720/4709
Who&apos;s Afraid of Disjunctive Properties? - Wiley Online Library,https://onlinelibrary.wiley.com/doi/pdf/10.1111/1533-6077.00001
