flocculation of kaolin suspensions and mature fine tailings,https://journals.scholarsportal.info/details/00084034/v96i0001/20_prfoksamft.xml
Actual Performance versus Theoretical Advantages of ...,https://journals.ashs.org/hortsci/view/journals/hortsci/40/7/article-p2040.xml
Using Polyacrylamide (PAM) for Reducing Sediment and Nutrient ...,https://journals.ashs.org/hortsci/view/journals/hortsci/40/4/article-p1110C.xml
polyacrylamide gel electrophoresis of ratanterior pituitary - procedures,https://joe.bioscientifica.com/downloadpdf/journals/joe/53/1/joe_53_1_020.xml
Polyacrylamide gel electrophoresis has been employed to separate ...,https://joe.bioscientifica.com/downloadpdf/journals/joe/76/3/joe_76_3_016.xml
21 CFR Part 173 -- Secondary Direct Food Additives Permitted in ...,https://www.gpo.gov/fdsys/pkg/CFR-2018-title21-vol3/xml/CFR-2018-title21-vol3-part173.xml
Improved Polyacrylamide Gel Electrophoretic Method for ...,http://ajcp.oxfordjournals.org/content/79/1/112.source.xml
Thermal decomposition of acrylamide from polyacrylamide,https://akjournals.com/downloadpdf/journals/10973/110/1/article-p423.xml
https://www.jove.com/v/58669/fluorescent-silver-staining-of-proteins ...,https://www.jove.com/sitemap/articles/58669.xml
[PDF] Assessment of acrylamide toxicity using a battery of standardised ...,http://sciendo.com/abstract/journals/aiht/66/4/article-p315.xml%3Frskey%3DuaLST8%26result%3D4
