A Catalogue of Learned Women in the Latin Schoolroom Letters of ...,https://brill.com/downloadpdf/book/edcoll/9789004361553/BP000044.xml
How the Bible Expelled Religion from the American Schoolroom - Brill,https://brill.com/view/book/edcoll/9789004284661/B9789004284661_016.xml
Rhetoric and the Passions in Shakespeare's Schoolroom - De Gruyter,https://www.degruyter.com/penn/downloadpdf/book/9780812207132/10.9783/9780812207132.9.xml
A Fifth-Grade Schoolroom - Scholars Portal Journals,https://journals.scholarsportal.info/details/15455858/v04i0003/178_afs.xml
"Book Review: Rebecca Rogers, From the Salon to the Schoolroom ...",https://journals.scholarsportal.info/details/02656914/v39i0001/178_brrrftp2x3p0.xml
Monthly Weather Review Volume 45 Issue 6 (1917) - AMS Journals,https://journals.ametsoc.org/view/journals/mwre/45/6/1520-0493_1917_45_301b_eohoas_2_0_co_2.xml
In the classroom: Clocks in kindergarten in: The Arithmetic Teacher ...,https://pubs.nctm.org/view/journals/at/10/7/article-p455.xml
The House that Geometry Built: A Plane Geometry Project in - NCTM,https://pubs.nctm.org/view/journals/mt/45/7/article-p518.xml
Faribault State School and Hospital - Minnesota Historical Society,http://www2.mnhs.org/library/findaids/gr00925.xml
