Yellowstone Caldera and Plateau Rhyolite,https://www.arcgis.com/sharing/rest/content/items/d31a992be02d458d9872e0e104873e8a/info/metadata/metadata.xml%3Fformat%3Ddefault%26output%3Dhtml
Valles Caldera National Preserve Management Act - Govinfo.gov,http://www.govinfo.gov/bulkdata/BILLSTATUS/113/s/BILLSTATUS-113s285.xml
Assessment of Eligible and Ineligible Lands for Consideration as ...,https://www.govinfo.gov/metadata/granule/FR-2022-07-12/2022-14833/mods.xml
Generalized Geologic Map of the Upper Animas River Watershed ...,https://data.usgs.gov/metadata/Geologic_Discipline_%2528legacy_programs%2529/map-mf_2377_metadata.xml
"Regional Director, Interior Regions 6, 7, & 8. - Federal Register",https://www.federalregister.gov/documents/full_text/xml/2022/07/12/2022-14833.xml
▷  ▷ caldera spas pure comfort manual - ECATTS,https://ecatts.com/userfiles/caldera-spas-pure-comfort-manual.xml
FORM D - SEC.gov,https://www.sec.gov/Archives/edgar/data/1492346/000149234610000002/xslFormDX01/primary_doc.xml
1801108014 NPI number — AURA CORINA CALDERA DDS,https://www.hipaaspace.com/medical_billing/coding/national_provider_identifier/codes/npi_1801108014.xml
Digital elevation model (DEM) and shaded relief image of Okmok ...,https://dggs.alaska.gov/metadata/RDF2011-6.xml
