Energy Spectra and Inertia–Gravity Waves in Global Analyses in,https://journals.ametsoc.org/view/journals/atsc/74/8/jas-d-16-0341.1.xml
Effect of Particle Inertia on the Alignment of Small Ice Crystals in ...,https://journals.ametsoc.org/view/journals/atsc/78/8/JAS-D-20-0221.1.xml
Some optimization problems on ranks and inertias of matrix-valued ...,https://projecteuclid.org/journals/banach-journal-of-mathematical-analysis/volume-8/issue-1/Some-optimization-problems-on-ranks-and-inertias-of-matrix-valued/10.15352/bjma/1381782094.xml
"The Impact of Sleep Inertia on Physical, Cognitive, and Subjective ...",https://journals.humankinetics.com/view/journals/ijspp/aop/article-10.1123-ijspp.2021-0414/article-10.1123-ijspp.2021-0414.xml
Negotiation Inaction Inertia: A Dynamic Model of the Impact of ... - Brill,https://brill.com/view/journals/iner/26/2/article-p269_5.xml%3Flanguage%3Den
Migration and Institutional Inertia: Restructuring the ... - Brill,https://brill.com/view/journals/jmh/8/1/article-p56_003.xml
The Inertia of Collections in: Museum Worlds Volume 7 Issue 1 (2019),https://www.berghahnjournals.com/view/journals/museum-worlds/7/1/armw070103.xml
Torsional mass moments of inertia for CROD and CBAR elements ...,http://www2.me.rochester.edu/courses/ME204/nx_help/en_US/tdocExt/content/6/id630116.xml
"Chapter 3: The inertia in: EU, Turkey and Counter-Terrorism",https://www.elgaronline.com/view/9781800379565.00011.xml
