"Family, Pakistan Mourn Loss Of Student Killed In Texas Shooting",https://www.vietnamtribune.com/news/257309538/oct04v56.flv
"Death Toll in Lao Dam Collapse Reaches 26, With 131 Missing",https://www.thailandherald.com/news/257733554/oct04v56.flv
"Trump, Kim Arrive In Singapore Ahead Of Historic Summit",https://www.southeastasiapost.com/news/257456627/oct04v40.flv
"UFO theorists gain mainstream voice for the first time, blame alien ...",https://www.irishsun.com/news/247380729/oct04v56.flv
Parole officer with brent everett & patrick downs flv - Gaytorrent.ru,https://www.gaytorrent.ru/details.php/1290b61d7b6f4fdd71a4245d9ffa993ab8402d569baad3fa/%25E2%2599%25BA%2BParole%2Bofficer%2Bwith%2Bbrent%2Beverett%2B%2526%2Bpatrick%2Bdowns.flv
the secret circle 1x21.FLV - XNXX.COM,https://www.xnxx.com/video-540qdbb/the_secret_circle_1x21.flv
Urabukkake Tour,https://www.urabukkake.com/en/tour/488ava/sample.flv%3Fpage%3D1
Rahatupu.Blogspot.Com Kim Kardashian wa Bongo Huyu Hapa !!! 2 ...,http://porjav.com/search/Rahatupu.Blogspot.Com-Kim-Kardashian-wa-Bongo-Huyu-Hapa-%2521%2521%2521-2.FLV
Myanmar judge says Reuters journalists breached secrets Act,https://www.mexicocitysun.com/news/257935837/oct04v56.flv
japanese m. 2017 part1.FLV 46 min - BRAZZERS,https://brazzershot.com/video26269041/japanese_m._2017_part1.flv
Tragic plane crash kills 21 in South Sudan - Long Beach Star,https://www.australianherald.com/news/257959316/oct04v56.flv
