Animism and Personal Religion in Southeast Asia in - Brill,https://brill.com/view/journals/bki/173/4/article-p552_7.xml%3Flanguage%3Den
Chapter 8 Arboreal Animists: The (Ab)use of Roman Sacred Trees in ...,https://brill.com/view/book/edcoll/9789004365001/BP00011.xml
The Return of the Animists in - Berghahn Journals,https://www.berghahnjournals.com/view/journals/religion-and-society/1/1/air-rs010107.xml
Toying with Animism in: Nature and Culture Volume 16 Issue 3 (2021),https://www.berghahnjournals.com/view/journals/nature-and-culture/16/3/nc160304.xml
Integrating Traditional Healing Practices into Counseling and ...,https://sk.sagepub.com/books/integrating-traditional-healing-practices-into-counseling-and-psychotherapy/n11.xml
SAGE Reference - Encyclopedia of Anthropology,https://sk.sagepub.com/reference/anthropology/n32.xml
Dead or alive?: the animism of artefact in literature - TEXT Journal,https://textjournal.scholasticahq.com/article/27062.xml
Shifting Ontologies in Huichol Ritual and Art1 | Scholars Portal ...,https://journals.scholarsportal.info/details/15599167/v40i0001/58_soihraa.xml
Contemporary Mari Belief: The Formation of Ethnic Religion - Sciendo,http://www.degruyter.com/view/j/jef.2018.12.issue-2/jef-2018-0013/jef-2018-0013.xml
Index in: The Magic of Organization - Elgaronline,https://www.elgaronline.com/view/edcoll/9781839106729/9781839106729.00021.xml
[PDF] THE PRACTICE OF WEARING CRYSTALS IN CONTEMPORARY ...,http://sciendo.com/abstract/journals/jef/13/1/article-p131.xml
Globalgothic: Unburying Japanese figurality - ManchesterHive,https://www.manchesterhive.com/downloadpdf/9781526102973/9781526102973.00020.xml
God as World-Mind: Some Theological Implications of Panpsychism in,https://www.mentis.de/view/book/edcoll/9783957437303/BP000011.xml
Introduction: Evidence for entheogen use in prehistory and world ...,https://akjournals.com/view/journals/2054/3/2/article-p43.xml
Animism: People Who Love Objects - ABC,https://www.abc.net.au/xmlcontent/tv/guide/xmlengine/brands/animism-people-who-love-objects/data.xml
"ANTIPHON, Tetralogy 1 | Loeb Classical Library",https://www.loebclassics.com/view/antiphon-first_tetralogy/1941/pb_LCL308.41.xml
References - Scholars.Direct,https://scholars.direct/Articles/anthropology/iap-4-025.xml%3Fjid%3Danthropology
Supplements I - The Zarathushtrian Assembly,http://imi-intel.com/userfiles/12242-prostatitis-tablets-most-effective.xml
<![CDATA[Sudanese refugees vote for separation ]]> - CNN,http://www.cnn.com/interactive/2011/01/us/gallery.sudan.vote.nashville/flashxml/index.xml
To E. B. Tylor 24 September [1871] - | Darwin Correspondence Project,https://www.darwinproject.ac.uk/letter/DCP-LETT-7966.xml
Bieke Zaman Maarten Van Mechelen Lizzy Bleumers When toys ...,https://dblp.uni-trier.de/rec/conf/acmidc/ZamanMB18.xml
The Asia Cafe Podcast - Podomatic,https://asiacafe.podomatic.com/rss2.xml
Head + Heart Talk - Podbean,https://feed.podbean.com/headplusheart/feed.xml
sitemap-artworks_177.xml - Art Basel,https://www.artbasel.com/sitemap-artworks_177.xml
recast-jats-build e082d6219a bmjgh bmjgh BMJ Global Health BMJ ...,https://gh.bmj.com/content/1/4/e000151.download.xml
"Women of Grace, Radio - EWTN",https://www.ewtn.com/api/feed/~LO.xml
