Chapter 4 Non-Action in: Lu Jia's New Discourses - Brill,https://brill.com/view/book/9789004419889/BP000006.xml%3Flanguage%3Den
Chapter 42: Counter-terrorism and Pan-Africanism: From non-action ...,https://www.elgaronline.com/view/edcoll/9780857938800/9780857938800.00053.xml
Chapter 45: Counter-terrorism and pan-Africanism: from non-action ...,https://www.elgaronline.com/view/edcoll/9781788972215/9781788972215.00056.xml
C70A-4-S102_1800010118000101.xml,https://le.utah.gov/xcode/Title70A/Chapter4/C70A-4-S102_1800010118000101.xml
"General Provisions and Definitions Amended by Chapter 237 , 1993 ...",https://le.utah.gov/xcode/Title70A/Chapter4/C70A-4-P1_1800010118000101.xml
The Origin of Word-related Motor Activity | Scholars Portal Journals,https://journals.scholarsportal.info/details/10473211/v25i0006/1668_toowma.xml
Wu Wei East and West in - Berghahn Journals,https://www.berghahnjournals.com/abstract/journals/theoria/58/126/th5812603.xml
WILLIBALD SCHAEFER CO. v. | 264 S.W.2d 920 (1954 ...,https://www.leagle.com/decision/19541184264sw2d92011154.xml
Where Have the Monetary Surprises Gone? The Effects of FOMC ...,https://www.elibrary.imf.org/view/journals/001/2007/185/article-A001-en.xml
