Boilermaker Union News and Updates | Page 139 | International ...,https://boilermakers.org/news/video.flv%3Fpage%3D138
Boilermaker Union News and Updates | Page 158 | International ...,https://boilermakers.org/news/video.flv%3Fpage%3D157
Jessica Thomas Triples vs. Covenant - Emory Athletics,https://www.emoryathletics.com/sports/sball/video/jthom.flv
Coach Penny Siqueiros Talks Emory Softball,https://www.emoryathletics.com/sports/sball/2010-11/Video/penny(0420).flv
MBB Highlights at Vanderbilt - Belmont Bruins,https://www.belmontbruins.com/sports/m-baskbl/2010-11/videos/MBBHvsVandy.flv
"Emirates cashes in, launches Edinburgh-Dubai direct flights",https://www.irishsun.com/news/257216847/oct04v56.flv
Saginaw Valley State - PrestoSports,https://svsu.prestosports.com/sports/wxc/videos/Rod_Cowan_Week_4.flv
MBB Selection Sunday Watch Party - Belmont Bruins,https://belmont.prestosports.com/sports/m-baskbl/2010-11/videos/Selection.flv%3Flist%3D/sports/m-baskbl/2010-11/videos/index
"[PDF] Parsi Theater, Urdu Drama, and the Communalization of Knowledge",https://minio.la.utexas.edu/colaweb-prod/profile/custom_pages/0/119/parsi_theater_urdu_drama_and_the_communa_51b7a927-cb02-4217-9c55-0726dcb7b8bf.flv
TWU Vic/Tas,http://old.twu.asn.au/index.php/2-general/images/2015/images/content/Whispers.flv
