Mechanisms of Desensitization and Resensitization of Proteinase ...,https://www.jbc.org/article/S0021-9258(19)61890-9/pdf
Enhancement of Bradykinin and Resensitization of Its B2 Receptor,https://www.ahajournals.org/doi/pdf/10.1161/01.HYP.33.3.835%3Fdownload%3Dtrue
Accelerated Resensitization of the D 1 Dopamine Receptor-mediated,https://www.jneurosci.org/content/jneuro/14/10/6280.full.pdf
Bacteriophage-resistant Acinetobacter baumannii are resensitized ...,https://www.nature.com/articles/s41564-020-00830-7.pdf%3Fproof%3Dt
Rapid resensitization of purinergic receptor function in human platelets,https://onlinelibrary.wiley.com/doi/pdf/10.1111/j.1538-7836.2008.03039.x
Desensitization and resensitization rates of glutamate-activated ...,https://journals.physiology.org/doi/pdf/10.1152/jn.1991.66.4.1166
Protein phosphatase 2A mediates resensitization of the neurokinin 1 ...,https://journals.physiology.org/doi/pdf/10.1152/ajpcell.00096.2011
[PDF] Resensitization of Fosfomycin-Resistant Escherichia coli Using the ...,https://www.mdpi.com/1422-0067/23/16/9175/pdf%3Fversion%3D1660626694
[PDF] Physiological Role of ATPase for GABAA Receptor Resensitization,https://www.mdpi.com/1422-0067/23/10/5320/pdf%3Fversion%3D1652335874
[PDF] Amoxicillin- resistant Streptococcus pneumoniae can be ... - eLife,https://elifesciences.org/articles/75607.pdf
Methylglyoxal Scavengers Resensitize KRAS-Mutated Colorectal ...,https://www.cell.com/cell-reports/pdf/S2211-1247(20)30021-8.pdf
A Novel Mechanism of Neurokinin-1 Receptor Resensitization,https://jpet.aspetjournals.org/content/jpet/303/3/1155.full.pdf
G-Protein Coupled Receptor Resensitization - Ingenta Connect,https://www.ingentaconnect.com/content/ben/cmp/2012/00000005/00000003/art00004%3Fcrawler%3Dtrue
[PDF] Amoxicillin-resistant Streptococcus pneumoniae can be resensitized ...,https://www.biorxiv.org/content/10.1101/2021.09.13.460059v2.full.pdf
Leucocytosis in Biomphalaria g/&rata Sensitized and Resensitized ...,https://www.sciencedirect.com/science/article/pii/0022201180900762/pdf%3Fmd5%3Df8b48e67a470f74a04894c75d3533531%26pid%3D1-s2.0-0022201180900762-main.pdf
Resistant Ovarian Cancer,https://mct.aacrjournals.org/content/molcanther/15/7/1557.full-text.pdf
Targeted Therapy in Advanced Thyroid Cancer to Resensitize ...,https://academic.oup.com/jcem/article-pdf/103/10/3698/25902571/jc.2018-00612.pdf
[PDF] eukaryotic translation initiation factor 3 subunit g (eiF3g ...,https://www.scienceopen.com/document_file/d6e6979f-a33f-44f1-bd8e-ed15b59b6d39/PubMedCentral/d6e6979f-a33f-44f1-bd8e-ed15b59b6d39.pdf
"[PDF] Rapid activation, desensitization, and resensitization of synaptic ...",https://www.ncbi.nlm.nih.gov/pmc/articles/PMC1280747/pdf/biophysj00129-0141.pdf
Lack of Penicillin Resensitization in Patients With a History of ...,https://jamanetwork.com/journals/InteMed/articlepdf/211364/ioi10223.pdf
