KEN LOACH AS SOCIAL MOVEMENT EDUCATOR - Brill,https://brill.com/downloadpdf/book/9789460919794/BP000009.xml
KEN LOACH AS SOCIAL MOVEMENT EDUCATOR - Brill,https://brill.com/previewpdf/book/edcoll/9789460919794/BP000009.xml%3FpdfJsInlineViewToken%3D514801045%26inlineView%3Dtrue
Affecting Profundity: Cognitive and Moral Dissonance in Lynch ...,https://www.berghahnjournals.com/view/journals/projections/11/1/proj110104.xml
"Cognitive and Moral Dissonance in Lynch, Loach, Linklater, and ...",https://www.berghahnjournals.com/abstract/journals/projections/11/1/proj110104.xml
"Triplophysa anshuiensis, a new species of blind loach from the ...",https://europepmc.org/articles/pmc5904374/bin/zookeys.744.21742-treatment1.xml
"Importing national cinema: Ken Loach, Ae Fond ... - manchester hive",https://www.manchesterhive.com/downloadpdf/9781526111838/9781526111838.00010.xml
Development of nine polymorphic microsatellite loci in the spined ...,https://journals.scholarsportal.info/details/1755098x/v08i0005/1001_donpmlectact.xml
Untitled,https://edition.cnn.com/video/data/3.0/video/tv/2016/05/23/ken-loach-palme-dor-pkg.cnn/index.xml
sitemap_products_1.xml - Aquatic Arts,https://aquaticarts.com/sitemap_products_1.xml%3Ffrom%3D4684093766%26to%3D9704827084
