"feeding mechanism of the echiuroid, ochetostoma - JSTOR",https://www.jstor.org/stable/1539504
XVII.—The natural history of an echiuroid worm,https://www.tandfonline.com/doi/pdf/10.1080/00222932808672765
XVI.—A new echiuroid worm from California,http://www.tandfonline.com/doi/pdf/10.1080/00222932808672764
NEUROMUSCULAR MECHANISMS OF BURROW IRRIGATION IN ...,https://journals.biologists.com/jeb/article-pdf/45/2/343/1339175/343.pdf
"marks on the Species Hamingia ijimai, Ikeda",https://jcs.biologists.org/content/joces/s2-56/221/135.full.pdf
Embryology of an Echiuroid Worm - Science,https://www.science.org/doi/pdf/10.1126/science.93.2417.402
"FEEDING MECHANISM OF THE ECHIUROID, OCHETOSTOMA ...",https://www.journals.uchicago.edu/doi/pdf/10.2307/1539504
"Stimulation of Unfertilized Eggs of the Echiuroid, <i>Urechis ...",https://onlinelibrary.wiley.com/doi/pdf/10.1111/j.1440-169X.1983.00445.x
on the vitally stainable granules - Wiley Online Library,https://onlinelibrary.wiley.com/doi/pdf/10.1111/j.1440-169X.1959.tb00251.x
CO-INSENSITIVE RESPIRATION IN MITOCHONDRIA ISOLATED ...,https://www.sciencedirect.com/science/article/pii/0305049186901744/pdf%3Fmd5%3D98d7e6037f267a14918af7cc007a405b%26pid%3D1-s2.0-0305049186901744-main.pdf%26_valck%3D1
