INFLUENCE OF A SOIL SPIKE AERATOR ON INCREASING NUT ...,https://journals.ashs.org/hortsci/view/journals/hortsci/27/11/article-p1168a.xml%3Frskey%3DJhEOwo
INFLUENCE OF A SOIL SPIKE AERATOR ON INCREASING NUT ...,https://journals.ashs.org/hortsci/view/journals/hortsci/28/4/article-p265B.xml
Aquarium Fish Tank Air Stone Cylinder Shape Aerator Pond Pump ...,https://ideal-bazar.com/product/aquarium-fish-tank-air-stone-cylinder-shape-aerator-pond-pump-8-5cm/a83/www.ideal-bazar.com/sitemap.xml
Performance evaluation of propeller-aspirator-pump aerator ...,https://journals.scholarsportal.info/details/01448609/v42i0002/70_peopa.xml
Channahon trustees deny resident's demand for water aerator,http://www.morrisherald-news.com/articles/2016/08/16/6b6e48f24a9241a49bcabc71c9b34354/index.xml
Observations On the Aerating Mechanism of the Wharf Crab ... - Brill,https://brill.com/view/journals/cr/15/2/article-p204_13.xml%3Flanguage%3Den
sitemap.xml,http://www.selvowater.com/sitemap.xml
sitemap.xml - Williams Sonoma,https://www.williams-sonoma.com/sitemap/shop/tabletop-glassware-bar/bar-wine-tool/sitemap.xml
MPE Mathematical Problems in Engineering 1563-5147 1024-123X ...,https://downloads.hindawi.com/journals/mpe/2015/872573.xml
