SSH-Ranking/config.ini at master · pronto/SSH-Ranking · GitHub,https://github.com/pronto/SSH-Ranking/blob/master/config.ini
broadlink-bridge/config.example.ini at master · lbschenkel/broadlink ...,https://github.com/lbschenkel/broadlink-bridge/blob/master/config.example.ini
frodovdr/Sonoff-Tasmota - platformio.ini at ... - Gitea,https://git.koehlerweb.org/frodovdr/Sonoff-Tasmota/src/commit/e017470df0e7330a3dcffc5317368599c315ba55/platformio.ini
Ikan Predator Menjadi Salah Satu Menu Andalan di Kafe Ini,https://travel.kompas.com/read/2017/02/21/104500827/ikan.predator.menjadi.salah.satu.menu.andalan.di.kafe.ini%3Fpage%3Dall
List of the known COM nodes and their type. ; ; Do not edit this file ...,https://www.pamho.net/files/NodeInfo.ini
Adblock Plus preferences version=4 [Filter] text ...,https://lamsey.homeip.net/files/abp.ini
Perguntas sobre desktop.ini. Página # 1 - SobreLinux,https://sobrelinux.info/tags/tag/desktop.ini
online půjčka cz ulice diskuze - OnlinePůjčky,https://www.antonio-pizza.cz/magmi/conf/magmi.ini
License GNU General Public License version 2 or later; see ...,http://www.cricte2004.eletrica.ufpr.br/cnee/administrator/language/es-ES/es-ES.com_kunena.install.ini
