"Parade's End, I want to argue, is a novel “about time” in Ricoeur's ...",https://brill.com/previewpdf/book/9789401210317/B9789401210317-s006.xml
The Thinking Fetus: Descartes at the Brink of Psychoanalysis in - Brill,https://brill.com/view/journals/ehcs/5/2/article-p234_5.xml
Queer Theory and Childhood - Childhood Studies - Oxford ...,https://www.oxfordbibliographies.com/view/document/obo-9780199791231/obo-9780199791231-0022.xml
False love and the perverse pact 1 | Scholars Portal Journals,https://journals.scholarsportal.info/details/00207578/v86i0003/775_wpflatpp1.xml
Decadence : Music in the Early Twentieth Century,https://www.oxfordwesternmusic.com/view/Volume4/actrade-9780195384840-div1-001011.xml%3Frskey%3DdrNrNq%26result%3D166
SAGE Reference - The SAGE Encyclopedia of Children and ...,https://sk.sagepub.com/Reference/the-sage-encyclopedia-of-children-and-childhood-studies/i14659.xml
Reading Freud: Psychoanalysis as Cultural Theory - SAGE Books,https://sk.sagepub.com/books/reading-freud/n3.xml
Preface and acknowledgements in: Imperium of the soul,https://www.manchesterhive.com/view/9781526106070/9781526106070.00004.xml
[PDF] Celebrating Our Current “Baldwin Moment” - Manchester Open Hive,https://www.manchesteropenhive.com/downloadpdf/journals/jbr/5/1/article-p1.xml
