MICROGRAFX Windows Draw Special Edition version 5,https://archive.org/details/WD45EPSON.7z
Seismometer : Antoine Jacquet (Royale) - Internet Archive,https://archive.org/details/seismometer-0.1.7z
Downloading drawio-portable-win64-13.6.2-10.7z... - Portapps,https://portapps.io/download/drawio-portable-win64-13.6.2-10.7z
Download The FreeType Project from SourceForge.net,https://qa.debian.org/watch/sf.php/freetype/ttfautohint-1.1-win32.7z
Inside Higher Ed's News,https://www.insidehighered.com/news/2020/06/11/colleges-face-evolving-cyber-extortion-threat.7Z%3Fpage%3D1051
All Those Beautiful “Euphoria” Makeup Looks Are | Into The Gloss,https://intothegloss.com/2019/08/euphoria-makeup-jules-maddy.7z
Formation of Primordial Black Holes in a Stiff Universe - NASA/ADS,https://adsabs.harvard.edu/full/1980SvAL....6....7Z
Variable bites and dynamic populations; new insights in Leishmania ...,https://europepmc.org/articles/pmc7861551/bin/pntd.0009033.s005.7z
SpinSPJ: a novel NMR scripting system to implement artificial ...,https://europepmc.org/articles/pmc8650269/bin/12859_2021_4492_moesm1_esm.7z
