5 things that have to go right for Michigan this season | The Blade,https://www.toledoblade.com/sports/michigan/2018/08/30/5-things-that-have-to-go-right-for-Michigan-this-season/stories/feed/index.rss
2016 Woodward Polar Bears football team - Toledo Blade,https://www.toledoblade.com/frontpage/2016/08/24/2016-Woodward-Polar-Bears-football-team/stories/feed/feed/index.rss
A Miami Hurricanes Podcast - Storm Surge - Audioboom,https://audioboom.com/channels/4996497.rss
The Scouted Football Podcast - Audioboom,https://audioboom.com/channels/5011500.rss
Georgia Southern Extra Podcast - Omny.fm,https://omny.fm/shows/georgia-southern-extra/playlists/podcast.rss
Matt Waldman's RSP Cast,https://pod.link/1393773461.rss
"Black Hat Briefings, Las Vegas 2006 [Audio] Presentations from the ...",https://www.blackhat.com/podcast/bh-usa-06-audio.rss
Week Zero Sports and Other Stuff - Buzzsprout,https://feeds.buzzsprout.com/547084.rss
Inside the Birds: A Philadelphia Eagles Podcast - Anchor,https://feeds.buzzsprout.com/385279.rss
