PaymentHub - Exactuals,https://forum.librevault.com/t/librevault-0-1-16/38.rss
Ohio Democrats propose single-payer health care | The Blade,https://www.toledoblade.com/news/state/2017/10/24/House-Dems-proposed-single-payer-health-care/stories/feed/index.rss
Town hall to explore future of health care - Toledo Blade,https://www.toledoblade.com/local/2017/04/07/Town-hall-to-explore-future-of-health-care/stories/feed/index.rss
Tuning In to The C-Suite - Audioboom,https://audioboom.com/channels/5026685.rss
Wearable technology | Employee Benefit News,https://www.employeebenefitadviser.com/tag/wearable-technology.rss
Webinar Czechia in the Arctic / The Arctic in Czechia | Ministry of ...,https://www.mzv.cz/jnp/en/foreign_relations/candidacy_arctic_council/webinar_czechia_in_the_arctic_the_arctic.rss
Czech footprints in the Arctic | Ministry of Foreign Affairs of the ... - MZV,https://www.mzv.cz/jnp/en/foreign_relations/candidacy_arctic_council/czech_footprints/index.rss
"Coffee, Compliance and Chuckleheads - PodServe.fm",https://www.podserve.fm/series/rss/3088/coffee-compliance-and-chuckleheads.rss
Health Care Collaborations - Buzzsprout,https://feeds.buzzsprout.com/1511974.rss
