"<hi rend=""bold"">Oral History Interview with Adele Clark, February 28 ...",https://docsouth.unc.edu/sohp/G-0014-2/G-0014-2.xml
"Valley Spirit: October 22, 1862",https://valley.lib.virginia.edu/news/vs1862/pa.fr.vs.1862.10.22.xml
"Waynesboro Village Record: April 14, 1863",https://valley.lib.virginia.edu/news/vr1863/pa.fr.vr.1863.04.24.xml
austria's post-89: staging suppressed memory in elfriede jelinek's ...,https://brill.com/downloadpdf/book/edcoll/9789401208895/B9789401208895-s012.xml
MAIN ALPHABETICAL SEQUENCE (A–Z) Abbasid bookhand ... - Brill,https://brill.com/downloadpdf/book/9789047443032/Bej.9789004170360.i-350_002.xml
"Mountains and molehills; or, Recollections of a burnt journal ... - Loc",https://tile.loc.gov/storage-services/service/gdc/calbk/010.xml
Untitled,https://tile.loc.gov/storage-services/public/gdcmassbookdig/20thcenturyhisto00lytl/20thcenturyhisto00lytl_djvu.xml
Final environmental impact statement and draft management plan ...,https://www.gpo.gov/fdsys/pkg/CZIC-qh76-5-n8-f56-1984/xml/CZIC-qh76-5-n8-f56-1984.xml
A new deep-sea species of <i>Flabelligena</i> from off the South ...,https://europepmc.org/articles/pmc7295819/bin/bdj.8.e53312-treatment1.xml
Uncle Silas: a Tale of Bartram-Haugh - Moved Permanently,http://research.ucc.ie/celt/document/E860000-001.xml
