CONTROLLED UNCLASSIFIED INFORMATION (CUI) - Govinfo.gov,https://www.govinfo.gov/content/pkg/CFR-2019-title32-vol6/xml/CFR-2019-title32-vol6-part2002.xml
"Price Liberalization, Money Growth, and Inflation During the ...",https://www.elibrary.imf.org/view/journals/001/1999/076/article-A001-en.xml
Index Number Biases During Price Liberalization in - IMF eLibrary,https://www.elibrary.imf.org/view/journals/024/1992/002/article-A003-en.xml
CONTROLLED UNCLASSIFIED INFORMATION (CUI) - US ...,https://www.gpo.gov/fdsys/pkg/CFR-2017-title32-vol6/xml/CFR-2017-title32-vol6-part2002.xml
Archivist of the United States. - Federal Register,https://www.federalregister.gov/documents/full_text/xml/2016/09/14/2016-21665.xml
https://www.newyorker.com/magazine/1947/01/11/gay-outpouring ...,https://www.newyorker.com/sitemap.xml%3Fyear%3D1947%26month%3D1%26week%3D1
The Political Economy of Philippine Tariff Reform - Brill,https://brill.com/previewpdf/journals/ppsj/18/1-2/article-p29_2.xml%3FpdfJsInlineViewToken%3D469717889%26inlineView%3Dtrue
Intergroup welfare comparisons using aggregate consumption data ...,https://digital.library.unt.edu/ark:/67531/metadc1060074/opensearch.xml
Chapter 3: Indian planning circa 2018 and past experience,https://www.elgaronline.com/abstract/edcoll/9781839100109/9781839100109.00009.xml
