Northeast Barbecue Society: Home,https://nebs.clubexpress.com/clubs/238021/rss/Blog2892.rss
The Official Eurovision Song Contest Podcast - Audioboom,https://audioboom.com/channels/4991348.rss
Way Public Library accepting submissions for cake contest | The Blade,https://www.toledoblade.com/Food/2015/06/09/Way-Public-Library-accepting-submissions-for-cake-contest/stories/feed/feed/index.rss
"""Masatoshi Tanaka presents: THE 3rd HAPPY CLARINET CONTEST""",https://www.mzv.cz/tokyo/en/kalendar_akci/masatoshi_tanaka_presents_the_3rd_happy.rss
Fine Arts Contest Awardees Participated in Workshop | Czech ... - MZV,https://www.mzv.cz/taipei/en/news_events/fine_arts_contest_awardees_participated.rss%3Fnotify%3D1
News - NBC15,http://www.nbc15.com/content/news/index.rss
NASA in Silicon Valley,https://www.nasa.gov/rss/dyn/NASA-in-Silicon-Valley.rss
New Yorker Cartoon Caption Contest Podcast - Pod.casts,https://pod.casts.io/podcasts/cartoon-caption-contest-podcast.rss
GET TO THE CONTEST - Buzzsprout,https://feeds.buzzsprout.com/148471.rss
