"December 20, 2019 Post - Meeting Survey - IDHS",https://www.dhs.state.il.us/page.aspx/FACT_Intro.flv%3Fitem%3D121273
Rural Scotland rated very good place to live - gov.scot,https://www.bangladeshsun.com/news/258095896/oct04v56.flv
Indestructible Elgar must prove he is more than just that - News24,https://www.malaysiasun.com/news/258049647/oct04v56.flv
U.S. Calls On Russia To Comply With UN Sanctions On North Korea,https://www.orangecountysun.com/news/257786499/oct04v56.flv
False Tsunami Warnings Sent Over Phones Spook Americans,https://www.philippinetimes.com/news/256389508/oct04v40.flv
"[PDF] Parsi Theater, Urdu Drama, and the Communalization of Knowledge",https://minio.la.utexas.edu/colaweb-prod/profile/custom_pages/0/119/parsi_theater_urdu_drama_and_the_communa_51b7a927-cb02-4217-9c55-0726dcb7b8bf.flv
DeMar Hoop and the Harm - NBA.com,https://www.nba.com/amp/raptors/drop-box-nba-web-141005-demarand1.flv
Slovakia Detains Suspects In Slain Journalist Case,https://www.irishsun.com/news/258049965/oct04v56.flv
Bok ratings: Pieter-Steph's tears told it all | Sport - News24,https://www.sierraleonetimes.com/news/257993273/oct04v40.flv
[PPT] Summary of 50 LOPAs carried out since PSLG ... - ResearchGate,https://www.researchgate.net/profile/Richard-Gowland/publication/267344499_206787_How_Layer_of_Protection_Analysis_In_Europe_Is_Affected_by_the_Guidance_Drawn_up_After_the_Buncefield_Accident/links/5923f3ccaca27295a8aa7c0e/Donald-Rumsfeld-Unknown-Unknowns.flv
