"PLINY THE ELDER, Natural History | Loeb Classical Library",https://www.loebclassics.com/view/pliny_elder-natural_history/1938/pb_LCL353.409.xml%3FreadMode%3Drecto
"APPIAN, Roman History 8.1. The Punic Wars | Loeb Classical Library",https://www.loebclassics.com/view/appian-roman_history_book_viii_1_punic_wars/1912/pb_LCL002.633.xml%3FreadMode%3Drecto
Water Defences in: Critical Survey Volume 16 Issue 3 (2004),https://www.berghahnjournals.com/view/journals/critical-survey/16/3/cs160303.xml
"Staunton Spectator: October 18, 1859 - Valley of the Shadow: Civil ...",https://valley.lib.virginia.edu/news/ss1859/va.au.ss.1859.10.18.xml
"Or, The Life and Adventures of Peter Wheeler, a Colored Man Yet ...",https://docsouth.unc.edu/neh/lester/lester.xml
"or, the Escape of William and Ellen Craft from Slavery:</emph ...",https://docsouth.unc.edu/neh/craft/craft.xml
"<hi rend=""italic"">Leaves of Grass</hi> (1855) - The Walt Whitman ...",https://whitmanarchive.org/published/LG/tei/ppp.00271.xml
wp-sitemap-posts-geodata-11.xml - Encyclopedia Virginia,https://encyclopediavirginia.org/wp-sitemap-posts-geodata-11.xml
TEI Simple Processing Model,https://exist.al.uw.edu.pl:8444/exist/apps/tei-simple/test/5730.xml%3Froot%3D1.2.2.5.5%26odd%3Dteisimple.odd
A Princess Of Mars,http://infomotions.com/musings/xml-in-libraries/etexts/tei/burroughs-princess-702.xml
bobty体育|bob体育官方app在线|bobo体育是干什么的,http://154.80.232.143/xqsls.xml
bob综合官方下载|bob棋牌靠谱吗|bob软件打不开,http://154.90.79.198/kvruj.xml
BEQUEST OF ALBERT ADSIT CLEMONS (Not available for ...,https://tile.loc.gov/storage-services/service/gdc/dcmsiabooks/tr/ea/su/re/is/la/nd/st/00/st/ev/_0/treasureislandst00stev_0/treasureislandst00stev_0_djvu.xml
an appreciation of john wesley's journal - Christian Classics ...,https://www.ccel.org/ccel/wesley/journal.xml
"Don John, or Don Juan Unmasked - The William Hone BioText",http://honearchive.org/etexts/don-john/don-john.xml
Red as a rose is she - Indiana University Bloomington,https://dcl.ils.indiana.edu/teiworkshop/teiworkshop_ii/eg/vwwp_example_VAB7385.xml
The Old Santa Fé Trail - William F. Cody Archive,https://codyarchive.org/texts/wfc.bks00017.xml
The twelve months volunteer - Rice Scholarship Home,https://scholarship.rice.edu/bitstream/handle/1911/27093/aa00376.xml%3Fsequence%3D1%26isAllowed%3Dy
The John Rylands University Library of Manchester is perhaps still,https://www.manchesterhive.com/previewpdf/journals/bjrl/74/2/article-p65.xml
YBV12_all.xml - Yellow Nineties 2.0,https://1890s.ca/wp-content/uploads/YBV12_all.xml
