MOTHER 3 Soundtrack : Nintendo - Internet Archive,https://archive.org/details/MOTHER3UltimateMusicRipV1.0MIDISF2.7z
Developmental and social deficits and enhanced ... - Europe PMC,https://europepmc.org/articles/pmc7518626/bin/pone.0239738.s001.7z
Download i pad view no recoil no grass.7z app free - APKProZ,https://apkproz.com/apk/i-pad-view-no-recoil-no-grass.7z
"Latest News, Videos and Photos of .7z - Times of India",https://timesofindia.indiatimes.com/topic/.7z
File:RoboCop.rka.7z - Zak,https://zak.fi/File:RoboCop.rka.7z
Olay Te Dly Moisturuzer C Size 1.7Z Olay Total Effects ... - PriceCheck,https://www.pricecheck.co.za/offers/197982124/Olay%2BTe%2BDly%2BMoisturuzer%2BC%2BSize%2B1.7Z%2BOlay%2BTotal%2BEffects%2BDaily%2BMoisturizer%2BCream%2B1.7Z
Staré Hry Na Stiahnutie :: DJ OldGames,https://www.starehry.eu/download/adventure/Full.Throttle-demo.7z
قیمت و خرید Olay Reg Microsculpt Seru Size 1.7z Olay Regenerist ...,https://egerd.com/product/eg-B00E4MONOE-US/Olay%2BReg%2BMicrosculpt%2BSeru%2BSize%2B1.7z%2BOlay%2BRegenerist%2BMicrosculpt%2BSerum%2B1.7z
Buy New Muslim Halal Ramadan Eid Al-Adha Home Decoration ...,https://en.aliradar.com/item/33000469614-New-Muslim-Halal-Ramadan-Eid-Al-Adha-Home-Decoration-Supplies-Pillowcase-45*45cm-Sofa-Cushion-Set-Party-Decoration-Gifts.7z
endymion.sak?.mail.login.page - Password,http://140.114.245.138/ftp.7z
Magic Partition Recovery v1.0 Commercial Edition PreActivated.7z ...,"http://chomikuj.pl/krychu9999/PROGRAMY/ODZYSKIWANIE%2BDANYCH/Magic%2BPartition%2BRecovery%2Bv1.0%2BCommercial%2BEdition%2BPreActivated,2141705868.7z"
Easy Photo Recovery 2012 v6.6.931 Final PreCracked.7z ...,"http://chomikuj.pl/krychu9999/PROGRAMY/ODZYSKIWANIE%2BDANYCH/Easy%2BPhoto%2BRecovery%2B2012%2Bv6.6.931%2BFinal%2BPreCracked,2139172520.7z"
