Amounts and Types of Epicuticular Leaf Waxes among Onion ...,https://journals.ashs.org/jashs/view/journals/jashs/145/1/article-p30.xml
Identities of and Phenotypic Variation for Epicuticular Waxes among ...,https://journals.ashs.org/hortsci/view/journals/hortsci/55/12/article-p2008.xml
Epicuticular Wax Rice Mutants Show Reduced Resistance ... - BioOne,https://bioone.org/journals/environmental-entomology/volume-50/issue-4/nvab038/Epicuticular-Wax-Rice-Mutants-Show-Reduced-Resistance-to-Rice-Water/10.1093/ee/nvab038.xml
Epicuticular waxes of eceriferum mutants of Arabidopsis thaliana ...,https://journals.scholarsportal.info/details/00319422/v33i0004/851_ewoemoat.xml
Correlation between epicuticular wax content in the leaves of early ...,https://akjournals.com/view/journals/038/39/1-3/article-p173.xml
Untitled,https://www.biorxiv.org/content/biorxiv/early/2019/05/02/625343.source.xml
Oviposition by Plutella xylostella (Lepidoptera: Plutellidae) and ...,https://jee.oxfordjournals.org/content/93/4/1152.source.xml
Untitled,https://www.scirp.org/xml/78801.xml
Israel Journal of Plant Sciences Volume 41 Issue 2 (1992) - Brill,https://brill.com/view/journals/ijps/41/2/article-p57_1.xml
