[PDF] Results from the Radial Artery Patency and Clinical Outcomes trial,https://www.jtcvs.org/article/S0022-5223(09)01277-X/pdf
"Patencies of 2,127 Arterial to Coronary Conduits Over 15 Years",https://www.annalsthoracicsurgery.org/article/S0003-4975(03)01331-6/pdf
Saphenous Vein Graft Patency 1 Year After - AHA Journals,https://www.ahajournals.org/doi/pdf/10.1161/01.CIR.80.5.1190
Patency and characteristics of lower extremity vein grafts requiring ...,https://www.jvascsurg.org/article/S0741-5214(00)62450-3/pdf
Comparison of patency of single and sequential radial artery grafting ...,https://academic.oup.com/icvts/advance-article-pdf/doi/10.1093/icvts/ivab279/43219433/ivab279.pdf
Comparison of graft patency for off-pump and conventional coronary ...,https://academic.oup.com/icvts/article-pdf/8/3/325/17753370/8-3-325.pdf
[PDF] Patency of conduits in patients who received internal mammary ...,https://bmccardiovascdisord.biomedcentral.com/track/pdf/10.1186/s12872-020-01433-0.pdf
The Significance of the Retrograde Patency Test in Microarterial ...,https://journals.sagepub.com/doi/pdf/10.1016/S0072-968X%252882%252980007-7
A Systematic Review and Meta-Analysis of 12-Month Patency After ...,https://journals.sagepub.com/doi/pdf/10.1177/15266028211057085
[PDF] Patency of ePTFE Arteriovenous Graft Placements in Hemodialysis ...,https://kidney360.asnjournals.org/content/early/2020/10/14/KID.0003502020/full-text.pdf
