Groks Science Radio Show and Podcast - Open Computing Facility,https://www.ocf.berkeley.edu/~ebchess/groks.rss
MCMP – Mathematical Philosophy (Archive 2011/12) - LMU München,https://cast.itunes.uni-muenchen.de/vod/playlists/XTmjGCoKQp/quicktime.rss
Distinctive Voices - Amazon S3,http://s3.amazonaws.com/media.voicesatbeckman.org/podcasts/podcast.rss
News | Swiss Plant Science Web - Universität Basel,https://swissplantscienceweb.unibas.ch/en/news/914/feed.rss
Evolution (Video) - UCTV,http://podcast.uctv.tv/UCTV_Video_evolution.rss
Mindy Body Connection (Video) - University of California Television,https://podcast.uctv.tv/UCTV_Video_mindbody.rss
Psychologists Off the Clock - Megaphone,https://pod.link/1176171178.rss
Journey of the Universe - Buzzsprout,https://feeds.buzzsprout.com/243076.rss
Mushroom Revival Podcast - Buzzsprout,https://feeds.buzzsprout.com/313607.rss
Podcast episodes featuring Ben Greenfield - Pod.casts,https://pod.casts.io/people/ben-greenfield.rss
Latest Augmented reality Podcast Episodes - Pod.casts,https://pod.casts.io/topics/augmented%2520reality/new-episodes.rss
Alp Sipahigil on Player FM,https://player.fm/podcasts/alp-sipahigil.rss
