eCFR :: 7 CFR Part 330 -- Federal Plant Pest Regulations; General,https://www.govinfo.gov/content/pkg/CFR-2018-title7-vol5/xml/CFR-2018-title7-vol5-part330.xml
Economic Effect of Insect Pest Management Strategies on Small ...,https://journals.ashs.org/horttech/view/journals/horttech/30/1/article-p64.xml
Management of Pest Insects and Plant Diseases in Fruit and ...,https://journals.ashs.org/hortsci/view/journals/hortsci/56/1/article-p94.xml
Spatial and Temporal Variation in Stored-Product Insect Pest ...,https://bioone.org/journals/annals-of-the-entomological-society-of-america/volume-115/issue-3/saab049/Spatial-and-Temporal-Variation-in-Stored-Product-Insect-Pest-Distributions/10.1093/aesa/saab049.xml
Short-Term Forecasts of Insect Phenology Inform Pest Management,https://bioone.org/journals/annals-of-the-entomological-society-of-america/volume-113/issue-2/saz026/Short-Term-Forecasts-of-Insect-Phenology-Inform-Pest-Management/10.1093/aesa/saz026.xml
Biology and Management of the Green Stink Bug | Oxford Academic,https://jipm.oxfordjournals.org/content/3/3/C1.source.xml
Diflubenzuron-Based Management of the Pear Pest Complex in ...,http://jee.oxfordjournals.org/content/89/3/621.source.xml
Soybean Pest Podcast - Iowa State Entomology,https://www.ent.iastate.edu/soybeanresearch/podcasts/soybean-pest-podcast/rss.xml
Site Map - American Pest,https://www.americanpest.net/sitemap.xml
