"Effect of Dietary Acidifier on Growth, Mortality, Post-Slaughter ...",http://www.degruyter.com/view/j/aoas.2013.13.issue-1/v10220-012-0061-z/v10220-012-0061-z.xml%3Fformat%3DINT
Drug products containing active ingredients offered over-the-counter ...,https://www.gpo.gov/fdsys/pkg/CFR-2018-title21-vol5/xml/CFR-2018-title21-vol5-sec310-540.xml
1. Introduction - Hindawi.com,https://downloads.hindawi.com/journals/vmi/2021/6610778.xml
Southwest Fertilizer,https://www.southwestfertilizer.com/blog-feed.xml
Boron Fertilizer Product and Concentration Influence Spray Water ...,https://journals.ashs.org/horttech/view/journals/horttech/10/2/article-p350.xml
Pulsing With Low Concentration Gibberellin Plus Benzyladenine or ...,https://journals.ashs.org/horttech/view/journals/horttech/24/5/article-p560.xml
Effects of Vinegars on the Growth Performance of Black Tiger Post ...,https://ija.scholasticahq.com/article/18993.xml
Reduction of Drying Time for Jerky Products,https://extension.okstate.edu/fact-sheets/reduction-of-drying-time-for-jerky-products.xml
"LACTULOSE SOLUTION, USP <br/> <br/> - Accessdata.fda.gov",https://www.accessdata.fda.gov/spl/data/9be2d0a1-1415-47de-87f0-03a66680c62f/9be2d0a1-1415-47de-87f0-03a66680c62f.xml
