sitemap.xml - Bazar International,http://bazar-international.lu/sitemap.xml
sitemap.xml - Apuesta Exitosa,https://www.apuestaexitosa.com/sitemap.xml
G General exclusions from licensable activities : Licensed Premises ...,https://www.bloomsburyprofessionalonline.com/view/licensed_premises/LPLPP-section-00000176.xml
Activités commerciales d'une association Direction de l'information ...,https://www.berlaimont.fr/wp-content/uploads/comarquage/asso/1574780683/N22179.xml
sitemap.xml - theLotter,https://www.thelotter.com/sitemap.xml
1_fr_0_sitemap.xml - Lotoquine,https://www.lotoquine.com/1_fr_0_sitemap.xml
Descargar programa para realizar sorteos,http://damascusuniversity.edu.sy/mtid-n/FCKBIH/9568-descargar-programa-para-realizar-sorteos.xml
Using Counselling Skills in Social Work - SAGE Books,https://sk.sagepub.com/books/using-counselling-skills-in-social-work/i567.xml
The Federal Democratic Republic of Ethiopia in - IMF eLibrary,https://www.elibrary.imf.org/view/journals/002/2008/260/article-A001-en.xml
The French Nonprofit Sector: A Literature Review - Brill,https://brill.com/downloadpdf/journals/vrbr/3/2/article-p1_3.xml
search.xml - Local Authority Publishing,http://www.localauthoritypublishing.co.uk/flip_guides/wisbechguide/files/data/search.xml
