Micro-computed tomography–based highly automated 3D ...,https://thejns.org/spine/view/journals/j-neurosurg-spine/13/3/article-p367.xml
Egon Schiele Art Centrum - Český Krumlov,http://infoservis.ckrumlov.info/docs/de/atr5.xml
Eröffnungsfeier des Centrums für Chemie und Biomedizin ...,https://www.uibk.ac.at/events/2012/05/21/eroeffnungsfeier-des-centrums-fuer-chemie-und-biomedizin.xml
by7.xml - Bundesarchiv,http://www.bundesarchiv.de/findbuecher/rlg_findm/findb/by7.xml
DE-1958_1ab42b61-f9cf-4df4-b1cd-2ec36a6fd485 ...,https://open-data.bundesarchiv.de/ddb-bestand/DE-1958_BY_7.xml
HINWEISE ZU DEN AUTORINNEN UND AUTOREN - Brill,https://brill.com/downloadpdf/book/edcoll/9783897856400/B9783897856400_s046.xml
ARCHAEOLOGICAL APPROACHES TO NORTH ATLANTIC WHALE ...,https://brill.com/downloadpdf/book/9789047432418/Bej.9789004163980.i-326_008.xml
Bilar kan knappt mötas i centrums nya p-garage - Mitti,https://www.mitti.se/archive/lm/2013/12/09/280555/index.xml
Välj bland utbudet - Förskola - ist-asp.com is parked,https://kungalv.ist-asp.com/kungalvpub/public/flow/eos.wf.childcare.application.xml
