HortScience Volume 27 Issue 6 (1992),https://journals.ashs.org/hortsci/abstract/journals/hortsci/27/6/article-p568b.xml
POSTHARVEST TECHNOLOGY OF IMPORTED AND ...,https://journals.ashs.org/hortsci/view/journals/hortsci/27/6/article-p568b.xml%3Frskey%3D4WJ3dT
Foreign Ports Transhipped Goods Remission Order,"https://laws-lois.justice.gc.ca/eng/XML/C.R.C.,_c._767.xml"
transhipment in: A Dictionary of Transport Analysis - Elgaronline,https://www.elgaronline.com/view/nlm-book/9781843763758/chapter182.xml
Untitled,https://www.govinfo.gov/content/pkg/BILLS-110hr1497ih/xml/BILLS-110hr1497ih.xml
Importation at designated ports. - GovInfo,https://www.govinfo.gov/content/pkg/CFR-2016-title50-vol10/xml/CFR-2016-title50-vol10-sec216-50.xml
Indirect FDI - Brill,https://brill.com/downloadpdf/journals/jwit/13/4/article-p542_2.xml
Adulis and the Sea in - Brill,https://brill.com/view/book/edcoll/9789004330825/B9789004330825_009.xml
"ANTIPHON, On the Murder of Herodes | Loeb Classical Library",https://www.loebclassics.com/view/antiphon-murder_herodes/1941/pb_LCL308.175.xml
