'His excellency at home' Frederik Hendrik and the noble life at Huis ...,https://brill.com/view/journals/nkjo/51/1/article-p83_5.xml%3Flanguage%3Den
"W. MONTGOMERY WATT, Islam and Christianity today, forward by ...",https://brill.com/view/journals/arab/34/1/article-p127_19.xml%3Flanguage%3Den
"Copy of a letter written from Buffalo, State of New York, North ... - Loc",https://tile.loc.gov/storage-services/service/rbc/rbaapc/12740/12740.xml
Untitled,https://tile.loc.gov/storage-services/service/rbc/rbpe/rbpe09/rbpe099/09900300/09900300.xml
News Room | Children's Hospital of Philadelphia,https://www.chop.edu/newsroom/wp-includes/wlwmanifest.xml
"Under Secretary for Management, US Department of State.",https://www.federalregister.gov/documents/full_text/xml/2022/04/11/2022-07641.xml
"To His Excellency, Richard, Earl of Bellomont, Baron of Coloony in ...",https://ota.bodleian.ox.ac.uk/repository/xmlui/bitstream/handle/20.500.12024/N00724/N00724.xml%3Fsequence%3D6%26isAllowed%3Dy
"Dedication of the Cushing General Hospital, Framingham ...",https://thejns.org/view/journals/j-neurosurg/1/2/article-p83.xml
Lt. Colonel Henry P. Dunbar,https://thejns.org/previewpdf/journals/j-neurosurg/1/2/article-p83.xml
