Truth and Contradiction - jstor,https://www.jstor.org/stable/2660440
On the Principle of Contradiction in Aristotle - jstor,https://www.jstor.org/stable/20125812
"[PDF] Negation, Contrast and Contradiction in Text Processing",https://www.aaai.org/Papers/AAAI/2006/AAAI06-120.pdf
[PDF] Finding Contradictions in Text - Stanford NLP Group,https://nlp.stanford.edu/pubs/contradiction-acl08.pdf
[PDF] Proof by Contradiction,https://www.math-cs.gordon.edu/courses/mat231/notes/proof-contradiction.pdf
Individual Differences in Tolerance for Contradiction,https://www.tandfonline.com/doi/pdf/10.1207/s15327043hup1703_3
"Time, change and contradiction",https://www.tandfonline.com/doi/pdf/10.1080/00048409012344201
"[PDF] Culture, Dialectics, and Reasoning About Contradiction",https://culcog.berkeley.edu/Publications/1999AmPsy_DT.pdf
[PDF] The Way of the Dialetheist: Contradictions in Buddhism,https://scholarworks.smith.edu/cgi/viewcontent.cgi%3Farticle%3D1017%26context%3Dphi_facpubs
Hegel's Metaphysics and the Problem of Contradiction,https://muse.jhu.edu/article/227494
