CATS WITH ROSTRAL TEGMENTAL AND MIDLINE THALAMIC ...,https://thejns.org/previewpdf/journals/j-neurosurg/17/6/article-p1045.xml
The Pinnacle of Salon Music : Music in the Nineteenth Century,https://www.oxfordwesternmusic.com/view/Volume3/actrade-9780195384833-div1-007004.xml%3Frskey%3DKIDONw%26result%3D521%26print
Resolving Childhood Trauma: A Long-Term Study of ... - SAGE Books,https://sk.sagepub.com/books/resolving-childhood-trauma/n7.xml
"Manly Health and Training [New York Atlas, 19 December 1858] a ...",https://whitmanarchive.org/published/periodical/journalism/tei/per.00434.xml
Scots doctors in the West Indies - ManchesterHive,https://www.manchesterhive.com/downloadpdf/9781847793034/9781847793034.00016.xml
Lichtenberg's eXcretory vision of Hogarth's A Harlot's Progress,https://www.manchesterhive.com/downloadpdf/9781526127068/9781526127068.00017.xml
"<emph>An Address before the Medical Society of North Carolina, at ...",https://docsouth.unc.edu/nc/johnsonch/johnsonch.xml
"PLINY THE ELDER, Natural History | Loeb Classical Library",https://www.loebclassics.com/view/pliny_elder-natural_history/1938/pb_LCL393.5.xml%3FreadMode%3Dreader
-V*- • » V O <*' K * A & *• . * o N o 5 \V V N v> «. ' * 0 / > .0 <> v vV ...,https://tile.loc.gov/storage-services/service/gdc/dcmsiabooks/in/va/ll/ey/of/ha/vi/la/00/cl/ar/invalleyofhavila00clar/invalleyofhavila00clar_djvu.xml
“La Belle Dame sans Merci”: - Romantic Circles,https://romantic-circles.org/sites/default/files/imported/pedagogies/commons/theatre/XML/comet.xml
"The Contemporary Review, Volume 18 - Rossetti Archive",http://www.rossettiarchive.org/docs/ap4.c7.18.rad.xml
The Tragedy of King Richard the Second - Ibiblio,https://www.ibiblio.org/xml/examples/shakespeare/rich_ii.xml
Folkloristic Approaches in Library and Information Science,https://www.ideals.illinois.edu/bitstream/handle/2142/8230/librarytrendsv47i3_tei.xml%3Fsequence%3D2
The demeanour of a good subject in order to the acquiring and ...,https://ota.bodleian.ox.ac.uk/repository/xmlui/bitstream/handle/20.500.12024/A42953/A42953.xml%3Fsequence%3D7%26isAllowed%3Dy
biorxiv BIORXIV bioRxiv bioRxiv Cold Spring Harbor Laboratory ...,https://www.biorxiv.org/content/biorxiv/early/2019/08/09/731315.source.xml
Consuming light in: Soaking up the rays - Manchester Open Hive,https://www.manchesteropenhive.com/view/9781526115980/9781526115980.00006.xml
The works of Virgil containing his Pastorals ... - Distant Reader,https://distantreader.org/carrels/author-virgil-freebo/cache/A65112.xml
Richard II - The Folger SHAKESPEARE,https://shakespeare.folger.edu/downloads/teisimple/richard-ii_TEIsimple_FolgerShakespeare.xml
xacra | diccionari.cat,https://www.diccionari.cat/EC-BI-ca-en-ad-02684623.xml
