Autonomy Within Subservient Careers - JStor,https://www.jstor.org/stable/41472597
"Elusive Legitimacy: Subservient, Separate, or Generative?",https://www.degruyter.com/document/doi/10.7208/9780226327358-005/pdf
[PDF] The Subservient Covenant - The Upper Register,https://www.upper-register.com/papers/subservient_cov.pdf
Subservient analysis,https://www.tandfonline.com/doi/pdf/10.1516/JAMP-DAEE-XYL4-CJHD
"The Subservient, Co-Equal, Affective, and Social Integration Styles ...",https://www.tandfonline.com/doi/pdf/10.1080/10632913.1995.9934564
Respiration Subservient to Nutrition,https://www.nejm.org/doi/pdf/10.1056/NEJM185301050472302
Respiration Subservient to Nutrition,https://www.nejm.org/doi/pdf/10.1056/NEJM185301120472401
Starry Eyes and Subservient Selves - SAGE Journals,https://journals.sagepub.com/doi/pdf/10.1177/000494411005400303
The hepatic artery: Subservient to hepatic metabolism or guardian of ...,http://www.sciencedirect.com/science/article/pii/0306362377900301/pdf%3Fmd5%3D0b8e6949f14bbf8dc7354e478ba416c9%26pid%3D1-s2.0-0306362377900301-main.pdf
Efficient Compression of Secured Images Using Subservient Data ...,https://www.sciencedirect.com/science/article/pii/S2212017316304285/pdf%3Fmd5%3De13bae17b0106507becea67b38b9c020%26pid%3D1-s2.0-S2212017316304285-main.pdf%26_valck%3D1
