'Only the NEC can fire me' - Eastern Cape premier | News24,https://www.internationaltravelnews.com/news/256576870/oct04v56.flv
Eastern Cape taxi strike disrupts social grant payments - News24,https://www.sierraleonetimes.com/news/258014998/oct04v56.flv
Charge dropped against businessman Mark Lifman - News24,https://www.manufacturingmirror.com/news/256423994/oct04v40.flv
Trial date set for alleged killer of Cape Town teen | News24,https://www.capetownexpress.com/news/256826316/oct04v56.flv
Western Cape R295m 'day zero' water plan kicks in - News24,https://www.capetownexpress.com/news/254555692/oct04v56.flv
South Africa's Zuma Stops Release of Corruption Report,https://www.nigeriasun.com/news/248921781/oct04v40.flv
"""New film contest for teens focuses on racial healing"" (Fox Illinois ...",https://www.dhs.state.il.us/page.aspx/FACT_1WhatIsVR.flv%3Fitem%3D134876%26postdate%3D3/13/2021%26approval%3D4%26newsitemid%3D134474%26getpreviousnews%3Dtrue%26newssidebar%3D126286
Ethics before making money - Mogoeng tells lawyers - News24,https://www.johannesburglife.com/news/246846291/feb24v21.flv
DA after the De Lille saga - News24,https://www.irishsun.com/news/257255700/oct04v56.flv
Muslims angered by proposed Hajj visa fee implementation - News24,https://www.africaleader.com/news/248588823/oct04v40.flv
At least 30 children abducted by rebels in South Sudan - report,https://www.broadcastcommunications.com/news/248940557/oct04v40.flv
"Visually impaired SA athletes blitz to gold, silver | Sport - News24",https://www.bangladeshsun.com/news/256998371/oct04v40.flv
"SuperSport cancels chat with trio of SA greats, Richards upset | Sport",https://www.beijingbulletin.com/news/259123170/feb24v21.flv
Classy WP too hot to handle for Sharks | Sport - News24,https://www.kenyastar.com/news/258057521/oct04v56.flv
"Welcome to Makhanda, formerly known as Grahamstown - News24",https://www.kenyastar.com/news/258075653/oct04v56.flv
#News24 ICYMI: Zimbabwe declares Mugabe's birthday a holiday ...,https://www.northkoreatimes.com/news/255529795/oct04v56.flv
Steyn's SA 'A' absence a concern | Sport - News24,https://www.northkoreatimes.com/news/253767432/oct04v56.flv
Links > The Israel Center for Social & Economic Progress,http://icsep.org.il/links/MiltonFriedmanEng.flv
Proteas cruise past Zimbabwe for series clean sweep | Sport - News24,https://www.malaysiasun.com/news/258089029/oct04v56.flv
Postgame Interviews vs. C.W. Post - Stonehill,https://www.stonehillskyhawks.com/video/mbkb/2010-11/mbkbCWP111310.flv
