Peroxisomes,https://www.cell.com/current-biology/pdf/S0960-9822(11)00823-2.pdf
Peroxisomal Dysfunction in Age-Related Diseases,https://www.cell.com/trends/endocrinology-metabolism/pdf/S1043-2760(16)30172-2.pdf
[PDF] The main facts - Archive ouverte HAL,https://hal.archives-ouvertes.fr/hal-00644263/document
Peroxisomal Disorders - JAMA Network,https://jamanetwork.com/journals/jamapediatrics/articlepdf/516722/archpedi_147_6_015.pdf
Peroxisomal Disorders - Springer,https://link.springer.com/content/pdf/10.1007/978-3-662-02613-7_33.pdf
Peroxisome Disorders and Cutaneous Manifestations,https://www.karger.com/Article/Pdf/247074
Peroxisomal ghosts are intracellular structures ... - Wiley Online Library,https://onlinelibrary.wiley.com/doi/pdf/10.1016/S0248-4900(00)89016-4
Peroxisomal β-oxidation stimulates cholesterol biosynthesis in the ...,https://www.jbc.org/article/S0021-9258(22)00012-6/pdf
Peroxisomal and Microsomal Lipid Pathways Associated with ...,https://www.jbc.org/article/S0021-9258(19)88989-5/pdf
