Entry Perceptually Contemporaneous Offenses - SAGE Reference ...,https://sk.sagepub.com/reference/criminologicaltheory/n195.xml
A Perceptually-regulated Exercise Test Predicts Peak Oxygen ...,https://journals.humankinetics.com/view/journals/japa/23/2/article-p205.xml
Metabolic and Perceptual Responses to Short-Term Cycle Training ...,https://journals.humankinetics.com/view/journals/pes/10/2/article-p110.xml
Finding perceptually dominant orientations in natural textures ... - Brill,https://brill.com/previewpdf/journals/sv/8/2/article-p221_4.xml
Perceptual fusion of musical notes by native Amazonians suggests ...,https://journals.scholarsportal.info/pdf/20411723/v11inone/nfp_pfomnbsuromi.xml
Perceptually enhanced blind single-channel music source ...,https://journals.scholarsportal.info/details/10512004/v23i0002/646_pebsmssbnmf.xml
XML - Journal of Numerical Cognition,https://jnc.psychopen.eu/index.php/jnc/article/view/8323/8323.xml
Psychophysical characterization and modeling of perception. - bioRxiv,https://www.biorxiv.org/content/biorxiv/early/2016/12/06/091918.source.xml
temporal advantage for reloading vs. uploading conscious ...,http://nc.oxfordjournals.org/content/2016/1/niw017.source.xml
A spherical color model is intuitively simple and perceptually ... - SPIE,http://spieeventseurope.org/x92195.xml
The effects of instruction on the stage placement of children in ...,https://pubs.nctm.org/view/journals/at/11/1/article-p4.xml
"Perception, Cognition, Action - Philosophy - Oxford Bibliographies",https://www.oxfordbibliographies.com/view/document/obo-9780195396577/obo-9780195396577-0326.xml
"Preference, Complexity, and Color Information Entropy Values for ...",https://journals.ashs.org/horttech/view/journals/horttech/25/5/article-p625.xml
Standard No. 101; Controls and displays. - Govinfo.gov,https://www.govinfo.gov/content/pkg/CFR-2004-title49-vol5/xml/CFR-2004-title49-vol5-sec571-101.xml
Somewhere Over the Rainbow: How to Make Effective Use of Colors ...,https://journals.ametsoc.org/view/journals/bams/96/2/bams-d-13-00155.1.xml
Author Summary - PLOS,https://www.tools.wmflabs.org/opendatasets/plos/extracted/pbio.0060138.xml
C Specification - Khronos Group,https://www.khronos.org/registry/EGL/sdk/docs/man/eglCreatePbufferSurface.xml
s7.xml - Society for Imaging Science and Technology,https://library.imaging.org/admin/apis/public/article_shell/uploads/article_files/IST/72010085/63/5/s7/s7.xml
"UF,University of Florida projects=ETD makerules=title,UF server=TD ...",https://ufdcimages.uflib.ufl.edu/UF/E0/04/67/10/00001/UFE0046710_00001.mets.xml
Light Field Image Coding Using VVC Standard and View ... - DBLP,https://dblp.org/pid/15/9811.xml
cetcolor.xml - The Comprehensive R Archive Network,http://cran.nexr.com/web/dcmeta/cetcolor.xml
"Voice changes in reproductive disorders, thyroid disorders and ...",https://ec.bioscientifica.com/downloadpdf/journals/ec/11/3/EC-21-0505.xml
Abstract - Cambridge Repository,https://www.repository.cam.ac.uk/bitstream/handle/1810/337023/41598_2022_Article_11373_nlm.xml%3Fsequence%3D4%26isAllowed%3Dy
The perception of voicing contrast in assimilation contexts in minimal ...,https://akjournals.com/view/journals/2062/68/1-2/article-p207.xml
Journal of Sports Science and Medicine,https://www.jssm.org/tablejssm-18-316.xml/table002.xml
info:oai:d-scholarship.pitt.edu:7639 info:ofi/fmt:xml:xsd:oai_dc http ...,http://d-scholarship.pitt.edu/cgi/export/7639/ContextObject/d-scholarship-7639.xml
Highlights from Photonics West articles | SPIE Homepage,https://spie.org/x92178.xml%3FArticleID%3Dx92178
Basic-level superiority in picture categorization - IDEALS @ Illinois,https://www.ideals.illinois.edu/bitstream/handle/2142/17661/ctrstreadtechrepv01982i00254_tei.xml%3Fsequence%3D2%26isAllowed%3Dy
