Engaging Citizens in Policy Making - Elgaronline,https://www.elgaronline.com/view/edcoll/9781800374355/9781800374355.xml
Citizen Governance: Leading American Communities ... - SAGE Books,https://sk.sagepub.com/books/citizen-governance/n3.xml
"Seeking Recognition, Becoming Citizens in - Berghahn Journals",https://www.berghahnjournals.com/view/journals/conflict-and-society/5/1/arcs050111.xml
“Counterterrorism Citizens” and the Neurotic City in - Berghahn ...,https://www.berghahnjournals.com/view/journals/conflict-and-society/7/1/arcs070106.xml
Chapter 15 The European Citizens' Initiative in Times of Brexit in - Brill,https://brill.com/view/book/edcoll/9789004433076/BP000018.xml
The Duty of Care for Citizens Abroad: Security and Responsibility in ...,https://brill.com/view/journals/hjd/13/2/article-p188_188.xml%3Flanguage%3Den
Citizens Utility Board – Your Independent Consumer Voice,http://cubwi.com/xml147402593/57727566.xml
Citizen Participation in Plan Preparation and Future Updates,https://permitsonoma.org/x105666.xml
Independent Citizens Pension Committee Meeting - County Of ...,https://sonomacounty.ca.gov/x60278.xml
