pab Ltd demo data / software,http://pab.nz/shadow/bme/ward_trans.vk_op10.380/data/ward_trans.vk_op10.380.7z
"Pathologist workload, work distribution and significant absences or ...",https://europepmc.org/articles/pmc8956155/bin/pone.0265905.s004.7z
A novel role for apatinib in enhancing radiosensitivity in non-small ...,https://europepmc.org/articles/pmc8557687/bin/peerj-09-12356-s004.7z
Dragon Seeds (USA) Sony PlayStation (PSX) ISO Download,https://www.romulation.net/PSX/Dragon-Seeds-U-SLUS-00734.7z
Stack Overflow Documentation Data Dump - Internet Archive,https://archive.org/details/documentation-dump.7z
Wrath of the Blood Ravens 2.4 - Warhammer 40000: Dawn of War II,https://gamefront.online/files/17451974/wrathofthebloodravens24.7z
CDN Download Failure (403 Error) - Nexus Mods,https://files.nexus-cdn.com/1704/12604/SkyUI_5_2_SE-12604-5-2SE.7z%3Fmd5%3DJPb-
MikroTik RouterOS Managing Webpage - Index of /backup,http://175.96.48.187/login-redirect/backup.7z
"(""TrackerCam",http://175.96.13.155/login1/8003/forum.7z
b2evo - Novell,http://203.187.87.128/login/Activex/upload.7z
Somewhat Skimpy DragonScale Armour v01 5411 0 1.7z - V Skyrim ...,"http://chomikuj.pl/maxns/Gry/V%2BSkyrim%2B(PL)/V%2BSkyrim%2BMody/Somewhat_Skimpy_DragonScale_Armour_v01-5411-0-1,1303150384.7z"
