THE OCCURRENCE OF ANOMALOUS WINDS AND THEIR ...,https://journals.ametsoc.org/view/journals/mwre/89/11/1520-0493_1961_089_0482_tooawa_2_0_co_2.xml
Anomalous Atmospheric Events Leading to the Summer 2010 ...,https://journals.ametsoc.org/view/journals/bams/92/3/2010bams3173_1.xml
Cervical myelopathy caused by invagination of anomalous lamina of ...,https://thejns.org/spine/view/journals/j-neurosurg-spine/19/6/article-p694.xml
BILLS-117hr6195ih.xml - Congress.gov,https://www.congress.gov/117/bills/hr6195/BILLS-117hr6195ih.xml
BILLS-117s2590is.xml - Govinfo.gov,https://www.govinfo.gov/bulkdata/BILLS/117/1/s/BILLS-117s2590is.xml
INTERMITTENT CUSHING'S SYNDROME WITH ANOMALOUS ...,https://joe.bioscientifica.com/view/journals/joe/36/1/joe_36_1_007.xml
Anomalous slow diffusion from perpetual homogenization,https://projecteuclid.org/journals/annals-of-probability/volume-31/issue-4/Anomalous-slow-diffusion-from-perpetual-homogenization/10.1214/aop/1068646372.xml
Anomalous Auditory Cortex Activations in Colored Hearing ... - Brill,https://brill.com/view/journals/sp/24/4/article-p391_4.xml%3Flanguage%3Den
Unusual echocardiographic image of a left circumflex coronary ...,https://eurheartj.oxfordjournals.org/content/37/9/792.source.xml
Highly efficient anomalous reflection by an optical metasurface - SPIE,http://spieeventseurope.org/x103098.xml
