"Butte County CA Archives History - Books .....Powellton, Inskip And ...",http://files.usgwarchives.net/ca/butte/history/1882/historyo/powellto179nms.txt
"Pershing County NV Archives History .....Hospitals, Sanatoriums And ...",http://files.usgwarchives.net/nv/pershing/history/other/hospital26gms.txt
"PROFESSIONAL CARDS DR. F. M. WEST, P PHYSICIAN and S ...",https://chroniclingamerica.loc.gov/lccn/sn86091313/1907-06-21/ed-1/seq-6/ocr.txt
"1 ''77Jen 7/fay Come and 7/Jen 7/Jay So, S3ui the World Soes on ...",https://chroniclingamerica.loc.gov/lccn/sn86091313/1907-10-25/ed-1/seq-5/ocr.txt
THE-HOTEL-CHILD.txt - Project Gutenberg Australia,https://gutenberg.net.au/fsf/THE-HOTEL-CHILD.txt
"Cute summer styles, generous hearts go together | News | mymcr.net",http://www.mymcr.net/articles/2012/06/25/news/doc4fe122497fa9e578212885.txt
The Project Gutenberg EBook of Collected Poems 1901-1918 in ...,https://www.gutenberg.org/files/12032/12032-8.txt
2013-03-27 15:26:18,https://www.tour-beijing.com/blog/wp-content/uploads/Thousands-of-love-locks-colourfully-festooned-with-flowing-red-ribbons..jpg.txt
Vreedzaam leven met cyborgs - James Lovelock over de toestand ...,http://enoch.finux.nl/www.nrc.nl/tmp/20200320T0656_Vreedzaam_leven_met_cyborgs___James_Lovelock_over_de_toestand_van_Gaia.txt
"Full text of ""Reports of the Department of the Interior for the Fiscal ...",https://archive.org/stream/reportsofdepartm19092unit/reportsofdepartm19092unit_djvu.txt
