[PDF] firms' environmental performance and the covid-19 crisis,https://www.elibrary.imf.org/downloadpdf/books/082/29273-9781513554228-en/ch005.xml
Marketing Strategies Used by US Landscape Services Firms in,https://journals.ashs.org/hortsci/view/journals/hortsci/56/6/article-p695.xml
Remaking the Global Economy: Economic-Geographical Perspectives,https://sk.sagepub.com/books/remaking-the-global-economy/n2.xml
SAGE Books - The Necessary Nature of Future Firms,https://sk.sagepub.com/books/the-necessary-nature-of-future-firms/n4.xml
Chapter 12: Researching firms and sanctions: theoretical and ...,https://www.elgaronline.com/view/edcoll/9781839102714/9781839102714.00019.xml
Entrepreneurship and the Growth of Firms - Elgaronline,https://www.elgaronline.com/view/1845425758.xml
Has globalization eroded firms' responsibility for their employees? A ...,https://www.degruyter.com/view/j/bap.2012.14.issue-3/bap-2012-0020/bap-2012-0020.xml
13 CFR Part 315 -- Trade Adjustment Assistance for Firms - eCFR,https://www.gpo.gov/fdsys/pkg/CFR-2018-title13-vol1/xml/CFR-2018-title13-vol1-part315.xml
Martindale-Hubbell Attorney Peer Ratings and Client Reviews,https://www.brmattorneys.com/storage/app/media/ratings.xml
Women- and Minority-Owned Businesses - Seattle.gov,http://cityofmusic.com/x5814.xml
