Implantation site intermediate trophoblasts in placenta cretas - Nature,https://www.nature.com/articles/3800210.pdf%3Forigin%3Dppub
What Is Trophoblast? A Combination of Criteria Define Human First ...,https://www.cell.com/stem-cell-reports/pdf/S2213-6711(16)00023-0.pdf
Trophoblast migration during human placental implantation,https://academic.oup.com/humupd/article-pdf/2/4/307/1939698/020307.pdf
Trophoblasts Protect the Inner Cell Mass from Macrophage ...,https://academic.oup.com/biolreprod/article-pdf/49/3/588/10537971/biolreprod0588.pdf
[PDF] In Vitro Model of Human Trophoblast in Early Placentation - MDPI,https://www.mdpi.com/2227-9059/10/4/904/pdf%3Fversion%3D1650005879
Immune-activating cells that interact with decidual leukocytes - PNAS,https://www.pnas.org/doi/pdf/10.1073/pnas.1507977112
Three types of HLA-G+ extravillous trophoblasts that have ... - PNAS,https://www.pnas.org/doi/pdf/10.1073/pnas.2000484117
Cell Signaling Pathways Involved During Invasion and ...,https://onlinelibrary.wiley.com/doi/pdf/10.1111/aji.12436
[PDF] Extravillous trophoblasts invade more than uterine arteries,https://d-nb.info/111976159X/34
