The Relaxation Response: A Strategy to Address Stress,https://journals.humankinetics.com/previewpdf/journals/ijatt/16/2/article-p20.xml
Stress Relaxation and Targeted Nutrition to Treat Patellar ...,https://journals.humankinetics.com/view/journals/ijsnem/29/4/article-p453.xml
Awareness of comfort immediately after a relaxation therapy session ...,https://journals.scholarsportal.info/pdf/17510759/v12inone/nfp_aociaasoteot.xml
Foliage Plants Cause Physiological and Psychological Relaxation ...,https://journals.ashs.org/hortsci/view/journals/hortsci/51/10/article-p1308.xml
THE RELAXATION TIME OF AIR IN THUNDERSTORMS in,https://journals.ametsoc.org/view/journals/mwre/95/12/1520-0493_1967_095_0843_trtoai_2_3_co_2.xml
Radiative Relaxation Time Scales Quantified from Sudden ...,https://journals.ametsoc.org/view/journals/atsc/78/1/jas-d-20-0015.1.xml
Glucagon induces airway smooth muscle relaxation by nitric oxide ...,https://joe.bioscientifica.com/view/journals/joe/225/3/205.xml
Glucagon induces airway smooth muscle ... - Journal of Endocrinology,https://joe.bioscientifica.com/downloadpdf/journals/joe/225/3/205.xml
SAGE Reference - Encyclopedia of Sport and Exercise Psychology,https://sk.sagepub.com/reference/encyclopedia-of-sport-and-exercise-psychology/i6820.xml
Relaxation to Equilibrium of Conservative Dynamics. I: Zero-Range ...,https://projecteuclid.org/journals/annals-of-probability/volume-27/issue-1/Relaxation-to-Equilibrium-of-Conservative-Dynamics-I--Zero-Range/10.1214/aop/1022677265.xml
