squeeze/CMakeLists.txt at master - GitHub,https://github.com/fabienbaron/squeeze/blob/master/CMakeLists.txt
Freshly Squeezed guitar tab by Scorpions @ XGuitar.com,https://www.xguitar.com/guitar-tabs/scorpions/eye_ii_eye/freshly_squeezed.txt
squeeze.txt,https://algs4.cs.princeton.edu/61event/squeeze.txt
Teleportation Fidelities of Squeezed States from Thermodynamical ...,http://spiral.ic.ac.uk/retrieve/2610/license.txt
third_party/WebKit/LayoutTests/svg/text/select-textLength-spacing ...,https://chromium.googlesource.com/chromium/src/%2B/adbcf1feb08731127872db3b215e9c7742335647/third_party/WebKit/LayoutTests/svg/text/select-textLength-spacing-squeeze-4-expected.txt
Up the Junction Squeeze Chords and Lyrics for Guitar - Chordie,https://www.chordie.com/chord.pere/chordiearchive.chordie.com/chord.pere/www.pjandphil.utvinternet.com/squeeze/JUNCTION.TXT
Squeeze Box The Who Chords and Lyrics for Guitar - Chordie,https://www.chordie.com/chord.pere/chordiearchive.chordie.com/chord.pere/www.pjandphil.utvinternet.com/who/SQUEEZE.TXT
The Squeeze - The Original Hip-Hop (Rap) Lyrics Archive,http://www.ohhla.com/anonymous/coup_the/sss_club/squeeze.cou.txt
Ranchers say they're being squeezed out | Wyoming News | trib.com,http://www.casperstartribune.net/articles/2008/01/25/news/wyoming/6d2a59a9a6c4e5a0872573db000438a0.txt
