Mary Houston: North America's Pre-Eminent Bohemian Waxwing ...,https://journals.scholarsportal.info/details/00065099/v74i0004/25_mhnapbwb.xml
Nonhuman Animal Behavioral Phenomena Are Central to the ... - Brill,https://brill.com/downloadpdf/journals/soan/27/5-6/article-p628_9.xml
Reactions of Four Passerine Species To Threats of Predation and ...,https://brill.com/view/journals/beh/123/1-2/article-p84_6.xml%3Flanguage%3Den
First Avenue & 7Th Street Entry: An Inventory of Its Band Files,http://www2.mnhs.org/library/findaids/00233.xml
Today's News | KYStandard.com - The Kentucky Standard,https://www.kystandard.com/news/todaysnews/rss.xml%3Fpage%3D1655%26mini%3Dcalendar-date%252F2012-06
OW8i4VQl.xml - Birdwatching-Bliss.com,http://www.birdwatching-bliss.com/OW8i4VQl.xml
Bombycilla garrulus (Bohemian Waxwing) en época de invernación ...,http://www.conabio.gob.mx/informacion/metadata/gis/bomgar_invgw.xml%3F_httpcache%3Dyes%26_xsl%3D/db/metadata/xsl/fgdc_html.xsl%26_indent%3Dno
"Pollination, Crop Productivity, and Arthropod and Bird Communities ...",https://journals.ashs.org/horttech/view/journals/horttech/31/1/article-p144.xml
"[PDF] Pollination, Crop Productivity, and Arthropod and Bird Communities ...",https://journals.ashs.org/horttech/downloadpdf/journals/horttech/31/1/article-p144.xml
