"NNT mutations: a cause of primary adrenal insufficiency, oxidative ...",https://eje.bioscientifica.com/view/journals/eje/175/1/73.xml
Diagnosis of secondary adrenal insufficiency in patients with ...,https://eje.bioscientifica.com/view/journals/eje/160/1/9.xml
is there a role for natriuretic peptide testing in the 'cardio-renal ...,http://eurheartj.oxfordjournals.org/content/28/24/2960.ref-links.xml
Nutrient Insufficiencies/Deficiencies in Children With Sickle Cell ...,https://journals.scholarsportal.info/details/15455009/v63i0006/1060_niicwsiawids.xml
Pituitary insufficiency as a side effect after ... - Journal of Neurosurgery,https://thejns.org/view/journals/j-neurosurg/113/Special_Supplement/article-p153.xml
the role of the hypothalamus,https://thejns.org/downloadpdf/journals/j-neurosurg/113/Special_Supplement/article-p153.xml
State and Market in Higher Education Reforms - Brill,https://brill.com/view/book/9789460918001/BP000004.xml
Genealogy and Insufficiencies of a Conceptual Dichotomy in ... - Brill,https://brill.com/view/book/edcoll/9789460918001/BP000004.xml%3Flanguage%3Dzh%26result%3D4%26rskey%3DWiZJXx
"Enacted by Chapter 63 , 1996 General Session 1996 Distribution of ...",https://le.utah.gov/xcode/Title7/Chapter18A/C7-18a-S502_1800010118000101.xml
