Postanal Repair for Faecal Incontinence - SAGE Journals,https://journals.sagepub.com/doi/pdf/10.1177/014107688407700406
Postanal repair restores anatomy rather than function - Springer,https://link.springer.com/content/pdf/10.1007/BF02552273.pdf
Postanal repair - Springer,https://link.springer.com/content/pdf/10.1007%252FBF01649512.pdf
Effect of postanal repair on progress of neurogenic damage to the ...,https://bjssjournals.onlinelibrary.wiley.com/doi/pdfdirect/10.1002/bjs.1800770515
Longâ•'term outcome of postanal repair in the treatment of faecal ...,https://onlinelibrary.wiley.com/doi/pdf/10.1111/j.1445-2197.2005.03520.x
[PDF] Surgical Management of Deep Postanal Abscess and Horseshoe ...,http://www.clinicsinsurgery.com/open-access/surgical-management-of-deep-postanal-abscess-and-horseshoe-fistula-of-cryptoglandular-origin-a-review-3005.pdf
Postanal repair for faecal incontinence persisting after rectopexy,https://academic.oup.com/bjs/article-pdf/81/2/305/36805123/bjs1800810254.pdf
Postanal repair for neuropathic faecal incontinence,https://academic.oup.com/bjs/article-pdf/70/2/101/36932048/bjs1800700216.pdf
Successful Treatment of Horseshoe Fistula Requires Deroofing of ...,https://www.sciencedirect.com/science/article/pii/000296109490247X/pdf%3Fmd5%3Deae5915bc556ab9d647f368dd2ca3d47%26pid%3D1-s2.0-000296109490247X-main.pdf
