News Article: Global food import bill on the rise despite stable markets,https://www.irishsun.com/news/253508035/oct04v56.flv
U.S. Slams European Plan To Help Iran Sidestep U.S. Sanctions,https://www.malaysiasun.com/news/258044043/oct04v56.flv
"In South Sudan, some children work in mines to survive | News24",https://www.malaysiasun.com/news/257983154/oct04v56.flv
Iran Prosecutor General Alarms Those Behind Price Hikes,https://www.kansascitypost.com/news/257771091/oct04v56.flv
"Trump, U.S. Allies Exchange Barbs Amid Growing Fears Of Trade War",https://www.southamericatimes.com/news/257397491/oct04v56.flv
At Least 74 People Killed In Forest Fires Near Athens,https://www.europesun.com/news/257726845/oct04v40.flv
Mexico invites tenders for major Veracruz port expansion plan,https://www.northkoreatimes.com/news/228900215/oct04v40.flv
Batu Caves may land in legal soup over revamped staircase,https://www.kualalumpurtimes.com/news/257920779/oct04v40.flv
Celebrities attend Amit Thackeray's big day! - Big News Network.com,https://www.shanghaisun.com/news/259247918/feb24v21.flv
Five of top 7 Australian billionaires are Jewish,https://www.chinanationalnews.com/news/257346112/oct04v56.flv
Experts believe organic social media marketing will die at the hands ...,https://www.michigansun.com/news/250578715/oct04v40.flv
Trump could open new front on trade war by taking on Europe,https://www.chilesun.com/news/259631858/feb24v21.flv
