"[PDF] Parsi Theater, Urdu Drama, and the Communalization of Knowledge",https://minio.la.utexas.edu/colaweb-prod/profile/custom_pages/0/119/parsi_theater_urdu_drama_and_the_communa_51b7a927-cb02-4217-9c55-0726dcb7b8bf.flv
"publiTV.com :: Los mejores anuncios de television, Spots TV, Advert ...",http://www.vejatv.com/videos/14/149540387341.flv
[PDF] KISS ÁDÁM1) és SZABÓ MÁRIA2),http://kmkt15.ttk.pte.hu/wp-content/uploads/2015/05/KMKTK_Absztrakt_kotet.pdf.flv
Najczęstsze błędy przy odchudzaniu (video) Fitness Odchudzanie ...,"https://chomikuj.pl/agatka-1/Fitness/Aerobik%2Bi%2BCwiczenia/ODCHUDZANIE/Najcz*c4*99stsze%2Bb*c5*82*c4*99dy%2Bprzy%2Bodchudzaniu%2B(video)%2BFitness%2B-%2BOdchudzanie%2B-%2BArtyku*c5*82%2B-%2BOdchudzanie%2B-%2BFitness%2B-%2BPolki%2B-%2BKobieta%2B-%2BSprawdzone%2Bsposoby%2Bna%2Bodchudzanie%2Bpoprzez%2B*c4*87wiczenia*2c%2Bup,1907500699.flv"
Makijaż w stylu Penelope Cruz Uroda Video Artykuł Video Uroda ...,"http://chomikuj.pl/magda10041/uroda%2B)/Makija*c5*bc%2Bw%2Bstylu%2BPenelope%2BCruz%2BUroda%2B-%2BVideo%2B-%2BArtyku*c5*82%2B-%2BVideo%2B-%2BUroda%2B-%2BPolki%2B-%2BKobieta%2B-%2BFilmy%2Binstrukta*c5*bcowe%2Bna%2Btemat%2Bmakija*c5*bcu*2c%2Bw*c5*82os*c3*b3w*2c%2Bpiel*c4*99gnacji%2Btwarzy%2Bi%2Bcia*c5*82a,292335133.flv"
Знаменитый завод марочных вин и коньяка «Коктебель - Напитки,http://12vodoemov.ru/images/stories/videos/BioSmart.flv
