Right Censoring and Martingale Methods for Failure Time Data,https://projecteuclid.org/journals/annals-of-statistics/volume-17/issue-3/Right-Censoring-and-Martingale-Methods-for-Failure-Time-Data/10.1214/aos/1176347260.xml
Coarsening at Random in General Sample Spaces and Random ...,https://projecteuclid.org/journals/annals-of-statistics/volume-23/issue-3/Coarsening-at-Random-in-General-Sample-Spaces-and-Random-Censoring/10.1214/aos/1176324622.xml
Chapter 17 Censoring/“Improving” Gersonides: The Case of ... - Brill,https://brill.com/abstract/book/edcoll/9789004425286/BP000020.xml
Censoring the Press - Brill,https://brill.com/downloadpdf/book/9789004394889/BP000005.xml
The SAGE Encyclopedia of Social Science Research Methods,https://methods.sagepub.com/reference/the-sage-encyclopedia-of-social-science-research-methods/n105.xml
"Quantifying Withdrawal of Consent, Loss to Follow-Up, Early Drug ...",https://jnccn.org/view/journals/jnccn/19/12/article-p1433.xml
"Quantifying Withdrawal of Consent, Loss to Follow-Up ... - JNCCN",https://jnccn.org/downloadpdf/journals/jnccn/19/12/article-p1433.xml
IPCW Estimator for Kendall's Tau under Bivariate Censoring in,https://www.degruyter.com/view/journals/ijb/5/1/article-ijb.2009.5.1.1121.xml.xml%3Flanguage%3Den
A Bayesian Processor of Uncertainty for Precipitation Forecasting ...,https://journals.ametsoc.org/view/journals/mwre/147/12/mwr-d-19-0066.1.xml
