Cuing Deception through Performance in 1940s Hollywood Cinema in,https://www.berghahnjournals.com/view/journals/projections/9/2/proj090202.xml
Cuing Deception through Performance in 1940s Hollywood Cinema in,https://www.berghahnjournals.com/abstract/journals/projections/9/2/proj090202.xml
Verbal Cuing and Motor Skill Acquisition for Adults with Down ...,https://journals.humankinetics.com/view/journals/apaq/8/3/article-p210.xml
Cross-sensory cuing drives cross-frequency neural coupling ... - Brill,https://brill.com/view/journals/sp/25/0/article-p62_58.xml
Griffith's Valuation - AskAboutIreland.ie,https://www.askaboutireland.ie/griffith-valuation/index.xml%3Faction%3DdoPlaceSearch%26Submit.x%3D31%26Submit.y%3D10%26Submit%26freetext%3DCuing%2520More
"SAGE Reference - Encyclopedia of Children, Adolescents, and the ...",https://sk.sagepub.com/reference/childmedia/n110.xml
biorxiv BIORXIV bioRxiv bioRxiv Cold Spring Harbor Laboratory ...,https://www.biorxiv.org/content/biorxiv/early/2022/04/07/2022.04.04.487064.source.xml
Ona Point oF \7iC!CD - NCTM,https://pubs.nctm.org/downloadpdf/journals/at/33/6/article-p4.xml
LS00512268_00001.mets.xml - UFDC Image Array 2,https://ufdcimages.uflib.ufl.edu/LS/00/51/22/68/00001/LS00512268_00001.mets.xml
Part-list cuing and the dynamics of false recall - Scholars Portal ...,https://journals.scholarsportal.info/details/10699384/v15i0002/296_pcatdofr.xml
biorxiv BIORXIV bioRxiv bioRxiv Cold Spring Harbor Laboratory ...,https://www.biorxiv.org/content/biorxiv/early/2022/01/27/2022.01.25.477681.source.xml
