McCarthy mocks Spicer with motorized podium on streets of ...,https://www.toledoblade.com/A-E/TV-Radio/2017/05/12/Melissa-McCarthy-mocks-Sean-Spicer-with-motorized-podium-in-NYC/stories/feed/index.rss
Motorized scooter driver injured in collison | The Blade,https://www.toledoblade.com/local/police-fire/2013/08/25/Motorized-scooter-driver-injured-in-collison/stories/feed/index.rss
Archive: Law and Ordeals - Audioboom,https://audioboom.com/channels/4903977.rss
THE PINBALL RESTORER'S PODCAST - Buzzsprout,https://feeds.buzzsprout.com/1725656.rss
Change of command of the Czech contingent operating within ... - MZV,https://www.mzv.cz/riga/en/foreign_policy/change_of_command_of_the_czech.rss
Homemade Electric Power Tools - NAVIN KHAMBHALA,https://navinkhambhala.com/mr-nk/f.rss
Outdoors - Deseret News,https://www.deseretnews.com/sports/outdoors/index.rss
Travel Is Your Business - Omny Studio,https://www.omnycontent.com/d/playlist/8350e07c-a3cf-4396-a990-a9e5015c0cf0/b18b78e4-b8cf-447e-a36c-aa2b01101abc/a92dc14a-1d05-49a5-befa-aa2b01101abc/podcast.rss
The MeatEater Podcast - Omny.fm,https://omny.fm/shows/the-meateater-podcast-1/playlists/podcast.rss
