Comparative pharmacology of oestrogens and catechol oestrogens,https://joe.bioscientifica.com/downloadpdf/journals/joe/94/1/joe_94_1_012.xml
Treatment with an inhibitor of catechol-O-methyltransferase activity ...,https://rep.bioscientifica.com/view/journals/rep/134/6/1340831.xml
Methionine sulfoxide reductase regulates brain catechol- O,https://ijnp.oxfordjournals.org/content/17/10/1707.source.xml
Increased catechol-O-methyltransferase activity and protein ...,https://journals.scholarsportal.info/details/01970186/v51i6-7/412_icaapetsnalm.xml
"Design, spectroscopic properties and effects of novel catechol ...",https://journals.scholarsportal.info/details/0022328x/v960icomplete/nfp_dspaeoaaadba.xml
Rooting Softwood Cuttings of Acer griseum: Promotion by Stockplant ...,https://journals.ashs.org/hortsci/view/journals/hortsci/25/2/article-p200.xml
Abstract - bioRxiv,https://www.biorxiv.org/content/biorxiv/early/2022/01/24/2022.01.20.477155.source.xml
"Effects of nitrate, fulvate, phosphate, phthalate, salicylate and ...",https://akjournals.com/view/journals/10967/287/1/article-p13.xml
Untitled,https://downloads.hindawi.com/journals/bca/2016/5360361.xml
1039828.xml - Biblioteka Nauki,https://bibliotekanauki.pl/articles/1039828.xml
