[PDF] Defense Technical Information Center Compilation Part Notice,https://apps.dtic.mil/sti/pdfs/ADP010386.pdf
A Phonetically Based Account of Phonological Stop ... - JSTOR,https://www.jstor.org/stable/4420189
Discrimination of Consonantal Attributes by CEERI Vocoder,https://www.tandfonline.com/doi/pdf/10.1080/03772063.1974.11487365
A phonetically based account of phonological stop assibilation,https://www.cambridge.org/core/services/aop-cambridge-core/content/view/8B842F0AB4C27000AFE26A548519E531/S095267570100402Xa.pdf/a-phonetically-based-account-of-phonological-stop-assibilation-.pdf
The present state of digital vocoding technique - IEEE Xplore,https://ieeexplore.ieee.org/iel6/8337/26064/01161973.pdf
[PDF] 'Uilmjui IONOFTHTS O'XW.'BfrtSUNnsnTEIj' - OSTI.GOV,https://www.osti.gov/servlets/purl/7296763
A comparison of the intelligibility of some low cost speech synthesis ...,https://onlinelibrary.wiley.com/doi/pdf/10.3109/13682828609012274
[PDF] Estimation of Speech Intelligibility Using Perceptual ... - IntechOpen,https://cdn.intechopen.com/pdfs/15024/InTech-Estimation_of_speech_intelligibility_using_perceptual_speech_quality_scores.pdf
Petrologic Evaluation of Significance of Natural ... - GeoScienceWorld,https://pubs.geoscienceworld.org/aapgbull/article-pdf/63/9/1590/4451589/aapg_1979_0063_0009_1590.pdf
Intelligibility of read Japanese words with competing noise in virtual ...,https://www.jstage.jst.go.jp/article/ast/29/1/29_1_74/_pdf/-char/en
