sitemap.xml - The Reverend's Big Blog of Leather - WordPress.com,https://leatherworkingreverend.wordpress.com/sitemap.xml
"Nautical Archaeology Surveys Near Jeddah, 2012–2013, and Their ...",https://brill.com/downloadpdf/book/edcoll/9789004362321/BP000026.xml
REGIONAL AND LOCAL MARKETS - Brill,https://brill.com/downloadpdf/book/edcoll/9789047411864/Bej.9789004156333.i-648_011.xml
"Britain, or A chorographicall description of the most flourishing ...",https://ota.bodleian.ox.ac.uk/repository/xmlui/bitstream/handle/20.500.12024/A17832/A17832.xml%3Fsequence%3D7%26isAllowed%3Dy
"Honor military, and ciuill contained in foure bookes. Viz. 1. Iustice ...",https://ota.bodleian.ox.ac.uk/repository/xmlui/bitstream/handle/20.500.12024/A11863/A11863.xml%3Fsequence%3D7%26isAllowed%3Dy
rss.xml,https://www.kolping-ox.de/rss/rss.xml
http://ines.kiev.ua/ 2022-05-15T01:05:44+09:00 weekly 0.9 http ...,http://ines.kiev.ua/sitemap43527.xml
