French replica of frigate sets sail for Boston | The Blade,https://www.toledoblade.com/Culture/2015/04/18/French-replica-of-revolutionary-frigate-sets-sail-for-Boston/stories/feed/index.rss
Dayton man replicates cruisers of Gotham | The Blade,https://www.toledoblade.com/business/2009/11/12/Dayton-man-replicates-cruisers-of-Gotham/stories/feed/index.rss
The Tiny Typecast - Glenn Fleishman,https://tinytypemuseum.com/tinytypecast.rss
Case And Point With Justin Case - Audioboom,http://audioboom.com/channels/4780061.rss
Conservator František Makeš's lecture in the Czech Centre,https://www.mzv.cz/stockholm/en/culture_and_education/archives/restorer_frantisek_makes_s_lecturein_the.rss%3Fforce_format%3Dmobile
Velvet Revolution Anniversary Celebrated by Clinking Keys - MZV,https://www.mzv.cz/abuja/en/news_events/velvet_revolution_anniversary_celebrated.rss
Firewhisky and Honey's Podcast - Buzzsprout,https://feeds.buzzsprout.com/537775.rss
Untitled,https://prism.librarymanagementcloud.co.uk/eastlothian/items.rss%3Fquery%3Dauthor%253A%2528Gray%252C%2BTanis%2529
America's 10 Best In-N-Out Burger Outposts - The Daily Meal,https://www.thisisinsider.com/the-10-best-in-n-out-locations-in-the-country-2017-3/food.rss
