5 Practices for Orchestrating Productive Mathematics Discussions,https://staging-pubs.nctm.org/view/book/9780873538015/9780873538015.xml
Harmonizing across Stakeholders to Accelerate Global Health Gains ...,https://www.ajtmh.org/view/journals/tpmd/106/5_Suppl/article-p67.xml
Harmonizing across Stakeholders to Accelerate Global Health Gains ...,https://www.ajtmh.org/view/journals/tpmd/aop/article-10.4269-ajtmh.21-1101/article-10.4269-ajtmh.21-1101.xml
Begin with the Brain - SAGE Books - Begin with the Brain ...,https://sk.sagepub.com/books/begin-with-the-brain-2e/n3.xml
Begin with the Brain: Orchestrating the Learner-Centered Classroom,https://sk.sagepub.com/books/begin-with-the-brain-2e/n9.xml
Chapter 5: Orchestrating affect at the entrepreneurial university in,https://www.elgaronline.com/view/edcoll/9781788975032/9781788975032.00012.xml
Chapter 5: Orchestrating affect at the entrepreneurial university in,https://www.elgaronline.com/abstract/edcoll/9781788975032/9781788975032.00012.xml
Symphony or Cacophony? Orchestrating Federal Mechanics toward ...,https://brill.com/view/journals/ejhl/29/1/article-p79_5.xml
Orchestrating multilateralism - Berghahn Journals,https://www.berghahnjournals.com/downloadpdf/journals/regions-and-cohesion/5/3/reco050306.xml
