Function of the mammalian postorbital bar - Wiley Online Library,https://onlinelibrary.wiley.com/doi/pdf/10.1002/jmor.10334
[PDF] The Mechanical Function of the Postorbital Bar in Eulemur fulvus ...,https://scholarsarchive.library.albany.edu/cgi/viewcontent.cgi%3Farticle%3D1022%26context%3Dhonorscollege_anthro
"Morphology, Function, and Evolution of the Anthropoid Postorbital ...",https://link.springer.com/content/pdf/10.1007/978-1-4684-3764-5_12.pdf
"[PDF] At Birth, Tarsiers Lack a Postorbital Bar or Septum - Brooklyn College",http://www.brooklyn.cuny.edu/web/aca_naturalsciences_anthropology/BIO-RosenbergerAlfred-PUB_2013_AR.pdf
[PDF] Oculomotor Stability and the Functions of the Postorbital Bar and ...,http://citeseerx.ist.psu.edu/viewdoc/download%3Fdoi%3D10.1.1.469.1229%26rep%3Drep1%26type%3Dpdf
The Postorbital Bone of Podocnemis (Chelonia) - jstor,https://www.jstor.org/stable/3890464
The postorbital approach to the middle cerebral artery in cats.,https://www.ahajournals.org/doi/pdf/10.1161/01.STR.19.4.503
Orbit orientation and the function of the mammalian postorbital bar,https://www.cambridge.org/core/services/aop-cambridge-core/content/view/054D58A266B81A27D41B8307936AADC9/S0952836900003137a.pdf/orbit-orientation-and-the-function-of-the-mammalian-postorbital-bar.pdf
"[PDF] 14. Rooneyia, Postorbital Closure, and the Beginnings of the Age of ...",http://www.brooklyn.edu/web/aca_naturalsciences_anthropology/BIO-RosenbergerAlfred-PUB_2008_S.pdf
"Masticatory stress, orbital orientation and the evolution of the ...",https://www.sciencedirect.com/science/article/pii/S0047248499903809/pdf%3Fmd5%3D523742e6f008ffe185fc69a034ce05e0%26pid%3D1-s2.0-S0047248499903809-main.pdf
[PDF] Mastication and the Postorbital Ligament: Dynamic Strain in Soft ...,https://www.sonometrics.com/all-papers/2011%2520Herring%2520Integr%2520Comp%2520Biol%2520Mastication%2520and%2520the%2520postorbital%2520ligament%2520dynamic%2520strain.pdf
[PDF] Laboratory 1 Worksheet: The Skull Objective,http://www.d.umn.edu/~rmoen/Mammalogy_4764_2009/Handouts/Lab_01_Skull.pdf
the role of the postorbital - Brill,https://brill.com/previewpdf/journals/njz/50/1/article-p75_7.xml
Sexual dimorphism of cranial measurements in the red fox Vulpes ...,https://bioone.org/journals/folia-zoologica/volume-59/issue-4/fozo.v59.i4.a3.2010/Sexual-dimorphism-of-cranial-measurements-in-the-red-fox-Vulpes/10.25225/fozo.v59.i4.a3.2010.pdf
[PDF] Appendix C: Mammal Skull ID Key and Activity PDF,https://assets.ctfassets.net/e09p19lzfrfe/3fuBzBNBTZojiSraSPJ315/403c2150fc8712103a3e069e10f9763e/Appendix-C-Mammal-Skull-ID-Key-and-Activity.pdf
[PDF] Comparative cranial biomechanics in two lizard species,https://hal.archives-ouvertes.fr/hal-03365333/document
"A New Genus of Late Oligocene Monkey (Cebidae, Platyrrhini) with ...",https://www.karger.com/Article/Pdf/155594
[PDF] tree shrews (5 genera) Genus to know,http://www.life.illinois.edu/ib/462/Need%2520to%2520Know%2520Primates.pdf
"Preliminary description of the cranium of Proteopithecus sylviae, an ...",https://www.pnas.org/doi/pdf/10.1073/pnas.94.26.14970
