"[PDF] aecial stages of the leaf kusts of rye, puccinia dispersa erikss. and ...",https://naldc.nal.usda.gov/download/IND43966824/PDF
Aecial Stage of Puccinia oxalidis - JSTOR,https://www.jstor.org/stable/pdf/2468893.pdf
An Ultrastructural Comparison of the Aecial and Telial Haustoria of ...,https://www.jstor.org/stable/3759769
Comparative ultrastructure of aecial and telial infections of ... - Springer,https://link.springer.com/content/pdf/10.1007/BF00436722.pdf
Delimitation of aecial from uredinial states - ScienceDirect.com,https://www.sciencedirect.com/science/article/pii/S0007153672801682/pdf%3Fmd5%3D4040177f04145f3f95bbd6d77ec45554%26pid%3D1-s2.0-S0007153672801682-main.pdf
Spermogonial and aecial stages of Kernkampella kirganelliae,https://www.sciencedirect.com/science/article/pii/S0007153685802369/pdf%3Fmd5%3De4e19902f9800436569ed0f65eb4d2c0%26pid%3D1-s2.0-S0007153685802369-main.pdf
Ultrastructure of the pycnial and aecial stages of Puccinia recondita,https://cdnsciencepub.com/doi/pdf/10.1139/b79-015%3Fdownload%3Dtrue
Aecial Stage of Puccinia oxalidis,https://www.journals.uchicago.edu/doi/pdf/10.1086/332261
[PDF] The Aecial Stage of Alsike Clover Rust - UNI ScholarWorks,https://scholarworks.uni.edu/cgi/viewcontent.cgi%3Farticle%3D6508%26context%3Dpias
The Aecial Stage of Coleosporium Ribicola,https://www.tandfonline.com/doi/pdf/10.1080/00275514.1916.12018895
Ultrastructural studies of the spermatial and aecial stages of ...,https://www.tandfonline.com/doi/pdf/10.1080/0028825X.1985.10425312
<i>Berberis</i> as the Aecial Host of <i>Puccinia brachypodii</i> in ...,https://onlinelibrary.wiley.com/doi/pdf/10.1111/j.1439-0434.1965.tb02165.x
[PDF] Factors Affecting the Development of the Aecial Stage of Puccinia ...,https://ageconsearch.umn.edu/record/163382/files/tb314.pdf
[PDF] Parasite Interaction with Sporulation by Cronartium quercuum f. sp ...,https://www.apsnet.org/publications/phytopathology/backissues/Documents/1981Articles/Phyto71n03_348.PDF
[PDF] Sporulation by Cronartium quercuum f. sp. fusiforme on Loblolly and ...,http://www.apsnet.org/publications/phytopathology/backissues/Documents/1981Articles/Phyto71n03_345.PDF
[PDF] Coleosporium Rusts Angelica Werth - Clemson University,https://www.clemson.edu/cafls/demo/files/awerth-coleosporium-paper.pdf
Rodents as a Factor in Reducing Aecial Sporulation of Cronartium ...,https://academic.oup.com/jof/article-pdf/33/12/994/23111229/jof0994.pdf
Mayor Arthur POArAIIER A aecial Meeting of the New Milford Town ...,http://www.newmilford.org/filestorage/7526/7528/7807/8059/17679/10_19_1998_Minutes_-_SM.pdf
[PDF] Multiple genotypes within aecial clusters in Puccinia graminis and ...,https://d-nb.info/1131962168/34
Distinctiveness of aecia and aeciospores in rust fungi on conifers,https://austriaca.at/0xc1aa5576%25200x0038b973.pdf
