Boilermaker Union News and Updates | Page 69 | International ...,https://boilermakers.org/news/video.flv%3Fpage%3D68
"March 7, 2022, The Community Advisory Council on Homelessness",https://www.dhs.state.il.us/page.aspx/FACT_1WhatIsVR.flv%3Fitem%3D141826%26newssidebar%3D138572
Videos - Max Spann Real Estate & Auction Company,https://www.maxspann.com/company/videos/category/in-the-news/nbc-news-grab-a-shore-home-for-a-steal-nbc-philadelphia.flv
Residential Environmental Health Issues & Risk Reduction Strategies,https://omls.oregon.gov/pipermail/health_education_promotion/attachments/20110318/8dfa73b5/attachment.flv
"Trump Upends Norms of Presidential Behavior, Historians Say",https://www.munichmetro.com/news/257693171/oct04v40.flv
(PDF) How an Engine Works - ResearchGate,https://www.researchgate.net/profile/Rahul_Kumar340/publication/319479515_How_an_Engine_Works/links/Video/How%252520an%252520engine%252520works%252520-%252520comprehensive%252520tutorial%252520animation%252520featuring%252520Toyota%252520engine%252520t_low.flv
Video news - Tashkent Pediatric Medical Institute,http://old.tashpmi.uz/en/all_news/video_news/%268_mart_TPMI.flv
Majlis Podcast: China's Security Interests In Central Asia,https://www.birminghamstar.com/news/259685683/feb24v21.flv
Can Moscow stop Kim Jong-un? - Russia Beyond,https://www.irishsun.com/news/247518957/oct04v56.flv
U.S. Security Adviser: Washington Not Pushing Iran 'Regime Change',https://www.irishsun.com/news/257260987/oct04v56.flv
France's Macron Encounters Obstacle Course at Home,https://www.sierraleonetimes.com/news/257940413/oct04v40.flv
"DA is not losing support, Maimane says in response to recent poll",https://www.johannesburglife.com/news/258575204/feb24v21.flv
qghappy庄周教学:Scientific Institutqghappy庄周教学ion,http://yaxinglegou.com/uploads/media/210916/5-210916094G9.flv
"US, South Korea Seem to Scale Back War Games",https://www.northkoreatimes.com/news/254426694/oct04v56.flv
U.S. Slams European Plan To Help Iran Sidestep U.S. Sanctions,https://www.malaysiasun.com/news/258044043/oct04v56.flv
Rebalancing binocular vision in amblyopia - Wiley Online Library,http://lists.nottingham.ac.uk/pipermail/psychology-visionlist/attachments/20140513/4336aaa9/attachment-0001.flv
SA on high alert for typhoid - News24,https://www.nigeriasun.com/news/251112011/oct04v56.flv
Montana Lawmakers Denounce Plans for Neo-Nazi Rally,https://www.oaklandtimes.com/news/250493249/oct04v56.flv
Russia's military and NATO held first telephone talks in three years,https://www.stpetersburgstar.com/news/252223357/feb24v21.flv
"70+ ""(waed)-murano-meets-toka-feat. - nachtleben.flv - LinkedIn",https://www.linkedin.com/pub/dir/%2B/%2528waed%2529-murano-meets-toka-feat.-dumbstruke---nachtleben.flv
Trump Blames Democrats for Family Separations — Again,https://www.austinglobe.com/news/257494417/oct04v40.flv
Recent program activities - > The Israel Center for Social ...,http://www.icsep.org.il/Icsepvideoclip.flv
EU Lays Out Accession Path For Balkan Countries - Radio Free ...,https://www.dublinnews.com/news/256383024/oct04v40.flv
Cameroon Prepares for Sunday Election Amid Security Challenges,https://www.madagascarsun.com/news/258088770/oct04v40.flv
"Automakers Warn US Tariffs Will Cost Jobs, Hike Prices",https://www.germanysun.com/news/257573831/oct04v56.flv
Bangalore-based team powers singaporean company in winning ...,https://www.asiapacificstar.com/news/248535501/oct04v56.flv
"Online interactive courses on AI in trading, first time on internet",https://www.cardiffstar.com/news/257757957/oct04v56.flv
Logan Bryan Amador | Dumbledore's Army Role-Play Wiki | Fandom,http://dumbledoresarmyroleplay.wikia.com/wiki/File:Lee_Mead_-_Dancing_through_Life_-_Wicked_London_-_YouTube.flv
"If Brunei Takes China's Energy Deal, Neighbors May Follow",https://www.vietnamtribune.com/news/258526756/feb24v21.flv
[PDF] Research & Innovation Management Geoinformation Technology,http://list.serv.uni-osnabrueck.de/pipermail/gfgi/attachments/20170203/c1409cea/attachment-0001.flv
"Commercial Refrigeration Perth | Commercial Heating, Cooling and ...",http://nrs.net.au/coles.flv
Aktualności | KSAP - Krajowa Szkoła Administracji Publicznej,https://sww.ksap.gov.pl/ksap/aktualnosci/2010-05-17-1.flv%3Ffield_news_category_value%3DAll%26page%3D48
Gamer.no,http://www.nordicreviews.net/7/7269/v_22977.flv
Wagga Wagga's message for the Morrison Muppet Show,https://www.australianherald.com/news/257959380/oct04v56.flv
"Clip Fuck Em Giang standard shape, lewd horse riding.FLV",http://16honeys.com/download/20869635/clip-chich-em-giang-dang-chuan-cuoi-ngua-dam-ang.flv
Sara (Sadhna) and Angad (Alekh) get together for photoshoot.flv,https://tourismadjara.ge/vi/364b2ea/enlighten-india-magazine-:-sara-(sadhna)-and-angad-(alekh)-get-together-for-photoshoot.flv
Cordillera's 2018 Outstanding Students conferred - Belgium Sun,https://www.stlouisstar.com/news/257739890/oct04v56.flv
Aktualności | KSAP - Krajowa Szkoła Administracji Publicznej,https://m.ksap.home.pl/ksap/aktualnosci/20110330_1.flv%3Ffield_news_category_value%3DAll%26page%3D5
IPTV: мировые тенденции развития и перспективы в России,http://broadcasting.ru/articles2/econandmen/iptv-mirovie-tendencii/video.flv/video.flv
[PDF] KISS ÁDÁM1) és SZABÓ MÁRIA2),http://kmkt15.ttk.pte.hu/wp-content/uploads/2015/05/KMKTK_Absztrakt_kotet.pdf.flv
[PPT] Zotero - PersianGig,http://cld.persiangig.com/dl/QBbSm/D5mLVcrsd9/zotero_1_5_cast.flv
dr. roller video.flv - Xuite 影音 - 隨意窩,https://vlog.xuite.net/play/d2tORDNzLTIyMDk4NzcuZmx2/dr.-roller-video.flv
[微整型][肉毒桿菌]治療：手汗症.flv - 隨意窩,https://vlog.xuite.net/play/b29yVG9lLTIyMTE4MDQuZmx2/-%25E5%25BE%25AE%25E6%2595%25B4%25E5%259E%258B-%25E8%2582%2589%25E6%25AF%2592%25E6%25A1%25BF%25E8%258F%258C-%25E6%25B2%25BB%25E7%2599%2582%25EF%25BC%259A%25E6%2589%258B%25E6%25B1%2597%25E7%2597%2587.flv
The.Rise.and.Rise.of.Bitcoin.2014.PL.SUBBED.FLV.flv - Chomikuj,"http://chomikuj.pl/boleczek32kalisz/filmy/The.Rise.and.Rise.of.Bitcoin.2014.PL.SUBBED.FLV,4458011527.flv"
