1. Introduction - Hindawi.com,https://downloads.hindawi.com/journals/jeph/2016/8096082.xml
THE POLITICAL IMPACT OF STRIKES AND DISORDER - De Gruyter,https://www.degruyter.com/california/downloadpdf/book/9780520331754/10.1525/9780520331754-012.xml
Bangladesh: Fifth and Sixth Reviews Under the Extended Credit ...,https://www.elibrary.imf.org/view/journals/002/2015/304/article-A001-en.xml
"Voices on the Ground: Kutiyattam, UNESCO, and the Heritage of ...",https://journals.scholarsportal.info/details/15430413/v52i0002/157_votgkuathoh.xml
Forms of resistance - Brill,https://brill.com/downloadpdf/book/9789047442844/Bej.9789004166837.i-472_010.xml
Chapter 7 - Brill,https://brill.com/downloadpdf/book/edcoll/9789047407119/B9789047407119_s010.xml
Reporting the Raj: The British Press and India c. 1880–1922,https://www.manchesterhive.com/downloadpdf/9781526119766/9781526119766.00020.xml
"Politics, Ideology and Nationalism: Jinnah, Savarkar ... - SAGE Books",https://sk.sagepub.com/books/politics-ideology-and-nationalism/i156.xml
"Radicalization in South Asia: Context, Trajectories and Implications",https://sk.sagepub.com/books/radicalization-in-south-asia/i584.xml
