the SoCial eCology of St. Barthélemy 3.1 Schooners When I ... - Brill,https://brill.com/previewpdf/book/9789004188242/B9789004188242_004.xml%3FpdfJsInlineViewToken%3D386827536%26inlineView%3Dtrue
the SoCial eCology of St. Barthélemy 3.1 Schooners When I ... - Brill,https://brill.com/downloadpdf/book/9789004188242/B9789004188242_004.xml
Schooners and Oysters: Reply to Bethke | Scholars Portal Journals,https://journals.scholarsportal.info/details/00218715/v99i0391/77_saortb.xml
Prairie Schooner' Inbred Cherry Tomato in,https://journals.ashs.org/hortsci/view/journals/hortsci/31/2/article-p291.xml%3Frskey%3DWx2mvo
Texas Adjutant General's Department Navy Papers: An Inventory of ...,https://txarchives.org/tslac/finding_aids/30003.xml
White's Ships - AskAboutIreland.ie,http://ams2-aai-web-1.anu.net/reading-room/environment-geography/transport/waterfords-shipyards/whites-ships/index.xml
Untitled,https://tile.loc.gov/storage-services/public/gdcmassbookdig/17thannualregatt00larc/17thannualregatt00larc_djvu.xml
"Journal of Chas. G. Fleming, USS Penobscot, 1866-1867: Finding Aid",https://www.usna.edu/Library/sca/man-findingaids/MS_104.EAD.xml
Untitled,http://findingaids.library.umass.edu/ead/mums199.xml
