Fusion over sublanguages - Project Euclid,https://projecteuclid.org/journals/journal-of-symbolic-logic/volume-71/issue-2/Fusion-over-sublanguages/10.2178/jsl/1146620149.xml
Lambda: the ultimate sublanguage (experience report) | Scholars ...,https://journals.scholarsportal.info/details/24751421/v3iicfp/1_ltusr.xml
Disciplinary variation in automatic sublanguage term identification ...,https://journals.scholarsportal.info/details/00028231/v48i0001/67_dviasti.xml
Object-Oriented RuleML,http://www.ruleml.org/indoo/indoo.xml
Using the basic TEI structural elements - University of Oxford,http://projects.oucs.ox.ac.uk/ENRICH/Deliverables/Training/tei-basic.xml%3FID%3Dbody.1_div.20
Key Concepts in Contemporary Rhetorical Studies - SAGE Knowledge,https://sk.sagepub.com/reference/sourcebook-on-rhetoric/n65.xml
"Genres, Registers, Text Types, Domains and Styles: Clarifying ... - Brill",https://brill.com/view/book/9789004334236/B9789004334236-s021.xml
Untitled,https://dblp.uni-trier.de/rec/persons/Codd72.xml
sitemap-14949999-14999999.xml - Scite,http://scite.ai/sitemap-14949999-14999999.xml
