"[PDF] 1 Scandalmonger A Review Kevin Leahy T.A.H. September, 18, 2010",http://bcnteachingamericanhistory.com/PDFs/Leahy_Book_Review_Scandalmonger.pdf
The Scandalmonger: Julian Tuwim - CEEOL,https://www.ceeol.com/content-files/document-570092.pdf
A King's Ransom: The Life of Charles Théveneau de Morande ...,https://academic.oup.com/ehr/article-pdf/CXXVI/523/1545/1960528/cer273.pdf
crs047.pdf,https://academic.oup.com/fh/article-pdf/26/3/408/1397390/crs047.pdf
[PDF] The Scandalmonger: Julian Tuwim - CEJSH,http://cejsh.icm.edu.pl/cejsh/element/bwmeta1.element.ojs-doi-10_18778_1505-9057_36_03/c/1630-1314.pdf
A King's Ransom: The Life of Charles Théveneau de Morande ...,https://muse.jhu.edu/article/427415/pdf
Scandalmonger: A Novel. By WILLIAM SAFIRE. (New York - JSTOR,https://www.jstor.org/stable/2674204
The Anatomy of Scandal - JStor,https://www.jstor.org/stable/4613223
[PDF] THE LIFE AND TIMES OF JAMES THOMSON CALLENDER ...,https://uh-ir.tdl.org/bitstream/handle/10657/2706/JACKSON-DISSERTATION-2013.pdf%3Fsequence%3D1%26isAllowed%3Dy
"The Life and Times of Charles Théveneau de Morande, Blackmailer ...",https://www.tandfonline.com/doi/pdf/10.1080/02684527.2012.755059%3FneedAccess%3Dtrue
