Synchronization,https://docs.deistercloud.com/content/Axional%2520development%2520tools.15/Axional%2520Studio.4/Administration.6/Additional%2520features.12/Mobile%2520devices.12/Synchronization.10.xml%3Fembedded%3Dtrue
Synchronized Seed Germination and Seedling Growth of Black ...,https://journals.ashs.org/horttech/view/journals/horttech/32/2/article-p182.xml
Synchronization batch size - Alpha Anywhere Documentation,https://documentation.alphasoftware.com/pages/Guides/Mobile%2520and%2520Web%2520Components/UX/Controls/Props/Data/List%2520Properties/listprops/Detail%2520View/Detail%2520View%2520Properties/Synchronization%2520batch%2520size.xml
"Synchronized ritual Behavior: religion, cognition and the ... - Brill",https://brill.com/previewpdf/book/edcoll/9789004225343/B9789004225343_006.xml
"Synchronized Swimming in Ontario, 1920–50s: Gender, Beauty, and ...",https://journals.humankinetics.com/abstract/journals/shr/53/1/article-p6.xml
"Synchronized Swimming in Ontario, 1920–50s: Gender, Beauty, and ...",https://journals.humankinetics.com/view/journals/shr/53/1/article-p6.xml
Maryland Sport Venues - Synchronized Swimming - ArcGIS Online,https://www.arcgis.com/sharing/rest/content/items/d3fd306a6bc9450a939f00985de6c6e5/info/metadata/metadata.xml%3Fformat%3Ddefault%26output%3Dhtml
SYNCHRONIZATION OF OESTRUS AND FERTILITY FOLLOWING ...,https://rep.bioscientifica.com/downloadpdf/journals/rep/37/1/jrf_37_1_023.xml
development of mouse and rat zygotes - following transfer to non ...,https://rep.bioscientifica.com/downloadpdf/journals/rep/33/1/jrf_33_1_019.xml
