"OVID, Metamorphoses | Loeb Classical Library",https://www.loebclassics.com/view/ovid-metamorphoses/1916/pb_LCL043.277.xml%3Famp%3Brskey%3DxAejVV%26readMode%3Drecto
"OVID, Metamorphoses | Loeb Classical Library",https://www.loebclassics.com/view/ovid-metamorphoses/1916/pb_LCL042.295.xml%3FreadMode%3Drecto
From sea to shining sea - Govinfo.gov,https://www.govinfo.gov/content/pkg/CZIC-hc110-e5-a55-1968/xml/CZIC-hc110-e5-a55-1968.xml
"In Oliver Twist, a novel very much concerned with how its ... - Brill",https://brill.com/downloadpdf/book/9789401209724/B9789401209724-s007.xml
Playing with Words and Identity - Brill,https://brill.com/downloadpdf/journals/vt/67/1/article-p59_5.xml
Drought Risk and Adaptation in the Interior United States,https://journals.ametsoc.org/downloadpdf/journals/wcas/8/2/wcas-d-15-0042_1.xml
Drought Risk and Adaptation in the Interior United States,https://journals.ametsoc.org/view/journals/wcas/8/2/wcas-d-15-0042_1.xml
"or, Altars of Sacrifice:</emph> Electronic Edition. - Documenting the ...",https://docsouth.unc.edu/imls/macaria/macaria.xml
Notes on Walt Whitman,https://whitmanarchive.org/criticism/disciples/tei/anc.00248.xml
SAGE Reference - Encyclopedia of Global Religion,https://sk.sagepub.com/reference/globalreligion/n161.xml
