Under construction: Sanctuary in Perrysburg | The Blade,https://www.toledoblade.com/Real-Estate/2017/04/23/Under-construction-Sanctuary-in-Perrysburg/stories/feed/feed/index.rss
Sanctuary South Shore - Buzzsprout,https://feeds.buzzsprout.com/579640.rss
Safe in the Sanctuary | Day 1,https://day1.org/1388-safe_in_the_sanctuary.rss
Inside Busch Wildlife Sanctuary - Subscribe on Android,https://subscribeonandroid.com/feeds.buzzsprout.com/1413154.rss
Tequila Bar Reviews US Search Advanced search Filters 138 ...,https://www.tequila.net/tequila-bar-reviews-us/luna-modern-mexican-kitchen_l1833_com_content.rss
Wildtracks,http://ww.wildtracksbelize.org/blog/wildtracks.rss
Locally Grown in Arizona - Open Conversation,https://pod.link/1515956180.rss
Sanctuary Haus (@sanctuary) | Lookbook,https://lookbook.nu/user/727246-Sanctuary-H/looks/hyped.rss
"Apartments near Sweetwater Elementary School in Port Orange, FL ...",https://www.apartmenthomeliving.com/port-orange-fl/spruce-creek/elementary/sweetwater-elementary-school-apartments_3.rss
