"499 if one wants to understand him. I noted misprints on pp. 27, 28 ...",https://brill.com/downloadpdf/journals/mnem/39/3-4/article-p499_51.xml
de novis libris iudicia - Brill,https://brill.com/previewpdf/journals/mnem/58/2/article-p299_15.xml%3FpdfJsInlineViewToken%3D1799393324%26inlineView%3Dtrue
Correction of some misprints in our paper in - AKJournals,https://akjournals.com/view/journals/10473/38/1-4/article-p263.xml
"THEOPHRASTUS, Enquiry into Plants, Volume I: Books 1-5 | Loeb ...",https://www.loebclassics.com/view/LCL070/1916/pb_LCL070.xix.xml%3FreadMode%3Drecto
"PHILOSTRATUS THE ELDER, Letters - Loeb Classical Library",https://www.loebclassics.com/view/philostratus_elder-letters/1949/pb_LCL383.397.xml
Round White Pill A116 - Topics - MedsChat,https://www.medschat.com/topics/round-white-pill-a116.xml
On Estimating the Variance of Time Averages in - AMS Journals,https://journals.ametsoc.org/view/journals/apme/15/5/1520-0450_1976_015_0514_oetvot_2_0_co_2.xml
"Richard Maurice Bucke to Walt Whitman, 1 April [188]9 - The Walt ...",https://whitmanarchive.org/biography/correspondence/tei/syr.00048.xml
"Walt Whitman to William Sloane Kennedy, 19 October 1888",https://whitmanarchive.org/biography/correspondence/tei/duk.00908.xml
