Peptidic Macrocycles - Conformational Sampling and ...,https://pubs.acs.org/doi/pdf/10.1021/acs.jcim.8b00097
Potent peptidic fusion inhibitors of influenza virus - Science,https://www.science.org/cms/asset/c0e0cd93-c2d6-40d6-9676-aea4a4d4a502/pap.pdf
Potent peptidic fusion inhibitors of influenza virus - Science,https://www.science.org/doi/pdf/10.1126/science.aan0516
[PDF] accumulation in inflammatory sites by non-peptidic mimetics of Arg ...,https://www.ncbi.nlm.nih.gov/pmc/articles/PMC1534914/pdf/clinexpimmunol00022-0072.pdf
[PDF] Current Trends in Food-Derived Peptidic Antioxidants - MDPI,https://www.mdpi.com/2076-3921/11/5/962/pdf
"[PDF] Syntheses of Peptidic, Natural Product-inspired, and Heterocyclic ...",http://d-scholarship.pitt.edu/16715/1/ETD_Corrected_Thesis.pdf
Peptidic regulation of heart rate and interactions with the autonomic ...,https://academic.oup.com/cardiovascres/article-pdf/37/3/578/909883/37-3-578.pdf
"[PDF] Cloning, expression and identification of KTX-Sp4, a selective Kv1.3 ...",https://cellandbioscience.biomedcentral.com/track/pdf/10.1186/s13578-017-0187-x.pdf
Connexin 43 peptidic medicine for glioblastoma stem cells,https://www.thelancet.com/pdfs/journals/ebiom/PIIS2352-3964(20)30581-8.pdf
from genome mining to peptidogenomics to spectral networks,http://pubs.rsc.org/en/content/articlepdf/2016/np/c5np00050e
