horttech02632 868..876 - [19437714 - HortTechnology] Spicy ...,https://journals.ashs.org/horttech/pdfviewer/full/journals/horttech/23/6/article-p868.xml%3Fbg%3DGREY_COLOR_LIGHT_VARIANT%26mgs%3DPRIMARY_COLOR%26mge%3DPRIMART_COLOR_DARK_VARIANT
Spicy Pepper Consumption and Preferences in the United States in,https://journals.ashs.org/horttech/view/journals/horttech/23/6/article-p868.xml
Deep brain stimulation: a mechanistic and clinical update in,https://thejns.org/focus/view/journals/neurosurg-focus/35/5/article-pE1.xml
"Deep brain stimulation: current assessment, new applications, and ...",https://thejns.org/focus/view/journals/neurosurg-focus/38/6/article-pE1.xml
TASTE RESPONSES IN ALCOHOL-DEPENDENT MEN,https://alcalc.oxfordjournals.org/content/36/6/516.ref-stubs.xml
SAGE Reference - Encyclopedia of Management Theory,https://sk.sagepub.com/reference/encyclopedia-of-management-theory/i4518.xml
sitemap.xml - PhantomBuster,https://phantombuster.com/sitemap.xml
Piłka na sznurku dla psów Collar Liker Cord 9 cm (6297) - Militaria.pl,https://www.militaria.pl/collar/pilka_na_sznurku_dla_psow_collar_liker_cord_9_cm_6297_p121172.xml
Eventeo - Event & Conference WordPress Theme - Mountainlikers,http://mountainlikers.com/wp-content/uploads/2021/10/demo-content-import-file_2021-10-05__16-16-52.xml
