"Osteoblasts in osteoporosis: past, emerging, and future anabolic ...",https://eje.bioscientifica.com/view/journals/eje/165/1/1.xml
a multi-functional complex organ. New insights into osteoblasts and ...,https://joe.bioscientifica.com/view/journals/joe/211/2/123.xml
Osteoblasts derived from mouse mandible enhance tumor growth of ...,https://journals.scholarsportal.info/pdf/22121374/v26icomplete/nfp_odfmmetodflb.xml
A novel human osteoblast–derived severe combined ...,https://thejns.org/spine/view/journals/j-neurosurg-spine/4/5/article-p388.xml
Osteoblast behaviors on titania nanotube and mesopore layers,https://rb.oxfordjournals.org/content/early/2016/12/23/rb.rbw042.source.xml
Alteration of osteocalcin mRNA expression in ovine osteoblasts in ...,https://akjournals.com/view/journals/018/61/1/article-p52.xml
Abstract - bioRxiv,https://www.biorxiv.org/content/biorxiv/early/2022/03/22/2022.03.21.485101.source.xml
Author Summary - PLOS,https://www.tools.wmflabs.org/opendatasets/plos/extracted/pbio.1002562.xml
Introduction - PLOS,http://open-repository.kisti.re.kr/cube/bitstream/open_repository/54502/1/journal.pone.0065940.xml
