2 CFR 200.310 -- Insurance coverage. - eCFR,https://www.gpo.gov/fdsys/pkg/CFR-2018-title2-vol1/xml/CFR-2018-title2-vol1-sec200-310.xml
Miscellaneous Concepts and Insurance Terminology - County Of ...,https://sonomacounty.ca.gov/x83870.xml
Insurance Waivers - County Of Sonoma - CA.gov,https://sonomacounty.ca.gov/x63642.xml
Contact Us - Westfield Insurance,https://westfielddss.ingeniuxondemand.com/x563.xml
45 CFR Part 156 -- Health Insurance Issuer Standards Under the ...,https://www.govinfo.gov/content/pkg/CFR-2016-title45-vol1/xml/CFR-2016-title45-vol1-part156.xml
Clear Insurance Management: Chartered Insurance Broker,http://emson.com/xml270221909/816235441.xml
"Predicting Flood Property Insurance Claims over CONUS, Fusing ...",https://journals.ametsoc.org/view/journals/bams/103/3/BAMS-D-21-0082.1.xml
Stronger Climate Resilience with Insurance in - AMS Journals,https://journals.ametsoc.org/view/journals/bams/100/8/bams-d-19-0073.1.xml
Insurance and Risk Management Policies - UW-Whitewater,https://www.choosewhitewater.org/x31232.xml
