chapter 2 The Scope and Limitations of the Concept of Evolving ...,https://brill.com/abstract/book/edcoll/9789004446854/BP000004.xml
chapter 4 “Evolving Capacities” and “Parental Guidance” in ... - Brill,https://brill.com/abstract/book/edcoll/9789004446854/BP000007.xml
Exploring the Higher-Order Cognitive Capacities of Sports Coaches in,https://journals.humankinetics.com/view/journals/iscj/9/2/article-p271.xml
"Binary Experiments, Minimax Tests and 2-Alternating Capacities",https://projecteuclid.org/journals/annals-of-statistics/volume-10/issue-1/Binary-Experiments-Minimax-Tests-and-2-Alternating-Capacities/10.1214/aos/1176345705.xml
"Symmetric, coherent, Choquet capacities - Project Euclid",https://projecteuclid.org/journals/annals-of-statistics/volume-24/issue-3/Symmetric-coherent-Choquet-capacities/10.1214/aos/1032526967.xml
en-US/Microsoft.PowerBI.Commands.Capacities.dll-Help.xml 1.0.613,https://www.powershellgallery.com/packages/MicrosoftPowerBIMgmt.Capacities/1.0.613/Content/en-US%255CMicrosoft.PowerBI.Commands.Capacities.dll-Help.xml
"[PDF] Antioxidation Capacities of Extracts from Green, Purple, and White ...",https://journals.ashs.org/hortsci/downloadpdf/journals/hortsci/40/5/article-p1221.xml
OBSERVATIONS ON THE RELATIONSHIP BETWEEN THE ...,https://eje.bioscientifica.com/view/journals/eje/54/3/acta_54_3_010.xml
"Climate change, environmental justice and the unusual capacities of ...",https://www.elgaronline.com/view/edcoll/9781802203332/9781802203332.00007.xml
