"The effects of intensive, long-term treadmill running on reproductive ...",https://joe.bioscientifica.com/view/journals/joe/200/3/259.xml
Energetics and Mechanics of Steep Treadmill Versus Overground ...,https://journals.humankinetics.com/view/journals/ijspp/17/4/article-p663.xml
Novice Users of a Bodyweight–Supporting Treadmill Require ...,https://journals.humankinetics.com/view/journals/jsr/aop/article-10.1123-jsr.2021-0379/article-10.1123-jsr.2021-0379.xml
Graded aerobic treadmill testing in pediatric sports-related concussion,https://thejns.org/pediatrics/view/journals/j-neurosurg-pediatr/18/6/article-p693.xml
Comparison of overground and treadmill-based gaits of dogs in,https://avmajournals.avma.org/abstract/journals/ajvr/74/4/ajvr.74.4.535.xml
Effect of underwater treadmill exercise on postural sway in horses ...,https://avmajournals.avma.org/view/journals/ajvr/74/7/ajvr.74.7.971.xml
Beyond the data treadmill in: Toxic truths - Manchester Open Hive,https://www.manchesteropenhive.com/view/9781526137005/9781526137005.00030.xml
[PDF] Influence of Treadmill Design on Rearfoot Pronation During Gait at ...,https://japmaonline.org/downloadpdf/journals/apms/95/5/0950475.xml
Implications of positive treadmill exercise tests in asymptomatic adult ...,http://eurheartj.oxfordjournals.org/content/8/6/611.source.xml
