Effects of operating pressure on coal gasification | Scholars Portal ...,https://journals.scholarsportal.info/details/00162361/v69i0005/656_eoopocg.xml
Secondary raw materials in cement industry in: Journal of Thermal ...,https://akjournals.com/abstract/journals/10973/70/1/article-p143.xml
Application of thermal analysis to the cement industry in - AKJournals,https://akjournals.com/view/journals/10973/38/9/article-p2137.xml
Cement (ordinary portland cement) - GaBi Software,http://gabi-documentation-2021.gabi-software.com/xml-data/processes/f982ac87-0bae-4da3-b446-7efe62fba0a8.xml
Cement (ordinary portland cement) - GaBi Software,http://gabi-documentation-2017.gabi-software.com/xml-data/processes/f982ac87-0bae-4da3-b446-7efe62fba0a8.xml
Untitled,https://downloads.hindawi.com/journals/amse/2020/7564108.xml
Tests of washed grades of Illinois coal ... - IDEALS @ Illinois,https://www.ideals.illinois.edu/bitstream/handle/2142/4300/engineeringexperv00000i00039_tei.xml%3Fsequence%3D1%26isAllowed%3Dy
Untitled,https://www.scirp.org/xml/71695.xml
UNIFORM SYSTEM OF ACCOUNTS PRESCRIBED ... - Govinfo.gov,https://www.govinfo.gov/content/pkg/CFR-1998-title18-vol1/xml/CFR-1998-title18-vol1-part201.xml
sitemap.xml,http://my.cickm.com/sitemap.xml
