Disappointing results following proctectomy with end-colostomy for ...,https://ecco-jcc.oxfordjournals.org/content/7/4/e150.source.xml
Colorectal Cancer Treatment - My Doctor Online - Kaiser Permanente,https://mydoctor.kaiserpermanente.org/ncal/structured-content/Treatment_Colorectal_Cancer_Treatment_-_Oncology.xml%3Fco%3D/regions/ncal
Growth hormone treatment of rats with chronic diverting colostomy ...,https://eje.bioscientifica.com/view/journals/eje/130/5/eje_130_5_016.xml%3Frskey%3DhguAdg%26result%3D415
Outcome of colostomy closure and influencing factors in patients ...,https://www.degruyter.com/view/j/abm.2011.5.issue-6/1905-7415.0506.114/1905-7415.0506.114.xml
Untitled,https://casereports.bmj.com/content/14/2/e240389.download.xml
Battery Ingestion with Colonic Perforation after Colostomy Closure in ...,https://journals.scholarsportal.info/pdf/21947619/v10i0001/e41_biwcpacciat.xml
Effectiveness of Structured Education on Patient's Knowledge and ...,https://journals.scholarsportal.info/details/23475625/v07i0004/370_eoseopkaprcc.xml
"Bowel and bladder continence, wound healing, and functional ...",https://thejns.org/spine/view/journals/j-neurosurg-spine/3/2/article-p106.xml
Deodorant Drug Products for Internal Use - Govinfo.gov,https://www.govinfo.gov/content/pkg/CFR-1999-title21-vol5/xml/CFR-1999-title21-vol5-part357-subpartI.xml
