Salsa - Music - Oxford Bibliographies,https://www.oxfordbibliographies.com/view/document/obo-9780199757824/obo-9780199757824-0274.xml
"Suaeda salsa, A Desalinating Companion Plant for Greenhouse ...",https://journals.ashs.org/hortsci/view/journals/hortsci/35/4/article-p620.xml
"[PDF] Suaeda salsa, A Desalinating water. They were opaque, reflective ...",https://journals.ashs.org/hortsci/downloadpdf/journals/hortsci/35/4/article-p620.xml
174 Juliet McMains Spinning Mambo Into Salsa analyzes the ... - Brill,https://brill.com/downloadpdf/journals/nwig/93/1-2/article-p174_42.xml
Salsa Rising: New York Latin Music of the Sixties Generation ... - Brill,https://brill.com/view/journals/nwig/92/1-2/article-p201_51.xml%3Flanguage%3Den
Salsa Dance Videos by Addicted2Salsa,https://www.addicted2salsa.com/podcast.xml
Injury Surveillance of Nonprofessional Salsa Dance in,https://journals.humankinetics.com/view/journals/jpah/15/10/article-p774.xml
"Popular Music: Topics, Trends & Trajectories - SAGE Books",https://sk.sagepub.com/books/popular-music/n27.xml
https://salsa-tropical.com/blog/ 2021-10-28T10:29:23+00:00 https ...,https://salsa-tropical.com/post-sitemap.xml
