Career planning | Accounting Today,https://www.taxprotoday.com/tag/career-planning.rss
Redzone Podcast: How to Make Better Decisions Faster - Audioboom,https://audioboom.com/channels/4975853.rss
Algorithm Design and Analysis - UC Davis,http://itunescontent.ucdavis.edu/media/2010/FA/ECS122A/118.rss
kw_data-flow+analysis.rss · master - gagallium-save - GitLab Inria,https://gitlab.inria.fr/gagallium/gagallium-save/-/blob/master/kw_data-flow%2Banalysis.rss
The Daily Standard Podcast - Your conservative source for analysis ...,https://wps3.washingtonexaminer.com/podcasts/daily-standard/daily-standard.rss
Mystery and Murder: Analysis by Dr. Phil - Megaphone,https://www.omnycontent.com/d/playlist/aaea4e69-af51-495e-afc9-a9760146922b/bc09518e-11a9-40e3-a28b-aadc00157de7/439b9640-b7e7-41b6-94e4-aadc0015bf98/podcast.rss
"Final Four: Analysis, notes, and TV info for Michigan vs. Loyola ...",https://www.toledoblade.com/College/2018/03/30/Final-Four-Analysis-notes-and-TV-info-for-Michigan-vs-Loyola-Chicago/stories/feed/feed/index.rss
"Chemistry enhanced podcasts, Imperial College London.",https://www.ch.ic.ac.uk/local/podcasts/index.rss
Law360's The Term - News & Analysis on the Supreme Court,https://www.law360.com/podcasts/supreme_court_feed.rss
"Picture of Federico Sequeda, CFA - Eaton Vance",https://institutional.eatonvance.com/blogfeed.rss%3Fblog_name%3DEVMBlog%26feed%3Demail
