Bacterium–bacterium inhibitory interactions among psychrotrophic ...,http://femsec.oxfordjournals.org/content/60/3/383.source.xml
Isolation and characterization of a mildly thermophilic nonsulfur ...,https://femsle.oxfordjournals.org/content/65/1-2/165.ref-stubs.xml
Interactions between the partners of the entomopathogenic ... - Brill,https://brill.com/previewpdf/journals/nemy/4/5/article-p601_6.xml
Some Basic Characteristics of Bacterial Freezing Nuclei in,https://journals.ametsoc.org/view/journals/apme/20/9/1520-0450_1981_020_1013_sbcobf_2_0_co_2.xml
Biogenic Ice Nuclei. Part II: Bacterial Sources in - AMS Journals,https://journals.ametsoc.org/view/journals/atsc/33/8/1520-0469_1976_033_1565_binpib_2_0_co_2.xml
Treatment outcome and associated factors of bacterial meningitis at ...,https://journals.scholarsportal.info/pdf/20550294/v7inone/nfp_toaafoehapos.xml
[PDF] Complete genome sequence of the nitrogen-fixing bacterium ...,https://journals.scholarsportal.info/pdf/19443277/v13inone/nfp_cgsotnbahtss.xml
The Survival of Bacterium Tularense in Lice and Louse Feces in,https://www.ajtmh.org/view/journals/tpmd/3/1/article-p179.xml
Nasopharyngeal Viral and Bacterial Co-Detection among Children ...,https://www.ajtmh.org/view/journals/tpmd/106/4/article-p1086.xml
