Reviews of books,https://www.tandfonline.com/doi/pdf/10.1080/00369224408735251
Popular Advice for the Well-Dressed Woman in the 19th Century,https://www.tandfonline.com/doi/pdf/10.1179/036121180805298646
The Relations of the American - and the Americo-Hungarian Labour ...,https://www.jstor.org/stable/42554722
Expediency vs. Morality: Jacksonian Politics and Slavery - jstor,https://www.jstor.org/stable/1901307
[PDF] On keeping logic in its place Yorick Wilks Computing Research ...,https://aclanthology.org/T87-1026.pdf
"Apoet's relation to truth is asymptotic, but not in the sense that a poet",https://www.journals.uchicago.edu/doi/pdf/10.1086/692044
enallage: is there such a thing? - Brill,https://brill.com/downloadpdf/book/9789004327382/BP000002.xml
Italian-Spanish Contact in Early 20th Century Argentina - Brill,https://brill.com/downloadpdf/journals/jlc/8/1/article-p112_6.xml
"[PDF] Third Debate: Jonesboro, Illinois - National Park Service",https://www.nps.gov/_cs_upload/abli/learn/education/classrooms/544887_1.pdf
[PDF] House Divided Speech - National Park Service,https://www.nps.gov/common/uploads/teachers/lessonplans/Primary_Sources1.pdf
