Ocean Swells along the Global Coastlines and Their Climate ...,https://journals.ametsoc.org/view/journals/clim/33/1/jcli-d-19-0216.1.xml
Ocean Swells along the Global Coastlines and Their Climate ...,https://journals.ametsoc.org/pdfviewer/full/journals/clim/33/1/jcli-d-19-0216.1.xml%3Fbg%3DGREY_COLOR_LIGHT_VARIANT%26mgs%3DPRIMARY_COLOR%26mge%3DPRIMART_COLOR_DARK_VARIANT
"Rising Seas, Receding Coastlines, and Vanishing Maritime Estates ...",https://brill.com/downloadpdf/journals/iclr/16/1/article-p38_3.xml
Composting as an Alternative Management Strategy for Sargassum ...,https://journals.ashs.org/horttech/view/journals/horttech/28/1/article-p80.xml
[PDF] Composting as an Alternative Management Strategy for Sargassum ...,https://journals.ashs.org/horttech/downloadpdf/journals/horttech/28/1/article-p80.xml
"Call for Submissions—Coastlines, FAU's Undergraduate Literary ...",https://www.fau.edu/artsandletters/english/news/call-for-submissions-coastlines-undergraduate-literary-magazine/index.xml
Are flight paths of nocturnal songbird migrants influenced by local ...,https://cz.oxfordjournals.org/content/60/5/660.source.xml
<p>Tidepool Wilderness Exploration<span></span></p> <p> </p>,https://parks.sonomacounty.ca.gov/x106965.xml
Property rights and land use planning on the Australian coast in,https://www.elgaronline.com/view/edcoll/9781786432513/9781786432513.00030.xml
