Entry Warm Demanders - SAGE Reference - The SAGE ...,https://sk.sagepub.com/reference/the-sage-encyclopedia-of-classroom-management/i3491.xml
L'Astronomie Chinoise Avant Les Han in - Brill,https://brill.com/view/journals/tpao/26/1/article-p267_16.xml%3Flanguage%3Den
Comment demander,http://cgparis.itamaraty.gov.br/fr/comment_demander.xml
Californie: nombre de signatures atteint pour demander la ...,https://www.courrierinternational.com/depeche/californie-nombre-de-signatures-atteint-pour-demander-la-revocation-du-gouverneur.afp.com.20210426.doc.98t9ey.xml
"La Géorgie va ""immédiatement"" demander l'adhésion à l'UE (parti ...",https://www.courrierinternational.com/depeche/la-georgie-va-immediatement-demander-ladhesion-lue-parti-au-pouvoir.afp.com.20220302.doc.324c2n9.xml
Les notaires peuvent demander et obtenir des certificats ...,http://www.kluwereasyweb.be/documents/lawyer-news/202001-lawyer/kl2370158-notarissen-kunnen-hypothecaire-getuigschriften-elektronisch-aanvragen-en-krijgen.xml%3Flang%3Dfr
Olivier Aumont dans la base Horizon - documentation.ird.fr,https://www.documentation.ird.fr/hor/mat:200219/tout.xml
sitemap.categories.xml - Devis.lu,https://devis.lu/sitemap.categories.xml
SMPTE Timed Text document created by MacCaption™ Changer ...,https://www.canada.ca/content/dam/phac-aspc/migration/phac-aspc/cd-mc/videos/assets/cc-st/physi-fra.xml
