TC The Cryosphere TC The Cryosphere 1994-0424 Copernicus ...,https://www.the-cryosphere.net/7/1971/2013/tc-7-1971-2013.xml
Analysis of the Global Microwave Polarization Data of Clouds in,https://journals.ametsoc.org/view/journals/clim/32/1/jcli-d-18-0293.1.xml
Analysis of the Global Microwave Polarization Data of Clouds,https://journals.ametsoc.org/downloadpdf/journals/clim/32/1/jcli-d-18-0293.1.xml
Description of Free Library of Philadelphia Lewis O 59: Shāhnāmah.,https://openn.library.upenn.edu/Data/0023/lewis_o_059/data/lewis_o_059_TEI.xml
Description of University of Pennsylvania CAJS Rar Ms 122,https://openn.library.upenn.edu/Data/0002/kcajs_rar_ms122/data/kcajs_rar_ms122_TEI.xml
"Esther Rashkin, Unspeakable Secrets and the Psychoanalysis of ...",https://www.berghahnjournals.com/downloadpdf/journals/projections/4/1/proj040111.xml
Sediment-hosted zinc-lead deposits of the world - USGS Mineral ...,https://mrdata.usgs.gov/metadata/ofr-2009-1252.xml
ACP Atmospheric Chemistry and Physics ACP Atmos. Chem. Phys ...,https://www.atmos-chem-phys.net/15/11909/2015/acp-15-11909-2015.xml
A Three-Wave Longitudinal Test of Self-Determination Theory's ...,https://journals.humankinetics.com/downloadpdf/journals/jsep/38/1/article-p15.xml
"Walters Ms. W.65, Collection of Sermons",http://www.thedigitalwalters.org/Data/WaltersManuscripts/ManuscriptDescriptions/W65_tei.xml
rows.xml - Chicago Data Portal,https://data.cityofchicago.org/api/views/fypr-ksnz/rows.xml%3FaccessType%3DDOWNLOAD
biorxiv BIORXIV bioRxiv bioRxiv Cold Spring Harbor Laboratory ...,https://www.biorxiv.org/content/biorxiv/early/2022/02/25/2021.05.11.442512.source.xml
"The rule of law, new constitutionalism, and transnational legality in",https://www.elgaronline.com/view/edcoll/9781786432438/9781786432438.00027.xml
Foreword in: A Scholarly Edition of Samuel P. Newman's A ... - Brill,https://brill.com/view/book/9789004441507/front-7.xml%3Flanguage%3Den
lhbum-7689g_0263_0522 The British regime in Wisconsin. 0263 ...,https://tile.loc.gov/storage-services/service/gdc/lhbum/7689g/7689g_0263_0522.xml
Journal of Porous Media,http://www.dl.begellhouse.com/ixml/Volume1_Issue1-46e9209f78a72942.xml
Sweden Lund Lund University Library Medeltidshandskrift 1 Ms 1 ...,http://www.alvin-portal.org/alvin/attachment/document/alvin-record:12596/ATTACHMENT-0067.xml
"SUETONIUS, Lives of the Caesars 6. Nero | Loeb Classical Library",https://www.loebclassics.com/view/suetonius-lives_caesars_book_vi_nero/1914/pb_LCL038.175.xml
