"Gadamer, Aesthetic Modernism, and the Rehabilitation of Allegory",https://brill.com/downloadpdf/journals/rip/34/1/article-p45_4.xml
"Descriptive, Dramatic, Legendary and Contemplative, by William ...",https://docsouth.unc.edu/southlit/simmspoems1/simmspoems1.xml
The Gothic aesthetic in - manchester hive,https://www.manchesterhive.com/view/9781526125675/9781526125675.00008.xml
https://wordunscrambler.org/word/disorders https://wordunscrambler ...,https://wordunscrambler.org/sitemap-words-50.xml
Norse Romanticism: Robert Hole Robert W. Rix Robert W. Rix ...,https://romantic-circles.org/sites/default/files/imported/editions/norse/XML/Richard_Hole.xml
lilith.xml - Christian Classics Ethereal Library,https://www.ccel.org/ccel/m/macdonald/lilith.xml
"The Seasons : ] SPRING . COME , gentle SPRING , AETHEREAL ...",https://www.eighteenthcenturypoetry.org/works/o3549-w0010/o3549-w0010.xml
The wandring lover a tragy-comedie being acted severall times ...,https://ota.bodleian.ox.ac.uk/repository/xmlui/bitstream/handle/20.500.12024/A50687/A50687.xml%3Fsequence%3D7%26isAllowed%3Dy
The pleasures of imagination: A poem. In three books. - Oxford Text ...,https://ota.bodleian.ox.ac.uk/repository/xmlui/bitstream/handle/20.500.12024/K048676.000/K048676.000.xml%3Fsequence%3D6%26isAllowed%3Dy
