Field-Object Design of a Numerical Weather Prediction Model for Uni,https://journals.ametsoc.org/view/journals/mwre/123/2/1520-0493_1995_123_0401_fodoan_2_0_co_2.xml
Efficient Adaptive Scheduling of Multiprocessors with Stable ...,https://journals.scholarsportal.info/details/10459219/v22i0004/594_easomwspf.xml
A multigrid method for multiprocessors | Scholars Portal Journals,https://journals.scholarsportal.info/details/00963003/v19i1-4/75_ammfm.xml
Real-Time Synchronization on Multiprocessors - TU Dresden,http://debian2.inf.tu-dresden.de/EZAG/old/2005-2010/abstracts/abstract_20070627.xml%3Fmode%3Dprint
L4.sec Microkernel for Shared Memory Multiprocessors,http://wwwos.inf.tu-dresden.de/EZAG/old/2005-2010/abstracts/abstract_20060804.xml
Untitled,https://academiccommons.columbia.edu/doi/10.7916/d8-s2kz-e886.xml
Untitled,https://downloads.hindawi.com/archive/2012/794753.xml
Untitled,https://dblp.org/pid/79/3674.xml
CloudEx: a fair-access financial exchange in the cloud. - DBLP,https://dblp.org/pid/r/MendelRosenblum.xml
