Expanded endonasal approach: the rostrocaudal axis. Part I. Crista ...,https://thejns.org/focus/view/journals/neurosurg-focus/19/1/foc.2005.19.1.4.xml
the rostrocaudal axis. Part I. Crista galli to the sella turcica,https://thejns.org/focus/downloadpdf/journals/neurosurg-focus/19/1/foc.2005.19.1.4.xml
Natural transformation of Streptococcus crista - Oxford Academic,https://femsle.oxfordjournals.org/content/143/1/13.source.xml
NPI Database | NPI:1699872382 | CRISTA MINISTRIES | Medical ...,https://www.hipaaspace.com/medical_billing/coding/national_provider_identifier/codes/npi_1699872382.xml
NPI Database | NPI:1649363755 | CRISTA E JOHNSON-AGBAKWU ...,https://www.hipaaspace.com/medical_billing/coding/national_provider_identifier/codes/npi_1649363755.xml
Crista sagittalis externa in the Skull of Pan troglodytes and its ... - Brill,https://brill.com/view/journals/ijfp/19/6/article-p469_5.xml
Studies on the Sensory Epithelium of the Labyrinthine Crista ...,https://journals.scholarsportal.info/details/00222151/v64i0007/420_sotseotlcaif.xml
One new antitumour cassane-type diterpene from Caesalpinia crista ...,https://journals.scholarsportal.info/details/14786419/v27i0006/537_onacdfcc.xml%3Flang%3Dfr
"Sunset at Scripps Seaside Forum Wedding, Crista and Sean ...",https://www.truephotography.com/juicebox/configs/crista-sean-details.CX1635981219.xml
