49 Transportation 3 2019-10-01 2019-10-01 false Structural integrity ...,https://www.govinfo.gov/content/pkg/CFR-2019-title49-vol3/xml/CFR-2019-title49-vol3-sec178-338-3.xml
Financial Protection Requirements and Indemnity Agreements - eCFR,https://www.gpo.gov/fdsys/pkg/CFR-2018-title10-vol2/xml/CFR-2018-title10-vol2-part140.xml
Validity and Reliability of a Kinematic Device for Measuring the ...,https://journals.humankinetics.com/view/journals/jab/16/1/article-p26.xml
Explosive East Coast Cyclogenesis: Numerical Experimentation and ...,https://journals.ametsoc.org/view/journals/mwre/117/11/1520-0493_1989_117_2384_eeccne_2_0_co_2.xml
28.91 . . . . WEATHER OF THE ATLANTIC AND PACIFIC OCEANS,https://journals.ametsoc.org/downloadpdf/journals/mwre/62/12/1520-0493_1934_62_467_naod_2_0_co_2.xml
George Floyd Justice in Policing Act of 2020 - Congress.gov,https://www.congress.gov/116/bills/hr7120/BILLS-116hr7120pcs.xml
Experimental study of medullary trigeminal evoked potentials,https://thejns.org/view/journals/j-neurosurg/93/1/article-p68.xml
