Plates & People gets Blackberry Special that's pizza | The Blade,https://opinion.toledoblade.com/a-e/food/2018/10/02/plates-people-gets-blackberry-corner-special-pizza/stories/feed/index.rss
Days In The Blackberries Field - Buzzsprout,https://feeds.buzzsprout.com/1984265.rss
Blackberry Bushes come to Beerlin - Cera Impala,https://ceraimpala.com/blogs/blackberry-bushes-come-to-beerlin.rss
10 Cheeses From Trader Joe's That You Need To Try - Spoon ...,https://www.thisisinsider.com/the-10-best-cheeses-to-buy-at-trader-joes-2017-7/food.rss
McHistory - WGLT,https://pod.link/1463820307.rss
"Take Me Home, Spooky Roads - Audioboom",https://audioboom.com/channels/5050006.rss
A broad-minded grapefruit's camel comes with it the thought that the ...,https://shalomapps.com/index.rss
