Capitalising on constraint – Bailout politics in Eurozone countries,https://www.manchesterhive.com/view/9781526149893/9781526149893.xml
The evolution of shadow education in China: From emergence to ...,https://akjournals.com/view/journals/063/11/2/article-p89.xml
"capitalisation in: A Dictionary of Taxation, Second Edition - Elgaronline",https://www.elgaronline.com/view/nlm-book/9781849801225/c1-sec13.xml
CFM52040: The matters and computational rules: capitalised ...,https://www.bloomsburyprofessionalonline.com/view/corporate_finance_manual/CFM52040.xml
8.03: Capitalised future earnings : Practical Share Valuation,https://www.bloomsburyprofessionalonline.com/view/practical_share_valuation/PSV-section8.03.xml
Ambiguous Positionings: The Politics and Experiences of Moral ...,https://brill.com/view/journals/iafr/12/2/article-p260_005.xml
Capitalising on Silver Tongues in - Brill,https://brill.com/view/journals/ajss/47/6/article-p661_2.xml%3Flanguage%3Den
cities and the changing landscape of cultural policy in - Bristol ...,https://bristoluniversitypressdigital.com/view/journals/pp/31/2/article-p153.xml
Capital Expenditure - Computers and computer peripherals ...,http://sbr.gov.au/taxonomy/sbr_au_reports/apra/rrf/rrf_332_0/rrf_332_0.0001/rrf_332_0.0001.lodge.request.02.01.labLink.xml
Acknowledgements in: Worlding the south - Manchester Open Hive,https://www.manchesteropenhive.com/view/9781526152893/9781526152893.00005.xml
Payday lending market investigation - GOV.UK,http://www.competition-commission.org.uk/our-work/directory-of-all-inquiries/payday-lending/evidence/cc-commissioned-research-and-surveys.xml
Capitalising Government Spending on Military Weapons - Office for ...,https://webarchive.nationalarchives.gov.uk/tna/20140723225357/http://www.ons.gov.uk/ons/dcp19975_360952.xml
SEC FORM 4,https://www.sec.gov/Archives/edgar/data/789019/000181928520000006/xslF345X03/edgar.xml
bluemixuima/primitiveAeDescriptorWordCase.xml at master - GitHub,https://github.com/dalelane/bluemixuima/blob/master/com.dalelane.uima.bluemixhelloworld/primitiveAeDescriptorWordCase.xml
Settler Colonialism - Anthropology - Oxford Bibliographies,https://www.oxfordbibliographies.com/view/document/obo-9780199766567/obo-9780199766567-0125.xml
The Role of Implicated Meaning in George Orwell's Nineteen Eighty ...,https://journals.scholarsportal.info/details/19295855/v7inone/22_troimioneltp_1.xml
Metadata XML - NHESS - Copernicus.org,https://nhess.copernicus.org/preprints/nhess-2021-398/nhess-2021-398.xml
XML - Scientific Research Publishing,https://www.scirp.org/xml/79664.xml
Capitalising on AUD/JPY momentum overrun - DBS Bank,https://www.dbs.com.sg/treasures/aics/templatedata/article/generic/data/en/CIO/042020/200413FX.xml
Back Matter in: IMF Working Papers Volume 1990 Issue 066 (1990),https://www.elibrary.imf.org/view/journals/001/1990/066/article-A999-en.xml
