[PDF] Is There a Shortage of Marriageable Men? - Brookings Institution,https://www.brookings.edu/wp-content/uploads/2016/06/56-Shortage-of-Marriageable-Men.pdf
[PDF] Shortage of “Marriageable” Men in U.S. Found Only Among Blacks ...,https://www.brookings.edu/wp-content/uploads/2016/06/marriagble-men-release.pdf
Men: A Test of the Wilson Hypothesis - jstor,https://www.jstor.org/stable/pdf/146195.pdf
Race and the Retreat From Marriage - jstor,https://www.jstor.org/stable/2096123
[PDF] STATEMENT OF MARRIAGEABLE AGE - travel.gov,https://travel.state.gov/content/dam/visas/iv-dv-supplemental/forms/MRV_Monrovia-Statement.pdf
A Focus on Participants in a Community Healthy Marriage Program,https://onlinelibrary.wiley.com/doi/pdf/10.1111/j.1741-3729.2009.00588.x
"[PDF] Male Earnings, Marriageable Men, and Nonmarital Fertility",https://www.nber.org/system/files/working_papers/w23408/w23408.pdf
Does the Shortage of Marriageable Women Induce the Trafficking of ...,https://journals.sagepub.com/doi/pdf/10.1177/10778012211014565
[PDF] Black Men Graduate Student's Definition of a Marriageable Man,https://scholarworks.uark.edu/cgi/viewcontent.cgi%3Farticle%3D5796%26context%3Detd
"Parental Divorce, Spouse Selection and Entry into Marriage",https://muse.jhu.edu/article/482853/pdf
