Rebuilding Process - Permit Sonoma,https://permitsonoma.org/x85209.xml
Frequently Asked Questions About Rebuilding - Permit Sonoma,https://permitsonoma.org/x85197.xml
Rebuilding Fiscal Institutions in Postconflict Countries | imfsg,https://www.elibrary.imf.org/view/books/084/05571-9781589064492-en/05571-9781589064492-en-book.xml
SAGE Books - Rebuilding Urban Neighborhoods,https://sk.sagepub.com/books/rebuilding-urban-neighborhoods/n3.xml
Democracy in Decline: Rebuilding its Future - SAGE Books,https://sk.sagepub.com/books/democracy-in-decline-rebuilding-its-future/i574.xml
Septic System Evaluations for Rebuilding and Temporary Housing ...,https://sonomacounty.ca.gov/x27212.xml
Design Thinking for Zero Net Energy - Rebuilding for Comfort ...,https://sonomacounty.ca.gov/x56815.xml
Recovering What was Stolen by Embracing the Process of Rebuilding,https://www.advancejournal.org/article/29061.xml
"Rebuilding, Remembrance, and Commerce in: Journeys Volume 20 ...",https://www.berghahnjournals.com/abstract/journals/journeys/20/1/jy200104.xml
Chapter 11: Colombia: Rebuilding El Salado - Elgaronline,https://www.elgaronline.com/view/9781788979078.00018.xml
News | Page 12 | SFGOV,https://sfgov.org/news/2014-12-10/news.xml%3Fpage%3D11
"BU Records: Alumni Rebuilding Campaign, Inclusive: 1922 ...",https://txarchives.org/baytc/finding_aids/10195.xml
Rebuilding and adaptation in: Crafting identities - manchester hive,https://www.manchesterhive.com/view/9781526147714/9781526147714.00012.xml
Rebuilding the Tower in: Race talk - Manchester Open Hive,https://www.manchesteropenhive.com/view/9781526138484/9781526138484.00016.xml
Cambodia – Rebuilding for a Challenging Future | imfsg - IMF eLibrary,https://0-www-elibrary-imf-org.library.svsu.edu/view/books/058/00957-9781589064447-en/00957-9781589064447-en-book.xml
Overfished species rebuilding plans. - Govinfo.gov,https://www.govinfo.gov/content/pkg/CFR-2006-title50-vol9/xml/CFR-2006-title50-vol9-sec660-365.xml
The Rebuilding of the Crystal Palace 1851-54 : Permanent and ...,https://journals.scholarsportal.info/details/02677768/v33i0002/43_trotcp1.xml
The National Public Health Laboratory Systems and Services Before ...,https://www.ajtmh.org/view/journals/tpmd/97/4_Suppl/article-p21.xml
10. What Are the Humanities For? Rebuilding the Public University,https://www.degruyter.com/rutgers/view/book/9780813573267/10.36019/9780813573267-012.xml
Rebuilding critical skills in nuclear science and technology,https://akjournals.com/view/journals/10967/263/1/article-p137.xml
