SECTION A HUMAN NECESSITIES AGRICULTURE ...,ftp://ftp.wipo.int/pub/itos4ipc/ITSupport_and_download_area/IPC2/subclass/core/en/xml/A01B.xml
SECTION A HUMAN NECESSITIES AGRICULTURE ...,ftp://ftp.wipo.int/pub/itos4ipc/ITSupport_and_download_area/IPC6/subclass/core/en/xml/A01B.xml
the twenty-five ploughs of sir john: the tale of gamelyn - Brill,https://brill.com/previewpdf/book/edcoll/9789401203920/B9789401203920-s010.xml
THE TWENTY-FIVE PLOUGHS OF SIR JOHN: THE TALE OF ... - Brill,https://brill.com/view/book/9789401203920/B9789401203920-s010.xml
Russia ploughs ahead to reduce dependence on the dollar - DBS,https://www.dbs.com.hk/sme/aics/templatedata/article/generic/data/en/CIO/082020/200814-currencies_hk.xml
News: Russia ploughs ahead to reduce dependence on the dollar,https://www.dbs.com.sg/treasures/templatedata/article/generic/data/en/CIO/082020/200814currencies.xml
Plough Sole as the Result of the Agricultural Land Use - Sciendo,http://www.degruyter.com/view/j/mgrsd.2004.11.issue-1/mgrsd-2004-0008/mgrsd-2004-0008.xml
Tillage - AskAboutIreland.ie,https://www.askaboutireland.ie/narrative-notes/tillage/index.xml
