Under-served populations | American Banker,https://www.cujournal.com/tag/under-served-populations.rss
"Former Ohio congressman Ralph Regula dies, served 18 terms ...",https://www.toledoblade.com/Deaths/2017/07/20/Former-Ohio-congressman-Ralph-Regula-dies-served-18-terms/stories/feed/index.rss
"Harvey Parker Tagsold, Jr. (1935-2016): Businessman also served ...",https://www.toledoblade.com/Deaths/2016/03/26/Harvey-Parker-Tagsold-Jr-1935-2016-Businessman-also-served-community/stories/feed/feed/index.rss
First Come First Served Podcast - Buzzsprout,https://feeds.buzzsprout.com/806981.rss
Life Sentence - Simplecast,https://pod.link/1591957987.rss
"Štěpán Janča, Czech evangelical priest serving at the Church of ...",https://www.mzv.cz/london/en/culture_and_education/czexpats_interviews/stepan_janca_czech_evangelical_priest.rss
