The unideological electorate - Wiley Online Library,https://onlinelibrary.wiley.com/doi/pdf/10.1111/j.2050-5876.2015.00849.x
UN Ideological Work and International Change,https://link.springer.com/content/pdf/10.1057/9780230507944_7.pdf
Ideology and Performance - JStor,https://www.jstor.org/stable/pdf/3207328.pdf
"The Case for a Re-Evaluation of the Concept ""Ideology"" - JStor",https://www.jstor.org/stable/40370770
"Identities, Ideologies, and Interests: Democratization and the Culture ...",https://www.journals.uchicago.edu/doi/pdfplus/10.2307/2960187
"Class, Crisis and the S - The University of Chicago Press: Journals",https://www.journals.uchicago.edu/doi/pdf/10.2307/2129845
the reasons why Reformation scholarship is so,https://academic.oup.com/ahr/article-pdf/94/3/792/306367/94-3-792.pdf
"Anthony Westell, Paradox: Trudeau as Prime Minister. Scarborough",https://www.cambridge.org/core/services/aop-cambridge-core/content/view/4466AE867D8C0E2C5403BA0B930E3E16/S000842390004021Xa.pdf/anthony-westell-paradox-trudeau-as-prime-minister-scarborough-prentice-hall-1972-pp-ix-262-pierre-elliott-trudeau-conversation-with-canadians-toronto-university-of-toronto-press-1972-pp-vi-214.pdf
[PDF] BHG&L Profit Sharing & 401(k) Plan ... - PlanSpecs.com,https://www.planspecs.com/bgl/pdf/BRI1MemoQ408.pdf
[PDF] The New “Lions of Syria”. Salafist and Jihadist Groups Dominate ...,https://www.swp-berlin.org/publications/products/comments/2014C19_sbg.pdf
