Amy Bryant Previews Her Team's Season - Emory Athletics,https://www.emoryathletics.com/sports/wten/video/2010-11/BryantPreSeason(09-28).flv
Women's Basketball Coach Christy Thomaskutty Updates Her Team,https://www.emoryathletics.com/sports/wbkb/video/christycarcaseprev.flv
Warren Wants IRS to Disclose Candidates' Tax Returns,https://www.israelherald.com/news/257875047/oct04v40.flv
Death Of Outspoken Srebrenica Mother Mocked By Top Serbian ...,https://www.swedensun.com/news/257736575/oct04v40.flv
Lawyers to Challenge Sessions' Ruling In Asylum Case,https://www.raleightimes.com/news/257483013/oct04v40.flv
Spanish Opera Singer Montserrat Caballe Dies at 85,https://www.malaysiasun.com/news/258088896/oct04v40.flv
"Do Your Brexit Duty, Britain's May Tells Her Divided Government",https://www.irishsun.com/news/257624776/oct04v56.flv
$366 for a person: How do people become slaves in Russia?,https://www.kenyastar.com/news/258088617/oct04v40.flv
Top Pakistani Court Upholds Christian Woman's Blasphemy Acquittal,https://www.kenyastar.com/news/259282418/feb24v21.flv
Miracle tree-top baby: Mozambique's modest celebrity - News24,https://www.madagascarsun.com/news/252068023/feb24v21.flv
UK PM's Team Makes Plans for Snap Election - Voice of America,https://www.northkoreatimes.com/news/258031566/oct04v56.flv
Gamer.no,http://www.nordicreviews.net/7/7269/v_22977.flv
