European Tapestries - Renaissance and Reformation,https://www.oxfordbibliographies.com/view/document/obo-9780195399301/obo-9780195399301-0467.xml
Chapter 5 The Barberini Tapestries: Charles Mather Ffoulke and the ...,https://brill.com/abstract/book/edcoll/9789004431041/BP000015.xml
The Barberini Tapestries: Charles Mather Ffoulke and the Dealer's ...,https://brill.com/downloadpdf/book/9789004431041/BP000015.xml
North American Quaker Tapestry Records | Archives & Manuscripts,http://www.swarthmore.edu/Library/friends/ead/4090naqt.xml
Untitled,https://www.pbteen.com/sitemap/shop/accessories/tapestries/sitemap.xml
"The Foliage Garden: Tapestries of Color, Shape, and Texture in",https://journals.ashs.org/horttech/view/journals/horttech/9/4/article-p690.xml
Tapestry of the Times - Smithsonian Folkways Recordings,https://folkways.si.edu/content/rss/tapestry.xml
"Guide to the Rudolph ""Rudi"" Fuchs Holiday Card Collection - TARO",https://txarchives.org/unt/finding_aids/00073.xml
tapestry4/pom.xml at trunk - GitHub,https://github.com/apache/tapestry4/blob/trunk/pom.xml
