Will Expectedly the Top Blow off? - jstor,https://www.jstor.org/stable/1312436
"includes frequent citation from other sources, most es - jstor",https://www.jstor.org/stable/10.1086/666900
"[PDF] Interactive Effects of Age, Gender, and Motives on Evaluations of ...",https://d-nb.info/1213244498/34
"expectedly. other hand, hypercapnia develops over a short period ...",http://www.sciencedirect.com/science/article/pii/S0140673667920065/pdf%3Fmd5%3Dd06b6088b93e4374cf471e6c0cf65af2%26pid%3D1-s2.0-S0140673667920065-main.pdf
"!nerge. Unhappily, though not t叫expectedly, they fall into predict ηle ...",https://brill.com/downloadpdf/journals/evqu/56/2/article-p105_6.pdf
brings life to an expectedly dry subject. His analytical and writing ...,https://www.cambridge.org/core/services/aop-cambridge-core/content/view/C5BC33A2ACD46CEA9AF797D50D250303/S0021911800073162a.pdf/my_brother_my_executioner_by_f_sionil_jose_quezon_city_new_day_publishers_1979_187_pp_825_paper_distributed_in_us_by_the_cellar_book_shop_detroit_mich.pdf
extent inhibited (p< 0.05) by bromocriptine and pergolide. Whereas ...,https://eje.bioscientifica.com/downloadpdf/journals/eje/113/1_Suppl/acta_111_Suppl_274_168.xml
[PDF] A Robust and Efficient Propane Dehydrogenation Catalyst from Un,https://chemrxiv.org/engage/api-gateway/chemrxiv/assets/orp/resource/item/628e512c44bdd545ba7018d6/original/a-robust-and-efficient-propane-dehydrogenation-catalyst-from-unexpectedly-segregated-pt2mn-nanoparticles.pdf
"The Oromia Rural Land Dispute Settlement Scheme, So Ambiguous ...",https://papers.ssrn.com/sol3/Delivery.cfm/SSRN_ID2193420_code1031846.pdf%3Fabstractid%3D2193420%26mirid%3D1
"[PDF] wishing to avoid the ill-usage of the soldiers, ran un expectedly in ...",https://digicol.lib.depaul.edu/digital/api/collection/p16106coll2/id/9625/download
