Marxist Medievalists: A Tradition - jstor,https://www.jstor.org/stable/40404148
Medievalists and the Study of Childhood - JStor,https://www.jstor.org/stable/3301328
Medievalists and the Study of Childhood - The University of Chicago ...,https://www.journals.uchicago.edu/doi/pdf/10.2307/3301328
The Medievalist and Cultural Literacy - The University of Chicago ...,https://www.journals.uchicago.edu/doi/pdf/10.2307/2864228
Medievalists and the Notion of the Frontier - SAGE Journals,https://journals.sagepub.com/doi/pdf/10.1177/097194589900200104
Medieval Europe and the World: Why Medievalists Should Also Be ...,https://compass.onlinelibrary.wiley.com/doi/pdf/10.1111/j.1478-0542.2006.00359.x
[PDF] An Introduction to Editing Manuscripts for Medievalists,https://digitalcommons.usu.edu/cgi/viewcontent.cgi%3Farticle%3D1000%26context%3Dlib_mono
'The revolt of the medievalists'. Directions in recent research on the ...,https://www.tandfonline.com/doi/pdf/10.1016/j.jmedhist.2006.07.006
[PDF] On Race and Medieval Studies: A Collective Statement by ... - H-Net,https://networks.h-net.org/node/189407/pdf
The New Medievalism (review) - Johns Hopkins University,https://muse.jhu.edu/article/417837
