1009.xml,https://discover.cs.ucsb.edu/commonerrors/error/1009.xml
invalid type argument of -> (have struct student),https://discover.cs.ucsb.edu/commonerrors/error/2021.xml
Internet Key Exchange (IKE) Attributes,https://www.iana.org/assignments/ipsec-registry/ipsec-registry.xml
Error 1330: Cabinet file data1.cab has an invalid digital signature,https://vpn.yonyou.com/prx/000/https/java.com/en/download/help/error_1330.xml
2018 - 2019 SCLEAMemorandum of Understanding: Article 36,https://sonomacounty.ca.gov/x86233.xml
"Chapter 3 The War Invalid: The Samovar, the Kommunalka ... - Brill",https://brill.com/abstract/book/9789004362406/BP000013.xml
Origin Validation Policy Considerations for Dropping Invalid Routes,https://www.ietf.org/archive/id/draft-sriram-sidrops-drop-invalid-policy-08.xml
IBM DB2 Database Server Invalid Data Stream Denial of Service,https://support.ixiacom.com/strikes/generic/ixia/ibm_db2_database_server_invalid_data_stream_denial_of_service_attack.xml
Fuzzer: HTTP GET Request Invalid URI - Ixia Support,https://support.ixiacom.com/strikes/fuzzers/http/get_invaliduri.xml
Comparing Methods for Using Invalid Days in Accelerometer Data to ...,https://journals.humankinetics.com/view/journals/jmpb/2/1/article-p4.xml
