"Pseudomyrmex spiculus valid Costa Rica. Neotropic. Ward, P. S. ...",https://www.antcat.org/catalog/search.txt%3Faction%3Dshow%26commit%3DGo%26controller%3Dcatalog%252Fsearches%26qq%3DPseudomyrmex%2Bsp%26st%3Dm%26utf8%3D%25E2%259C%2593
BBBdb_2017.11.txt,https://www.uv.es/jgpausas/bbb/BBBdb_2017.11.txt
tree_register.txt,http://ecoregister.org/data/FourMeasures/tree_register.txt
DocumentResolver/DocumentData.txt at master · mlichtenberg ...,https://github.com/mlichtenberg/DocumentResolver/blob/master/DocumentResolverGUI/DocumentData.txt
Acadian Flycatcher Alder Flycatcher Allen's Hummingbird American ...,https://www.fantasybirding.com/yardsquad/RobinHoodedMergansers_Stretch3_Species_List.txt
Alder Flycatcher American Black Duck American Coot American ...,https://www.fantasybirding.com/yardsquad/LosGreenHermits_Media_List.txt
Horizontal transfer and proliferation of Tsu4 in Saccharomyces ...,https://europepmc.org/articles/pmc5998506/bin/13100_2018_122_moesm5_esm.txt
MASARYK UNIVERSITY FACULTY OF SCIENCE DEPARTMENT ...,https://is.muni.cz/th/hx46f/Bakalarska_praca.txt
implementation panama osu really labeling marked whom should ...,http://d-scholarship.pitt.edu/23344/3/indexcodes.txt
