Comparison of antidromic and orthodromic action potentials of ...,https://physoc.onlinelibrary.wiley.com/doi/pdf/10.1113/jphysiol.1983.sp014529
[PDF] Antidromic and Orthodromic Activation of Epileptic Neurons in ...,https://depts.washington.edu/fetzweb/assets/wyler_fetz_ward_expneuro_1974_antidromic_and_orthodromic_activation.pdf
Synaptic plasticity by antidromic firing during hippocampal ... - PNAS,https://www.pnas.org/doi/pdf/10.1073/pnas.1210735110
THE INTERACTION OF ANTIDROMIC AND ORTHO,https://journals.physiology.org/doi/pdf/10.1152/jn.1943.6.2.143
ANTIDROMIC ACTION POTENTIALS IN LATERAL GENICULATE ...,https://journals.physiology.org/doi/pdf/10.1152/jn.1957.20.2.167
BRAIN RESEARCH 353 ANTIDROMIC AND ORTHODROMIC ...,https://www.sciencedirect.com/science/article/pii/0006899371901089/pdf%3Fmd5%3D58c6811501b2c5879a005a5ac7789b2a%26pid%3D1-s2.0-0006899371901089-main.pdf
[PDF] SVT: Orthodromic or Antidromic? And why does that matter?,"https://www.derangedphysiology.com/files/Orthdromic%2520vs%2520antidromic%2520SVT,%2520and%2520why%2520it%2520matters.pdf"
[PDF] Antidromic and orthodromic responses evoked in cat cerebral cortex ...,https://scholarworks.montana.edu/xmlui/bitstream/handle/1/5187/31762100137668.pdf%3Bsequence%3D1
"[PDF] analysed. spike, frequently occurred. Thus, two responses, a small ...",https://www.ncbi.nlm.nih.gov/pmc/articles/PMC1331360/pdf/jphysiol01351-0164.pdf
[PDF] Neuronal cultures show bidirectional axonal conduction ... - bioRxiv,https://www.biorxiv.org/content/10.1101/2021.03.07.434278v3.full.pdf
Insights From a Pacing Model of Wolff-Parkinson-White Syndrome,https://www.ahajournals.org/doi/pdf/10.1161/01.RES.65.2.295%3Fdownload%3Dtrue
Physiological Substrate for Antidromic Reciprocating Tachycardia,https://www.ahajournals.org/doi/pdf/10.1161/01.CIR.85.2.574
Chapter 7. Antidromic facial nerve response - Taylor & Francis Online,https://www.tandfonline.com/doi/pdf/10.1080/00016480050180115
Initiation of antidromic reciprocating tachycardia - Heart Rhythm,https://www.heartrhythmjournal.com/article/S1547-5271(06)01244-6/pdf
Incidence and prognostic significance of spontaneous and inducible ...,https://academic.oup.com/europace/article-pdf/15/6/871/7534638/eus354.pdf
Selective Depressant Action of Antidromic Impulses on Gustatory ...,https://rupress.org/jgp/article-pdf/88/2/219/1249001/219.pdf
Antidromic Conduction in a Direct Posterior Pathway from Midbrain ...,https://www.karger.com/Article/Pdf/121510
Presynaptic Inhibition and Antidromic Spikes in Primary Afferents of ...,https://www.jneurosci.org/content/jneuro/21/3/1007.full.pdf
Antidromic Invasion of Spikes from a Cortical Epileptogenic Focus,https://www.science.org/doi/pdf/10.1126/science.176.4033.424
Alterations in the Antidromic Potential of Motor Neurons ... - Science,https://www.science.org/doi/pdf/10.1126/science.101.2625.412
