Electronic invoicing - Accounting Today,https://www.taxprotoday.com/tag/electronic-invoicing.rss
Electronic Team Serial to Ethernet Connector Updates Notification,https://www.electronic.us/rss/en-serial-over-ethernet.rss
[Audio] Nanostructured Electronic Devices: Percolation and Reliability,https://nanohub.org/resources/7168/feed.rss%3Fcontent%3Daudio
Product Catalog - Electronics - EMD Group,http://www.emd-performance-materials.com/en/product_finder.rss
Electronic Team SyncMate Expert Updates Notification,https://www.sync-mac.com/rss/en-syncmate.rss
Electronic Groove podcast,https://electronicgroove.com/Podcast/podcast.rss
Electronic Team USB Network Gate Updates Notification,https://www.net-usb.com/rss/en-usb-over-ethernet.rss
Electronic Team Commander One Updates Notification,https://ftp-mac.com/rss/jp-commander.rss
Electronic Team Elmedia Player Updates Notification,https://www.elmedia-video-player.com/rss/en-elmedia.rss
