THE MEANING OF THE SOUND OF RATTLING BY ... - Brill,https://brill.com/previewpdf/journals/beh/66/3-4/article-p252_3.xml%3FpdfJsInlineViewToken%3D1596472608%26inlineView%3Dtrue
no evidence that envenomation cues facilitate k - Brill,https://brill.com/downloadpdf/journals/amre/42/4/article-p491_8.xml
Rattlesnakes Geoffrey R. Smith David J. Wishart Project Team ...,http://plainshumanities.unl.edu/encyclopedia//doc/source/egp.pe.050.xml
"Comparison of isoflurane, sevoflurane, and desflurane as inhalant ...",https://avmajournals.avma.org/view/journals/javma/257/9/javma.257.9.945.xml
Thromboelastographic evaluation of dogs bitten by rattlesnakes ...,https://avmajournals.avma.org/downloadpdf/journals/ajvr/79/5/ajvr.79.5.532.xml
Facebook Live: What's Shaking in the Parks: Rattlesnakes!,https://parks.sonomacounty.ca.gov/x60632.xml
A 13-Year Study of A Northern Population of Twin-Spotted ...,https://journals.scholarsportal.info/details/07331347/v26i0001/1_a1soanpgrsac.xml
Growth Patterns of Dusky Pygmy Rattlesnakes (Sistrurus miliarius ...,https://journals.scholarsportal.info/details/07331347/v26i0001/58_gpodprmbfcf.xml
Antivenin and Antitoxin in the Treatment of Experimental ...,https://www.ajtmh.org/view/journals/tpmd/10/1/article-p75.xml
II. Microevolutionary Effects of Relaxed Selection From Rattlesnakes in,https://brill.com/view/journals/beh/124/1-2/article-p137_8.xml%3Flanguage%3Den
