Guideline Discordance and Patient Cost Responsibility in Medicare ...,https://jnccn.org/view/journals/jnccn/17/10/article-p1221.xml
Charivaris and Whitecapping in Nineteenth-Century North America in,https://brill.com/view/book/9789004243866/B9789004243866_004.xml
Bilateral neck exploration in patients with primary ...,https://eje.bioscientifica.com/view/journals/eje/170/5/719.xml
Monozygotic twins discordant for congenital adrenal hyperplasia ...,https://eje.bioscientifica.com/view/journals/eje/182/2/EJE-19-0249.xml
Treatment of Experimental Data with Discordant Observations,https://www.degruyter.com/view/j/msr.2012.12.issue-4/v10048-012-0020-y/v10048-012-0020-y.xml
Case Report: Birth Outcome and Neurodevelopment in Placental ...,https://www.ajtmh.org/view/journals/tpmd/100/3/article-p552.xml
Twin pairs showing discordance of phenotype in adult Gaucher's ...,https://qjmed.oxfordjournals.org/content/97/4/199.ref-links.xml
[PDF] Discordant serum lipid parameters,https://journals.scholarsportal.info/pdf/1476511x/v20inone/nfp_dslp.xml
Discordant vocals and blinding light in: Sound / image,https://www.manchesterhive.com/view/9781526149206/9781526149206.00011.xml
