Manifesto of Communist Party APK for Android Download,https://apkpure.com/manifesto-of-communist-party/honiware.manifest
Download Manifesto of Communist Party APK Full | ApksFULL.com,https://apksfull.com/amp-manifesto-of-communist-party/honiware.manifest
Manifesto of Communist Party 1.3 APK Download - Android Books ...,https://sv.apk-dl.com/manifesto-of-communist-party/honiware.manifest
NCPN - Facebook,https://www.facebook.com/NCPN.Manifest
Manifesto of Communist Party6 - أحدث إصدار لنظام Android - قم ...,https://apkgk.com/ar/honiware.manifest
Manifesto of Communist Party - Nejnovější Verze Pro Android ...,https://apkgk.com/cs/honiware.manifest
Télécharger Manifesto of Communist Party Gratuit sur PC (Windows ...,https://apktelechargersurpc.com/application/honiware.manifest
Manifesto of Communist Party Pour Android - Apk Télécharger,https://apk.support/app-fr/honiware.manifest
