"Incest, Classified in: Inner Asia Volume 23 Issue 1 (2021) - Brill",https://brill.com/view/journals/inas/23/1/article-p21_3.xml
"Incest: a crime of violence, 1840–1940 in - Manchester Open Hive",https://www.manchesteropenhive.com/view/9789198469912/9789198469912.00011.xml
The phenomenon of incest in Sweden over 250 years in,https://www.manchesteropenhive.com/view/9789198469912/9789198469912.00012.xml
Collection: Incest Survivors Resource Network International Papers,http://art.ericleasemorgan.com/sandbox/liam/src/ead/4101isrn.xml
Incest: The Father and The Male Therapist | Scholars Portal Journals,https://journals.scholarsportal.info/details/02659883/v06i0002/143_itfatmt.xml
Entry Incest - SAGE Knowledge,https://sk.sagepub.com/reference/the-sage-encyclopedia-of-marriage-family-couples-counseling/i6632.xml
'The word is incest' in: Incest in contemporary literature,https://www.manchesterhive.com/abstract/9781526122179/9781526122179.00011.xml
CRIMEN SOLLICITATIONIS: TABOOING INCEST AFTER THE ORGY,https://www.berghahnjournals.com/downloadpdf/journals/boyhood-studies/4/2/bhs040207.xml
Untitled,https://edition.cnn.com/video/data/3.0/video/politics/2021/09/07/abbott-abortion-rape-incest-response-texas-vpx.cnn/index.xml
