"Full text of ""San Francisco Cinematheque Program Notes""",https://archive.org/stream/sanfranciscocine00sanfrich/sanfranciscocine00sanfrich_djvu.txt
"Full text of ""San Francisco Cinematheque Program ... - Internet Archive",https://archive.org/stream/sanfranciscocine95sanfrich/sanfranciscocine95sanfrich_djvu.txt
AAS releases Cinémathèque sound bank for the Ultra Analog VA-1 ...,https://static.www.applied-acoustics.com/docs/AAS-Cinematheque-PressRelease.txt
"FOR IMMEDIATE RELEASE Date: November 23, 2004 THE ...",https://www.nirvanaclub.com/news/markey-press.txt
mm Canton wanted to the ez- Guns screen; the duo will throw a wine ...,https://ufdcimages.uflib.ufl.edu/AA/00/06/92/21/00444/00034.txt
In the Still of the Museum: Jean-Luc Godard's Sixty-Year Voyage,http://pmc.iath.virginia.edu/text-only/issue.906/17.1gavarini.txt
"aw, gee, what a bummer. i'll give any film with either Catherine ...",http://euler.stat.yale.edu/~tba3/class_data/aclImdb/train/unsup/15613_0.txt
"Sadness and nostalgia permeate Late Chrysanthemums, a 1954 ...",http://euler.stat.yale.edu/~tba3/class_data/aclImdb/test/pos/612_9.txt
0001047469-98-042533.txt - SEC.gov,https://www.sec.gov/Archives/edgar/data/61442/0001047469-98-042533.txt
100-battleship-potemkin.txt - cloudfront.net,https://d17h27t6h515a5.cloudfront.net/topher/2017/September/59ad991e_100-battleship-potemkin/100-battleship-potemkin.txt
