Accept License Agreement - XMOS,https://www.xmos.com/download/XMOS-xTIMEcomposer-(Windows)(9.2.2).msi
Support Software Downloads - M-Audio,https://m-audio.com/support/download/software/m-audioaxiomreasondirectlink-v1.0.0.msi
https://github.com/adobe/brackets/releases/downloa...,https://github.com/adobe/brackets/releases/download/release-1.4/Brackets.Release.1.4.msi
You are about to download 'sap-intelligent-rpa-2.0.28.40.msi',https://tools.hana.ondemand.com/additional/sap-intelligent-rpa-2.0.28.40.msi
Download TinTin++ Mud Client from SourceForge.net,https://downloads.sourceforge.net/tintin/WinTin%2B%2B%2520Windows%2520Installer/1.98.2/wintin%2B%2B.1.98.2.msi
Download Adaptive Typing Tutor from SourceForge.net,http://downloads.sourceforge.net/typing-tutor/typing-tutor-0.6.3.msi%3Fuse_mirror%3Dosdn
Free Edition of Netwrix Auditor for Active Directory,https://www.freeware1.com/download/65783/Netwrix_Change_Notifier_for_Active_Directory.msi
"Steam, The Ultimate Online Game Platform",https://store.steampowered.com/about/SteamInstall.msi
Intelligent Infrastructure for Retail - Zynstra - ncr software defined store,https://www.zynstra.com/protex/ProtexLoginApp.msi
Topics with Label: SupportAssistx64-3.4.0.200.msi - Dell Community,https://www.dell.com/community/forums/filteredbylabelpage/board-id/Support-Assist/label-name/supportassistx64-3.4.0.200.msi
