New and Pre-Owned Toyota Dealer - Freeway Toyota Blog,http://www.hanfordtoyota.com/blog/rss/index.xml
The Freeway Journey in - Berghahn Journals,https://www.berghahnjournals.com/view/journals/transfers/11/1/trans110103.xml
index.xml - CNN,https://www.cnn.com/video/data/3.0/video/us/2022/07/07/freeway-shootout-california-bay-area-affil-pkg-kgo-vpx.kgo/index.xml
Use of Crop Water Stress Index to Schedule Irrigation of Freeway ...,https://journals.ashs.org/hortsci/view/journals/hortsci/25/3/article-p302.xml
Collection: Barney Circle interstate bridge fight records,https://gwlibrary.wrlc.org/ead/ms2355.xml
Implementing Estimation of Capacity for Freeway Sections,https://projecteuclid.org/journals/journal-of-applied-mathematics/volume-2011/issue-SI1/Implementing-Estimation-of-Capacity-for-Freeway-Sections/10.1155/2011/941481.xml
Race and Revolt in the Modernist City by Eric Avila (review),https://journals.scholarsportal.info/details/19346832/v22i0001/104_tfotfrtmcbea.xml
doc4.xml - SEC.gov,https://www.sec.gov/Archives/edgar/data/1208091/000089924320026670/doc4.xml
primary_doc.xml - SEC Report,https://sec.report/Document/0001931737-22-000001/primary_doc.xml
