TREMENDOUS STORM IN NORTHWEST ATLANTIC in: Bulletin of ...,https://journals.ametsoc.org/view/journals/bams/10/2/1520-0477-10_2_52.xml
"TREMENDOUS SNOWSTORM IN PALESTINE, FEBRUARY 9–11 ...",https://journals.ametsoc.org/view/journals/mwre/48/2/1520-0493_1920_48_80b_tsipf_2_0_co_2.xml
sitemap_blogs_1.xml - Tremendous Leadership,https://tremendousleadership.com/sitemap_blogs_1.xml
Wetland Plants for Wastewater Treatment: A Tremendous ...,https://journals.ashs.org/hortsci/view/journals/hortsci/31/4/article-p594c.xml
The Dayton Agreement: A tremendous gamble in - Brill,https://brill.com/view/journals/joup/3/1/article-p2_.xml%3Flanguage%3Den
"“A Beautiful,Tremendous Russian Book, and OtherThingsToo” - Brill",https://brill.com/downloadpdf/journals/css/51/2-3/article-p376_10.xml
Editorial. Growing research: how neurosurgeons can lead the ...,https://thejns.org/focus/view/journals/neurosurg-focus/51/3/article-pE10.xml
Tremendous Earthquake in China | Scholars Portal Journals,https://journals.scholarsportal.info/details/00368733/v24i0026/406_teic.xml
Tremendous Breadth of Interests | Scholars Portal Journals,https://journals.scholarsportal.info/details/00145246/v106i0001/32_tboi.xml
FORM D - SEC.gov,https://www.sec.gov/Archives/edgar/data/1775745/000177574519000001/xslFormDX01/primary_doc.xml
