Radiopaque synthetic sponge as a prosthesis for microvascular ...,https://thejns.org/view/journals/j-neurosurg/65/4/article-p564.xml
Brain-tumor imaging using radiopaque perfluorocarbon in,https://thejns.org/view/journals/j-neurosurg/58/5/article-p650.xml
What Is Your Diagnosis? in - AVMA Journals,https://avmajournals.avma.org/view/journals/javma/243/1/javma.243.1.45.xml
What Is Your Diagnosis? in - AVMA Journals,https://avmajournals.avma.org/view/journals/javma/230/3/javma.230.3.345.xml
THE TRANSPORT OF RADIOPAQUE MEDIUM THROUGH THE ...,https://rep.bioscientifica.com/view/journals/rep/1/2/jrf_1_2_003.xml
Radiopaque Alginate Microcapsules for X-ray Visualization and ...,https://journals.scholarsportal.info/details/15438384/v03i0005/531_ramfxvaioct.xml
Radiopaque gauze migrating into the intestine – a case presentation ...,https://journals.scholarsportal.info/details/27196313/v66i0004/14_rgmitiacp.xml
Computed tomography as a problem solving tool in non-radiopaque ...,https://akjournals.com/view/journals/1646/6/1/article-p43.xml
Silver Nitrate Interpreted as Osseous Pathology on Radiographs in,https://japmaonline.org/view/journals/apms/106/6/15-063.xml
