Measurement of soil radioactivity levels and radiation hazard ...,https://akjournals.com/downloadpdf/journals/10967/283/2/article-p371.xml
Journal of Radioanalytical and Nuclear Chemistry - AKJournals,https://akjournals.com/view/journals/10967/283/2/article-p371.xml
interfluvial | diccionari.cat,https://www.diccionari.cat/EC-GDLC-e00078314.xml
Living with floods through geospatial approach: a case study of ...,https://journals.scholarsportal.info/details/25233963/v01i0004/nfp_lwftgaohdwbi.xml
Untitled,https://www.medrxiv.org/content/medrxiv/early/2022/05/23/2022.05.21.22275403.source.xml
The Atlantic Ocean and India - Oxford Bibliographies,https://www.oxfordbibliographies.com/view/document/obo-9780199730414/obo-9780199730414-0215.xml
Snow Cover and Spring Flood Flow in the Northern Part of Western ...,https://journals.ametsoc.org/downloadpdf/journals/hydr/12/6/jhm-d-11-017_1.xml
THE PELLA rEgION - Brill,https://brill.com/previewpdf/book/edcoll/9789004236103/B9789004236103_003.xml
Effects of Habitat Quality and Hunting Pressure on Arboreal ... - Brill,https://brill.com/downloadpdf/journals/ijfp/68/3-5/article-p199_8.xml
