Sesquiterpene Lactones and Bitterness in Korean Leaf Lettuce ...,https://journals.ashs.org/hortsci/view/journals/hortsci/44/2/article-p246.xml
The natural anti-inflammatory sesquiterpene lactone achillolide A ...,https://brill.com/view/journals/ijps/68/1-2/article-p107_107.xml
Short Communication The natural anti-inflammatory ... - Brill,https://brill.com/downloadpdf/journals/ijps/68/1-2/article-p107_107.xml
Simultaneous determination of seven sesquiterpene lactone ...,https://akjournals.com/view/journals/1326/31/4/article-p280.xml
Color and chemical reactions of selected sesquiterpene lactones ...,https://akjournals.com/downloadpdf/journals/1006/26/3/article-p289.xml
A New Eudesmane-Type Sesquiterpene from the Leaves ...,https://journals.scholarsportal.info/details/00093130/v54i0001/66_anesftlov.xml
[PDF] Molecular and Functional Evolution of the Spermatophyte ... - MDPI,https://journals.scholarsportal.info/pdf/14220067/v22i0012/nfp_mafeotsss.xml
Gametocytocidal Activity of the Antimalarial α/β Arteether against ...,https://www.ajtmh.org/view/journals/tpmd/43/6/article-p571.xml
ECAM Evidence-Based Complementary and Alternative Medicine ...,https://downloads.hindawi.com/journals/ecam/2013/163404.xml
Relationship between Levels of Sesquiterpene Lactones in Chicory ...,https://journals.ashs.org/jashs/view/journals/jashs/123/2/article-p326.xml
