Vaginitis | My Doctor Online - Kaiser Permanente,https://mydoctor.kaiserpermanente.org/mas/structured-content/Condition_Vaginitis.xml%3Fco%3D/regions/mas
Bacterial Vaginosis | My Doctor Online,https://mydoctor.kaiserpermanente.org/mas/structured-content/Condition_Bacterial_Vaginosis.xml%3Fco%3D/regions/mas
AN IMPROVED ARTIFICIAL VAGINA FOR COLLECTING RABBIT ...,https://rep.bioscientifica.com/view/journals/rep/7/3/jrf_7_3_016.xml
Anti-inflammatory effects of androgens in the human vagina in,https://jme.bioscientifica.com/view/journals/jme/65/3/JME-20-0147.xml
Primary Vaginal Mucinous Adenocarcinoma of Intestinal Type ...,https://ajcp.oxfordjournals.org/content/144/5/790.source.xml
"Funktionsmorphologische Untersuchungen an Vagina, Vulva ... - Brill",https://brill.com/view/journals/nema/29/2/article-p190_7.xml%3Flanguage%3Den
Introduction - PLOS,http://open-repository.kisti.re.kr/cube/bitstream/open_repository/95142/1/journal.pone.0000418.xml
Late G2 vagina toxicity in post-operative endometrial carcinoma is ...,https://journals.scholarsportal.info/pdf/1689832x/v10i0001/40_lgvtipfa2cov.xml
Vaginal resection and anastomosis for treatment of vestibulovaginal ...,https://avmajournals.avma.org/abstract/journals/javma/239/7/javma.239.7.972.xml
