High-energy pilon fractures management: State of the art in,https://eor.bioscientifica.com/view/journals/eor/1/10/2058-5241.1.000016.xml
Intra-articular fractures of the distal tibia - EFORT Open Reviews,https://eor.bioscientifica.com/view/journals/eor/2/8/2058-5241.2.150047.xml
Mid-Term Results of Minimally Invasive Plate Osteosynthesis and ...,https://japmaonline.org/view/journals/apms/107/1/14-120.xml
Lateral Transfibular Approach to Tibial Pilon Fractures: A Case ...,https://japmaonline.org/view/journals/apms/109/6/17-212.xml
Plafond luchtverhitters EC - LVECRO - Clima Construct,https://www.climaconstruct.be/documents/catalog-old/lvecro.xml%3Flang%3Den
search.xml - Benjamin Moore,http://media.benjaminmoore.com/WebServices/prod/colortrends2015ca/files/data/search.xml
1_fr_0_sitemap.xml - Ventilateurs de plafond,https://www.ventilateurs-plafond.com/1_fr_0_sitemap.xml
An Error by Jacob de Wit in: Oud Holland - Brill,https://brill.com/view/journals/oh/74/1/article-p58_13.xml%3Flanguage%3Den
Femur Length is Correlated with Isometric Quadriceps Strength in ...,https://ijspt.scholasticahq.com/article/35704.xml
