WAG 20-05-05: Reevaluating the Restriction - IDHS,https://www.dhs.state.il.us/page.aspx/FACT_1WhatIsVR.flv%3Fitem%3D17688
Boilermaker Union News and Updates | Page 110 | International ...,https://boilermakers.org/news/video.flv%3Fpage%3D109
Bad Sports | Stoked Wiki | Fandom,https://stoked.wikia.com/wiki/File:Stoked_Season_2_Episode_16_-_Bad_Sports.flv
"News 13 | Florida News Video | Orlando, Daytona Beach",https://ifasgallery.ifas.ufl.edu/poncho69/Pool-Safety-0608.flv
Young And Busty Ponytailed Blonde Ashli Decides To Show Her Hot ...,http://www.amandapics.com/news/7366691/Young_And_Busty_Ponytailed_Blonde_Ashli_Decides_To_Show_Her_Hot_Titties/galleries.payserve.com/1/34696/56115/images/joyce.flv
Amandla Stenberg: I'm Still Finding My Voice,https://www.nigeriasun.com/news/258101430/feb24v21.flv
Republican Advisers Weigh Trump Foreign Policy Risks,https://www.irishsun.com/news/243852805/oct04v56.flv
North Korea Ridicules UN Chief's Presidential Ambitions,https://www.northkoreatimes.com/news/250400683/oct04v56.flv
New Treatments Give Hope to People With Brain Tumors,https://www.ohiostandard.com/news/257618314/feb24v21.flv
