Evaluation of the mosquitoes Aedes aegypti and Culex pipiens ... - Brill,https://brill.com/view/journals/nemy/7/2/article-p281_13.xml%3Flanguage%3Den
Evaluation of the mosquitoes <i>Aedes aegypti</i> and <i ... - Brill,https://brill.com/downloadpdf/journals/nemy/7/2/article-p281_13.xml
1. Introduction - Hindawi.com,https://downloads.hindawi.com/journals/jtm/2012/598789.xml
The Rôle of Solutes and Colloids in the Nutrition of Anopheline ...,https://www.ajtmh.org/view/journals/tpmd/s1-12/3/article-p263.xml
Replication of dengue type 2 virus in Culex quinquefasciatus (Diptera,https://www.ajtmh.org/view/journals/tpmd/60/2/article-p319.xml
Research Article Diversity of Mosquito Vectors (Diptera: Culicidae ...,https://journals.scholarsportal.info/pdf/1687708x/v2012inone/nfp_domvcicpb.xml
Dirofilariosis in the Americas: a more virulent Dirofilaria immitis?,https://journals.scholarsportal.info/details/17563305/v6inone/288_ditaamvdi.xml
Early History of Laboratory Breeding of Aedes aegypti (Diptera,http://jme.oxfordjournals.org/content/47/6/957.ref-links.xml
biorxiv BIORXIV bioRxiv bioRxiv Cold Spring Harbor Laboratory ...,https://www.biorxiv.org/content/biorxiv/early/2020/06/23/2020.06.23.166694.source.xml
