Variation in incubation length and hatching asynchrony in Eastern ...,https://bioone.org/journals/ornithology/volume-138/issue-3/ukab031/Variation-in-incubation-length-and-hatching-asynchrony-in-Eastern-Kingbirds/10.1093/ornithology/ukab031.xml
Dawn song of eastern kingbirds: intrapopulation variability and ... - Brill,https://brill.com/view/journals/beh/144/10/article-p1273_8.xml%3Flanguage%3Den
Behavioral Information Provided By Two Song Forms of the Eastern ...,https://brill.com/view/journals/beh/120/1-2/article-p90_6.xml%3Flanguage%3Den
"KINGLETS Regulidae, BUSHTIT Aegithalidae, CREEPER Certhiidae",https://www.degruyter.com/princetonup/view/book/9780691184159/10.1515/9780691184159-172.xml
"ARISTOTLE, History of Animals, Volume III | Loeb Classical Library",https://www.loebclassics.com/view/LCL439/1991/pb_LCL439.577.xml
The American Crocodile in Florida Bay | Scholars Portal Journals,https://journals.scholarsportal.info/details/01608347/v22i0002/552_tacifb.xml
c9byfhmv.xml - Birds of North America,https://www.birds-of-north-america.net/c9byfhmv.xml
Hoplia equina (Coleoptera: Scarabaeidae) and Nontarget Capture ...,https://ee.oxfordjournals.org/content/34/1/158.source.xml
