[PDF] Use of navigation channels by Lake Sturgeon - Semantic Scholar,https://journals.scholarsportal.info/pdf/19326203/v12i0007/nfp_uoncblvoftss.xml
Channelized receiver platform of SDR based on FPGAs | Scholars ...,https://journals.scholarsportal.info/details/1523553x/v2inone/840_crposbof.xml
Physical Quality (Habitat)- State Hygienic Lab - The University of Iowa,http://www.shl.uiowa.edu/env/limnology/physicalquality.xml
tc-2021-338.xml - The Cryosphere - Copernicus.org,https://tc.copernicus.org/preprints/tc-2021-338/tc-2021-338.xml
Untitled,https://www.scirp.org/xml/78384.xml
The Re-construction of Nature: Postmodern Ecology and the ... - Brill,https://brill.com/previewpdf/book/edcoll/9789004333932/B9789004333932-s013.xml
Laboratory Investigation of the Impact of Lateral Spreading on ...,https://journals.ametsoc.org/downloadpdf/journals/phoc/43/12/jpo-d-12-0117.1.xml
Surficial Processes on Two Fluvially Dominated Alluvial Fans in ...,http://repository.azgs.az.gov/uri_gin/azgs/dlio/931/fgdc.xml
"Canals and Water Raceways of New Jersey, Series DGS08-1 ...",https://njdep.maps.arcgis.com/sharing/rest/content/items/2679728b13664ceab554a5aa5dbf6804/info/metadata/metadata.xml%3Fformat%3Ddefault%26output%3Dhtml
