Programma Dettagliato,https://aunicalogin.polimi.it/aunicalogin/getservizio.xml%3Fid_servizio%3D178%26c_classe%3D745896
EOF Calculations and Data Filling from Incomplete Oceanographic ...,https://journals.ametsoc.org/view/journals/atot/20/12/1520-0426_2003_020_1839_ecadff_2_0_co_2.xml
EOF Calculations and Data Filling from Incomplete ... - AMS Journals,https://journals.ametsoc.org/downloadpdf/journals/atot/20/12/1520-0426_2003_020_1839_ecadff_2_0_co_2.xml
"Acting Director, Federal Housing Finance Agency. - Govinfo.gov",https://www.govinfo.gov/content/pkg/FR-2013-01-11/xml/FR-2013-01-11.xml
biorxiv BIORXIV bioRxiv bioRxiv Cold Spring Harbor Laboratory ...,https://www.biorxiv.org/content/biorxiv/early/2020/08/05/2020.07.07.191189.source.xml
2021.09.27.461905.source.xml - bioRxiv,https://www.biorxiv.org/content/biorxiv/early/2022/01/22/2021.09.27.461905.source.xml
Theoretical Issues in Psychology: An Introduction - SAGE Books,https://sk.sagepub.com/books/theoretical-issues-in-psychology-2e/n2.xml
"Administrator, Agricultural Marketing Service. - US Government ...",https://www.gpo.gov/fdsys/pkg/FR-2013-04-25/xml/FR-2013-04-25.xml
Origin of DNA damage in ejaculated human spermatozoa,https://rep.bioscientifica.com/downloadpdf/journals/revreprod/4/1/31.xml
