AC electroosmosis micromixing on a lab-on-a-foil electric ...,https://journals.scholarsportal.info/details/09254005/v359icomplete/nfp_aemoalemd.xml
Microfluidic pump based on the phenomenon of electroosmosis of ...,https://journals.scholarsportal.info/details/16134982/v11i0006/675_mpbotpoeotsk.xml
Solution of Time Periodic Electroosmosis Flow with Slip Boundary,https://projecteuclid.org/journals/abstract-and-applied-analysis/volume-2014/issue-SI13/Solution-of-Time-Periodic-Electroosmosis-Flow-with-Slip-Boundary/10.1155/2014/789147.xml
AMSE Advances in Materials Science and Engineering 1687-8442 ...,https://downloads.hindawi.com/journals/amse/2021/6627331.xml
1. Introduction - Hindawi.com,https://downloads.hindawi.com/journals/jnt/2018/4018503.xml
Variables that Affect Performance in Planar Chromatography with ...,https://akjournals.com/view/journals/1006/14/6/article-p409.xml
Variables that Affect Performance in Planar ... - AKJournals,https://akjournals.com/downloadpdf/journals/1006/14/6/article-p409.xml
biorxiv BIORXIV bioRxiv bioRxiv Cold Spring Harbor Laboratory ...,https://www.biorxiv.org/content/biorxiv/early/2022/02/24/2020.09.25.310755.source.xml
biorxiv BIORXIV bioRxiv bioRxiv Cold Spring Harbor Laboratory ...,https://www.biorxiv.org/content/biorxiv/early/2020/02/26/2020.02.25.964809.source.xml
Data for semi-permanent cationic coating for protein separations,https://europepmc.org/articles/pmc7186883/bin/mmc1.xml
Nanoscience and Technology: An International Journal,http://www.dl.begellhouse.com/ixml/Volume3_Issue1-5fcbd1f94a8f765d.xml
Convection-Enhanced Delivery of Macromolecules to the Brain ...,http://d-scholarship.pitt.edu/cgi/export/10849/MODS/d-scholarship-10849.xml
https://www.168report.com/reports/893930/continuous-ambulatory ...,https://www.168report.com/sitemap/medical-devices-consumables78.xml
Effects of Ice Massage Prior to an Iontophoresis Treatment Using ...,https://journals.humankinetics.com/downloadpdf/journals/jsr/30/4/article-p538.xml
Journal Of Applied and Computational Sciences in Mechanics,https://mechanic-ferdowsi.um.ac.ir/index.php/mechanics/article/download/41691/sitemap.xml%3Fusr%26lang%3Den
sitemap_collections_1.xml - Platinum Chemicals,https://www.platinumchemicals.co.uk/sitemap_collections_1.xml
"Physical review. E, Statistical physics, plasmas, fluids, and related ...",http://static.lichtargelab.org/MeTeOR/MEDLINE/pubmed18n0974.xml
Applying Calcium Chloride Postharvest to Improve Highbush ...,https://journals.ashs.org/hortsci/abstract/journals/hortsci/28/10/article-p1033.xml%3Frskey%3DH3ammU
Liuming Yan Changle Shao Xiaobo Ji Evaluation of electroosmotic ...,https://dblp.uni-trier.de/rec/journals/jcc/YanSJ09.xml
Download,https://phmpt.org/wp-content/uploads/2022/05/FDA-CBER-2021-5683-0058829-to-0058954_125742_S1_M5_bnt162-01-S-define.xml
