Injured Sri Lanka skipper Mathews to fly home | Sport - News24,https://www.malaysiasun.com/news/251138755/oct04v40.flv
Four JDT players out of Malaysia squad for Asian Cup qualifier vs ...,https://www.malaysiasun.com/news/253467391/oct04v56.flv
5 infamous India-Australia controversies | Sport - News24,https://www.australianherald.com/news/251873425/oct04v56.flv
"With Morkel struggling, Maharaj key to Proteas cause | Sport - News24",https://www.australianherald.com/news/256902350/oct04v40.flv
Philander lukewarm on pink ball | Sport - News24,https://www.nigeriasun.com/news/249733119/oct04v40.flv
WATCH: All Blacks touch down in SA | Sport - News24,https://www.johannesburglife.com/news/258070575/oct04v56.flv
Erasmus among 'best in the world' - Matfield | Sport - News24,https://www.northkoreatimes.com/news/256620067/oct04v56.flv
"SuperSport cancels chat with trio of SA greats, Richards upset | Sport",https://www.beijingbulletin.com/news/259123170/feb24v21.flv
Granting Test status to Afghanistan a hasty decision: Azhar,https://www.centralasiatimes.com/news/257498325/feb24v21.flv
