213 Readers who know John Shepherd by sight will find some small ...,https://brill.com/downloadpdf/journals/nanu/22/1/article-p213_15.xml
Two Theological Readings in the Victorian Church of England - Brill,https://brill.com/downloadpdf/journals/hbth/43/2/article-p146_2.xml
"<emph>The Life of Josiah Henson, Formerly a Slave, Now an ...",https://docsouth.unc.edu/neh/henson49/henson49.xml
Is Regionalism Simply a Diversion? Evidence from the Evolution of ...,https://www.elibrary.imf.org/view/journals/001/1995/109/article-A001-en.xml
[PDF] Download PDF - IMF eLibrary - International Monetary Fund,https://www.elibrary.imf.org/downloadpdf/journals/001/1995/109/001.1995.issue-109-en.xml
Death and Resurrection in the Early Cold War - jstor,https://www.degruyter.com/transcript/downloadpdf/book/9783839417720/10.14361/transcript.9783839417720.335.xml
Social Measurement - SAGE Research Methods - Sage Publications,http://methods.sagepub.com/base/download/BookChapter/social-measurement/n2.xml
Ride through the pampas--Winter journey across the ... - Loc,https://tile.loc.gov/storage-services/service/gdc/calbk/110.xml
"George Washington Papers, Series 2, Letterbooks 1754-1799 - Loc",https://tile.loc.gov/storage-services/service/mss/mgw/mgw2/020/020.xml
Introduction: thinking with saints - manchester hive,https://www.manchesterhive.com/downloadpdf/9781526100221/9781526100221.00006.xml
A calm and sober enquiry concerning the possibility of a Trinity in ...,https://ota.bodleian.ox.ac.uk/repository/xmlui/bitstream/handle/20.500.12024/A44670/A44670.xml%3Fsequence%3D7%26isAllowed%3Dy
Emma - Austen Said - University of Nebraska–Lincoln,http://austen.unl.edu/xml/aus.005.xml
1. The Work of the Holy Spirit in Reference to Particular Persons — 2 ...,https://ccel.org/ccel/h/howe_john/howe05.xml
Christians are called to follow the Lord in all their endeavors ...,https://www.ccel.org/ccel/b/bruce/twelve.xml
Uncle Silas: a Tale of Bartram-Haugh - Moved Permanently,http://research.ucc.ie/celt/document/E860000-001.xml
"Arts, Faculty of English, Department of DSpace UBCV Das Gupta ...",https://open.library.ubc.ca/media/download/rdf-xml/831/1.0096547/0.xml
A Journal of a Voyage to the South Seas - New Zealand Electronic ...,http://nzetc.victoria.ac.nz/tei-source/ParJour.xml
The Endeavour Journal of Joseph Banks 1768–1771 [Volume One],http://nzetc.victoria.ac.nz/tei-source/Bea01Bank.xml
u_word_1.xml - PronounceHippo.com,https://www.pronouncehippo.com/pro-sitemaps/u_word_1.xml
szotabla_am_szo.xml,http://www.virtualismelleklet.hu/anyagok/jatek/nyelvtudor/data/szotabla_am_szo.xml
