What is the eligibility criteria to be a meteorologist? - Career Guide,http://www.counselling.meracareerguide.com/t/what-is-the-eligibility-criteria-to-be-a-meteorologist/6826.rss
What are the main work and responsibilities of a meteorologist?,http://www.counselling.meracareerguide.com/t/what-are-the-main-work-and-responsibilities-of-a-meteorologist/6201.rss
Let's Talk About the Weather - Buzzsprout,https://feeds.buzzsprout.com/1591498.rss
Ex-chief meteorologist reflects on WNWO cuts - Toledo Blade,https://www.toledoblade.com/TV-Radio/2017/01/18/Norm-Van-Ness-WNWO-TV-Channel-24-s-longtime-chief-meteorologist-was-brief-in-farewell-to-station/stories/feed/index.rss
The Met Éireann Podcast - RTE,https://audioboom.com/channels/4997901.rss
News - WCTV,https://www.wctv.tv/content/news/index.rss
Petersfield Weather with Richard Marks,https://www.omnycontent.com/d/playlist/6448c854-680b-440e-9f7c-a9dd007afaf1/d60a732c-6246-4205-8bf3-a9dd0081cf2b/cd8e5eaf-e713-4d1e-b659-aab901037b7b/podcast.rss
Ch. 13 meteorologist is on the move - The Toledo Blade,https://www.toledoblade.com/TV-Radio/2013/11/30/Ch-13-meteorologist-is-on-the-move/stories/feed/feed/index.rss
