Entry Venn Diagram - SAGE Reference - The SAGE Encyclopedia of ...,https://sk.sagepub.com/reference/socialscience/n1074.xml
Spirit and Voice: Toward a Feminist Pentecostal Pneumatology in,https://brill.com/view/journals/pneu/29/2/article-p189_2.xml%3Flanguage%3Den
"Populism Versus the New Globalization, written by Barrie Axford in",https://brill.com/view/journals/popu/aop/article-10.1163-25888072-bja10034/article-10.1163-25888072-bja10034.xml
Hinduism - Puruṣārthas - Oxford Bibliographies,https://www.oxfordbibliographies.com/view/document/obo-9780195399318/obo-9780195399318-0044.xml
Identification and Estimation of Dynamic Causal Effects in ...,https://sociorepec.org/publication.xml%3Fh%3Drepec:nbr:nberwo:24216%26l%3Den
googleXML_t.xml - National Bureau of Economic Research,https://www.nber.org/wwpinfo/googleXML_t.xml
International Contagion Effects from the Russian Crisis and the ...,https://www.elibrary.imf.org/view/journals/001/2002/074/article-A001-en.xml
An Ethnography of Sport Militarism at the Canada Army Run,https://journals.humankinetics.com/downloadpdf/journals/ssj/38/3/article-p276.xml
"In this article, Zacharias Ursinus exposits and expands question and ...",https://www.ccel.org/ccel/u/ursinus/gospel.xml
