Evaluation of Epicotyl Grafting on 25- to 55-day-old Pecan ...,https://journals.ashs.org/horttech/view/journals/horttech/25/3/article-p392.xml
Variation for Black Rot Resistance in Tronchuda Regenerated from ...,https://journals.ashs.org/hortsci/view/journals/hortsci/30/6/article-p1298.xml
Somatic embryogenesis from cultured epicotyls and primary leaves ...,https://journals.scholarsportal.info/details/10545476/v33i0002/88_sefceaplosmm.xml
A comprehensive view of epicotyl dormancy in Viburnum furcatum ...,https://journals.scholarsportal.info/details/09602585/v24i0004/281_acvoedwlsuts.xml
LIGHT-STIMULATED LEAF GROWTH ON INTACT AND EXCISED ...,https://brill.com/view/journals/ijps/47/3/article-p141_2.xml
Light-stimulated leaf growth on intact and excised bean plants ... - Brill,https://brill.com/view/journals/ijps/50/4/article-p265_4.xml%3Flanguage%3Den
"201.56-7 Lily family, Liliaceae. Kinds of seed: Asparagus, chives ...",https://www.ecfr.gov/api/versioner/v1/full/2022-02-14/title-7.xml%3Fchapter%3DI%26part%3D201%26section%3D201.56-7%26subchapter%3DK%26subject_group%3DECFR3d2232d54d37c47%26subtitle%3DB
biorxiv BIORXIV bioRxiv bioRxiv Cold Spring Harbor Laboratory ...,https://www.biorxiv.org/content/biorxiv/early/2019/08/19/738971.source.xml
BINDING OF OESTRADIOL TO RABBIT BLASTOCYSTS AND ITS ...,https://rep.bioscientifica.com/view/journals/rep/39/1/jrf_39_1_009.xml
