a case of thyroid storm with systemic thromboembolism in,https://edm.bioscientifica.com/view/journals/edm/2021/1/EDM20-0118.xml
Thrombin generation and fibrin clot structure after vitamin D ...,https://ec.bioscientifica.com/view/journals/ec/8/11/EC-19-0429.xml
Thrombosis in Pregnancy - My Doctor Online - Kaiser Permanente,https://mydoctor.kaiserpermanente.org/ncal/structured-content/Condition_Thrombosis_in_Pregnancy_-_MFM.xml%3Fco%3D/regions/ncal
Blood Clots and the Athlete: A Review of Deep Vein Thrombosis in ...,https://journals.humankinetics.com/previewpdf/journals/ijatt/12/4/article-p2.xml%3FpdfJsInlineViewToken%3D968603302%26inlineView%3Dtrue
xml - Govinfo.gov,https://www.govinfo.gov/bulkdata/BILLS/117/2/sres/BILLS-117sres571ats.xml
The influence of cerebrospinal fluid on blood coagulation and the ...,https://thejns.org/view/journals/j-neurosurg/130/4/article-p1244.xml
"Development of a recalcitrant, large clot burden, bifurcation ...",https://thejns.org/focus/view/journals/neurosurg-focus/42/4/article-pE6.xml
Competing Interest Statement - bioRxiv,https://www.biorxiv.org/content/biorxiv/early/2021/03/14/2021.03.13.435277.source.xml
Detection of Clot Retraction Through Changes of the Electrical ...,http://ajcp.oxfordjournals.org/content/56/6/713.source.xml
