Coastal Wetlands buffer delineation - Govinfo.gov,https://www.govinfo.gov/content/pkg/CZIC-qh87-3-s55-1987/xml/CZIC-qh87-3-s55-1987.xml
Acting Secretary of the Commission. - Govinfo.gov,https://www.govinfo.gov/bulkdata/FR/2006/07/FR-2006-07-03.xml
"Growth, Flowering, and Survival of Black-eyed Susan from Different ...",https://journals.ashs.org/horttech/downloadpdf/journals/horttech/11/1/article-p26.xml
sitemap.xml - Arkansas Native Plant Society,https://anps.org/sitemap.xml
Final report - US Government Publishing Office,https://www.gpo.gov/fdsys/pkg/CZIC-tc425-c37-n7-1994/xml/CZIC-tc425-c37-n7-1994.xml
Florida coastal ecological characterization - US Government ...,https://www.gpo.gov/fdsys/pkg/CZIC-hb3525-f6-f56-1983-v-2-pt-2/xml/CZIC-hb3525-f6-f56-1983-v-2-pt-2.xml
"Delineation of Natural Communities, A Checklist ... - IDEALS @ Illinois",https://www.ideals.illinois.edu/bitstream/handle/2142/10595/inhsbiodv01997i00002_tei.xml%3Fsequence%3D1%26isAllowed%3Dy
J - Ibiblio,https://www.ibiblio.org/webster/xml_files/gcide_j.xml
Translation of the Nyumon Saijiki - Japanese Text Initiative,http://jti.lib.virginia.edu/japanese/haiku/HigHaikDL.xml
Translation of the Nyumon Saijiki - Japanese Text Initiative,http://jti.lib.virginia.edu/japanese/haiku/HigHaik.xml
