"Chapter 6 That in Ancient Writers, the Words 'to Sing' Often Mean 'to ...",https://brill.com/view/book/edcoll/9789004465947/BP000099.xml
Chapter 8 History Declaimed: Rōkyoku Narrative Ballads by Nikkei ...,https://brill.com/view/book/9789004396395/BP000011.xml
Chapter 8: Economics of performers' rights in - Elgaronline,https://www.elgaronline.com/view/edcoll/9781849808521/9781849808521.00016.xml
statement of changes in beneficial ownership - SEC FORM 4,https://www.sec.gov/Archives/edgar/data/0000889971/000118143113019006/xslF345X03/rrd375216.xml
X0201 4 1998-07-09 0 0000778426 AEGIS COMMUNICATIONS ...,https://www.sec.gov/Archives/edgar/data/938919/000105077903000004/primary_doc.xml
"SENECA THE ELDER, Controversiae | Loeb Classical Library",https://www.loebclassics.com/view/seneca_elder-controversiae/1974/pb_LCL464.13.xml%3FreadMode%3Drecto
"AUSONIUS, The Daily Round | Loeb Classical Library",https://www.loebclassics.com/view/ausonius-daily_round/1919/pb_LCL096.25.xml%3FreadMode%3Drecto
Book Reviews in: TURBA Volume 1 Issue 1 (2022) - Berghahn ...,https://www.berghahnjournals.com/view/journals/turba/1/1/turba010117.xml%3Frskey%3DKuoXka%26result%3D7
The Future of Social Work: Seven Pillars of Practice - SAGE Books,https://sk.sagepub.com/books/the-future-of-social-work/i206.xml
"SENECA THE YOUNGER, Epistles | Loeb Classical Library",https://www.loebclassics.com/view/seneca_younger-epistles/1917/pb_LCL075.189.xml%3FreadMode%3Drecto
SEC FORM 4,https://www.sec.gov/Archives/edgar/data/778426/000105077903000004/xslF345X02/primary_doc.xml
