Untitled,https://www.govinfo.gov/content/pkg/BILLS-109hr5381enr/xml/BILLS-109hr5381enr.xml
Montana State and Federal Hatcheries - ArcGIS Online,https://www.arcgis.com/sharing/rest/content/items/2ab937688ba74deebd6a73a7383f1a3e/info/metadata/metadata.xml%3Fformat%3Ddefault%26output%3Dhtml
[PDF] Humpback whales feed on hatchery-released juvenile salmon,https://journals.scholarsportal.info/pdf/20545703/v04i0007/nfp_hwfohjs.xml
An Inventory of Parks and Wildlife Department Inland Fisheries ...,https://txarchives.org/tslac/finding_aids/20152.xml
Kamas State Fish Hatchery History,https://history.utah.gov/finding-aids/data/B01051/B1051.xml
Michigan and CDC trace backyard flocks to outbreaks,http://www.shl.uiowa.edu/publications/lablink/201901/michiganandcdctracebackyardflockstooutbreaks.xml
Untitled,https://app.leg.wa.gov/documents/billdocs/2015-16/Xml/Bills/House%2520Bills/1270.xml
ark:/67531/metadc788113/metadata.dc.xml - UNT Digital Library,https://digital.library.unt.edu/ark:/67531/metadc788113/metadata.dc.xml
"Chapter 7: Hatcheries, accelerators and incubators in - Elgaronline",https://www.elgaronline.com/view/9781782544623.00014.xml
