FORM D - SEC.gov,https://www.sec.gov/Archives/edgar/data/1837413/000183741320000001/xslFormDX01/primary_doc.xml
Observations of surface cobbles at two southern California beaches,https://journals.scholarsportal.info/details/00253227/v419icomplete/nfp_ooscatscb.xml
"Neoichnology of Chalk cobbles from north Norfolk, England",https://journals.scholarsportal.info/details/00167878/v128i0004/558_noccfneiftap.xml
Diver-operated suction sampling in Norwegian cobble grounds - Brill,https://brill.com/view/journals/cr/88/2/article-p184_5.xml%3Flanguage%3Den
Cobble in: Manchester - ManchesterHive,https://www.manchesterhive.com/view/9781526144133/9781526144133.00056.xml
Shoreline erosion and bluff stability along Lake ... - Govinfo.gov,https://www.govinfo.gov/content/pkg/CZIC-gb459-5-m5-s5-appendix-6/xml/CZIC-gb459-5-m5-s5-appendix-6.xml
Gallery Cobbles,http://www.fjcevolution.com.br/arq-08/wp-json/oembed/1.0/embed-8.xml
Table Summarizing Winter and Summer Grain Size Statistics ...,ftp://eclogite.geo.umass.edu/pub/stategeologist/BOEMData/Metadata/GrainSize_Summary.xml
Muck Problems in Subway Shield Tunneling in Sandy Cobble Stratum,https://www.degruyter.com/view/j/pomr.2016.23.issue-s1/pomr-2016-0062/pomr-2016-0062.xml
