My School ID - iPhone APP,https://iphone.apkpure.com/my-school-id/com.iak.msi
#Minecraftinstaller.msi | NewsBreak,https://www.newsbreak.com/topics/minecraftinstaller.msi
$100 Off MSI Coupon (3 Discount Codes) | Sep 2022,https://dealrated.com/store/us.msi
MSI Reviews And Details 2022 | Read Customer Feedback,https://dealrated.com/store-profile/us.msi
Mijnschoolinfo6 - أحدث إصدار لنظام Android - قم بتنزيل Apk,https://apkgk.com/ar/nl.arcamax.msi
"Kolom dr Rianti Maharani, Msi - Kompas.com",https://kolom.kompas.com/2499/dr.Rianti.Maharani.Msi
Motherboard Berstandar Militer ala MSI - Tekno Kompas,https://tekno.kompas.com/read/2011/06/01/21035673/Motherboard.Berstandar.Militer.ala.MSI
"Kolom Dr. Drs. I Ketut Suweca, M.Si - Kompas.com - Beranda",https://jawabsoal.live/baca-https-kolom.kompas.com/2781/dr.drs.i.ketut.suweca.msi
純正 買取 ホビージャパン パンデミック レガシー シーズン0 日本語 ...,http://delaware.alera.in/.msi
