Respiratory failure due to insufflated talc Gastric volvulus after ...,https://www.thelancet.com/pdfs/journals/lancet/PIIS0140-6736(97)24004-3.pdf
Pulmonary Retention and Translocation of Insufflated Tantalum,https://pubs.rsna.org/doi/pdf/10.1148/121.2.415
The recovery of gases insufflated at laparoscopy,https://obgyn.onlinelibrary.wiley.com/doi/pdf/10.1111/j.1471-0528.1984.tb05925.x
Effect of temperature of insufflated CO2 during and after prolonged ...,https://link.springer.com/content/pdf/10.1007/s004649900798.pdf
A Novel Technique for Localization of Occult Bronchopleural Fistulas,https://www.atsjournals.org/doi/pdf/10.1513/AnnalsATS.201212-126OT
Peritoneal Insufflation Facilitates CT-Guided Percutaneous ...,https://www.ajronline.org/doi/pdf/10.2214/AJR.16.16362
"PHARYNGEAL INSUFFLATION, A SIMPLE METHOD OF ...",https://jamanetwork.com/journals/JAMA/articlepdf/452154/jama_lviii_19_001.pdf
Carbon dioxide-insufflated colonoscopy - ScienceDirect.com,https://www.sciencedirect.com/science/article/pii/S0016510786718774/pdf%3Fmd5%3D3dac4bb74b2296f182327960fedf0217%26pid%3D1-s2.0-S0016510786718774-main.pdf
[PDF] Effect of carbon dioxide insufflation on free internal thoracic artery ...,http://www.jtcvs.org/article/S0022522303018932/pdf
High Flow Insufflation for the Maintenance of the ...,https://www.karger.com/article/pdf/198252
Effect of Abdominal Insufflation for Laparoscopy on Intracranial ...,https://jamanetwork.com/journals/SURG/articlepdf/1820447/sbr130012.pdf
[PDF] Distal projection of insufflated gas during tracheal gas ... - CiteSeerX,https://citeseerx.ist.psu.edu/viewdoc/download%3Fdoi%3D10.1.1.582.7795%26rep%3Drep1%26type%3Dpdf
Contained Power Morcellation Within an Insufflated Isolation Bag,https://journals.lww.com/greenjournal/Documents/Sept2014_JournalClub_Cohen.pdf
[PDF] The effect of heating insufflation gas on acid-base alterations and ...,http://ekja.org/upload/pdf/kjae-61-275.pdf
Cardiovascular Collapse Caused by Carbon Dioxide Insufflation ...,https://journals.sagepub.com/doi/pdf/10.1177/0310057X0203000117
Location of the Deep Epigastric Vessels in the Resting and ...,https://www.jmig.org/article/S1553-4650(16)30040-1/pdf
[PDF] CASE REPORT Gabapentin and Buprenorphine Nasal Insufflation ...,https://medicine.missouri.edu/sites/default/files/Case_report-Gabapentin_Buprenorphine.pdf
Fetal blood gases after in utero carbon dioxide insufflation for ...,https://www.ajogmfm.org/article/S2589-9333(21)00104-X/pdf
[PDF] a simple method to prevent direct airborne contamination during ...,https://www.cardiolinkgroup.com/wp-content/uploads/2017/02/Prevent-airborne-contamination.pdf
