"Solo gigolos, senile felines converge in a reversible year | The Blade",https://www.toledoblade.com/Print-Furniture/2002/01/21/Solo-gigolos-senile-felines-converge-in-a-reversible-year/stories/feed/index.rss
Malice and evidence | The Blade,https://www.toledoblade.com/Editorials/2017/05/18/Toledo-Blade-editorial-Malice-and-evidence/stories/feed/feed/index.rss
Off The Hook Radio - Audioboom,https://audioboom.com/channels/4955110.rss
The Blind Truth - Audioboom,https://audioboom.com/channels/4904163.rss
The Michael Savage Show - Megaphone,https://www.omnycontent.com/d/playlist/a7b0bd27-d748-4fbe-ab3b-a6fa0049bcf6/aaf310db-97a4-428f-bde6-a84e0041aabe/2247fc58-f667-4d2a-a67f-a84e0041c550/podcast.rss
Serious Issues: A Comic Book Podcast with Andrew Levins - Acast,http://www.omnycontent.com/d/playlist/0e353d3f-11cf-44ca-b469-a6c000a35649/0d0c72c3-87cd-4b5f-8dda-a818000e5081/de4622cd-af03-4106-823d-a818000e508f/podcast.rss
Fabrica de Agregate din Cheboksary - partener al Agropiese TGR,https://agro.md/ro/comments-1483.rss%3Fpage%3D5
The Glenn Beck Podcast - Megaphone,https://omny.fm/shows/the-glenn-beck-program/playlists/the-glenn-beck-podcast.rss
The White House Brief - Megaphone,https://omny.fm/shows/the-white-house-brief/playlists/podcast.rss
Professor Buzzkill History Podcast - Spreaker,https://pod.link/980285277.rss
