Few facts are known about the ancestor of my great-grandfather ...,https://www.familysearch.org/service/records/storage/das-mem/patron/v2/TH-904-74561-1033-89/dist.txt%3Fctx%3DArtCtxPublic
"Compiled by Amy Smith Hancock February 5, 1961 Sarah Wooding ...",https://www.familysearch.org/service/records/storage/das-mem/patron/v2/TH-232-36328-7-63/dist.txt%3Fctx%3DArtCtxPublic
9510972.txt - Veterans Affairs,http://www.va.gov/vetapp95/files3/9510972.txt
Linkenheil Meat Market - USGenWeb Archives,http://files.usgwarchives.net/ia/lyon/history/linkenhe.txt
Bachelor Party - Daily Script,https://www.dailyscript.com/scripts/Bachelor%2520Party.txt
Adverbs occurring four times each in the British National Corpus List ...,https://www.wordfrequency.info/samples/bnc_adv_4.txt
PAGE FOUR THE KEY WEST CITHEN ** Florida: Partly cloudy to ...,https://ufdcimages.uflib.ufl.edu/UF/00/04/86/66/00584/00096a.txt
The Little Glass Bottle By H. P. Lovecraft ------=-O-=------ “Heave to ...,https://www.schmalenstroer.net/books/H.P.%2520Lovecraft/H.P.%2520Lovecraft%2520-%2520The%2520Little%2520Glass%2520Bottle.txt
ABDITORY ABDUCENS ABDUCENT ABDUCTOR ABELMOSK ...,https://www.passcal.nmt.edu/~dthomas/apps/Secret%2520words/secret08.txt
