THE REGULATION OF ALTERNATIVE SPLICING ASSOCIATED ...,http://scholarsbank.uoregon.edu/xmlui/bitstream/1794/10335/5/Warf_Michael_Bryan_phd2009su.pdf.txt
Supplementary Material (ESI) for Molecular BioSystems This journal ...,http://www.rsc.org/suppdata/mb/c0/c002567b/c002567b_1.txt
Emerg Infect Dis EID Emerging Infectious Diseases 1080-6040 1080 ...,https://stacks.cdc.gov/view/cdc/16289/cdc_16289_DS8.txt
BVA9502482 DOCKET NO. 93-09 504 ) DATE ) ) On appeal from ...,http://www.va.gov/vetapp95/files1/9502482.txt
"BEGIN PRIVACY-ENHANCED MESSAGE----- Proc-Type: 2001,MIC ...",https://www.sec.gov/Archives/edgar/data/882509/000091412101000081/0000914121-01-000081.txt
Genomic instability at the locus of sterol C24-methyltransferase ...,https://europepmc.org/articles/pmc6375703/bin/pntd.0007052.s002.txt
"Pharmacology of DB844, an Orally Active aza Analogue of ...",https://kuscholarworks.ku.edu/bitstream/1808/13293/3/Thuita2012.pdf.txt
