"ETS 2 Mods, Euro Truck Simulator 2 Mods | ETS2Planet.net",https://ets2planet.net/wp-content/uploads/2020/08/Oversize_load_ETS_1.0.7z
"ETS 2 Mods, Euro Truck Simulator 2 Mods - ETS2Planet.net",https://ets2planet.net/wp-content/uploads/2021/12/dashboard_lights_renaultt_1.0.7z
UEFA Euro 2004 - Portugal (USA) Sony PlayStation 2 (PS2) ISO ...,https://www.romulation.net/PS2/UEFA-Euro-2004-Portugal-(U).7z
EURO PRICE Angol szótár DVD-M - Internet Archive,https://archive.org/details/d-51-hu-00608-0003.7z
Name Last modified Size - Internet Archive,https://archive.org/download/segaextremesportsv0.90020000703segapalbetagdrsegaextremesportbeta3label.7z
Grand Theft Auto Mods - GTALand.net - GTA Mods,https://gtaland.net/wp-content/uploads/2021/08/1559859632_m9dopplersapphire_GTALand.net.7z
GTA Mods | Grand Theft Auto Mods - GTALand.net,https://gtaland.net/wp-content/uploads/2020/06/1593283581_zebra_GTALand.net.7z
Impact of COVID-19 on Immunization Services for Maternal and ...,https://europepmc.org/articles/pmc7563512/bin/vaccines-08-00556-s001.7z
Forecasting the need for medical specialists in Spain - Europe PMC,https://europepmc.org/articles/pmc2987757/bin/1478-4491-8-24-s1.7z
