EURO—VISION - Audioboom,https://audioboom.com/channels/5050151.rss
The Athletic Women's Football Podcast: Euro Edition - Megaphone,https://audioboom.com/channels/5003651.rss
MesserSoft GmbH,https://www.messersoft.com/news.rss
Google | Accounting Today,https://www.taxprotoday.com/organization/google.rss
Kids Euro Festival: Recycled Butterflies Workshop - MZV,https://www.mzv.cz/washington/en/culture_events/culture/past_cultural_events/kids_euro_festival_recycled_butterflies.rss
SKODA AUTO to Lead INDIA 2.0 Project for 1 Bln. Euro - MZV,https://www.mzv.cz/newdelhi/en/bilateral_relations/skoda_auto.rss
"Dollar Recovers, Euro Area PMI Doesn't - Marc to Market",https://www.businessinsider.com/dollar-recovers-euro-area-pmi-doesnt-2012-5/comments.rss
Opinion on a proposal for a directive of the European Parliament ...,http://europa.eu/_feeds/feed_esb_en.rss
Euro oder Dollar? | Thailand Forum • HolidayCheck,https://www.holidaycheck.at/foren/topic/32364.rss
