Final Fantasy XI Online - Vana'diel Collection 2008 (USA) Sony ...,https://www.romulation.org/roms/PS2/Final-Fantasy-XI-Online-Vanadiel-Collection-2008-(U).7z
Underwater light climate and wavelength dependence of microalgae ...,https://europepmc.org/articles/pmc8496463/bin/peerj-09-12101-s008.7z
Staré Hry Na Stiahnutie :: DJ OldGames,https://www.starehry.eu/download/adventure/Full.Throttle-demo.7z
Návody - The Walking Dead - Episode 3: Long ... - Abecedaher.cz,http://abecedaher.cz/index.php/db_data/12/0000012335/trainer_8548_DS2_unlocker.7z%3Fpage%3Dnavod%26page2%3Dzobrazit%26id_hry%3D0000013273
SCHEMAT BEZPIECZNIKÓW XSARA II.7z - SCHEMATY - Prywatne ...,"http://chomikuj.pl/Ketras/POZOSTA*c5*81E/Prywatne/SCHEMATY/SCHEMAT%2BBEZPIECZNIK*c3*93W%2BXSARA%2BII,2046343122.7z"
Laboratoria Metody Pomiaru wysokieko napięcia przemiennego.7z ...,"http://chomikuj.pl/Ketras/POZOSTA*c5*81E/IM%2BLABORKI/Laboratoria%2B-%2BMetody%2BPomiaru%2Bwysokieko%2Bnapi*c4*99cia%2Bprzemiennego,2046549196.7z"
