The salmonella typhimurium reverse mutation assay. - Govinfo.gov,https://www.govinfo.gov/content/pkg/CFR-2018-title40-vol35/xml/CFR-2018-title40-vol35-sec798-5265.xml
Salmonella typhimurium reverse mutation assay. - Govinfo.gov,https://www.govinfo.gov/content/pkg/CFR-2018-title40-vol18/xml/CFR-2018-title40-vol18-sec79-68.xml
Physiological characterisation of an Azotobacter vinelandii nifU ...,https://femsle.oxfordjournals.org/content/175/2/185.ref-stubs.xml
Transformation of Revertant Murine Cells by 5-Azacytidine Results ...,https://akjournals.com/view/journals/030/52/3-4/article-p433.xml
TRANSFORMATION OF REVERTANT MURINE CELLS BY 5 ...,https://akjournals.com/downloadpdf/journals/030/52/3-4/article-p433.xml
biorxiv BIORXIV bioRxiv bioRxiv Cold Spring Harbor Laboratory ...,https://www.biorxiv.org/content/biorxiv/early/2018/09/09/412221.source.xml
biorxiv BIORXIV bioRxiv bioRxiv Cold Spring Harbor Laboratory ...,https://www.biorxiv.org/content/biorxiv/early/2020/09/19/2020.09.19.304683.source.xml
Author Summary - PLOS,http://open-repository.kisti.re.kr/cube/bitstream/open_repository/280747/1/journal.pntd.0004299.xml
medrxiv MEDRXIV medRxiv medRxiv Cold Spring Harbor ...,https://www.medrxiv.org/content/early/2021/10/03/2021.06.11.21258758.source.xml
