"Quantitative Research, Purpose of - SAGE Research Methods",https://methods.sagepub.com/reference/the-sage-encyclopedia-of-communication-research-methods/i11671.xml
Quantitative Research,https://methods.sagepub.com/reference/sage-encyc-qualitative-research-methods/n361.xml
Chapter 5 Using Biostatistics and Analyzing Quantitative Data in,https://publications.ashp.org/view/book/9781585285617/ch05.xml
Evaluation of Radar Quantitative Precipitation Estimates (QPEs) as ...,https://journals.ametsoc.org/view/journals/hydr/21/8/jhmD200033.xml
Quantitative Assessment of State-Dependent Atmospheric Motion ...,https://journals.ametsoc.org/view/journals/apme/58/11/jamc-d-19-0166.1.xml
"Qualitative, Quantitative, and Mixed Methods Research Sampling ...",https://www.oxfordbibliographies.com/view/document/obo-9780199756810/obo-9780199756810-0241.xml
Quantitative Analysis of Flavor and Other Volatiles and for Certain ...,https://journals.ashs.org/jashs/view/journals/jashs/116/2/article-p265.xml
Chapter 7: The perils of quantitative research in international law in,https://www.elgaronline.com/view/edcoll/9781788976367/9781788976367.00013.xml
Discovering statistics and developing a quantitative research design in,https://www.elgaronline.com/view/edcoll/9781788975629/9781788975629.00023.xml
QUANTITATIVE ANALYSIS OF DENGUE-2 VIRUS RNA DURING ...,https://www.ajtmh.org/view/journals/tpmd/74/1/article-p132.xml
Displaying Labeled Quantitative Data - Sciendo,https://www.degruyter.com/view/j/sc.2019.5.issue-2/sc-2019-0005/sc-2019-0005.xml
A Quantitative and Qualitative Assessment of Autistic Individuals on ...,https://journals.humankinetics.com/view/journals/apaq/2/1/article-p43.xml
Annex Selected Case Studies—Quantitative Analysis in - IMF eLibrary,https://www.elibrary.imf.org/view/books/071/00631-9781557755995-en/ch007.xml
Quantitative Methods for Classifying Writing Systems - ACL Anthology,https://aclanthology.coli.uni-saarland.de/papers/N06-2030/n06-2030.xml
Quantitative history in: The houses of history - ManchesterHive,https://www.manchesterhive.com/abstract/9781526153708/9781526153708.00011.xml
A Quantitative Approach To Medieval Muslim Biographical ... - Brill,https://brill.com/view/journals/jesh/13/1/article-p195_12.xml%3Flanguage%3Den
QUANTITATIVE ANALYSIS OF PORCINE SPERMATOZOA AND ...,https://rep.bioscientifica.com/view/journals/rep/19/1/jrf_19_1_007.xml
IMPLEMENTING QUANTITATIVE TECHNIQUES TO IMPROVE ...,https://akjournals.com/downloadpdf/journals/606/14/3/article-p223.xml
Microsurgical approaches to the cerebellar interpeduncular region,https://thejns.org/view/journals/j-neurosurg/aop/article-10.3171-2021.6.JNS204457/article-10.3171-2021.6.JNS204457.xml
An Annotated Bibliography of Quantitative Methodology Relating to ...,https://projecteuclid.org/journals/statistical-science/volume-4/issue-3/An-Annotated-Bibliography-of-Quantitative-Methodology-Relating-to-the-AIDS/10.1214/ss/1177012492.xml
