Negligible Unforced Historical Pattern Effect on Climate Feedback ...,https://journals.ametsoc.org/view/journals/clim/34/1/jcliD190941.xml
Forced and Unforced Decadal Behavior of the Interhemispheric SST ...,https://journals.ametsoc.org/view/journals/clim/33/9/jcli-d-19-0102.1.xml
Eighteen THE UNFORCED FLOWERS OF LIFE? RICHARD ... - Brill,https://brill.com/previewpdf/book/edcoll/9789401207294/B9789401207294-s021.xml
The 'Unforced force' of Religious Identification: Indonesian Hindu ...,https://brill.com/view/book/edcoll/9789004255685/B9789004255685-s009.xml
Untitled,https://edition.cnn.com/video/data/3.0/video/world/2021/08/14/peter-bergen-afghanistan-biden-unforced-error-smerconish-vpx-sot.cnn/index.xml
Forced and unforced variability of twentieth century North American ...,https://journals.scholarsportal.info/details/09307575/v37i5-6/1097_fauvotcnadap.xml
IO Module Events and Alarms - ComPacT NSX Modbus Comm UG,https://www.productinfo.schneider-electric.com/compactnsxmodbuscommug/compact-nsx-modbus-comm-ug/EN/BM_VEGA_IEC_Compact_NSX_Modbus_2c93c0c3_quasar_0000594002.XML.xml/%24/TPC_Master_NS_IO_Module_1_Events_2c93c0c3_quasar_0000593993.XML
Journal of Sports Science and Medicine,https://www.jssm.org/tablejssm-16-489.xml/table005.xml
Comparison of Athlete–Coach Perceptions of Internal and External ...,https://journals.humankinetics.com/downloadpdf/journals/ijspp/9/5/article-p751.xml
