"Territory Manager - Working Solutions, LLC",http://billstatus.ls.state.ms.us/members/house/bounds.xml
Bounds.xml,http://billstatus.ls.state.ms.us/2022/pdf/House_authors/Bounds.xml
Moment Bounds for Associated Sequences - Project Euclid,https://projecteuclid.org/journals/annals-of-probability/volume-16/issue-3/Moment-Bounds-for-Associated-Sequences/10.1214/aop/1176991684.xml
Bounds for the Distribution of the Generalized Variance,https://projecteuclid.org/journals/annals-of-statistics/volume-17/issue-4/Bounds-for-the-Distribution-of-the-Generalized-Variance/10.1214/aos/1176347387.xml
The Bounds of Myth - Brill,https://brill.com/abstract/book/edcoll/9789004448674/BP000003.xml
"Historicism Now: Historiographic Ontology, Epistemology and ... - Brill",https://brill.com/view/journals/jph/16/1/article-p92_4.xml
Upward Bound Director Temp (R) T18_032322_9637 - Kutztown ...,https://www.kutztown.edu/x9637.xml
"Parsing with Treebank Grammars: Empirical Bounds, Theoretical ...",https://aclanthology.coli.uni-saarland.de/papers/P01-1044/p01-1044.xml
openstreetmap-license-change/bounds.xml at master - GitHub,https://github.com/openstreetmap/openstreetmap-license-change/blob/master/bounds.xml
Chapter 10: The bounds between negligence and strict liability in,https://www.elgaronline.com/view/edcoll/9781789905977/9781789905977.00017.xml
4.3 Lower Bounds,https://hunch.net/~jl/projects/prediction_bounds/thesis/mathml/thesisse17.xml
6 PAC-Bayes bounds,https://hunch.net/~jl/projects/prediction_bounds/thesis/mathml/thesisch6.xml
Nursing Students Highlighted in Brockton Enterprise Story on ...,https://www.curry.edu/x1503.xml
"Men, Masculinity, and the Media - SAGE Books",https://sk.sagepub.com/books/men-masculinity-and-the-media/n14.xml
Bridging Mixture Model Estimation and Information Bounds Using I ...,https://journals.scholarsportal.info/details/1053587x/v65i0018/4821_bmmeaibui.xml
sitemap.xml - University of Northern Colorado,http://www.unco.edu/college-bound-colorado/sitemap.xml
ON LOWER AND UPPER BOUNDS FOR PROBABILITIES OF ...,https://akjournals.com/downloadpdf/journals/012/52/1/article-p102.xml
Improved bounds for the Erdős-Rogers function - Advances in ...,https://www.advancesincombinatorics.com/article/12048.xml
NTPsec ntpd process control Out of Bounds Read - Ixia Support,https://support.ixiacom.com/strikes/exploits/misc/cve_2019_6444_ntpsec_ntpd_process_control_oob_read.xml
Microsoft Edge Repeat Method Out of Bounds Memory Read,https://support.ixiacom.com/strikes/exploits/browser/cve_2017_0208_ms_edge_repeat_info_disclosure.xml
