Social Divisions - SAGE Knowledge,https://sk.sagepub.com/books/key-concepts-in-family-studies/n45.xml
Improved Historical Temperature and Precipitation Time Series for ...,https://journals.ametsoc.org/view/journals/apme/53/5/jamc-d-13-0248.1.xml
A Historical Perspective of US Climate Divisions in - AMS Journals,https://journals.ametsoc.org/view/journals/bams/77/2/1520-0477_1996_077_0293_ahpouc_2_0_co_2.xml
Dynamics of cytoplasm and cleavage divisions correlates with ...,https://rep.bioscientifica.com/view/journals/rep/155/1/REP-17-0230.xml
Revisiting Divisions of Labour - manchester hive,https://www.manchesterhive.com/view/9781526116239/9781526116239.xml
The Chapter and Section Divisions in Esther - Brill,https://brill.com/previewpdf/book/9789004285569/B9789004285569_009.xml
