Skilled America - Buzzsprout,https://feeds.buzzsprout.com/914734.rss
Subscribe on Android to Skilled Trades Playbook by At Your Best,https://subscribeonandroid.com/feeds.buzzsprout.com/398833.rss
Group hires manager to find skilled workers | The Blade,https://www.toledoblade.com/business/2016/08/02/Group-hires-manager-to-find-skilled-workers/stories/feed/index.rss
Training center to host skilled trades contest - The Toledo Blade,https://www.toledoblade.com/business/2014/04/10/Training-center-to-host-skilled-trades-contest/stories/feed/feed/index.rss
Blue Card - for highly-skilled jobs | Embassy of the Czech Republic ...,https://www.mzv.cz/singapore/en/visit_and_stay/long_term_stay_and_residency/blue_card.rss
Employee Card (long term residence permit for purpose of ... - MZV,https://www.mzv.cz/manila/en/visa_and_consular_services/visa_information/long_term_visa_stay_of_more_than_90_days/employee_card/employee_card_long_term_residence_permit.rss
The Skilled Dad - Megaphone,https://pod.link/1580267593.rss
The Sleep Is A Skill Podcast - Simplecast,https://pod.link/1501931597.rss
Immigration on the Canadian Prairies - Audioboom,https://audioboom.com/channels/5055823.rss
Election 2020 | Employee Benefit News,https://www.employeebenefitadviser.com/tag/election-2020.rss
