Glass Cage Podcast - Audioboom,https://audioboom.com/channels/5040837.rss
Cage-free eggs come with price - Toledo Blade,https://www.toledoblade.com/Opinion/Letters-to-the-Editor/2015/12/29/Letters-tot-the-editor-Cage-free-eggs-come-with-price/stories/feed/index.rss
Bad hair day at box office for Nicolas Cage | The Blade,https://www.toledoblade.com/Culture/2008/09/08/Bad-hair-day-at-box-office-for-Nicolas-Cage/stories/feed/index.rss
The Cage Free Chicks Podcast - Anchor,https://pod.link/1455669123.rss
The Infinite Monkey Cage - Subscribe by Email,https://www.subscribebyemail.com/podcasts.files.bbci.co.uk/b00snr0w.rss
We Gauge Cage - Buzzsprout,https://feeds.buzzsprout.com/143325.rss
"Using the QNAP TVS-951X as an example, whether you need a fast ...",https://sviko.com/t/do-you-really-need-a-fast-nas-in-a-digital-studio-finding-out-using-qnap-tvs-951x/83.rss
Synology UC3200 Review: affordable dual-controller iSCSI storage,https://sviko.com/t/synology-uc3200-review-dual-controller-iscsi-storage/135.rss
https://www.king-jouet.com/jeux-jouets/cage-foot-b...,https://www.king-jouet.com/jeux-jouets/cage-foot-baby-foot-ballon-euro-2021/3-ans/page1.rss
