Asymmetric Arbitrage and Default Premiums Between the US and ...,https://www.elibrary.imf.org/view/journals/024/2004/002/article-A003-en.xml
Guidance on Significant Price Discovery Contracts - Govinfo.gov,https://www.govinfo.gov/content/pkg/CFR-2009-title17-vol1/xml/CFR-2009-title17-vol1-part36-appA.xml
International Arbitration of Climate- Related Disputes - Brill,https://brill.com/previewpdf/book/edcoll/9789004447615/BP000022.xml%3FpdfJsInlineViewToken%3D447476021%26inlineView%3Dtrue
"Mutuality, reciprocity and justice within the context of a unified theory ...",https://www.elgaronline.com/view/edcoll/9781785363351/9781785363351.00012.xml
TEL Theoretical Economics Letters 2162-2078 Scientific Research ...,https://www.scirp.org/xml/70817.xml
"Les avantages pour l'Afrique de l'arbitrage transnational, moyen ...",https://www.manchesterhive.com/view/9781526151285/9781526151285.00019.xml
Market Madness? The Case of <i>Mad Money</i> - SocioRePEc,https://sociorepec.org/publication.xml%3Fh%3Drepec:inm:ormnsc:v:58:y:2012:i:2:p:351-364%26l%3Den
Assistant Secretary. - Federal Register,https://www.federalregister.gov/documents/full_text/xml/2022/04/06/2022-07193.xml
Règles de 1986 sur la procédure des comités d'arbitrage sur les ...,https://laws-lois.justice.gc.ca/fra/XML/DORS-86-787.xml
format XML - Thèses,https://www.theses.fr/2021PA020063.xml
