Optimal Javelin Release - Human Kinetics Journals,https://journals.humankinetics.com/downloadpdf/journals/jab/11/4/article-p371.xml
Release Parameter Contributions to New-Rules Javelin Throwing,https://journals.humankinetics.com/downloadpdf/journals/jab/7/2/article-p111.xml
FORM D - SEC.gov,https://www.sec.gov/Archives/edgar/data/1796219/000179621919000001/xslFormDX01/primary_doc.xml
FORM D - SEC.gov,https://www.sec.gov/Archives/edgar/data/1634258/000163425819000001/xslFormDX01/primary_doc.xml
A joint resolution relating to the disapproval of the proposed foreign ...,https://www.govinfo.gov/bulkdata/BILLSTATUS/115/sjres/BILLSTATUS-115sjres50.xml
First Day of School - AskAboutIreland.ie,http://ams2-aai-web-1.anu.net/learning-zone/primary-students/looking-at-places/louth/cuchulainn/first-day-of-school/index.xml
"Alternate OSD Federal Register Liaison Officer, Department of ...",https://www.federalregister.gov/documents/full_text/xml/2022/03/03/2022-04483.xml
"The Tepma and the Javelin in Pindar, Nemean vii 70-3, and Greek ...",https://journals.scholarsportal.info/details/00754269/v96inone/70_ttatjinv7aga.xml
Javelin/pom.xml at master · Davtux/Javelin - GitHub,https://github.com/Davtux/Javelin/blob/master/pom.xml
"Javelin Investments, LLC et al v. McGinnis et al - Govinfo.gov",https://www.govinfo.gov/metadata/granule/USCOURTS-txsd-4_05-cv-03379/USCOURTS-txsd-4_05-cv-03379-0/mods.xml
