WAG 07-02-15-a: Trusts Established on or After 08/11/93 - DHS,https://www.dhs.state.il.us/page.aspx/FACT_1WhatIsVR.flv%3Fitem%3D14936
"Volume XI, Issue XVII - December 2017 - IDHS",https://www.dhs.state.il.us/page.aspx/FACT_Intro.flv%3Fitem%3D99998
U.S. Slams European Plan To Help Iran Sidestep U.S. Sanctions,https://www.malaysiasun.com/news/258044043/oct04v56.flv
Republican Advisers Weigh Trump Foreign Policy Risks,https://www.irishsun.com/news/243852805/oct04v56.flv
"U.S. Faces Evolving, Emboldened Adversaries in Cyberspace ...",https://www.northkoreatimes.com/news/256993740/oct04v56.flv
"Merkel in Israel to Promote Tight Ties, as Differences Loom",https://www.israelherald.com/news/258078181/oct04v40.flv
EU Gears Up for Trade War as Populist Challenge Grows,https://www.madagascarsun.com/news/257470968/oct04v56.flv
Ninth Rhino Dies at New Kenyan Sanctuary - Voice of America,https://www.sierraleonetimes.com/news/257693174/oct04v40.flv
"Gabon - HE Mr. Emmanuel Issoze-Ngondet, Minister for Foreign Affairs",https://www.nigeriasun.com/news/248024179/oct04v56.flv
"SDF, Iraqis Defend Syrian Border Town from IS",https://www.polandsun.com/news/257587284/oct04v40.flv
