Chapter 51: A Theory of Individualism and Collectivism,https://sk.sagepub.com/reference/hdbk_socialpsychtheories2/n51.xml
Collectivism/Individualism - SAGE Reference - Encyclopedia of Identity,https://sk.sagepub.com/reference/identity/n38.xml
Sociological Individualism - Brill,https://brill.com/previewpdf/book/edcoll/9789004385122/BP000007.xml
Individualistic and Holistic Models of Collective Beliefs and the Role ...,https://brill.com/view/book/edcoll/9789004449602/BP000009.xml
Methodological Individualism - Sociology - Oxford Bibliographies,https://www.oxfordbibliographies.com/view/document/obo-9780199756384/obo-9780199756384-0092.xml
Chapter 8: Individualistic representation in the liberal century,https://www.elgaronline.com/view/edcoll/9781788977081/9781788977081.00015.xml
How Slam Dunks Affect Individualism and Optimism for Athletic ...,https://journals.humankinetics.com/view/journals/ijsc/2/1/article-p21.xml
INDIVIDUALISTIC ATTRIBUTES OF INFLATIONARY EXPECTATIONS,https://journals.scholarsportal.info/details/1011002x/v56i0002/275_iaoie_1.xml
Untitled,https://jspp.psychopen.eu/index.php/jspp/article/view/5221/5221.xml
Teaching and learning anthropology in an insecure environment in,https://www.berghahnjournals.com/view/journals/latiss/7/3/latiss070303.xml
"Individualism, intrigue and esprit de corps in: Exporting empire",https://www.manchesterhive.com/abstract/9781526118554/9781526118554.00011.xml
THE RISE AND FALL OF COMPETITIVENESS: Experimental ...,https://sociorepec.org/publication.xml%3Fh%3DRePEc:feb:natura:00579%26l%3Den
Reliability and correlations. - ClinMed International Library,https://clinmedjournals.org/articles/iaarm/international-archives-of-addiction-research-and-medicine-iaarm-6-033.xml
Neoliberalism in clinical social work practice: the benefits and ...,https://bristoluniversitypressdigital.com/view/journals/crsw/9/3/article-p339.xml
430773.xml - Biblioteka Nauki,https://bibliotekanauki.pl/articles/430773.xml
The Eastern heart and Galen's ventricle: a historical review of the ...,https://thejns.org/focus/view/journals/neurosurg-focus/23/1/foc-07_07_e3.xml
Understanding Perceptions of Abrupt Climate Change and Their ...,https://journals.ametsoc.org/downloadpdf/journals/wcas/3/1/2011wcas1081_1.xml
Assessing the Operationalization of Cultural Theory through Surveys ...,https://journals.ametsoc.org/downloadpdf/journals/wcas/12/4/WCAS-D-19-0103.1.xml
Collaborative therapeutic nursing relationships ... - Scholars.Direct,https://scholars.direct/Articles/nursing/jnp-4-049.xml%3Fjid%3Dnursing
Giddens's way with words in: The Third Way and beyond,https://www.manchesteropenhive.com/view/9781526137883/9781526137883.00016.xml
