“Levantine” and “Syrian” Climates in: Atlas of the Near East - Brill,https://brill.com/view/book/9789004345188/B9789004345188_004.xml
"Levantine Thinking In Egypt in: Egypt, Canaan and Israel - Brill",https://brill.com/view/book/edcoll/9789004210691/Bej.9789004194939.i-370_013.xml
The Sociopragmatics of Attitude Datives in Levantine Arabic in,https://akjournals.com/view/journals/2062/aop/article-10.1556-2062.2021.00527/article-10.1556-2062.2021.00527.xml
"Currents, Water Masses, Eddies and Jets in the Mediterranean ...",https://journals.ametsoc.org/view/journals/phoc/18/10/1520-0485_1988_018_1320_cwmeaj_2_0_co_2.xml
Circulation in the Eastern Levantine Basin Determined by Inverse ...,https://journals.ametsoc.org/view/journals/phoc/18/3/1520-0485_1988_018_0506_citelb_2_0_co_2.xml
2 Levantine Stylistic Practices in Collective Memory - De Gruyter,https://www.degruyter.com/chicago/view/book/9780226164427/10.7208/9780226164427-006.xml
Gulf of Antalya (Levantine Sea): a new locality for Ogyrides ...,https://journals.scholarsportal.info/details/17552672/v3inone/nfp_goasanlfom.xml
New records and range expansion of lessepsian migrants in the ...,https://journals.scholarsportal.info/details/17552672/v3inone/nfp_nrareoitlaas.xml
Creating Resources for Dialectal Arabic from a Single Annotation,https://aclanthology.org/C16-1326.xml
