Into the Jaws of Death - Brill,https://brill.com/previewpdf/book/edcoll/9789004212688/B9789004212688-s003.xml%3FpdfJsInlineViewToken%3D844089741%26inlineView%3Dtrue
"Letters and Diaries of Japanese Soldiers, 1940–1946 - Brill",https://brill.com/downloadpdf/journals/jaer/11/1-2/article-p65_6.xml
"Villasur, Pedro de (ca. late seventeenth century-1720) - Plains ...",http://plainshumanities.unl.edu/encyclopedia//doc/source/egp.ea.041.xml
SAGE Reference - Encyclopedia of Leadership,https://sk.sagepub.com/reference/leadership/n294.xml
Untitled,http://findingaids.library.umass.edu/ead/mums353.xml
Masculinity on Stage in - Berghahn Journals,https://www.berghahnjournals.com/view/journals/aspasia/13/1/asp130104.xml
"Aug. 1, 1777 - Jan. 20, 1778, from The Writings of George ... - Loc",https://tile.loc.gov/storage-services/service/mss/mgw/mgw3b/004/004.xml
"The Diaries of George Washington. Vol. 4. Donald Jackson, and ...",https://tile.loc.gov/storage-services/service/mss/mgw/mgwd/wd04/wd04.xml
"[PDF] The experience of occupation in the Nord, 1914–​18: Living with ...",https://www.manchesteropenhive.com/downloadpdf/9781526117816/9781526117816.00013.xml
The Political Cost of Dissent - ManchesterHive,https://www.manchesterhive.com/downloadpdf/9781526143440/9781526143440.00018.xml
