People Forget That - Buzzsprout,https://feeds.buzzsprout.com/758744.rss
San Francisco Damn Podcast with Dee Dee Lefrak - Anchor,https://feeds.buzzsprout.com/970294.rss
Phoning It In - Audioboom,https://audioboom.com/channels/4964380.rss
Emotions – The Why Files,https://whyfiles.org/category/grades-5-8/science-in-personal-and-social-perspectives/personal-health/emotions/feed/index.rss
Humor makes a return to buddy-cop genre in 'The Guard' | The Blade,https://www.toledoblade.com/Movies/2011/09/17/Movie-review-The-Guard/stories/feed/feed/index.rss
Untitled,https://prism.librarymanagementcloud.co.uk/wolverhampton/items.rss%3Fquery%3Dsubject%253A%2528Reducing%2Bdiets%2529%26facet%255B0%255D%3Dformat%253A%2522paperback%2522%26facet%255B1%255D%3Dsubject%253A%2522Reducing%2Bdiets%2522%26facet%255B2%255D%3Dsubjectdisp%253A%2522Health%2Band%2BWellbeing%2522%26facet%255B3%255D%3Dsubject%253A%2522Reducing%2Bexercises%2522
The Hanging Garden Radio Show from BFF.fm,https://data.bff.fm/shows/hanging-garden.rss
It's Been a Minute,https://pod.link/1250180134.rss
Watchdog on Wall Street - Spreaker,http://podcast.radioamerica.org/watchdog-on-wall-street.rss
The White House Brief - Megaphone,https://omny.fm/shows/the-white-house-brief/playlists/podcast.rss
BLOOD ON THE TRACKS Season 3: A Bob Dylan Story - Omny Studio,https://omnycontent.com/d/playlist/e73c998e-6e60-432f-8610-ae210140c5b1/267E7421-B017-44F0-AA83-AE3300346E78/F1CF97D9-5522-43DE-B558-AE3300346E82/podcast.rss
Why Is This Not a Movie? - Pod.casts - The Podcast Discovery Service,https://pod.casts.io/podcasts/why-is-this-not-a-movie.rss
TechByter Worldwide (formerly Technology Corner) with Bill Blinn,https://www.techbyter.com/rss/tc.rss
Video Games on Player FM,https://player.fm/featured/video-games.rss
