PROSTATISM - Urologic Clinics,https://www.urologic.theclinics.com/article/S0094-0143(05)70294-9/pdf
Pharmacologic Therapy for Prostatism - Mayo Clinic Proceedings,http://www.mayoclinicproceedings.org/article/S0025-6196(11)63528-3/pdf
UNRECOGNIZED PROSTATISM - JAMA Network,https://jamanetwork.com/journals/JAMA/articlepdf/314114/jama_148_11_011.pdf
NATURAL HISTORY OF PROSTATISM - ScienceDirect.com,https://www.sciencedirect.com/science/article/pii/S0090429597005050/pdf%3Fmd5%3Dc52410948614601dc7c860200b369cbb%26pid%3D1-s2.0-S0090429597005050-main.pdf
Prostatism,https://link.springer.com/content/pdf/10.1007/978-1-4757-2945-0_74.pdf
Symptoms and signs of prostatism as risk factors for prostatectomy,https://onlinelibrary.wiley.com/doi/pdf/10.1002/pros.2990160309
[PDF] Prostatism - Health conditions directory,http://conditions.health.qld.gov.au/HealthCondition/media/pdf/16/201/529/prostatism-v3
Assessment of prostatism: role of intravenous urography.,https://pubs.rsna.org/doi/pdf/10.1148/radiology.165.3.2446348
"effects of prostatic symptoms on spouses' quality of life, daily ...",https://academic.oup.com/fampra/article-pdf/18/6/610/9803515/180610.pdf
Excretory urography in patients with prostatism - American Journal ...,https://www.ajronline.org/doi/pdf/10.2214/ajr.147.5.957
