Articular impaction injuries in the lower limb in - EFORT Open Reviews,https://eor.bioscientifica.com/view/journals/eor/2/5/2058-5241.2.160072.xml
Drop Impactions in - AMS Journals - American Meteorological Society,https://journals.ametsoc.org/view/journals/apme/12/2/1520-0450_1973_012_0316_di_2_0_co_2.xml
Outcome of medical and surgical treatment of cecal impaction in ...,https://avmajournals.avma.org/abstract/journals/javma/231/9/javma.231.9.1378.xml
"Clinical signs, treatment, and prognosis for horses with impaction of ...",https://avmajournals.avma.org/abstract/journals/javma/243/11/javma.243.11.1596.xml
Impaction fracture of the lumbar vertebrae with dural tear in,https://thejns.org/view/journals/j-neurosurg/53/6/article-p765.xml
Impaction fracture of the lumbar vertebrae with dural tear,https://thejns.org/downloadpdf/journals/j-neurosurg/53/6/article-p765.xml
Femoral head mosaicplasty by direct anterior approach ... - SICOT-J,https://journals.scholarsportal.info/pdf/24268887/v7inone/nfp_fhmbdaiwpshd.xml
Dynamic Ulnar Impaction Syndrome in a Collegiate Baseball Player in,https://journals.humankinetics.com/view/journals/ijatt/19/3/article-p15.xml
Acute colonic impaction and faecaloma due to canine benign ...,https://akjournals.com/view/journals/004/69/1/article-p9.xml
