munch/config.xml at master · ariskoumis/munch · GitHub,https://github.com/ariskoumis/munch/blob/master/config.xml
The Fermented Food Podcast - FermUp,http://fermup.com/feed/fermuppodcast.xml
Shining a light on the Arabidopsis circadian clock - Scholars Portal ...,https://journals.scholarsportal.info/details/01407791/v40i0011/2571_salotacc.xml
image-sitemap-6.xml - SXSW,https://www.sxsw.com/image-sitemap-6.xml
References - ClinMed International Library,https://clinmedjournals.org/articles/ijsem/international-journal-of-sports-and-exercise-medicine-ijsem-5-144.xml
κυπριακη δημοκρατια κυπριακη δημοκρατια the cyprus gazette,http://cypruslibrary.moec.gov.cy/ebooks/The_Cyprus_Gazette_1920/files/search/searchtext.xml
Drākṣa: Imported Grape Wine or Chinese Rice Beer? - Brill,https://brill.com/downloadpdf/book/9789004417038/BP000014.xml
Salivary dysfunction caused by medication usage in - AKJournals,https://akjournals.com/view/journals/2060/107/2/article-p195.xml
Burāq depicted as Amanita muscaria in a 15th century Timurid ...,https://akjournals.com/view/journals/2054/3/2/article-p133.xml
