Bogus Stranger Paradigm - SAGE Knowledge,https://sk.sagepub.com/reference/humanrelationships/n62.xml
Encyclopedia of Survey Research Methods,https://methods.sagepub.com/reference/encyclopedia-of-survey-research-methods/n42.xml
How Do We Combat Bogus Medicines in the Age of the COVID-19 ...,https://www.ajtmh.org/view/journals/tpmd/103/4/article-p1360.xml
azure-cosmos-db-change-feed-dotnet-retail-sample/Bogus.xml at ...,https://github.com/Azure-Samples/azure-cosmos-db-change-feed-dotnet-retail-sample/blob/master/DataGenerator/bin/Debug/Bogus.xml
Tropical Cyclone Initialization with a Spherical High-Order Filter and ...,https://journals.ametsoc.org/view/journals/mwre/138/4/2009mwr2943.1.xml
Extra Extended DNS Error codes for DNSSEC status bogus - IETF,https://www.ietf.org/id/draft-carpay-extra-ede-codes-dnssec-bogus-00.xml
Using the bogus pipeline to investigate trait narcissism and well ...,https://journals.scholarsportal.info/details/01918869/v151icomplete/nfp_utbptitnaw.xml
Clogs in the bogus pipeline: Demand characteristics and social ...,https://journals.scholarsportal.info/details/00926566/v10i0001/69_citbpdcasd.xml
Untitled,https://edition.cnn.com/video/data/3.0/video/business/2020/08/16/the-origins-of-the-latest-bogus-birther-lie.cnn/index.xml
