[PDF] 4 The faces of modernity - Manchester Open Hive,https://www.manchesteropenhive.com/downloadpdf/9789198469943/9789198469943.00009.xml
The Caves of Qumran - Brill,https://brill.com/downloadpdf/book/edcoll/9789004316508/B9789004316508_001.xml
"Medieval Polemic, Romance Bibles, and the Castilian Works ... - Brill",https://brill.com/downloadpdf/journals/me/22/1-3/article-p113_6.xml
SAGE Reference - Handbook of Workplace Violence,https://sk.sagepub.com/reference/hdbk_workviolence/n22.xml
Effect of nitrogen top-dressing on winter wheat in - AKJournals,https://akjournals.com/view/journals/0806/33/2-3/article-p619.xml
Determination of the Risk Function for Survivors Using Beta Pert ...,https://www.degruyter.com/view/j/jok.2007.3.issue--1/v10040-008-0002-1/v10040-008-0002-1.xml
Transthoracic ultrasound-guided biopsy in the hands of chest ...,https://journals.scholarsportal.info/pdf/20018525/v06i0001/nfp_tubithocpasa.xml
sitemap-posttype-post.201712.xml - Dot Esports,https://dotesports.com/sitemap-posttype-post.201712.xml
post-sitemap2.xml - eSports,https://www.esports.com/en/post-sitemap2.xml
