Workforce and Transaction Summary - IDHS,https://www.dhs.state.il.us/page.aspx/FACT_Intro.flv%3Fitem%3D87954
WAG 22: Related Program Provisions - IDHS,https://www.dhs.state.il.us/page.aspx/FACT_1WhatIsVR.flv%3Fitem%3D18531
Top Republican Lawmaker Calls For Stronger U.S. Action Against ...,https://www.irishsun.com/news/257987129/oct04v56.flv
India Seals Deal for Russian Air Defense Systems During Putin Visit,https://www.indiagazette.com/news/258088693/feb24v21.flv
U.S. Calls On Russia To Comply With UN Sanctions On North Korea,https://www.orangecountysun.com/news/257786499/oct04v56.flv
Jordan: Small Step for Non-Citizen Children | Human Rights Watch,https://www.sierraleonetimes.com/news/258095749/oct04v56.flv
Kyle-Mertz - Holmes-Murphy-and-Associates-Inc - Business Record,https://businessrecord.com/Content/Default/Archives/Article/Kyle-Mertz---Age-27--Account-executive--Holmes-Murphy-and-Associates-Inc---/-3/988/flood.flv
Trump Signs Order Reimposing Sanctions On Iran - Radio Free ...,https://www.stpetersburgstar.com/news/257796220/feb24v21.flv
Cryptocurrency boom breathes life into ghost town | Fin24 - News24,https://www.beijingbulletin.com/news/256888996/oct04v56.flv
Europeans Intensify Lobbying to Preserve Iran Deal,https://www.belgiumsun.com/news/254885389/oct04v40.flv
