LIVE A LEGACY - Straight Talk on Life Lessons - Audioboom,https://audioboom.com/channels/5029790.rss
The Wake Up Call - Audioboom,https://audioboom.com/channels/4816769.rss
Truth Be Told VIP In Person or Virtual Story Gathering - Trauma ...,https://pod.link/illuminatedwithjennifer.rss
EFT Tapping Junction - Spreaker,https://pod.link/1461508588.rss
Sleep Science Podcast - Buzzsprout,https://feeds.buzzsprout.com/787211.rss
Clearing a New Path - Buzzsprout,https://feeds.buzzsprout.com/1836617.rss
