Chapter 14 Commonness and Rarity in Mountain Plants in - Brill,https://brill.com/view/book/9789047418689/B9789047418689_s017.xml
Timescales of population rarity and commonness in random ...,https://journals.scholarsportal.info/details/00405809/v69i0004/351_topracire.xml
Observations on Early Type of Brain Abscess Following Penetrating ...,https://thejns.org/view/journals/j-neurosurg/3/1/article-p7.xml
Untitled,https://www.biorxiv.org/content/biorxiv/early/2020/08/13/2020.08.12.247502.source.xml
Abstract - bioRxiv,https://www.biorxiv.org/content/biorxiv/early/2021/11/04/2021.11.03.467170.source.xml
Place of Research and Development Activity in the ... - Sciendo,https://www.degruyter.com/view/j/minib.2017.20.issue-2/minib.20.03.2016.10/minib.20.03.2016.10.xml
On the benefits and pitfalls of analogies for innovative design ...,http://d-scholarship.pitt.edu/cgi/export/22942/XML/d-scholarship-22942.xml
Conservative Management of Adolescents With Abnormal Cytology ...,https://jnccn.org/view/journals/jnccn/6/1/article-p101.xml
Closing Brackets with Recurrent Neural Networks - ACL Anthology,https://aclanthology.org/W18-5425.xml
