Bryological Notes : Bryophagy of Dawsonia superba Grev. by larvae ...,https://journals.scholarsportal.info/details/03736687/v18i0002/365_bn.xml
The liverworts of Greenland. Nordic Bryological Society - Sciendo,https://www.degruyter.com/view/j/cszma.2014.63.issue-3/cszma-2014-0021/cszma-2014-0021.xml
S. References and further reading - Brill,https://brill.com/downloadpdf/book/edcoll/9789004475434/back-3.xml
"King, Kathleen - AskAboutIreland.ie",http://ams2-aai-web-1.anu.net/reading-room/life-society/science-technology/irish-scientists/king-kathleen/index.xml
"A Rare Liverwort in the Mediterranean Area, Crossocalyx ... - BioOne",https://bioone.org/journals/cryptogamie-bryologie/volume-38/issue-3/v38.iss3.2017.275/A-Rare-Liverwort-in-the-Mediterranean-Area-iCrossocalyx-hellerianus-i/10.7872/cryb/v38.iss3.2017.275.xml
Anterior spinal artery aneurysm,https://thejns.org/downloadpdf/journals/j-neurosurg/53/4/article-p570.xml
Intracranial dermoid cyst in Goldenhar's syndrome,https://thejns.org/downloadpdf/journals/j-neurosurg/53/3/article-p408.xml
ec921bc2-5538-47ed-9e72-0d687b4ca4d3.xml - EIDC,https://catalogue.ceh.ac.uk/id/ec921bc2-5538-47ed-9e72-0d687b4ca4d3.xml%3Fformat%3Dgemini
Notes on Some Species of Colura (Lejeuneaceae ... - AKJournals,https://akjournals.com/view/journals/034/62/3-4/article-p393.xml
