On hating and despising legal philosophy - Elgaronline,https://www.elgaronline.com/downloadpdf/journals/jlp/46-1/jlp.2021.01.02.xml
I Despise Them! I Detest Them! Franchise Relocation and the ...,https://journals.humankinetics.com/view/journals/jsm/21/2/article-p194.xml
The Despised Doxa* Husserl and the Continuing Crisis of Western ...,https://brill.com/view/journals/rip/12/1/article-p21_3.xml%3Flanguage%3Den
CREATION OF THE DESPISED OTHER - Brill,https://brill.com/previewpdf/book/9789087906849/BP000007.xml
"The maligned, the despised and the ostracised in - ManchesterHive",https://www.manchesterhive.com/view/9781526118035/9781526118035.00016.xml
"The maligned, the despised and the ostracised in - ManchesterHive",https://www.manchesterhive.com/abstract/9781526118035/9781526118035.00016.xml
"ARISTOTLE, Politics | Loeb Classical Library",https://www.loebclassics.com/view/aristotle-politics/1932/pb_LCL264.449.xml%3Fresult%3D41%26rskey%3DkkiXia%26readMode%3Drecto
"PLATO, Gorgias | Loeb Classical Library",https://www.loebclassics.com/view/plato_philosopher-gorgias/1925/pb_LCL166.485.xml%3FreadMode%3Drecto
“I Always Did Despise the Irish”: Charlotte Perkins Gilman and ...,https://journals.scholarsportal.info/details/15403084/v53i0002/127_addticpgah.xml
A Word from the Word - Daily Feature - Dan Hayden,https://www.awordfromtheword.org/podcast.xml
Event Details - The State Theatre,http://www.thestatetheatre.com/events/e1619.xml
The Sociology of Childhood - SAGE Books,https://sk.sagepub.com/books/the-sociology-of-childhood-fourth-edition/i186.xml
A Hoosier's Opinion Of Walt Whitman [Review of Leaves of Grass ...,https://whitmanarchive.org/criticism/reviews/tei/anc.00049.xml
"The Tudors, the Reformation and the Start of Plantation",http://ams2-aai-web-1.anu.net/learning-zone/secondary-students/history/history-of-ireland-overview/the-tudors-the-reformatio/index.xml
sitemap.xml - MMA Junkie,https://mmajunkie.usatoday.com/sitemap.xml%3Fyyyy%3D2016%26mm%3D06%26dd%3D08
God Save the King - Digital Victorian Periodical Poetry - University of ...,https://dvpp.uvic.ca/xml/blackwoods/1830/pom_10191_god_save_the_king.xml
