Early effects of androgen deprivation on bone and mineral ...,https://eje.bioscientifica.com/view/journals/eje/183/2/EJE-20-0348.xml
Sleep Deprivation Training to Reduce the Negative Effects of Sleep ...,https://journals.humankinetics.com/view/journals/ijspp/17/3/article-p499.xml
Deprivation as Un-Experienced Harm? in - Brill,https://brill.com/view/journals/soan/27/5-6/article-p469_1.xml%3Flanguage%3Den
Entry Group Relative Deprivation - SAGE Knowledge,https://sk.sagepub.com/reference/the-sage-encyclopedia-of-political-behavior/i5199.xml
CLO22-049: Major Adverse Cardiovascular Events Risk After ...,https://jnccn.org/view/journals/jnccn/20/3.5/article-pCLO22-049.xml
Host Deprivation Effects on the Functional Response and Parasitism ...,https://bioone.org/journals/journal-of-economic-entomology/volume-114/issue-5/toab144/Host-Deprivation-Effects-on-the-Functional-Response-and-Parasitism-Rate/10.1093/jee/toab144.xml
Deprivation in: Bordering intimacy - Manchester Open Hive,https://www.manchesteropenhive.com/view/9781526146946/9781526146946.00012.xml
[PDF] Altered hippocampal transcriptome dynamics following sleep ...,https://journals.scholarsportal.info/pdf/17566606/v14inone/nfp_ahtdfsd.xml
"Sleep patterns, fatigue, and working hours among veterinary house ...",https://avmajournals.avma.org/abstract/journals/javma/aop/javma.21.05.0234/javma.21.05.0234.xml
