Decoding Anagrammed Texts Written in an Unknown Language and ...,https://aclanthology.org/Q16-1006.xml
Transactions of the Association for Computational Linguistics ...,https://aclanthology.org/volumes/Q16-1.xml
How to Solve a Cryptic Crossword,http://cairo.lti.cs.cmu.edu/~hector/wikihow_xml/categorized/Hobbies%2520and%2520Crafts/Games/Puzzles%2520and%2520Memory%2520Games/Crossword%2520Puzzles/Solve-a-Cryptic-Crossword.html.xml
Shakespeare's Twelfth Night wordplay in - Manchester Open Hive,https://www.manchesteropenhive.com/view/9781526137104/9781526137104.00012.xml
[PDF] Shakespeare's Twelfth Night wordplay - Manchester Open Hive,https://www.manchesteropenhive.com/downloadpdf/9781526137104/9781526137104.00012.xml
Manuel Ponce - Music - Oxford Bibliographies,https://www.oxfordbibliographies.com/view/document/obo-9780199757824/obo-9780199757824-0296.xml
NARRATIVE ILLUSTRATION TECHNIQUES AND THE MUTE ... - Brill,https://brill.com/downloadpdf/journals/erc/5/1/article-p56_6.xml
Kircher's Bohemia: Jesuit Networks and Habsburg Patronage in the ...,https://brill.com/downloadpdf/journals/erl/5/2/article-p163_163.xml
4kNZ7QfK.xml - Word-Game-World.com,https://www.word-game-world.com/4kNZ7QfK.xml
