Ornis Scandinavica Becomes Journal of Avian Biology,https://journals.scholarsportal.info/details/00305693/v24i0004/339_osbjoab.xml
Hitchhikers' guide to analysing bird ringing data - Sciendo,https://sciendo.com/view/journals/orhu/24/1/article-p172.xml
Population trends of common breeding and wintering birds in ...,http://www.degruyter.com/view/j/orhu.2012.20.issue-2/orhu-2013-0007/orhu-2013-0007.xml
Raptors are still affected by environmental pollutants: Greenlandic ...,http://www.degruyter.com/view/j/orhu.2018.26.issue-2/orhu-2018-0026/orhu-2018-0026.xml%3Fformat%3DINT%3B
8””” - AMS Journals,https://journals.ametsoc.org/downloadpdf/journals/mwre/48/4/1520-0493_1920_48_214a_arfbwt_2_0_co_2.xml
ORNIS POUTIC 150 G - - Commandez en ligne,https://www.apodenys.be/documents/catalog/0065235.xml%3Flang%3Dfr
Relationship Between Laying Order and Egg Dimensions in the ...,http://rcin.org.pl/Content/55525/url-publication.xml
Head morphological variation in Podarcis muralis and Podarcis sicula,https://brill.com/view/journals/amre/28/4/article-p566_14.xml%3Flanguage%3Den
