Chapter 6 Problems in Applying the Treaties: Ambassadors and ...,https://brill.com/view/book/9789004443761/BP000007.xml
Introduction in: Beyond Ambassadors,https://brill.com/view/book/edcoll/9789004438989/BP000001.xml
The Autism Ambassadors Handbook: Peer Support ... - SAGE Books,https://sk.sagepub.com/books/the-autism-ambassadors-handbook/n5.xml
CQ Press - The U.S. Constitution A to Z - SAGE Knowledge,https://sk.sagepub.com/cqpress/the-us-constitution-a-to-z-2e/n12.xml
"Academic ambassadors, Pacific allies - manchester hive",https://www.manchesterhive.com/view/9781526128980/9781526128980.xml
The Ambassador,http://washington.itamaraty.gov.br/en-us/the_ambassador.xml
Warhawk Ambassadors - UW-Whitewater,https://www.uww.edu/x97311.xml
The Role of Ambassadors for the IMC Strategies of Major Event ...,https://journals.humankinetics.com/previewpdf/journals/jsm/31/5/article-p528.xml
Ambassador Program expands into STEM,http://www.shl.uiowa.edu/publications/lablink/201408/ambassador.xml
