Myostatin inhibits myosatellite cell proliferation and consequently ...,https://joe.bioscientifica.com/view/journals/joe/215/1/177.xml
Myostatin inhibits myosatellite cell proliferation and consequently ...,https://joe.bioscientifica.com/downloadpdf/journals/joe/215/1/177.xml
"704 the Society. Consequently, in some stories, the identities of the ...",https://brill.com/previewpdf/journals/jjs/6/4/article-p704_704.xml%3FpdfJsInlineViewToken%3D1123149508%26inlineView%3Dtrue
"Correction: A survey of negative mental health outcomes, workplace ...",https://avmajournals.avma.org/view/journals/javma/260/2/javma.260.02.168.xml
A Constant Pressure Upper Boundary Formulation for Models ...,https://journals.ametsoc.org/view/journals/mwre/aop/MWR-D-21-0328.1/MWR-D-21-0328.1.xml
Results of Decompression Operation for Trigeminal Neuralgia in,https://thejns.org/view/journals/j-neurosurg/11/5/article-p499.xml
Graduate Program Overview | Duquesne University,https://www.duq.edu/x3467.xml
Influenza Protection - County Of Sonoma - CA.gov,https://sonomacounty.ca.gov/x63258.xml
“Like a child in their debt and consequently their slave ... - De Gruyter,https://www.degruyter.com/penn/downloadpdf/book/9780812207224/10.9783/9780812207224.53.xml
