[PDF] Alliin in Garlic - UC ANR,https://ucanr.edu/datastoreFiles/234-199.pdf
"[PDF] Allicin, an Antioxidant and Neuroprotective Agent, Ameliorates ...",https://www.mdpi.com/2076-3921/11/1/87/pdf
[PDF] Therapeutic Potential of Allicin and Aged Garlic Extract in ... - MDPI,https://www.mdpi.com/1422-0067/23/13/6950/pdf
"Efficacy of allicin, the reactive molecule of garlic, in inhibiting ...",https://academic.oup.com/jac/article-pdf/53/5/832/2237997/dkh174.pdf
"Allicin, a naturally occurring antibiotic from garlic, specifically inhibits ...",https://febs.onlinelibrary.wiley.com/doi/pdf/10.1016/0014-5793%252890%252980647-2
"[PDF] Enzyme Inhibition by Allicin, the Active Principle of Garlic - NCBI",https://www.ncbi.nlm.nih.gov/pmc/articles/PMC1216205/pdf/biochemj00855-0175.pdf
Low Allicin Release from Garlic Supplements: a Major Problem Due ...,https://pubs.acs.org/doi/pdf/10.1021/jf001287m
"Allicin, the Antibacterial Principle of Allium sativum. I. Isolation ...",https://pubs.acs.org/doi/pdf/10.1021/ja01239a048
Allicin from garlic strongly inhibits cysteine proteinases and ...,https://journals.asm.org/doi/pdf/10.1128/AAC.41.10.2286
[PDF] Allicin - Santa Cruz Biotechnology,http://datasheets.scbt.com/sc-202449.pdf
[PDF] Review of Toxicity of Allicin From Garlic - Juniper Publishers,https://juniperpublishers.com/oajt/pdf/OAJT.MS.ID.555647.pdf
"[PDF] Antibacterial activity of a new, stable, aqueous extract of allicin ...",https://www.researchgate.net/profile/Houda_Kawas/post/What-are-the-biomedical-application-of-MRSA-virus/attachment/59d63e1d79197b807799ac94/AS%253A422572576776192%25401477760561964/download/British-Journal-Of-Biomedical-Science-Allicin-vs-MRSA.pdf
The Effect of Allicin from Garlic on Tumor Growth* - AACR Journals,https://aacrjournals.org/cancerres/article-pdf/20/4/431/2375899/cr0200040431.pdf
Antibacterial Activity of Allicin Alone and in Combination ... - Nature,https://www.nature.com/articles/ja200745.pdf%3Fproof%3Dt%2529Nature
"[PDF] Allicin inhibits cell polarization, migration and division via its direct ...",https://www.weizmann.ac.il/immunology/Geiger/sites/mcb.Geiger/files/Prager%2520M%2520Cell%2520Motil%252007%2520300.pdf
[PDF] effects of allicin on cardiovascular risk Factors in spontaneously ...,https://www.ima.org.il/filesupload/imaj/0/52/26271.pdf
Allicin induces apoptosis through activation of both intrinsic and ...,https://www.spandidos-publications.com/10.3892/mmr.2018.8552/download
Thermostability of Allicin Determined by Chemical and Biological ...,https://www.tandfonline.com/doi/pdf/10.1271/bbb.80381
"Effect of Purified Allicin, the Major Ingredient ofFreshly Crushed ...",https://www.tandfonline.com/doi/pdf/10.1207/S15327914NC382_14
[PDF] Antimicrobial properties of allicin from garlic - CiteSeerX,https://citeseerx.ist.psu.edu/viewdoc/download%3Fdoi%3D10.1.1.1043.1282%26rep%3Drep1%26type%3Dpdf
