Tansley Review No. 30. The Phytoplanktonic Ways of Life - jstor,https://www.jstor.org/stable/2557308
A dynamic regulatory model of phytoplanktonic acclimation to light ...,https://aslopubs.onlinelibrary.wiley.com/doi/pdfdirect/10.4319/lo.1998.43.4.0679
"[PDF] The comparative estimation of phytoplanktonic, microphytobenthic ...",https://horizon.documentation.ird.fr/exl-doc/pleins_textes/pleins_textes_5/b_fdi_31-32/34226.pdf
Phytoplanktonic Sources of Volatile Aldehydes in the River RhBne ...,https://www.sciencedirect.com/science/article/pii/027277149190035A/pdf%3Fmd5%3D0beb4f3e3e587ffca067382492d5f7de%26pid%3D1-s2.0-027277149190035A-main.pdf%26_valck%3D1
Trophic coupling between bacterial and phytoplanktonic ...,https://www.int-res.com/articles/ame/15/a015p025.pdf
Optical properties of diverse phytoplanktonic species: experimental ...,https://academic.oup.com/plankt/article-pdf/10/5/851/7569375/10-5-851.pdf
Macroaggregates and their phytoplanktonic components in the ...,https://academic.oup.com/plankt/article-pdf/8/3/475/4302204/8-3-475.pdf
[PDF] Phytoplanktonic life in boreal humic lakes - CORE,https://core.ac.uk/download/pdf/14926904.pdf
Dissolved Organic Matter and Phytoplanktonic Productivity in Marl ...,https://www.tandfonline.com/doi/pdf/10.1080/05384680.1968.11903859
[PDF] Phytoplanktonic DOC and POC production in the Bransfield and ...,http://polarphytoplankton.ucsd.edu/docs/protocols/literature/Moran%2526Estrada_DSRII_2002.pdf
