On hating and despising legal philosophy - Elgaronline,https://www.elgaronline.com/view/journals/jlp/46-1/jlp.2021.01.02.xml
The Double Structure of Misogyny in Stephen King's Carrie in ... - Brill,https://brill.com/view/book/edcoll/9781848880054/BP000006.xml
Introduction in: Hating Girls - Brill,https://brill.com/view/book/9789004467002/BP000001.xml%3Flanguage%3Den
A Review of Loving + Hating Mathematics: Challenging the Myths of ...,https://pubs.nctm.org/view/journals/jrme/43/4/article-p494.xml
Hating Everything - Berghahn Journals,https://www.berghahnjournals.com/downloadpdf/journals/girlhood-studies/4/1/ghs040106.xml
Hating Everything in: Girlhood Studies Volume 4 Issue 1 (2011),https://www.berghahnjournals.com/view/journals/girlhood-studies/4/1/ghs040106.xml
"MENANDER, Misoumenos (The Hated Man) | Loeb Classical Library",https://www.loebclassics.com/view/menander_comic_poet-misoumenos_hated_man/1997/pb_LCL459.247.xml
To J. D. Hooker 4 August [1872] - | Darwin Correspondence Project,https://www.darwinproject.ac.uk/letter/DCP-LETT-8449.xml
Chapter 205 Allen and Greenough's Latin Grammar Dickinson ...,http://dcc.dickinson.edu/sites/default/files/Chapter-205.xml
Conditional Convective Heating in a Baroclinic Atmosphere,https://journals.ametsoc.org/view/journals/atsc/52/10/1520-0469_1995_052_1699_cchiab_2_0_co_2.xml
