"The relationship between eye-winking tics, frequent eye-blinking ...",https://jnnp.bmj.com/content/jnnp/52/4/477.full.pdf
The interpretation and evaluation of winking in stranger dyads,https://www.tandfonline.com/doi/pdf/10.1080/08824099909388725
How to distinguish a wink from a twitch,https://www.journals.uchicago.edu/doi/pdf/10.14318/hau7.2.038
The Winking Owl: Visual Effect and Its Art Historical Thick Description,https://www.jstor.org/stable/1344290
THE JAW-WINKING PHENOMENON: REPORT OF A CASE,https://jamanetwork.com/journals/OPHTH/articlepdf/613055/archopht_18_2_002.pdf
[PDF] Winking Lizard Tavern - ScholarsArchive@JWU,https://scholarsarchive.jwu.edu/cgi/viewcontent.cgi%3Farticle%3D1350%26context%3Dmenu_collection
Inverse Jaw-Winking with Exaggerated Bell's Phenomenon (“Ocular ...,https://www.karger.com/Article/Pdf/304913
Cerebral control of winking before and after learning,https://onlinelibrary.wiley.com/doi/pdf/10.1002/brb3.1483
"ralph wesley danifxson, md, d.ophth. - ScienceDirect.com",https://www.sciencedirect.com/science/article/pii/S0002939432902839/pdf%3Fmd5%3D5310de114c5b136eda28acb488792738%26pid%3D1-s2.0-S0002939432902839-main.pdf
