Bacterial microflora in the gastro-intestinal tract of Dover sole (Solea ...,https://femsle.oxfordjournals.org/content/35/1/107-1.ref-stubs.xml
Physiological and biochemical characteristics of identified species.,https://clinmedjournals.org/articles/jcgt/journal-of-clinical-gastroenterology-and-treatment-jcgt-6-073.xml
Does the Application of a Semiocclusive Dressing Alter the ...,https://japmaonline.org/view/journals/apms/111/1/i8750-7315-111-1-article_1.xml
host–bacteria communication within the gut microbiome in,https://joe.bioscientifica.com/view/journals/joe/225/2/R21.xml
Assessment of the qualitative variation in bacterial microflora among ...,https://avmajournals.avma.org/abstract/journals/ajvr/66/9/ajvr.2005.66.1556.xml
Fungicide and Clay Treatments for Control of Powdery Mildew ...,https://journals.ashs.org/hortsci/view/journals/hortsci/41/1/article-p176.xml
Antagonistic Effect of Lactic Acid Bacteria on Microflora of Shredded ...,https://journals.ashs.org/hortsci/view/journals/hortsci/40/4/article-p1134D.xml%3Frskey%3DahfZHg
Microflora of Meloidogyne egg masses: species composition ... - Brill,https://brill.com/view/journals/nemy/3/8/article-p729_1.xml%3Flanguage%3Den
Characterization of a microorganism isolated from the effluent of ...,https://journals.scholarsportal.info/details/13891723/v92i0004/397_coamifeohfbm.xml
EFFECT OF pH ON MICROFLORA OF CIVIL CHEESE DURING ...,https://akjournals.com/downloadpdf/journals/066/33/2/article-p201.xml
https://www.jove.com/v/2830/sequencing-bacterial-microflora ...,https://www.jove.com/sitemap/articles/2830.xml
OJMM Open Journal of Medical Microbiology 2165-3372 Scientific ...,https://www.scirp.org/xml/102933.xml
ABSTRACT - world wide journals,https://www.worldwidejournals.com/international-journal-of-scientific-research-(IJSR)/xmlview.xml%3Fid%3D11664
SAGE Reference - Encyclopedia of Obesity - SAGE Knowledge,https://sk.sagepub.com/Reference/obesity/n263.xml
Taxonomic identity of <i>Corydalislidenii</i> (Papaveraceae).,https://europepmc.org/articles/pmc8873148/bin/phytokeys.190.80724-treatment1.xml
Keywords - Journal of Pure and Applied Microbiology,https://microbiologyjournal.org/xml/vol16no1/JPAM.16.1.06.xml
PSJFS Potravinarstvo Slovak Journal of Food Sciences Potr. S. J. F. ...,https://potravinarstvo.com/dokumenty/xml/vol13/PSJFS-13-1-779/PSJFS-13-1-779.xml
biorxiv BIORXIV bioRxiv bioRxiv Cold Spring Harbor Laboratory ...,https://www.biorxiv.org/content/biorxiv/early/2020/02/06/2020.02.03.933317.source.xml
recast-jats-build a5a9521409 bmjopen BMJ Open bmjopen BMJ ...,https://bmjopen.bmj.com/content/10/9/e035677.download.xml
Studies of Diarrheal Disease in Central America in - American ...,https://www.ajtmh.org/view/journals/tpmd/17/3/article-p397.xml
