The mesoglea of hydra. I. Physical and histochemical properties,https://onlinelibrary.wiley.com/doi/pdf/10.1002/jez.1401710103
On the Chemical Composition and Developmental Role of the ...,https://academic.oup.com/icb/article-pdf/14/2/575/5911226/14-2-575.pdf
[PDF] Mesoglea Extracellular Matrix Reorganization during Regenerative ...,https://www.mdpi.com/1422-0067/22/11/5971/pdf
The Mesoglea and Muscle-fibres of Chlorohydra viridissima,https://journals.biologists.com/jcs/article-pdf/s3-91/16/419/1460112/419.pdf
HYDRA MESOGLEA: SIMILARITY OF ITS AMINO ACID AND ...,https://www.sciencedirect.com/science/article/pii/0305049175902527/pdf%3Fmd5%3Dcf9a602917ade45f79c67809d5778ee0%26pid%3D1-s2.0-0305049175902527-main.pdf
[PDF] ~mesoglea,http://www.dscc.edu/sites/default/files/bwilliams/Biology2/acetate%2520overlay/5_Hydra%2520Anatomy.pdf
Ultrastructure of the mesoglea of the sea anemone Nematostella ...,https://www.jstor.org/stable/23016666
3882051.pdf - JSTOR,https://www.jstor.org/stable/pdf/3882051.pdf
Hydra Mesoglea: a Model for Investigating Epithelial Cellâ ... - Science,https://www.science.org/doi/pdf/10.1126/science.7444468
An Uhrastructural Examination of the Mesoglea of Hydra - Springer,https://link.springer.com/content/pdf/10.1007/BF00335643.pdf
