Obsessive-Compulsive Disorder (OCD) | My Doctor Online - Kaiser ...,https://mydoctor.kaiserpermanente.org/ncal/structured-content/Condition_Obsessive-Compulsive_Disorder_-_Child_Psych.xml%3Fco%3D/regions/ncal
Obsessive Compulsive Disorder: A Neuropsychological Approach,https://sk.sagepub.com/books/obsessive-compulsive-disorder/i1015.xml
Lesion location and outcome following cingulotomy for obsessive ...,https://thejns.org/view/journals/j-neurosurg/136/1/article-p221.xml
[PDF] How obsessive–compulsive and bipolar disorders meet each other ...,https://journals.scholarsportal.info/pdf/1744859x/v19inone/nfp_hoabdmoaigea.xml
Individual‑fMRI‑approaches reveal cerebellum and visual ... - Nature,https://journals.scholarsportal.info/pdf/20452322/v11inone/nfp_ircavcfciocd.xml
Evidence-based pharmacotherapy of obsessive-compulsive disorder,https://ijnp.oxfordjournals.org/content/15/8/1173.ref-stubs.xml
An empirical study of affective and cognitive functions in Compulsive ...,https://akjournals.com/view/journals/2006/aop/article-10.1556-2006.2021.00056/article-10.1556-2006.2021.00056.xml
Obsessive-Compulsive Ir/rationality in Watt in - Brill,https://brill.com/abstract/journals/sbt/29/1/article-p92_8.xml
