A Cervical and a Lumbar Pilonidal Sinus Communicating with ...,https://thejns.org/view/journals/j-neurosurg/6/2/article-p97.xml
Congenital Dermal (Pilonidal) Sinus with Dural Connection in,https://thejns.org/view/journals/j-neurosurg/4/3/article-p276.xml
Pilonidal Sinus Surgery with Mechanical Drilling Technique ...,https://journals.scholarsportal.info/details/09722068/v82i0005/824_psswmdt.xml
CRIS Case Reports in Surgery 2090-6919 2090-6900 Hindawi ...,https://downloads.hindawi.com/journals/cris/2017/5791972.xml
CRIS Case Reports in Surgery 2090-6919 2090-6900 Hindawi ...,https://downloads.hindawi.com/journals/cris/2014/451869.xml
Management of a pilonidal sinus with V.A.C. - World Wide Wounds,http://www.worldwidewounds.com/2009/December/Fette/Fette-VAC_latin1.xml
Management of a pilonidal sinus with VAC® Therapy - World Wide ...,http://www.worldwidewounds.com/2009/December/Fette/Fette-VAC_utf8.xml
SS Surgical Science 2157-9407 Scientific Research Publishing ...,https://www.scirp.org/xml/21152.xml
A randomized controlled trial of effectiveness of platelet-rich plasma ...,https://europepmc.org/articles/pmc6963006/bin/mmc1.xml
