Inhibition of TAMs improves the response to docetaxel in castration ...,https://erc.bioscientifica.com/view/journals/erc/26/1/ERC-18-0284.xml
Inhibition of TAMs improves the response to docetaxel in castration ...,https://erc.bioscientifica.com/downloadpdf/journals/erc/26/1/ERC-18-0284.xml
tams_apriltags/package.xml at master · TAMS-Group/tams_apriltags ...,https://github.com/TAMS-Group/tams_apriltags/blob/master/package.xml
tams_ur5_setup/package.xml at master · TAMS-Group ... - GitHub,https://github.com/TAMS-Group/tams_ur5_setup/blob/master/tams_ur5_setup_moveit_config/package.xml
A Unidirectional Transition from Migratory to Perivascular ...,https://journals.scholarsportal.info/details/22111247/v23i0005/1239_autfmtirftci.xml
recast-jats-build ec6cccc6e1 jitc J Immunother Cancer 40425 ...,https://jitc.bmj.com/content/8/Suppl_3/A431.1.download.xml
Background - Journal for ImmunoTherapy of Cancer,https://jitc.bmj.com/content/8/1/e000339.download.xml
Guide to the Texas Academy of Math and Science Collection - TARO,https://txarchives.org/unt/finding_aids/00099.xml
biorxiv BIORXIV bioRxiv bioRxiv Cold Spring Harbor Laboratory ...,https://www.biorxiv.org/content/biorxiv/early/2022/01/28/2022.01.26.468593.source.xml
