Strep Throat | My Doctor Online,https://mydoctor.kaiserpermanente.org/ncal/structured-content/Condition_Strep_Throat_-_Pediatrics.xml%3Fco%3D/regions/ncal
"Throat Culture, Comprehensive",https://umc.edu/som/Departments%2520and%2520Offices/SOM%2520Departments/Pathology/UMMC%2520Lab%2520Services/Lab%2520Test%2520List/Laboratory/Tests/Throat-Culture--Comprehensive.xml
Laryngoscopy with Removal of Laryngeal Lesions,https://www.umc.edu/Healthcare/ENT/Patient-Handouts/Adult/Voice_Swallowing/Laryngoscopy.xml
Clinical course of suspected viral sore throat in young adults,https://journals.scholarsportal.info/pdf/02813432/v24i0002/93_ccosvstiyacs.xml
[PDF] Diagnostic performance of the combined nasal and throat swab in ...,https://journals.scholarsportal.info/pdf/14712334/v21inone/nfp_dpotcnathwsc.xml
Patterns of throat colour variation in Quedenfeldtia trachyblepharus ...,https://brill.com/view/journals/amre/34/4/article-p567_13.xml%3Flanguage%3Den
image-sitemap-1.xml - Frisco Family ENT,https://www.friscofamilyent.com/image-sitemap-1.xml
Anisakid Larva from the Throat of an Alaskan Eskimo in: The ...,https://www.ajtmh.org/view/journals/tpmd/25/5/article-p691.xml
"Chapter 35: Mouth, Throat, and Nose Medications in: Understanding ...",https://publications.ashp.org/abstract/book/9781585283590/ch035.xml%3Frskey%3DHCB2ZT%26result%3D2421
