Multi-Level Marketing as “Gig” Work: Worker Motivations ... - Brill,https://brill.com/view/journals/jlso/25/1/article-p83_5.xml
Chapter 8: Multi-party working relationships in gig work - Elgaronline,https://www.elgaronline.com/view/edcoll/9781839100277/9781839100277.00017.xml
"Chapter 3: The past, present and future of gig work in - Elgaronline",https://www.elgaronline.com/abstract/edcoll/9781839100277/9781839100277.00011.xml
"Women, Retirement, and the Growing Gig Economy Workforce",https://gsulawreview.org/article/34479.xml
BILLS-117hres772ih.xml - Govinfo.gov,https://www.govinfo.gov/bulkdata/BILLS/117/1/hres/BILLS-117hres772ih.xml
Individualising Risk: Paid Care Work in the New Gig Economy by ...,https://bristoluniversitypressdigital.com/view/journals/ijcc/aop/article-10.1332-239788221X16504438497287/article-10.1332-239788221X16504438497287.xml%3Frskey%3DKbmQzg%26result%3D3
An independence property for the product of GIG and gamma laws,https://projecteuclid.org/journals/annals-of-probability/volume-28/issue-3/An-independence-property-for-the-product-of-GIG-and-gamma/10.1214/aop/1019160339.xml
Algorithmic management and app‐work in the gig economy,https://journals.scholarsportal.info/details/09545395/v30i0001/114_amaaitaferah.xml
sitemap_products_1.xml - Gig Morris Florist,https://gigmorris.com/sitemap_products_1.xml%3Ffrom%3D10327031433%26to%3D118277898249
