[PDF] INSTRUMENTS! PERUVIAN PANPIPES,http://www.mim.org/wp-content/uploads/2017/02/2015-11-05-MIMkids-Peruvian-Panpipes.pdf
Stopped-pipe wind instruments: Acoustics of the panpipes,http://asa.scitation.org/doi/pdf/10.1121/1.1815132
Twelve Nasca Panpipes: A Study - jstor,https://www.jstor.org/stable/pdf/851338.pdf
HOPEWELL PANPIPES: A RECENT DISCOVERY IN INDIANA,https://www.jstor.org/stable/20708323
Panpipes as units of cultural analysis and dispersal,https://www.cambridge.org/core/services/aop-cambridge-core/content/view/196760C57BACE9DF0AFD52D31F988B7D/S2513843X20000158a.pdf/panpipes_as_units_of_cultural_analysis_and_dispersal.pdf
[PDF] Peru: Llamas and Panpipes “Siku” Let's Explore the World,https://4-h.ca.uky.edu/files/peru_llamas_and_flute_september_28.pdf
"[PDF] hopewell panpipe, music, art, and expression: an exploration of ...",https://minds.wisconsin.edu/bitstream/handle/1793/66617/Reis_Thesis.pdf%3Fsequence%3D1%26isAllowed%3Dy
[PDF] Straw Pan Pipes,https://www.gosh.nhs.uk/documents/11553/Straw_Pan_Pipes.pdf
[PDF] Panpipe,https://www.espsciencetime.org/Downloads/Panpipe.pdf
Rhapsody on the Panpipes - De Gruyter,https://www.degruyter.com/document/doi/10.1515/9781400864430.233/pdf
