Indians owner Paul Dolan gets head shaved | The Blade,https://www.toledoblade.com/sports/indians/2015/06/07/Indians-owner-Paul-Dolan-gets-head-shaved/stories/feed/feed/index.rss
Indians owner Paul Dolan gets head shaved | The ... - Toledo Blade,https://www.toledoblade.com/sports/indians/2015/06/07/Indians-owner-Paul-Dolan-gets-head-shaved/stories/feed/index.rss
Shaved Monkey Media Podcast - Buzzsprout,https://feeds.buzzsprout.com/1954861.rss
I Shaved My Vag For This? - Buzzsprout,https://feeds.buzzsprout.com/1809107.rss
Chest hair on guys - Health and Beauty - Chictopia's Official Forum ...,http://www.chictopia.com/forums/Health%2Band%2BBeauty/topics/1105.rss
Two Girls One Pod - Omny.fm,https://omny.fm/shows/two-girls-one-pod/playlists/podcast.rss
FUT Weekly Podcast - Audioboom,https://audioboom.com/channels/4972611.rss
Minted Review: Text a Stylist for Help With Hanging and Choosing Art,https://www.businessinsider.com/minted-review-text-a-stylist-2018-5/insiderpicks.rss
BCBGMaxAzria Cassaundra shipfree Peplum Blouse Faux Leather,https://www.osteofregault.ca/rss/politics-155.rss
