Fainting (Syncope) | My Doctor Online,https://mydoctor.kaiserpermanente.org/ncal/structured-content/Symptom_Fainting_Syncope_-_Hospital_Medicine.xml%3Fco%3D/regions/ncal
Adenosine test in the diagnosis of unexplained syncope,https://eurheartj.oxfordjournals.org/content/27/12/1396.source.xml
Long QT syndrome patients may faint due to neurocardiogenic ...,https://europace.oxfordjournals.org/content/5/4/367.source.xml
Exercise-Related Syncope: Acute Management and Subsequent ...,https://journals.humankinetics.com/downloadpdf/journals/ijatt/12/6/article-p4.xml
Syncope Associated with Persistent Hypoglossal Artery in,https://thejns.org/view/journals/j-neurosurg/21/2/article-p139.xml
Partial Glossopharyngeal Neuralgia Associated with Syncope in,https://thejns.org/view/journals/j-neurosurg/14/4/article-p452.xml
SAGE Reference - Encyclopedia of Health & Aging,https://sk.sagepub.com/reference/aging/n267.xml
Systemic hemodynamics during cough induced and vasovagal ...,https://akjournals.com/view/journals/1646/2/2/article-p91.xml
