Frequent premature atrial complexes predict new occurrence of ...,https://europace.oxfordjournals.org/content/14/7/942.source.xml
SAGE Reference - Encyclopedia of Public Relations,https://sk.sagepub.com/reference/publicrelations/n316.xml
Heart Palpitations | My Doctor Online,https://mydoctor.kaiserpermanente.org/ncal/structured-content/Condition_Heart_Palpitations_-_Cardiology.xml%3Fco%3D/regions/ncal
Campaign Finance in the Era of Super-PACS - Political Science,https://www.oxfordbibliographies.com/view/document/obo-9780199756223/obo-9780199756223-0229.xml
"Driving support: workers, PACs, and congressional support of the ...",https://www.degruyter.com/view/j/bap.ahead-of-print/bap-2013-0005/www.degruyter.com/view/j/bap.ahead-of-print/bap-2013-0005/bap-2013-0005.xml
The future of PACS in healthcare enterprises | Scholars Portal ...,https://journals.scholarsportal.info/details/0720048x/v78i0002/253_tfopihe.xml
Preference elicitation: Obtaining gestural guidelines for PACS in ...,https://journals.scholarsportal.info/details/13865056/v130icomplete/nfp_peoggfpin.xml
PROGRAM TO ENCOURAGE PUBLIC AND COMMUNITY SERVICE,https://www.govinfo.gov/content/pkg/CFR-2008-title32-vol1/xml/CFR-2008-title32-vol1-part77.xml
weasis-pacs-connector/pom.xml at master - GitHub,https://github.com/nroduit/weasis-pacs-connector/blob/master/pom.xml
