1503323.txt - Veterans Affairs,http://www.va.gov/vetapp15/Files1/1503323.txt
1403808.txt - Veterans Affairs,http://www.va.gov/vetapp14/Files1/1403808.txt
Transfascial muscular hernia: An unusual cause for a “hide and ...,https://dermatology.cdlib.org/1702/3_case_presentations/4_11-00009/alfageme.txt
Chesterton girl survives congenital diaphragmatic hernia | Local News,http://nwi.com/articles/2008/04/01/news/porter_county/doc53fd6d27d3f29be08625741d00834973.txt
Case report Open Access Perforated gastric corpus in a ...,https://thescholarship.ecu.edu/bitstream/10342/3399/4/Perofrated%2520gastric%2520corpus%2520strangulated%2520paraesophageal%2520hernia.pdf.txt
DEPARTMENT OF THE NAVY BOARD FOR CORRECTION OF ...,https://boards.law.af.mil/NAVY/BCNR/CY2019/2276-19_Redacted.txt
RECORD OF PROCEEDINGS AIR FORCE BOARD FOR ...,https://boards.law.af.mil/AF/BCMR/CY2010/BC201002265.txt
Health Awareness Talk Hernia To Me: Advice For Effective ...,https://www.mynewstouse.com/uploads/files/20211019-134906-36395.txt
