offspring of pinealectomized rats - Reproduction,https://rep.bioscientifica.com/downloadpdf/journals/rep/89/2/jrf_89_2_005.xml
pinealectomized female rats - Bioscientifica,https://eje.bioscientifica.com/downloadpdf/journals/eje/116/2/acta_116_2_015.xml
Their effects on plasma leptin levels and relationship with zinc in,https://akjournals.com/view/journals/018/58/4/article-p335.xml
Effect of pinealectomy on immune parameters in rats with ...,https://journals.scholarsportal.info/details/03445607/v24i0001/0026_eopoipirwsai.xml
Evidence that Melatonin Increases Inhibin Beta-A and Follistatin ...,https://journals.scholarsportal.info/details/19337191/v27i0007/1455_etmiibeioopr.xml
TESTICULAR STATUS IN PINEALECTOMIZED ADULT ... - Brill,https://brill.com/view/journals/ijee/48/3/article-p189_1.xml%3Flanguage%3Den
1. Introduction - Hindawi.com,https://downloads.hindawi.com/journals/jos/2010/830231.xml
"The pineal gland: anatomy, physiology, and clinical significance in",https://thejns.org/view/journals/j-neurosurg/63/3/article-p321.xml
President: Alfred K. Blackadar President-Elect: Richard J. Reed ...,https://journals.ametsoc.org/previewpdf/journals/bams/52/4/1520-0477-52_4_289.xml%3FpdfJsInlineViewToken%3D920255789%26inlineView%3Dtrue
Introduction - PLOS,http://open-repository.kisti.re.kr/cube/bitstream/open_repository/43858/1/journal.pone.0077904.xml
