index.xml,https://edition.cnn.com/video/data/3.0/video/us/2012/03/15/vo-blagojevich-departs-house-for-prison.wgn/index.xml
CNN reporter on Trump's claim: None of that is true CNN's <a href ...,https://edition.cnn.com/video/data/3.0/video/politics/2019/10/04/trump-claim-joe-biden-jeremy-diamond-fact-check-ath-vpx.cnn/index.xml
THE COPULA IN ECUADORIAN QUECHUA in Pieter Muysken - Brill,https://brill.com/previewpdf/book/edcoll/9789047427087/B9789047427087_011.xml
"http://departs.xiangjufang.com/ <tr> <td class=""tc"">1 2022-04-08 ...",http://departs.case.xiangjufang.com/departs.xiangjufang.com.xml
Trade with noncontiguous territory. - Govinfo.gov,https://www.govinfo.gov/content/pkg/CFR-2018-title19-vol1/xml/CFR-2018-title19-vol1-sec4-84.xml
Voluntary departure-authority of the Executive Office for Immigration ...,https://www.govinfo.gov/content/pkg/CFR-2019-title8-vol1/xml/CFR-2019-title8-vol1-sec1240-26.xml
"Night Order-Book of the USS Chaumont, 1924-1925: Finding Aid",https://www.usna.edu/Library/sca/man-findingaids/MS_116.EAD.xml
Final train departs Union Station - Shaw Local,https://www.mysuburbanlife.com/articles/2014/09/26/e1d769f71df94edcbd12d6553e6d8734/index.xml
Governance in Developing Asia - Elgaronline,https://www.elgaronline.com/view/edcoll/9781784715564/9781784715564.xml
When to depart from a stopover site? Time since arrival matters ...,https://bioone.org/journals/ornithology/volume-139/issue-1/ukab057/When-to-depart-from-a-stopover-site-Time-since-arrival/10.1093/ornithology/ukab057.xml
