sitemap.xml - Amazon.com,https://docs.aws.amazon.com/prescriptive-guidance/latest/modernization-mainframe-decoupling-patterns/sitemap.xml
Microcomputer Methods for Social Scientists,https://methods.sagepub.com/base/download/BookChapter/microcomputer-methods-for-social-scientists/n6.xml
EView Technology is now part of Precisely Ironstream,http://eview-tech.com/sitemap-index.xml
Robot-Framework-Mainframe-3270-Library/Mainframe3270.xml at ...,https://github.com/Altran-PT-GDC/Robot-Framework-Mainframe-3270-Library/blob/master/doc/Mainframe3270.xml
Cyborg Goddesses: The Mainframe Revisited in - Brill,https://brill.com/view/book/edcoll/9789401206747/B9789401206747-s008.xml
Microcomputer versus mainframe usage by marketing professionals ...,https://journals.scholarsportal.info/details/00920703/v15i0002/1_mvmubmp.xml%3Flang%3Dfr
hardware.xml,https://www.toolbox.com/hardware.xml
Modern Meteorological Computing Resources—the ... - AMS Journals,https://journals.ametsoc.org/downloadpdf/journals/bams/69/7/1520-0477_1988_069_0736_mmcrme_2_0_co_2.xml
Modern Meteorological Computing Resources—the Maryland ...,https://journals.ametsoc.org/view/journals/bams/69/7/1520-0477_1988_069_0736_mmcrme_2_0_co_2.xml
