SAGE Reference - Encyclopedia of Human Relationships,https://sk.sagepub.com/reference/humanrelationships/n48.xml
How do aunts and uncles compensate for low parental education in ...,https://www.elgaronline.com/view/edcoll/9781786432551/9781786432551.00012.xml
Paternal aunts as matriarchs in Taiwanese family businesses,https://www.elgaronline.com/view/edcoll/9781839104329/9781839104329.00013.xml
Gender and Genre in Charles Chesnutt's the Conjure Woman,https://journals.scholarsportal.info/details/01486179/v25i0004/665_auagagicctcw.xml
"Spinster heroines, aunts and widowed mothers, 1910–39 in",https://www.manchesterhive.com/view/9781526111654/9781526111654.00007.xml
story.xml - The Courier Mail,http://media01.couriermail.com.au/multimedia/mediaplayer/slideshows/1134/xml/story.xml%3FNoCache%3D1337256627661
mice reared with rats: an interstrain - Brill,https://brill.com/previewpdf/journals/beh/38/3-4/article-p315_5.xml%3FpdfJsInlineViewToken%3D915888157%26inlineView%3Dtrue
Sixth Aunt in: Exiled Pilgrims - Brill,https://brill.com/view/book/9789004292086/B9789004292086_017.xml%3Flanguage%3Den
