When Gymnasts Lose Previously Automatic Backward Moving Skills in,https://journals.humankinetics.com/view/journals/jcsp/11/3/article-p181.xml
Grip Lock: A Unique Mechanism of Injury in Gymnastics,https://journals.humankinetics.com/previewpdf/journals/ijatt/13/1/article-p7.xml
Study on analysis the emotion regulation mechanisms responsible ...,https://sciendo.com/downloadpdf/journals/tperj/10/19/article-p165.xml
The Physique of Elite Female Artistic Gymnasts: A Systematic Review,https://www.degruyter.com/view/j/hukin.2017.58.issue-1/hukin-2017-0075/hukin-2017-0075.xml
THE JUMPSMILE PROJECT,https://ijspt.scholasticahq.com/article/33751.xml
"Girls Gymnastics: Katrina Carlson, Downers Grove ... - Shaw Local",https://www.mysuburbanlife.com/articles/2019/12/03/4e140598162c4140a9be4f975eb81a8b/index.xml
Bone Mineralization in Rhythmic Gymnasts Entering Puberty: A,https://www.jssm.org/abstresearchajssm-16-99.xml.xml
Bone mineral density acquisition in peripubertal female rhythmic ...,https://eje.bioscientifica.com/downloadpdf/journals/eje/163/1/157.xml
Somatotype of Top-Level Serbian Rhythmic Gymnasts,https://journals.scholarsportal.info/details/16405544/v40i0001/181_sotsrg.xml
