SEC FORM D - SEC.gov,https://www.sec.gov/Archives/edgar/data/0001674456/000167445616000001/xslFormDX01/primary_doc.xml
"""It was a Negro Taught Them"", a New Look at African Labor in Early ...",https://brill.com/downloadpdf/journals/jaas/9/3-4/article-p160_3.xml
britain's asian century: porcelain and global - Brill,https://brill.com/downloadpdf/book/edcoll/9789004189355/Bej.9789004189348.i-259_009.xml
Règlement canadien sur la fixation des prix des oeufs d'incubation ...,http://laws-lois.justice.gc.ca/fra/XML/DORS-89-512.xml
Authorized Deposits of Deleterious Substances - Laws.justice.gc.ca,"https://laws-lois.justice.gc.ca/eng/XML/C.R.C.,_c._818.xml"
Untitled,https://dictionary.cambridge.org/es/sitemap/frances-ingles/sitemap2.xml
Untitled,https://dictionary.cambridge.org/us/sitemap/french-english/sitemap2.xml
item4-sitemap.xml - Hillas.com,https://www.hillas.com/item4-sitemap.xml
Minsheu_A Dictionary in Spanish and English_1599_final.xml,https://tspace.library.utoronto.ca/bitstream/1807/99181/4/Minsheu_A%2520Dictionary%2520in%2520Spanish%2520and%2520English_1599_final.xml
