Internalisation of uncross-linked rituximab is not essential for the ...,https://journals.scholarsportal.info/details/10428194/v49i0008/1578_iourinkiblcl.xml
recast-jats-build ce88187742 tsaco tsaco Trauma Surgery & Acute ...,https://tsaco.bmj.com/content/1/1/e000026.download.xml
1. Introduction - Hindawi.com,https://downloads.hindawi.com/journals/ijps/2019/6936437.xml
biorxiv BIORXIV bioRxiv bioRxiv Cold Spring Harbor Laboratory ...,https://www.biorxiv.org/content/early/2020/03/26/2020.03.25.007690.source.xml
People in Economics in - IMF eLibrary,https://www.elibrary.imf.org/view/journals/022/0041/002/article-A003-en.xml
SECURITIES AND EXCHANGE COMMISSION [Release No. 34 ...,https://www.federalregister.gov/documents/full_text/xml/2018/01/22/2018-00975.xml
Owning Up: Empowering Adolescents to Confront ... - SAGE Books,https://sk.sagepub.com/books/owning-up-2e/i219.xml
Inter-monomer cross-linking affects the thermal transitions in F-actin,https://akjournals.com/downloadpdf/journals/10973/101/2/article-p549.xml
Inter-monomer cross-linking affects the thermal transitions in F-actin in,https://akjournals.com/abstract/journals/10973/101/2/article-p549.xml
