Can we ever stop imaging in surgically treated and radiotherapy ...,https://eje.bioscientifica.com/view/journals/eje/165/5/739.xml
An estimation of global volume of surgically treatable epilepsy ...,https://thejns.org/view/journals/j-neurosurg/130/4/article-p1127.xml
Surgically treatable adult epilepsy: a changing patient population ...,https://thejns.org/view/journals/j-neurosurg/135/6/article-p1765.xml
Findings and prognostic indicators of outcomes for queens with ...,https://avmajournals.avma.org/view/journals/javma/260/S2/javma.20.12.0712.xml
Evaluation of surgically placed gastrojejunostomy feeding tubes in ...,https://avmajournals.avma.org/view/journals/javma/232/3/javma.232.3.380.xml
Impairments of Postural Balance in Surgically Treated Lumbar Disc ...,https://journals.humankinetics.com/view/journals/jab/36/4/article-p228.xml
Factors Affecting the Clinical Outcomes of Surgically Treated Ankle ...,https://japmaonline.org/view/journals/apms/111/5/18-184.xml
Incidence Rates of Surgically Managed Cystic Echinococcosis in ...,https://www.ajtmh.org/view/journals/tpmd/102/1/article-p90.xml
[PDF] Role of LDL level over hospital stay length of surgically treated ...,https://journals.scholarsportal.info/pdf/17498090/v10isuppl_1/a228_rollohaopadp.xml
Tectonic corneal lamellar grafting for surgically-induced necrotizing ...,https://europepmc.org/articles/pmc6063979/bin/mmc1.xml
