4 dead in Pittsburgh flash flooding - The Toledo Blade,https://www.toledoblade.com/news/Nation/2011/08/20/Pittsburgh-flash-flooding/stories/feed/feed/index.rss
Fremont sailor reflects on historic North Pole submarine voyage,https://www.toledoblade.com/local/2018/08/03/Fremont-WWII-Navy-vet-reflects-on-historic-North-Pole-voyage-of-the-USS-Nautilus-submarine/stories/feed/index.rss
Deep Water Culture - Buzzsprout,https://feeds.buzzsprout.com/1736426.rss
Binge Warning - Buzzsprout,https://feeds.buzzsprout.com/1759108.rss
Latest antarctica Podcast Episodes - Pod.casts,https://pod.casts.io/topics/%25E2%2580%25A8antarctica/new-episodes.rss
Doctor Who: Tin Dog Podcast,http://audioboom.com/channels/2940967.rss
Now The End Begins Bible Study Archives - Sermon Audio,http://www.sermonaudio.com/rss_source.rss%3Fsourceid%3Dnteb
The Peer Pleasure Podcast - Megaphone,https://pod.link/1166822958.rss
