Flash Video wiki | TheReaderWiki,https://thereaderwiki.com/es/.flv
[Cercle d'étude de la Déportation et de la Shoah],https://www.cercleshoah.org/spip.php/IMG/flv/06_sarah_montard.flv%3Fdebut_article_langue%3D370
¿Cómo relacionarnos con nuestros familiares que no son ...,https://www.islamweb.net/ramadanS/articles/154316/flv/rv4.flv
"La lealtad, una virtud noble - Ramadan - Islamweb",https://islamweb.net/ramadanS/articles/153731/flv/flv/rv4.flv
Elementos filtrados por fecha: Diciembre 2017 - Airfeu,https://www.airfeu.com/noticias/itemlist/date/2018/zenith_agua.flv%3Fstart%3D160
Elementos filtrados por fecha: Diciembre 2010 - Airfeu,https://www.airfeu.com/noticias/itemlist/date/2011/images/zenith_agua.flv%3Fstart%3D170
