America through the Eyes of Czech Foreign Correspondents - MZV,https://www.mzv.cz/washington/en/culture_events/culture/america_through_the_eyes_of_czech.rss
Latest Stories from The Associated Press - Audioboom,https://audioboom.com/channels/4277258.rss
Sports News from the Associated Press - Audioboom,https://audioboom.com/channels/5065604.rss
'60 Minutes' correspondent Ed Bradley dies at 65 - Toledo Blade,https://www.toledoblade.com/Deaths/2006/11/09/60-Minutes-correspondent-Ed-Bradley-dies-at-65/stories/feed/index.rss
It Came From The Radio - Anchor,https://pod.link/1215106198.rss
Bret Baier's All-Star Panel - Megaphone,https://omny.fm/shows/the-candidates-with-bret-baier/playlists/podcast.rss
"On the Middle East with Andrew Parasiliti and Amberin Zaman, an Al ...",https://rss.art19.com/on-the-middle-east-with-andrew-parasiliti-an-al-monitor-podcast.rss
48 Hours - Art19.com,https://www.omnycontent.com/d/playlist/4b5f9d6d-9214-48cb-8455-a73200038129/281bc566-ad26-4fb6-bf75-a78e0074e5b6/812344c8-f887-4617-8fa7-a78e0074e5ba/podcast.rss
From Our Citywire Correspondent - Buzzsprout,https://feeds.buzzsprout.com/1011280.rss
