nominal morphology - Brill,https://brill.com/downloadpdf/book/9789047429173/Bej.9789004175730.i-615_004.xml
The Formation of Greek Place-nouns in -εών/-ών in - Brill,https://brill.com/view/journals/ieul/4/1/article-p1_1.xml%3Flanguage%3Den
The role of attention in processing morphologically complex spoken ...,https://journals.scholarsportal.info/details/16625161/v6inone/nfp_troaipcswaes.xml
Untitled,http://downloads.hindawi.com/journals/mpe/2021/6672762.xml
SAGE Reference - Encyclopedia of Language Development,https://sk.sagepub.com/reference/encyclopedia-of-language-development/n169.xml
Clause-initial position remains (phonetically) empty - Taalportaal,https://www.taalportaal.org/taalportaal/topic/link/syntax__Dutch__vp__V11_Word_order_Clause_initial_position__V11_Word_order_Clause_initial_position.11.2.xml
Diminutive formation in Hungarian in - AKJournals,https://akjournals.com/view/journals/2062/68/1-2/article-p230.xml
Untitled,https://ora4-prd.bodleian.ox.ac.uk/objects/uuid:39fd5b76-2099-4f42-a428-e4c2df39685d.xml
Untitled,https://open.library.ubc.ca/media/download/rdf-xml/831/1.0096517/0.xml
Harmonic Uniformity and Hungarian front/back harmony in,https://akjournals.com/view/journals/2062/68/1-2/article-p175.xml
On the semantics of scalar adjectives - Taalportaal,https://www.taalportaal.org/taalportaal/topic/link/syntax__Dutch__ap__a3__a3_Modification.3.1.1.xml
