and Zeatin-induced High-frequency Shoot Regeneration from Leaf ...,https://journals.ashs.org/horttech/view/journals/horttech/23/3/article-p276.xml
The Use of Zeatin to Initiate in Vitro Cultures of Vaccinium Species ...,https://journals.ashs.org/hortsci/view/journals/hortsci/26/10/article-p1320.xml
[PDF] Identification of the profile of endogenous cytokinin-like compounds ...,http://sciendo.com/abstract/journals/fhort/32/1/article-p21.xml
Role of cis‐zeatin in root responses to phosphate starvation ...,https://journals.scholarsportal.info/details/0028646x/v224i0001/242_rocirrtps.xml
"Indoleacetic acid, gibberellic acid, zeatin, and abscisic acid levels in ...",https://brill.com/view/journals/ijps/49/4/article-p269_4.xml%3Flanguage%3Den
Abstract - bioRxiv,https://www.biorxiv.org/content/biorxiv/early/2022/05/27/2021.07.29.454319.source.xml
IJAC International Journal of Analytical Chemistry 1687-8779 1687 ...,https://downloads.hindawi.com/journals/ijac/2020/8853451.xml
Plant growth regulators induced urease activity in Cucurbita pepo L ...,https://akjournals.com/view/journals/018/67/1/article-p53.xml
AJPS American Journal of Plant Sciences 2158-2742 Scientific ...,https://www.scirp.org/xml/94895.xml
