CINQUECENTO (1500–1599) - jstor,https://www.jstor.org/stable/10.5699/yearworkmodlang.75.2013.0307
The Rise of Cinquecento Tragedy - JSTOR,https://www.jstor.org/stable/41913899
[PDF] The Cinquecento Italian Madrigal in Theory and Practice,https://eprints.whiterose.ac.uk/140155/3/Sacchini%2520Massini%2520Madrigal%2520%255Brevised%255D%25202.pdf
Cinquecento Sources for A Midsummer Night's Dream,https://muse.jhu.edu/article/488435/pdf
[PDF] Comprising five professional singers from five European countries,https://www.ensemblecinquecento.com/wp-content/uploads/sites/43/2018/06/Cinquecento-Biography-2018-English.pdf
The Rejection of Learning in Mid-Cinquecento Italy,https://www.cambridge.org/core/services/aop-cambridge-core/content/view/0E65AB0988F135E7B25684E9EA3A12E9/S0081865800002391a.pdf/div-class-title-the-rejection-of-learning-in-mid-span-class-italic-cinquecento-span-italy-div.pdf
Women and Italian Cinquecento literary academies,https://api.taylorfrancis.com/content/chapters/edit/download%3FidentifierName%3Ddoi%26identifierValue%3D10.4324/9781351199070-25%26type%3Dchapterpdf
[PDF] Storia Della Letteratura Italiana Dal Cinquecento | Sena-Esteves Lab,https://senaesteveslab.umassmed.edu/publication/storia-della-letteratura-italiana-dal-cinquecento/%3Fredir_esc%3DS8598
TINTORETTO AND THE SCUOLE DEL SACRAMENTO,https://onlinelibrary.wiley.com/doi/pdf/10.1111/j.1467-8365.1983.tb00792.x
