The PapaCast GolfCast - Audioboom,https://audioboom.com/channels/4681656.rss
James Taylor to play Huntington Center | The Blade,https://www.toledoblade.com/Music-Theater-Dance/2016/05/26/James-Taylor-to-play-Huntington-Center/stories/feed/index.rss
Festival's historic homes offer glimpse of city's grand past,https://www.toledoblade.com/frontpage/2001/05/30/Festival-s-historic-homes-offer-glimpse-of-city-s-grand-past/stories/feed/index.rss
The WDW Connection Show - A Walt Disney World Informational ...,https://feeds.buzzsprout.com/1872168.rss
Hua Hin mit Kindern | Thailand Forum • HolidayCheck,https://www.holidaycheck.at/foren/topic/49406.rss
South Coast: Mornings - ABC,http://www.abc.net.au/local/programs/southcoast/programs_m35/south_coast_mornings.rss
