DO COLEOPTILE TIPS PRODUCE AUXIN.? - SHELDRAKE,https://nph.onlinelibrary.wiley.com/doi/pdf/10.1111/j.1469-8137.1973.tb04393.x
The Role of the Coleoptile Apex in Controlling Organ Elongation,https://www.jstor.org/stable/23692109
The Role of the Coleoptile Apex in Controlling Organ Elongation - jstor,https://www.jstor.org/stable/23692110
The Role of the Coleoptile Apex in Controlling ... - Oxford Academic,https://academic.oup.com/jxb/article-pdf/39/10/1343/1664614/39-10-1343.pdf
Cessation of coleoptile elongation and loss of auxin sensitivity in ...,https://www.tandfonline.com/doi/pdf/10.4161/psb.11210
Seed Germination and Coleoptile Growth of New Rice Lines ...,https://www.tandfonline.com/doi/pdf/10.1626/pps.18.471
[PDF] PER'MEABILITY OF AVENA COLEOPTILE SECTIONTS TO WATER ...,https://www.ncbi.nlm.nih.gov/pmc/articles/PMC540727/pdf/plntphys00372-0060.pdf
[PDF] Response of Oat Coleoptiles' - NCBI,https://www.ncbi.nlm.nih.gov/pmc/articles/PMC1086541/pdf/plntphys00495-0048.pdf
Auxin-binding protein from coleoptile membranes of corn (Zea mays ...,https://www.jbc.org/article/S0021-9258(17)39315-8/pdf
[PDF] Coleoptile length of wheat varieties,https://www.dpi.nsw.gov.au/__data/assets/pdf_file/0006/459006/Coleoptile-length-of-wheat-varieties.pdf
A Device for Measuring Avena Coleoptile Curvature - Science,https://www.science.org/doi/pdf/10.1126/science.101.2631.568.a
Position of Scutellum and Homology of Coleoptile in Maize,https://www.journals.uchicago.edu/doi/pdfplus/10.1086/332625
RESPONSES OF AVENA COLEOPTILE SECTIONS TO HIGH ...,http://www.publish.csiro.au/bi/pdf/bi9570147
coleorhiza. root and coleoptile emergence and growth: effects of ...,https://cdnsciencepub.com/doi/pdf/10.4141/cjps79-009
Effect of the Roots on the Production of Auxin by the Coleoptile - PNAS,https://www.pnas.org/content/pnas/23/5/272.full.pdf
[PDF] auxin relationships of the rice coleoptile 1 - Plant Physiology,http://www.plantphysiol.org/content/29/1/92.full.pdf
THE GROWTH AND RESPIRATION OF THE AVENA COLEOPTILE ...,https://rupress.org/jgp/article-pdf/20/1/1/1238621/1.pdf
[PDF] DO COLEOPTILE TIPS PRODUCE AUXIN?,https://www.sheldrake.org/files/pdfs/papers/Do-Coleoptile-Tips-Produce-Auxin.pdf
[PDF] Coleoptile Lengths - For Wheat Planted in Northwest Kansas,http://www.sunflower.k-state.edu/agronomy/wheat/wheat-coleoptile-lengths-chart-15-16.pdf
Control of Apoplast pH in Corn Coleoptile ... - ScienceDirect.com,http://www.sciencedirect.com/science/article/pii/S0176161711812174/pdf%3Fmd5%3D47935a10dfd45a7ef36bb08023fddb9c%26pid%3D1-s2.0-S0176161711812174-main.pdf%26_valck%3D1
