Parasiticidal Potencies of the Tri- to Hepta-Methyl Derivatives of ...,https://journals.sagepub.com/doi/pdf/10.3181/00379727-26-4493
Series in the Spectra of Aluminum and Magnesium in the ... - Science,https://www.science.org/doi/pdf/10.1126/science.60.1556.388
The use of hexazonium-p-rosanilin in the histochemical ... - Springer,http://link.springer.com/content/pdf/10.1007/BF00490369.pdf
Parafuchsin as a Stain for Tubercle Bacilli - ATS Journals,https://www.atsjournals.org/doi/pdf/10.1164/art.1917.1.4.218
Series in the Spectra of Aluminum and Magnesium in the ... - Science,https://science.sciencemag.org/content/sci/60/1556/388.full.pdf
Purifying Pararosanilin for Use in Colorless Schiff Reagent,https://www.tandfonline.com/doi/pdf/10.3109/10520295409115493
Rosanilins: Indicator Dyes for Chloramphenicol-Resistant,https://journals.asm.org/doi/pdf/10.1128/jb.150.3.1375-1382.1982
[PDF] SAFETY DATA SHEET - Fisher Scientific,https://www.fishersci.com/store/msds%3FpartNumber%3DAC419140025%26productDescription%3DBASIC%2BFUCHSIN%2BPURE%2B88%2525%2B2.5KG%26vendorId%3DVN00032119%26countryCode%3DUS%26language%3Den
Staining With Basic Fuchsin,https://academic.oup.com/labmed/article-pdf/14/7/431/24947883/labmed14-0431.pdf
Studies of the Toxicity of Basic Fuchsin for Certain Bacteria,https://ajph.aphapublications.org/doi/pdf/10.2105/AJPH.30.1.59
