Dorsal root entry zone lesions for the treatment of post-herpetic ...,https://thejns.org/view/journals/j-neurosurg/60/6/article-p1258.xml
Effect of Previous Sensory Loss On The Appearance of Herpes ...,https://thejns.org/view/journals/j-neurosurg/10/5/article-p463.xml
Genital herpetic infection association with cervical dysplasia and ...,https://journals.scholarsportal.info/details/0008543x/v23i0004/940_ghiawcdac.xml
In vitro and in vivo herpetic vector-mediated gene transfer in the ...,https://eje.bioscientifica.com/view/journals/eje/145/4/497.xml
Assessment of viremia associated with experimental primary feline ...,https://avmajournals.avma.org/view/journals/ajvr/70/1/ajvr.70.1.99.xml
Assessment of viremia associated with experimental primary feline ...,https://avmajournals.avma.org/downloadpdf/journals/ajvr/70/1/ajvr.70.1.99.xml
Development of herpetic infection associated with stroke and its ...,https://www.degruyter.com/view/j/cipms.2017.30.issue-1/cipms-2017-0004/cipms-2017-0004.xml%3Fformat%3DINT
References - ClinMed International Library,https://clinmedjournals.org/articles/ijaa/international-journal-of-anesthetics-and-anesthesiology-ijaa-7-109.xml
Virus and Host Factors that Mediate the Clinical and Behavioral ...,https://akjournals.com/view/journals/030/50/4/article-p443.xml
