Nondestructive analysis of the gold quarter liras - AKJournals,https://akjournals.com/downloadpdf/journals/10967/279/1/article-p345.xml
Lira plunge squeezes traders - DBS,https://www.dbs.com.hk/treasures/aics/templatedata/article/generic/data/en/CIO/032021/210324-currencies_hk.xml
Turkish lira erases central bank-fuelled gain - DBS,https://www.dbs.com.hk/treasures/aics/templatedata/article/generic/data/en/CIO/122021/211203-currencies_hk.xml
FORM D - SEC.gov,https://www.sec.gov/Archives/edgar/data/1816514/000181651420000001/xslFormDX01/primary_doc.xml
Is Gold a Hedge Against Turkish Lira? - Sciendo,https://www.degruyter.com/view/j/jeb.2008.3.issue-1/v10033-008-0004-x/v10033-008-0004-x.xml
The Italian Lira in the Narrow Erm Band in - IMF eLibrary,https://www.elibrary.imf.org/view/journals/001/1991/019/article-A001-en.xml
The Italian Lira in the Narrow Erm Band: The Challenge of Credibility,https://www.elibrary.imf.org/view/journals/001/1991/019/001.1991.issue-019-en.xml
"Haydn, Neapel und Die Lira Organizzata in - Brill",https://brill.com/view/book/edcoll/9783846758755/BP000004.xml%3Flanguage%3Dde
La lira asiatica di Apollo. Interazioni musicali tra la Grecia antica e il ...,https://brill.com/view/journals/grms/6/2/article-p379_8.xml%3Flanguage%3Den
