On the Abruptness of Bølling–Allerød Warming - AMS Journals,https://journals.ametsoc.org/downloadpdf/journals/clim/29/13/jcli-d-15-0675.1.xml
On the Abruptness of Bølling–Allerød Warming in - AMS Journal,https://journals.ametsoc.org/view/journals/clim/29/13/jcli-d-15-0675.1.xml
"303 Abdel-Latif, A. 70 abruptness, tipping points 278 accountability ...",https://www.elgaronline.com/downloadpdf/edcoll/9781788115414/9781788115414.00024.xml
Internal Evidence For The Completeness Of The Bellum Civile in - Brill,https://brill.com/view/book/edcoll/9789004217096/B9789004217096-s004.xml
"MARCUS AURELIUS, Marcus Aurelius - Loeb Classical Library",https://www.loebclassics.com/view/LCL058/1916/pb_LCL058.ix.xml
"SENECA THE YOUNGER, Epistles | Loeb Classical Library",https://www.loebclassics.com/view/seneca_younger-epistles/1917/pb_LCL077.311.xml%3FreadMode%3Drecto
IV Programs for Preventing Capital Account Crises in - IMF eLibrary,https://www.elibrary.imf.org/view/books/084/08995-9781589067097-en/C4.xml
Conditions on abruptness in a gradient-ascent Maximum Entropy ...,https://aclanthology.org/W18-0312.xml
[PDF] Perturbation of amygdala-cortical projections reduces ensemble ...,https://journals.scholarsportal.info/pdf/2050084x/v10inone/nfp_poapreopcigc.xml
