Multiple testing: when is many too much? in - European Journal of ...,https://eje.bioscientifica.com/view/journals/eje/184/3/EJE-20-1375.xml
A Case Study of a Soccer Team That Fosters Multiple Outcomes in,https://journals.humankinetics.com/view/journals/tsp/35/2/article-p131.xml
"Too Many Cooks, Not Enough Gourmets: Examining Provision and ...",https://journals.humankinetics.com/abstract/journals/tsp/36/2/article-p89.xml
Conclusion “She Had Many Gifts” in - Brill,https://brill.com/abstract/book/9789004502901/BP000031.xml
Discourse of Motherly Love and Parental Governance in 2019 Hong ...,https://brill.com/view/journals/mtsr/aop/article-10.1163-15700682-12341528/article-10.1163-15700682-12341528.xml
"IMF Working Papers Volume 2020 Issue 108: One Money, Many ...",https://www.elibrary.imf.org/view/journals/001/2020/108/001.2020.issue-108-en.xml
How Many ENSO Flavors Can We Distinguish? in - AMS Journals,https://journals.ametsoc.org/view/journals/clim/26/13/jcli-d-12-00649.1.xml
Continuum Many Maximal Consistent Normal Bimodal Logics with ...,https://projecteuclid.org/journals/notre-dame-journal-of-formal-logic/volume-39/issue-1/Continuum-Many-Maximal-Consistent-Normal-Bimodal-Logics-with-Inverses/10.1305/ndjfl/1039293024.xml
Regression Models with Infinitely Many Parameters - Project Euclid,https://projecteuclid.org/journals/annals-of-statistics/volume-12/issue-2/Regression-Models-with-Infinitely-Many-Parameters--Consistency-of-Bounded/10.1214/aos/1176346508.xml
