Spicule Formation in the Invertebrates with Special Reference to the ...,https://academic.oup.com/icb/article-pdf/24/4/883/268814/24-4-883.pdf
Spicule Formation by Isolated Micromeres of the Sea Urchin Embryo,https://academic.oup.com/icb/article-pdf/15/3/567/6005724/15-3-567.pdf
"Spicule formation in the solitary ascidian, <i>herdmania momus</i>",https://onlinelibrary.wiley.com/doi/pdf/10.1002/jmor.1051920206
A Distinctive Sponge Spicule Assemblage from Organic Buildups in ...,https://www.jstor.org/stable/1303725
Spicule Formation in the Solitary Ascidian Bathypera feminalba ...,https://www.jstor.org/stable/3227036
[PDF] Quantifying Spicules - arXiv,https://arxiv.org/pdf/1208.4404
The Development and Structure of the Spicules in Sycons,https://journals.biologists.com/jcs/article-pdf/s2-49/194/231/1455183/231.pdf
REVISION OF SOLAR SPICULE CLASSIFICATION - IOPscience,http://iopscience.iop.org/0004-637X/750/1/16/pdf/apj_750_1_16.pdf
[PDF] 10. paleoenvironmental significance of siliceous sponge spicules ...,http://www-odp.tamu.edu/publications/101_SR/VOLUME/CHAPTERS/sr101_10.pdf
[PDF] A Study of Nail-Head Spicule Inclusion in Natural Gemstones - GIA,https://www.gia.edu/doc/A-Study-of-Nail-head-Spicule-Inclusions-in-Natural-Gemstones.pdf
"Spicule size variation in Xestospongia testudinaria Lamarck, 1815 at ...",https://aip.scitation.org/doi/pdf/10.1063/1.4985425
Structural Characterization of Siliceous Spicules from Marine Sponges,https://www.cell.com/biophysj/pdf/S0006-3495(04)74131-4.pdf
A technique for detecting matrix proteins in the crystalline spicule of ...,https://www.pnas.org/content/pnas/93/3/1282.full.pdf
[PDF] Sponge spicule assemblages from the Cambrian (Series 2–3) of ...,http://www.diva-portal.org/smash/get/diva2:1368272/FULLTEXT01.pdf
SPICULE-LIKE STRUCTURES OBSERVED IN THREE ...,http://iopscience.iop.org/0004-637X/701/2/1569/pdf/0004-637X_701_2_1569.pdf
Spicule Matrix Protein LSM34 Is Essential for Biomineralization of ...,https://www.sciencedirect.com/science/article/pii/S0014482701953984/pdf%3Fmd5%3D4362093c0c160358780fa79cc318fb50%26pid%3D1-s2.0-S0014482701953984-main.pdf%26_valck%3D1
The dynamics of spicule calcification in whole colonies of the ...,https://www.sciencedirect.com/science/article/pii/0022098189901573/pdf%3Fmd5%3D6cc369c799e18f5ef7d6da4a8eb898f6%26pid%3D1-s2.0-0022098189901573-main.pdf
[PDF] Morphogenesis of calcitic sponge spicules: a role for specialized ...,https://aizenberglab.seas.harvard.edu/files/1995_FASEBJ_0.pdf
[PDF] MECHANICAL DESIGN OF SPICULE-REINFORCED CONNECTIVE ...,https://citeseerx.ist.psu.edu/viewdoc/download%3Fdoi%3D10.1.1.538.8225%26rep%3Drep1%26type%3Dpdf
"Radiating Spicules, a Non-Specific Sign of Bone Disease",https://pubs.rsna.org/doi/pdf/10.1148/65.2.200
