"Variables, Conceptualization - SAGE Research Methods",https://methods.sagepub.com/reference/the-sage-encyclopedia-of-communication-research-methods/i15301.xml
Chapter Three | Conceptualizing your Survey Research Study,https://methods.sagepub.com/book/designing-and-doing-survey-research/i168.xml
"Chapter 2 Conceptualization, Assent, and Scientific Knowledge in",https://brill.com/view/book/9789004434523/BP000004.xml
How to Conceptualize an Introductory Course on the Academic ...,https://www.berghahnjournals.com/view/journals/religion-and-society/12/1/arrs120109.xml
Conceptualizing and Capturing Outcomes of Environmental ...,https://www.berghahnjournals.com/view/journals/environment-and-society/12/1/ares120110.xml
Conceptualization and Measurement of Fan Engagement: Empirical ...,https://journals.humankinetics.com/view/journals/jsm/28/4/article-p399.xml
Operationally Conceptualizing Physical Literacy: Results of a Delphi ...,https://journals.humankinetics.com/view/journals/jtpe/38/2/article-p91.xml
[PDF] CONCEPTUALIZATION OF LEGAL TERMS IN DIFFERENT FIELDS ...,https://sciendo.com/downloadpdf/journals/rela/9/1/article-p81.xml
"Conceptualizing the who, what, when, where, why and how of ...",https://www.elgaronline.com/view/edcoll/9781788112208/9781788112208.00031.xml
"Conceptualizing, Measuring, and Evaluating Improvement Networks",https://www.oxfordbibliographies.com/view/document/obo-9780199756810/obo-9780199756810-0271.xml
Conceptualizing non-state counter-terrorism in - ManchesterHive,https://www.manchesterhive.com/view/9781526157935/9781526157935.00009.xml
The Global Citizen Conceptualized : Accommodating Ambiguity,https://journals.scholarsportal.info/details/10283153/v21i0001/6_tgcc.xml
Conceptualizing Mathematically Significant Pedagogical ...,https://pubs.nctm.org/downloadpdf/journals/jrme/46/1/article-p88.xml
Conceptualizing the Impact of Dust-Contaminated Infrared ...,https://journals.ametsoc.org/downloadpdf/journals/atot/38/2/JTECH-D-19-0125.1.xml
On the pitfalls of conceptualizing excessive physical exercise as an ...,https://akjournals.com/view/journals/2006/aop/article-10.1556-2006.2022.00001/article-10.1556-2006.2022.00001.xml
Towards a New Conceptualization of Educational Research for ...,https://www.degruyter.com/view/j/dcse.2016.7.issue-2/dcse-2016-0017/dcse-2016-0017.xml%3Fformat%3DINT
Conceptualizing security in the Middle East in - Manchester Open Hive,https://www.manchesteropenhive.com/view/9781526137623/9781526137623.00007.xml
2015-43-8-1361-1370.xml - Social Behavior and Personality,https://www.sbp-journal.com/public/journals/1/files/2015-43-8-1361-1370.xml
Impact of International Service-Learning on Students' Global ...,https://ijrslce.scholasticahq.com/article/31305.xml
How the War Began: Conceptualizing Conflict Escalation in ...,https://www.schoeningh.de/view/journals/spsr/48/2/article-p135_2.xml
Reliability and correlations. - ClinMed International Library,https://clinmedjournals.org/articles/iaarm/international-archives-of-addiction-research-and-medicine-iaarm-6-033.xml
Conceptualizing and measuring culture in international business ...,https://sociorepec.org/publication.xml%3Fh%3Drepec:pal:jintbs:v:46:y:2015:i:9:p:1011-1027%26l%3Den
rsos.212022.xml - Cambridge Repository,https://www.repository.cam.ac.uk/bitstream/handle/1810/336846/rsos.212022.xml%3Fsequence%3D3%26isAllowed%3Dy
[PDF] Central Bank Financial Strength and Policy Performance,https://www.elibrary.imf.org/downloadpdf/journals/001/2008/176/article-A000-en.xml
Conceptualization of the effect of taxation on the development of ...,https://socionet.ru/publication.xml%3Fh%3Drepec:nos:lkhaof:20
Musica Ficta - Oxford History of Western Music,https://www.oxfordwesternmusic.com/view/Volume1/actrade-9780195384819-div1-008012.xml%3Frskey%3DT1nuEK%26result%3D426%26print%26print
Programma Dettagliato,https://aunicalogin.polimi.it/aunicalogin/getservizio.xml%3Fid_servizio%3D178%26c_classe%3D690147
conceptualizing journalism in times of global crises - Universität ...,https://www.uibk.ac.at/events/2022/05/10/risk-journalism-conceptualizing-journalism-in-times-of-global-crises.xml
School Psychology Forum (SPF),https://www.nasponline.org/x32323.xml
Comprehensive Examination - Midwestern University,https://www.midwestern.edu/glendale-az-campus-catalog/college-of-health-sciences/clinical-psychology-program/program-description/comprehensive-examination.xml
