Breakdown 2 Lowdown - Audioboom,https://audioboom.com/channels/5065248.rss
"Toledo's breaking news, sports, and entertainment ... - The Blade",https://www.toledoblade.com/frontpage/2008/01/13/Arts-retreats-beckon-crafters-veteran-and-novice/stories/feed/index.rss
I Always Wanted To - Libsyn,https://pod.link/alwayswanted.rss
ERAVE365 Live DJ Sets Podcast - Buzzsprout,https://feeds.buzzsprout.com/1230716.rss
"The Lit Up & Liberated Entrepreneur, from passion to profits, with ...",https://feeds.buzzsprout.com/680402.rss
Latest News - Young N Reckless Music,https://www.youngnrecklessmusic.com/blogs/latest-news.rss
One Nation Under A Groove Productions,http://onenationunderagroove.net/podcast/rss/groove.rss
