"Are We a Conversation? Hermeneutics, Exteriority, and ... - Brill",https://brill.com/view/journals/rip/47/3/article-p331_331.xml%3Flanguage%3Den
"Interiority, Exteriority and the Realm of Intentionality in - Brill",https://brill.com/view/journals/jpp/48/1/article-p39_2.xml%3Flanguage%3Den
From Slavery to What World?: Flight and Exteriority in Neil Roberts ...,https://journals.scholarsportal.info/details/1092311x/v20i0001/193_fstwwfinrfam.xml
CS27_2 final.indd - [17522293 - Critical Survey] Bacillophobia.pdf,https://www.berghahnjournals.com/pdfviewer/full/journals/critical-survey/27/2/cs270204.xml%3Fbg%3DGREY_COLOR_LIGHT_VARIANT%26mgs%3DPRIMARY_COLOR%26mge%3DPRIMART_COLOR_DARK_VARIANT
Augustine on the Metamorphosis of Interiority in - Wilhelm Fink Verlag,https://www.fink.de/abstract/book/edcoll/9783846765760/BP000021.xml
Can a Robot Be a Person? De-Facing Personhood and Finding It ...,https://jmt.scholasticahq.com/article/34128.xml
Chapter 3: Beyond the elephant of gentrification: relational ...,https://www.elgaronline.com/view/edcoll/9781785361739/9781785361739.00011.xml
Five: Disruptive bodies in - Bristol University Press Digital,https://bristoluniversitypressdigital.com/abstract/book/9781529202557/ch005.xml
"Symbols, Practices, and Institutional Contradictions",https://sk.sagepub.com/navigator/institutional-theory-in-organization-studies/n28.xml
"New Criticism, German werkimmanente Interpretation) operated",https://akjournals.com/previewpdf/journals/11059/14/2/article-p53.xml%3FpdfJsInlineViewToken%3D422568840%26inlineView%3Dtrue
