Chapter 4 Defamiliarizing Wombs and Imagining New Surrogacy in ...,https://brill.com/view/book/9789004468849/BP000013.xml%3Flanguage%3Den
Chapter 7 Masculine Uses of the Womb in the Renaissance in - Brill,https://brill.com/view/book/edcoll/9789004429734/BP000007.xml
Ectogenesis is for Feminists : Reclaiming Artificial Wombs from ...,https://journals.scholarsportal.info/details/23803312/v06i0001/nfp_eiff.xml
recast-jats-build ce88187742 medethics J Med Ethics jme Journal of ...,https://jme.bmj.com/content/45/11/728.download.xml
Gender & Nation - SAGE Books,https://sk.sagepub.com/books/gender-and-nation/n2.xml
Locating Cultural Change: Theory Method Process - SAGE Books,https://sk.sagepub.com/books/locating-cultural-change/n3.xml
"Modern Women, Mobility, and Maternity in: Journeys Volume 16 ...",https://www.berghahnjournals.com/abstract/journals/journeys/16/1/jy160103.xml
"Modern Women, Mobility, and Maternity in - Berghahn Journals",https://www.berghahnjournals.com/view/journals/journeys/16/1/jy160103.xml
The Greek Anthology 9 | Loeb Classical Library,https://www.loebclassics.com/view/greek_anthology_9/1917/pb_LCL084.59.xml%3FreadMode%3Drecto
