Meet the Funding Recipients - IDHS,https://www.dhs.state.il.us/page.aspx/FACT_1WhatIsVR.flv%3Fitem%3D128226
"""New film contest for teens focuses on racial healing"" (Fox Illinois ...",https://www.dhs.state.il.us/page.aspx/FACT_1WhatIsVR.flv%3Fitem%3D134876%26postdate%3D3/13/2021%26approval%3D4%26newsitemid%3D134474%26getpreviousnews%3Dtrue%26newssidebar%3D126286
"Filipinos Favor US Aid, Leery of China",https://www.malaysiasun.com/news/248746639/oct04v56.flv
"Tributes Pour In for Senator John McCain, But Not From Trump",https://www.northkoreatimes.com/news/257900604/oct04v40.flv
Ninth Rhino Dies at New Kenyan Sanctuary - Voice of America,https://www.sierraleonetimes.com/news/257693174/oct04v40.flv
Divide And Rule? Complex Ethnic Problems Dominate Bosnian ...,https://www.northernirelandnews.com/news/258088992/oct04v40.flv
Experts in absorbent products for urinary incontinence,http://www.indas.com/en/indas-for-you/Find-your-product/swf/parati_promociones.flv
tango.me - LiveOMG,http://liveomg.com/stream.flv%3Ffilter%3Dtango.me
Egomaniac (English Edition) Format Kindle - Vi Keeland - Amazon,http://www.multiup.org/fichiers/download/f0a03f68922edb906e06d99b76064e4c_Bivouac_-_France_2_-_15_Janvier_2013_-_0h40_-_704x400.flv%3F_locale%3Den
LK-Nhạc Sống DrumBa Bolero.||.Hòa Tấu-Hay. - YouTube,https://www.nhacsong.vn/videos.flv%3Fvid%3D28d1986c7
