"Local news, Weather, Sports, Free ... - SteinbachOnline.com",https://steinbachonline.com/images/stories/videos/street_tour~1.flv
"Local news, Weather, Sports, Free ... - SteinbachOnline.com",https://steinbachonline.com/images/stories/videos/flooding.flv
"Local news, Weather, Sports, Free Classifieds ... - PortageOnline.com",https://portageonline.com/images/stories/videos/portageex.flv
"News 13 | Florida News Video | Orlando, Daytona Beach",https://ifasgallery.ifas.ufl.edu/poncho69/Pool-Safety-0608.flv
Monday's weather: A hot start to the new week - News24,https://www.sierraleonetimes.com/news/259685322/feb24v21.flv
"Local news, Weather, Sports, Free ... - PembinaValleyOnline.com",https://www.pembinavalleyonline.com/images/stories/videos/winkler_fire_rescue_open_house_jaws2.flv
Cultural (100712_kikuyugrass.flv) | PACE Turf,https://www.paceturf.org/journal/category/Cultural/100712_kikuyugrass.flv
False Tsunami Warnings Sent Over Phones Spook Americans,https://www.philippinetimes.com/news/256389508/oct04v40.flv
FAO Food Price Index holds steady in August - Fao.org,https://www.srilankasource.com/news/257949778/oct04v40.flv
Perilous weather persists: Typhoon Jongdari imperils Japan,https://www.irishsun.com/news/257753442/oct04v56.flv
