"A de novo reference transcriptome for Bolitoglossa vallecula, an ...",https://europepmc.org/articles/pmc7038590/bin/mmc1.xml
Measuring Vallecular Volume on Flexible Endoscopic Evaluation of ...,https://journals.scholarsportal.info/details/0179051x/v36i0001/96_mvvofesapocs.xml
Lingual thyroid gland: it's time for awareness in,https://edm.bioscientifica.com/view/journals/edm/2020/1/EDM20-0026.xml
B) Tongue base hemiglosectomy; C) Posoperative MR,https://clinmedjournals.org/articles/jor/journal-of-otolaryngology-and-rhinology-jor-7-098.xml
Traumatic midline subarachnoid hemorrhage on initial computed ...,https://thejns.org/view/journals/j-neurosurg/129/5/article-p1317.xml
Cephalometric oropharynx and oral cavity analysis in Chiari ...,https://thejns.org/downloadpdf/journals/j-neurosurg/126/2/article-p626.xml
1. Introduction - Hindawi.com,https://downloads.hindawi.com/journals/ijoto/2015/780197.xml
1. Introduction - Hindawi.com,https://downloads.hindawi.com/journals/ijoto/2010/697583.xml
Untitled,http://d-scholarship.pitt.edu/cgi/export/36610/MODS/d-scholarship-36610.xml
