Construct Irrelevance - SAGE Research Methods,https://methods.sagepub.com/reference/the-sage-encyclopedia-of-educational-research-measurement-and-evaluation/i5811.xml
Entry Construct Irrelevance - SAGE Reference - The SAGE ...,https://sk.sagepub.com/reference/sage-encyclopedia-of-educational-research-measurement-evaluation/i5811.xml
[PDF] Construct Irrelevance - SAGE Research Methods,https://methods-sagepub-com-christuniversity.knimbus.com/base/download/ReferenceEntry/the-sage-encyclopedia-of-educational-research-measurement-and-evaluation/i5811.xml
View of Relevance and Irrelevance,https://journals.scholarsportal.info/pdf/25743430/v04i0001/nfp_rai.xml
Debt Overhang or Debt Irrelevance? Revisiting the Debt-Growth Link,https://www.elibrary.imf.org/view/journals/001/2005/223/001.2005.issue-223-en.xml
Debt Overhang or Debt Irrelevance? in - IMF eLibrary,https://www.elibrary.imf.org/view/journals/024/2010/001/article-A001-en.xml
The Irrelevance of Distribution for the Syllogism - Project Euclid,https://projecteuclid.org/journals/notre-dame-journal-of-formal-logic/volume-35/issue-3/The-Irrelevance-of-Distribution-for-the-Syllogism/10.1305/ndjfl/1040511349.xml
Myth of Scholarly Irrelevance for the United Nations,https://isr.oxfordjournals.org/content/13/1/18.source.xml
The Irrelevance of Aquinas' Uncaused Cause Argument in - Brill,https://brill.com/view/book/edcoll/9789004311589/B9789004311589-s008.xml
On the Irrelevance of the Beautiful in - Brill,https://brill.com/view/journals/rip/41/2/article-p287_8.xml%3Flanguage%3Den
On the Current State of Public Administration Research and ...,https://www.degruyter.com/view/j/nispa.2018.11.issue-2/nispa-2018-0011/nispa-2018-0011.xml
Testing the Modigliani-Miller Theorem of Capital Structure ...,https://sociorepec.org/publication.xml%3Fh%3Drepec:iie:wpaper:wp15-8%26l%3Den
Devolution and the Scottish Conservatives - manchester hive,https://www.manchesterhive.com/view/9781847794796/9781847794796.xml
Devolution and the Scottish Conservatives. Banal activism ...,https://www.berghahnjournals.com/view/journals/saas/20/3/j.1469-8676.2012.00213_19.x.xml
international-journal-of-toxicology-and-risk-assessment-ijtra-4-011.xml,https://clinmedjournals.org/articles/ijtra/international-journal-of-toxicology-and-risk-assessment-ijtra-4-011.xml
Emergence Phenomena in German - Heidelberg University Publishing,https://heiup.uni-heidelberg.de/reader/index/361/361-69-83994-1-10-20190212.xml
Journal for Research in Mathematics Education Volume 24 Issue 5 ...,https://pubs.nctm.org/view/journals/jrme/24/5/jrme.24.issue-5.xml
Chicago Scholarship Online - British Academy Scholarship,https://britishacademy.universitypressscholarship.com/archive/BRITISH_ACADEMY/2015/11/APPENDIX-1.xml
The Spanish Socialist Workers' Party in: In search of social democracy,https://www.manchesteropenhive.com/view/9781526125095/9781526125095.00012.xml
"SIDONIUS, Poems. Letters | Loeb Classical Library",https://www.loebclassics.com/view/LCL296/1936/pb_LCL296.lxxi.xml
biorxiv BIORXIV bioRxiv bioRxiv Cold Spring Harbor Laboratory ...,https://www.biorxiv.org/content/biorxiv/early/2017/07/18/161331.source.xml
Evaluating and Characterizing Human Rationales - ACL Anthology,https://aclanthology.org/2020.emnlp-main.747.xml
Neorealism - International Relations - Oxford Bibliographies,https://www.oxfordbibliographies.com/view/document/obo-9780199743292/obo-9780199743292-0037.xml
Today's Opinions | KYStandard.com,https://www.kystandard.com/opinion/todaysopinions/rss.xml%3Fpage%3D497%26destination%3Dopinion%252Ftodaysopinions%252Frss.xml%253Fpage%253D668%26mini%3Dcalendar-date%252F2016-07
Letter to the Editor - AVMA Journals,https://avmajournals.avma.org/downloadpdf/journals/javma/227/6/javma.2005.227.882.xml
Malpractice litigation following spine surgery in - Journal of ...,https://thejns.org/spine/view/journals/j-neurosurg-spine/27/4/article-p470.xml
conformance-doc.xml,https://docs.oasis-open.org/codelist/cs01-ContextValueAssociation-1.0/doc/conformance-doc.xml
Authorial irrelevance in Sábato's El Túnel in: Neohelicon Volume 35 ...,https://akjournals.com/view/journals/11059/35/1/article-p205.xml%3Frskey%3Ds2RZYF%26result%3D4360
109 HCON 319 : Expressing the sense of the Congress regarding ...,https://www.govinfo.gov/content/pkg/BILLS-109hconres319rh/xml/BILLS-109hconres319rh.xml
Exact Averaging of Atmospheric State and Flow Variables,https://journals.ametsoc.org/downloadpdf/journals/atsc/69/5/jas-d-11-0299.1.xml
