IDP Shibboleth V3 Login Form - Marist College,https://my.marist.edu/documents/810944/1920494/CiscoJabberSetup.msi
Download 7-Zip from SourceForge.net - Compression,https://www.7-zip.org/a/7z1600.msi
Download The VDMSound Project from SourceForge.net,https://prdownloads.sourceforge.net/vdmsound/VDMSound-2.0.4-WinNT-i386.msi%3Fdownload
Surge.msi | Villains Fanon Wiki - Fandom,https://villainsfanon.fandom.com/wiki/Surge.msi
Surge.msi | Near Pure Evil Wiki - Fandom,https://near-pure-evil.fandom.com/wiki/Surge.msi
End User Terms of Use & Export Compliance - Sophos,https://download.sophos.com/network/clients/SophosConnect_2.2.75_IPsec_and_SSLVPN.msi
Hunter College: Protected Download - CUNY,https://ww3.hunter.cuny.edu/files/icit/ps-pulse-win-5.2r6.0-b977-32bitinstaller.msi
"Steam, The Ultimate Online Game Platform",https://store.steampowered.com/about/SteamInstall.msi
