Meet the Funding Recipients - IDHS,https://www.dhs.state.il.us/page.aspx/FACT_1WhatIsVR.flv%3Fitem%3D128226
Egypt Sentences 75 to Death Over 2013 Sit-In Violence,https://www.sierraleonetimes.com/news/257959185/oct04v40.flv
Iran's Parliament Passes Bill Against Funding Terrorism,https://www.philippinetimes.com/news/258095659/oct04v56.flv
Anti-Trump Protests Planned Across US After Election Results,https://www.orangecountysun.com/news/249301131/oct04v40.flv
UNICEF - The Smurfs | Public Information Film Wiki - Fandom,http://pif.wikia.com/wiki/File:Unicef_-_The_Smurfs.flv
"Anti-Doping Agency Is Compromised, Group Contends",https://www.northkoreatimes.com/news/258025807/oct04v56.flv
Kyiv Ready To Exchange 23 Russians For Ukrainian Prisoners,https://www.irishsun.com/news/257602771/oct04v56.flv
Istanbul police detain 8 suspects over nightclub attack - News24,https://www.irishsun.com/news/250608455/feb24v21.flv
Tension Flares in Kosovo Over Possible Land Swap With Serbia,https://www.polandsun.com/news/258057585/feb24v21.flv
"Rights Group Accuses Mexican Military, Police of Unlawful Killings",https://www.illinoisintelligencer.com/news/258017887/oct04v40.flv
