9/11 Tribute Museum Expands Space for Personal Stories,https://www.oaklandtimes.com/news/253568455/feb24v21.flv
WAG 19-07-04-b: REDE Not Returned or Returned Late by MPR Unit,https://www.dhs.state.il.us/page.aspx/FACT_1WhatIsVR.flv%3Fitem%3D17573
"In Damascus, Syrians Dare to Hope that War's End May Be Near",https://www.northernirelandnews.com/news/257719139/oct04v40.flv
WATCH: Gatwick Airport suspends flights after drone sightings,https://www.irishsun.com/news/258645582/feb24v21.flv
Centre constitutes Competition Law Review Committee,https://www.malaysiasun.com/news/258064633/oct04v56.flv
At Least 74 People Killed In Forest Fires Near Athens,https://www.europesun.com/news/257726845/oct04v40.flv
World Tourism Day: harnessing new technologies to transform travel,https://www.northkoreatimes.com/news/258052055/oct04v56.flv
Violence Continues to Disrupt Life in Many Parts of Cameroon,https://www.sierraleonetimes.com/news/257981369/oct04v56.flv
Iran Guard Launches Missiles into Syria over Parade Attack,https://www.iranherald.com/news/258064738/oct04v40.flv
Expert's take: Why women must be at the heart of the humanitarian ...,https://www.trinidadtimes.com/news/248567191/oct04v56.flv
"Hard to See, Hard to Breathe: US West Struggles with Smoke",https://www.batonrougepost.com/news/257869547/oct04v56.flv
Ethiopian Conflict Disrupts School for Tens of Thousands,https://www.madagascarsun.com/news/257556197/oct04v40.flv
Turkey's Erdogan Wins New Term In Poll Criticized By Monitors,https://www.southamericatimes.com/news/257556113/oct04v56.flv
Chapter 5: AcuServer Functions - Die Blumengalerie,https://www.blumengalerie.at/videos/VTS_02_1.flv
心情日记| 红楼阁REDdist,https://www.reddist.com/taxonomy/term/13/sample.FLV%3Fpage%3D785
心情日记| 红楼阁REDdist,https://www.reddist.com/taxonomy/term/13/sample.FLV%3Fpage%3D695
"Trump slams Sessions again, says Russia probe is AG's fault",https://www.stpetersburgstar.com/news/257422535/oct04v40.flv
https://www.gdqyfw.com/1640246665_srs%20(2).flv?do...,https://www.gdqyfw.com/1640246665_srs%2520(2).flv%3Fdownload%3Dtrue
"ISIS claims Kabul attacks, as U.S. warns of Taliban threat",https://www.nepalnational.com/news/257854730/oct04v40.flv
