"Administrator, Rural Utilities Service. - GovInfo",https://www.govinfo.gov/content/pkg/FR-2010-09-29/xml/FR-2010-09-29.xml
"Narrative event boundaries, reading times, and expectation ...",https://journals.scholarsportal.info/details/0090502x/v44i0007/1064_nebrtae.xml
Ditransitive constructions with two human non-agentive arguments,https://brill.com/previewpdf/journals/fdl/39/1/article-p141.xml
Expected and Unexpected Stressors in Major International ...,https://journals.humankinetics.com/view/journals/tsp/16/1/article-p20.xml
Abstract - medRxiv,https://www.medrxiv.org/content/medrxiv/early/2021/09/14/2021.09.09.21263341.source.xml
Hasyarasa at SemEval-2020 Task 7 - ACL Anthology,https://aclanthology.org/2020.semeval-1.105.xml
Acting Assistant Commissioner for Policy. - Federal Register,https://www.federalregister.gov/documents/full_text/xml/2010/09/29/2010-24296.xml
Commissioner of Food and Drugs. - Federal Register,https://www.federalregister.gov/documents/full_text/xml/2022/05/23/2022-10458.xml
