Sayyids of Hadhramaut in Early Modern India - Brill,https://brill.com/downloadpdf/journals/ajss/32/3/article-p329_3.xml
"Shah Abuʾl-Maʿali , Mir Sayyid ʿAli, and the Sayyids of Tirmiz - Brill",https://brill.com/view/journals/muqj/35/1/article-p125_6.xml%3Flanguage%3Den
Sacred Lineages of Samarqand: History and Identity - Berghahn ...,https://www.berghahnjournals.com/downloadpdf/journals/ame/15/1/ame150104.xml
Sayyid Qutb - Islamic Studies - Oxford Bibliographies,https://www.oxfordbibliographies.com/view/document/obo-9780195390155/obo-9780195390155-0072.xml
Sayyid Ahmad Khan - Islamic Studies - Oxford Bibliographies,https://www.oxfordbibliographies.com/view/document/obo-9780195390155/obo-9780195390155-0069.xml
Sayyid Qutb's political and religious thought - Elgaronline,https://www.elgaronline.com/view/journals/lath/2-1/lath.2014.01.04.xml
El Sayyid Nosair - SAGE Reference - Encyclopedia of Terrorism,https://sk.sagepub.com/reference/terrorism/n312.xml
the MaKing of the “indian araB” and the tale of saYYid fadl - De Gruyter,https://www.degruyter.com/hup/downloadpdf/book/9780674286894/10.4159/9780674286894-005.xml
The roots of radical Islam In his new documentary Why They Hate ...,https://edition.cnn.com/video/data/3.0/video/tv/2016/05/20/exp-sayyid-qutb-why-they-hate-us.cnn/index.xml
Hādhā Kitāb Ḥiṣn al-ḥaṣīn min kalām Sayyid al-Mursalīn. - OPenn,https://openn.library.upenn.edu/Data/0033/uts_ms_011_arabic/data/uts_ms_011_arabic_TEI.xml
