boram/LICENSE.MPV at master - GitHub,https://github.com/Kagami/boram/blob/master/licenses/LICENSE.MPV
Comparison: KMPlayer - All Video Player vs mpv-android,https://appgrooves.com/compare/app-kmplayer-mirror-mode-hd-by-pandoratv-co-ltd/android-is.xyz.mpv
Comparison: VRTV VR Video Player vs mpv-android - AppGrooves,https://appgrooves.com/compare/android-se.chai.vrtv/android-is.xyz.mpv
KORVUE Provider App and SDK intelligence | Mobile App and SDK ...,https://mightysignal.com/a/android/com.korvue.mpv
KORVUE Provider for Android - APK Download - APK Pure,https://apkpure.com/es/korvue-provider/com.korvue.mpv
KORVUE Provider cho Android - Tải về APK - APK Pure,https://apkpure.com/vn/korvue-provider/com.korvue.mpv
