PCL22-186: A Potential Biomarker for Radiosensitivity of Squamous ...,https://jnccn.org/view/journals/jnccn/20/3.5/article-pPCL22-186.xml
Intrinsic radiosensitivity and repair of sublethal radiation-induced ...,https://avmajournals.avma.org/view/journals/ajvr/69/9/ajvr.69.9.1197.xml
Radiosensitive hemangiopericytoma of the falx,https://thejns.org/downloadpdf/journals/j-neurosurg/68/4/article-p640.xml
The impact of radiosurgery fractionation and tumor radiobiology on ...,https://thejns.org/view/journals/j-neurosurg/119/5/article-p1131.xml
Individual radiosensitivity in a breast cancer collective is changed ...,https://www.degruyter.com/view/j/raon.2014.48.issue-1/raon-2013-0061/raon-2013-0061.xml
The radiation response of hormone-resistant prostate cancer ...,https://erc.bioscientifica.com/view/journals/erc/14/3/0140633.xml
[PDF] Radiation Therapy in Adult Soft Tissue Sarcoma—Current ... - MDPI,https://journals.scholarsportal.info/pdf/20726694/v12i0011/nfp_rtiastdaraeo.xml
"[PDF] 1α,25(OH)2D3 Radiosensitizes Cancer Cells by Activating the ...",https://journals.scholarsportal.info/pdf/16639812/v11inone/nfp_1rccbatnp.xml
Phantom positioned in the isocenter of the gantry.,https://clinmedjournals.org/articles/ijrit/international-journal-of-radiology-and-imaging-technology-ijrit-6-071.xml
