Undertreatment in a nonselected population of adult patients with ...,https://www.jacionline.org/article/S0091-6749(96)70084-2/pdf
"Thyroid Activity of Selected, Nonselected, and Dwarf Broiler Lines",https://www.sciencedirect.com/science/article/pii/S0032579119461610/pdf%3Fmd5%3Dd14ec10c20fd65175e553b8f7f5aac90%26pid%3D1-s2.0-S0032579119461610-main.pdf
A Method for Generating Hybrids Containing Nonselected ...,https://www.sciencedirect.com/science/article/pii/0888754389902747/pdf%3Fmd5%3D2be69c744f3e4bcbac07cbb020066618%26pid%3D1-s2.0-0888754389902747-main.pdf%26_valck%3D1
Selection Efficiency in a Nonselected Population of Loblolly Pine,https://academic.oup.com/forestscience/article-pdf/40/3/452/22549733/forestscience0452.pdf
[PDF] The ingredients of nonselected NP resultatives - Stanford University,http://web.stanford.edu/~bclevin/utah15res.pdf
Transfer of nonselected transferable day 3 embryos in low embryo ...,https://www.fertstert.org/article/S0015-0282(03)02248-9/pdf
The Multilink Duet in Acute Myocardial Infarction (MIAMI) Trial,https://onlinelibrary.wiley.com/doi/pdf/10.1002/1522-726X%2528200011%252951%253A3%253C273%253A%253AAID-CCD5%253E3.0.CO%253B2-P
post-tonsillectomy and -adenoidectomy hemorrhage in,https://journals.sagepub.com/doi/pdf/10.1177/000348940311200113
Selected Sperm Differ from Nonselected Cells in Their ...,https://www.tandfonline.com/doi/pdf/10.3109/01485019208987703
Postpartum Thyroiditis: Epidemiology and Clinical Evolution,https://www.liebertpub.com/doi/pdf/10.1089/thy.2000.10.71
[PDF] Article 4 Binocular Measurements in a Nonselected Group of Non,https://www.ovpjournal.org/uploads/2/3/8/9/23898265/ovp6-1_article_skjold_web.pdf
PULMONARY HYPERTENSION ASSOCIATED WITH SARCOIDOSIS,http://journal.chestnet.org/article/S0012-3692(16)51673-0/pdf
The fate of nonselected activity in saccadic decisions: distinct goal ...,https://journals.physiology.org/doi/pdf/10.1152/jn.00254.2017
[PDF] Nonselected Use of Direct Coronary Stenting. The DISCO 2 Trial,https://www.revespcardiol.org/index.php%3Fp%3Drevista%26tipo%3Dpdf-simple%26pii%3D13049670
The effect of prenatal vaginal progesterone on cervical length in ...,https://www.tandfonline.com/doi/pdf/10.1080/14767058.2017.1403577
The consequence of refreshing for access to nonselected items in ...,https://link.springer.com/content/pdf/10.3758/MC.37.2.164.pdf
[PDF] Figure S7. Depth of env epitope recognition by Emv2 ... - PLOS,https://journals.plos.org/plospathogens/article/file%3Ftype%3Dsupplementary%26id%3Dinfo:doi/10.1371/journal.ppat.1002709.s007
Physical Performance Differences Between Spanish Selected and ...,https://journals.humankinetics.com/downloadpdf/journals/ijspp/16/11/article-p1676.pdf
Endovascular Treatment of Middle Cerebral Artery Aneurysms for ...,http://www.ajnr.org/content/35/4/715.full.pdf
[PDF] Adaptive Mutation: Has the Unicorn Landed? - NCBI,https://www.ncbi.nlm.nih.gov/pmc/articles/PMC1460081/pdf/9560365.pdf
