Purpose Unstoppable - Subscribe on Android,https://www.subscribeonandroid.com/purposeunstoppable.podbean.com/feed.xml
"“Unstoppable” Germany, “unbeatable” Britain ... - manchester hive",https://www.manchesterhive.com/view/9781526157300/9781526157300.00010.xml
"“Unstoppable” Germany, “unbeatable” Britain ... - manchester hive",https://www.manchesterhive.com/abstract/9781526157300/9781526157300.00010.xml
Follow Unlocking Unstoppable Love on Podbean iPhone and ...,https://www.podbean.com/site/podcatcher/index/feedurl/https%25253A%25252F%25252Ffeed.podbean.com%25252Funlockingunstoppablelove%25252Ffeed.xml
An Unstoppable Force Meets a Movable Object? Assignment ... - Brill,https://brill.com/downloadpdf/journals/alq/19/1/article-p169_5.xml
An Unstoppable Force Meets a Movable Object? Assignment ... - Brill,https://brill.com/view/journals/alq/19/1/article-p169_5.xml%3Flanguage%3Den
Restaurant Unstoppable with Eric Cacciatore - Libsyn,https://www.ivoox.com/restaurant-unstoppable-with-eric-cacciatore_fg_f1184773_filtro_1.xml
The unstoppable glottal: tracking rapid change in an iconic British ...,https://journals.scholarsportal.info/details/13606743/v22i0003/323_tugtrciaibv.xml
Unstoppable climate change? The influence of fatalistic beliefs ...,https://journals.scholarsportal.info/details/14693062/v19i0004/511_ucctiocawtpc.xml
primary_doc.xml - SEC Report,https://sec.report/Document/0001920857-22-000001/primary_doc.xml
