Interaction of Low-Level Flow with the Western Ghat Mountains and ...,https://journals.ametsoc.org/view/journals/mwre/112/4/1520-0493_1984_112_0652_iollfw_2_0_co_2.xml
Role of Eastern Ghats Orography and Cold Pool in an Extreme ...,https://journals.ametsoc.org/view/journals/mwre/146/4/mwr-d-16-0473.1.xml
INFLUENCE OF PROVENANCE VARIATION ON WOOD ... - Brill,https://brill.com/view/journals/iawa/25/3/article-p273_2.xml%3Flanguage%3Den
influence of provenance variation on wood properties of teak ... - Brill,https://brill.com/downloadpdf/journals/iawa/25/3/article-p273_2.xml
"Genus Diplasiolejeunea (Lejeuneaceae, Porellales) New to India ...",https://akjournals.com/view/journals/034/63/3-4/article-p285.xml
Estimating population sizes of leopard cats in the Western Ghats ...,https://bioone.org/journals/journal-of-mammalogy/volume-96/issue-4/gyv079/Estimating-population-sizes-of-leopard-cats-in-the-Western-Ghats/10.1093/jmammal/gyv079.xml
Spatio-temporal precipitation variability over Western Ghats and ...,https://journals.scholarsportal.info/details/23636203/v03i0004/1611_spvowguhrogd.xml
soundslide.xml - NPR,http://www.npr.org/assets/multimedia/2010/04/grandtrunk/puja/soundslide.xml
Biochemical composition of two giant pill-millipedes of the Western ...,https://www.degruyter.com/view/j/biolet.2015.52.issue-1-2/biolet-2015-0014/biolet-2015-0014.xml%3Fformat%3DINT
