Macroeconomic Analyses | Embassy of the Czech Republic in Ankara,https://www.mzv.cz/ankara/en/economy_and_trade/macroeconomic_analyses/index.rss%3Fforce_format%3Dmobile
Redzone Podcast: How to Make Better Decisions Faster - Audioboom,https://audioboom.com/channels/4975853.rss
Career planning | Accounting Today,https://www.taxprotoday.com/tag/career-planning.rss
Algorithm Design and Analysis - UC Davis,http://itunescontent.ucdavis.edu/media/2010/FA/ECS122A/118.rss
"Chemistry enhanced podcasts, Imperial College London.",https://www.ch.ic.ac.uk/local/podcasts/index.rss
Mystery and Murder: Analysis by Dr. Phil - Megaphone,https://www.omnycontent.com/d/playlist/aaea4e69-af51-495e-afc9-a9760146922b/bc09518e-11a9-40e3-a28b-aadc00157de7/439b9640-b7e7-41b6-94e4-aadc0015bf98/podcast.rss
The Daily Standard Podcast - Your conservative source for analysis ...,https://wps3.washingtonexaminer.com/podcasts/daily-standard/daily-standard.rss
Law360's Pro Say - News & Analysis on Law and the Legal Industry,https://www.law360.com/podcasts/feed.rss
Faculty of Mathematics - OVGU,https://www.ovgu.de/unimagdeburg/en/Research/Research%2BProfile/Faculty%2BResearch%2BTopics/Faculty%2Bof%2BMathematics-p-35128.rss
