"PHILO, On the Unchangeableness of God | Loeb Classical Library",https://www.loebclassics.com/view/philo_judaeus-unchangeableness_god/1930/pb_LCL247.43.xml
Introduction in: Brill's Companion to Euripides (2 vols),https://brill.com/view/book/edcoll/9789004435353/BP000001.xml%3Flanguage%3Den
The League of Nations and the Power of “Experiment Narratives” in ...,https://brill.com/downloadpdf/journals/iclr/22/3-4/article-p275_2.xml
SAGE Reference - The SAGE Handbook of Applied Social Psychology,https://sk.sagepub.com/reference/the-sage-handbook-of-applied-social-psychology/i2075.xml
"Spirituality, Religion, and Aging: Illuminations for Therapeutic Practice",https://sk.sagepub.com/books/spirituality-religion-and-aging/i1526.xml
On the Move in Cattle Country: Tracking Nomadic Pastoralists in ...,https://www.ajtmh.org/view/journals/tpmd/99/1/article-p9.xml
Short Medical Trip to Ghana: A Reality Check in,https://www.ajtmh.org/view/journals/tpmd/101/5/article-p958.xml
"<emph>Battles and Victories of Allen Allensworth, AM, Ph. D ...",https://docsouth.unc.edu/neh/alexander/alexander.xml
Cooperation and competition in: Beyond the state,https://www.manchesteropenhive.com/view/9781526137074/9781526137074.00012.xml
"[PDF] missions, the colonial state and constructing a health system in ...",https://www.manchesteropenhive.com/downloadpdf/9781526137074/9781526137074.00012.xml
