[PDF] Supramolecular Biopolymers II,https://www.mpikg.mpg.de/864588/Polysaccharide.pdf
Polysaccharides in Human Health Care - SAGE Journals,https://journals.sagepub.com/doi/pdf/10.1177/1934578X1701200604
Polysaccharides in Oral Drug Delivery - American Chemical Society,https://pubs.acs.org/doi/pdf/10.1021/bk-2009-1017.ch001
Strategy for Structural Elucidation of Polysaccharides,https://pubs.acs.org/doi/pdf/10.1021/acs.analchem.9b00789
Bacterial Polysaccharides: An Overview - Springer Link,https://link.springer.com/content/pdf/10.1007%252F978-3-319-16298-0_68.pdf
[PDF] Versatile Types of Polysaccharide-Based Drug Delivery Systems,https://www.mdpi.com/1422-0067/21/23/9159/pdf
the size and shape of some polysaccharide molecules by c. t. ...,https://www.sciencedirect.com/science/article/pii/S0096533208600879/pdf%3Fmd5%3D5c838cc9df312e9d41f757b4024ced00%26pid%3D1-s2.0-S0096533208600879-main.pdf%26_valck%3D1
ORIGINS AND STABILITY OF SOIL POLYSACCHARIDE - Wiley,https://bsssjournals.onlinelibrary.wiley.com/doi/pdf/10.1111/j.1365-2389.1977.tb02290.x
Polysaccharide Nomenclature - Wiley Online Library,https://onlinelibrary.wiley.com/doi/pdf/10.1111/j.1432-1033.1982.tb06799.x
[PDF] Safety Assessment of Polysaccharide Gums as Used in Cosmetics,https://www.cir-safety.org/sites/default/files/plpogu092015final.pdf
