Download 7-Zip from SourceForge.net - Compression,https://www.7-zip.org/a/7z1514.msi
Download 7-Zip from SourceForge.net,https://www.7-zip.org/a/7z1600.msi
Calibre download latest version - FOSSHUB,https://elibrary.mediu.edu.my/books/downloads/Ebook%2520Reader/calibre-64bit-4.0.0.msi
Download TortoiseSVN from SourceForge.net,https://nchc.dl.sourceforge.net/project/tortoisesvn/1.9.6/Application/TortoiseSVN-1.9.6.27867-x64-svn-1.9.6.msi
"Berita Kolom Dr. Drs. I Ketut Suweca, M.Si Terbaru Hari ini",https://kolom.kompas.com/2781/dr.drs.i.ketut.suweca.msi
Fpfisu.neshly.com is for sale! | TRUSTEDNAMES,http://fpfisu.neshly.com/Zultys_Fax_2.0_x64_Server.msi
تحریک منہاج القرآن شرقپور شریف کے زیراہتمام 23واں ماہانہ درس عرفان ...,https://www.minhaj.org/ur.php/images-db/downloads/CompactUrduFonts.msi%3Ftid%3D7596
