A Comparison of Both Motorized and Nonmotorized Treadmill Gait ...,https://journals.humankinetics.com/view/journals/jsr/27/4/article-p357.xml
A Comparison of Both Motorized and Nonmotorized Treadmill Gait ...,https://journals.humankinetics.com/abstract/journals/jsr/27/4/article-p357.xml
Chapter 8: Non-motorized transport development in Chinese cities in,https://www.elgaronline.com/view/edcoll/9781786439239/9781786439239.00014.xml
Encyclopedia of Transportation: Social Science and Policy,https://sk.sagepub.com/reference/encyclopedia-of-transportation/n355.xml
BILLS-115s2877is.xml - Govinfo.gov,https://www.govinfo.gov/content/pkg/BILLS-115s2877is/xml/BILLS-115s2877is.xml
xml - Govinfo.gov,https://www.govinfo.gov/bulkdata/BILLS/114/2/s/BILLS-114s3205is.xml
Recreational Kayak and Non Motorized Vessel Fishing,https://www.arcgis.com/sharing/rest/content/items/5bfebe8f92284d998a6567b509dbd5bc/info/metadata/metadata.xml%3Fformat%3Ddefault%26output%3Dhtml
SHARED-USE NONMOTORIZED (SUN) TRAIL NETWORK IN ...,https://www.fgdl.org/metadata/fgdc_xml/suntrailnetwork_aug19.shp.xml
Prediction of belt sag on a non-motorized curved treadmill,https://journals.scholarsportal.info/details/22347593/v18i0003/359_pobsoanct.xml
Measuring relative non-motorized accessibility to retail activities,https://resolver.scholarsportal.info/resolve/15568318/v13i0009/639_mrnatra.xml
