slack-electioneer/requirements.txt at master · takwas/slack ... - GitHub,https://github.com/takwas/slack-electioneer/blob/master/requirements.txt
98-1204a.txt - US Court of Appeals - DC Circuit,https://www.cadc.uscourts.gov/internet/opinions.nsf/C9939476C32D574A85256F15006C1749/%24file/98-1204a.txt
United States Court of Appeals FOR THE DISTRICT OF COLUMBIA ...,https://www.cadc.uscourts.gov/internet/opinions.nsf/D085BA2DCEECCA2185256F7A00641F6F/%24file/00-1238a.txt
abase abash abbreviate abduct abet abhor abjure abnegate abolish ...,https://faculty.sbs.arizona.edu/hammond/ling578-sp19/verbs.txt
"address to the Voters of Wilkes, 1830 - USGenWeb Archives",http://files.usgwarchives.net/nc/wilkes/history/other/election.txt
"OPINION annually, but enforces the statute requiring vehicle inspec ...",https://scholarworks.iupui.edu/bitstream/1805/293/70/1968%2520Ind%2520Op%2520Att%2527y%2520Gen%252078.pdf.txt
macrcode.txt - California Department of Justice,https://www.oag.ca.gov/sites/all/files/agweb/law-enforcement/code-tables/macrcode.txt%3F051420190957
"Good afternoon. I'm Susan Collins, the Joan and Sanford Weill Dean ...",https://fordschool.umich.edu/sites/default/files/2014-gerken-citizens-united.txt
00001.txt,https://ufdcimages.uflib.ufl.edu/AA/00/08/15/00/00598/00001.txt
