"Ambassador Zdeněk Lyčka's article ""An Exemplary Life Is Not ...",https://www.mzv.cz/copenhagen/en/news/x2010/ambassador_zdenek_lycka_s_article_an.rss
More Exemplary - Buzzsprout,https://feeds.buzzsprout.com/862984.rss
Lessons from those who mean it | The Blade,https://www.toledoblade.com/Opinion/Editorials/2016/04/21/Lessons-from-those-who-mean-it/stories/feed/feed/index.rss
BEDFORD JUNIOR HIGH IS A WINNER | The Blade,https://www.toledoblade.com/East/2006/05/18/BEDFORD-JUNIOR-HIGH-IS-A-WINNER/stories/feed/index.rss
180 Degrees - Audioboom,https://audioboom.com/channels/5003824.rss
Albanian Friday Sermon by Head of Ahmadiyya Muslim Community,https://www.alislam.org/friday-sermon/podcasts/rss/friday-sermon-al.rss
Search results for Law) 0 10 1882 http://library.ncirl.ie/items/7313 ...,https://library.ncirl.ie/items.rss%3Fquery%3DLaw%2529%26offset%3D0
