Reviewer Information - SPIE Digital Library,http://spie.org/x993.xml
SPIE Journals Reviewer Information,https://spie.org/x87371.xml
JAVMA Reviewers 2021 in - AVMA Journals - American Veterinary ...,https://avmajournals.avma.org/abstract/journals/javma/260/7/javma.260.7.773.xml
Reviewers for Volume 39 - ACL Anthology,https://aclanthology.info/papers/J13-4010/j13-4010.xml
Acknowledgment of Reviewers in: IAWA Journal Volume 43 ... - Brill,https://brill.com/view/journals/iawa/43/1-2/article-p217_15.xml
How to Be a More Effective Reviewer in - AMS Journals,https://journals.ametsoc.org/view/journals/mwre/150/6/MWR-D-22-0102.1.xml
Reviewers for Volume 44 - ACL Anthology,https://aclanthology.coli.uni-saarland.de/papers/J18-4013/j18-4013.xml
ASN Journals Extends Gratitude to Top Five Reviewers of 2021,https://www.kidneynews.org/view/post/publications-0/jasn-cjasn-kidney360-recognize-2021-top-5-reviewers.xml
Acknowledgement to reviewers in - Reproduction - Bioscientifica,https://rep.bioscientifica.com/view/journals/rep/163/1/REP-163-A1.xml
