Pharmacokinetics of butorphanol tartrate in red-tailed hawks (Buteo ...,https://avmajournals.avma.org/view/journals/ajvr/69/5/ajvr.69.5.596.xml
Pharmacokinetics of butorphanol tartrate in a long-acting poloxamer ...,https://avmajournals.avma.org/view/journals/ajvr/78/6/ajvr.78.6.688.xml
[PDF] Vinorelbine Tartrate - Ashp Publications,https://publications.ashp.org/previewpdf/book/9781585286850/ch400.xml%3FpdfJsInlineViewToken%3D31127696%26inlineView%3Dtrue
Effect of Zolpidem Tartrate on the Developmental Rate of ... - BioOne,https://bioone.org/journals/journal-of-medical-entomology/volume-58/issue-6/tjab071/Effect-of-Zolpidem-Tartrate-on-the-Developmental-Rate-of-Forensically/10.1093/jme/tjab071.xml
Corrigendum to: Effect of Zolpidem Tartrate on the Developmental ...,https://bioone.org/journals/journal-of-medical-entomology/volume-59/issue-2/tjab204/Corrigendum-to--Effect-of-Zolpidem-Tartrate-on-the-Developmental/10.1093/jme/tjab204.xml
"Synthesis, characterization and thermal behaviour of solid-state ...",https://akjournals.com/downloadpdf/journals/10973/105/3/article-p867.xml
Stress degradation studies on zolpidem tartrate using LC-DAD and ...,https://akjournals.com/view/journals/1326/26/1/article-p81.xml
Transdermal delivery of tolterodine tartrate for overactive bladder ...,https://www.degruyter.com/view/j/acph.2017.67.issue-3/acph-2017-0027/acph-2017-0027.xml
Effects of Four Weeks L-Carnitine L-tartrate Ingestion on Substrate ...,https://journals.humankinetics.com/view/journals/ijsnem/15/6/article-p665.xml
