Prevalence of diaphragmatic muscle weakness and dyspnoea in ...,https://eje.bioscientifica.com/view/journals/eje/147/3/299.xml
Prevalence of diaphragmatic muscle weakness and dyspnoea in ...,https://eje.bioscientifica.com/downloadpdf/journals/eje/147/3/299.xml
Sensory experience of dyspnoea - BMJ Open Respiratory Research,https://bmjopenrespres.bmj.com/content/7/1/e000493.download.xml
Acta Physiologica Hungarica Volume 102 Issue 2 (2015) - AKJournals,https://akjournals.com/view/journals/036/102/2/article-p163.xml
Echocardiographic subtypes of heart failure in consecutive ...,https://journals.scholarsportal.info/details/20533624/v06i0001/nfp_esohfichpwd.xml
An interesting case of progressive dyspnoea and diffuse mediastinal ...,https://journals.scholarsportal.info/details/18106838/v17i0001/nfp_aicopdmaia2m.xml
young woman with shortness of breath | European Heart Journal,https://eurheartj.oxfordjournals.org/content/37/16/1311.source.xml
international-journal-of-critical-care-and-emergency-medicine ...,https://clinmedjournals.org/articles/ijccem/international-journal-of-critical-care-and-emergency-medicine-ijccem-4-033.xml
What Is Your Diagnosis? in - AVMA Journals - American Veterinary ...,https://avmajournals.avma.org/abstract/journals/javma/258/4/javma.258.4.365.xml
A bolt from the blue; A case report of an unusual asthma exacerbation,https://europepmc.org/articles/pmc6938945/bin/mmc1.xml
