RingMaster/owners.txt at master - GitHub,https://github.com/Azure/RingMaster/blob/master/owners.txt
Form of Shopping Center Management Agreement between owners ...,http://www.sec.gov/Archives/edgar/data/899715/000089971503000190/tfocform8kex102.txt
lr96-01.txt - HUD,https://www.hud.gov/sites/documents/lr96-01.txt
Top land owners - Manatee County Property Appraiser,https://www.manateepao.gov/data/top_acreage.txt
Major Foreign Holders of Treasury Securities,https://ticdata.treasury.gov/Publish/mfh.txt
"After 30+ years, Eclectic Cafe owner most proud of legacy | Profiles",http://www.azbiz.com/articles/2011/02/05/news/profiles/doc4d4aeb5b98f26185181771.txt
Original Land Owners Of Thornton Township - USGenWeb Archives,http://files.usgwarchives.net/il/cook/deeds/thornton.txt
1850 Federal Census Slave Owners - USGenWeb Archives,http://files.usgwarchives.net/ga/baldwin/census/1850/slaveowners.txt
Owner's Club West Coast LLC Reg D SEC Securities Filing,https://disclosurequest.com/form/owners-club-west-coast-llc/0001214659-21-010711/0001214659-21-010711.txt
