Complications and outcomes associated with laparoscopic-assisted ...,https://avmajournals.avma.org/view/journals/javma/aop/javma.21.12.0536/javma.21.12.0536.xml
Development and evaluation of a high-fidelity canine laparoscopic ...,https://avmajournals.avma.org/view/journals/javma/254/1/javma.254.1.113.xml
laparoscopic pregnancy diagnosis and uterine fluid recovery in swine,https://rep.bioscientifica.com/downloadpdf/journals/rep/44/2/jrf_44_2_011.xml
Laparoscopic placement of distal ventriculoperitoneal shunt ...,https://thejns.org/pediatrics/view/journals/j-neurosurg-pediatr/2/4/article-p282.xml
Laparoscopy versus mini-laparotomy peritoneal catheter insertion of ...,https://thejns.org/focus/view/journals/neurosurg-focus/41/3/article-pE7.xml
[PDF] Development of a standardized laparoscopic caecum resection ...,https://journals.scholarsportal.info/pdf/09492321/v19i0001/33_doaslctslair.xml
Outcome measurement in laparoscopic cholecystectomy by using a ...,https://intqhc.oxfordjournals.org/content/20/2/144.source.xml
Gallbladder Surgery (Cholecystectomy) - My Doctor Online,https://mydoctor.kaiserpermanente.org/ncal/structured-content/Procedure_Gallbladder_Surgery_Cholecystectomy_-_Surgery.xml%3Fco%3D/regions/ncal
Laparoscopic Excision of a Primary Giant Splenic Hydatid Cyst ...,https://www.ajtmh.org/view/journals/tpmd/101/4/article-p821.xml
