SEC FORM D/A,https://www.sec.gov/Archives/edgar/data/1734482/000089552720000010/xslFormDX01/primary_doc.xml
descriptions of the pharos of alexandria - Brill,https://brill.com/previewpdf/book/edcoll/9789004231948/B9789004231948_020.xml
DESCRIPTIONS OF THE PHAROS OF ALEXANDRIA IN ISLAMIC ...,https://brill.com/downloadpdf/book/edcoll/9789004231948/B9789004231948_020.xml
Pharos: accurate and decentralised network coordinate system ...,https://journals.scholarsportal.info/details/17518628/v03i0004/539_paadncs.xml
Search Engines of the Future: The Pharos project - for iPod/iPhone,http://media-podcast.open.ac.uk/feeds/ou-research-pharos/ipod-all/rss2.xml
wp-sitemap-posts-page-1.xml - Pharos Arts Foundation,https://pharosartsfoundation.org/wp-sitemap-posts-page-1.xml
wp-sitemap-posts-event-1.xml - Pharos Arts Foundation,https://pharosartsfoundation.org/wp-sitemap-posts-event-1.xml
"NPI Database | NPI:1891122396 | PHAROS GROUP, LLC | Medical ...",https://www.hipaaspace.com/medical_billing/coding/national_provider_identifier/codes/npi_1891122396.xml
Pharos the Egyptian and consumer culture - manchester hive,https://www.manchesterhive.com/downloadpdf/9781526141897/9781526141897.00014.xml
