Children's and Teenagers' Perceptions of Peer Relationships in the ...,https://journals.humankinetics.com/view/journals/jsep/18/4/article-p347.xml
Friendship Quality in Youth Disability Sport: Perceptions of a Best ...,https://journals.humankinetics.com/view/journals/apaq/19/4/article-p472.xml
Arnolfini's best friend in - Brill,https://brill.com/view/journals/nkjo/70/1/article-p20_3.xml%3Flanguage%3Den
"Kate Harrison Friend papers, Inclusive: 1898-1950 - TARO",https://txarchives.org/baytc/finding_aids/10054.xml
Collection: Theodore Friend Papers | Archives & Manuscripts,http://www.swarthmore.edu/Library/friends/ead/6d11thfr.xml
Friends Freedmen's Association Records | Archives & Manuscripts,http://www.swarthmore.edu/library/friends/ead/4024frfr.xml
Friendship - Sociology - Oxford Bibliographies,https://www.oxfordbibliographies.com/view/document/obo-9780199756384/obo-9780199756384-0170.xml
"Yearly Meeting of Friends, held in Virginia Records - Bryn Mawr ...",https://web.tricolib.brynmawr.edu/speccoll/bym/virgym.xml
