"Food manufacturing sustainability, process and GMP design",https://www.magnetgroup.be/news/food-manufacturing-sustai/index.xml
Oxidative Stability of Meat Products and the Role of Antioxidants,https://www.morebooks.de/us/search.xml%3Fq%3Doxidative%2Bstability%2Bof%2Bmeat%2Bproducts%2B%2526%2BAntioxidants
Timely Topics in Nutrition - AVMA Journals,https://avmajournals.avma.org/previewpdf/journals/javma/238/11/javma.238.11.1430.xml%3FpdfJsInlineViewToken%3D1120424561%26inlineView%3Dtrue
SiteMap - Papa Machinery,https://www.papafoodmachine.com/sitemap.xml
THE ILAN OF RABBI SASSON BEN MORDECHAI SHANDUKH - Brill,https://brill.com/downloadpdf/journals/ima/aop/article-10.1163-18718000-12340131/article-10.1163-18718000-12340131.xml
Untitled,https://cdn.elifesciences.org/articles/32242/elife-32242-v2.xml
Of People and Places: Urban Gendering in the English Plays,https://www.degruyter.com/view/j/stap.2009.45.issue-2/v10121-009-0020-7/v10121-009-0020-7.xml
sitemap.xml,http://m.papabarmachine.com/sitemap.xml
Computational Thermal Sciences: An International Journal,http://www.dl.begellhouse.com/ixml/Volume12_Issue1-120a2d78158f7d99.xml
