Diffraction - SPIE,http://spieeventseurope.org/x32393.xml
Diffraction Limit - SPIE,http://spieeventseurope.org/x34468.xml
Limits at the Limes. Diffracted Sovereignty inside the Border Zones in,https://brill.com/view/journals/pari/2/2/article-p205_205.xml
The Young principle and integration-masked lumped sources of a ...,https://journals.scholarsportal.info/details/10637710/v62i0006/659_typailsoadf.xml
Testing and Comparing the Modified Anomalous Diffraction ...,https://journals.ametsoc.org/view/journals/atsc/63/11/jas3775.1.xml
Diffraction of Continental Shelf Waves by Irregular Alongshore ...,https://journals.ametsoc.org/view/journals/phoc/10/8/1520-0485_1980_010_1187_docswb_2_0_co_2.xml
TEM diffraction pattern calculation - TerpConnect,http://terpconnect.umd.edu/~zhangx/html/TEM.xml
Diffraction modes - CMST,https://www.cmst.be/publi/docdc/doctoraatsu28.xml
SV Shock and Vibration 1875-9203 1070-9622 Hindawi 10.1155 ...,https://downloads.hindawi.com/journals/sv/2022/9764478.xml
