"Intracity and intercity networks of multinational firms, 2010-2019 in",https://www.elgaronline.com/view/edcoll/9781788114707/9781788114707.00034.xml
Performance Evaluation of a Smart Mobile Air Temperature and ...,https://journals.ametsoc.org/view/journals/atot/37/10/jtechD200012.xml
Performance Evaluation of a Smart Mobile Air ... - AMS Journals,https://journals.ametsoc.org/downloadpdf/journals/atot/37/10/jtechD200012.xml
Limited exemptions for intra-city zone drivers. - Govinfo.gov,https://www.govinfo.gov/content/pkg/CFR-2010-title49-vol5/xml/CFR-2010-title49-vol5-sec391-62.xml
ABSTRACT - medRxiv,https://www.medrxiv.org/content/medrxiv/early/2020/08/12/2020.04.07.20053439.source.xml
SAGE Reference - The Encyclopedia of Housing,https://sk.sagepub.com/reference/housing2ed/n211.xml
SAGE Reference - Encyclopedia of American Urban History,https://sk.sagepub.com/reference/urbanhistory/n436.xml
SCN Security and Communication Networks 1939-0122 1939-0114 ...,https://downloads.hindawi.com/journals/scn/2021/9998405.xml
Role of urban planning characteristics in forming pandemic resilient ...,https://journals.scholarsportal.info/details/02642751/v118icomplete/nfp_roupcicwegai.xml
WCMC Wireless Communications and Mobile Computing 1530 ...,https://downloads.hindawi.com/journals/wcmc/2022/7283841.xml
