Minimally invasive strip craniectomy for metopic craniosynostosis ...,https://thejns.org/video/view/journals/neurosurg-focus-video/4/2/article-pV5.xml
Single incision endoscopic strip craniectomy for sagittal ...,https://thejns.org/video/view/journals/neurosurg-focus-video/4/2/article-pV10.xml
Strip Theory,http://www2.me.rochester.edu/courses/ME204/nx_help/en_US/tdocExt/content/6/id481916.xml
Integrating Rowcovers and Strip Tillage for Pest Management in ...,https://journals.ashs.org/horttech/view/journals/horttech/29/6/article-p923.xml
United States Treasury Strip Coupon - SEC.gov,https://www.sec.gov/Archives/edgar/data/52848/000175272420016911/primary_doc.xml
Mechanism of folding a strip into isotetrahedra or rectangle dihedra,https://projecteuclid.org/journals/sut-journal-of-mathematics/volume-57/issue-2/Mechanism-of-folding-a-strip-into-isotetrahedra-or-rectangle-dihedra/10.55937/sut/1641859460.xml
CONTRACTION OF THE RABBIT MAMMARY STRIP IN VITRO IN ...,https://eje.bioscientifica.com/view/journals/eje/48/2/acta_48_2_002.xml
Chapter 7 Using Sequential Art of a Comic Strip to Explore the ... - Brill,https://brill.com/view/book/9789004518438/BP000019.xml%3Flanguage%3Den
Development and Introduction of the Filariasis Test Strip,https://www.ajtmh.org/downloadpdf/journals/tpmd/aop/article-10.4269-ajtmh.21-0990/article-10.4269-ajtmh.21-0990.xml
