A Comparative Study of Deep Avian Foveas,https://www.karger.com/Article/Pdf/124142
Problems of deep foveas - Wiley Online Library,https://onlinelibrary.wiley.com/doi/pdf/10.1111/j.1442-9071.1992.tb00740.x
The Morphological Development of the Human Fovea,https://www.sciencedirect.com/science/article/pii/S0161642084342476/pdf%3Fmd5%3D027b2516f3a492b7ca246a86317d19c9%26pid%3D1-s2.0-S0161642084342476-main.pdf
The Tarsier Fovea: Functionless Vestige or Nocturnal Adaptation?,http://link.springer.com/content/pdf/10.1007%252F978-1-4419-8873-7_19.pdf
[PDF] Organization of the Adult Primate Fovea,http://eknygos.lsmuni.lt/springer/262/1-23.pdf
[PDF] Autofluorescence Characteristics of Normal Foveas and ... - CiteSeerX,https://citeseerx.ist.psu.edu/viewdoc/download%3Fdoi%3D10.1.1.1075.7585%26rep%3Drep1%26type%3Dpdf
Nasotemporal Asymmetry Keeps the Fovea in Temporal Retina,https://www.jneurosci.org/content/jneuro/12/6/2381.full.pdf
Robust Fovea Detection in Retinal OCT Imaging using Deep Learning,https://ieeexplore.ieee.org/iel7/6221020/6363502/09754240.pdf
Families With Vitelliform - Dystrophy of the Fovea - JAMA Network,https://jamanetwork.com/journals/jamaophthalmology/articlepdf/629445/archopht_81_3_001.pdf
A MORPHOLOGICAL COMPARISON OF FOVEAL DEVELOPMENT ...,https://www.nature.com/articles/eye199229.pdf%3Fproof%3Dt%252F
