The Orange Chair Podcast - Audioboom,https://audioboom.com/channels/5005062.rss
Islamic Society of Orange County - Audioboom,https://audioboom.com/channels/5017217.rss
The Orange Podcast - Buzzsprout,https://feeds.buzzsprout.com/1069972.rss
Orange Pill Podcast - Buzzsprout,https://feeds.buzzsprout.com/1263314.rss
"Apartments near Sweetwater Elementary School in Port Orange, FL ...",https://www.apartmenthomeliving.com/port-orange-fl/spruce-creek/elementary/sweetwater-elementary-school-apartments_3.rss
Company buying Trump's social media app faces subpoenas - WFTV,https://www.wftv.com/news/topstory.rss
Voice Church of Orange County - Subscribe on Android,https://subscribeonandroid.com/feeds.soundcloud.com/users/soundcloud:users:486991875/sounds.rss
Subscribe by Email to Bleeding Orange & Blue,https://www.subscribebyemail.com/feeds.buzzsprout.com/1440724.rss
"Photo News-Shenzhen Orange Juice Energy Technology Co., LTD ...",https://en.prnasia.com/mediaroom/listpage-18079-photo-0.rss
