14 D3bug.Mkv Photos and Premium High Res Pictures - Getty Images,https://www.gettyimages.com/photos/d3bug.mkv
11 D4bug.Mkv Photos and Premium High Res Pictures - Getty Images,https://www.gettyimages.ae/photos/d4bug.mkv
Rapid bioerosion in a tropical upwelling coral reef - Europe PMC,https://europepmc.org/articles/pmc6135564/bin/pone.0202887.s007.mkv
Saksi Penembakan Aktivis Papua Mako Tabuni - Cinemata,https://cinemata.org/Members/numbaymedia/videos/mako-tabuni.mkv%3Fset_language%3Did%26cl%3Did
Information about once upon complete and most intensive,https://www.diyhow.net/series/once%2520upon%2520/Erase%2520una%2520vez.tp4x02.720p.HDTV.X264-SONY%2520(1).mkv
Call the Midwife - Series 5 + 2015 Christmas Special [DVD] [2016],http://www.multiup.org/fichiers/download/0a706939ca412df04f12c554f4091c73__gtradsub__Saint_Seiya_Omega___06_HD_vostfr__10bit_.mkv
