A route for the passage of substances through the developing ...,https://journals.scholarsportal.info/details/0033183x/v88i0001/117_arftposttdpe.xml
AJPS American Journal of Plant Sciences 2158-2742 Scientific ...,https://www.scirp.org/xml/74610.xml
Stipe anatomical studies on selected pteridophytes of South India in,https://akjournals.com/view/journals/034/58/1-2/article-p167.xml
Bioaccumulation pattern of lanthanides in pteridophytes and ...,https://akjournals.com/downloadpdf/journals/10967/291/1/article-p187.xml
Fern and Lycophyte Ecology - Oxford Bibliographies,https://www.oxfordbibliographies.com/view/document/obo-9780199830060/obo-9780199830060-0118.xml
"<i>Deparia × nanakuraensis</i> K.Hori (Athyriaceae), a new hybrid ...",https://europepmc.org/articles/pmc7642121/bin/phytokeys.165.57837-treatment1.xml
3. Glossary of terms - Brill,https://brill.com/downloadpdf/book/edcoll/9789004475434/back-1.xml
Hydraulic Conductance and Xylem Structure in Tracheid-Bearing ...,https://brill.com/view/journals/iawa/6/4/article-p293_4.xml%3Flanguage%3Den
In Vitro Propagation of Resurrection Plant Selaginella pulvinata ...,https://journals.ashs.org/hortsci/view/journals/hortsci/56/3/article-p313.xml
