doc-en/array-unshift.xml at master · php/doc-en - GitHub,https://github.com/php/doc-en/blob/master/reference/array/functions/array-unshift.xml
doc-en/unshift.xml at master · php/doc-en - GitHub,https://github.com/php/doc-en/blob/master/reference/ds/ds/vector/unshift.xml
Microsoft Edge Chakra JavaScript Array.unshift Memory Corruption,https://support.ixiacom.com/strikes/exploits/browser/cve_2016_0186_ms_js_array_mem_corruption.xml
Summary in: The Prehistory of the Balto-Slavic Accent - Brill,https://brill.com/view/book/9789004346109/B9789004346109_008.xml
java/res/xml/keyboard_layout_set_hindi.xml - Google Git,https://android.googlesource.com/platform/packages/inputmethods/LatinIME/%2B/master/java/res/xml/keyboard_layout_set_hindi.xml
Application of Clustering Algorithms to TRMM Precipitation over the ...,https://journals.ametsoc.org/view/journals/clim/33/13/jcli-d-19-0537.1.xml
Robust Identification of Local Biogeophysical Effects of Land-Cover ...,https://journals.ametsoc.org/view/journals/clim/30/3/jcli-d-16-0067.1.xml
baseline-shift.xml - Vertical Alignment Properties - Xep,http://xep.xattic.com/xep/testsuite/features/baseline-shift.xml
Effect of subpixel magnetic resonance imaging shifts on ...,https://thejns.org/view/journals/j-neurosurg/97/10005/article-p445.xml
