Metabolic effects of dialyzate glucose in chronic hemodialysis,https://academic.oup.com/ndt/article-pdf/27/4/1559/7637207/gfr520.pdf
Design Principles of an Electrochemical Dialyzate Regenerator for ...,https://link.springer.com/content/pdf/10.1023/A:1021179918359.pdf
On the Ability of the Blood Plasma Dialyzate of Patients with Senile ...,https://www.karger.com/Article/PDF/305037
MRI visualization of rodent liver structure and peritoneal adhesion ...,https://onlinelibrary.wiley.com/doi/pdfdirect/10.1002/mrm.21506
mental Renal Hypertension by Dialysis in - AHA Journals,https://www.ahajournals.org/doi/pdf/10.1161/01.CIR.3.3.384
Circulating Blood of Dogs by Dialysis - AHA Journals,https://www.ahajournals.org/doi/pdf/10.1161/01.CIR.2.3.363
Antimutagenicity of Dialyzates of Vegetables and Fruits,https://www.tandfonline.com/doi/pdf/10.1080/00021369.1988.10868882
PROMOTING EFFECT OF SALIVA DIALYZATE ON THE LACTATE ...,https://www.sciencedirect.com/science/article/pii/0003996970900749/pdf%3Fmd5%3D9fa6ff9143783156e78cb5a58853ee89%26pid%3D1-s2.0-0003996970900749-main.pdf
Ensuring hemodialysis adequacy by dialysis dose monitoring with ...,https://journals.sagepub.com/doi/pdf/10.1177/03913988211059841
Determination of aluminum in dialyzate concentrates by L'Vov ...,http://pubs.acs.org/doi/pdf/10.1021/ac00155a025
