Andreea Grama (@gramaandreea13) | Lookbook,https://lookbook.nu/user/3563464-Andreea-G/looks.rss
Larisa Anamaria Drăgan | Lookbook,https://lookbook.nu/user/5450824-Larisa-Anamaria-D/looks/hyped.rss
"Toledo's breaking news, sports, and entertainment ... - The Blade",https://www.toledoblade.com/frontpage/2005/08/11/Fayette-Family-perfect-match-for-thistle-salute/stories/feed/feed/index.rss
"Grasses give birds winter food, shelter | The Blade",https://www.toledoblade.com/Amy-Stone/2003/01/15/Grasses-give-birds-winter-food-shelter/stories/feed/index.rss
'Nisam dobila ni sto grama viška': Mama Milica otkriva kako je ...,https://www.yumama.com/amp/trudnoca/zdravlje-trudnica/37416-nisam-dobila-ni-sto-grama-viska-mama-milica-otkriva-kako-je-sacu.rss
Rođen je sa samo 258 grama: Najmanja beba na svetu spremna da ...,http://www.yumama.com/vesti/33046-rodjen-je-sa-samo-258-grama-najmanja-beba-na-svetu-spremna-da-na.rss
Call Chelsea Peretti - Megaphone,https://www.omnycontent.com/d/playlist/49bc0705-e4ac-479f-ad74-a8dd0069c564/ee9428e0-0b4b-4085-939b-a9140147aff9/1fbb0386-4050-48f4-ab0a-a9140147affe/podcast.rss
Good Moms Bad Choices - Spreaker,https://pod.link/1356670998.rss
Spider firma parceria com distribuidor brasileiro - MZV,https://www.mzv.cz/saopaulo/pt/comercio_e_economia/produtos_tchecos_no_brasil/spider_firma_parceria_com_distribuidor_1.rss
