Discouraging Cheating in Your Classroom - NCTM,https://pubs.nctm.org/downloadpdf/journals/mt/92/7/article-p587.xml
Teaching Is a Journey: This Happened to You Too? in - NCTM,https://pubs.nctm.org/view/journals/mtlt/115/3/article-p237.xml
Digital India's Smart Transform-Nation: Enabling or Discouraging a ...,https://brill.com/view/journals/dias/6/3/article-p237_6.xml%3Flanguage%3Den
Parental Practices Encouraging and Discouraging Physical Activity ...,https://journals.humankinetics.com/view/journals/jpah/12/3/article-p361.xml
Soliciting or discouraging the political participation of certain persons.,https://www.govinfo.gov/content/pkg/CFR-2000-title5-vol2/xml/CFR-2000-title5-vol2-sec734-305.xml
Digital India's Smart Transform-Nation: Enabling or Discouraging a ...,https://journals.scholarsportal.info/details/22142304/v06i0003/237_disteodac.xml
IMF Working Papers Volume 2006 Issue 020,https://www.elibrary.imf.org/view/journals/001/2006/020/001.2006.issue-020-en.xml
Does Import Protection Discourage Exports? in - IMF eLibrary,https://www.elibrary.imf.org/view/journals/001/2006/020/article-A001-en.xml
