THE FOX-TROT AND THE NEW ECONOMIC POLICY: A CASE ...,https://www.schoeningh.de/downloadpdf/journals/expt/2/1/article-p443_.xml
Liberation Songs: Music and the Cultural Memory of the Dutch ... - Brill,https://brill.com/view/book/edcoll/9789004292017/BP000010.xml
Fatal intestinal inflammatory lesions in equids in California: 710 ...,https://avmajournals.avma.org/view/journals/javma/256/4/javma.256.4.455.xml%3Frskey%3DRwARDp%26result%3D1419
Criminology and Social Policy - SAGE Books,https://sk.sagepub.com/books/criminology-and-social-policy/n4.xml
Dancing in the English style - ManchesterHive,https://www.manchesterhive.com/downloadpdf/9781526105943/9781526105943.00017.xml
deConstruCtinG the Pendelton riot - Berghahn Journals,https://www.berghahnjournals.com/downloadpdf/journals/contention/2/2/cont020204.xml
"Politics, Consumption, or Nihilism in - Berghahn Journals",https://www.berghahnjournals.com/view/journals/contention/2/2/cont020201.xml
"Commissioner, Immigration and Naturalization Service. - Govinfo.gov",https://www.govinfo.gov/bulkdata/FR/2000/06/FR-2000-06-23.xml
Aviation Podcast - Airline Pilot Guy,http://airlinepilotguy.com/podcast.xml
