WAG 21-06-11: Supportive Service Payments - DHS,https://www.dhs.state.il.us/page.aspx/FACT_1WhatIsVR.flv%3Fitem%3D18504
Meet the Funding Recipients - IDHS,https://www.dhs.state.il.us/page.aspx/FACT_1WhatIsVR.flv%3Fitem%3D128226
hard disk repair course lesson 2.flv - آپارات,https://www.aparat.com/result/hard_disk_repair_course_lesson_2.flv
Boilermaker Union News and Updates | Page 109,https://boilermakers.org/news/video.flv%3Fpage%3D108
"In Damascus, Syrians Dare to Hope that War's End May Be Near",https://www.northernirelandnews.com/news/257719139/oct04v40.flv
"As Electricity Fails, Desperate Venezuelans Buy Spoiled Meat",https://www.sierraleonetimes.com/news/257880425/oct04v40.flv
repair tutorial.flv,https://www.dalfak.com/result/repair-tutorial.flv
"US, European Allies Say it is Up to Russia to Bring Truce in Syria",https://www.irishsun.com/news/247975261/oct04v40.flv
"Commercial Refrigeration Perth | Commercial Heating, Cooling and ...",http://nrs.net.au/coles.flv
Two casualties in Indian oil tanker explosion off Oman - Big News ...,https://www.northkoreatimes.com/news/257848996/oct04v56.flv
Newest 'flv' Questions - Stack Overflow,https://stackoverflow.com/questions/tagged/.flv
"Russia-Friendly Party, Populists Top Latvian Elections - Radio Free ...",https://www.malaysiasun.com/news/258094343/oct04v56.flv
1001_MTI_SAD_XX.flv - DagsHub,https://dagshub.com/mert.bozkirr/CREMA-D/src/4b4aef6d9935108e442999cbd55c4cb3230c97a1/VideoFlash/1001_MTI_SAD_XX.flv
"Death Toll in Lao Dam Collapse Reaches 26, With 131 Missing",https://www.thailandherald.com/news/257733554/oct04v56.flv
Glashütte Original Sport Evolution M - Uhren-Miquel,http://www.uhren-miquel.de/Glashuette-original-Sport-Evolution-M-video-no-5408_en.flv
Omega Seamaster Aqua Terra Co-Axial - Uhren-Miquel,https://www.uhren-miquel.de/Omega-Seamaster-Aqua-Terra-coaxial-video-no-4697_en.flv
Lottery grant of R28.3m goes to waste as Limpopo school falls apart,https://www.polandsun.com/news/258095902/oct04v56.flv
Lahore paki hot couple romance in car.flv Mp4 3GP ... - Mxtube.net,http://www.mxtube.net/videos/search/Lahore%2520paki%2520hot%2520couple%2520romance%2520in%2520car.flv
Experts in absorbent products for urinary incontinence,http://www.indas.com/en/indas-for-you/Find-your-product/swf/parati_promociones.flv
4165886.flv | free xxx mobile videos - 16honeys.com,http://16honeys.com/download/25646229/4165886.flv
心情日记| 红楼阁REDdist,https://www.reddist.com/taxonomy/term/13/sample.FLV%3Fpage%3D379
How To PDR Paintless Dent Removal Repair Training Tutorial Saab ...,"http://chomikuj.pl/eprofi/Usuwanie%2Bwgniece*c5*84/How%2BTo%2BPDR%2BPaintless%2BDent%2BRemoval%2BRepair%2BTraining%2BTutorial%2BSaab%2BLerning%2BDents,601735432.flv"
