DanyHot.FLV - XNXX.COM,https://www.xnxx.tv/video-7hwk179/danyhot.flv
amateur hot latina playing with a dildo(3).flv - XVIDEOS.COM,https://www.xvideos2.com/video2324159/amateur_hot_latina_playing_with_a_dildo_3_.flv
JuliannaBenz's cam&comma; Fotos&comma; Videos y ... - XNXX.com,https://xxx.yayatube.com/video-denv96f/juliannabenz_s_cam_fotos_videos_y_chat_con_web_cams_en_vivo_en_cam4.flv
"JuliannaBenz's cam, Fotos, Videos y Chat con Web ... - XNXX.com",https://www.xnxx2.com/video-denv96f/juliannabenz_s_cam_fotos_videos_y_chat_con_web_cams_en_vivo_en_cam4.flv
Bangladesh sex Niloy Shokh -.FLV - Free Porn Videos - XVIDEOS ...,https://www.xv-videos1.com/video2207283/bangladesh_sex_niloy_shokh_-.flv
"Mujerlunabe's cam, Fotos, Videos y Chat con Web Cams en Vivo en ...",https://www.xv-videos1.com/video8672472/mujerlunabe_s_cam_fotos_videos_y_chat_con_web_cams_en_vivo_en_cam4.flv
1.flv porn results 307K Videos · 1.6K Images - MOTHERLESS.COM,https://motherless.com/term/videos/1.flv%3Frange%3D0%26size%3D0%26sort%3Drelevance%26page%3D4638
Hermosa BBW le encanta follar y faciales pegajosos,https://es.lizporn.com/video7403616/beautiful_bbw_loves_to_fuck_and_sticky_facials_-_xvideos.com.flv
Bangladesh sex Niloy Shokh -.FLV - XVIDEOS.COM,https://www.xvideos3.com/video2207283/bangladesh_sex_niloy_shokh_-.flv
"THE BEST FREE PORN SITE - Shemale Porn Homepage, Free ...",https://sg-gay.xnxx-sex-videos.net/video10433071/_vgay.us.flv
Biba Hespaña 1x03&period;flv - XVIDEOS.COM - Vídeos Porno ...,https://es.nudejet.com/video37249221/27/biba_hespana_1x03.flv
Bangladesh sex Niloy Shokh -.FLV - छक्कों की ब्लू फिल्म का होमपेज ...,https://hi-shemale.xvideos8.mx/video2207283/bangladesh_sex_niloy_shokh_-.flv
"Tirik ang Mata ni Kuya.flv - HD Sex, XXX Porn VIdeos | HDSex.Porn",https://hdsex.porn/video/eHf1/tirik-ang-mata-ni-kuya.flv
Pornflv - Turkish HD Porn . pro,https://www.turkishhdporn.pro/tags/Porn.flv
India amateur sonia bhabhi follada en perrito estilo Sexo flv 2 min,https://es.clixtube.com/video9633174/indian_amateur_sonia_bhabhi_fucked_in_doggy_style_sex.flv
Biba Hespaña 1x03.flv - फ्री ब्लू फिल्म वीडियो - XVIDEOS.COM,https://in-shemale.xvideos.com.de/video37249221/21/biba_hespana_1x03.flv
Betty Bang XXX en Fuck Buddy Betty en Plumper Pass&period;FLV,https://es.wholeporn.net/video19841917/betty_bang_xxx_en_fuck_buddy_betty_en_plumper_pass.flv
India amateur sonia bhabhi follada en perrito estilo Sexo flv,https://es.tubedare.org/video9633174/indian_amateur_sonia_bhabhi_fucked_in_doggy_style_sex.flv
"JuliannaBenz's cam, Fotos, Videos y Chat con Web Cams en Vivo ...",https://in.xvides.to/video22519125/juliannabenz_s_cam_fotos_videos_y_chat_con_web_cams_en_vivo_en_cam4.flv
