Stable lariats bearing a snoRNA (slb-snoRNA) in eukaryotic cells,https://www.pnas.org/doi/pdf/10.1073/pnas.2114156118
Formation of Lariats and Circles in Self-splicing of the Precursor to ...,http://www.sciencedirect.com/science/article/pii/0092867486907579/pdf%3Fmd5%3Dab58f24dd855feb4438923dc1b7de0e6%26pid%3D1-s2.0-0092867486907579-main.pdf
An RNA Processing Activity that Debranches RNA Lariats - jstor,https://www.jstor.org/stable/1695191
A Novel Approach to the Synthesis of DNA and RNA Lariats,https://pubs.acs.org/doi/pdf/10.1021/jo701418w
[PDF] RNA Analysis Via Purified Lariat Populations,https://ors.umkc.edu/services/commercialization/technology-docs/lariat-seq.pdf
In vitro formation of a lariat structure containing a G2'-5'G linkage.,https://www.jbc.org/article/S0021-9258(18)61342-0/pdf
[PDF] Sachse High School JV Lariat Drill Team 2022-2023 Informational ...,https://garlandisd.net/media/15797/download%3Finline
Lariat intronic RNAs in the cytoplasm of Xenopus tropicalis oocytes,http://rnajournal.cshlp.org/content/20/9/1476.full.pdf
Inborn Errors of RNA Lariat Metabolism in Humans with Brainstem ...,https://www.cell.com/cell/pdf/S0092-8674(18)30163-6.pdf
[PDF] The stability and fate of a spliced intron from vertebrate cells - NCBI,https://www.ncbi.nlm.nih.gov/pmc/articles/PMC1369753/pdf/10024173.pdf
