[PDF] Ovalbumin | Data sheet | InvivoGen,https://www.invivogen.com/sites/default/files/invivogen/products/files/ovalbumin.pdf
[PDF] EndoGrade Ovalbumin - BioVendor,https://www.biovendor.com/endo-grade-ovalbumin-25-mg/PDS.pdf
Ovalbumin: a secreted protein without a transient ... - PNAS,https://www.pnas.org/doi/pdf/10.1073/pnas.75.1.94
[PDF] Ovalbumin (3G2E1D9): sc-65984 - Santa Cruz Biotechnology,https://datasheets.scbt.com/sc-65984.pdf
[PDF] Albumin from chicken egg white (A5378) - Product Information Sheet,https://www.sigmaaldrich.com/deepweb/assets/sigmaaldrich/product/documents/145/665/a5378pis.pdf
Ovalbumin is an elastase substrate. - Journal of Biological Chemistry,https://www.jbc.org/article/S0021-9258(17)42598-1/pdf
Structural Properties of Recombinant Ovalbumin and Its ...,https://www.tandfonline.com/doi/pdf/10.1271/bbb.63.1392
Structural Characteristics of Hen Egg Ovalbumin Expressed in Yeast ...,https://www.tandfonline.com/doi/pdf/10.1271/bbb.69.755
Structural Comparison of Ovalbumins from Nine Different Species,https://febs.onlinelibrary.wiley.com/doi/pdf/10.1111/j.1432-1033.1970.tb01196.x
STUDIES ON OVALBUMIN II. THE FORMATION AND PROPERTIES ...,https://www.publish.csiro.au/bi/pdf/BI9650365
THE ACTION OF CARBOXYPEPTIDASE ON OVALBUMIN,https://pubs.acs.org/doi/pdf/10.1021/ja01136a520
Reversible unfolding of the major fraction of ovalbumin by guanidine ...,https://pubs.acs.org/doi/pdf/10.1021/bi00668a034
[PDF] Interactions of ovalbumin and of its putative signal sequence ... - NCBI,https://www.ncbi.nlm.nih.gov/pmc/articles/PMC1147990/pdf/biochemj00254-0053.pdf
Identification of an Ovalbumin Signal Sequence - ScienceDirect.com,http://www.sciencedirect.com/science/article/pii/0022283684900317/pdf%3Fmd5%3Db99c4e9ffa3834d561d03cc9b9992db0%26pid%3D1-s2.0-0022283684900317-main.pdf
The Carbohydrate of Ovalbumin - ScienceDirect.com,https://www.sciencedirect.com/science/article/pii/0003986161901448/pdf%3Fmd5%3Dbac05f73181da5cb9191e9d58461fabd%26pid%3D1-s2.0-0003986161901448-main.pdf
Hen- and Duck-Ovalbumins III. Further Notes on Crystalline ...,https://www.jimmunol.org/content/jimmunol/30/1/41.full.pdf
Precipitin Reactions of Various Ovalbumins - SAGE Journals,https://journals.sagepub.com/doi/pdf/10.3181/00379727-36-9130P
The presence of heat-stable conformers of ovalbumin affects ...,https://academic.oup.com/peds/article-pdf/16/12/1035/4351257/gzg123.pdf
The Proteins of Egg White - jstor,https://www.jstor.org/stable/30083596
[PDF] Ovalbumin - INTERCHIM,http://www.interchim.fr/ft/R/R5851B.pdf
