A note on 'shared' allomorphs - Brill,https://brill.com/downloadpdf/journals/jgl/6/1/article-p5_3.xml
Computational Processing of Allomorphy in word derivation of ... - Brill,https://brill.com/downloadpdf/journals/jgl/11/2/article-p286_13.xml
SAGE Knowledge,https://sk.sagepub.com/reference/the-sage-encyclopedia-of-human-communication-sciences-and-disorders/i2790.xml
Against phonologically-optimizing suppletive allomorphy (POSA) in ...,https://akjournals.com/view/journals/2062/68/1-2/article-p103.xml
Allomorphic responses in Serbian pseudo-nouns as a result of ...,https://akjournals.com/view/journals/064/58/1/article-p65.xml
Subtractive Morphology - Linguistics - Oxford Bibliographies,https://www.oxfordbibliographies.com/view/document/obo-9780199772810/obo-9780199772810-0116.xml
Allomorphy in the plural morpheme of Old English disyllabic neuter,https://www.degruyter.com/view/j/stap.2011.46.issue-4/v10121-010-0009-2/v10121-010-0009-2.xml
Untitled,https://aclanthology.org/L10-1041.xml
Studies concerning the accessibility of different allomorphic forms of ...,https://journals.scholarsportal.info/details/09690239/v19i0001/55_sctaodafoc.xml
