Orthopteran insects as potential and preferred preys of the Red ...,http://www.degruyter.com/view/j/orhu.2015.23.issue-1/orhu-2015-0004/orhu-2015-0004.xml
Conservation of orthopteran biological diversity relative to ...,https://journals.scholarsportal.info/details/1366638x/v2i3-4/247_coobdrtlcite.xml
SELECTIVE ATTENTION AND THE SPATIO-TEMPORAL ... - Brill,https://brill.com/view/journals/beh/140/1/article-p1_1.xml%3Flanguage%3Den
Functional morphology and phylogenetic significance of the ... - Brill,https://brill.com/view/journals/ise/53/2/article-p185_002.xml
biorxiv BIORXIV bioRxiv bioRxiv Cold Spring Harbor Laboratory ...,https://www.biorxiv.org/content/early/2020/01/17/2020.01.17.910042.source.xml
578327.xml - Hindawi.com,http://downloads.hindawi.com/journals/psyche/2011/578327.xml
Psyche: A Journal of Entomology Psyche 0033-2615 Cambridge ...,http://psyche.entclub.org/metadata/6.xml
From Francisco de Arruda Furtado 22 October 1881 - | Darwin ...,https://www.darwinproject.ac.uk/letter/DCP-LETT-13423.xml
A comparison of cluster analysis and diversity-ordering in ...,https://akjournals.com/view/journals/168/5/2/article-p189.xml
