Le Royaume De Champa in: T'oung Pao Volume 14 Issue 1 (1913),https://brill.com/view/journals/tpao/14/1/article-p153_9.xml%3Flanguage%3Den
a part iii The Cultural Politics of the Danka System - Brill,https://brill.com/previewpdf/book/9781684174522/BP000013.xml%3FpdfJsInlineViewToken%3D1004297873%26inlineView%3Dtrue
The syntax of cemetery space in - Manchester Open Hive,https://www.manchesteropenhive.com/view/9781526153845/9781526153845.00011.xml
Spatially Distributed Sensible Heat Flux over a Semiarid Watershed ...,https://journals.ametsoc.org/view/journals/apme/36/4/1520-0450_1997_036_0293_sdshfo_2.0.co_2.xml
Spatially Distributed Sensible Heat Flux over a Semiarid Watershed ...,https://journals.ametsoc.org/view/journals/apme/36/4/1520-0450_1997_036_0281_sdshfo_2.0.co_2.xml
Welcoming Acts - Berghahn Journals,https://www.berghahnjournals.com/downloadpdf/journals/migration-and-society/5/1/arms050107.xml
sitemap.xml - LOIS LAMBERT GALLERY,https://www.loislambertgallery.com/sitemap.xml
Felicia Hemans and Burial at Sea in the Nineteenth-Century Imaginary,https://www.manchesterhive.com/downloadpdf/journals/gs/19/2/article-p30.xml
