Wind Turbine Clutter Mitigation via Nonconvex Regularizers and ...,https://journals.ametsoc.org/downloadpdf/journals/atot/36/6/jtech-d-18-0164.1.xml
Short-Wavelength Technology and the Potential For Distributed ...,https://journals.ametsoc.org/view/journals/bams/90/12/2009bams2507_1.xml
WCMC Wireless Communications and Mobile Computing 1530 ...,https://downloads.hindawi.com/journals/wcmc/2021/6673235.xml
1. Introduction - Hindawi.com,http://downloads.hindawi.com/journals/jr/2020/3849309.xml
Dictionary learning for transcriptomics data reveals type-specific ...,https://www.degruyter.com/view/journals/itit/ahead-of-print/article-10.1515-itit-2019-0048/article-10.1515-itit-2019-0048.xml
biorxiv BIORXIV bioRxiv bioRxiv Cold Spring Harbor Laboratory ...,https://www.biorxiv.org/content/biorxiv/early/2019/10/23/735514.source.xml
medrxiv MEDRXIV medRxiv medRxiv Cold Spring Harbor ...,https://www.medrxiv.org/content/early/2021/04/26/2021.04.23.21256000.source.xml
PLoS ONE plos plosone PLoS ONE 1932-6203 Public Library of ...,http://open-repository.kisti.re.kr/cube/bitstream/open_repository/50374/1/journal.pone.0067202.xml
RealsearchGroup.github.io.backup/rss.xml at master ...,https://github.com/RealsearchGroup/RealsearchGroup.github.io.backup/blob/master/rss.xml
Wind Turbine Clutter Mitigation via Nonconvex Regularizers and ...,https://journals.ametsoc.org/view/journals/atot/36/6/jtech-d-18-0164.1.xml
