"The Levite Singers in Chronicles and Their Stabilising Role, written ...",https://brill.com/view/journals/vt/69/2/article-p331_12.xml%3Flanguage%3Den
The (Un)Stable Digital Bible: A Destabilising Peritext and Stabilising ...,https://brill.com/view/journals/rmdc/8/3/article-p361_361.xml%3Flanguage%3Den
Part IV Stabilising the ambivalence of repetition in: Over her dead body,https://www.manchesterhive.com/view/9781526125637/9781526125637.00021.xml
On the effectiveness of slope-stabilising piles for soils with distinct ...,https://journals.scholarsportal.info/details/00168505/v72i0004/309_oteospfswdsb.xml
Influence of stabilising agents on the properties of liposomal ...,https://resolver.scholarsportal.info/resolve/09505423/v55i0002/702_iosaotleeche.xml
Decreased prevalence of hypercholesterolaemia and stabilisation of ...,https://eje.bioscientifica.com/view/journals/eje/170/2/295.xml
The Stabilising Effect of Social Policies in the Financial Crisis,https://sociorepec.org/publication.xml%3Fh%3Drepec:wfo:wquart:y:2011:i:2:p:100-110%26l%3Den
A longitudinal study of academic webs: Growth and stabilisation,https://akjournals.com/downloadpdf/journals/11192/71/3/article-p523.xml
[PDF] THE POTENTIAL OF THE SOIL FOR STABILISATION OF ORGANIC ...,http://sciendo.com/downloadpdf/journals/agri/61/2/article-p50.xml
Preparation of colourless phosphate glass by stabilising higher Fe[II ...,https://journals.scholarsportal.info/pdf/20452322/v8inone/nfp_pocpgbshfimh.xml
Modernising the agricultural sector and stabilising the ... - Sciendo,https://www.degruyter.com/view/j/manment.2012.16.issue-2/v10286-012-0075-8/v10286-012-0075-8.xml
