Melatonin has multiorgan effects | European Heart Journal,https://ehjcvp.oxfordjournals.org/content/2/4/258.source.xml
Circadian production of melatonin in cartilage modifies rhythmic ...,https://joe.bioscientifica.com/view/journals/joe/241/2/JOE-19-0022.xml
Exogenous melatonin inhibits neutrophil migration through ...,https://joe.bioscientifica.com/view/journals/joe/227/1/49.xml
Effects of long-term oral administration of melatonin on tear ...,https://avmajournals.avma.org/abstract/journals/javma/260/5/javma.21.03.0114.xml
Helping Your Teen Sleep | My Doctor Online,https://mydoctor.kaiserpermanente.org/ncal/structured-content/Health_Topic_Helping_Your_Teen_Sleep_12_to_18_Years_-_Pediatrics.xml%3Fco%3D%252Fregions%252Fncal
[PDF] Melatonin-Induced Cytoskeleton Reorganization Leads to Inhibition ...,https://journals.scholarsportal.info/pdf/14220067/v21i0002/nfp_mcrltiomccp.xml
[PDF] Melatonin's Impact on Antioxidative and Anti-Inflammatory ... - MDPI,https://journals.scholarsportal.info/pdf/2218273x/v10i0009/nfp_mioaaarihad.xml
Exogenous Application of Melatonin Improves Drought Tolerance in ...,https://journals.ashs.org/jashs/abstract/journals/jashs/146/1/article-p24.xml
Influence of Exercise Time of Day on Salivary Melatonin Responses in,https://journals.humankinetics.com/view/journals/ijspp/14/3/article-p351.xml
