Evolution of Mutualism - Evolutionary Biology - Oxford Bibliographies,https://www.oxfordbibliographies.com/view/document/obo-9780199941728/obo-9780199941728-0128.xml
"Temperature-dependent effects on mutualistic, antagonistic, and ...",https://akjournals.com/view/journals/168/8/1/article-p47.xml
"Chapter 1 Optimization, MEP, and Mutualism in - Brill",https://brill.com/view/book/9789004428546/BP000009.xml
Influence of the mutualistic endophyte Fusarium oxysporum 162 on ...,https://brill.com/view/journals/nemy/9/6/article-p771_3.xml%3Flanguage%3Den
Mutualistic Interactions of the Aphid Lachnus allegheniensis ...,https://aesa.oxfordjournals.org/content/85/2/173.source.xml
Mutualistic vs. zero‐sum modes of competition - Berghahn Journals,https://www.berghahnjournals.com/view/journals/saas/27/1/soca12578.xml
Mutualistic Fermentative Digestion in the Gastrointestinal Tract ...,https://bioone.org/journals/integrative-and-comparative-biology/volume-42/issue-2/42.2.319/Mutualistic-Fermentative-Digestion-in-the-Gastrointestinal-Tract--Diversity-and/10.1093/icb/42.2.319.xml
Mutualistic relationship beneficial for aphids and ants on giant ...,https://akjournals.com/view/journals/168/7/1/article-p43.xml
