It's a mixed bouquet for sales of autumn plants at area stores | The ...,https://www.toledoblade.com/Retail/2005/09/20/It-s-a-mixed-bouquet-for-sales-of-autumn-plants-at-area-stores/stories/feed/feed/index.rss
"Two Minutes in the Garden: Gardening Tips, Science, Myths",https://empressofdirt.net/briefing/full.rss
Better Lawns and Gardens - Audioboom,https://audioboom.com/channels/4983138.rss
Creating Impact Through Giving - Buzzsprout,https://feeds.buzzsprout.com/1035445.rss
The Gardenangelists - Buzzsprout,https://feeds.buzzsprout.com/225480.rss
Modern Magick and Spirituality for Mystics and Seekers - Living Open,https://pod.link/1143497810.rss
Single at Thirty: The Manual for the Modern Woman - Omny Studio,https://www.omnycontent.com/d/playlist/2596aacb-8d6a-4b53-a7cc-abc1005233a6/fca597be-a77f-4297-bcc8-ad5e0091aa61/f383164a-251c-4dc0-8b4d-ad5e00929594/podcast.rss
PoetsUnplugged.com - Pod.casts - The Podcast Discovery Service,https://pod.casts.io/podcasts/poetsunplugged-com.rss
