Then I Heard a Voice - Buzzsprout,https://feeds.buzzsprout.com/887587.rss
Iowa Civil Rights History - Buzzsprout,https://feeds.buzzsprout.com/1491550.rss
"Toledo's breaking news, sports, and entertainment ... - The Blade",https://www.toledoblade.com/frontpage/2008/03/16/1859-schoolhouse-with-abolitionist-ties-may-be-razed/stories/feed/index.rss
BG men's hoopers dominate - Toledo Blade,https://www.toledoblade.com/BGSU/2013/11/09/College-BAsketball-BGSU-vs-Earlham-at-BG-november-9-2013/stories/feed/index.rss
What's New - Anna Fritz,https://www.annafritz.com/blogs/what-s-new.rss
The Original and Present State of Man - Friends Library,https://api.friendslibrary.com/download/cff8d640-fe95-43c7-a927-0d9504c4af7e/audio/podcast/hq/podcast.rss
The Journal and Letters of Mary Dudley - Friends Library,https://api.friendslibrary.com/download/dd7e6a9b-096c-4a42-84d9-1bbc436efbd4/audio/podcast/hq/podcast.rss
About Regional Podcast - Audioboom,https://audioboom.com/channels/4973941.rss
The Mysterious Secrets Of Uncle Bertie's Botanarium,https://www.omnycontent.com/d/playlist/aaea4e69-af51-495e-afc9-a9760146922b/8bc791a4-aa83-4f4b-bc30-aa3200e14c2b/03dad0b2-30b1-491f-9354-aa3200e14c2f/podcast.rss
