Better Animal Handling - Buzzsprout,https://feeds.buzzsprout.com/688886.rss
"Manufacturer, Exporter, Saddles, Saddlery, Rugs, Horse Clothing ...",http://indiansaddlery.com/index.rss
HorseSense - Audioboom,https://audioboom.com/channels/4632225.rss
BRASS - BATTLEGROUND PRODUCTIONS,https://pod.link/1131884875.rss
Happy trails part of the fun: Angola preserve offers array of activities,https://www.toledoblade.com/frontpage/2008/08/11/Happy-trails-part-of-the-fun-Angola-preserve-offers-array-of-activities/stories/feed/index.rss
Preservationists restoring luster to Custer statue | The Blade,https://www.toledoblade.com/North/2010/05/12/Preservationists-restoring-luster-to-Custer-statue/stories/feed/index.rss
Pat Kennedy Lahoud Real Estate Associate in Washington ...,http://www.litchfieldcountyforsale.com/rss.2.0.rss
Taber Evangelical Free Church,https://www.taberefc.ca/podcasts/media.rss
Design Notes - Libsyn,http://feeds.soundcloud.com/users/soundcloud:users:156734245/sounds.rss
