jdeclipse-realign/fragment.xml at master - GitHub,https://github.com/mchr3k/jdeclipse-realign/blob/master/realignment.jd.ide.eclipse/fragment.xml
The comprehensive anatomical spinal osteotomy and anterior ...,https://thejns.org/spine/view/journals/j-neurosurg-spine/29/5/article-p565.xml
Examining Opposition Realignment and Japan's Rightward Shift in ...,https://brill.com/view/journals/aisr/21/2/article-p55_3.xml%3Flanguage%3Den
"Critical Elections, Partisan Realignment, and Long-Term Electoral ...",https://www.oxfordbibliographies.com/view/document/obo-9780199756223/obo-9780199756223-0246.xml
BILLS-113hr5799ih.xml - Govinfo.gov,https://www.govinfo.gov/bulkdata/BILLS/113/2/hr/BILLS-113hr5799ih.xml
Knee Patellofemoral Syndrome - My Doctor Online - Kaiser ...,https://mydoctor.kaiserpermanente.org/ncal/structured-content/Condition_Knee_Patellofemoral_Syndrome.xml%3Fco%3D/regions/ncal
Use of internal splinting to realign a noncompliant sternum in a cat ...,https://avmajournals.avma.org/abstract/journals/javma/228/7/javma.228.7.1047.xml
Critical Elections: British Parties and Voters in Long-Term Perspective,https://sk.sagepub.com/books/critical-elections/n4.xml
Committee Meetings and Agendas - County Of Sonoma - CA.gov,https://sonomacounty.ca.gov/x31267.xml%3Fid%3D2147593800
