Rust Fungi with Caeoma-like Sori on Conifers - JStor,https://www.jstor.org/stable/3758359
"Caeoma cassiopae sp. nov., a rust on Cassiope tetragona in the - jstor",https://www.jstor.org/stable/3761975
Three new <i>Caeoma</i> species on <i>Rosa</i> spp. from Pakistan,https://www.ingentaconnect.com/content/mtax/mt/2012/00000120/00000001/art00029%3Fcrawler%3Dtrue
"The development of Cwcoma, nitens has recently been",https://www.journals.uchicago.edu/doi/pdfplus/10.1086/275753
Relationship of Cæoma nitens and Puccinia peckiana,https://www.journals.uchicago.edu/doi/pdfplus/10.1086/327167
"[PDF] UNINUCLEATED AECIÜIOSPORES IN CAEOMA NITENS, AND ...",https://naldc.nal.usda.gov/download/IND43966843/PDF
"CAEOMA FAULLIANA, SYNONYM OF THE TREE RUST FUNGUS ...",https://cdnsciencepub.com/doi/pdf/10.1139/b60-074
"Caeoma tsukubaense n. sp., a rhododendron rust fungus of Japan ...",https://link.springer.com/content/pdf/10.1007/s10267-004-0228-2.pdf
[PDF] Caeoma kaiku,https://www.nzpcn.org.nz/flora/species/caeoma-kaiku/%3Fdownload%3Dpdf
Morphology of aecia of the rust fungi - ScienceDirect.com,https://www.sciencedirect.com/science/article/pii/S0007153685801856/pdf%3Fmd5%3Dbeb8f2e1abee07d0d4185f4f08c55945%26pid%3D1-s2.0-S0007153685801856-main.pdf
