Management of syndesmotic injuries of the ankle in,https://eor.bioscientifica.com/view/journals/eor/2/9/2058-5241.2.160084.xml
Ankle and syndesmosis instability: consensus and controversies in,https://eor.bioscientifica.com/view/journals/eor/6/6/2058-5241.6.210017.xml
Effectiveness of the TightRope® Fixation in Treating Ankle ...,https://journals.humankinetics.com/view/journals/jsr/30/4/article-p676.xml
Proximal and Distal Tibofibular Syndesmosis Injury in a Collegiate ...,https://journals.humankinetics.com/previewpdf/journals/ijatt/18/3/article-p24.xml
[PDF] Dynamic and Stabilometric Analysis After Syndesmosis Injuries,https://japmaonline.org/downloadpdf/journals/apms/110/4/i8750-7315-110-4-article_9.xml
Syndesmotic Rupture Without Ankle Fracture in,https://japmaonline.org/view/journals/apms/93/4/87507315-93-4-336.xml
Bilateral ankle syndesmosis injury: a rare case report,https://orthopedicreviews.openmedicalpublishing.org/article/35494.xml
Anatomy of the distal tibiofibular syndesmosis in adults: a pictorial ...,https://journals.scholarsportal.info/details/00218782/v217i0006/633_aotdtspewama.xml
[PDF] Syndesmotic instability can be assessed by measuring the distance ...,https://journals.scholarsportal.info/pdf/14712474/v23inone/nfp_sicbabuwsacs.xml
