ocr.xml - Chronicling America,https://chroniclingamerica.loc.gov/lccn/sn86069133/1910-10-31/ed-1/seq-2/ocr.xml
"Reformations, revolutions, continuity, and counter-reformations in",https://www.manchesteropenhive.com/view/9781526114600/9781526114600.00011.xml
DISSOLUTE CHARACTERS: Irish literary history through Balzac ...,https://www.manchesterhive.com/downloadpdf/9781526125538/9781526125538.00023.xml
INDIGENOUS PEDAGOGY AND DEVELOPMENT - Brill,https://brill.com/downloadpdf/book/9789460913730/BP000008.xml
Chapter Seven - the Many FaCeS oF Wage-Labour - Brill,https://brill.com/downloadpdf/book/9789004232778/B9789004232778_009.xml
M3976 FACCARELLO (V2) TEXT.indd - Elgaronline,https://www.elgaronline.com/downloadpdf/edcoll/9781849801119/9781849801119.00019.xml
Minsheu_A Dictionary in Spanish and English_1599_final.xml,https://tspace.library.utoronto.ca/bitstream/1807/99181/4/Minsheu_A%2520Dictionary%2520in%2520Spanish%2520and%2520English_1599_final.xml
Mansfield Park - Austen Said,https://austen.unl.edu/xml/aus.006.xml
Recollections of Writers - LORD BYRON and his TIMES,http://lordbyron.org/ChClark.1878.xml
Sketches of the Living Poets. Mr. Campbell - LORD BYRON and his ...,https://lordbyron.org/LeHunt.1821.Campbell.xml
