“You are exactly my brand of heroin(e)” - Berghahn Journals,https://www.berghahnjournals.com/downloadpdf/journals/girlhood-studies/4/1/ghs040105.xml
Chapter 4 Demystifying the Algerian Chivalric Romance and its ...,https://brill.com/abstract/book/9789004442719/BP000012.xml
"Chapter 1 Introduction in: Heroines, Harpies, and Housewives - Brill",https://brill.com/view/book/9789004432154/BP000009.xml
"Bachelor girls, mistresses and the New Woman heroine in",https://www.manchesterhive.com/view/9781526111654/9781526111654.00006.xml
The courtesy-book heroine of Mansfield Park | Scholars Portal ...,https://journals.scholarsportal.info/details/00420247/v44i0001/31_tchomp.xml
Female Icons of the Zionist Movement: The Making of a National ...,https://journals.scholarsportal.info/details/14690764/v11i3-4/249_fiotzmoanhii.xml
Heroines in Belgium and Serbia in: Nurse Writers of the Great War,https://www.manchesteropenhive.com/view/9781526129352/9781526129352.00010.xml
'Harriet' puts iconic heroine on big screen Tony winner Cynthia Erivo ...,https://edition.cnn.com/video/data/3.0/video/movies/2019/10/30/harriet-puts-iconic-heroine-on-big-screen.cnn/index.xml
"Waynesboro Village Record: February 20, 1863 - Valley of the ...",https://valley.lib.virginia.edu/news/vr1863/pa.fr.vr.1863.02.20.xml
