Loss of Sexual Desire in Women | My Doctor Online,https://mydoctor.kaiserpermanente.org/mas/structured-content/Condition_Loss_of_Sexual_Desire_in_Women_-_Ob_Gyn.xml%3Fco%3D/regions/mas
"Intentional Libido, Impulsive Libido in: Journal of Phenomenological ...",https://brill.com/view/journals/jpp/12/1/article-p51_3.xml%3Flanguage%3Den
"Intentional Libido, Impulsive Libido in - Brill",https://brill.com/view/journals/jpp/12/2/article-p51_4.xml%3Flanguage%3Den
Female sexual dysfunction for the endocrinologist - European ...,https://eje.bioscientifica.com/downloadpdf/journals/eje/182/6/EJE-19-0903.xml
Testosterone-induced increase in libido in a patient with a loss-of ...,https://edm.bioscientifica.com/abstract/journals/edm/2021/1/EDM21-0031.xml
Evaluation and treatment of decreased libido associated with painful ...,https://avmajournals.avma.org/view/journals/javma/224/4/javma.2004.224.565.xml
Evaluation and treatment of decreased libido ... - AVMA Journals,https://avmajournals.avma.org/downloadpdf/journals/javma/224/4/javma.2004.224.565.xml
"LCL 414: 352-353 - AUGUSTINE, The City of God against the ...",https://www.loebclassics.com/view/augustine-city_god_pagans/1957/pb_LCL414.353.xml
Sexual Health: An Important Concern for Kidney Disease Patients in,https://www.kidneynews.org/view/journals/kidney-news/11/7/article-p20_17.xml
