'Irrational Lengthening' in Virgil - Brill,https://brill.com/downloadpdf/journals/mnem/73/4/article-p577_3.xml
Romance Scansion and the Muw Aššahat in - Brill,https://brill.com/view/journals/jal/11/1/article-p36_3.xml%3Flanguage%3Den
Metrical Annotation of a Large Corpus of Spanish Sonnets,https://aclanthology.org/L16-1691.xml
Machine Learning for Metrical Analysis of English Poetry,https://aclanthology.org/C16-1074.xml
Poetry in Prose: automatic identification of verses in ... - dh2016,https://dh2016.adho.org/abstracts/static/data/396.xml
"<title type=""main"">PoetryLab. An Open Source Toolkit for ... - DH2020",https://dh2020.adho.org/wp-content/uploads/2020/07/463_PoetryLabAnOpenSourceToolkitfortheAnalysisofSpanishPoetryCorpora.xml
"CLAUDIAN, Shorter Poems | Loeb Classical Library",https://www.loebclassics.com/view/claudian_claudianus-shorter_poems/1922/pb_LCL136.187.xml%3FreadMode%3Drecto
"PLAUTUS, The Little Carthaginian - Poenulus - Loeb Classical Library",https://www.loebclassics.com/view/plautus-little_carthaginian/2012/pb_LCL260.189.xml%3FreadMode%3Drecto
METER AND MEASURE IN AVANT-GARDE POETRY - AKJournals,https://akjournals.com/previewpdf/journals/11059/21/1/article-p143.xml%3FpdfJsInlineViewToken%3D1264710107%26inlineView%3Dtrue
