"Full text of ""Studies in stichomythia .."" - Internet Archive",https://archive.org/stream/studiesinstichom00hancrich/studiesinstichom00hancrich_djvu.txt
"Halleran, 'Agon in Euripides', Bryn Mawr Classical Review v3n05 ...",http://serials.infomotions.com/bmcr/bmcr-v3n05-halleran-agon.txt
Hamlet is a play written by William Shakespeare that very closely ...,https://www.cs.du.edu/~leut/2673/cheat_smallSet/sra126.txt
kbart - Brill,https://brill.com/fileasset/downloads_static/ebookkbart/9789004419025_KBART.txt
"""The Letter was not nice but full of charge"": Toward an Electronic ...",https://extra.shu.ac.uk/emls/iemls/shaksper/files/DYNAMIC%2520SHAKSPER.txt
"The Project Gutenberg EBook of Tragedy, by Ashley H. Thorndike ...",https://www.gutenberg.org/files/38711/38711-8.txt
