[PDF] Self-circularization of Linear DNA | Thermo Fisher Scientific,https://tools.thermofisher.com/content/sfs/manuals/MAN0013192_Selof_Linear_DNA_UG.pdf
[PDF] Importance of Beam Circularization,https://www.thorlabs.com/images/TabImages/Elliptical_Beam_Circularization_Lab_Fact.pdf
Widespread and Functional RNA Circularization in Localized ...,https://www.cell.com/cell/pdf/S0092-8674(19)30058-3.pdf
RNA Circularization Diminishes Immunogenicity and Can Extend ...,https://www.cell.com/molecular-cell/pdfExtended/S1097-2765(19)30105-4
"Curved DNA: design, synthesis, and circularization. - PNAS",https://www.pnas.org/doi/pdf/10.1073/pnas.83.4.862
Circularization of oligonucleotides by disulfide bridge formation,https://academic.oup.com/nar/article-pdf/23/11/2025/7123130/23-11-2025.pdf
[PDF] One-step DNA Fragment Assembly and Circularization for Gene ...,https://www.mdpi.com/1467-3045/12/1/00011/pdf
[PDF] recombination by a digestion-circularization polymerase - NCBI,https://www.ncbi.nlm.nih.gov/pmc/articles/PMC49628/pdf/pnas01089-0325.pdf
A new molecular mechanism of RNA circularization and the ...,https://www.tandfonline.com/doi/pdf/10.1080/07391102.2020.1844802
Inverted repeats are necessary for circularization of the mouse testis ...,https://www.sciencedirect.com/science/article/pii/0378111995006397/pdf%3Fmd5%3D8ff21be34541935f13d917d1ed02a7ed%26pid%3D1-s2.0-0378111995006397-main.pdf
