Mutualisms and Symbioses - Ecology - Oxford Bibliographies,https://www.oxfordbibliographies.com/view/document/obo-9780199830060/obo-9780199830060-0006.xml
Entry Stakeholder Symbiosis - SAGE Knowledge,https://sk.sagepub.com/reference/sage-encyclopedia-of-business-ethics-and-society-2e/i38813.xml
Symbiosis And Parasitism In The Crustacea in - Brill,https://brill.com/view/book/edcoll/9789004188259/B9789004188259-s006.xml
Symbiosis and Substitution in Spectator Sport in - Human Kinetics ...,https://journals.humankinetics.com/view/journals/jsm/20/3/article-p299.xml
First Look Into the Ambrosia Beetle–Fungus Symbiosis Present in ...,https://bioone.org/journals/environmental-entomology/volume-51/issue-2/nvab142/First-Look-Into-the-Ambrosia-BeetleFungus-Symbiosis-Present-in-Commercial/10.1093/ee/nvab142.xml
Drivers and barriers for industrial symbiosis: the case of Mo ...,https://www.elgaronline.com/view/edcoll/9781800373082/9781800373082.00021.xml
"The story of symbiosis with zooxanthellae, or how they enable their ...",http://biologie.ens-lyon.fr/ressources/bibliographies/m1-12-13-biosci-reviews-fournier-a-1c-m.xml
A Precarious Symbiosis : Music in the Early Twentieth Century,https://www.oxfordwesternmusic.com/view/Volume4/actrade-9780195384840-div1-007003.xml
Looking at the Eukaryotic Associations from a Microbial Perspective,https://journals.scholarsportal.info/pdf/23795077/v04i0004/nfp_msabdleafamp.xml
