[PDF] Semisolid and examinational Gerard fraternized ... - Medical Grads,https://medicalgrads.com/wp-content/uploads/formidable/24/semisolid-and-examinational-gerard-fraternized-some-recension-so-overbearingly.pdf
[PDF] Supplementary Data List S1: Phrases used for levels of sweetness ...,https://www.mdpi.com/article/10.3390/foods11131872/s1
"[PDF] 1. As a YouTuber and music educator, when you use someone ...",https://www.judiciary.senate.gov/download/beato-responses-to-questions-for-the-record
"Authorship and Synchronicity in Shahriar Mandanipour's ""Censoring",https://www.jstor.org/stable/24482802
The Customer as King: A Response to Hans G. Hönig,https://www.tandfonline.com/doi/pdf/10.1080/13520529709615482
A Review of “Service Learning: Linking Library Education and ...,https://www.tandfonline.com/doi/pdf/10.1080/10875300903535263
The emergence of cultural complexity on the west coast of North ...,https://www.cambridge.org/core/services/aop-cambridge-core/content/view/61483EEFFC7D0189B9D4828212CFEECC/S0003598X00080777a.pdf/the-emergence-of-cultural-complexity-on-the-west-coast-of-north-america.pdf
Teaching the Body in Composition Class,https://muse.jhu.edu/article/262647/pdf
"DA MILLER, Jane Austen, or the Secret of Style (Princeton",https://read.dukeupress.edu/novel/article-pdf/38/2-3/302/448934/0380302.pdf
[PDF] AN INTEGRATED SOLUTION TO DISPLAY LARGE IMAGES AT ...,https://www.hou.usra.edu/meetings/planetdata2019/pdf/7064.pdf
