Protocol Support for High Availability IKEv2/IPsec - IETF Tools,https://tools.ietf.org/id/draft-ietf-ipsecme-ipsecha-protocol-00.xml
repmgr/promoting-standby.xml at master · EnterpriseDB/repmgr ...,https://github.com/2ndQuadrant/repmgr/blob/master/doc/promoting-standby.xml
repmgr/repmgrd-automatic-failover.xml at master - GitHub,https://github.com/2ndQuadrant/repmgr/blob/master/doc/repmgrd-automatic-failover.xml
Reliability and availability of 1-out-of-n:G cold standby systems with ...,https://journals.scholarsportal.info/details/00390631/v21i0004/315_raao1cfracrr.xml
Cost analysis of a repairable warm standby k-out-of-n: G and 2-out ...,https://journals.scholarsportal.info/details/25201352/v10i0002/121_caoarwucfucr.xml
Filariasis Testing in a Jird Model: New Drug Leads from Some Old ...,https://www.ajtmh.org/view/journals/tpmd/51/6/article-p791.xml
ICC's Uniform Rules for Demand Guarantees 758 - Dentons,https://www.dentons.com/~/media/Videos/2010/September/URDG%2520758/data/srchdata.xml
Analysis of 1 out of 2 Main Units and 2 out of 4 Subunits System ...,https://www.ijtsrd.com/PaperXml//ijtsrd9410.xml
"THE COURTHOUSE CONSTABLE Volume 6, Issue 1 Winter 2019 ...",http://w.constable5.com/news/CN5_newsletter_V6_N1_2019/files/search/bookText.xml
