Brazil's Olympic Legacy: Teen Girls Tackle Taboos Through Sport,https://www.malaysiasun.com/news/248463477/oct04v40.flv
Uniforms (1) Anal Gay Tube.FLV - XNXX.COM,https://www.xnxx.tv/video-68i1j8e/uniforms_1_anal_gay_tube.flv
capoeira brazil batizado.flv - Video - Chomikuj,"https://chomikuj.pl/KowiMatsu/CAPOEIRA/Video/capoeira%2Bbrazil%2Bbatizado,328434825.flv"
Bigg Boss Brazil Oops Video.flv - Lady Banana XXVIDEO,https://www.ladybanana.co.uk/it/video16344933/bigg_boss_brazil_oops_video.flv
Bigg Boss Brazil Oops Video.flv - 16honeys.com,http://16honeys.com/download/16344933/bigg-boss-brazil-oops-video.flv
California startup Bird launches scooters in Mexican capital,https://www.indiagazette.com/news/258088952/oct04v56.flv
4 people fall ill after eating tuna at Sydney cafe,https://www.southeastasiapost.com/news/230587307/feb24v21.flv
Watch out for these giant venomous jellyfish! - Big News Network.com,https://www.irishsun.com/news/257641880/oct04v40.flv
Latin Spice - Green Dress Dance.FLV - XNXX.COM,https://www.xnxx.com/video-77gaj4f/latin_spice_-_green_dress_dance.flv
Ilagan City to sponsor skills training program anew,https://www.theuknews.com/news/257554710/feb24v21.flv
Harley-Davidson: No US Sales Hit From Offshoring Dustup,https://www.oaklandtimes.com/news/257726913/oct04v56.flv
