working in the 'Huts' with the professor: the first Maudsley years in,https://joe.bioscientifica.com/view/journals/joe/226/2/E7.xml
MEMOIR: working in the 'Huts' with the professor: the first Maudsley ...,https://joe.bioscientifica.com/downloadpdf/journals/joe/226/2/E7.xml
DOC Huts - ArcGIS Online,https://www.arcgis.com/sharing/rest/content/items/7f7321caf77b4101b9573db4575dd794/info/metadata/metadata.xml%3Fformat%3Ddefault%26output%3Dhtml
sitemap.xml - Great Huts Resort,https://greathuts.com/sitemap.xml
Forms of shelter among nomadic forest dwellers in Southeast Asia in,https://brill.com/view/book/edcoll/9789004253988/B9789004253988-s010.xml
THE R USSIAN SMOKY HUT AND ITS PROBABLE HEALTH ... - Brill,https://brill.com/previewpdf/journals/ruhi/28/1-4/article-p171_11.xml
[PDF] First evaluation of bendiocarb in experimental huts using different ...,https://journals.scholarsportal.info/pdf/14752875/v15inone/nfp_feobiehudsim.xml
Evaluation of the Residual Efficacy of Actellic300 CS in Simple Huts ...,https://bioone.org/journals/journal-of-medical-entomology/volume-58/issue-6/tjab096/Evaluation-of-the-Residual-Efficacy-of-Actellic300-CS-in-Simple/10.1093/jme/tjab096.xml
The Hut-Hospital as Project and as Practice in - Berghahn Journals,https://www.berghahnjournals.com/view/journals/social-analysis/62/2/sa620204.xml
