"Relative Poincaré lemma, contractibility, quasi-homogeneity and ...",https://projecteuclid.org/journals/illinois-journal-of-mathematics/volume-48/issue-3/Relative-Poincar%25C3%25A9-lemma-contractibility-quasi-homogeneity-and-vector-fields-tangent/10.1215/ijm/1258131054.xml
Pointwise version of contractibility of Banach algebras of locally ...,https://projecteuclid.org/journals/bulletin-of-the-belgian-mathematical-society-simon-stevin/volume-26/issue-1/Pointwise-version-of-contractibility-of-Banach-algebras-of-locally-compact/10.36045/bbms/1553047232.xml
Left amenability and left contractibility of Lau algebras in - AKJournals,https://akjournals.com/view/journals/012/51/3/article-p407.xml
why fiduciary accountability cannot be negotiable in - Elgaronline,https://www.elgaronline.com/abstract/edcoll/9781784714826/9781784714826.00017.xml
"Motivation, information, negotiation: why fiduciary accountability ...",https://www.elgaronline.com/view/edcoll/9781784714826/9781784714826.00017.xml
1. Introduction - Hindawi.com,http://downloads.hindawi.com/journals/aaa/2014/514761.xml
recast-jats-build ec6cccc6e1 fmch Fam Med Com Health fmch ...,https://fmch.bmj.com/content/1/3/12.download.xml
Glomus Tumor Simulating Nerve Root Compression and Raynaud's ...,https://thejns.org/previewpdf/journals/j-neurosurg/29/6/article-p645.xml
biorxiv BIORXIV bioRxiv bioRxiv Cold Spring Harbor Laboratory ...,https://www.biorxiv.org/content/biorxiv/early/2019/12/02/861997.source.xml
