reap-base/pom.xml at master - GitHub,https://github.com/reap-platform/reap-base/blob/master/pom.xml
FORM D - SEC.gov,https://www.sec.gov/Archives/edgar/data/1806377/000180637720000001/xslFormDX01/primary_doc.xml
Inviting Applications for the Rural Energy for America ... - GovInfo,https://www.govinfo.gov/metadata/granule/FR-2021-07-26/2021-15785/mods.xml
Inviting Applications for the Rural Energy for America ... - GovInfo,https://www.govinfo.gov/metadata/granule/FR-2020-11-25/2020-26086/mods.xml
AS Hijack Detection and Mitigation - IETF,https://www.ietf.org/archive/id/draft-sriram-sidrops-as-hijack-detection-03.xml
"An ordinary but extraordinary city: Siem Reap Angkor, Cambodia in",https://www.elgaronline.com/abstract/edcoll/9781789908015/9781789908015.00015.xml
"Emergence of Pediatric Melioidosis in Siem Reap, Cambodia in",https://www.ajtmh.org/view/journals/tpmd/82/6/article-p1106.xml
"Emergence of Pediatric Melioidosis in Siem Reap, Cambodia",https://www.ajtmh.org/downloadpdf/journals/tpmd/82/6/article-p1106.xml
Resort in Siem Reap - Angkor Miracle Resort & Spa,https://angkormiracle.com/index.php/page-sitemap.xml
