Resprouting patterns after fire and response to stool cleaning of two ...,https://journals.scholarsportal.info/details/03781127/v179i1-3/401_rpafarlhotds.xml
Demography of Adenostoma fasciculatum after fires of different ...,https://journals.scholarsportal.info/details/00298549/v96i0001/95_doafafdiiscc.xml
Fire in Mediterranean Climate Ecosystems—A Comparative ... - Brill,https://brill.com/view/journals/ijee/58/2-3/article-p123_3.xml%3Flanguage%3Den
"aDepartment of Biology and Environment, Faculty of Natural ... - Brill",https://brill.com/downloadpdf/journals/ijee/58/2-3/article-p177_7.xml
1. Introduction - Hindawi.com,http://downloads.hindawi.com/journals/ijecol/2020/1672306.xml
1. Introduction - Hindawi.com,https://downloads.hindawi.com/journals/ijfr/2014/821891.xml
Effect on Production and Quality of Intensifying Triploid Watermelon ...,https://journals.ashs.org/hortsci/view/journals/hortsci/43/1/article-p149.xml
Production and Postharvest Treatment of Cut Stems of Eucalyptus L ...,https://journals.ashs.org/hortsci/view/journals/hortsci/31/6/article-p1007.xml
RAVG Thematic Percent Change in Canopy Cover (CC-5) - USDA,https://data.fs.usda.gov/geodata/rastergateway/ravg/RAVG_Metadata_National_Mosiac_CC5.xml
HortTechnology] Response of 'Desirable' and 'Kiowa' Pecan to a ...,https://journals.ashs.org/horttech/pdfviewer/full/journals/horttech/18/3/article-p455.xml%3Fbg%3DGREY_COLOR_LIGHT_VARIANT%26mgs%3DPRIMARY_COLOR%26mge%3DPRIMART_COLOR_DARK_VARIANT
NHESS Natural Hazards and Earth System Sciences NHESS Nat ...,https://www.nat-hazards-earth-syst-sci.net/10/957/2010/nhess-10-957-2010.xml
