"The Convection, Aerosol, and Synoptic-Effects in the Tropics (CAST ...",https://journals.ametsoc.org/abstract/journals/bams/98/8/bams-d-16-0192.1.xml
"The Convection, Aerosol, and Synoptic-Effects in the Tropics (CAST ...",https://journals.ametsoc.org/view/journals/bams/98/8/bams-d-16-0192.1.xml
PROTEOLYTIC ENZYME SYSTEMS IN DEVELOPING RAT ...,https://rep.bioscientifica.com/abstract/journals/rep/17/1/jrf_17_1_004.xml
"Penn St.-Schuylkill at Clarks Summit - September 7, 2021 - Box Score",https://www.psuschuylkillathletics.com/sports/wsoc/2021-22/boxscores/20210907_stfv.xml
"Clarks Summit at SUNY Poly September 3, 2021",https://wildcats.sunypoly.edu/sports/wsoc/2021-22/boxscores/20210903_afvt.xml
sitemap.xml - The New Yorker,https://www.newyorker.com/sitemap.xml%3Fyear%3D1936%26month%3D11%26week%3D3
Untitled,http://downloads.hindawi.com/journals/amete/2015/261239.xml
"Clarks Summit at SUNY Poly - September 3, 2021 - 7:00 PM - Box",https://www.nacathletics.com/sports/wsoc/2021-22/boxscores/20210903_afvt.xml
"Penn St.-Abington at Clarks Summit - September 3, 2019 - 04:00 ...",https://d3soccer.com/seasons/women/2019/boxscores/20190903_z1ca.xml
