"Male Travelers, Female Bodies, and the Gendering of Racial Ideology",https://www.jstor.org/stable/2953316
"[PDF] ""Some Could Suckle over Their Shoulder"": Male Travelers, Female ...",https://fac.umass.edu/ArticleMedia/Files/MorganSomeCouldSuckleOverTheirShoulder.pdf
"[PDF] Harmful, Non-Productive Suckling in Orphaned Neonatal Kittens","https://www.maddiesfund.org/Harmful-Non-productive-Suckling-in-Orphaned-Neonatal-Kittens/presentation_content/external_files/Educational%2520Handout-%2520Harmful,%2520Non-Productive%2520Suckling%2520in%2520Orphaned%2520Neonatal%2520Kittens.pdf"
Behavioral neuroscience: Learning to suckle with signature odor.,https://www.cell.com/current-biology/pdf/S0960-9822(12)01136-0.pdf
A COMPARISON OF ISOTOPE DILUTION AND WEIGH-SUCKLE ...,https://cdnsciencepub.com/doi/pdf/10.4141/cjas85-116
Suckle facilitation of feeding in selected adult dysphagic patients,http://link.springer.com/content/pdf/10.1007/BF02408234
SUCKLING BEHAVIOR OF PRAIRIE VOLES,https://academic.oup.com/jmammal/article-pdf/79/4/1184/2513941/79-4-1184.pdf
ULTRASOUND DEMONSTRATION OF TONGUE MOTIONS ...,https://onlinelibrary.wiley.com/doi/pdf/10.1111/j.1469-8749.1990.tb16928.x
[PDF] Progression from gastric tube feeds to full suckle feeds ... - CiteSeerX,https://citeseerx.ist.psu.edu/viewdoc/download%3Fdoi%3D10.1.1.524.7194%26rep%3Drep1%26type%3Dpdf
Neonatal Cardiac Deceleration on Suckle Feeding - JAMA Network,https://jamanetwork.com/journals/PEDS/articlepdf/501849/archpedi_112_1_003.pdf
