Undergraduate Program Phase - University of Mississippi Medical ...,https://www.asylumhillproject.org/Office%2520of%2520Academic%2520Affairs/For-Students/Academic%2520Outreach%2520Programs/Mississippi%2520Rural%2520Dentists%2520Scholarship%2520Program/Program%2520Phases/Undergraduate%2520Program%2520Phase/Undergraduate%2520Program%2520Phase.xml
Undergraduate Policies - Academic Catalog,http://www.gallaudet.edu/x63610.xml
SHRP Undergraduate Programs - University of Mississippi Medical ...,https://mychart.tlummc.net/Office%2520of%2520Academic%2520Affairs/For-Students/Student%2520Financial%2520Aid/Cost-of-Attendance-and-Tuition/2021-Cost-of-Attendance-and-Tuition/School-of-Health-Related-Professions/SHRP%2520Undergraduate%2520Programs.xml
Study Habits and Attainment in Undergraduate Mathematics,https://pubs.nctm.org/view/journals/jrme/51/1/article-p26_1.xml
"Undergraduate, Traditional Campus Based Programs 2020-21 ...",https://www.umc.edu/Office%2520of%2520Academic%2520Affairs/For-Students/Student%2520Affairs/Student%2520Accounting%2520and%2520Insurance/Tuition/Fees/Tables-2020-2021/SHRP/Undergrad-Traditional-Campus.xml
"Undergraduate, Traditional Campus Based Programs 2022-23 ...",https://www.umc.edu/Office%2520of%2520Academic%2520Affairs/For-Students/Student%2520Affairs/Student%2520Accounting%2520and%2520Insurance/Tuition/Fees/Tables-2022-2023/SHRP/Undergrad-Traditional-Campus.xml
Video feature: Resident graduate students live and learn with ...,http://www.kwqpqk.tw/main/news/archive/S43/09/41I14/index.xml
How Undergraduate Students Learn Atmospheric Science,https://journals.ametsoc.org/view/journals/bams/103/2/BAMS-D-20-0023.1.xml
Undergraduate Enrollment Deposit | Duquesne University,https://duq.edu/x112378.xml
