Entry Scree Plot - SAGE Knowledge,https://sk.sagepub.com/reference/sage-encyclopedia-of-educational-research-measurement-evaluation/i18507.xml
How to do Linguistics with R – Companion site,https://benjamins.com/sites/z.195/question/m85.xml
How to do Linguistics with R – Companion site,https://benjamins.com/sites/z.195/question/m84.xml
Figures and Tables in: Education and Emergency in Italy - Brill,https://brill.com/view/book/9789004523234/front-7.xml
Theory: The Time Screen : Music in the Late Twentieth Century,https://www.oxfordwesternmusic.com/view/Volume5/actrade-9780195384857-div1-006003.xml
SCREE FORESTS (MERCURIALI-TILIETUM) OF THE BÖRZSÖNY ...,https://akjournals.com/downloadpdf/journals/034/46/3-4/article-p319.xml
D13494 - REAR VISION SYSTEMS VIGNAL KIT 5 INCH. COLOR ...,https://www.sandersparts.be/documents/catalog/d13494.xml%3Flang%3Den
[PDF] Using principal component analysis to reduce complex datasets ...,https://journals.scholarsportal.info/pdf/17430003/v15inone/nfp_upcatrbrtihp.xml
