Lingular Disease - CHEST Journal,https://journal.chestnet.org/article/S0096-0217(16)60082-1/pdf
Roentgenographic Findings in Lesions of the Lingula,https://pubs.rsna.org/doi/pdf/10.1148/57.2.193
The Lingula is an Appropriate Site for Lung Biopsy,https://www.annalsthoracicsurgery.org/article/S0003-4975(99)01565-9/pdf
Lingular collapse with medial pneumothorax,https://www.ajronline.org/doi/pdf/10.2214/ajr.136.5.919
"Shape, height, and location of the lingula for sagittal ramus ...",https://onlinelibrary.wiley.com/doi/pdf/10.1002/ca.20849
Cenozoic records of the genus Lingula (Brachiopoda,https://www.tandfonline.com/doi/pdf/10.1080/03036758.1987.10421705
Lingular and Right Middle Lobe Biopsy in the Assessment of Diffuse ...,https://www.sciencedirect.com/science/article/pii/S0003497510620711/pdf%3Fmd5%3D834f60e4c3a88fc7fb88506c9e1a3085%26pid%3D1-s2.0-S0003497510620711-main.pdf
Resection of the Right Middle Lobe and Lingula for Mycobacterial ...,https://www.sciencedirect.com/science/article/pii/0003497596005346/pdf%3Fmd5%3D77cbdcb04225179eaab7dfe36a9a0b2b%26pid%3D1-s2.0-0003497596005346-main.pdf
[PDF] Anatomical review of the mandibular lingula for inferior alveolar ...,https://journals.viamedica.pl/folia_morphologica/article/download/FM.a2020.0135/52411
"[PDF] Proof that Lingula (Brachiopoda) is not a living-fossil, and emended ...",http://paleopolis.rediris.es/cg/03/L01/CG2003_L01.pdf
