Pastoralism - African Studies - Oxford Bibliographies,https://www.oxfordbibliographies.com/view/document/obo-9780199846733/obo-9780199846733-0010.xml
African Pastoralism: Plus ça Change? From Constant Herders ... - Brill,https://brill.com/view/book/9789004471641/BP000014.xml
Africa's Nomadic Pastoralists and Their Animals Are an Invisible ...,https://www.ajtmh.org/view/journals/tpmd/103/5/article-p1777.xml
Falling between the Cracks of the Governing Systems - AMS Journals,https://journals.ametsoc.org/view/journals/wcas/14/1/WCAS-D-21-0052.1.xml
Falling between the cracks of the governing systems - AMS Journals,https://journals.ametsoc.org/view/journals/wcas/aop/WCAS-D-21-0052.1/WCAS-D-21-0052.1.xml
Natureculture in pastoralism and the literary pastoral in - manchester ...,https://www.manchesterhive.com/abstract/9781526156587/9781526156587.00007.xml
Livestock Dung Use in Steppe Pastoralism in,https://www.berghahnjournals.com/view/journals/sibirica/21/1/sib210102.xml
Pastoralism as a form of entrepreneurship among Negev Bedouin in,https://www.elgaronline.com/view/edcoll/9781839104138/9781839104138.00066.xml
Pastoralism in the Andes - Latin American Studies - Oxford ...,https://www.oxfordbibliographies.com/view/document/obo-9780199766581/obo-9780199766581-0200.xml
SAGE Reference - Encyclopedia of Environment and Society,https://sk.sagepub.com/reference/environment/n828.xml
