"Ghazi A. Algosaibi, An Apartment Called Freedom. A Novel. London ...",https://brill.com/view/journals/wdi/38/1/article-p125_5.xml%3Flanguage%3Den
REVIEW GHAZI A. ALGHOSAIBI. An Apartment Called ... - Brill,https://brill.com/previewpdf/journals/jal/28/1-2/article-p291_10.xml
statement of changes in beneficial ownership - SEC FORM 4,https://www.sec.gov/Archives/edgar/data/0001652724/000120919121058567/xslF345X03/doc4.xml
SEC FORM 4,https://www.sec.gov/Archives/edgar/data/883241/000119971922000056/xslF345X03/edgardoc.xml
Kao Shuan: A Member of the Dera Ghazi Khan Serogroup ...,https://jme.oxfordjournals.org/content/26/5/425.source.xml
Untitled,https://dblp.org/pid/120/6948.xml
A Study on Radiative Damping of Planetary Waves Utilizing ...,https://journals.ametsoc.org/view/journals/atsc/42/19/1520-0469_1985_042_2032_asordo_2_0_co_2.xml
Dars-e-Hadees By Maulana Naseem Ghazi Falahi - Subscribe on ...,https://www.subscribeonandroid.com/khaulafatima.github.io/islam4all.github.io/darse_e_hadees/podcast/lectures.xml
1. Introduction - De Gruyter,https://www.degruyter.com/toronto/view/book/9781442632172/10.3138/9781442632172-003.xml%3Flanguage%3Den
