Meet Seven-time Triple Jump All-American Nakeisha Jones - Tufts,https://www.gotuftsjumbos.com/video/Nakeisha_(for_paul).flv
Chinese shipping line takes delivery of largest container ship ever built,https://www.northkoreatimes.com/news/227888009/oct04v56.flv
Peliculas.flv | MercadoLibre,https://listado.mercadolibre.com.mx/musica-peliculas-y-series/musica-en-ecatepec-de-morelos-estado-de-mexico/peliculas.flv
Dwane Casey Ice Bucket Challenge - NBA.com,https://www.nba.com/amp/raptors/drop-box-nba-web-140820-caseyicebucket.flv
AnimeFenix for Android - APK Download,https://apkpure.com/ar/animefenix/com.animefenix.flv
Carr Fire: Most formidable of 94 fires raging across U.S. - Big News ...,https://www.irishsun.com/news/257768387/oct04v56.flv
