[PDF] PERVADE - Floratine Northwest,https://www.floratinenorthwest.com/uploads/Products/Pervade.pdf
[PDF] Pervade Pellets - Floratine Northwest,https://www.floratinenorthwest.com/uploads/Products/Pervade%2520Pellets.pdf
A Book Pervaded by Voices,https://muse.jhu.edu/article/833742/pdf
Towards Architecting Digital Twin-Pervaded Systems - IEEE Xplore,https://ieeexplore.ieee.org/iel7/8870973/8882798/08882862.pdf
[PDF] Pervade - SAFETY DATA SHEET,http://floratine.com/sds/Pervade.SDS.USA.pdf
"[PDF] U.S. EPA, Pesticides, Label, PERVADE MOSQUITO LARVICIDE ...",https://www3.epa.gov/pesticides/chem_search/ppls/011930-00006-20110216.pdf
lic identities that pervaded Carnival Clambake - jstor,https://www.jstor.org/stable/541743
Pervading Themes and Issues in the Management of Staff ...,https://www.tandfonline.com/doi/pdf/10.1080/0305763880140314
1 The dialectic of coldness in Adorno's social theory - SAGE Journals,https://journals.sagepub.com/doi/pdf/10.1177/0725513613494712
BOOK REVIEWS 313 pervaded the settlements along the St. Law,https://www.journals.uchicago.edu/doi/pdf/10.1086/240091
colonial Other that pervaded interwar French society. Ezra ... - JStor,https://www.jstor.org/stable/3685813
conceptualizing task-technology fit for technology-pervaded value ...,https://aisel.aisnet.org/cgi/viewcontent.cgi%3Ffilename%3D0%26article%3D1048%26context%3Decis2020_rp%26type%3Dadditional
Balance Sense: Response Motifs that Pervade the Brain - Cell Press,https://www.cell.com/current-biology/pdf/S0960-9822(18)31361-7.pdf
[PDF] Pope Francis Lesson Two,https://stsebastianseymour.weconnect.com/uploads/mce/ac3478d69a3c81fa62e60f5c3696165a4e5e6ac4/Pope%2520Francis%2520Lesson%2520Two.pdf
"Despite the smell of olive oil that pervaded the house, Belkhodja ...",https://www.degruyter.com/document/doi/10.12987/9780300231571-025/pdf
[PDF] PERVADE,https://d2j31icv6dlhz6.cloudfront.net/O/gRjyV8A1e5/pervade-water-penetrant-pdf.pdf
Heuristics Structure and Pervade Formal Risk Assessment,https://onlinelibrary.wiley.com/doi/pdf/10.1111/risa.12136
[PDF] A gloomy spirit pervaded the Sauk and Fox villages. It was early ...,https://pubs.lib.uiowa.edu/palimpsest/article/id/21711/download/pdf/
The placebo effect phenomenon has pervaded modern medical ...,https://www.cambridge.org/core/services/aop-cambridge-core/content/view/D68E0D8856D408FE2A71840F8ED42619/S0007125000067659a.pdf/edited-by-allan-beveridge-femi-oyebode-and-rosalind-ramsay-the-placebo-effect-in-clinical-practice-by-walter-a-brown-oxford-university-press-2013-pound3000-hb-177-pp-isbn-9780199933853.pdf
