[PDF] Tumorigenesis as a process of gradual loss of original cell identity ...,https://cellandbioscience.biomedcentral.com/track/pdf/10.1186/s13578-017-0188-9.pdf
Cellular Pliancy and the Multistep Process of Tumorigenesis,https://www.cell.com/cancer-cell/pdf/S1535-6108(18)30007-2.pdf
Reversible Tumorigenesis by MYC in Hematopoietic Lineages,https://www.cell.com/molecular-cell/pdf/S1097-2765(00)80367-6.pdf
the adaptation of mammalian cells to sustained stress environment ...,https://academic.oup.com/carcin/article-pdf/26/8/1323/7089214/bgi079.pdf
The mechanisms of IDH mutations in tumorigenesis - Nature,https://www.nature.com/articles/cr201251.pdf%3Forigin%3Dppub
g-irradiation- induced thymic lymphomagenesis requires Puma-driven,http://genesdev.cshlp.org/content/24/15/1608.full.pdf
IDH1 and IDH2 Mutations in Tumorigenesis: Mechanistic Insights ...,https://clincancerres.aacrjournals.org/content/18/20/5562.full-text.pdf
Suppression of Tumorigenesis and Induction of p15ink4b by Smad4 ...,http://clincancerres.aacrjournals.org/content/clincanres/8/11/3628.full.pdf
Genetic similarities between organogenesis and tumorigenesis of ...,https://www.tandfonline.com/doi/pdf/10.4161/cc.7.2.5284
Crvptorchism and testicular tumorigenesis - Surgery,http://www.surgjournal.com/article/0039-6060(68)90287-0/pdf
[PDF] Aneuploidy: Instigator and Inhibitor of Tumorigenesis,"http://cmm.ucsd.edu/cleveland/DWC%2520Journal%2520PDF%2520files/2007/Weaver%2520and%2520Cleveland%2520(2007)%2520Cancer%2520Research%252067,%2520(21)%2520pages%252010103-10105.pdf"
YAP in tumorigenesis: Friend or foe? - Journal of Hepatology,https://www.journal-of-hepatology.eu/article/S0168-8278(15)00088-4/pdf
[PDF] RADIATION AND THE MICROENVIRONMENT TUMORIGENESIS ...,http://pfeifer.phas.ubc.ca/refbase/files/Barcellos-Hoff-Naturereviews.Cancer-2005-5-867.pdf
[PDF] Centrosome amplification is sufficient to promote spontaneous ...,https://mbg.jhmi.edu/wp-content/uploads/2020/03/nihms845493.pdf
Molecular Mechanisms Involved in Tumorigenesis and Their ...,https://www.sciencedirect.com/science/article/pii/0002961094901295/pdf%3Fmd5%3D97320e1bca2e80f5328b221c2832ce0f%26pid%3D1-s2.0-0002961094901295-main.pdf
Novel functions beyond tumorigenesis - The Lancet,https://www.thelancet.com/pdfs/journals/ebiom/PIIS2352-3964(20)30569-7.pdf
[PDF] Recurrent Somatic Structural Variations Contribute to Tumorigenesis ...,https://med.stanford.edu/content/dam/sm/csbs/documents/Chen-2014-Recurrent%2520somatic%2520structural%2520variat4.pdf
Innate lymphoid cells involve in tumorigenesis - Wiley Online Library,https://onlinelibrary.wiley.com/doi/pdf/10.1002/ijc.29443
Neoplastic Transformation and Tumorigenesis Associated with ...,https://www.jbc.org/article/S0021-9258(19)55754-4/pdf
[PDF] Modeling Somatic Evolution in Tumorigenesis - PLOS,https://journals.plos.org/ploscompbiol/article/file%3Fid%3D10.1371/journal.pcbi.0020108%26type%3Dprintable
The Gut Microbiome Modulates Colon Tumorigenesis - ASM Journals,https://journals.asm.org/doi/pdf/10.1128/mBio.00692-13
Bidirectional Signals Transduced by TOPK-ERK Interaction Increase ...,https://www.gastrojournal.org/article/S0016-5085(07)00833-5/pdf
[PDF] A population of stress-like cancer cells in melanoma promotes ...,https://www.biorxiv.org/content/10.1101/396622v2.full.pdf
684.full.pdf - PNAS,http://www.pnas.org/content/pnas/94/2/684.full.pdf
Mechanisms of Selenium Inhibition of Tumorigenesis - SAGE Journals,http://journals.sagepub.com/doi/pdf/10.3109/10915818609140733
[PDF] TBC1D9: An Important Modulator of Tumorigenesis in Breast Cancer,https://www.mdpi.com/2072-6694/13/14/3557/pdf
[PDF] UPDATE OF HARDERIAN GLAND TUMORIGENESIS: LOW-DOSE,https://three.jsc.nasa.gov/iws/25/cancerRisks/3247.pdf
[PDF] Autophagy regulator BECN1 suppresses mammary tumorigenesis ...,https://oar.princeton.edu/rt4ds/file/2960/Autophagy%2Bregulator%2BBECN1%2Bsuppresses.pdf
Tracking the origins of tumorigenesis - Science,https://www.science.org/doi/pdf/10.1126/science.aad9670
Genetic analysis of tumorigenesis - Karger Publishers,https://www.karger.com/Article/Pdf/131651
