MULTI-MALE MATING BY PAIRED AND UNPAIRED FEMALE ... - Brill,https://brill.com/downloadpdf/journals/beh/139/9/article-p1147_4.xml
MULTI-MALE MATING BY PAIRED AND UNPAIRED FEMALE ... - Brill,https://brill.com/view/journals/beh/139/9/article-p1147_4.xml%3Flanguage%3Den
Deep CT to MR Synthesis Using Paired and Unpaired Data,https://journals.scholarsportal.info/pdf/14248220/v19i0010/nfp_dctmsupaud.xml
Nature of the unpaired orbital of the disulphide anion as disclosed ...,https://journals.scholarsportal.info/details/00092614/v32i0002/247_notuoodf3shc.xml
A Cycled Reinforcement Learning Approach - ACL Anthology,https://aclanthology.org/P18-1090.xml
Constructing Emotional Consensus and Utilizing Unpaired Data for ...,https://aclanthology.org/2021.findings-emnlp.268.xml
How to do Linguistics with R – Companion site,https://benjamins.com/sites/z.195/question/m23.xml
properties of descending dorsal unpaired median (dum) neurons of ...,https://akjournals.com/downloadpdf/journals/018/55/1-4/article-p13.xml
Properties of descending dorsal unpaired median ... - AKJournals,https://akjournals.com/view/journals/018/55/1-4/article-p13.xml
