Multihour Stratospheric Flights with the Heliotrope Solar Hot-Air ...,https://journals.ametsoc.org/view/journals/atot/37/6/JTECH-D-19-0175.1.xml
Multihour Stratospheric Flights with the Heliotrope ... - AMS Journals,https://journals.ametsoc.org/downloadpdf/journals/atot/37/6/JTECH-D-19-0175.1.xml
[PDF] Volatile Floral Chemistry of Heliotropium arborescens L. 'Marine',https://journals.ashs.org/hortsci/downloadpdf/journals/hortsci/40/5/article-p1237.xml
Reducing Substrate Moisture Content (SMC) during Greenhouse ...,https://journals.ashs.org/hortsci/view/journals/hortsci/53/7/article-p1006.xml
UNE ODEUR FINE ET SUAVE D'HELIOTROPE - Brill,https://brill.com/view/book/9789401211956/B9789401211956-s004.xml
FORM D - SEC.gov,https://www.sec.gov/Archives/edgar/data/1597168/000159716814000001/xslFormDX01/primary_doc.xml
"Host‐specificity of Uromyces heliotropii, a fungal agent for the ...",https://journals.scholarsportal.info/details/00034746/v121i0003/697_houhafocheia.xml
"Book XXXVII - PLINY THE ELDER, Natural History | Loeb Classical ...",https://www.loebclassics.com/view/pliny_elder-natural_history/1938/pb_LCL419.299.xml%3FreadMode%3Drecto
Easter Mayhem 2017 Results - Planet Calypso,https://www.planetcalypso.com/news/pages/2017/04/26/1427/index.xml%3F
UNE ODEUR FINE ET SUAVE D'HELIOTROPE - Brill,https://brill.com/view/book/edcoll/9789401211956/B9789401211956-s004.xml
recast-jats-build e082d6219a bmjcr BMJ Case Reports ...,https://casereports.bmj.com/content/13/2/e232260.download.xml
