Difficulty with Arousal or Orgasm in Women | My Doctor Online,https://mydoctor.kaiserpermanente.org/mas/structured-content/Health_Topic_Difficulty_with_Arousal_or_Orgasm_in_Women_-_ObGyn.xml%3Fco%3D/regions/mas
Difficulty with Arousal or Orgasm in Women - My Doctor Online,https://mydoctor.kaiserpermanente.org/ncal/structured-content/Health_Topic_Difficulty_with_Arousal_or_Orgasm_in_Women_-_ObGyn.xml%3Fco%3D/regions/ncal
"Bitenosh's Orgasm, Galen's Two Seeds and Conception Theory in ...",https://brill.com/view/journals/dsd/28/1/article-p38_3.xml%3Flanguage%3Den
"Chapter 7 Good Vibrations: Hysteria, Female Orgasm, and Medical ...",https://brill.com/view/book/9789004336612/B9789004336612_010.xml
Prostate‐induced orgasms: A concise review illustrated with a highly ...,https://journals.scholarsportal.info/details/08973806/v31i0001/81_poacriwahrcs.xml
The role of women's orgasm goal pursuit in women's orgasm ...,https://journals.scholarsportal.info/details/01918869/v155icomplete/nfp_trowogpiwoo.xml
Death by orgasm in: Dangerous bodies - manchester hive,https://www.manchesterhive.com/view/9781784996758/9781784996758.00010.xml
