10 flight attendants reveal their favorite places to visit - Insider,https://www.thisisinsider.com/flight-attendants-favorite-destinations-2018-11/travel.rss
History of Flight Connection | Embassy of the Czech Republic ... - MZV,https://www.mzv.cz/copenhagen/en/briefly_about_the_czech_republic/history/history_of_flight_connection.rss
Airport comments for China - OurAirports,https://ourairports.com/countries/CN/comments.rss
New exhibit takes flight at Imagination Station | The Blade,https://www.toledoblade.com/business/Technology/2018/03/17/New-exhibit-takes-flight-at-Imagination-Station/stories/feed/feed/index.rss
Delta Air Lines ends last Toledo Express flight | The Blade,https://www.toledoblade.com/local/2011/02/22/Delta-ends-last-Toledo-flight/stories/feed/feed/index.rss
Flight Assist - Buzzsprout,https://feeds.buzzsprout.com/1095017.rss
Flight School - Buzzsprout,https://feeds.buzzsprout.com/644974.rss
The Secret History of Flight 149 - Megaphone,https://pod.link/1606899704.rss
Take FLIGHT - Megaphone,https://audioboom.com/channels/5004403.rss
