Evaluating Knowledge to Support Climate Action - AMS Journals,https://journals.ametsoc.org/view/journals/wcas/11/3/wcas-d-18-0134_1.xml
THE UPWARD SPEED OF AN AIR CURRENT NECESSARY TO ...,https://journals.ametsoc.org/view/journals/mwre/61/7/1520-0493_1933_61_198_tusoaa_2_0_co_2.xml
Resilience and Growth Through Sustained Adjustment - IMF eLibrary,https://www.elibrary.imf.org/view/books/084/05963-9781557754226-en/05963-9781557754226-en-book.xml
Sustaining and Accelerating Pro-Poor Growth in Africa | imfsg,https://www.elibrary.imf.org/view/books/058/06605-9781589064942-en/06605-9781589064942-en-book.xml
Transforming the R&D Model to Sustain Growth - ICON plc,https://www.idpeevercau.ga/insights/transforming-trials/transforming-the-rd-model/index.xml
"Transcription controls growth, cell kinetics and cholesterol supply to ...",https://ec.bioscientifica.com/view/journals/ec/6/7/EC-17-0092.xml
Sunitinib achieved fast and sustained control of VIPoma symptoms,https://eje.bioscientifica.com/downloadpdf/journals/eje/172/1/K1.xml
Sustaining Regular Exercise During Weight Loss Maintenance,https://journals.humankinetics.com/view/journals/jpah/18/10/article-p1253.xml
Finding Joy in the Journey: Sustaining a Meaningful Career in Sport ...,https://journals.humankinetics.com/view/journals/jsm/36/1/article-p1.xml
Challenges to and Opportunities for Sustaining an Equity Focus in ...,https://pubs.nctm.org/view/journals/jrme/53/2/article-p88.xml
