Muteness as Utterance of a Forced Reality Jack Bilbo's Modern Art ...,https://brill.com/abstract/book/9789401202008/B9789401202008_s012.xml
Jutta Vinzent Muteness as Utterance of a Forced Reality - Brill,https://brill.com/downloadpdf/book/9789401202008/B9789401202008_s012.xml
"Austin at Dallas Christian - February 12, 2022 - 3:00 PM - Box Score",https://austin.prestosports.com/sports/bsb/2021-22/boxscores/20220212_pkd4.xml
Louisiana Christian at Xavier (NO) - 19:46:00 - Box Score - NAIA Stats,https://naiastats.prestosports.com/sports/mbkb/2021-22/boxscores/20220214_abac.xml
Bilbo-Val: Automatic Identification of Bibliographical Zone in Papers,https://aclanthology.org/L16-1576.xml
SEC FORM 4,https://www.sec.gov/Archives/edgar/data/1661181/000106299322009807/xslF345X03/form4.xml
statement of changes in beneficial ownership - SEC FORM 4,https://www.sec.gov/Archives/edgar/data/1661181/000166118121000068/xslF345X03/edgar.xml
NPI Database | NPI:1316996424 | LINDA SUE BILBO APRN-BC ...,https://www.hipaaspace.com/medical_billing/coding/national_provider_identifier/codes/npi_1316996424.xml
NPI Database | NPI:1245615616 | DUANE BILBO X | Medical ...,https://www.hipaaspace.com/medical_billing/coding/national_provider_identifier/codes/npi_1245615616.xml
