Cameroon Prepares for Sunday Election Amid Security Challenges,https://www.madagascarsun.com/news/258088770/oct04v40.flv
Nigeria Arrests Boko Haram Members Linked to Chibok Attack,https://www.nigeriasun.com/news/257693170/oct04v40.flv
Nové formy reklamního působení a právo proti nekalé soutěži,https://is.muni.cz/th/151329/pravf_m/14347153/Kofola.FLV%3Finfo
Bangalore-based team powers singaporean company in winning ...,https://www.asiapacificstar.com/news/248535501/oct04v56.flv
{Raw Fuck Club} Shane Frost and Tate Ryder flv - Gaytorrent.ru,https://www.gaytorrent.ru/details.php/748d76835ae8410971a4245d9ffa993a18c38bae8206859f/%25E2%2599%25BA%2B%257BRaw%2BFuck%2BClub%257D%2BShane%2BFrost%2Band%2BTate%2BRyder.flv
Hop on with frog's evolutionary movements - Big News Network.com,https://www.irishsun.com/news/249647501/oct04v56.flv
Record 1.2 metric tonne shipment of meth seized in Australia,https://www.dublinnews.com/news/255848842/oct04v56.flv
