Influence of raceway waviness on the level of vibration in rolling ...,https://journals.scholarsportal.info/details/23001917/v65i0004/541_iorwotlovirb.xml
Identification of Acoustic Emissions From Porosity and Waviness ...,https://journals.scholarsportal.info/details/21653984/v02i0001/37_ioaefpdicfrc.xml
DT-CWT Robust Filtering Algorithm for The Extraction of Reference ...,https://www.degruyter.com/view/j/msr.2014.14.issue-2/msr-2014-0012/msr-2014-0012.xml
GEOFLUIDS Geofluids 1468-8123 1468-8115 Hindawi 10.1155 ...,https://downloads.hindawi.com/journals/geofluids/2021/4901231.xml
Computerized ultrasonographic tissue characterization of equine ...,https://avmajournals.avma.org/view/journals/ajvr/64/3/ajvr.64.3.366.xml
Investigating Head Movements Induced by 'Riloid' Patterns in ... - Brill,https://brill.com/downloadpdf/journals/msr/31/8/article-p753_3.xml
Relationships between anatomical and vibrational properties ... - Brill,https://brill.com/view/journals/iawa/39/1/article-p63_6.xml
Persistent Anomaly Changes in High-Resolution Climate ...,https://journals.ametsoc.org/abstract/journals/clim/aop/JCLI-D-20-0465.1/JCLI-D-20-0465.1.xml
Check VDA-4955 Compliance,http://www2.me.rochester.edu/courses/ME204/nx_help/en_US/tdocExt/content/r/vda_checker_vda_checker.xml
