"Cognitive Bias, Privacy Rights, and Digital Evidence in International ...",https://brill.com/abstract/journals/icla/21/2/article-p242_242.xml
SAGE Reference - The SAGE Encyclopedia of Human ...,https://sk.sagepub.com/reference/the-sage-encyclopedia-of-human-communication-sciences-and-disorders/i12614.xml
A Technique for Seamless Forecast Construction ... - AMS Journals,https://journals.ametsoc.org/downloadpdf/journals/mwre/148/9/mwrD190076.xml
A Technique for Seamless Forecast Construction and Validation ...,https://journals.ametsoc.org/view/journals/mwre/148/9/mwrD190076.xml
Comments on Polak and on Thygesen in - IMF eLibrary,https://www.elibrary.imf.org/view/books/071/02042-9781557756640-en/ch029.xml
REPRODUCTION - Bioscientifica,https://rep.bioscientifica.com/downloadpdf/journals/rep/161/1/REP-20-0253.xml
Child Wages in the Cotton Mills: Our Modern Feudalism: Electronic ...,https://docsouth.unc.edu/nc/mckelway/mckelway.xml
Book Reviews in: Transfers Volume 6 Issue 3 (2016) - Berghahn ...,https://www.berghahnjournals.com/view/journals/transfers/6/3/trans060314.xml
Linker histone defines structure and self‑association behaviour of ...,https://journals.scholarsportal.info/pdf/20452322/v11inone/nfp_lhdsasbot1hc.xml
