Trichrome Stain for Parasite Detection - State Hygienic Laboratory,http://www.shl.uiowa.edu/testmenu/menupages/parasiteidtrichome.xml
Observations on the Pathology of Saccular Aneurysms in,https://thejns.org/view/journals/j-neurosurg/24/4/article-p792.xml
Effect of Trichome Removal and UV-C on Populations of E. coli ...,https://journals.ashs.org/hortsci/view/journals/hortsci/55/10/article-p1626.xml
Pathology in Practice in: Journal of the American Veterinary Medical ...,https://avmajournals.avma.org/view/journals/javma/259/S2/javma.20.03.0111.xml
A selective estrogen receptor a agonist ameliorates hepatic ...,https://joe.bioscientifica.com/downloadpdf/journals/joe/210/3/323.xml
THE RAT ADENOHYPOPHYSIS DURING INCREASED ...,https://eje.bioscientifica.com/view/journals/eje/53/4_Suppl/acta_53_Suppl_112_001.xml%3Frskey%3DrGlQzY%26result%3D1
Diffuse Intralobular Liver Fibrosis in Dogs Naturally Infected with ...,https://www.ajtmh.org/downloadpdf/journals/tpmd/79/2/article-p198.xml
Untitled,https://www.biorxiv.org/content/biorxiv/early/2020/07/04/2020.07.03.187237.source.xml
Introduction - PLOS,http://open-repository.kisti.re.kr/cube/bitstream/open_repository/78867/1/journal.pone.0019097.xml
