Nazification of the German Bureaucracy Reconsidered: A Case Study,https://www.jstor.org/stable/1881401
Nazification of the German Bureaucracy Reconsidered: A Case Study,https://www.journals.uchicago.edu/doi/pdf/10.1086/600404
"The Case of the International Criminal Police Commission(""Interpol"")",https://journals.sagepub.com/doi/pdf/10.1177/002071520204300102
"[PDF] The Greater Germanic Reich: Education, Nazification, and the ...",https://trace.tennessee.edu/cgi/viewcontent.cgi%3Farticle%3D6440%26context%3Dutk_graddiss
The nazification of art - Taylor & Francis Online,https://www.tandfonline.com/doi/pdf/10.1016/0191-6599%252891%252990057-6
[PDF] creating killers: the nazification of the black sea germans and,https://cdr.lib.unc.edu/downloads/8s45q997j%3Flocale%3Den
"Heidegger, De-Nazification and the Art of Teaching - Brill",https://brill.com/downloadpdf/book/9789004380776/BP000010.pdf%3FpdfJsInlineViewToken%3D780319054%26inlineView%3Dtrue
Joseph Lewitan and the Nazification of Dance in Germany,https://www.degruyter.com/document/doi/10.9783/9780812208863.335/pdf
4 The Nazification of Norway's Towns - De Gruyter,https://www.degruyter.com/document/doi/10.1515/9780691210902-006/pdf
From De-Nazification of Germany to De-Baathification of Iraq,https://onlinelibrary.wiley.com/doi/pdf/10.1002/polq.12618
