Chapter 4: The intransigent context: glimpses at the history of a ...,https://www.elgaronline.com/abstract/edcoll/9781781955130/9781781955130.00011.xml
"Between Intransigence and Tolerance in: Inquisition, Conversion ...",https://brill.com/view/book/9789004422667/BP000008.xml
"IMF Working Papers Volume 2017 Issue 118: Disinflation, External ...",https://www.elibrary.imf.org/view/journals/001/2017/118/001.2017.issue-118-en.xml
"Disinflation, External Vulnerability, and Fiscal Intransigence in",https://www.elibrary.imf.org/view/journals/001/2017/118/article-A001-en.xml
The Work-Family Interface: An Introduction - SAGE Books,https://sk.sagepub.com/books/the-work-family-interface/n4.xml
"SENECA THE YOUNGER, Hercules | Loeb Classical Library",https://www.loebclassics.com/view/seneca_younger-hercules/2018/pb_LCL062.9.xml
intransigent | diccionari.cat,https://www.diccionari.cat/EC-GDLC-e00078661.xml
Macro Insights Weekly: Commodity price spike and energy transition,https://www.dbs.com.hk/treasures-private-client/aics/templatedata/article/generic/data/en/GR/032022/220314_insights_weekly.xml
Sartre Studies International Volume 3 Issue 1 (1997) - Berghahn ...,https://www.berghahnjournals.com/view/journals/sartre-studies/3/1/sartre-studies.3.issue-1.xml
article-pi.xml - American Journal of Tropical Medicine and Hygiene,https://www.ajtmh.org/pdfviewer/full/journals/tpmd/77/6_Suppl/article-pi.xml%3Fbg%3DGREY_COLOR_LIGHT_VARIANT%26mgs%3DPRIMARY_COLOR%26mge%3DPRIMART_COLOR_DARK_VARIANT
