Note On Podophthalmus Vigil (Fabricius) From India in - Brill,https://brill.com/view/journals/cr/3/4/article-p319_8.xml%3Flanguage%3Den
Observations On the Molt Cycle and Growth of the Crab ... - Brill,https://brill.com/view/journals/cr/11/2/article-p185_9.xml%3Flanguage%3Den
EIGHT Vigil: Holding Hands at the Eleventh Hour - De Gruyter,https://www.degruyter.com/california/downloadpdf/book/9780520949416/10.1525/9780520949416-011.xml
Gangs in America - SAGE Books,https://sk.sagepub.com/books/gangs-in-america-3e/n11.xml
FORM D - SEC.gov,https://www.sec.gov/Archives/edgar/data/1827087/000182708720000001/xslFormDX01/primary_doc.xml
statement of changes in beneficial ownership - SEC FORM 4,https://www.sec.gov/Archives/edgar/data/1827087/000089924322009052/xslF345X03/doc4.xml
Thank you for support of candlelight vigil - Shaw Local,https://www.saukvalley.com/articles/2012/07/25/r_tiltswoas1k1fudecuzjtw/index.xml
Keeping Vigil over the Patient: a grounded theory of nurse ...,https://journals.scholarsportal.info/details/03092402/v66i0003/552_kvotpagtonap.xml
The Vigil of Venus | Scholars Portal Journals,https://journals.scholarsportal.info/details/0009840x/v55i0001/153_tvov.xml
