"Endamoeba Histolytica and Other Intestinal Protozoa in 1,060 ...",https://www.ajtmh.org/view/journals/tpmd/s1-15/3/article-p331.xml
The Cultivation of Endamoeba Histolytica in a Defined Medium in,https://www.ajtmh.org/view/journals/tpmd/s1-30/3/article-p363.xml
Climate and Disease (V)* - AMS Journals,https://journals.ametsoc.org/downloadpdf/journals/bams/18/12/1520-0477-18_12_383.xml
Cerebral Amebiasis in - Journal of Neurosurgery,https://thejns.org/view/journals/j-neurosurg/21/8/article-p704.xml
CASE REPORTS AND TECHNICAL NOTES,https://thejns.org/previewpdf/journals/j-neurosurg/3/6/article-p538.xml
oldmedlinev1.xml,https://www.nlm.nih.gov/databases/dtd/oldmedlinev1.xml
THE GREATER VIRUNGA LANDSCAPE: SUMMARY.,https://minds.wisconsin.edu/bitstream/handle/1793/78863/norm_full_disp.xml%3Fsequence%3D1%26isAllowed%3Dy
Effect of body feed on the filtration of water through diatomite,https://www.ideals.illinois.edu/bitstream/handle/2142/4316/engineeringexperv00000i00425_tei.xml%3Fsequence%3D1
sitemap-paper-0005785.xml - Semantic Scholar,https://www.semanticscholar.org/sitemap-paper-0005785.xml
