The Physical Differences Between Faster and Slower Elite Male and ...,https://journals.humankinetics.com/abstract/journals/ijspp/17/6/article-p879.xml
Slower CKD Progression with RASIs versus CCBs in - Kidney News ...,https://www.kidneynews.org/abstract/journals/kidney-news/13/2/article-p5_4.xml
Slower CKD Progression with RASIs versus CCBs in - Kidney News ...,https://www.kidneynews.org/view/journals/kidney-news/13/2/article-p5_4.xml
Slowed + Reverb Generator,https://finitelanguages.com/116-map.xml
Salinity Slows Germination of Rough Bluegrass in - Journal of the ...,https://journals.ashs.org/hortsci/view/journals/hortsci/39/2/article-p394.xml
Differences between Faster versus Slower Components of ...,https://journals.ametsoc.org/view/journals/atsc/71/1/jas-d-13-03.1.xml
The slower the better: how sperm capacitation and acrosome ...,https://rep.bioscientifica.com/view/journals/rep/143/3/297.xml
Singapore: Slower growth ahead - DBS Bank,https://www.dbs.id/id/corporate/aics/templatedata/article/generic/data/en/GR/052022/220525_insights_singapore.xml
"[PDF] Slower EEG alpha generation, synchronization and ''flow'' - PeerJ",https://journals.scholarsportal.info/pdf/21678359/v5inone/nfp_seagsaianoms.xml
