420 Southwestern Historical Quarterly upon an occasion or two ...,https://www.jstor.org/stable/30238656
Thinking of That Than Which Nothing Greater can be Thought - jstor,https://www.jstor.org/stable/43248886
[PDF] Can Politics Be Thought ? - Duke University Press,https://www.dukeupress.edu/Assets/PubMaterials/978-1-4780-0166-9_601.pdf
What is to be thought? What is to be done? - SAGE Journals,https://journals.sagepub.com/doi/pdf/10.1177/1368431012440869
[PDF] What Is Poetry? - Palm Beach State College,https://www.palmbeachstate.edu/slc/Documents/whatispoetry.pdf
hdy196010.pdf - Nature,https://www.nature.com/articles/hdy196010.pdf%3Forigin%3Dppub
ciated algebraic group AT(@). The representations of dt t,https://www.ams.org/journals/bull/1947-53-09/S0002-9904-1947-08878-9/S0002-9904-1947-08878-9.pdf
Thinking of That Than Which Nothing Greater can be Thought,https://onlinelibrary.wiley.com/doi/pdf/10.1111/j.1741-2005.1991.tb03721.x
"rarity, hereditary telangiectasis should be thought the following case ...",https://www.nejm.org/doi/pdf/10.1056/NEJM194202262260904
problems in astronomy and biology - IOPscience,https://iopscience.iop.org/article/10.1086/127174/pdf
