[PDF] C-PHYCOCYANIN - Agilent,https://www.agilent.com/cs/library/datasheets/public/TDW%2520PB11%2520C-Phycocyanin%2520Technical%2520Data%2520Sheet%2520040518AF.pdf
Phycocyanins: Structure and Function - Springer Link,https://link.springer.com/content/pdf/10.1007/978-1-4684-2574-1_2.pdf
"R-Phycocyanin 11, a New Phycocyanin Occurring in Marine ...",https://www.jbc.org/article/S0021-9258(18)45573-1/pdf
[PDF] Phycocyanin: A Potential Drug for Cancer Treatment,https://www.jcancer.org/v08p3416.pdf
Differentiation of phycocyanins of Microcystis aeruginosa in two ...,https://academic.oup.com/plankt/article-pdf/17/10/1951/4329902/17-10-1951.pdf
[PDF] C-PHYCOCYANIN EXTRACTION FROM Spirulina platensis WET ...,https://www.scielo.br/j/bjce/a/BFvt5GhtQ8NFVDRMk9ZxG9L/%3Fformat%3Dpdf%26lang%3Den
Role of Allophycocyanin as Light-Harvesting Pigment in ... - PNAS,https://www.pnas.org/doi/pdf/10.1073/pnas.70.11.3130
Algal Phycocyanins Promote Growth of Human Cells in Culture - jstor,https://www.jstor.org/stable/4296345
Psychrophile C-Phycocyanin - jstor,https://www.jstor.org/stable/4265944
Production of the α and β Subunits of Spirulina Allophycocyanin and ...,https://journals.sagepub.com/doi/pdf/10.1177/1087057113520565
