A pound of cure | The Blade,https://www.toledoblade.com/Editorials/2017/09/17/A-pound-of-cure-opioid-addiction-epidemic/stories/feed/feed/index.rss
Egyptian pound slides further following floatation | The Blade,https://www.toledoblade.com/Economy/2016/11/06/Egyptian-pound-slides-further-following-floatation/stories/feed/index.rss
Dawg Pound Daily Podcast on the Cleveland Browns - Subscribe on ...,https://subscribeonandroid.com/www.omnycontent.com/d/playlist/33250137-f269-48a3-86dc-abcd016c932f/247e9891-e401-4a9a-aef2-ac290017647a/afc15464-16ea-4c43-904a-ac290017647b/podcast.rss
Subscribe by Email to Dawg Pound Daily Podcast on the Cleveland ...,https://www.subscribebyemail.com/www.omnycontent.com/d/playlist/33250137-f269-48a3-86dc-abcd016c932f/247e9891-e401-4a9a-aef2-ac290017647a/afc15464-16ea-4c43-904a-ac290017647b/podcast.rss
Pound for Pound Boxing Podcast - Global,https://audioboom.com/channels/4931835.rss
The Dawg Pound - Buzzsprout,https://feeds.buzzsprout.com/1894348.rss
Secrets of the 420 Pound Christian - Buzzsprout,https://feeds.buzzsprout.com/1938462.rss
