The Stereotype of the Sanctimonious Menniste Zusje (Mennonite ...,https://brill.com/view/book/9789004275027/B9789004275027-s010.xml
"The Reformed Polemic against Anabaptist Marriage, 1560– ...",https://brill.com/view/book/9789004275027/B9789004275027-s006.xml%3Flanguage%3Den
Familial arteriovenous malformations in - Journal of Neurosurgery,https://thejns.org/view/journals/j-neurosurg/62/4/article-p597.xml
Meningioma of the anterior part of the third ventricle in - Journal of ...,https://thejns.org/view/journals/j-neurosurg/50/2/article-p233.xml
sitemap.xml - FOX 2,https://fox2now.com/sitemap.xml%3Fyyyy%3D2013%26mm%3D05%26dd%3D15
IN VITRO PRODUCTION OF ANDROGENS BY A VIRILIZING ...,https://eje.bioscientifica.com/view/journals/eje/44/1/acta_44_1_003.xml
CONTRIBUTION TO THE STUDY OF THE SO-CALLED PURE ...,https://eje.bioscientifica.com/view/journals/eje/48/3/acta_48_3_017.xml
sitemap.xml - Wanderlust Tours,http://www.wanderlusttours.com/sitemap.xml
biorxiv BIORXIV bioRxiv bioRxiv Cold Spring Harbor Laboratory ...,https://www.biorxiv.org/content/biorxiv/early/2020/09/19/2020.09.18.304261.source.xml
ugabma_wsbn_wsbn38280 wsbn38280 wsbn ugabma yes WSB-TV ...,http://crdl.usg.edu/export/xml/ugabma/wsbn/crdl_ugabma_wsbn_wsbn38280.xml
