Geochemistry and background concentration of major ions in spring ...,https://journals.scholarsportal.info/details/03756742/v165icomplete/49_gabcomahaoth.xml
Mold challenge study in bottled natural mineral waters and spring ...,https://akjournals.com/view/journals/030/55/2/article-p145.xml
determination of uranium and thorium isotopes in mineral springwaters,https://akjournals.com/downloadpdf/journals/10967/212/4/article-p251.xml
Effect of deforestation on stream and spring water chemistry in ...,https://www.degruyter.com/view/j/ffp.2014.56.issue-3/ffp-2014-0015/ffp-2014-0015.xml
1. Introduction - Hindawi.com,http://downloads.hindawi.com/journals/geofluids/2019/7046320.xml
Reformed folklore? in: The spoken word - Manchester Open Hive,https://www.manchesteropenhive.com/view/9781526137876/9781526137876.00010.xml
Wine Country Swimming Fun at Morton's Warm Springs - Marin ...,http://feedproxy.google.com/~r/marinmommies/WDjR/~3/GFBCm46iCRs/rss.xml
Select Papyri. Poetry. Elegiac and Iambic Poems - Loeb Classical ...,https://www.loebclassics.com/view/select_papyri_poetry_elegiac_iambic_poems/1941/pb_LCL360.453.xml
"VARRO, On the Latin Language - Loeb Classical Library",https://www.loebclassics.com/view/varro-latin_language/1938/pb_LCL333.25.xml%3FreadMode%3Drecto
