Startup Accelerator - OVHcloud Startup Program,https://www.ovh.com.au/startup/kit.xml
SPIE Startup Challenge | Supporting Entrepreneurs in Photonics,http://spie.org/x88933.xml%3FwebSyncID%3Dce46e9e6-ec7a-49da-b6a0-cbad059329ad%26sessionGUID%3D883c9d90-2bc9-993c-ed26-8bead49a2853
Creating and Assigning a Startup Form,https://documentation.alphasoftware.com/pages/Guides/Desktop/Design/View/Form/Creating%2520and%2520Assigning%2520a%2520Startup%2520Form.xml
Startup Form Design Examples,https://documentation.alphasoftware.com/pages/Guides/Desktop/Design/View/Form/Startup%2520Form%2520Design%2520Examples.xml
Corporate-startup Co-creation for Increased Innovation and Societal ...,https://brill.com/view/journals/thj/7/2-3/article-p227_5.xml%3Flanguage%3Den
Corporate-startup Collaboration: Its Diffusion to and within the Firm in,https://brill.com/view/journals/thj/7/2-3/article-p250_6.xml%3Flanguage%3Den
Example startup,https://docs.deistercloud.com/content/Axional%2520business%2520products.5/B2B%2520and%2520B2C.100/POS.1/Example%2520startup.70.xml%3Fembedded%3Dtrue
sitemap.xml - Google Cloud,https://cloud.google.com/startup/sitemap.xml
ipfixcol/startup.xml at master - GitHub,https://github.com/CESNET/ipfixcol/blob/master/base/config/startup.xml
The RTI Startup Guide: Tools and Temple for School Implementation,https://sk.sagepub.com/books/the-rti-startup-guide-tools-and-templates-for-schoolwide-implementation/i436.xml
Death Stranding Crash on Startup - How to Fix - Sekolah Prima,https://www.sekolahprima.sch.id/death-stranding-game-crashing-on-startup-issue-solved.xml
