Chapter 4 An Excellently Weird and Romantic Story in - Brill,https://brill.com/view/book/9789004353107/BP000005.xml%3Flanguage%3Den
An Excellently Weird and Romantic Story in - Brill,https://brill.com/view/book/9789004353107/B9789004353107_005.xml%3Flanguage%3Den
"PHILO, Questions and Answers on Genesis | Loeb Classical Library",https://www.loebclassics.com/view/philo_judaeus-questions_answers_genesis/1953/pb_LCL380.151.xml
"PLATO, Meno | Loeb Classical Library",https://www.loebclassics.com/view/plato_philosopher-meno/1924/pb_LCL165.285.xml%3FreadMode%3Drecto
ENDOCRINE ORGANS AND UNDERNUTRITION. PARADOXICAL ...,https://eje.bioscientifica.com/abstract/journals/eje/25/2/acta_25_2_005.xml
Twentieth EUGOGO Anniversary Symposium in - European Thyroid ...,https://etj.bioscientifica.com/abstract/journals/etj/9/1_Suppl/ETJ510702.xml
Comments on McCauley and White in - IMF eLibrary - International ...,https://www.elibrary.imf.org/view/books/071/02042-9781557756640-en/ch021.xml
Identification of Plasma Metabolites Prognostic of Acute Kidney ...,https://journals.scholarsportal.info/details/15353893/v14i0007/2897_iopmpoacswcb.xml
Electronic structure of correlated topological insulator candidate ...,https://journals.scholarsportal.info/details/16741056/v29i0001/017304_esoctisbpaqo.xml
Quantitative Measurements of Path-Integrated Rain Rate by an ...,https://journals.ametsoc.org/view/journals/atot/2/3/1520-0426_1985_002_0285_qmopir_2_0_co_2.xml
search.xml - EgyptAir,https://www.egyptair.com/newpages/reports/2009-2010/cargo9-10/files/data/search.xml
Transtubular microsurgical approach to treating extraforaminal ...,https://thejns.org/focus/view/journals/neurosurg-focus/35/2/article-pE1.xml
Abstract - Exeley Inc,https://www.exeley.com/exeley/journals/sj_child_adolescent_psychiatry_psychology/7/i_current/xml/10.21307_sjcapp-2019-005.xml
Julia and Keaton's Wedding - Aisle Planner,https://juliaandkeaton.com/feeds/all.atom.xml
hessd Hydrology and Earth System Sciences Discussions hessdD ...,https://hess.copernicus.org/preprints/hess-2021-403/hess-2021-403.xml
Next-Generation Low-Cost Motion Capture Systems Can Provide ...,https://journals.humankinetics.com/view/journals/jab/29/1/article-p112.xml
PHOA3Pn0RDzrGQC04DDi6hpx...,http://english.cctv.com/2018/07/18/PHOA3Pn0RDzrGQC04DDi6hpx180718.xml
An investigation of the impact of the scholarship types on academic ...,https://akjournals.com/view/journals/063/9/4/article-p668.xml
Professorship (W3) in Practical Philosophy - Universität Bielefeld,https://www.uni-bielefeld.de/uni/karriere/professuren/wiss2938_englisch.xml
"The Chocolate Dandies Sissle, Noble performer Blake, Eubie ...",https://memory.loc.gov/diglib/ihas/loc.music.tda.3225/mods.xml
