Land-snow data assimilation including a moderately coupled ...,https://journals.ametsoc.org/view/journals/hydr/aop/JHM-D-21-0198.1/JHM-D-21-0198.1.xml
Note on the Scattering of Radiation by Moderately Nonspherical ...,https://journals.ametsoc.org/view/journals/atsc/39/8/1520-0469_1982_039_1886_notsor_2_0_co_2.xml
Ingestion of a Moderately High Caffeine Dose Before Exercise ...,https://journals.humankinetics.com/view/journals/ijsnem/25/1/article-p46.xml
L-Carnitine Supplementation Combined with Aerobic Training Does ...,https://journals.humankinetics.com/view/journals/ijsnem/10/2/article-p199.xml
Compatible solutes in new moderately halophilic isolates,https://femsle.oxfordjournals.org/content/122/1-2/165.source.xml
Citrulline and Arginine Are Moderately Heritable in Two Red-fleshed ...,https://journals.ashs.org/hortsci/view/journals/hortsci/54/2/article-p200.xml
Change in Chlorophyll Content Over Time Well-differentiated Salt ...,https://journals.ashs.org/hortsci/view/journals/hortsci/54/9/article-p1477.xml
Moderately Large Deviations and Expansions of ... - Project Euclid,https://projecteuclid.org/journals/annals-of-probability/volume-21/issue-3/Moderately-Large-Deviations-and-Expansions-of-Large-Deviations-for-Some/10.1214/aop/1176989137.xml
Chapter 1 China Enters the Final Stretch before Realizing a ... - Brill,https://brill.com/abstract/book/edcoll/9789004418608/BP000007.xml
