Fidelities: Elizabeth Costello and Diary of a Bad Year in: Acts of ...,https://brill.com/view/book/9789401206945/B9789401206945-s010.xml
Fidelities - Brill,https://brill.com/previewpdf/book/9789401206945/B9789401206945-s010.xml%3FpdfJsInlineViewToken%3D386500476%26inlineView%3Dtrue
The Fidelities of John Clare and Elizabeth Bishop | Scholars Portal ...,https://journals.scholarsportal.info/details/15239012/v23i0003/269_tfojcaeb.xml
Fidelity of the Observational/Reanalysis Datasets and Global ...,https://journals.ametsoc.org/view/journals/clim/32/1/jcli-d-18-0104.1.xml
Using Codec Control Messages in the RTP Audio-Visual ... - IETF,https://www.ietf.org/archive/id/draft-ietf-avtext-avpf-ccm-layered-00.xml
Advertising Entanglement Capabilities in Quantum Networks - IETF,https://www.ietf.org/archive/id/draft-kaws-qirg-advent-01.xml
International Journal for Uncertainty Quantification,https://www.dl.begellhouse.com/ixml/Volume10_Issue6-3673619972b2eee6.xml
ABSTRACT,https://www.rpsonline.com.sg/proceedings/9789811820168/html/222.xml
Untitled,https://academiccommons.columbia.edu/doi/10.7916/d8-0mt1-3p44.xml
