WAG 17-01-01: Time Limits - IDHS,https://www.dhs.state.il.us/page.aspx/FACT_1WhatIsVR.flv%3Fitem%3D16739
Japanese PM Abe Seen Headed for Extended Term Despite Flat ...,https://www.longbeachstar.com/news/257896731/oct04v56.flv
TROJ_INJECTR.FLV - Threat Encyclopedia - Trend Micro,https://www.trendmicro.com/vinfo/us/threat-encyclopedia/malware/troj_injectr.flv
How Do TUMS Work to Provide Heartburn Relief?,https://heartburn.com/video/HB_Causes.flv
File:COSPAS.flv - Engineering and Technology History Wiki,https://ethw.org/File:COSPAS.flv
"U.S. Faces Evolving, Emboldened Adversaries in Cyberspace ...",https://www.northkoreatimes.com/news/256993740/oct04v56.flv
"Gazprom Clinches Deal In Lengthy EU Antitrust Case, Avoids Fine",https://www.germanysun.com/news/257341421/oct04v56.flv
Login - SUNY Broome,http://www.goholycross.com/video/men-s_hockey/Pearl_1-22.flv%3FDB_OEM_ID%3D33100
Turbulence at Treasury: A short history - News24,https://www.johannesburglife.com/news/258095885/oct04v56.flv
The Hangout: Mo Pete on the Eastern Conference | NBA.com,https://www.nba.com/raptors/drop-box-nba-web-140912-hangoutseg3.flv
Open Gym: Dwane Casey In Africa - NBA.com,https://www.nba.com/raptors/drop-box-nba-web-140807-caseydiary.flv
Raptors Highlights: Raptors vs. Kings - NBA.com,https://www.nba.com/raptors/drop-box-nba-web-141005-highlights.flv
Trump Trade Strategy Savaged on Capitol Hill,https://www.pekingpress.com/news/257527615/oct04v40.flv
OPPLE launches JBL ceiling light - where light meets sound,https://www.malaysiasun.com/news/258478767/feb24v21.flv
hapaME首页,http://www.hapame.com/uploads/flv/anfaxianchang3/1.flv
权威媒体衢州门户 - 衢州新闻网,https://www.qz828.com/att_flv/0/10/76/31/10763189_107971.flv
Alist,https://alist.ixacg.com/aliyun/Xmind8%25E6%2595%2599%25E7%25A8%258B/%25E3%2580%258E%25E8%2584%2591%25E5%2591%2586%25E7%2593%259C%25E6%2580%259D%25E7%25BB%25B4%25E5%25AF%25BC%25E5%259B%25BE%25E3%2580%258F%2520xmind%25E4%25BD%25BF%25E7%2594%25A8%25E6%2595%2599%25E7%25A8%258B%25208%25E9%259B%2586/%25E3%2580%258E%25E8%2584%2591%25E5%2591%2586%25E7%2593%259C%25E6%2580%259D%25E7%25BB%25B4%25E5%25AF%25BC%25E5%259B%25BE%25E3%2580%258F%2520xmind%25E4%25BD%25BF%25E7%2594%25A8%25E6%2595%2599%25E7%25A8%258B%2520%5B8%2520-%25208%5D.flv
Programs - > The Israel Center for Social & Economic Progress,http://www.icsep.org.il/MiltonFriedmanEng.flv
Rabada gives Proteas a strong start in PE | Sport - News24,https://www.chinanationalnews.com/news/256696479/oct04v40.flv
BskyB to air YRF movies in Britain and Ireland,https://www.irishsun.com/news/232214781/oct04v56.flv
