"Enzymatic Browning, Polyphenol Oxidase Activity, and Polyphenols ...",https://journals.ashs.org/hortsci/view/journals/hortsci/45/8/article-p1150.xml
"[PDF] Enzymatic Browning, Polyphenol Oxidase Activity, and Polyphenols ...",https://journals.ashs.org/hortsci/downloadpdf/journals/hortsci/45/8/article-p1150.xml
"[PDF] Dietary Polyphenol Intake Is Associated with Biological Aging, a ...",https://journals.scholarsportal.info/pdf/20726643/v13i0005/nfp_dpiiawcfftms.xml
[PDF] Understanding the Functional Activity of Polyphenols Using Omics ...,https://journals.scholarsportal.info/pdf/20726643/v13i0011/nfp_utfaopuoa.xml
Identification and quantification of polyphenols from Cassia ... - Brill,https://brill.com/view/journals/ijps/68/1-2/article-p133_133.xml
[PDF] CHANGES OF POLYPHENOL COMPOUND CONCENTRATIONS IN ...,https://sciendo.com/abstract/journals/prolas/71/6/article-p492.xml
Polyphenol content and antioxidant capacity of the Tarumá (Vitex ...,https://jefc.scholasticahq.com/article/31084.xml
Altered element homeostasis and transmethylation ability in short ...,https://akjournals.com/view/journals/066/aop/article-10.1556-066.2022.00053/article-10.1556-066.2022.00053.xml
Effect of Supplementation With Ecklonia cava Polyphenol on ...,https://journals.humankinetics.com/view/journals/ijsnem/20/1/article-p72.xml
