A SWORDSMAN'S PERSPECTIVE - Brill,https://brill.com/downloadpdf/book/9789004213913/B9789004213913_s006.xml
<emph>The Religious Instruction of the Negroes. In the United ...,https://docsouth.unc.edu/church/jones/jones.xml
https://www.tvguide.com/movies/village-of-the-giants/2030042259 ...,https://www.tvguide.com/movies/1417.xml
All's Well That Ends Well - The Folger SHAKESPEARE,https://shakespeare.folger.edu/downloads/teisimple/alls-well-that-ends-well_TEIsimple_FolgerShakespeare.xml
The Constitutional rights of the women of the United States - Loc,https://tile.loc.gov/storage-services/service/rbc/rbnawsa/n8333/n8333.xml
Memorial addresses in honor of Governor Alexander Ramsey ... - Loc,https://tile.loc.gov/storage-services/service/gdc/lhbum/0866f/0866f_0290_0339.xml
government.xml - Christian Classics Ethereal Library,https://ccel.org/ccel/a/allestree/government.xml
"﻿Empire and Enterprise﻿: Money, power and the Adventurers for Irish ...",https://www.manchesterhive.com/downloadpdf/9781526132000/9781526132000.00008.xml
Duell-ease A worde with. valiant spiritts shewing the abuse of duells ...,https://ota.bodleian.ox.ac.uk/repository/xmlui/bitstream/handle/20.500.12024/A00503/A00503.xml%3Fsequence%3D6%26isAllowed%3Dy
All's Well That Ends Well - Ibiblio,https://www.ibiblio.org/xml/examples/shakespeare/all_well.xml
