Les b  n  fices de la densification urbaine - SocioRePEc,https://sociorepec.org/publication.xml%3Fh%3Drepec:cai:rcedec:rce_028_0170%26l%3Den
Introduction in: Private International Law - Brill,https://brill.com/view/book/9789004503915/BP000002.xml
3 The Blindfold in - Brill,https://brill.com/view/book/9789004368675/B9789004368675_004.xml
from headquarters - AMS Journals,https://journals.ametsoc.org/downloadpdf/journals/bams/77/5/1520-0477-77_5_1020.xml
"1305 In Bob Glahn's (2003) comment, he discusses my recent paper ...",https://journals.ametsoc.org/downloadpdf/journals/wefo/18/6/1520-0434_2003_018_1305_r_2_0_co_2.xml
[PDF] Title XIX - Journal of the American Podiatric Medical Association,https://japmaonline.org/downloadpdf/journals/apms/93/4/87507315-93-4-347.xml
was the recognition in certain gonadotrophin preparations of ...,https://eje.bioscientifica.com/downloadpdf/journals/eje/67/1/acta_67_1_005.xml
Here's how sampling wastes on Guam make for ... - Govinfo.gov,https://www.govinfo.gov/content/pkg/CZIC-td796-5-h47/xml/CZIC-td796-5-h47.xml
Chile: Recent Economic Developments in - IMF eLibrary,https://www.elibrary.imf.org/view/journals/002/1995/102/article-A003-en.xml
