Victorian Literature - Sentimentality - Oxford Bibliographies,https://www.oxfordbibliographies.com/view/document/obo-9780199799558/obo-9780199799558-0063.xml
Sentimentalism and Domestic Fiction - American Literature,https://www.oxfordbibliographies.com/view/document/obo-9780199827251/obo-9780199827251-0015.xml
Marilynne Robinson and Nineteenth-Century Prodigal Son Narratives,https://brill.com/previewpdf/book/edcoll/9789004302235/B9789004302235-s007.xml
Marilynne Robinson and Nineteenth-Century Prodigal Son ... - Brill,https://brill.com/view/book/edcoll/9789004302235/B9789004302235-s007.xml
Untitled,https://sk.sagepub.com/navigator/popular-culture/n59.xml
Object attachment: Humanness increases sentimental and ...,https://akjournals.com/view/journals/2006/7/4/article-p1132.xml
The Concept of Sentimental Boyhood in - Berghahn Journals,https://www.berghahnjournals.com/view/journals/boyhood-studies/11/1/bhs110103.xml
"A Dog's Life: Anthropomorphism, Sentimentality, and Ideology in ...",https://journals.scholarsportal.info/details/00433462/v31i0002/139_adlasaiijm.xml
"""The Spirit of a Man and the Limbs of a Cripple"": Sentimentality ...",https://journals.scholarsportal.info/details/08481512/v35i0002/117_soamatcythor.xml
A sentimental education in: Karel Reisz - manchester hive,https://www.manchesterhive.com/view/9781526141583/9781526141583.00015.xml
PAW's Annual Reader-Photo Contest | Princeton Alumni Weekly,https://dc-107957-786384926.us-east-1.elb.amazonaws.com/issues/2014/07/09/pages/3355/index.xml
"Aboriginal brass bands, tourism and sentimental colonialism in",https://www.elgaronline.com/abstract/edcoll/9781789908183/9781789908183.00011.xml
Emotions and Society Volume 1 Issue 2 (2019),https://bristoluniversitypressdigital.com/view/journals/emsoc/1/2/emsoc.1.issue-2.xml
SWAFN: Sentimental Words Aware Fusion Network for Multimodal ...,https://aclanthology.org/2020.coling-main.93.xml
The Sentimentality of William Tavener,https://cdrhmedia.unl.edu/data/cather/source/tei/cat.ss039.xml
Retrospective Scences from a Sentimental World - 9784756251497,https://www.exhibitionsinternational.be/documents/catalog/9784756251497.xml%3Flang%3Dfr%26open%3DFILTER%255CJAAR%255C2019
sentimental | diccionari.cat,https://www.enciclopedia.cat/ec-gdlc-e00123372.xml
https://www.sportstalkphilly.com/2012/07/a-bullpen...,https://www.sportstalkphilly.com/2012/07/a-bullpen-not-ridiculous-sentimentality-will-help-the-phillies-win-games/comments/atom.xml
653569.xml - Biblioteka Nauki,https://bibliotekanauki.pl/articles/653569.xml
Letters to the Editor in - AVMA Journals,https://avmajournals.avma.org/abstract/journals/javma/240/6/javma.240.6.659.xml
Cool enough for Lou Reed? in: Across the margins,https://www.manchesteropenhive.com/view/9781526137227/9781526137227.00015.xml
Forcing Herbaceous Perennials to Flower after Storage Outdoors ...,https://journals.ashs.org/horttech/view/journals/horttech/5/3/article-p239.xml
"""Criminal Justice"" During the Long Eighteenth Century",https://www.huntington.org/xml/rss/criminal.xml
XML,https://le.utah.gov/xcode/Title78B/Chapter6/C78B-6-S1277_2022050420220504.xml
Mazatlan ............. Zacatecas ............ .- c1 .... .... .... .... - AMS Journals,https://journals.ametsoc.org/downloadpdf/journals/mwre/26/10/1520-0493_1898_26_458b_oapaph_2_0_co_2.xml
arlington-fly-in-b-17g-sentimental-journey-nose-hatch ... - 360Cities,https://www.360cities.net/mobile_embed_iframe/arlington-fly-in-b-17g-sentimental-journey-nose-hatch-view-arlington-wa.xml
Ne Plus Ultra (Going as Far as You can Go),https://www.oxfordwesternmusic.com/view/Volume5/actrade-9780195384857-div1-002003.xml
Civil War-Era Newspapers - Valley of the Shadow,https://valley.lib.virginia.edu/news/vr1863/pa.fr.vr.1863.05.29.xml
An Inventory of His Jack White Orchestra Sound and Visual Collection,https://www.mnhs.org/library/findaids/sv000282.xml
Kapitel 5 Laurence Sternes A Sentimental Journey auf dem Index oder,https://www.schoeningh.de/view/book/9783657704743/BP000011.xml
