The Ontogeny of Impaling Behaviour in the Loggerhead Shrike ... - Brill,https://brill.com/view/journals/beh/42/3-4/article-p232_3.xml%3Flanguage%3Den
The Transcendent and Man in Andrei Belyi's Petersburg - Brill,https://brill.com/downloadpdf/journals/css/16/1/article-pvii_1.xml
Table-fixed retractor system for noncranial surgery in,https://thejns.org/view/journals/j-neurosurg/64/5/article-p819.xml
Table-fixed retractor system for noncranial surgery in: Journal of ...,https://thejns.org/abstract/journals/j-neurosurg/64/5/article-p819.xml%3Frskey%3DFKPsjk%26result%3D356
Mediastinal Abscess Extension Status Post Oropharyngeal Trauma,http://mirc.luriechildrens.org/storage/ss12/docs/20171018143932875/MIRCdocument.xml
Untitled,https://www.govinfo.gov/content/pkg/BILLS-111hr5566eah/xml/BILLS-111hr5566eah.xml
sitemap_products_1.xml - True Sound Control,https://www.truesoundcontrol.com/sitemap_products_1.xml%3Ffrom%3D463467081%26to%3D5613613575
[PDF] violence and the Great Turkish War in the work of Romeyn de Hooghe,https://www.manchesteropenhive.com/downloadpdf/9781526140616/9781526140616.00019.xml
Oral injuries in children presenting to a Japanese pediatric ...,https://journals.scholarsportal.info/details/13288067/v59i0007/826_oiicptajper.xml
