Who Invented It? - jstor,https://www.jstor.org/stable/7881
Invented versus Traditional Spelling in First Graders' Writings - jstor,https://www.jstor.org/stable/40171140
[PDF] Top 20 Ancient Chinese Inventions - USC U.S.-China Institute,https://china.usc.edu/sites/default/files/forums/Chinese%2520Inventions.pdf
You Could Have Invented Spectral Sequences,https://www.ams.org/notices/200601/fea-chow.pdf
Invented and Manufactured History,https://muse.jhu.edu/article/521362/pdf
"[PDF] Susan Hibbard invented the feather duster in 1876, but there was a ...",http://www.sbcounty.gov/museum/media/press-kit/gadgets/gadgets-media-kit-fun-facts.pdf
[PDF] Invented spelling and its value in kindergarten - UNI ScholarWorks,https://scholarworks.uni.edu/cgi/viewcontent.cgi%3Farticle%3D1205%26context%3Dgrp
[PDF] Activity: Who Invented the Cotton Gin?,http://historyexplorer.si.edu/sites/default/files/Content/Who%2520Invented%2520the%2520Cotton%2520Gin.pdf
WHO INVENTED THE COMPASS?,https://www.tandfonline.com/doi/pdf/10.1080/00253359.1937.10657223
Understanding Creativity Judgments of Invented Alien Creatures ...,https://onlinelibrary.wiley.com/doi/pdf/10.1002/j.2162-6057.2007.tb01072.x
