US Lobsters Are a Target of China's Threatened Tariffs,https://www.manufacturingmirror.com/news/257497244/oct04v56.flv
Policy Statement: Nondiscrimination and Affirmative Action - IDHS,https://www.dhs.state.il.us/page.aspx/FACT_Intro.flv%3Fitem%3D40749
Kentucky Governor Downplays Effect of EU Tariffs on Bourbon,https://www.chinanationalnews.com/news/257540236/oct04v40.flv
Media Watchdogs Condemn 12-Year Sentence For Tajik Journalist,https://www.irishsun.com/news/257680088/oct04v40.flv
"Fed's Powell: Years of Strong Jobs, Low Inflation Still Ahead",https://www.illinoisintelligencer.com/news/257686848/oct04v56.flv
"U.S., EU allies retaliate with military action on Syria - Nigeria Sun",https://www.northkoreatimes.com/news/257013776/oct04v40.flv
Trump Trade Strategy Savaged on Capitol Hill,https://www.pekingpress.com/news/257527615/oct04v40.flv
"Automakers Warn US Tariffs Will Cost Jobs, Hike Prices",https://www.germanysun.com/news/257573831/oct04v56.flv
Russia Dumped U.S. Bond Holdings This Year Amid U.S. Sanctions ...,https://www.bangladeshsun.com/news/257703785/oct04v40.flv
"Trump, U.S. Allies Exchange Barbs Amid Growing Fears Of Trade War",https://www.southamericatimes.com/news/257397491/oct04v56.flv
At Least 74 People Killed In Forest Fires Near Athens - Radio Free ...,https://www.europesun.com/news/257726845/oct04v40.flv
Monitor: Israel strike Hezbollah arms depots in Damascus,https://www.europesun.com/news/257557204/oct04v56.flv
5 infamous India-Australia controversies | Sport - News24,https://www.australianherald.com/news/251873425/oct04v56.flv
