[PDF] The non-arbitrary aspect of language: The iconicity of onomatopoeic ...,http://www.linguistics.fi/julkaisut/SKY2009/Rungrojsuwan_NETTI.pdf
Isolation and Non-Arbitrary Division: Frege's Two Criteria for Counting,https://www.jstor.org/stable/20117670
[PDF] Finding Non-Arbitrary Form-Meaning Systematicity Using String ...,https://pages.ucsd.edu/~bkbergen/papers/smlkr_final.pdf
Locke and the Non-Arbitrary - SAGE Journals,https://journals.sagepub.com/doi/pdf/10.1177/1474885103002003002
The inhibition of aggression under nonarbitrary frustration,https://onlinelibrary.wiley.com/doi/pdf/10.1111/j.1467-6494.1960.tb01605.x
[PDF] Iconicity and indexicality in real-world learning and processing - OSF,https://osf.io/ptjwe/download
NONARBITRARY TREATMENT AND THE LIMITS OF PROCEDURE,https://www.degruyter.com/document/doi/10.18574/nyu/9780814728437.003.0003/pdf
Psychopathy is a nonarbitrary class - Cambridge University Press,https://www.cambridge.org/core/services/aop-cambridge-core/content/view/0637AC6C5DFF4D39750C62E7E8E193B1/S0140525X00039935a.pdf/psychopathy-is-a-nonarbitrary-class.pdf
[PDF] The Specificity of Non-Arbitrary Sound-to-Meaning ...,https://escholarship.org/content/qt79n6s3v4/qt79n6s3v4_noSplash_c3f14d44da45fe11303ee26f6d756b5e.pdf%3Ft%3Dop2lp7
Toward a Multidimensional Framework of Nonarbitrary Classification,https://www.journals.uchicago.edu/doi/pdf/10.1086/694835
