Dog Days of Summer - Introducing Czech Shepherds - MZV,https://www.mzv.cz/washington/en/culture_events/culture/dog_days_of_summer_introducing_czech.rss
The Shepherd's Tent - Podcasts,https://podcasts.subsplash.com/qdfktcr/podcast.rss
Christ Our Shepherd Church Sermons,https://cosc.sermons.io/sermons/audio_feed.rss
Shepherd of the Desert Podcast - Buzzsprout,https://feeds.buzzsprout.com/42396.rss
"Local shepherd takes best of breed, group | The Blade",https://www.toledoblade.com/local/2016/02/16/Local-shepherd-takes-best-of-breed-group/stories/feed/feed/index.rss
Renovations revealed at Shepherd of the Valley Lutheran Church ...,https://www.toledoblade.com/Religion/2011/10/21/Renovations-revealed-at-Shepherd-of-the-Valley-Lutheran-Church/stories/feed/feed/index.rss
Christ Church Surbiton Hill - CrossPreach,https://www.crosspreach.com/sermons/listall/16.rss
Feed - Tenth Church,https://www.tenth.ca/podcasts/media.rss
Good Shepherd LCMS Boise - The Podcast Discovery Service,https://pod.casts.io/podcasts/good-shepherd-lcms-boise.rss
