THEOPHANY AND ANTHROPOMORPHISM IN THE OLD ... - Brill,https://brill.com/view/book/edcoll/9789004275300/B9789004275300-s004.xml
Scholarly Frameworks for Reading Irenaeus: The Question of ... - Brill,https://brill.com/view/journals/vc/72/3/article-p255_2.xml%3Flanguage%3Den
RECONCILING AUGUSTINIAN AND PALAMITE AESTHETICS 1,https://journals.scholarsportal.info/details/02667177/v26i0001/76_tairaapa1.xml
A Catechesis on the Mysteries of the Incarnation and the Holy Trinity ...,https://journals.scholarsportal.info/details/15439925/v16i0002/154_htacothtbrfs.xml
INVITING GODS: CASES OF THEOPHANIES IN THE PGM ...,https://akjournals.com/downloadpdf/journals/068/56/1/article-p23.xml
St. Nicholas of Myra Sunday Homilies,http://orlandobyzantine.com/podcasts/homilies.xml
"From Villainous Letch and Sinful Outcast, to “Especially Beloved of ...",https://www.berghahnjournals.com/abstract/journals/historical-reflections/42/1/hrrh420105.xml
"Walters Ms. W.545, Hymnal",https://www.thedigitalwalters.org/Data/WaltersManuscripts/ManuscriptDescriptions/W545_tei.xml
"PHILO, On the Embassy to Gaius. General Indexes - Loeb Classical ...",https://www.loebclassics.com/view/LCL379/1962/pb_LCL379.189.xml
