"Thesis/Dissertation: Milan Mužík, učo 251547: Data retention",https://is.muni.cz/th/251547/fi_b/gen_random.7z%3Finfo%3D1%3Blang%3Den%3Bkeywords%3Dinfo
Návody - Bet on Soldier: Black-out Saigon - Abecedahier.sk,http://www.abecedaher.sk/index.php/db_data/06/0000006888/db_data/12/0000012335/trainer_8548_DS2_unlocker.7z%3Fpage%3Dnavod%26page2%3Dzobrazit%26id_hry%3D0000010244
Návody - Red Faction - Abecedahier.sk,http://www.abecedaher.sk/index.php/db_data/06/0000006888/db_data/12/0000012335/trainer_8548_DS2_unlocker.7z%3Fpage%3Dnavod%26page2%3Dzobrazit%26id_hry%3D0000002730
ozdobné úchytky na nábytek - Levný nábytek,http://www.ktband.cz/backupktband.7z
ubytování belpasso itálie rezervace bez poplatků,https://www.livetoride.cz/localhost-db.7z
ubytování trinidad a tobago dovolená trinidad a tobago,https://www.livetoride.cz/database/livetoridedb.7z
