RENAISSANCE HIEROGLYPHIC STUDIES - Brill,https://brill.com/downloadpdf/book/edcoll/9789047400158/B9789047400158-s016.xml
From hieroglyphs to universal characters: Pictography in the early ...,https://brill.com/view/journals/nkjo/61/1/article-p238_10.xml%3Flanguage%3Den
Egyptian Hieroglyphs for Complete Beginners - 9780500051726,https://www.exhibitionsinternational.be/documents/catalog/9780500051726.xml%3Flang%3Den%26
First appearance and sense of the term “spinal column” in ancient ...,https://thejns.org/spine/view/journals/j-neurosurg-spine/97/1/article-p152.xml
"Isis, Osiris, Thoth, and the origin of the djed cross in: Neurosurgical ...",https://thejns.org/focus/view/journals/neurosurg-focus/23/1/foc-07_07_e6.xml
Unlocking The Mayan Script With Unicode - dh2016,https://dh2016.adho.org/abstracts/static/data/245.xml
"Susan Brind Morrow: An Inventory of Her Papers, 1940-2017 and ...",https://txarchives.org/ttusw/finding_aids/60214.xml
Common hieroglyphs and abbreviations : Clinical Negligence: A ...,https://www.bloomsburyprofessionalonline.com/view/lewis_buchan/CNAPG-0031305.xml
"Description of Free Library of Philadelphia, Lewis T512 ... - OPenn",https://openn.library.upenn.edu/Data/0023/lewis_t512/data/lewis_t512_TEI.xml
