Capitol Crude: The US Oil Policy Podcast - S&P Global,https://www.spglobal.com/commodityinsights/plattscontent/en/market-insights/podcasts/feed/platts-crude-podcasts.xml
U.S. Crude Oil Pipelines,https://www.arcgis.com/sharing/rest/content/items/ae809a7e79354d31ab37da8df6352f84/info/metadata/metadata.xml%3Fformat%3Ddefault%26output%3Dhtml
BILLS-117hr7343ih.xml - Govinfo.gov,https://www.govinfo.gov/bulkdata/BILLS/117/2/hr/BILLS-117hr7343ih.xml
Crude Oil Washing Operations and Equipment Manual. - GovInfo,https://www.govinfo.gov/content/pkg/CFR-2006-title33-vol2/xml/CFR-2006-title33-vol2-sec157-138.xml
Oil - DBS Bank,https://www.dbs.com.sg/corporate/aics/templatedata/article/generic/data/en/industry/energy/oil.xml
Content XML - Subpart A - eCFR,https://www.ecfr.gov/api/versioner/v1/full/2022-04-07/title-10.xml%3Fpart%3D221
FURTHER STUDIES ON A THYROID STIMULATING FACTOR IN ...,https://eje.bioscientifica.com/view/journals/eje/55/4/acta_55_4_005.xml
Analyzing the Risk-return Relationship in Crude Oil Futures Market ...,https://journals.scholarsportal.info/details/18766102/v104icomplete/462_atrricofmuhd.xml
A CRUDE HYGROMETER in: Monthly Weather Review Volume 26 ...,https://journals.ametsoc.org/view/journals/mwre/26/12/1520-0493_1898_26_567d_ach_2_0_co_2.xml
Postcolonial Consciousness in an Era of Global Capitalism in - Brill,https://brill.com/abstract/book/9789004437456/BP000004.xml
antibodies in high titre to purified human thyroglobulin and to crude ...,https://joe.bioscientifica.com/downloadpdf/journals/joe/20/2/joe_20_2_001.xml
catalytic effects of metallic additives on the combustion properties of ...,https://akjournals.com/downloadpdf/journals/10973/64/3/article-p1311.xml
INFLUENCE OF RESERVOIR ROCK COMPOSITION ON THE ...,https://akjournals.com/downloadpdf/journals/10973/97/2/article-p397.xml
Transitory and Permanent Shocks in the Global Market for Crude Oil in,https://www.elibrary.imf.org/abstract/journals/001/2020/047/article-A001-en.xml
Recent Dynamics of Crude Oil Prices (2006) - IMF eLibrary,https://www.elibrary.imf.org/view/journals/001/2006/299/001.2006.issue-299-en.xml
The crazy curse and crude domination in - Berghahn Journals,https://www.berghahnjournals.com/view/journals/focaal/2008/52/focaal520101.xml
BILLS-117hr7688eh.xml - Congress.gov,https://www.congress.gov/117/bills/hr7688/BILLS-117hr7688eh.xml
Effect of crude fiber and total dietary fiber on the calculated nitrogen ...,https://avmajournals.avma.org/view/journals/ajvr/82/10/ajvr.82.10.787.xml
Crude oil mix - GaBi Software,http://gabi-documentation-2022.gabi-software.com/xml-data/processes/aff23711-2b95-4a7e-b9ee-ebbcb3d682ea.xml
BNP CSACS SWAP 14 - SEC.gov,https://www.sec.gov/Archives/edgar/data/1355064/000175272420247009/primary_doc.xml
