Supertransferred hyperfine interactions in layer LaSrGa0.995Cu0 ...,https://journals.scholarsportal.info/details/09214526/v325inone/246_shiill.xml
Eddy Transport of Thickness and Momentum in Layer and Level ...,https://journals.ametsoc.org/view/journals/phoc/27/6/1520-0485_1997_027_1153_etotam_2.0.co_2.xml
Radiative/Turbulent Transfer Interactions in Layer Clouds in,https://journals.ametsoc.org/view/journals/atsc/44/9/1520-0469_1987_044_1287_rtiilc_2_0_co_2.xml
Combined global/linear inversion of well-logging data in layer-wise ...,https://akjournals.com/view/journals/074/40/2/article-p203.xml
Simultaneous detection of vaccinal and field infectious bursal ...,https://akjournals.com/view/journals/004/62/2/article-p264.xml
Signaling of Modem-On-Hold status in Layer 2 Tunneling Protocol ...,https://pike.lysator.liu.se/docs/ietf/rfc/35/rfc3573.xml
"Provisioning, Auto-Discovery, and Signaling in Layer 2 Virtual ...",https://pike.lysator.liu.se/docs/ietf/rfc/60/rfc6074.xml
Using Application Identification in Services Function Chaining ... - IETF,https://www.ietf.org/archive/id/draft-penno-sfc-appid-04.xml
Abstract - bioRxiv,https://www.biorxiv.org/content/biorxiv/early/2022/06/12/2022.06.08.495376.source.xml
A two-dimensional random growth model in layer-by-layer epitaxy ...,https://journals.scholarsportal.info/details/00396028/v139i2-3/360_atrgmile.xml
BLM Utah Interactive Map - ArcGIS Online,https://www.arcgis.com/sharing/rest/content/items/6be0174d44f04f1c853197cadcfa89f0/info/metadata/metadata.xml%3Fformat%3Ddefault%26output%3Dhtml
cp-2021-176.xml - Copernicus.org,https://cp.copernicus.org/preprints/cp-2021-176/cp-2021-176.xml
