Systematizing Democratic Systems Approaches in,https://www.berghahnjournals.com/view/journals/democratic-theory/6/2/dt060205.xml
"20 Faunal Collecting, Inventorying and Systematizing in the Marine ...",https://brill.com/abstract/book/edcoll/9789004323841/B9789004323841_021.xml
Systematizing Systemlessness«: Novalis's Reflections on the ... - Brill,https://brill.com/previewpdf/book/edcoll/9789042030121/B9789042030121-s020.xml%3FpdfJsInlineViewToken%3D902516818%26inlineView%3Dtrue
IMF Working Papers Volume 2022 Issue 110: Systematizing ...,https://0-www-elibrary-imf-org.library.svsu.edu/view/journals/001/2022/110/001.2022.issue-110-en.xml
Systematizing Trial and Error Using Spreadsheets in - NCTM,https://pubs.nctm.org/abstract/journals/at/39/7/article-p8.xml
The Arithmetic Teacher Volume 39 Issue 7 (1992) - NCTM,https://pubs.nctm.org/view/journals/at/39/7/at.39.issue-7.xml
Metallicity of Chemical Bonds and Its Role in Their Systematization ...,https://journals.scholarsportal.info/details/00360244/v94i0006/1153_mocbaitsapos.xml
Certificate Transparency with Privacy - Sciendo,https://www.degruyter.com/view/j/popets.2017.2017.issue-4/popets-2017-0052/popets-2017-0052.xml%3Fformat%3DINT
Systematization of Experiences - SAGE Research Methods,https://methods.sagepub.com/book/the-sage-handbook-of-action-research-3e/i930.xml
