[PDF] DOPA Fact Sheet March 2018.pdf,https://dhcd.dc.gov/sites/default/files/dc/sites/dhcd/publication/attachments/DOPA%2520Fact%2520Sheet%2520March%25202018.pdf
[PDF] A Novel Method for Creating a Synthetic L-DOPA Proteome and In ...,https://www.mdpi.com/2227-7382/9/2/24/pdf
Effect of l-dopa on sympathetic nerve activity and blood pressure in ...,https://www.ahajournals.org/doi/pdf/10.1161/01.RES.43.1.24
Is DOPA a neurotransmitter?,https://www.cell.com/trends/pharmacological-sciences/pdf/S0165-6147(02)02013-8.pdf
Effects of L-Dopa on Norepinephrine Metabolism in the Brain - PNAS,https://www.pnas.org/doi/pdf/10.1073/pnas.68.3.662
[PDF] pnas00084-0134.pdf - NCBI,http://www.ncbi.nlm.nih.gov/pmc/articles/PMC389365/pdf/pnas00084-0134.pdf
[PDF] L-Dopa and the negative symptoms of Parkinsonism - NCBI,https://www.ncbi.nlm.nih.gov/pmc/articles/PMC496559/pdf/jnnpsyc00227-0094.pdf
Long-term administration of L-DOPA does not damage ... - Neurology,https://n.neurology.org/content/31/9/1194.full.pdf
Genetic Inactivation of Dopamine D1 but Not D2 Receptors Inhibits L ...,http://www.biologicalpsychiatryjournal.com/article/S0006-3223(09)00509-5/pdf
Therapeutic doses of L-dopa reverse hypersensitivity of ...,https://academic.oup.com/brain/article-pdf/127/7/1661/739813/awh190.pdf
Dopaâ•'responsive dystonia: [<sup>18</sup>F]dopa positron ...,https://onlinelibrary.wiley.com/doi/pdf/10.1002/ana.410300106
Activation of Dopamine Cell Firing by Repeated L-DOPA ...,https://www.jneurosci.org/content/jneuro/15/9/6157.full.pdf
"The Effect of L-Dopa on Plasma Growth Hormone, Insulin, and ...",https://academic.oup.com/jcem/article-pdf/34/1/99/10519775/jcem0099.pdf
Effect of Levodopa (L-Dopa) on Serum Growth Hormone in Children ...,https://www.nature.com/articles/pr197310.pdf%3Forigin%3Dppub
Unleashing the shape of l-DOPA at last - RSC Publishing,https://pubs.rsc.org/en/content/articlepdf/2022/cp/d1cp05066d
L-Dopa and Schizophrenia - SAGE Journals,http://journals.sagepub.com/doi/pdf/10.1177/070674377602100105
Failure of vitamin B6 to reverse the L-dopa effect,https://jnnp.bmj.com/content/jnnp/34/6/682.full.pdf
[PDF] Delegation of Parental Authority (DOPA) - LawHelpMN,https://www.lawhelpmn.org/sites/default/files/2018-11/F-06%2520DOPA.pdf
Intense oxidative DNA damage promoted by L-DOPA and its ...,https://www.sciencedirect.com/science/article/pii/0014579394010560/pdf%3Fmd5%3D0397bc21fb0f841d5b9410eaeb5b7c85%26pid%3D1-s2.0-0014579394010560-main.pdf
The Use of L-dopa and Carbidopa in Metastatic Malignant Melanoma,https://www.sciencedirect.com/science/article/pii/S0022202X9190277W/pdf%3Fmd5%3Da087129680a41e12fdca645899dcb98b%26pid%3D1-s2.0-S0022202X9190277W-main.pdf
