"Eye Mefe.flv | Moses Ok Lyrics, Song Meanings, Videos ... - SonicHits",https://sonichits.com/video/Moses_Ok/Eye_Mefe.flv
sex09&period;FLV - Free Porn Videos - XVIDEOS.COM,https://xvideos.wptri.com/video9771604/sex09.flv%3Fpl%3D4630990%26plname%3Dforced
Gallery - Octopus Box,https://octopusbox.com/eng/gallery/view/KF310_languages_editing.flv
Lourdes la profesora del 8 phút trước - Xvideos,https://xvideos98.xxx/video8312109/lourdes_la_profesora_del_anal.flv
sweet brunette playing with her toy(2).flv - XVIDEOS.COM,https://www.xvideos.com/video2076524/sweet_brunette_playing_with_her_toy_2_.flv
Velamma Bhabhi South Indian MILF Doggy Style Hardcore Sex.FLV,https://xvideos8.org/video9633256/velamma_bhabhi_south_indian_milf_doggy_style_hardcore_sex.flv
sexy hot brunette fucking her juicy pussy(2).flv - XVIDEOS.COM,https://www.xvideos3.com/video2645397/sexy_hot_brunette_fucking_her_juicy_pussy_2_.flv
Ce vieil homme se fait sucer la bite.FLV - XVIDEOS.COM,https://www.xvideos4.com/video2880862/ce_vieil_homme_se_fait_sucer_la_bite.flv
