Postirradiation Sarcoma,https://pubs.rsna.org/doi/pdf/10.1148/96.3.593
[PDF] centrifugation on the yield and the kinetics of radiation-induced ...,https://www.ncbi.nlm.nih.gov/pmc/articles/PMC1211080/pdf/1065.pdf
Early-Onset Postirradiation Sarcoma of the Tongue after ...,https://www.karger.com/Article/Pdf/328977
Modifying Normal Tissue Damage Postirradiation Report of a ... - jstor,https://www.jstor.org/stable/3580963
Postirradiation Hibernation and Radiation Response of Ground ...,https://www.jstor.org/stable/3573631
Postirradiation sarcoma of bone. - American Cancer Society Journals,https://acsjournals.onlinelibrary.wiley.com/doi/pdf/10.1002/1097-0142(197901)43:1%253C182::AID-CNCR2820430127%253E3.0.CO%3B2-S
Postirradiation Changes in the Pelvic Wall,https://www.tandfonline.com/doi/pdf/10.3109/02841859309175410
404.pdf - ASH Publications,https://ashpublications.org/blood/article-pdf/7/4/404/595589/404.pdf
[PDF] Postirradiation Morphea in Patients With Breast Cancer,https://www.actasdermo.org/index.php%3Fp%3Drevista%26tipo%3Dpdf-simple%26pii%3DS1578219019300083
