Disease Eradication - SAGE Research Methods,https://methods.sagepub.com/reference/encyc-of-epidemiology/n115.xml
"African Origin, African Solutions, and Relevance for COVID-19† in",https://www.ajtmh.org/view/journals/tpmd/104/2/article-p416.xml
Malaria Eradication—Growth of the Concept and its Application in,https://www.ajtmh.org/view/journals/tpmd/7/3/article-p259.xml
Intracranial Eradication of Middle Cerebral Aneurysms in,https://thejns.org/view/journals/j-neurosurg/15/2/article-p223.xml
Long-term effects of Helicobacter pylori eradication on circulating ...,https://eje.bioscientifica.com/downloadpdf/journals/eje/158/3/323.xml
Climate Change and Alternative Hosts Complicate the Eradication of ...,https://bioone.org/journals/annals-of-the-entomological-society-of-america/volume-115/issue-1/saab034/Climate-Change-and-Alternative-Hosts-Complicate-the-Eradication-of-Cattle/10.1093/aesa/saab034.xml
Polio Eradication in Pakistan - Public Health - Oxford Bibliographies,https://www.oxfordbibliographies.com/view/document/obo-9780199756797/obo-9780199756797-0158.xml
PRRS eradication from swine farms in five regions of Hungary in,https://akjournals.com/view/journals/004/68/3/article-p257.xml
"Chapter 7 To Inoculate, or Aim to Eradicate Smallpox in - Brill",https://brill.com/abstract/book/9789004465374/BP000018.xml
BILLS-113sres270ats.xml - GovInfo,https://www.govinfo.gov/bulkdata/BILLS/113/2/sres/BILLS-113sres270ats.xml
Eradication of Phytophthora ramorum and Other Pathogens from ...,https://journals.ashs.org/horttech/view/journals/horttech/18/1/article-p106.xml
[PDF] Efficacy of tailored second-line therapy of Helicobacter pylori ...,https://journals.scholarsportal.info/pdf/17574749/v12inone/nfp_eotstotfamps.xml
[PDF] Achieving global malaria eradication in changing landscapes,https://journals.scholarsportal.info/pdf/14752875/v20inone/nfp_agmeicl.xml
Optimal Control against the Human Papillomavirus - Project Euclid,https://projecteuclid.org/journals/abstract-and-applied-analysis/volume-2019/issue-none/Optimal-Control-against-the-Human-Papillomavirus--Protection-versus-Eradication/10.1155/2019/4567825.xml
Texas Boll Weevil Eradication Foundation Records: An Inventory of ...,https://txarchives.org/tslac/finding_aids/14002.xml
"Inter-American Convention on the Prevention, Punishment and ...",https://www.jus.uio.no/english/services/library/treaties/02/2-04/violence-against-women.xml
The politics of vaccination - Manchester Open Hive,https://www.manchesteropenhive.com/view/9781526110916/9781526110916.00022.xml
Review of the Michigan Upper Peninsula Bovine Viral Diarrhea ...,https://avmajournals.avma.org/view/journals/javma/243/4/javma.243.4.548.xml
Comparison of bacterial eradication between standard and double ...,https://www.degruyter.com/view/j/abm.2011.5.issue-5/1905-7415.0505.088/1905-7415.0505.088.xml
"Global Cases of WPV1 and cVDPV as of October 26th, 2021 (Global ...",https://clinmedjournals.org/articles/jide/journal-of-infectious-diseases-and-epidemiology-jide-7-237.xml
