Morality and 'Conformism' in: Gramsci's Pathways - Brill,https://brill.com/view/book/9789004303690/B9789004303690_008.xml
Morality and 'Conformism' - Brill,https://brill.com/previewpdf/book/9789004303690/B9789004303690_008.xml
IMF Working Papers Volume 2011 Issue 033 - IMF eLibrary,https://www.elibrary.imf.org/view/IMF001/11652-9781455217939/11652-9781455217939/11652-9781455217939.xml
Conformism and Public News in: IMF Working Papers Volume 2011 ...,https://www.elibrary.imf.org/view/journals/001/2011/033/article-A001-en.xml
Citizenship and Education in Post-independent India,https://journals.scholarsportal.info/details/09716858/v28i0001/57_bcaccaeipi.xml
"The International Handbook of Children, Media and Culture",https://sk.sagepub.com/reference/hdbk_childmediaculture/n27.xml
Non-conformism or nationalism? Yuriy Butsko and his “Russian ...,https://akjournals.com/abstract/journals/6/56/4/article-p317.xml
Untitled,https://jspp.psychopen.eu/index.php/jspp/article/view/5281/5281.xml
Pension Reform and Economic Theory - Elgaronline,https://www.elgaronline.com/view/9781840643640.xml%3Fv%3Dtoc
1070326.xml - Biblioteka Nauki,https://bibliotekanauki.pl/articles/1070326.xml
