[PDF] The Many Applications of Engineered Bacteriophages— An Overview,https://www.mdpi.com/1424-8247/14/7/634/pdf
Phages and their satellites encode hotspots of antiviral systems,https://www.cell.com/cell-host-microbe/pdfExtended/S1931-3128(22)00104-4
Phages and their potential to modulate the microbiome and immunity,https://www.nature.com/articles/s41423-020-00532-4.pdf%3Forigin%3Dppub
How to train your bacteriophage - PNAS,https://www.pnas.org/doi/pdf/10.1073/pnas.2109434118
Coevolutionary phage training leads to greater bacterial ... - PNAS,https://www.pnas.org/doi/pdf/10.1073/pnas.2104592118
"[PDF] Novel Cluster AZ Arthrobacter phages Powerpuff, Lego, and ... - PLOS",https://journals.plos.org/plosone/article/file%3Fid%3D10.1371/journal.pone.0262556%26type%3Dprintable
Contained use of Bacteriophages: Risk Assessment and Biosafety ...,https://www.liebertpub.com/doi/pdf/10.1177/153567601001500106
[PDF] Phages as Antibiotic Alternatives and their use in Humans ...,https://www.hhs.gov/sites/default/files/tawil-paccarb.pdf
Genetically Engineered Phages: a Review of Advances over the ...,https://journals.asm.org/doi/pdf/10.1128/MMBR.00069-15
Phage Factor - JStor,https://www.jstor.org/stable/26016042
