Sarawak and the Brooke dynasty's centenary of 1941 - manchester ...,https://www.manchesterhive.com/downloadpdf/9781526142702/9781526142702.00012.xml
[9781526142702 - Monarchies and decolonisation in Asia ...,https://www.manchesterhive.com/pdfviewer/full/9781526142702/9781526142702.00012.xml%3Fbg%3DGREY_COLOR_LIGHT_VARIANT%26mgs%3DPRIMARY_COLOR%26mge%3DPRIMART_COLOR_DARK_VARIANT
The Name of Brooke: the End of White Rajah Rule in ... - Archives Hub,https://archiveshub.jisc.ac.uk/files/oxbod/0123_2002rhodes.xml
"PLINY THE ELDER, Natural History | Loeb Classical Library",https://www.loebclassics.com/view/pliny_elder-natural_history/1938/pb_LCL418.425.xml%3FreadMode%3Drecto
"Part 2 Power, Profit and the Periphery - Brill",https://brill.com/downloadpdf/book/9789004357280/B9789004357280_008.xml
feed.xml - All Australian Music Stories,https://allaustralianmusicstories.podbean.com/feed.xml
From A. R. Wallace 2 March [1867] 1 - Darwin Correspondence ...,https://www.darwinproject.ac.uk/letter/DCP-LETT-5968.xml
Claiming India: French Scholars and the ... - SAGE Books,https://sk.sagepub.com/books/claiming-india/i1421.xml
The Danish connection - Tamil Arts Academy,http://tamilartsacademy.com/articles/article23.xml
The Trials on Labuan - Brill,https://brill.com/previewpdf/book/9789004292055/B9789004292055-s015.xml
