Understanding Reservoir Operating Rules in the Transboundary ...,https://journals.ametsoc.org/view/journals/hydr/20/11/jhm-d-19-0058_1.xml
The Case of the High Aswan Dam in the Transboundary Nile River ...,https://journals.ametsoc.org/view/journals/hydr/22/5/JHM-D-20-0241.1.xml
Yahweh's Fresh Water Reservoir beneath His Mountain-Palace in,https://brill.com/view/journals/jane/21/1/article-p75_3.xml
Texas Supreme Court Canyon Dam and Reservoir Records,https://txarchives.org/tslac/finding_aids/20018.xml
The Role of the Reservoir Host in Tropical Disease in,https://www.ajtmh.org/view/journals/tpmd/s1-24/2/article-p125.xml
Present Knowledge of the Distribution of Trypanosoma Cruzi in ...,https://www.ajtmh.org/abstract/journals/tpmd/s1-21/2/article-p335.xml
SEC FORM 3 - SEC.gov,https://www.sec.gov/Archives/edgar/data/1288449/000095014221002494/xslF345X02/es210172896_3-erreservoir.xml
Risk factors associated with conversion of an Ommaya reservoir to a ...,https://thejns.org/pediatrics/view/journals/j-neurosurg-pediatr/25/4/article-p417.xml
Intraparenchymal hemorrhage after serial ventricular reservoir taps ...,https://thejns.org/pediatrics/view/journals/j-neurosurg-pediatr/28/6/article-p695.xml
