Quantitative Proteomic Analysis of Cell Wall and Plasma Membrane ...,https://journals.scholarsportal.info/details/15353893/v10i0002/459_qpaocwmffmab.xml
Word-initial clusters and minimality in Yakima Sahaptin | Scholars ...,https://journals.scholarsportal.info/details/09526757/v23i0001/21_wcamiys.xml
Te Development of Prosodic Structure: Evidence from Typical ... - Brill,https://brill.com/downloadpdf/book/edcoll/9789004280151/B9789004280151_005.xml
"Supervisory Chief, Regional Programs Unit. - Federal Register",https://www.federalregister.gov/documents/full_text/xml/2020/06/04/2020-12027.xml
Untitled,https://dblp.org/pid/27/3820.xml
SAGE Reference - The SAGE Handbook of Case-Based Methods,https://sk.sagepub.com/reference/the-sage-handbook-of-case-based-methods/n12.xml
Prosodic vowel lengthening in a spontaneous speech corpus of ...,https://www.degruyter.com/view/j/linpo.2015.57.issue-1/linpo-2015-0004/linpo-2015-0004.xml%3Fformat%3DINT%26intcmp%3Dtrendmd
Europe PMC,https://europepmc.org/articles/pmc6620427/bin/mmc1.xml
"Androgen receptor roles in hepatocellular carcinoma, fatty liver ...",https://erc.bioscientifica.com/downloadpdf/journals/erc/21/3/R165.xml
phonetiCs and phonology introduction in this chapter the sound ...,https://brill.com/downloadpdf/book/9789004246126/B9789004246126_003.xml
Defining the prosodic word with segmental processes in Dagbani in,https://akjournals.com/view/journals/2062/aop/article-10.1556-2062.2021.00437/article-10.1556-2062.2021.00437.xml
