cradle-of-filth,https://www.cradleoffilth.com/blog-feed.xml
Wires are the New Filth: The Rebirth of Dickens' London in ... - Brill,https://brill.com/abstract/book/9789004361317/B9789004361317_008.xml
Those in love with quantum filth in: Anti-computing,https://www.manchesteropenhive.com/view/9781526160720/9781526160720.00013.xml
Evaluation of Filth Fly Species Composition and Abundance Using ...,https://bioone.org/journals/journal-of-medical-entomology/volume-57/issue-6/tjaa104/Evaluation-of-Filth-Fly-Species-Composition-and-Abundance-Using-Two/10.1093/jme/tjaa104.xml
Augmentation of Early Season Releases of Filth Fly (Diptera ...,http://ee.oxfordjournals.org/content/15/3/590.source.xml
Filth Fly Transmission of Escherichia coli O157:H7 and Salmonella ...,http://aesa.oxfordjournals.org/content/110/1/83.source.xml
Experimental Transmission of Toxoplasma Gondii by Filth-Flies in,https://www.ajtmh.org/view/journals/tpmd/20/3/article-p411.xml
Mechanical transport and transmission of Cryptosporidium parvum ...,https://www.ajtmh.org/view/journals/tpmd/63/3/article-p178.xml
The Real Filth Fighters - ABC,https://www.abc.net.au/xmlcontent/tv/guide/xmlengine/brands/real-filth-fighters/data.xml
