[ Pireze. . HF Network]. Swan. Lake. The Mo Han D. 7z,https://archive.org/details/Pireze..HFNetwork.Swan.Lake.TheMoHanD.7z
Fern Marie Johnson Jacobson (1926-2011) buried in Wolf Lake ...,https://peoplelegacy.com/fern_marie_johnson_jacobson-6F3.7z
Ida Emma Borchardt Smith (1891-1956) buried in Saint Pauls ...,https://peoplelegacy.com/ida_emma_borchardt_smith-1p7.7Z
Spatial distribution of rural population from a climate perspective,https://europepmc.org/articles/pmc7932106/bin/pone.0248078.s001.7z
Inside Higher Ed's News,https://www.insidehighered.com/news/2020/06/11/colleges-face-evolving-cyber-extortion-threat.7Z%3Fpage%3D1051
Download 7-Zip from SourceForge.net - Compression,http://d.7-zip.org/a/7z920_extra.7z
Download 7-Zip from SourceForge.net,https://downloads.sourceforge.net/sevenzip/7z920_extra.7z
Download emule X Mod from SourceForge.net,https://downloads.sourceforge.net/emulex/eMule0.49c-Lite1.5.0.0-x86-bin-only.7z%3Fuse_mirror%3Dnchc
Generalized Schuster Law and King's Formula - NASA/ADS,https://adsabs.harvard.edu/full/1998SerAJ.157....7Z
