What Is a Transcriptional Burst?,https://www.cell.com/trends/genetics/pdf/S0168-9525(20)30005-6.pdf
Transcriptional Addiction in Cancer - Cell Press,https://www.cell.com/cell/pdf/S0092-8674(16)31727-5.pdf
Transcriptional activation: risky business - Genes & Development,http://genesdev.cshlp.org/content/15/9/1045.full.pdf
How mammalian transcriptional repressors work - FEBS Press,https://febs.onlinelibrary.wiley.com/doi/pdf/10.1111/j.1432-1033.2004.04174.x
Gene transcription in bursting: a unified mode for realizing accuracy ...,https://onlinelibrary.wiley.com/doi/pdf/10.1111/brv.12452
The Evolution of Transcriptional Regulation in Eukaryotes,https://academic.oup.com/mbe/article-pdf/20/9/1377/2987271/msg140.pdf
Genome-wide kinetic properties of transcriptional bursting in mouse ...,https://www.science.org/doi/pdf/10.1126/sciadv.aaz6699
[PDF] A Small Molecule Transcriptional Activation Domain,http://www.bu.edu/aldolase/biochemistry/html_docs/ChemicalBiology.pdf
Transcriptional and posttranscriptional regulation of ... - PNAS,https://www.pnas.org/doi/pdf/10.1073/pnas.0510607103
[PDF] SnapShot: Transcription Regulation: Pausing,https://els-jbs-prod-cdn.jbs.elsevierhealth.com/pb/assets/raw/journals/research/snapshots/PIIS0092867413004522.pdf
