The Conte: Oral and Written Dynamics (review) | Scholars Portal ...,https://journals.scholarsportal.info/details/15272044/v42i0002/203_tcoawd.xml
Privatizing the Conte du Graal: How Renaissance Printers ... - Brill,https://brill.com/previewpdf/book/edcoll/9789401204316/B9789401204316-s010.xml
adapts in the Conte del graal: - Brill,https://brill.com/downloadpdf/book/9789004476516/B9789004476516_s010.xml
Female Figures in the Illustrated Manuscripts of Le conte du Graal ...,https://www.manchesterhive.com/view/journals/bjrl/81/3/article-p7.xml
"EFFECT OF THYROIDECTOMY, THIOUREA AND IODINE ON THE ...",https://eje.bioscientifica.com/view/journals/eje/20/4/acta_20_4_008.xml
Softball - Wabash Valley College Athletics,https://www.wvcwarriorathletics.com/sports/sball/2021-22/boxscores/20220219_yv09.xml
O'CONNELL v. CONTE | 76 Wn.2d 280 (1969) | wn2d2801320 ...,https://www.leagle.com/decision/196935676wn2d2801320.xml
FORM D - SEC.gov,https://www.sec.gov/Archives/edgar/data/1585608/000158560822000003/xslFormDX01/primary_doc.xml
"Stonehill at American Int'l - April 20, 2022 - 2:30 PM - Box Score ...",https://www.stonehillskyhawks.com/sports/sball/2021-22/boxscores/20220420_cn68.xml
