Considerations for cancer immunotherapy biomarker research ...,https://erc.bioscientifica.com/view/journals/erc/27/9/ERC-20-0187.xml
Immunotherapy of advanced thyroid cancer: from bench to bedside,https://eje.bioscientifica.com/downloadpdf/journals/eje/183/2/EJE-20-0283.xml
"Management of Immunotherapy-Related Toxicities, Version 1.2020 in",https://jnccn.org/view/journals/jnccn/18/3/article-p230.xml
Role of Immunotherapy in Triple-Negative Breast Cancer in - JNCCN,https://jnccn.org/view/journals/jnccn/18/4/article-p479.xml
Immunotherapeutic treatments for spinal and peripheral nerve tumors,https://thejns.org/focus/view/journals/neurosurg-focus/52/2/article-pE8.xml
Using viral vectors to deliver local immunotherapy to glioblastoma in,https://thejns.org/focus/view/journals/neurosurg-focus/50/2/article-pE4.xml
Use of Immunotherapy in cancer treatment | Insights - ICON plc,http://www.yicangyuan.com/insights/blog/2020/01/23/the-use-of-immunotherapy-in-cancer-treatment/index.xml
Adaptimmune Therapeutics plc,https://www.sec.gov/Archives/edgar/data/1621227/000110465920059925/adap-20200512_pre.xml
Combination Immunotherapy for Kidney Cancer - Urology Care ...,https://itstimetotalkaboutoab.org/x4775.xml
[PDF] Perspectives on immunotherapy via oncolytic viruses - Infectious ...,https://journals.scholarsportal.info/pdf/17509378/v14inone/nfp_poivov.xml
Allergy Shots (Allergen Immunotherapy) in Children | My Doctor Online,https://mydoctor.kaiserpermanente.org/ncal/structured-content/Treatment_Allergen_Immunotherapy_in_Children_-_Pedi_Allergy.xml%3Fco%3D/regions/ncal
Immunotherapy and Novel Cancer Target Therapies in Kidney ...,https://www.kidneynews.org/view/journals/kidney-news/13/5/article-p19_5.xml
Immunotherapy with Mycobacterium vaccae in the treatment of ...,https://femsim.oxfordjournals.org/content/21/1/71.source.xml
Role of Immunotherapy in Pythium insidiosum Keratitis in - American ...,https://www.ajtmh.org/view/journals/tpmd/aop/article-10.4269-ajtmh.22-0015/article-10.4269-ajtmh.22-0015.xml
Untitled,https://jitc.bmj.com/content/8/2/e001383.download.xml
"Associate Director, Technology Transfer Center, National Cancer ...",https://www.federalregister.gov/documents/full_text/xml/2022/06/16/2022-12954.xml
[PDF] Candida albicans Immunotherapy for Verrucae Plantaris,https://japmaonline.org/downloadpdf/journals/apms/105/5/14-062.xml
Immunotherapy using CRISPR-Cas9 systems to treat rheumatoid ...,https://jhss.scholasticahq.com/article/33705.xml
international-journal-of-immunology-and-immunotherapy-ijii-7-053.xml,https://clinmedjournals.org/articles/ijii/international-journal-of-immunology-and-immunotherapy-ijii-7-053.xml
Immunotherapy for treatment of multicentric cutaneous pythiosis in a ...,https://avmajournals.avma.org/view/journals/javma/223/2/javma.2003.223.215.xml%3Frskey%3Dam0yrm%26result%3D2
Quantitation of anti–Pythium insidiosum antibodies before and after ...,https://avmajournals.avma.org/abstract/journals/ajvr/79/11/ajvr.79.11.1160.xml
Immunotherapy Combination Trials Q&A | Thought Leadership ...,https://iconplc.com/news-events/thought-leadership/immunotherapy-combination-trials-q-and-a/index.xml
Acta Microbiologica et Immunologica Hungarica - AKJournals,https://akjournals.com/view/journals/030/59/1/article-p63.xml
News Room | Children's Hospital of Philadelphia,https://www.chop.edu/newsroom/wp-includes/wlwmanifest.xml%3Fpage%3D173
Abstract - bioRxiv,https://www.biorxiv.org/content/biorxiv/early/2020/11/17/2020.09.03.260265.source.xml
Immunotherapy for HPV associated cancer - Europe PMC,https://europepmc.org/articles/pmc6639647/bin/mmc1.xml
Stallergenes Greer and Anergis Report Successful Preclinical Study ...,https://s23.q4cdn.com/175719177/files/test-1013/stallergenesgreer-release-example2.xml
"Chelsea Tripp DVM, DACVIM (Oncology) - Canine Cancer Alliance",https://www.ccralliance.org/blog-feed.xml
Renal Cell Cancer Update - Research To Practice,http://www.researchtopractice.com/podcast/feed/rccu.xml
Immunotherapy Clinical Trial RCT CCT.xml - World Allergy ...,https://www.worldallergy.org/systematic-reviews/files/Allergy%2520Immunotherapy%2520(General)/Mendeley%2520Import%2520Files/Immunotherapy%2520Clinical%2520Trial%2520RCT%2520CCT.xml
