"4 THE SUN, SATURDAY, JULY 15, 1916. NEWS FROM THE BOOK ...",https://chroniclingamerica.loc.gov/lccn/sn83030430/1916-07-15/ed-1/seq-4/ocr.txt
xevflYUEvrrOC4GtoaY6tg1ooR.txt - DevForum | Roblox,https://devforum.roblox.com/uploads/short-url/xevflYUEvrrOC4GtoaY6tg1ooR.txt
0001104659-15-014529.txt - SEC.gov,https://www.sec.gov/Archives/edgar/data/1274057/000110465915014529/0001104659-15-014529.txt
Former Bengal in Super Bowl | Local | idahostatejournal.com,http://www.idahostatejournal.com/articles/2009/01/27/sports/local/1.txt
M ilitary U nit W rong for U. T. T he T o d a y's Editorial V O L U M E 4 ...,https://repositories.lib.utexas.edu/bitstream/handle/2152/98347/19390122.txt%3Fsequence%3D2%26isAllowed%3Dy
13573.txt - Project Gutenberg,https://www.gutenberg.org/files/13573/13573.txt
pone until better times the repayment of two millions of Exchequer ...,https://ufdcimages.uflib.ufl.edu/UF/00/09/47/30/10431/0578.txt
exhibit-d.txt - Amazon S3,https://s3.amazonaws.com/s3.documentcloud.org/documents/1004442/exhibit-d.txt
"the faint ef heart begin to despair, and thai The sixth district of the ...",https://newspapers.digitalnc.org/lccn/sn84026472/1863-12-02/ed-1/seq-3/ocr.txt
English Words l la word xrv8 com,https://word.xrv8.com/English-Words__l__la__word-xrv8-com.txt
Scroll Very Fast Fast Scroll Medium Scroll Slow Scroll Very Slow ...,https://www.asstr.org/files/Collections/Alt.Sex.Stories.Moderated/Year98/13449.txt
