FastShare.cz,http://www.fastshare.cz/17377678/the.patent.scam.2017.720p.web.h264-opus.mkv
Endoscopic Management of Tympanic Membrane Retraction Pockets,https://europepmc.org/articles/pmc6838262/bin/12070_2019_1682_moesm1_esm.mkv
Modified Endoscope Holder for Two Handed Endoscopic Ear Surgery,https://europepmc.org/articles/pmc7374685/bin/12070_2020_1841_moesm1_esm.mkv
online ke zhlédnutí a stažení - Sdilej.cz,https://sdilej.cz/15681427/treti-patro-1985-2.zed.mkv
Třetí patro - 05 - Hrdlička.mkv online ke zhlédnutí a stažení - Sdilej.cz,https://sdilej.cz/9896357/treti-patro-05-hrdlicka.mkv
My Friend's Hot Mom Olivia Parrish 120310.mkv - pełnometrażowe ...,"http://chomikuj.pl/wieko666/*2b%2B18/pe*c5*82nometra*c5*bcowe%2Bruchanko/My%2BFriend*27s%2BHot%2BMom%2B-%2BOlivia%2BParrish%2B120310,1943132111.mkv"
