18 The Shark in the Library in - Brill,https://brill.com/abstract/book/9789004472013/BP000029.xml
18 The Shark in the Library in - Brill,https://brill.com/view/book/9789004472013/BP000029.xml%3Flanguage%3Den
Variations in Kindergarten Mathematics Programs and What a ...,https://pubs.nctm.org/view/journals/at/29/5/article-p46.xml
Federal and State government publications of ... - IDEALS @ Illinois,http://www.ideals.illinois.edu/bitstream/handle/2142/3884/gslisoccasionalpv00000i00100_tei.xml%3Fsequence%3D3
Citation analysis of the literature of Systemic Botany: A preliminary ...,https://journals.scholarsportal.info/details/00028231/v41i0007/535_caotlosbaps.xml
Content of the Ó Ceallaigh Collection - AskAboutIreland.ie,https://www.askaboutireland.ie/reading-room/sports-recreation/sport/o-ceallaigh-gaa-collectio/content-of-the-o-ceallaig/index.xml
frame.xml - Libraries Linking Idaho,http://lili.org/forlibs/ce/able/able7/presentation_content/frame.xml
The SAGE Encyclopedia of Qualitative Research Methods,https://sk.sagepub.com/reference/research/n35.xml
Content of the Ó Ceallaigh Collection - AskAboutIreland.ie,http://ams2-aai-web-1.anu.net/reading-room/sports-recreation/sport/o-ceallaigh-gaa-collectio/content-of-the-o-ceallaig/index.xml
