Monounsaturated Fatty Acid Intake by Children and Adults,http://nutritionreviews.oxfordjournals.org/content/62/4/132.source.xml
Effects of Salt and Fat on Your Heart | My Doctor Online,https://mydoctor.kaiserpermanente.org/mas/structured-content/Health_Topic_Heart_Effects_of_Salt_and_Fat_-_Cardiology.xml%3Fco%3D%252Fregions%252Fmas
Mechanisms involved in the cytotoxic and cytoprotective actions of ...,https://joe.bioscientifica.com/view/journals/joe/194/2/1940283.xml
Mechanisms involved in the cytotoxic and cytoprotective actions of ...,https://joe.bioscientifica.com/downloadpdf/journals/joe/194/2/1940283.xml
Inhibitory effect of very-long-chain monounsaturated fatty-acyl-CoAs ...,https://journals.scholarsportal.info/details/00052760/v960i0003_c/410_ieovmffaiscm.xml
Assessing Fatty Acid Profiles of Macadamia Nuts in,https://journals.ashs.org/hortsci/view/journals/hortsci/54/4/article-p633.xml
21 CFR 101.9 -- Nutrition labeling of food. - eCFR,https://www.gpo.gov/fdsys/pkg/CFR-2018-title21-vol2/xml/CFR-2018-title21-vol2-sec101-9.xml
Metabolism and Physiological Effects of Cyclic Fatty Acids Formed ...,https://lipidlibrary.aocs.org/x3162.xml
Untitled,https://www.medrxiv.org/content/medrxiv/early/2022/05/31/2022.05.27.22275343.source.xml
