[PDF] emission monitoring in animal husbandry - Advanced Energy,https://www.advancedenergy.com/globalassets/resources-root/application-notes/en-em-animal-husbandry-application-note.pdf
[PDF] Extensive versus modern animal husbandry – pros and cons - CORE,https://core.ac.uk/download/pdf/233610350.pdf
ECO-ENERGETIC ANALYSIS OF ANIMAL HUSBANDRY IN ...,https://www.sciencedirect.com/science/article/pii/0360544292900452/pdf%3Fmd5%3D4cf0e8753cad9ecd00687381a7370d62%26pid%3D1-s2.0-0360544292900452-main.pdf
"Likenings: Rhetorical Husbandries and Portia's ""True Conceit ... - jstor",https://www.jstor.org/stable/41917364
the english agricultural revolution - jstor,https://www.jstor.org/stable/pdf/1880527.pdf
"Rhetorical Husbandries and Portia's ""True Conceit"" of Friendship",https://www.journals.uchicago.edu/doi/pdfplus/10.1086/rd.31.41917364
Late Bronze Age Pig Husbandries in the Aegean and Anatolia,https://www.tandfonline.com/doi/pdf/10.1080/00934690.2020.1754081
"the turnip, the new husbandry - Oxford Academic",https://academic.oup.com/qje/article-pdf/83/3/375/5434046/83-3-375.pdf
[PDF] Evaluation of economic sustainability on the agricultural ...,https://ageconsearch.umn.edu/record/164900/files/2012-RAD-09-20-SUBI%25C4%2586_305-324.pdf
[PDF] Husbandry Guidelines For African Lion Panthera leo Class,http://nswfmpa.org/Husbandry%2520Manuals/Published%2520Manuals/Mammalia/African%2520Lion.pdf
a history of the introduction of timothy and cocksfoot into alternate ...,https://onlinelibrary.wiley.com/doi/pdf/10.1111/j.1365-2494.1968.tb00593.x
The Missing Links of Fish Husbandry,https://afspubs.onlinelibrary.wiley.com/doi/pdfdirect/10.1577/1548-8659%25281959%252921%255B51%253ATMLOFH%255D2.0.CO%253B2
[PDF] Livestock Husbandry and Environmental Problems - International ...,http://www.ijsrp.org/research-paper-0513/ijsrp-p1789.pdf
[PDF] Sheep husbandry in the early Neolithic of the Pyrenees,https://zaguan.unizar.es/record/101625/files/texto_completo.pdf
[PDF] Efiects of Implements of Husbandry (Farm Equipment) on Pavement ...,https://www.lrrb.org/media/reports/201208.pdf
"[PDF] 1. animal husbandry, dairying and fisheries department - TN GOV",https://www.tn.gov.in/rti/ahf/PIO-APPL-AHDF-HODs.pdf
Convertible Husbandry vs. Regular Common Fields - Cambridge ...,https://www.cambridge.org/core/services/aop-cambridge-core/content/view/BD55BD94ACD94F56A650AF121F2361B0/S0022050704002761a.pdf/convertible_husbandry_vs_regular_common_fields_a_model_on_the_relative_efficiency_of_medieval_field_systems.pdf
"[PDF] 2020, Study Programme part Animal Husbandry (Bachelor study ...",https://www.vhluas.com/binaries/content/assets/hvhl/internet-en/study/animal-husbandry/animal-husbandry-eer-2019-2020.pdf
"[PDF] Effect, Problems and Countermeasures of “Internet+” in Animal ...",https://www.atlantis-press.com/article/25878308.pdf
[PDF] Sustainable Animal Husbandries (module of the integrated course,https://www.uniba.it/ricerca/dipartimenti/disaat/didattica/off/offerta-formativa-2022-2023/saat/teaching-programs/sustainable-animal-husbandries-saat-2021-2022-a-g.pdf
