HOW DO EXHORTATIVE EXPRESSIONS WORK ... - JSTOR,https://www.jstor.org/stable/41913338
Obligatory Split Control into Exhortative Complements in Korean,https://www.jstor.org/stable/40071446
"Influence of Modeling, Exhortative Verbalization, and Surveillance ...",http://psycnet.apa.org/journals/dev/6/3/402.pdf
A Call to Resistance: The Exhortative Function of Daniel 7,https://muse.jhu.edu/article/747082/pdf
[PDF] A Syntactic Analysis of Interpretive Restrictions on Imperative ...,https://semanticsarchive.net/Archive/mNkYWFlY/ZanuttiniPakPortner-subjects.pdf
"Agreement in Promissive, Imperative, and Exhortative Clauses",https://www.ingentaconnect.com/content/jbp/kl/2008/00000014/00000001/art00007%3Fcrawler%3Dtrue
[PDF] Exhortative clauses in Scots To form imperatives and similar ...,http://scotssyntaxatlas.ac.uk/wp-content/uploads/2019/01/EDSW9_Sailor_Thoms.pdf
THE HOLOCAUST AND THE HUMANITIES - Wiley Online Library,https://onlinelibrary.wiley.com/doi/pdf/10.1002/j.2164-6163.1980.tb00099.x
[PDF] A Study of Exhortative Sentences in Russian Language for ...,https://meral.edu.mm/record/6727/files/Yi%2520Yi%2520Htay%2528Rus%2529.pdf
EXHORTATION AND DUTY TR IV 8 and TR IV 9 explain the Pr¯abh ...,https://brill.com/downloadpdf/book/9789004230248/B9789004230248-s004.pdf%3FpdfJsInlineViewToken%3D529312503%26inlineView%3Dtrue
