“The Stippling Shows Statistically Significant Grid Points”: How ...,https://journals.ametsoc.org/view/journals/bams/97/12/bams-d-15-00267.1.xml
Machine Learning Classification of Significant Tornadoes and Hail ...,https://journals.ametsoc.org/view/journals/wefo/36/6/WAF-D-21-0056.1.xml
Significant Geographies in: Journal of World Literature Volume ... - Brill,https://brill.com/view/journals/jwl/3/3/article-p290_5.xml%3Flanguage%3Den
Why not to (over)emphasize statistical significance in - European ...,https://eje.bioscientifica.com/view/journals/eje/181/3/EJE-19-0531.xml
least significant change for adjusted serum calcium in - European ...,https://eje.bioscientifica.com/view/journals/eje/184/1/EJE-20-0634.xml
a comparison of prenatal versus postnatal closure in - Journal of ...,https://thejns.org/pediatrics/view/journals/j-neurosurg-pediatr/29/5/article-p497.xml
The Environment Produces a Significant Effect on Pungency of ...,https://journals.ashs.org/hortsci/view/journals/hortsci/32/7/article-p1292.xml
Significant Energy Deficit and Suboptimal Sleep During a Junior ...,https://journals.humankinetics.com/view/journals/pes/aop/article-10.1123-pes.2021-0119/article-10.1123-pes.2021-0119.xml
Estimating Clinically Significant Mold Spores in Outdoor Environment,https://www.preventchildabusems.org/som/Departments%2520and%2520Offices/SOM%2520Departments/Preventive-Medicine/Research1/GIS-and-Remote-Sensing/Research-Tracks/Estimating-Clinically-Significant-Mold-Spores-in-Outdoor-Environment.xml
Significant Topographic Changes in the United States - USGS,https://na.unep.net/downloads/sciweb1/shared/topo/downloads/Topochange/topo_change_polygons_Shapefile/topo_change_polygons_metadata.xml
