[PDF] The History of Incense,https://m.naturesgardencandles.com/mas_assets/theme/ngc/pdf/histincense.pdf
[PDF] The Altar of Incense.docx,https://0201.nccdn.net/4_2/000/000/046/6ea/the-altar-of-incense.pdf
"[PDF] incense and incense sticks: types, components, origin and their ...",https://www.jbino.com/docs/Issue06_28_2020.pdf
Exposition of respiratory ailments from trace metals concentrations ...,https://www.nature.com/articles/s41598-021-89493-w.pdf%3Fproof%3Dt%25C2%25A0
The Uses of Incense in the Ancient Israelite Ritual - JSTOR,https://www.jstor.org/stable/1516131
Raw Material Management of Community Incense Production ...,https://www.sciencedirect.com/science/article/pii/S1877042813026025/pdf%3Fmd5%3Db468a0178453acdb7652e1de6b0c47ee%26pid%3D1-s2.0-S1877042813026025-main.pdf
VOCs and Particulate Pollution due to Incense Burning in Temples ...,https://www.sciencedirect.com/science/article/pii/S1877705815028957/pdf%3Fmd5%3Df3813366e31e39110ecf0fffe4c20261%26pid%3D1-s2.0-S1877705815028957-main.pdf
Qualitative Analysis of the Smoke-Stream of Different Kinds of ...,https://journals.sagepub.com/doi/pdf/10.1177/1934578X1000500836
InScene: a communication device which uses incenses,https://dl.acm.org/doi/pdf/10.1145/1178823.1178865
[PDF] Indoor Air Quality: Assessment of Dangerous Substances in Incense ...,https://www.mdpi.com/1660-4601/18/15/8086/pdf%3Fversion%3D1627640309
