Boilermaker Union News and Updates | Page 10 | International ...,https://boilermakers.org/news/video.flv%3Fpage%3D9
Afghanistan: un attentat à Kaboul fait 30 morts et ... - Journal L'Union,https://www.lunion.fr/art/706861/article/2016-04-19/video/MMV877902_TFR.flv
Colombie: cessez-le-feu avec les Farc à partir de lundi - L'Union,https://www.lunion.fr/art/791872/article/2016-08-28/137/video/MMV929767_TFR.flv
[PDF] Ils sont six à briguer le siège de Pierre Kohler,https://www.suissesolidaire.org/wp-content/uploads/20150321.pdf.flv
Tajemnice Domu Anubisa 93 House of Dead Ends.flv ... - Chomikuj,"http://chomikuj.pl/m26gfmhfm/zachomikowane/Tajemnice%2BDomu%2BAnubisa%2B93%2BHouse%2Bof%2BDead-Ends,1797420627.flv"
I am very glad because I'm finally returning back home ... - Chomikuj,"http://chomikuj.pl/m26gfmhfm/CHARLIE%2BMCDONNELL/charlieissoboredlike/I%2Bam%2Bvery%2Bglad*2c%2Bbecause%2BI*27m%2Bfinally%2Breturning%2Bback%2Bhome%2B(MichaelAranda)%2B16.03.2010,1912099568.flv"
