North Korea Ridicules UN Chief's Presidential Ambitions,https://www.northkoreatimes.com/news/250400683/oct04v56.flv
EU Agrees 18 Million Euro Development Aid for Iran,https://www.orangecountysun.com/news/257882874/oct04v56.flv
Left or Right: Whose Side Is History On?,https://www.calgarymonitor.com/news/258088644/oct04v40.flv
EU Lays Out Accession Path For Balkan Countries - Radio Free ...,https://www.dublinnews.com/news/256383024/oct04v40.flv
Trump Warns Iran Not To Restart Nuclear Program - Radio Free ...,https://www.irishsun.com/news/257221236/oct04v56.flv
"Putin Bullish On Russian Economy, Blasts West In Q&A Session",https://www.moscowinquirer.com/news/257438599/oct04v40.flv
Pakistan To Hold General Elections July 25 - Radio Free Europe,https://www.malaysiasun.com/news/257359524/oct04v56.flv
"China Boosts Defense Spending, Rattling its Neighbors' Nerves",https://www.taiwansun.com/news/256658197/oct04v56.flv
Divide And Rule? Complex Ethnic Problems Dominate Bosnian ...,https://www.northernirelandnews.com/news/258088992/oct04v40.flv
India Seals Deal for Russian Air Defense Systems During Putin Visit,https://www.indiagazette.com/news/258088693/feb24v21.flv
Iran's Parliament Passes Bill Against Funding Terrorism,https://www.philippinetimes.com/news/258095659/oct04v56.flv
U.S. Special Forces Soldier Dies From Wounds Received In ...,https://www.centralasiatimes.com/news/257835105/oct04v56.flv
Bosnians Cast Ballots After Divisive Election Campaign - Radio Free ...,https://www.mediterraneantimes.com/news/258089036/oct04v40.flv
Trump Calls On U.S. Attorney General To End Russia Probe 'Right ...,https://www.europesun.com/news/257774538/oct04v56.flv
Putin Hits Out At U.S. In Red Square Parade Speech - Radio Free ...,https://www.stpetersburgstar.com/news/257225616/oct04v56.flv
Trump Signs Order Reimposing Sanctions On Iran - Radio Free ...,https://www.stpetersburgstar.com/news/257796220/feb24v21.flv
Top Pakistani Court Upholds Christian Woman's Blasphemy Acquittal,https://www.kenyastar.com/news/259282418/feb24v21.flv
"Family, Pakistan Mourn Loss Of Student Killed In Texas Shooting",https://www.vietnamtribune.com/news/257309538/oct04v56.flv
Death Of Outspoken Srebrenica Mother Mocked By Top Serbian ...,https://www.swedensun.com/news/257736575/oct04v40.flv
