The Tillage Edge - Transistor,https://audioboom.com/channels/5022759.rss
UC Agriculture and Natural Resources (Video) - UCTV,https://podcast.uctv.tv/UCTV_campus_ANR_video.rss
Salford - From the Field - Buzzsprout,https://feeds.buzzsprout.com/1952858.rss
Wessels Living History Farm,https://livinghistoryfarm.org/podcasts/index.rss
https://www.agrimag.co.za/new-farm-equipment/tilla...,https://www.agrimag.co.za/new-farm-equipment/tillage-equipment/75k/350k/new.rss
Field Work - American Public Media,https://feeds.publicradio.org/public_feeds/fieldwork/rss/rss.rss
Longtime family business has fingers in many pies | The Blade,https://www.toledoblade.com/local/2004/01/12/Longtime-family-business-has-fingers-in-many-pies/stories/feed/index.rss
Activists plant seed for Toledo farming rules | The Blade,https://www.toledoblade.com/Politics/2017/06/22/Activists-plant-seed-for-city-farming-rules/stories/feed/feed/index.rss
Journal of Agricultural Machinery,https://jame.um.ac.ir/index.php/Paleon/data/jame/news/ju.rss%3Flang%3Den
