Major drug operation stumbled upon by police - Toledo Blade,https://www.toledoblade.com/Police-Fire/2012/09/18/Major-drug-operation-stumbled-upon-by-police/stories/feed/index.rss
UT women stumble at home against Ohio - Toledo Blade,https://www.toledoblade.com/sports/ut/2017/01/18/University-of-Toledo-women-s-basketball-team-plays-Ohio-University-at-Savage-Arena/stories/feed/index.rss
Blues on Parade: A Chelsea F.C Podcast - Anchor,http://feeds.soundcloud.com/users/soundcloud:users:315047173/sounds.rss
Dr. Carl Broggi - Search The Scriptures,https://searchthescriptures.org/podcasts/search-the-scriptures.rss
If That Ain't Country,https://ifthataintcountry.net/blogs/if-that-ain-t-country.rss
Talkin' about with Ed and Karl - Buzzsprout,https://feeds.buzzsprout.com/1928244.rss
The Last We Fake - Buzzsprout,https://feeds.buzzsprout.com/1924597.rss
Santa Clara First Baptist Church Podcast,https://www.scfbc.org/scfbcpodcast.rss
