A restudy of the generic composition of the linyphiid spider fauna of ...,https://brill.com/view/journals/ise/23/2/article-p153_2.xml%3Flanguage%3Den
[PDF] The testing effect for mediator final test cues and ... - BMC Psychology,https://journals.scholarsportal.info/pdf/20507283/v4inone/nfp_ttefmfcioale.xml
The Value of Hypertonic Mannitol Solution in Decreasing Brain ...,https://thejns.org/view/journals/j-neurosurg/19/12/article-p1038.xml
SAGE Reference - The SAGE Handbook of Applied Memory,https://sk.sagepub.com/reference/the-sage-handbook-of-applied-memory/n11.xml
"THE RESPONSE OF PLASMA SUGAR, FREE FATTY ACIDS, 11 ...",https://joe.bioscientifica.com/view/journals/joe/48/3/joe_48_3_009.xml
"The relation between gastrin, gastric acid and thyroid function ...",https://eje.bioscientifica.com/view/journals/eje/95/3/acta_95_3_008.xml
Gamma-ray energies of radionuclides formed by uranium fission ...,https://akjournals.com/abstract/journals/10967/3/3-4/article-p271.xml
News Releases | Page 141 | MASSPIRG,https://masspirg.org/news/mortgage%2520servicing%2520system/rss.xml/rss.xml%3Fpage%3D140
news and notes in: Bulletin of the American Meteorological Society ...,https://journals.ametsoc.org/abstract/journals/bams/46/3/1520-0477-46_3_134.xml
