Energy Costs of Household and Eldercare Activities in Young to ...,https://journals.humankinetics.com/view/journals/jpah/19/6/article-p404.xml
Energy Costs of Household and Eldercare Activities in Young to ...,https://journals.humankinetics.com/abstract/journals/jpah/19/6/article-p404.xml
"Eldercare, gender relations and migrant labour in Japan - Elgaronline",https://www.elgaronline.com/view/edcoll/9781788112901/9781788112901.00014.xml
"Chapter 7: Eldercare, gender relations and migrant labour in Japan ...",https://www.elgaronline.com/abstract/edcoll/9781788112901/9781788112901.00014.xml
Culture or Context? in: Asian Journal of Social Science ... - Brill,https://brill.com/view/journals/ajss/48/3-4/article-p227_3.xml%3Flanguage%3Den
Age And gender In JAPAnese elderCAre CommunICATIon - Brill,https://brill.com/downloadpdf/book/9789004194847/Bej.9789004187788.i-545_019.xml
LifePod: smart home tech can help facilitate challenges of eldercare ...,https://www.ageinplacetech.com/node/4144/atom.xml
Toward an ElderCare Living Lab for Sensor-Based Health ...,https://journals.scholarsportal.info/details/23256095/v04i0003/30_taellfshaapt.xml
"NPI Database | NPI:1811664683 | LIFE ELDERCARE, INC ...",https://www.hipaaspace.com/medical_billing/coding/national_provider_identifier/codes/npi_1811664683.xml
