Defining the inherent stability of degenerative spondylolisthesis,https://thejns.org/spine/view/journals/j-neurosurg-spine/23/2/article-p178.xml
Adult degenerative scoliosis: evaluation and management in,https://thejns.org/focus/view/journals/neurosurg-focus/28/3/2010.1.focus09271.xml
Current trends in the management of degenerative lumbar ...,https://eor.bioscientifica.com/view/journals/eor/3/5/2058-5241.3.170050.xml
Degenerative Spine Disease | American Journal of Clinical Pathology,https://ajcp.oxfordjournals.org/content/125/2/193.source.xml
Dynamic stabilization for degenerative diseases in the lumbar spine,https://orthopedicreviews.openmedicalpublishing.org/article/23134.xml
Degenerative spine disease: Italian position paper on acquisition ...,https://journals.scholarsportal.info/pdf/18694101/v12inone/nfp_dsdipparomri.xml
Red blood cell distribution width in dogs with chronic degenerative ...,https://avmajournals.avma.org/view/journals/javma/243/6/javma.243.6.858.xml
