metadata.xml - NUST Library,http://library.nust.ac.zw/exams/Applied%2520Science/Applied%2520Physics/metadata.xml
Short Takes: Another Good Idea: Pasta Symmetry in - NCTM,https://pubs.nctm.org/view/journals/mtms/12/9/article-p516.xml
Detecting Reflectional Symmetries in 3D Data Through Symmetrical ...,https://dblp.org/rec/conf/iccvw/EcinsFA17.xml
[PDF] No effect of multi-axis dot pattern symmetry on subjective duration,https://journals.scholarsportal.info/pdf/19326203/v15i0012/nfp_neomdpsosd.xml
Quantification of local symmetry: application to texture discrimination ...,https://brill.com/previewpdf/journals/sv/8/4/article-p515_10.xml
Detection of visual symmetries JOHAN WAGEMANS ... - Brill,https://brill.com/downloadpdf/journals/sv/9/1/article-p9_2.xml
1. Introduction - Hindawi.com,https://downloads.hindawi.com/journals/complexity/2020/8820500.xml
A Lagrangian-Based Approach for Determining Trajectories ...,https://journals.ametsoc.org/abstract/journals/phoc/37/6/jpo3038.1.xml
SAGE Reference - Encyclopedia of Perception - SAGE Knowledge,https://sk.sagepub.com/reference/perception/n13.xml
