the effect of submergence on ontogeny of cambium and ... - Brill,https://brill.com/downloadpdf/journals/iawa/22/2/article-p159_4.xml
THE EFFECT OF SUBMERGENCE ON ONTOGENY OF CAMBIUM ...,https://brill.com/view/journals/iawa/22/2/article-p159_4.xml%3Flanguage%3Den
Exogenous Application of Nitrogen and Cytokinin on Growth ...,https://journals.ashs.org/hortsci/view/journals/hortsci/51/12/article-p1602.xml
Submerged in darkness: adaptations to prolonged submergence by ...,https://journals.scholarsportal.info/details/03057364/v103i0002/359_sidatpwsotaf.xml
Rice Genotypes with SUB1 QTL Differ in Submergence Tolerance ...,https://journals.scholarsportal.info/details/19398425/v5inone/nfp_rgwsqdsargar.xml
"Releases. Lifesaving Equipment, Hydraulic and Manual - Govinfo.gov",https://www.govinfo.gov/content/pkg/CFR-2018-title46-vol6/xml/CFR-2018-title46-vol6-part160-subpart160-062.xml
1. Introduction - Hindawi.com,https://downloads.hindawi.com/journals/ija/2017/9734036.xml
XML - Scientific Research Publishing,https://www.scirp.org/xml/117289.xml
Removing Spurious Low-Frequency Variability in Drifter Velocities,https://journals.ametsoc.org/downloadpdf/journals/atot/30/2/jtech-d-12-00139_1.xml
