Forces and torques between nonintersecting straight currents ...,https://journals.scholarsportal.info/details/01430807/v37i0004/045206_fatbnsc.xml
Nonintersection Exponents for Brownian Paths. II. Estimates and ...,https://projecteuclid.org/journals/annals-of-probability/volume-18/issue-3/Nonintersection-Exponents-for-Brownian-Paths-II-Estimates-and-Applications-to/10.1214/aop/1176990733.xml
acute and long-term outcomes from the Barrow Ruptured Aneurysm ...,https://thejns.org/view/journals/j-neurosurg/129/3/article-p711.xml
Entry Fundamental Principle of Mixed Methods Research - SAGE ...,https://sk.sagepub.com/reference/behavioralsciences/n1079.xml
Extension of Nonparametric IRT to Polytomous Item Scores,https://methods.sagepub.com/book/introduction-to-nonparametric-item-response-theory/n7.xml
1. Introduction - Hindawi.com,http://downloads.hindawi.com/journals/amp/2012/463610.xml
Comments on “Probability for a Period and Its Subperiods,https://journals.ametsoc.org/view/journals/mwre/128/8/1520-0493_2000_128_3011_copfap_2.0.co_2.xml
Large-scale spectral clustering using diffusion coordinates on ...,https://aclanthology.org/W18-1705.xml
Hervaeus Natalis and Durand of St. Pourçain on Limit Decision in,https://brill.com/view/book/edcoll/9789004368736/BP000005.xml
