Chapter 20: The Reprivatization of War in: Handbook on the ...,https://www.elgaronline.com/view/edcoll/9781848446496/9781848446496.00026.xml
Chapter 20: The Reprivatization of War in - Elgaronline,https://www.elgaronline.com/abstract/edcoll/9781848446496/9781848446496.00026.xml
Transfer of Ownership of Forests in the Western and Northern ...,https://www.degruyter.com/view/j/sho.2018.36.issue-1/sho-2018-0008/sho-2018-0008.xml
IMF Working Papers Volume 2003 Issue 235: From the Front Lines ...,https://www.elibrary.imf.org/view/journals/001/2003/235/001.2003.issue-235-en.xml
"Emotion, Medizin und Volksbelehrung: die Entstehung des - Brill",https://brill.com/view/journals/ges/66/2/article-p67_5.xml%3Flanguage%3Den
Marxist morphologies - Berghahn Journals,https://www.berghahnjournals.com/downloadpdf/journals/focaal/2018/82/fcl820102.xml
Ecological conflicts in Poland | Scholars Portal Journals,https://journals.scholarsportal.info/details/03432521/v54i3-4/507_ecip.xml
Government and Housing: Developments in Seven ... - SAGE Books,https://sk.sagepub.com/books/government-and-housing/n19.xml
Acta Ethnographica Hungarica Volume 58 Issue 1 (2013) - AKJournals,https://akjournals.com/abstract/journals/022/58/1/article-p87.xml
