Detection of third and sixth cranial nerve palsies with a novel ...,https://thejns.org/view/journals/j-neurosurg/122/3/article-p707.xml
Multiple cranial nerve palsies due to a hyperextension injury to the ...,https://thejns.org/view/journals/j-neurosurg/61/1/article-p172.xml
Third nerve palsy and internal carotid aneurysm | QJM,https://qjmed.oxfordjournals.org/content/109/11/755.source.xml
"Macroprolactinoma causing VI, X, XII cranial nerve palsies nearly 30 ...",https://edm.bioscientifica.com/view/journals/edm/2018/1/EDM18-0053.xml
Radial nerve palsy in - EFORT Open Reviews,https://eor.bioscientifica.com/view/journals/eor/1/8/2058-5241.1.000028.xml
Peripheral (Seventh) Nerve Palsy and Multiple Sclerosis - Karger ...,https://journals.scholarsportal.info/pdf/1662680x/v08i0001/27_pnpamsaddacr.xml
Third Cranial Nerve Palsy in the Setting of Chikungunya Virus ...,https://www.ajtmh.org/view/journals/tpmd/95/1/article-p180.xml
journal-of-otolaryngology-and-rhinology-jor-4-047.xml - ClinMed ...,https://clinmedjournals.org/articles/jor/journal-of-otolaryngology-and-rhinology-jor-4-047.xml
References - ClinMed International Library,https://clinmedjournals.org/articles/jide/journal-of-infectious-diseases-and-epidemiology-jide-8-258.xml
