XML - Govinfo.gov,https://www.govinfo.gov/content/pkg/CFR-2019-title30-vol2/xml/CFR-2019-title30-vol2.xml
OIL AND GAS AND SULPHUR OPERATIONS IN THE OUTER ...,http://www.gpo.gov/fdsys/pkg/CFR-2012-title30-vol2/xml/CFR-2012-title30-vol2-part250.xml
Oceanic Isopycnal Slope Spectra. Part I: Internal Waves in,https://journals.ametsoc.org/view/journals/phoc/37/5/jpo3073.1.xml
Oceanic Isopycnal Slope Spectra. Part I: Internal Waves,https://journals.ametsoc.org/downloadpdf/journals/phoc/37/5/jpo3073.1.xml
AN AUTOETHNOGRAPHY OF (NOT) COUNSELLING - Brill,https://brill.com/previewpdf/book/edcoll/9789462094109/BP000009.xml%3FpdfJsInlineViewToken%3D1057511893%26inlineView%3Dtrue
"Water and Soil, Blood and Oil - Frontiers in International ...",https://brill.com/downloadpdf/book/9789004372887/BP000004.xml
SAGE Reference - Encyclopedia of Journalism,https://sk.sagepub.com/reference/journalism/n266.xml
rows.xml - NYC Open Data -,https://data.cityofnewyork.us/api/views/w6sb-ivb2/rows.xml%3FaccessType%3DDOWNLOAD
Entering the town of Twin Peaks - Diane,https://www.ivoox.com/diane-entering-the-town-of-twin-peaks_fg_f1362502_filtro_1.xml
