"[PDF] Overuse, Underuse and Misuse of Medical Care - National ...",http://go.nationalpartnership.org/site/DocServer/Three_Categories_of_Quality.pdf
Right care 4 - Levers for addressing medical underuse and overuse,https://www.thelancet.com/pdfs/journals/lancet/PIIS0140-6736(16)32586-7.pdf
"[PDF] Testimony The Overuse, Underuse, and Misuse of Health Care",https://www.cbo.gov/sites/default/files/110th-congress-2007-2008/reports/07-17-healthcare_testimony.pdf
Measuring Underuse and Overuse of Medications,https://agsjournals.onlinelibrary.wiley.com/doi/pdf/10.1111/jgs.16111
"Food Insecurity, Cost-related Medication Underuse, and Unmet Needs",https://www.amjmed.com/article/s0002-9343(14)00030-8/pdf
"[PDF] Finding the golden mean: the overuse, underuse, and optimal use of ...",https://www.viacharacter.org/pdf/Golden_mean_overuse_underuse__optimal_use_of_CS_(Niemiec_2019).pdf
[PDF] Social anxiety via character strengths underuse and overuse,https://www.viacharacter.org/pdf/Overuse-underuse-optimal_use__SAD_-_Freidlin_Littman-Ovadia__Niemiec_(2017).pdf
"Health Insurance Status, Cost-Related Medication Underuse, and ...",https://www.jstor.org/stable/4640706
Underuse of Medications and Lifestyle Counseling to Prevent ...,https://diabetesjournals.org/care/article-pdf/42/5/e75/553084/dc181554.pdf
Biobank managers bemoan underuse of collected samples - Nature,https://www.nature.com/articles/nm0313-253a.pdf%3Forigin%3Dppub
Police May Underuse Section 136 - SAGE Journals,https://journals.sagepub.com/doi/pdf/10.1177/002580249303300302
[PDF] OVERUSE AND UNDERUSE OF ACUTE HEALTHCARE - Public ...,https://thedocs.worldbank.org/en/doc/9a5b05632510462a3f81e1d75d4bd154-0050022021/original/OveruseandUnderuseofAcuteHealthcare-AnjaSautmann.pdf
Overuse and underuse of diagnostic upper gastrointestinal ...,https://academic.oup.com/intqhc/article-pdf/11/4/301/5173878/110301.pdf
[PDF] ''Underuse'' as a cause for musculoskeletal injuries - CiteSeerX,https://citeseerx.ist.psu.edu/viewdoc/download%3Fdoi%3D10.1.1.929.6825%26rep%3Drep1%26type%3Dpdf
Cost-Related Medication Underuse Among Chronically Ill Adults,https://ajph.aphapublications.org/doi/pdf/10.2105/AJPH.94.10.1782
[PDF] Cost-related underuse of medications in older adults: ELSI-Brazil,https://www.scielo.br/j/rsp/a/XjgkQpyScFtfk93tXgGmvBN/%3Fformat%3Dpdf%26lang%3Den
Underuse of Indicated Medications Among Physically Frail,https://www.sciencedirect.com/science/article/pii/S1543594609000713/pdf%3Fmd5%3D8764ef1f5f59126ae40c7dcf868f6658%26pid%3D1-s2.0-S1543594609000713-main.pdf
"[PDF] Cost, coverage, and the underuse of medications among people ...",https://hsrc.himmelfarb.gwu.edu/cgi/viewcontent.cgi%3Farticle%3D1056%26context%3Dsphhs_policy_briefs
[PDF] The Overuse and Underuse of Healthcare in Neurotrauma,https://www.pajtcces.com/doi/PAJT/pdf/10.5005/jp-journals-10030-1368
Costs and underuse of insulin and diabetes supplies,https://www.diabetesresearchclinicalpractice.com/article/S0168-8227(21)00355-7/pdf
Adverse Outcomes of Underuse of β-Blockers in Elderly Patients,https://jamanetwork.com/journals/JAMA/articlepdf/416027/jama_277_18_019.pdf
[PDF] The Role of Price and Convenience in Underuse of ORS to Treat ...,https://www.jhsph.edu/research/centers-and-institutes/health-services-outcomes-research/_images/Materials/The%2520Role%2520of%2520Price%2520and%2520Convenience%2520in%2520Underuse%2520of%2520ORS%2520to%2520Treat%2520Child%2520Diarrhea%2520A%2520Cluster%2520Randomized%2520Controlled%2520Trial%2520in%2520Uganda.pdf
Underuse of clozapine in treatment-resistant schizophrenia†,https://www.cambridge.org/core/services/aop-cambridge-core/content/view/4FB922E9FD7BC01DAFF5EB8CFA228D38/S1355514600014152a.pdf/underuse_of_clozapine_in_treatmentresistant_schizophrenia.pdf
Overuse and underuse of colonoscopy in a European primary care ...,https://www.giejournal.org/article/S0016-5107(00)99794-3/pdf
Underuse Versus Overuse of Neonatal Intensive Care,https://www.jpeds.com/article/S0022-3476(17)31302-1/pdf
Regionalization and the Underuse of Angiography in the Veterans ...,https://www.nejm.org/doi/pdf/10.1056/NEJMsa021725
Can nudge-interventions address health service overuse and ...,https://bmjopen.bmj.com/content/bmjopen/9/6/e029540.full.pdf
[PDF] Underuse and overuse of colonoscopy among survivors of ...,https://sph.unc.edu/wp-content/uploads/sites/112/2013/12/salz_hpm_abstract.pdf
[PDF] Savarese et al. MRA underuse in HFrEF - Deep Blue,https://deepblue.lib.umich.edu/bitstream/handle/2027.42/146476/ejhf1182_am.pdf%3Fsequence%3D2
Adverse Outcomes and Predictors of Underuse of Antithrombotic ...,https://www.ahajournals.org/doi/pdf/10.1161/01.STR.31.4.822%3Fdownload%3Dtrue
