Hospice of Helping Hands | West Branch Regional Medical Center,https://www.wbrmc.com/hospice-helping-hands-landing.php/robots.txt
Helping Survivors Cope During Covid-19 - Caminar Latino,https://caminarlatino.org/wp-content/uploads/2021/05/TXT-Helping-Survivors-Cope-during-Covid-19.txt
pinacleenterprises1ex5.txt - SEC.gov,http://www.sec.gov/Archives/edgar/data/1522165/000101489711000112/pinacleenterprises1ex5.txt
helping-users-sign-in-hints/LICENCE.txt at master - GitHub,https://github.com/alphagov/helping-users-sign-in-hints/blob/master/LICENCE.txt
Helping hands reach out to Harvey's survivors - tbnweekly.com,http://www.tbnweekly.com/front_page/content_articles/082917_fpg-02.txt
ACC helping former NASA workers find employment | News ...,http://www.alvinsun.net/articles/2012/09/05/news/doc503e443c24cbd397956181.txt
Jobs: A helping hand? | Opinion | harborcountry-news.com,http://harborcountry-news.com/articles/2012/07/07/opinion/doc4fcfa0954c85f068709664.txt
Honor your freedom by helping others gain their independence ...,https://www.shawlocal.com/2007/07/11/honor-your-freedom-by-helping-others-gain-their-independence/auyt1jq/neighbors03.txt
A helping hand for the holidays | News | egcitizen.com,http://www.egcitizen.com/articles/2015/12/01/news/doc5655022215a85753820870.txt
