Insect Serosa: A Head Line in Comparative Developmental Genetics,https://www.cell.com/current-biology/pdf/S0960-9822(05)00287-3.pdf
[PDF] The extraembryonic serosa protects the insect egg against desiccation,https://uenf.br/posgraduacao/ecologia-recursosnaturais/wp-content/uploads/sites/7/2018/05/Artigo-Gustavo-4.pdf
[PDF] The extraembryonic serosa is a frontier epithelium providing ... - eLife,https://elifesciences.org/articles/04111.pdf
"The serosa of Manduca sexta (Insecta, Lepidoptera) - ScienceDirect ...",https://www.sciencedirect.com/science/article/pii/S0040816601902137/pdf%3Fmd5%3Dfd03262f0dc1b1169e5763c225d3d2f2%26pid%3D1-s2.0-S0040816601902137-main.pdf%26_valck%3D1
cotesia congrega ta: presence of a separate amnion and serosa - jstor,https://www.jstor.org/stable/3283409
"racic approach, the ICB appeared on the right crus",https://academic.oup.com/dote/article-pdf/31/Supplement_1/59/29397784/doy089.ps01.032.pdf
Pathological serosa and node-based classification - Nature,https://www.nature.com/articles/6691720.pdf%3Forigin%3Dppub
[PDF] Microscopic distance from tumor invasion front to serosa might be a ...,https://journals.plos.org/plosone/article/file%3Ftype%3Dprintable%26id%3D10.1371/journal.pone.0225958
Serosa membrane plays a key role in transferring vitellin ...,https://onlinelibrary.wiley.com/doi/pdf/10.1046/j.1440-169X.2001.00614.x
Serosa-Mimetic Nanoarchitecture Membranes for Highly Efficient ...,https://pubs.acs.org/doi/pdf/10.1021/jacs.1c07392
Gastric plication: preclinical study of durability of serosa-to-serosa ...,https://www.soard.org/article/S1550-7289(10)00750-1/pdf
MASTOIDITIS HYPERPLASTICA SEROSA - JAMA Network,https://jamanetwork.com/journals/jama/articlepdf/230296/jama_79_5_012.pdf
CHOROIDOSIS CENTRALIS SEROSA - JAMA Network,https://jamanetwork.com/journals/OPHTH/articlepdf/616255/archopht_27_1_006.pdf
Avitene granulomas of colonic serosa - Annals of Clinical ...,http://www.annclinlabsci.org/content/16/4/296.full.pdf
Surgical Outcome of Serosa-negative Advanced Gastric Carcinoma,https://ar.iiarjournals.org/content/anticanres/24/5B/3169.full-text.pdf
[PDF] l Que es la coriorretinopatia serosa central? l Cuales son los ...,https://saeye.com/wp-content/uploads/handouts/spanish/Coriorretinopatia-Serosa-Central.pdf
IL-4 gene transfer to the small bowel serosa leads to intestinal ...,https://journals.physiology.org/doi/pdf/10.1152/ajpgi.00065.2006
Adjuvant mitomycin and fluorouracil followed by oral uracil plus ...,https://www.thelancet.com/pdfs/journals/lancet/PIIS014067369901048X.pdf
Contribution to the Chorioretinitis Centralis Serosa Kitahara - Karger ...,https://www.karger.com/Article/Pdf/300925
Parachordoma of the Gastric Serosa - SAGE Journals,https://journals.sagepub.com/doi/pdf/10.1177/1066896907302367
"DIGES TIVE SYSTEM mucosa, submucosa, muscularis externa, and ...",https://link.springer.com/content/pdf/10.1007/978-0-387-21760-4_10.pdf
Polarized Transport of Hydrophilic Compounds Across Rat Colonic ...,https://www.gastrojournal.org/article/S0016-5085(00)70259-9/pdf
Polypoid endometrioma of the rectal serosa and retroperitoneal ...,https://www.tandfonline.com/doi/pdf/10.1080/00313020310001643570
Trophoblast and Serosa. A Contribution to the Morphology of the ...,https://journals.biologists.com/jcs/article-pdf/s2-41/164/589/1454247/589.pdf
[PDF] Massive malignant solitary fibrous tumor arising from the bladder ...,https://jmedicalcasereports.biomedcentral.com/track/pdf/10.1186/s13256-014-0505-4.pdf
[PDF] Distinct Functions of the Tribolium zerknu¨llt Genes in Serosa ...,https://core.ac.uk/download/pdf/81132835.pdf
[PDF] JKSS - KoreaMed Synapse,https://synapse.koreamed.org/upload/synapsedata/pdfdata/5037jkss/jkss-81-19.pdf
Otitis Serosa - PatientPop.com,https://sa1s3.patientpop.com/assets/docs/70073.pdf
"(ANGIONEUROTICA), AND SEROSA ALLERGICA, Guist, Reh, Hery ...",https://bjo.bmj.com/content/bjophthalmol/25/8/369.full.pdf
[PDF] S2.11 The appearance of the serosa must be recorded. - RCPA,https://www.rcpa.edu.au/Library/Practising-Pathology/Structured-Pathology-Reporting-of-Cancer/Docs/P09_S2_11
SEROSA LINED BOWEL WALL IMBRICATION AS A CONTINENT ...,https://www.auajournals.org/doi/pdf/10.1016/S0022-5347%252805%252968005-6
[PDF] Laparoscopic Management of a Translocated Intrauterine Device ...,http://www.jpma.org.pk/PdfDownload/3027.pdf
Chronic Postoperative or Posttraumatic Retinitis (Retinitis Serosa),https://www.ajo.com/article/S0002-9394(36)92569-2/pdf
[PDF] Hysteroscopic myomectomy in a submucous fibroid 3 mm from the ...,https://gynecolsurg.springeropen.com/track/pdf/10.1007/s10397-006-0242-9.pdf
"Functional Results, Complications Associated with the Serosa-lined ...",https://www.eu-focus.europeanurology.com/article/S2405-4569(20)30094-8/pdf
Hypertrophy of mucosa and serosa in the obstructed intestine of rats,https://www.cambridge.org/core/services/aop-cambridge-core/content/view/6FF1F46BA68A2B20F2395BC086C6838C/S0021878201008743a.pdf/div-class-title-hypertrophy-of-mucosa-and-serosa-in-the-obstructed-intestine-of-rats-div.pdf
Surface microdialysis on small bowel serosa in monitoring of ischemia,https://www.journalofsurgicalresearch.com/article/S0022-4804(16)30010-5/pdf
[PDF] SMALL BOWEL (for TUMOR) Procedure: 1. Measure the length and ...,http://pathology.ucla.edu/workfiles/Education/Residency%2520Program/Gross%2520Manual/Small%2520Bowel%2520(Neoplastic).pdf
