[PDF] adventures of an oxy-phile,https://perf2ndwind.org/tompetty/Adventures%2520of%2520an%2520Oxyphile.pdf
Adventures of an Oxy-Phile - Respiratory Care,http://rc.rcjournal.com/content/respcare/50/12/1669.full.pdf
Oxyphile cells in the parathyroid glands of the cow and steer,https://anatomypubs.onlinelibrary.wiley.com/doi/pdf/10.1002/ar.1090390211
The function of the parathyroid oxyphil cells in uremia,https://www.kidney-international.org/article/S0085-2538(17)30484-2/pdf
Functioning Oxyphil Cell Adenomas of Parathyroid Gland:,https://academic.oup.com/ajcp/article-pdf/78/5/681/26429624/ajcpath78-0681.pdf
Oxyphilic Granular Hepatocytes,https://academic.oup.com/ajcp/article-pdf/74/4/432/24882795/ajcpath74-0432.pdf
The angiographic appearance of benign renal oxyphilic adenoma,https://www.ajronline.org/doi/pdf/10.2214/ajr.127.5.717
Oxyphil cells in thyroid disease: a uniform change?,https://jcp.bmj.com/content/jclinpath/39/8/908.full.pdf
Oxyphil Cell Metaplasia in the Parathyroids Is Characterized by ...,https://ajp.amjpathol.org/article/S0002-9440(14)00433-7/pdf
[PDF] Parathyroid,https://medicine.osu.edu/-/media/files/medicine/departments/otolaryngology/atlas-of-head-and-neck-pathology/p/parathyroid2.pdf%3Fla%3Den%26hash%3DB581F982AFE165A878EE4C97ED640B2D0AFD2BA4
