International Condemnation of Russian Aggression in Ukraine ...,https://www.mzv.cz/islamabad/en/public_diplomacy/international_condemnation_of_russian.rss
The Czech Republic Stands Shoulder to Shoulder with France - MZV,https://www.mzv.cz/washington/en/czech_u_s_relations/news/czech_republic_s_condolences_for_lives.rss%3Fforce_format%3Dmobile
Pumpkin festival turns to mayhem in New Hampshire ... - Toledo Blade,https://www.toledoblade.com/news/Nation/2014/10/19/Pumpkin-festival-turns-to-mayhem-in-New-Hampshire-leading-to-injuries-arrests-tear-gas/stories/feed/index.rss
Pumpkin festival turns to mayhem in New ... - The Toledo Blade,https://www.toledoblade.com/Nation/2014/10/19/Pumpkin-festival-turns-to-mayhem-in-New-Hampshire-leading-to-injuries-arrests-tear-gas/stories/feed/index.rss
Is This Going To Cause An Argument - Audioboom,https://audioboom.com/channels/5024577.rss
which newspaper | Beekeeping & Apiculture Forum,https://beekeepingforum.co.uk/blogs/authors/10739/index.rss
Temples Made With Hands - Buzzsprout,https://feeds.buzzsprout.com/1924514.rss
