Honor Cultures and Violence - Criminology - Oxford Bibliographies,https://www.oxfordbibliographies.com/view/document/obo-9780195396607/obo-9780195396607-0160.xml
Awards and Honors | MissionSquare - ICMA-RC,http://fairfax457.com/x3166.xml
Supervisor Shirlee Zane Honored as Exceptional Advocate for ...,https://sonomacounty.ca.gov/x20392.xml
More Honored in the Breach? Representations of Honor in ... - Brill,https://brill.com/view/book/9789004395695/BP000004.xml%3Flanguage%3Den
Education Honor Society | Curry College,https://www.curry.edu/x733.xml
Lambda Alpha Criminal Justice Honor Society | Curry College,https://www.curry.edu/x723.xml
MAURY HONORED in - AMS Journals,https://journals.ametsoc.org/abstract/journals/bams/12/5/1520-0477-12_5_102c.xml
The Undergraduate Honors Program in the Biological Sciences,https://www.duq.edu/x2310.xml
Who Are We Honoring? Extending the Ebony & Ivy Discussion to ...,https://journals.humankinetics.com/view/journals/jsm/35/1/article-p17.xml
