Factors affecting excitatory amino acid release following severe ...,https://thejns.org/view/journals/j-neurosurg/89/4/article-p507.xml
Role of excitatory amino acid pathways in control of gonadotrophin ...,https://rep.bioscientifica.com/view/journals/rep/113/1/jrf_113_1_007.xml
Competition and Homeostasis of Excitatory and Inhibitory ...,https://journals.scholarsportal.info/details/10473211/v25i0010/3713_cahoeaitamvc.xml
Characterization of serotonin-induced inhibition of excitatory ...,https://journals.scholarsportal.info/details/17566606/v10inone/nfp_cosioetitacc.xml
Inhibitory and excitatory neurotransmitters in the ... - AVMA Journals,https://avmajournals.avma.org/view/journals/ajvr/65/8/ajvr.65.8.1108.xml
Inhibitory and excitatory neurotransmitters in the ... - AVMA Journals,https://avmajournals.avma.org/downloadpdf/journals/ajvr/65/8/ajvr.65.8.1108.xml
Introduction - PLOS,https://www.tools.wmflabs.org/opendatasets/plos/extracted/pbio.0040207.xml
Excitatory Effects of Intromission in Mating Behaviour of the Male Rat ...,https://brill.com/view/journals/beh/16/1-2/article-p66_3.xml%3Flanguage%3Den
biorxiv BIORXIV bioRxiv bioRxiv Cold Spring Harbor Laboratory ...,https://www.biorxiv.org/content/biorxiv/early/2020/09/24/2020.09.24.311852.source.xml
