"Do Your Brexit Duty, Britain's May Tells Her Divided Government",https://www.irishsun.com/news/257624776/oct04v56.flv
Afghan President Rejects Resignations of Top Security Officials,https://www.northkoreatimes.com/news/257895331/oct04v56.flv
"Iran oil tanker collides off China's coast, dozens missing",https://www.northkoreatimes.com/news/256003001/feb24v21.flv
Kerala floods: Death toll reaches 29 - Big News Network.com,https://www.philippinetimes.com/news/257822717/oct04v40.flv
step sister caught brother sniffing her panties - Free Videos online.FLV,https://www.xnxx.com/video-3hwhd76/step_sister_caught_brother_sniffing_her_panties_-_free_videos_online.flv
Dozens die in Nicaragua's bloodiest day of clashes,https://www.riodejaneirosun.com/news/257645576/oct04v56.flv
