Role of Eastern Ghats Orography and Cold Pool in an Extreme ...,https://journals.ametsoc.org/view/journals/mwre/146/4/mwr-d-16-0473.1.xml
Numerical Study of Physical Processes Controlling Summer ...,https://journals.ametsoc.org/view/journals/clim/31/8/jcli-d-17-0002.1.xml
Estimating population sizes of leopard cats in the Western Ghats ...,https://bioone.org/journals/journal-of-mammalogy/volume-96/issue-4/gyv079/Estimating-population-sizes-of-leopard-cats-in-the-Western-Ghats/10.1093/jmammal/gyv079.xml
Untitled,https://se.copernicus.org/preprints/3/1/2011/sed-3-1-2011.xml
"Genus Diplasiolejeunea (Lejeuneaceae, Porellales) New to India ...",https://akjournals.com/view/journals/034/63/3-4/article-p285.xml
Spatio-temporal precipitation variability over Western Ghats and ...,https://journals.scholarsportal.info/details/23636203/v03i0004/1611_spvowguhrogd.xml
A newPiperfrom the northern Western Ghats and notes on economic ...,https://journals.scholarsportal.info/details/09259864/v61i0006/1057_antnwganoepo.xml
Behavioural Variability in Macaques and Langurs of the Western ...,https://brill.com/view/journals/ijfp/88/3/article-p293_5.xml
"DNA barcoding, phylogeny and systematics of Golden-backed frogs ...",https://brill.com/view/journals/ctoz/83/4/article-p269_4.xml%3Flanguage%3Den
