Chapter 2 Philosophical Principles and Commandments in: The ...,https://brill.com/view/book/9789004465824/BP000003.xml%3Flanguage%3Den
Chapter 5 Existentialism in - Brill,https://brill.com/view/book/9789004465824/BP000007.xml
The Enigma of Consciousness – Philosophic and Scientific Approach,https://www.degruyter.com/view/j/acm.2016.16.issue-2/acm-2016-0010/acm-2016-0010.xml%3Fformat%3DINT
The Courage of Conviction: Andreia as Precondition for Philosophic ...,https://journals.scholarsportal.info/details/09608788/v23i0003/438_tcocaaeippar.xml
Plato on Philosophic Character | Scholars Portal Journals,https://journals.scholarsportal.info/details/15384586/v25i0003/325_popc.xml
Leadership and the Unmasking of Authenticity - Elgaronline,https://www.elgaronline.com/view/edcoll/9781786430984/9781786430984.xml
Marialuisa Baldi - Oxford Bibliographies,https://www.oxfordbibliographies.com/ViewContributor/document/obo-9780195399301/obo-9780195399301-0344.xml%3Fid%3Dcon7187
"DIOGENES LAERTIUS, Lives of Eminent Philosophers, Volume I ...",https://www.loebclassics.com/view/LCL184/1925/pb_LCL184.xvii.xml
"Cosmic matters: Spenser, Donne, and the philosophic poem",https://www.manchesterhive.com/downloadpdf/9781526117366/9781526117366.00013.xml
Philosophic Inquiry in Sport in: Sociology of Sport Journal Volume 6 ...,https://journals.humankinetics.com/view/journals/ssj/6/2/article-p178.xml
