NMAH.AC.0993 Hayward (Bartlett) Company Records Guide to the ...,https://sirismm.si.edu/EADs/NMAH.AC.0993-ead.xml
SECTION F MECHANICAL ENGINEERING LIGHTING HEATING ...,ftp://ftp.wipo.int/pub/itos4ipc/ITSupport_and_download_area/20090101/subclass/core/en/xml/F17B.xml
"Director, Regulatory Support Division. - Federal Register",https://www.federalregister.gov/documents/full_text/xml/2022/05/26/2022-11348.xml
"Director, Regulatory Support Division. - Federal Register",https://www.federalregister.gov/documents/full_text/xml/2022/03/16/2022-05510.xml
"ACCOUNTS, NATURAL GAS ACT - Govinfo.gov",https://www.govinfo.gov/content/pkg/CFR-2021-title18-vol1/xml/CFR-2021-title18-vol1-chapI-subchapF.xml
XML - Govinfo.gov,https://www.govinfo.gov/content/pkg/CFR-2020-title29-vol5/xml/CFR-2020-title29-vol5.xml
sitemap-2017-13-a.xml - The Telegraph,https://www.telegraph.co.uk/property/sitemap-2017-13-a.xml
image-sitemap-3.xml - The Historic England Blog,https://heritagecalling.com/image-sitemap-3.xml
Further Application of Weather Information 1 - AMS Journals,https://journals.ametsoc.org/downloadpdf/journals/bams/44/2/1520-0477-44_2_72.xml
