Hearty stew will warm you up during dull month of January | The Blade,https://www.toledoblade.com/Food/2017/01/17/Hearty-stew-will-warm-you-up-during-dull-month-of-January/stories/feed/index.rss
Hearty bowl of chili is good football food - Toledo Blade,https://www.toledoblade.com/Food/2013/02/03/Hearty-bowl-of-chili-is-good-football-food/stories/feed/feed/index.rss
Hearty Lopez (@heartylopez) | Lookbook,https://lookbook.nu/user/1358349-Hearty-L/looks.rss
The 10 UK Foods You Have To Try (and Why) - Eating Europe,https://www.insider.com/foods-everyone-should-try-in-london-2015-8/food.rss
IN The Grill Room with Bob & Jay - Audioboom,http://audioboom.com/channels/4273118.rss
Never Knowingly Understood - Audioboom,https://audioboom.com/channels/4917945.rss
Human Being Human Podcast - Buzzsprout,https://feeds.buzzsprout.com/281659.rss
EU Open House 2018 - May 12 | Embassy of the Czech Republic in ...,https://www.mzv.cz/washington/en/culture_events/news/eu_open_house_2018_may_12.rss
HomeWithEU: Experience European Culture without Leaving Home,https://www.mzv.cz/chicago/en/culture_events/homewitheu_experience_european_culture.rss
