watch the hottest brunette ever fucking her pussy(4).flv - Xvideos.com,https://www.xv-videos1.com/video2010002/watch_the_hottest_brunette_ever_fucking_her_pussy_4_.flv
watch the hottest brunette ever fucking her pussy(4).flv - Xvideos.com,https://www.xvideos3.com/video2010002/watch_the_hottest_brunette_ever_fucking_her_pussy_4_.flv
cute blonde strips and fucks herself(3).flv - XVIDEOS.COM,https://www.xvideos.com/video2203711/cute_blonde_strips_and_fucks_herself_3_.flv
c26fb246845defb71e19edef5ed1f57d7b6c06cc.flv - XVIDEOS.COM,https://danhchotre.com/video15067801/c26fb246845defb71e19edef5ed1f57d7b6c06cc.flv%3Fpl%3D51031833%26plname%3Dsolia
DaringSex Busty MILF se fait prendre en train de se masturber,https://fr-shemale.xvideoshq.tv/video9429404/daringsex_busty_milf_se_fait_prendre_en_train_de_se_masturber_-_xvideos.com.flv
65196.FLV - XVIDEOS.COM - Vídeos pornô gratuitos,https://pt.xvideos65.com/video27290119/65196.flv
professora peituda fodida beijada.flv 10 minutos - Vídeos pornô ...,https://pt.xvideos65.com/video3733404/professora_peituda_fodida_beijada.flv
blonde shows her pussy and fingers herself with pleasure(2).flv,https://www.xnxx.tv/video-19rflf0/blonde_shows_her_pussy_and_fingers_herself_with_pleasure_2_.flv
watch the hottest brunette ever fucking her pussy(4).flv - XNXX.COM,http://www.xnxx.tv/video-172xee8/watch_the_hottest_brunette_ever_fucking_her_pussy_4_.flv
jordania mabada monte nebo.flv دیدئو dideo,https://www.dideo.ir/v/yt/jhQEfgLiadE/jordania-mabada-monte-nebo.flv
