Fine Structure of the Envelope and Micropyles in the Eggs of the ...,https://onlinelibrary.wiley.com/doi/pdf/10.1111/j.1440-169X.1982.00341.x
The ecological function of insect egg ... - British Ecological Society,https://besjournals.onlinelibrary.wiley.com/doi/pdf/10.1111/1365-2435.14023
Comparative morphology and morphometry of the micropyle of two ...,https://bioone.org/journals/journal-of-vertebrate-biology/volume-70/issue-1/jvb.20130/Comparative-morphology-and-morphometry-of-the-micropyle-of-two-Korean/10.25225/jvb.20130.pdf
[PDF] The ecological function of insect egg ... - The Lincoln Repository,https://eprints.lincoln.ac.uk/48068/1/The%2520ecological%2520function%2520of%2520egg%2520micropyles_accepted.pdf
Micropyle number is associated with elevated female promiscuity in ...,https://royalsocietypublishing.org/doi/pdf/10.1098/rsbl.2016.0782
Ultrastructural features of chorion and micropyles in eggs of ...,https://www.tandfonline.com/doi/pdf/10.1080/11250009009355712
Investigating reproductive success of the ladybird beetle Harmonia ...,https://www.nature.com/articles/s41598-019-49249-z.pdf%3Fproof%3Dtr
Sperm Attractant in the Micropyle Region of Fish and Insect Eggs,https://academic.oup.com/biolreprod/article-pdf/doi/10.1095/biolreprod.112.105072/10582548/biolreprod0047.pdf
The Role of the Micropyle in the Pollination of Pinus - jstor,https://www.jstor.org/stable/2473526
[PDF] The Drosophila micropyle as a system to study how epithelia build ...,http://shb-lab.org/PDFs/Horne-Badovinac%2520Micropyle%2520Review%25202020.pdf
The Role of the Micropyle in the Pollination of Pinus,https://www.journals.uchicago.edu/doi/pdf/10.1086/336010
[PDF] Micropyle number is associated with elevated female promiscuity in ...,https://core.ac.uk/download/pdf/76999949.pdf
The nucellar epidermis and micropyle of Ornithogalum caudatum ...,https://cdnsciencepub.com/doi/pdf/10.1139/b80-216
The structure of the micropyles of Lytta nuttalli Say and L. viridana ...,https://cdnsciencepub.com/doi/pdf/10.1139/z70-159
[PDF] Ultrastructure of the chorion and the micropyle of an endemic ...,https://aquadocs.org/bitstream/handle/1834/11528/IFRO-v11n3p657-en.pdf%3Fsequence%3D3%26isAllowed%3Dy
Micropyle of some salmonins and coregonins,https://link.springer.com/content/pdf/10.1007/BF00000950.pdf
[PDF] Grooves surrounding the micropyle decrease the inseminating dose ...,https://repositorio.unesp.br/bitstream/handle/11449/163670/WOS000418839900007.pdf%3Fsequence%3D1
Fine Structures of the Micropyles of Pelagic Eggs of Some Marine ...,https://www.jstage.jst.go.jp/article/jji1950/35/3/35_3_351/_pdf
[PDF] Variation in butterfly eggs is driven by female promiscuity - Phys.org,https://phys.org/pdf401531836.pdf
Termite queens close the sperm gates of eggs to switch from ... - PNAS,https://www.pnas.org/doi/pdf/10.1073/pnas.1412481111
