125 Category:Fittings>Type:17mm>Manufacturer:Netafim 376 ...,https://www.mtncom.net/store-files/mls/All%2520Products/Turf/Drip/Product.txt
1719 Category:Drip Tubing>Material:Poly>Brand:Salco 48349 ...,https://www.mtncom.net/store-files/mls/All%2520Products/Turf/Pipe%2520%26%2520Tubing/Product.txt
"Event Name, Tuesday Morn, February 11, 2020 RESULTS OF ...",http://www.austinbridge.org/sbruce/results/20/02/200211M.TXT
"Tuesday Afternoon Pairs, Tuesday Aft, November 13, 2018 ...",http://www.austinbridge.org/sbruce/results/18/11/181113A.TXT
"Full text of ""Astra Pack (10) Tower Of Babel - Internet Archive",https://archive.org/stream/AstraPack_Tower_Of_Babel_Amiga/_Manual02_200_djvu.txt
"Full text of ""MOCAGH.ORG: Rainbird Software: pawn amigaguide""",https://archive.org/stream/vgmuseum_rainbird_pawn-amigaguide/pawn-amigaguide_djvu.txt
Magnetic Scrolls Fact Sheet - The Interactive Fiction Archive,https://www.ifarchive.org/if-archive/magnetic-scrolls/info/msfact.txt
She sits alone Reading by the light of a fire She hears the distant ...,https://www.oocities.org/trial_5/rainbird.txt
Rain Garden Links Rain Gardens A how-to manual for homeowners ...,http://npsnj.org/PDFs/rain_garden_links.txt
Synonyms file for Apache Solr generated by Search API Synonym ...,https://www.rainbird.com/sites/default/files/synonyms/synonyms__lang_en__type_all__filter_nospace.txt
