phonology - Brill,https://brill.com/previewpdf/book/9789047440628/Bej.9789004178274.i-490_003.xml
Illustrations in: Click Consonants - Brill,https://brill.com/view/book/edcoll/9789004424357/front-7.xml%3Flanguage%3Den
Impacts of Small-Scale Urban Encroachment on Air ... - AMS Journal,https://journals.ametsoc.org/downloadpdf/journals/apme/58/6/jamc-d-19-0002.1.xml
Impacts of Small-Scale Urban Encroachment on Air Temperature ...,https://journals.ametsoc.org/view/journals/apme/58/6/jamc-d-19-0002.1.xml
Masked Auditory Feedback Affects Speech Motor Learning of a ...,https://journals.humankinetics.com/view/journals/mcj/15/1/article-p68.xml
"ARISTOPHANES, Attributed Fragments | Loeb Classical Library",https://www.loebclassics.com/view/aristophanes-attributed_fragments/2008/pb_LCL502.225.xml
Contact effects on voice-onset time (VOT) in Patagonian Welsh ...,https://journals.scholarsportal.info/details/00251003/v50i0002/153_ceovtipw.xml
The Phonetics of VOT and Tone Interaction in Cantonese Holman ...,http://d-scholarship.pitt.edu/cgi/export/25258/MODS/d-scholarship-25258.xml
Austrian Positioning Service APOS - Administrator 2021-08-19 ...,ftp://gnss-metadata.eu/station/xml/PFA300AUT.xml
