Iranian UN Envoy Condemns Israel's 'Racist' Law - Politics news,https://www.iranherald.com/news/257730691/oct04v56.flv
Russia Dumped U.S. Bond Holdings This Year Amid U.S. Sanctions ...,https://www.bangladeshsun.com/news/257703785/oct04v40.flv
Meet the Funding Recipients - IDHS,https://www.dhs.state.il.us/page.aspx/FACT_1WhatIsVR.flv%3Fitem%3D128226
"Putin Not Welcome In Congress If He Visits Washington, Leaders Say",https://www.stpetersburgstar.com/news/257730682/oct04v56.flv
"The Week In Russia: Spies, 'Scumbags,' And Senior Citizens",https://www.birminghamnews.com/news/258086108/oct04v40.flv
"[PDF] Parsi Theater, Urdu Drama, and the Communalization of Knowledge",https://minio.la.utexas.edu/colaweb-prod/profile/custom_pages/0/119/parsi_theater_urdu_drama_and_the_communa_51b7a927-cb02-4217-9c55-0726dcb7b8bf.flv
Saudi Crown Prince: 'We Did Our Job' Replacing Iranian Oil,https://www.southamericatimes.com/news/258088815/oct04v40.flv
