Replacement of Spinal Intervertebral Discs with Locally ...,https://thejns.org/view/journals/j-neurosurg/16/3/article-p311.xml
Rapid polymerizing fibrin glue from autologous or single-donor blood,https://thejns.org/view/journals/j-neurosurg/76/4/article-p626.xml
[PDF] Miniemulsion polymerization as a versatile tool for the synthesis of ...,https://journals.scholarsportal.info/pdf/18605397/v6inone/1132_mpaavtftsofp.xml
Prefabricated light-polymerizing plastic pattern for partial denture ...,https://journals.scholarsportal.info/details/0976237x/v02i0004/402_plppfpdf.xml
Preparation of Hazardous Materials for Transportation - GovInfo,https://www.govinfo.gov/content/pkg/CFR-2018-title49-vol2/xml/CFR-2018-title49-vol2-part173-subpartB.xml
"Class 4, Divisions 4.1, 4.2 and 4.3-Definitions. - GovInfo",https://www.govinfo.gov/content/pkg/CFR-2018-title49-vol2/xml/CFR-2018-title49-vol2-sec173-124.xml
Radiation induced polymerization of isoprene - Springer LINK,https://akjournals.com/view/journals/10967/275/1/article-p9.xml
Atom Transfer Radical Polymerization in Continuous Microflow,https://akjournals.com/downloadpdf/journals/1846/4/2/article-p92.xml
"In guinea pig sperm, aldolase A forms a complex with actin, WAS ...",https://rep.bioscientifica.com/view/journals/rep/137/4/669.xml
