Kinetics and mechanism of oxidation of quinols by hexachloroiridate ...,https://pubs.acs.org/doi/pdf/10.1021/j100908a014
Quinol intermediates in the reaction of .pi.-allylnickel bromides with ...,https://pubs.acs.org/doi/pdf/10.1021/ja00479a030
NATURALLY OCCURRING QUINOLS AND QUINONES STUDIED ...,https://www.sciencedirect.com/science/article/pii/S0031942200942250/pdf%3Fmd5%3D605eead781b0dae303ec14b9b3001dd3%26pid%3D1-s2.0-S0031942200942250-main.pdf
The pathways of redox equilibration of quinols and quinones have ...,https://www.sciencedirect.com/science/article/pii/0005272881902061/pdf%3Fmd5%3D5dd313cefd0990b8cd630b7feb3347de%26pid%3D1-s2.0-0005272881902061-main.pdf
4-Phenyl-quinol and its Innermolecular Rearrangements.,https://www.journal.csj.jp/doi/pdf/10.1246/bcsj.18.93
The Oxidation of Quinols by Mitochondrial Preparations,https://onlinelibrary.wiley.com/doi/pdf/10.1002/9780470719213.ch7
Quinol-based cyclic antioxidant mechanism in estrogen ... - PNAS,https://www.pnas.org/doi/pdf/10.1073/pnas.2032621100
Some Piperidinomethyl Quinols and Quinones,https://www.publish.csiro.au/ch/pdf/CH9761163
"p-Quinols and p-Quinol Ethers from 2,4,6-Trialkylphenols",https://www.thieme-connect.com/products/ejournals/pdf/10.1055/s-0029-1217127.pdf
"The Possible Function of Quinols, Chromanols and Chromenols in ...",https://academic.oup.com/ajcn/article-pdf/9/4/50/24199871/50.pdf
