The Forest World - Texas Archive of the Moving Image,https://texasarchive.org/2009_00191.flv
Thai Shrimp Industry Care the Environment.flv - Ecology Gateway,https://www.ecologygateway.com/76272/Ashley%2520Bell/Department%2520Fisheries/Environment%2520care/Thai%2520Shrimp%2520Industry%2520Care%2520the%2520Environment.flv
Researchers Simulate Fukushima Radiation Spread Because ...,https://index.ecologicalblog.com/325731/university/pollution/radioactive/Researchers-Simulate-Fukushima-Radiation-Spread-Because-Studying-Current-Effects-Makes-No-Sense.flv
"Hard to See, Hard to Breathe: US West Struggles with Smoke",https://www.batonrougepost.com/news/257869547/oct04v56.flv
World Tourism Day: harnessing new technologies to transform travel,https://www.northkoreatimes.com/news/258052055/oct04v56.flv
[PDF] Global fishery prospects under contrasting management regimes,http://lista.oannes.org.pe/pipermail/oannes-oannes.org.pe/attachments/20160405/65a80e49/attachment-0004.flv
EU Lays Out Accession Path For Balkan Countries - Radio Free ...,https://www.dublinnews.com/news/256383024/oct04v40.flv
"Russia, Saudi Arabia 'Quietly' Agree To Lift Oil Production",https://www.illinoisintelligencer.com/news/258080967/oct04v40.flv
Wagga Wagga's message for the Morrison Muppet Show,https://www.australianherald.com/news/257959380/oct04v56.flv
psyc3203-12-1-11-del-2.flv - Det samfunnsvitenskapelige fakultet,https://www.sv.uio.no/tjenester/kunnskap/videoopptak-lydopptak-med-podcastmulighet/videoer/psyc3203-12-1-11-del-2.flv%3Fvrtx%3Dview-as-webpage
