Electronic Supplementary Information Sheetlike Gold nanostructures ...,http://www.rsc.org/suppdata/c7/ra/c7ra11188f/c7ra11188f1.pdf
Study of Sheetlike BiOI/Rodlike Bi5O7I Composite Photocatalyst by ...,https://pubs.acs.org/doi/pdf/10.1021/acs.energyfuels.1c01072
MOF-Derived Hierarchical CoSe2 with Sheetlike Nanoarchitectures ...,https://pubs.acs.org/doi/pdf/10.1021/acs.inorgchem.0c01828
Topology and Spin Polarization in Sheetlike Metal(II) Polymers,https://www.tandfonline.com/doi/pdf/10.1080/10587259908023352
Sheet-Like Remodeling of the Transverse Tubular System in Human ...,https://www.ahajournals.org/doi/pdf/10.1161/CIRCULATIONAHA.116.024470%3Fdownload%3Dtrue
Hydraulics of Sheetlike Solution Cavities - by Gerald K. Mooreb - Wiley,https://ngwa.onlinelibrary.wiley.com/doi/pdfdirect/10.1111/j.1745-6584.1973.tb02976.x
Sheetlike plumes near a heated bottom plate at large Rayleigh ...,https://agupubs.onlinelibrary.wiley.com/doi/pdf/10.1029/JC089iC01p00727
Observation of a Large-Scale Sheetlike Current Filament in a Thin n ...,https://journals.jps.jp/doi/pdf/10.1143/JPSJ.59.420
Microcalorimeter for measuring heat of straining or destraining of ...,https://aip.scitation.org/doi/pdf/10.1063/1.1686644
The Compositionally-zoned Sheet-like Granite Pluton of the ...,https://academic.oup.com/petrology/article-pdf/30/6/1383/4314068/30-6-1383.pdf
