Where to Submit Application - Territorial Competence - MZV,https://www.mzv.cz/jnp/en/information_for_aliens/long_stay_visa/where_to_submit_application_territorial/index.rss
Where to Submit Application | Ministry of Foreign Affairs of the Czech ...,https://www.mzv.cz/jnp/en/information_for_aliens/where_to_submit_application/index.rss
Do512 Family,https://do512.com/family.rss
Atlanta Theatre Life - Audioboom,https://audioboom.com/channels/4932337.rss
Where To Stick It - Buzzsprout,https://feeds.buzzsprout.com/1618561.rss
Want to become a Dr.?What to do.. where to go... - Career Guide,http://www.counselling.meracareerguide.com/t/want-to-become-a-dr-what-to-do-where-to-go/1165.rss
"Detroit vs. Green Bay: Where to watch, how to listen | The Blade",https://www4.toledoblade.com/sports/pro/2018/10/04/detroit-lions-vs-green-bay-packers-how-watch-listen-stream/stories/feed/feed/index.rss
"Cleveland vs. Kansas City: Where to watch, how to listen | The Blade",https://www.toledoblade.com/sports/pro/2018/11/01/cleveland-browns-vs-kansas-city-cheifs-how-watch-listen-stream/stories/feed/index.rss
Christmas in Birmingham,https://visitbirmingham.com/christmas/christmas-competitions/win-a-cadbury-family-pass-this-christmas/.rss
