Steady Admiration in an Expanding Present: On Our New ... - Brill,https://brill.com/view/book/edcoll/9789401209045/B9789401209045-s010.xml
Kitāb dhamm al-kibr wa'l-ʿujb: Book XXIX of the Revival of the ... - Brill,https://brill.com/view/journals/alab/69/1/article-p244_11.xml
"Admiration, ambivalence, antipathy: the past and future for US ...",https://www.elgaronline.com/view/edcoll/9781782544364/9781782544364.00035.xml
"Chapter 24: Admiration, ambivalence, antipathy: the past and future ...",https://www.elgaronline.com/abstract/edcoll/9781782544364/9781782544364.00035.xml
Péguy et Hugo: une admiration réticente in: Verbum Volume 5 Issue ...,https://akjournals.com/view/journals/094/5/1/article-p5.xml
Relevance Statement - Personality Science,https://ps.psychopen.eu/index.php/ps/article/view/7293/7293.xml
Ethical codes and corporate responsibility of the most admired ...,http://www.degruyter.com/view/j/bap.2012.14.issue-4/bap-2012-0044/bap-2012-0044.xml
To D. T. Gardner [c. 27 August 1874] 1,https://www.darwinproject.ac.uk/letter/DCP-LETT-9601.xml
Aberrant consumers: Selfies and fat admiration websites | Scholars ...,https://journals.scholarsportal.info/details/21604851/v06i0002/206_acsafaw.xml
Admirable Numbers and Compatible Pairs in - NCTM,https://pubs.nctm.org/abstract/journals/at/7/6/article-p293.xml
