Specificity and sensitivity of commercially available assays for ...,https://eje.bioscientifica.com/view/journals/eje/170/4/529.xml
Problems with GH assays and strategies toward standardization in,https://eje.bioscientifica.com/view/journals/eje/159/suppl_1/S41.xml
Understanding lipase assays in the diagnosis of pancreatitis in ...,https://avmajournals.avma.org/view/journals/javma/aop/javma.22.03.0144/javma.22.03.0144.xml
Development and validation of real-time PCR assays based ... - Brill,https://brill.com/view/journals/nemy/19/7/article-p789_2.xml%3Flanguage%3Den
Biomarker assays bioanalytical meetings CLIA | Webinar - ICON plc,https://www.iconplc.com/news-events/events/webinars/biomarker-assays-bioanalytical-meets-clia/index.xml
Designing and Interpreting Limiting Dilution Assays - Oxford Academic,https://journals.scholarsportal.info/pdf/23288957/v02i0004/nfp_daildalrfhiv.xml
vitro assays for tumorigenicity assessment of CRISPR-Cas9 genome ...,https://journals.scholarsportal.info/pdf/23290501/v23icomplete/241_eotiaftaocgc.xml
Assays to Assess Freeze Injury of Satsuma Mandarin in,https://journals.ashs.org/hortsci/view/journals/hortsci/37/6/article-p871.xml
Multigene Assays in Metastatic Colorectal Cancer in - JNCCN,https://jnccn.org/view/journals/jnccn/11/suppl_4/article-pS-9.xml
