Excited state tracking during the relaxation of coordination compounds,https://europepmc.org/articles/pmc8247441/bin/jcc-40-1420-s001.7z
Use of Wishart Prior and Simple Extensions for Sparse Precision ...,https://europepmc.org/articles/pmc4734711/bin/pone.0148171.s001.7z
Design of half and full optical binary adders using the polarization ...,https://ui.adsabs.harvard.edu/abs/2007SPIE.6695E...7Z
Flux-density measurements of some radio sources at 1-5 MM,https://adsabs.harvard.edu/full/1975SvAL....1....7Z
"A powerful, cross platform, SQL database system - Download ...",https://qa.debian.org/watch/sf.php/firebird/firebird-net-provider/5.0.0.0/NETProvider-5.0.0.0-src.7z
Download Firebird from SourceForge.net - Debian QA,https://qa.debian.org/watch/sf.php/firebird/FirebirdSql.Data.FirebirdClient-4.8.1.0-NET45.7z
Cialis Prijs Nederland - Erectie Medicijnen Kopen,https://www.annemariehaverkamp.nl/.wp-config.7z
Libido Pillen - Apcalis - Annemarie Haverkamp,https://www.annemariehaverkamp.nl/.wp-config.php.7z
"A Boltom: jó áron, szinte minden! - aboltom.com",https://aboltom.com/Aut%25C3%25B3/Audi%25C3%25B3%252C%2520Vide%25C3%25B3/index.php/download/firmware%2Bdriver/217.GS8000%2520Full%2520HD%2520Car%2520Camera%2520Dashcam%2520DVR%2520with%2520GPS%2520logger%2520CD.7z
