Description of Free Library of Philadelphia Lewis O 5: al-Qurʼān.,https://openn.library.upenn.edu/Data/0023/lewis_o_005/data/lewis_o_005_TEI.xml
Description of Free Library of Philadelphia Lewis O 28: Dalāʼil al ...,https://openn.library.upenn.edu/Data/0023/lewis_o_028/data/lewis_o_028_TEI.xml
AL-AZHAR MOSQUE: AN ARCHITECTURAL CHRONICLE OF ... - Brill,https://brill.com/previewpdf/journals/muqj/13/1/article-p45_5.xml
"Stone, Metal, Wood and Worked Bone Finds from the 1926 ... - Brill",https://brill.com/previewpdf/book/edcoll/9789004307766/B9789004307766_020.xml
Foreign imitations of the English noble - American Numismatic Society,http://numismatics.org/digitallibrary/ark:/53695/nnan64111.xml
CKD F.R.Mコンビネーション 白色シリーズ 1個 【NEW限定品 ...,https://renatabarroso.com.br/floriated/11/news/kd-front-sitemaps.xml
"A Most Certain, Strange, and True Discovery of a Witch.",http://roominhistory.com/Witches/content/DiscoveryofaWitch.xml
places can be found in the monasteries of Dayr al-Qalt and ... - Brill,https://brill.com/previewpdf/book/9789047424161/Bej.9789004170858.i-236_005.xml
