Authorized set-aside activities. - Govinfo.gov,https://www.govinfo.gov/content/pkg/CFR-2014-title40-vol1/xml/CFR-2014-title40-vol1-sec35-3535.xml
Catastrophes Aside: Environment and the End of Antiquity in - Brill,https://brill.com/abstract/book/9789004392083/BP000039.xml
XML - Utah Legislature,https://le.utah.gov/xcode/Title63N/Chapter7/C63N-7-S301_2022050420220701.xml
Community Development Block Grant - County Of Sonoma,https://sonomacounty.ca.gov/x90664.xml
"Director, Office of Atmospheric Programs. - Federal Register",https://www.federalregister.gov/documents/full_text/xml/2022/04/05/2022-07152.xml
Smart Employee Benefit Decisions This Fall - ICMA-RC,http://fairfax457.org/x17364.xml
Making the Most of Your Employee Benefits - ICMA-RC,http://inspired4retirement.com/x18774.xml
"[PDF] Setting aside, recognition and enforcement - Jurabibliotek.dk",https://www.jurabibliotek.dk/previewpdf/book/9788757497748/book-part-9788757497748-sec15.xml%3FpdfJsInlineViewToken%3D245511431%26inlineView%3Dtrue
The Long-Term Impact of Boosting Your Savings - ICMA-RC,http://vantagepointira.com/x18203.xml
How does a small business concern qualify to provide manufactured ...,https://www.gpo.gov/fdsys/pkg/CFR-2012-title13-vol1/xml/CFR-2012-title13-vol1-sec121-406.xml
"Order 37 Rehearing, Setting Aside and Appeal from District Judge ...",https://www.bloomsburyprofessionalonline.com/view/hershman_mcfarlane/CLAP-K1-UID12627.xml
"Askance, athwart, aside in: Performance and Spanish film",https://www.manchesterhive.com/view/9781526107732/9781526107732.00013.xml
Critical Appraisal of 'Patent Illegaility'as a Ground for Setting Aside ...,https://blr.scholasticahq.com/article/5596.xml
Setting aside Hungarian arbitral awards without time limit?,https://akjournals.com/downloadpdf/journals/026/49/3/article-p327.xml
Balancing Act: Save for Tomorrow While Enjoying Life Today,https://www.icmarc.org/x17359.xml
Open Enrollment Strategies for Your Employee Benefits - ICMA-RC,http://nfop457.com/x18789.xml
Chapter 9: The set-aside of arbitral awards - Elgaronline,https://www.elgaronline.com/view/9781800882782.00012.xml
I love you with all my brain: laying aside the intellectually dull sword ...,https://journals.scholarsportal.info/details/20009011/v02i0001/nfp_ilywamidsobd.xml
HB 981,http://billstatus.ls.state.ms.us/2022/pdf/history/HB/HB0981.xml
