Eleven-year Correlation of Physical Fruit Texture Traits between ...,https://journals.ashs.org/horttech/view/journals/horttech/30/6/article-p719.xml
Penetrometer Measurement of Apple and Kiwifruit Firmness,https://journals.ashs.org/jashs/view/journals/jashs/121/5/article-p927.xml
Soil classifications and bearing capacity. - Govinfo.gov,https://www.govinfo.gov/content/pkg/CFR-2018-title24-vol5/xml/CFR-2018-title24-vol5-sec3285-202.xml
An Improved Technique Using Dental Prostheses for Field ... - Brill,https://brill.com/view/journals/ijfp/86/4/article-p398_7.xml
Cereal Research Communications Volume 35 Issue 2 (2007),https://akjournals.com/view/journals/0806/35/2/article-p989.xml
Journal of Radioanalytical and Nuclear Chemistry - AKJournals,https://akjournals.com/view/journals/10967/248/2/article-p289.xml
Steady state of solid-grain interfaces during simulated CPT - Sciendo,https://www.degruyter.com/view/j/sgem.2013.35.issue-4/sgem-2013-0034/sgem-2013-0034.xml
1. Introduction - Hindawi.com,https://downloads.hindawi.com/archive/2015/470160.xml
civil.xml,http://www.uwyo.edu/_files/sitemap/directories/civil.xml
