"Explainer: Hurdles Facing Parents, Children Separated at US Border",https://www.illinoisintelligencer.com/news/257521164/oct04v40.flv
"Do Your Brexit Duty, Britain's May Tells Her Divided Government",https://www.irishsun.com/news/257624776/oct04v56.flv
Trump Blames Democrats for Family Separations — Again,https://www.austinglobe.com/news/257494417/oct04v40.flv
Ramaphosa to unveil Mandela statue at UN HQ on Heritage Day,https://www.nigeriasun.com/news/258033151/oct04v40.flv
"Britain's Brexit Proposal Dead, May Humiliated, Press Says",https://www.manufacturingmirror.com/news/258023321/oct04v56.flv
Din personliga Tvtablå - Kolla.tv,https://kolla.tv/Static/Flash/logo/KollaTV_WhiteBG_Logo_Loop_WEB_Hd_v03.flv%3Fday%3D0%26week%3D1
