Transformative Transitional Justice and the Malleability of Post ...,https://www.elgaronline.com/view/9781783470037/9781783470037.xml
Burstiness and Stochasticity in the Malleability of Physical Activity in,https://journals.humankinetics.com/view/journals/jsep/43/5/article-p387.xml
SAGE Reference - Encyclopedia of Psychology and Law,https://sk.sagepub.com/reference/psychologylaw/n58.xml
Postscript: The Malleability of History in: Art and the Brain - Brill,https://brill.com/view/book/9789004322998/B9789004322998-s018.xml
Making ends meet: The social malleability of needs and resources,https://journals.scholarsportal.info/details/00905720/v19i0002/209_memtsmonar.xml
Increasing the perceived malleability of gender bias using a ...,https://journals.scholarsportal.info/details/13684302/v21i0005/788_itpmogvifdis.xml
Malleable microsurgical suction device in - Journal of Neurosurgery,https://thejns.org/view/journals/j-neurosurg/54/5/article-p704.xml
Conclusion in: Balancing the self - Manchester Open Hive,https://www.manchesteropenhive.com/view/9781526132123/9781526132123.00020.xml
Malleability of Preferences for Honesty - SocioRePEc,https://sociorepec.org/publication.xml%3Fh%3Drepec:hka:wpaper:2021-021%26l%3Den
