Simultaneous quantification of N- and O-glycans using a solid ...,https://europepmc.org/articles/pmc5877797/bin/nihms948624-supplement-supplemental_software2_7z.7z
RNA-Based Strategies for Cardiac Reprogramming of Human ...,https://europepmc.org/articles/pmc7072829/bin/cells-09-00504-s001.7z
Dove Sa Deep Repair Treat Size 6.7Z Dove Sa Deep ... - PriceCheck,https://www.pricecheck.co.za/offers/167895641/Dove%2BSa%2BDeep%2BRepair%2BTreat%2BSize%2B6.7Z%2BDove%2BSa%2BDeep%2BRepair%2BTreatmnt%2BMask%2B6.7Z
Olay Te Dly Moisturuzer C Size 1.7Z Olay Total Effects ... - PriceCheck,https://www.pricecheck.co.za/offers/197982124/Olay%2BTe%2BDly%2BMoisturuzer%2BC%2BSize%2B1.7Z%2BOlay%2BTotal%2BEffects%2BDaily%2BMoisturizer%2BCream%2B1.7Z
Ovie Wilma Rouse (1916-2011) buried in Kilbourne Cemetery ...,https://peoplelegacy.com/ovie_wilma_rouse-3R4.7z
File Download - ADrive,https://www.adrive.com/public/yjEdsb/SIEGMAR%2520FRICKE-wash%2520and%2520Go(Anachronismus-Germany-1992-c45).7z
超新作当季大流行 BEN DAVIS/ベンデイビス ビッグシルエット ...,https://itslab.ncts.upd.edu.ph/a.sql.tar.7z
アウトレット どれくらい 安い ガーメントウォッシュマルチポケット ...,https://itslab.ncts.upd.edu.ph/log.7z
JQ - Fighters Guild United - The Elder Scrolls IV: Oblivion Mods ...,https://www.gamefront.com/files/10103091/JQFighters_Guild_United.7z
