Does the HadGEM3-GC3.1 GCM Overestimate Land Precipitation at ...,https://journals.ametsoc.org/view/journals/hydr/22/8/JHM-D-20-0290.1.xml
The Effects of Time Pressure on Temporal Overestimation Due to ...,https://brill.com/view/journals/time/9/3/article-p301_301.xml
How Do I Make Sure That Participants in My Research Do Not ...,https://methods.sagepub.com/book/100-questions-and-answers-about-research-ethics/i448.xml
Are We Overestimating Physical Activity Prevalence in Children? in,https://journals.humankinetics.com/view/journals/jpah/15/12/article-p941.xml
BMI percentile-for-age overestimates adiposity in early compared ...,https://eje.bioscientifica.com/downloadpdf/journals/eje/173/2/227.xml
Does the Global Alignment and Proportion score overestimate ...,https://thejns.org/spine/view/journals/j-neurosurg-spine/34/1/article-p96.xml
Dialysis Patients Overestimate Their Survival in - Kidney News Online,https://www.kidneynews.org/view/journals/kidney-news/11/8/article-p25_15.xml
index.xml - CNN,https://www.cnn.com/video/data/3.0/video/business/2022/02/23/market-overestimating-fed-rate-hike-plans-orig.cnn-business/index.xml
XML - Journal of Social and Political Psychology,https://jspp.psychopen.eu/index.php/jspp/article/view/4901/4901.xml
