[PDF] Residential Environmental Health Issues & Risk Reduction Strategies,https://omls.oregon.gov/pipermail/health_education_promotion/attachments/20110318/8dfa73b5/attachment.flv
Purchase of Service (POS) Bed Hold Request Form and Process,https://www.dhs.state.il.us/page.aspx/FACT_1WhatIsVR.flv%3Fitem%3D126274
Summary of PUNS by Type of Support Needed - IDHS,https://www.dhs.state.il.us/page.aspx/FACT_Intro.flv%3Fitem%3D56036
Glass Thousand Oaks - 805.495.0441 - Dilbeck Realty Woodland Hills,http://www.hetbakhuis.dsilvasfilho.pt/tr-trailers.com/paulina18/trailer.flv
Sichuan Police Detain Dozens of Christians Praying For Quake ...,https://www.buffalobreeze.com/news/257264346/oct04v56.flv
"[PDF] Parsi Theater, Urdu Drama, and the Communalization of Knowledge",https://minio.la.utexas.edu/colaweb-prod/profile/custom_pages/0/119/parsi_theater_urdu_drama_and_the_communa_51b7a927-cb02-4217-9c55-0726dcb7b8bf.flv
Five of top 7 Australian billionaires are Jewish,https://www.chinanationalnews.com/news/257346112/oct04v56.flv
Taliban Political Chief Baradar To Attend Afghan Peace Talks In Qatar,https://www.calgarymonitor.com/news/259685681/feb24v21.flv
"Commercial Refrigeration Perth | Commercial Heating, Cooling and ...",http://nrs.net.au/coles.flv
