Mating with immunised male mice affects the phenotype of adult ...,https://rep.bioscientifica.com/view/journals/rep/160/1/REP-19-0360.xml
Ovule Culture to Obtain Progeny from Hybrid Seedless Bunch ...,https://journals.ashs.org/jashs/view/journals/jashs/115/6/article-p1019.xml
Comparing Genotypic and Phenotypic Variation of Selfed and ...,https://journals.ashs.org/hortsci/view/journals/hortsci/55/8/article-p1206.xml
Maternal Care of Immature Progeny by Parasitoids,http://aesa.oxfordjournals.org/content/66/2/486.source.xml
Reproductive Performance of Inbred or Outbred F 1 and F 2 Progeny ...,http://aesa.oxfordjournals.org/content/74/1/108.source.xml
Forced Egg Laying Method to Establish F1 Progeny from Field ...,https://bioone.org/journals/journal-of-medical-entomology/volume-58/issue-6/tjab105/Forced-Egg-Laying-Method-to-Establish-F1-Progeny-from-Field/10.1093/jme/tjab105.xml
Progeny of water frog populations in central Poland Leszek Berger1 ...,https://brill.com/downloadpdf/journals/amre/13/2/article-p135_4.xml
Vertical Transmission of Zika Virus in Aedes aegypti Produces ...,https://www.ajtmh.org/view/journals/tpmd/103/2/article-p876.xml
Chapter 3: East Coast Legal Realism and its progeny in - Elgaronline,https://www.elgaronline.com/abstract/edcoll/9781788117760/9781788117760.00011.xml
