Medical futility is commonly encountered in small animal clinical ...,https://avmajournals.avma.org/view/journals/javma/aop/javma.22.01.0033/javma.22.01.0033.xml
Medical futility is commonly encountered in small ... - AVMA Journals,https://avmajournals.avma.org/abstract/journals/javma/aop/javma.22.01.0033/javma.22.01.0033.xml
Editorial. Toward reducing futile recanalization in stroke,https://thejns.org/focus/view/journals/neurosurg-focus/51/1/article-pE14.xml
Futile substrate cycles in the glycolytic pathway of boar and rat ...,https://rep.bioscientifica.com/view/journals/rep/79/1/jrf_79_1_004.xml
Futile growth and mounting destruction in - manchester hive,https://www.manchesterhive.com/view/9781526144515/9781526144515.00010.xml
Futility of Bias-Free Learning - José M. Vidal,http://jmvidal.cse.sc.edu/talks/conceptlearning/futilityofnobias.xml
Futile Counsels: Prophecy and Poetry in John Lydgate's Troy Book,https://journals.scholarsportal.info/details/10432213/v35inone/95_fcpapijltb.xml
The Use of Slow Codes and Medically Futile Codes in Practice ...,https://journals.scholarsportal.info/details/08853924/v62i0002/326_tuoscamfcip.xml
Untitled,https://openheart.bmj.com/content/5/2/e000879.download.xml
