"ARISTOTLE, History of Animals | Loeb Classical Library",https://www.loebclassics.com/view/aristotle-history_animals/1965/pb_LCL438.215.xml%3FreadMode%3Drecto
THERMOREGULATORY BEHAVIOUR OF ROCK LIZARDS IN ... - Brill,https://brill.com/downloadpdf/journals/beh/124/1-2/article-p123_7.xml
Thermoregulatory Behaviour of Rock Lizards in Response To Tail ...,https://brill.com/view/journals/beh/124/1-2/article-p123_7.xml%3Flanguage%3Den
"[PDF] The Human Orphan Nuclear Receptor Tailless (TLX, NR2E1) Is ...",https://journals.scholarsportal.info/pdf/19326203/v09i0006/nfp_thonrtnid.xml
Modular Neural Control for Gait Adaptation and Obstacle Avoidance ...,https://journals.scholarsportal.info/details/09210296/v101i0002/nfp_mncfgaaoatgr.xml
SYNTHESIS OF RNA IN t 12 /t 12 MOUSE EMBRYOS - Reproduction,https://rep.bioscientifica.com/view/journals/rep/33/3/jrf_33_3_016.xml
INVESTIGATIONS INTO THE ANTI-FERTILITY EFFECT OF INTRA ...,https://rep.bioscientifica.com/abstract/journals/rep/14/1/jrf_14_1_007.xml
ENG Engineering 1947-3931 Scientific Research Publishing ...,https://www.scirp.org/xml/65833.xml
From William Chester Tait 26 January 1869 - | Darwin ...,https://www.darwinproject.ac.uk/letter/DCP-LETT-6577.xml
