[PDF] When fish wore armour: enter the Placoderms,https://freedomtoteach.collins.co.uk/when-fish-wore-armour-placoderms/bioblog-24_7/
The Relationship of Placoderms - jstor,https://www.jstor.org/stable/4522999
"a review of placoderm scales, and their significance in - JStor",https://www.jstor.org/stable/4523984
[PDF] The phylogeny of antiarch placoderms - UMD Geology,https://www.geol.umd.edu/undergraduate/paper/kearsley.pdf
Paleontology: There are more placoderms in the sea - Cell Press,https://www.cell.com/current-biology/pdf/S0960-9822(21)00902-7.pdf
INTERRELATIONSHIPS OF PLACODERMS REVISITED,https://www.sciencedirect.com/science/article/pii/S001669959580093X/pdf%3Fmd5%3D5add1a32d60676f854762ed984baf51f%26pid%3D1-s2.0-S001669959580093X-main.pdf%26_valck%3D1
[PDF] A Silurian placoderm with osteichthyan-like marginal jaw bones,http://lveho.ivpp.cas.cn/kycg/lw/201404/P020140409593937213739.pdf
[PDF] A large Middle Devonian eubrachythoracid 'placoderm' (Arthrodira ...,https://sjpp.springeropen.com/track/pdf/10.1186/s13358-020-00212-w.pdf
Placoderms and the evolutionary origin of teeth,https://royalsocietypublishing.org/doi/pdf/10.1098/rsbl.2016.0159
An antiarch placoderm shows that pelvic girdles arose at the root of ...,https://royalsocietypublishing.org/doi/pdf/10.1098/rsbl.2011.1033
