0844018.txt - Veterans Affairs,http://www.va.gov/vetapp08/files5/0844018.txt
"Full text of ""The micrographic dictionary; a guide to the examination ...",https://archive.org/stream/micrographicdict12grif/micrographicdict12grif_djvu.txt
"Full text of ""The micrographic dictionary - Internet Archive",https://archive.org/stream/micrographicdic01henfgoog/micrographicdic01henfgoog_djvu.txt
Adopting Release for Rule 17a-4(f) - SEC.gov,https://www.sec.gov/rules/final/34-38245.txt
"BEGIN PRIVACY-ENHANCED MESSAGE----- Proc-Type: 2001,MIC ...",https://www.sec.gov/Archives/edgar/data/97196/0000914760-95-000100.txt
"EASTMAN KODAK COMPANY, PETITIONER V. IMAGE TECHNICAL ...",https://www.justice.gov/sites/default/files/osg/briefs/1990/01/01/sg900104_0.txt
35842-0.txt - Project Gutenberg,https://www.gutenberg.org/files/35842/35842-0.txt
HUB_AGENCY_REPORT TEXAS COMPTROLLER OF PUBLIC ...,https://comptroller.texas.gov/data/purchasing/hub/fy18s/agydet/306_agy_det_web.txt
miscnote.txt - USPTO,https://www.uspto.gov/sites/default/files/web/offices/com/sol/notices/miscnote.txt
supplied london load strained elsevier shown 345mpa cylinder ...,https://nal-ir.nal.res.in/3042/2/indexcodes.txt
