Connecting the Strands of Physical Culture in Native Lives in,https://journals.humankinetics.com/view/journals/shr/29/1/article-p121.xml
Connecting the Strands of Physical Culture in Native Lives,https://journals.humankinetics.com/previewpdf/journals/shr/29/1/article-p121.xml
Asylum Entertainment and Recreation in Australia and New Zealand ...,https://brill.com/view/book/edcoll/9789042026322/B9789042026322-s016.xml
Amusement Parks in: Encyclopedia of Tourism Management and ...,https://www.elgaronline.com/view/nlm-book/9781800377479/b-9781800377486.amusement.parks.xml
XML,https://le.utah.gov/xcode/Title78B/Chapter4/C78B-4-S507_1800010118000101.xml
statement of changes in beneficial ownership - SEC FORM 4,https://www.sec.gov/Archives/edgar/data/813828/000138713122006265/xslF345X03/para-form4.xml
index.xml - CNN,https://www.cnn.com/video/data/3.0/video/us/2022/03/25/teen-death-orlando-amusement-park-ride-newsroom-vpx.cnn/index.xml
NMAH.AC.0060.S01.01.Amusements Warshaw Collection of ...,https://sirismm.si.edu/EADs/NMAH.AC.0060.S01.01.Amusements-ead.xml
AGC.xml,http://www.state.nj.us/lps/ca2/lgccc/AGC.xml
