host–bacteria communication within the gut microbiome in,https://joe.bioscientifica.com/view/journals/joe/225/2/R21.xml
Private Well Water - State Hygienic Laboratory - The University of Iowa,http://www.shl.uiowa.edu/env/privatewell/faq.xml
Molecular richness and biotechnological potential of bacteria ...,https://femsec.oxfordjournals.org/content/85/3/519.source.xml
Bacterial culture and immunohistochemical detection of bacteria and ...,https://avmajournals.avma.org/view/journals/javma/260/2/javma.20.10.0552.xml
Lactic Acid Bacteria Incorporated into Edible Coatings to Control ...,https://journals.ashs.org/hortsci/view/journals/hortsci/54/2/article-p337.xml
[PDF] Occurrence and Location of Endophytic Bacteria in Garden and Wild ...,https://journals.ashs.org/hortsci/downloadpdf/journals/hortsci/40/2/article-p348.xml
Bacterial Diversity in Freshwater - Ecology - Oxford Bibliographies,https://www.oxfordbibliographies.com/view/document/obo-9780199830060/obo-9780199830060-0180.xml
s41467-019-08719-8.pdf - Nature,https://journals.scholarsportal.info/pdf/20411723/v10inone/nfp_esgaastsdsib.xml
[PDF] γδT cells play a pleiotropic role in tumor immunity,https://journals.scholarsportal.info/pdf/20453701/v11inone/nfp_irtcbcapriti.xml
Bacteria as Biogenic Sources of Freezing Nuclei in - AMS Journals,https://journals.ametsoc.org/view/journals/apme/17/7/1520-0450_1978_017_1049_babsof_2_0_co_2.xml
DNA Sequencing to Evaluate Nail Pathogens: An Investigation into ...,https://japmaonline.org/view/journals/apms/111/2/i8750-7315-111-2-article_5.xml
