FORM D - SEC.gov,https://www.sec.gov/Archives/edgar/data/1831032/000156761920018701/xslFormDX01/primary_doc.xml
Chapter 9 The Curious Case of Isaac Casaubon's Monstrous Bladder,https://brill.com/view/book/edcoll/9789004507159/BP000018.xml
Appendix 1. Data of the microscopic preparations shown in ... - Brill,https://brill.com/previewpdf/book/9789004265738/B9789004265738-s009.xml
What Is Your Diagnosis? - AVMA Journals,https://avmajournals.avma.org/downloadpdf/journals/javma/233/2/javma.233.2.227.xml
What Is Your Diagnosis? in - AVMA Journals,https://avmajournals.avma.org/view/journals/javma/233/2/javma.233.2.227.xml
Untitled,https://www.researchgate.net/publication/306621301_XML_Treatment_for_Doryodes_bistrialis/data/57bf62e008ae2f5eb32e90bc/zookeys5276087-treatment4.xml
"PLINY THE ELDER, Natural History | Loeb Classical Library",https://www.loebclassics.com/view/pliny_elder-natural_history/1938/pb_LCL392.65.xml%3FmainRsKey%3DV7FKrS
"PLINY THE ELDER, Natural History | Loeb Classical Library",https://www.loebclassics.com/view/pliny_elder-natural_history/1938/pb_LCL418.145.xml%3FmainRsKey%3DyNDuY9
Initial experience with a bone-anchored sling for stress urinary ...,https://journals.scholarsportal.info/details/00297844/v95i0004_s1/s2_iewabsfsui.xml
