Military Base Closings - HUD,https://www.hud.gov/sites/documents/93-31ml.txt
HURRICANE IRENE CLOSINGS & DELAYS | News ...,http://www.carolinacoastonline.com/articles/2011/08/27/topsail_voice/news/doc4e5636eeaa019826082011.txt
"April 30, 1997 GSBCA 13867-RELO In the Matter of THOMAS S ...",https://gsbca.gsa.gov/relo/r138670.txt
"Holiday pickup delays, closings announced | News ...",http://www.westhartfordnews.com/articles/2015/12/28/news/doc56689e584114c666407651.txt
Office of the Vice President for Administration J. Daniel Bloomer ...,https://sunyorange.edu/vpa/docs/20082009snowclosingprocedure.txt
Why don't media report on business closings and those who are let ...,http://www.insidetucsonbusiness.com/articles/2010/05/21/opinion/columnists/guest_opinion/doc4bf6b5a457460652432313.txt
"Parks and Rec has multiple closings, some cancelations | Bulletin ...",http://capjournal.com/articles/2011/05/31/bulletin/doc4de5879912c10459576040.txt
<DOCUMENT> <TYPE>8-K <SEQUENCE>1 <FILENAME ...,https://www.sec.gov/Archives/edgar/data/1025707/000093041306005041/c43134_8k.txt
Closings for Fourth of July weekend | The Sentinel: News ...,http://cumberlink.com/articles/2009/07/01/news/local/doc4a4b61862433e891838823.txt
