The facilitatory effect of N-methyl-D-aspartate on sexual receptivity in ...,https://eje.bioscientifica.com/view/journals/eje/128/4/acta_128_4_017.xml
[PDF] The Role of Amino Acids in Neurotransmission and Fluorescent ...,https://journals.scholarsportal.info/pdf/14220067/v21i0017/nfp_troaaiaftftd.xml
Effect of Aspartate and Asparagine Supplementation on Fatigue ...,https://journals.humankinetics.com/view/journals/ijsnem/13/1/article-p65.xml
Failure of the competitive N-methyl-d-aspartate antagonist Selfotel ...,https://thejns.org/view/journals/j-neurosurg/91/5/article-p737.xml
Aspartate amino transferase (AST/SGOT) test system. - Govinfo.gov,https://www.govinfo.gov/content/pkg/CFR-2020-title21-vol8/xml/CFR-2020-title21-vol8-sec862-1100.xml
Glutamate-Aspartate Transaminase Activity in the Blood Plasma of ...,http://aesa.oxfordjournals.org/content/60/2/428.source.xml
Functional analysis of a conserved aspartate D218 in ...,http://femsle.oxfordjournals.org/content/157/1/137.source.xml
"Isolated aspartate aminotransferase elevation in a young, healthy ...",https://akjournals.com/view/journals/650/155/39/article-p1558.xml
Prevention of central sensitization and pain by N-methyl-D-aspartate ...,https://avmajournals.avma.org/abstract/journals/javma/228/1/javma.228.1.53.xml
