Structure and function of the fused rhabdom,https://link.springer.com/content/pdf/10.1007/BF01352157.pdf
Rhabdom evolution in butterflies - Journals,https://royalsocietypublishing.org/doi/pdf/10.1098/rspb.2012.0475
Rhabdom constriction enhances filtering by the red screening ...,https://journals.biologists.com/jeb/article-pdf/212/13/2057/1267191/2057.pdf
ultrastructural changes of rhabdoms of the eyes of ocypode species ...,https://www.jstor.org/stable/1549786
"Rods, Rhabdoms, and Rhythms - jstor",https://www.jstor.org/stable/1309071
Rhabdom Adaptation and Its Phylogenetic Significance,https://onlinelibrary.wiley.com/doi/pdf/10.1111/j.1463-6409.1976.tb00685.x
Rhabdom structure and receptor potentials in single crayfish ...,https://onlinelibrary.wiley.com/doi/pdf/10.1002/jcp.1030660314
FINE STRUCTURE OF THE RETINULAE IN THE COMPOUND EYE ...,https://rupress.org/jcb/article-pdf/14/3/489/1291677/489.pdf
"[PDF] ""9 The rhabdom of the lobster eye Summary Introduction - CiteSeerX",https://citeseerx.ist.psu.edu/viewdoc/download%3Fdoi%3D10.1.1.901.9155%26rep%3Drep1%26type%3Dpdf
Structure and possible function of the unusual compound eye of ...,https://www.tandfonline.com/doi/pdf/10.1080/03014223.1977.9517932
