build-jzlib.xml - Git Repositories | Swift,https://swift.im/git/stroke/commit/build-jzlib.xml%3Fid%3Dbd9407d3f0ef8a1f94fedc5b68fc1e05c129b562
medrxiv MEDRXIV medRxiv medRxiv Cold Spring Harbor ...,https://www.medrxiv.org/content/early/2020/05/20/2020.05.16.20101204.source.xml
Colour figures of vol. 4A - Brill,https://brill.com/downloadpdf/book/edcoll/9789047440451/B9789047440451_008.xml
Stroke Reasoning for Robotic Chinese Calligraphy Based on ...,https://journals.scholarsportal.info/details/18754791/v09i0004/525_srfrccbocfs.xml
SAGE Reference - The SAGE Encyclopedia of Theory in Counseling ...,https://sk.sagepub.com/reference/the-sage-encyclopedia-of-theory-in-counseling-and-psychotherapy/i10454.xml
recast-jats-build e082d6219a bmjcr BMJ Case Reports ...,https://casereports.bmj.com/content/12/8/e230472.download.xml
Survival following decompressive hemicraniectomy for ...,https://thejns.org/pediatrics/view/journals/j-neurosurg-pediatr/18/3/article-p344.xml
Clinical utility of arterial spin labeling imaging in disorders of the ...,https://thejns.org/focus/view/journals/neurosurg-focus/47/6/article-pE5.xml
homepage_featured_stack.xml - Minor League Baseball,http://www.milb.com/gen/hb/list/t1350/homepage_featured_stack.xml
