Bill looks to eliminate in Ohio mandate on prevailing wages | The ...,https://www.toledoblade.com/news/State/2017/03/01/Bill-looks-to-eliminate-in-Ohio-mandate-on-prevailing-wages/stories/feed/feed/index.rss
Bill looks to eliminate in Ohio mandate on prevailing wages,https://www.toledoblade.com/State/2017/03/01/Bill-looks-to-eliminate-in-Ohio-mandate-on-prevailing-wages/stories/feed/index.rss
The Prevailing Narrative with Matt Bilinsky - Megaphone,https://omny.fm/shows/the-prevailing-narrative-with-matt-bilinsky/playlists/podcast.rss
https://howtodiscuss.com/t/price-prevailing-at-dat...,https://howtodiscuss.com/t/price-prevailing-at-date-of-shipment/26962.rss
Cigna | Employee Benefit News,https://www.employeebenefitadviser.com/organization/cigna.rss
Hanging With The Minister - Audioboom,https://audioboom.com/channels/5051781.rss
Moneywise - Audioboom,https://audioboom.com/channels/5062451.rss
Adaptation and integration course for long-term and permanent ...,https://www.mzv.cz/chicago/en/consular_information/residency_stay_over_6_months/adaptation_and_integration_course_for.rss
New obligation for foreign residents as of 01/01/2021 - MZV,https://www.mzv.cz/beirut/en/visa_and_consular_information/condition_for_entry_to_the_czech/new_obligation_for_foreign_nationals_as.rss
North Side Baptist Church - Podcasts,http://podcasts.subsplash.com/9702995/podcast.rss
Redeemer Olive Branch - Podcasts,http://podcasts.subsplash.com/f4ecd24/podcast.rss
