COMPARISON OF VAGINAL TOLERANCE TESTS OF ...,https://rep.bioscientifica.com/view/journals/rep/20/1/jrf_20_1_011.xml
SPECIAL REQUIREMENTS FOR TESTING SPERMICIDES,https://eje.bioscientifica.com/downloadpdf/journals/eje/77/1_Suppla/acta_75_Suppl_185_018.xml
Barrier Birth Control Methods | My Doctor Online,https://mydoctor.kaiserpermanente.org/ncal/structured-content/Prevention_Barrier_Birth_Control_Methods_-_ObGyn.xml%3Fco%3D/regions/ncal
Diaphragm | My Doctor Online,https://mydoctor.kaiserpermanente.org/mas/structured-content/Health_Topic_Diaphragm_-_ObGyn.xml%3Fco%3D/regions/mas
"Asiatic acid, a non-detergent type spermicide: exploration of ...",https://journals.scholarsportal.info/details/10542523/v25i0009/1908_aaantsopposa.xml%3Flang%3Dfr
Use of Spermicide Containing Nonoxynol-9 Provides Substantial ...,https://journals.scholarsportal.info/details/00147354/v26i0005/234_uoscnpspagi.xml
User labeling for latex condoms. - Govinfo.gov,https://www.govinfo.gov/content/pkg/CFR-2017-title21-vol8/xml/CFR-2017-title21-vol8-sec801-435.xml
Untitled,https://downloads.hindawi.com/journals/bmri/2009/452567.xml
Chlamydia DNA by PCR - University of Mississippi Medical Center,https://www.umc.edu/som/Departments%2520and%2520Offices/SOM%2520Departments/Pathology/UMMC%2520LAb%2520Services/Lab%2520Test%2520List/Laboratory/Tests/Chlamydia-DNA-by-PCR.xml
