HIGH TITERS OF IgG ANTIBODIES AGAINST PLASMODIUM ...,https://www.ajtmh.org/view/journals/tpmd/74/2/article-p191.xml
Changes in Antibody Titers and Serum Protein Fractions during the ...,https://www.ajtmh.org/view/journals/tpmd/15/1/article-p3.xml
EPR20-073: The Effects of Chemotherapy on the Efficacy ... - JNCCN,https://jnccn.org/view/journals/jnccn/18/3.5/article-pEPR20-073.xml
Correlation of the antibody titers with serum prolactin levels and their ...,https://eje.bioscientifica.com/view/journals/eje/130/5/eje_130_5_004.xml
"Number of autoantibodies and HLA genotype, more than high titers ...",https://eje.bioscientifica.com/view/journals/eje/163/4/541.xml
[PDF] Incidence and Severity of Huanglongbing and Candidatus ...,https://journals.ashs.org/hortsci/downloadpdf/journals/hortsci/46/10/article-p1344.xml
Elevated Titers of Serum Agglutinators: A Serologie Indicator of ...,http://ajcp.oxfordjournals.org/content/63/1/98.source.xml
2021.03.17.20200246.source.xml - medRxiv,https://www.medrxiv.org/content/early/2021/03/20/2021.03.17.20200246.source.xml
Serum antibody titers following routine rabies vaccination in African ...,https://avmajournals.avma.org/view/journals/javma/235/8/javma.235.8.978.xml
