Learning Multiple Visuomotor Transformations: Adaptation and ...,https://journals.humankinetics.com/view/journals/mcj/8/4/article-p534.xml
Estimating the Orientation and Spacing of Midlatitude Linear ...,https://journals.ametsoc.org/view/journals/atsc/69/1/jas-d-11-070.1.xml
galen's concept of nature - Brill,https://brill.com/downloadpdf/book/9789004232549/B9789004232549-s015.xml
Madness in Susan Glaspell's The Verge as Only Chance for Sanity,https://brill.com/downloadpdf/book/edcoll/9789004382381/BP000006.xml
Community Projects as Social Activism: From Direct ... - SAGE Books,https://sk.sagepub.com/books/community-projects-as-social-activism-from-direct-action-to-direct-services/i367.xml
SAGE Reference - Religious Leadership: A Reference Handbook,https://sk.sagepub.com/reference/religious-leadership-reference-handbook/n52.i1.xml
Download .xml file - NIH VideoCast,https://videocast.nih.gov/vodCaptions/orwh121119.xml%3Fdownload%3Dyes
Download .xml file - NIH VideoCast,https://videocast.nih.gov/vodCaptions/ninr092920.xml%3Fdownload%3Dyes
Personal values and entrepreneurial intention: an empirical study in,https://www.elgaronline.com/view/edcoll/9781782547303/9781782547303.00008.xml
"Youth Will Neads Have Dalliance, attributed to King Henry VIII",https://dvpp.uvic.ca/xml/atalanta/1892/pom_2227_youth_will_neads_have.xml
