[PDF] They Call It … Eyeshine! - Friends of the Wildflower Garden,http://www.friendsofthewildflowergarden.org/pages/gentian/newarticles/eyeshine.pdf
[PDF] The eyeshine of animals great and small (sorted by color) - Townnews,https://bloximages.newyork1.vip.townnews.com/jhnewsandguide.com/content/tncms/assets/v3/editorial/a/6e/a6e974d5-3639-5615-9da7-a8225e669731/54f6443b1be1d.pdf.pdf
"Eye Shine in Birds, with Notes on the Feeding Habits of some ...",http://academic.oup.com/condor/article-pdf/29/1/25/28134729/condor0025.pdf
Functional Morphology of Guanine Type Tapetum Lucidum,https://www.int-res.com/articles/meps/2/m002p009.pdf
Reflections on the tapetum lucidum and eyeshine in lycosoid spiders,https://www.jstor.org/stable/23610234
"[PDF] Optic-nerve-transmitted eyeshine, a new type of light emission from ...",https://frontiersinzoology.biomedcentral.com/track/pdf/10.1186/s12983-017-0198-9.pdf
Eyeshine,https://muse.jhu.edu/article/837570/pdf
Eyeshine in fishes. A review of ocular reflectors,https://cdnsciencepub.com/doi/pdf/10.1139/z80-133
The Outside Story - Harris Center for Conservation Education,https://harriscenter.org/wp-content/uploads/2019/09/Eye_Shine_March2019_Spikol.pdf
Intensity and polarization of the eyeshine in butterflies - Springer LINK,https://link.springer.com/content/pdf/10.1007/BF00190209.pdf
