Meet the Funding Recipients - IDHS,https://www.dhs.state.il.us/page.aspx/FACT_1WhatIsVR.flv%3Fitem%3D128226
African First Ladies: Private Sector Trailing Gender Equality,https://www.northernirelandnews.com/news/254821009/oct04v40.flv
NSA Deleting More Than 685 Million Call Records - Voice of America,https://www.northkoreatimes.com/news/257588048/oct04v56.flv
Russia Dumped U.S. Bond Holdings This Year Amid U.S. Sanctions ...,https://www.bangladeshsun.com/news/257703785/oct04v40.flv
Trump Calls On U.S. Attorney General To End Russia Probe 'Right ...,https://www.europesun.com/news/257774538/oct04v56.flv
"Putin Not Welcome In Congress If He Visits Washington, Leaders Say",https://www.stpetersburgstar.com/news/257730682/oct04v56.flv
Arizona's Sen. Flake Takes GOP to Task Over Trump,https://www.phoenixherald.com/news/254195000/oct04v40.flv
"[PDF] Parsi Theater, Urdu Drama, and the Communalization of Knowledge",https://minio.la.utexas.edu/colaweb-prod/profile/custom_pages/0/119/parsi_theater_urdu_drama_and_the_communa_51b7a927-cb02-4217-9c55-0726dcb7b8bf.flv
"The Week In Russia: Spies, 'Scumbags,' And Senior Citizens",https://www.austinglobe.com/news/258086108/oct04v40.flv
EU Lays Out Accession Path For Balkan Countries,https://www.dublinnews.com/news/256383024/oct04v40.flv
What Buhari and Trump stand to gain from state visit - News24,https://www.illinoisintelligencer.com/news/257143000/oct04v40.flv
Pierwszy kolorowy telewizor w USA 1961.flv - Chomikuj,"http://chomikuj.pl/julitkacozjadlafrytka/filmiki-roznosci/Pierwszy%2Bkolorowy%2Btelewizor%2Bw%2BUSA%2B1961,204336069.flv"
Practical Dreamer (1957).flv - filmiki-roznosci - julitkacozjadlafrytka ...,"http://chomikuj.pl/julitkacozjadlafrytka/filmiki-roznosci/Practical%2BDreamer%2B(1957),204879092.flv"
