Subcellular localization of MS4A13 isoform 2 in mouse spermatozoa in,https://rep.bioscientifica.com/view/journals/rep/154/6/REP-17-0477.xml
Review of cellular and subcellular changes in the cambium in - Brill,https://brill.com/view/journals/iawa/34/4/article-p391_6.xml%3Flanguage%3Den
Prognostic implications of the subcellular localization of survivin in ...,https://thejns.org/view/journals/j-neurosurg/128/3/article-p679.xml
Aspergillus niger G proteins: subcellular localization,https://femsle.oxfordjournals.org/content/92/3/259.ref-stubs.xml
Subcellular localization of full-length human myeloid leukemia factor ...,https://www.degruyter.com/view/j/cmble.2013.18.issue-1/s11658-012-0044-1/s11658-012-0044-1.xml%3Flang%3Dde
Subcellular Localization of a Basic Peroxidase Isoenzyme in ...,https://journals.ashs.org/jashs/view/journals/jashs/119/6/article-p1276.xml
Subcellular Localization of 14-3-3 Regulatory Proteins in ...,https://journals.ashs.org/hortsci/abstract/journals/hortsci/31/4/article-p614e.xml
Subcellular Targets for Photodynamic Therapy: Implications for ...,https://jnccn.org/pdfviewer/full/journals/jnccn/10/Suppl_2/article-pS-56.xml%3Fbg%3DGREY_COLOR_LIGHT_VARIANT%26mgs%3DPRIMARY_COLOR%26mge%3DPRIMART_COLOR_DARK_VARIANT
