"Employees Pose Big Potential Danger to Aviation, Experts Say",https://www.internationaltravelnews.com/news/257828044/oct04v56.flv
Couple trying all poses.FLV | free xxx mobile videos - 16honeys.com,http://16honeys.com/download/6175207/couple-trying-all-poses.flv
Trump Touts Excellent Progress in Talks With Xi,https://www.northkoreatimes.com/news/255305981/oct04v56.flv
What pays for war - media library - global witness,https://www.globalwitness.org/sites/default/files/import/wpfw_lge.flv
UN Palestinian Refugee Agency Narrows Shortfall after US Cuts,https://www.jamaicantimes.com/news/258052369/oct04v56.flv
1001_IWW_HAP_XX.flv - DagsHub,https://dagshub.com/mert.bozkirr/CREMA-D/src/master/VideoFlash/1001_IWW_HAP_XX.flv
"Automakers Warn US Tariffs Will Cost Jobs, Hike Prices",https://www.germanysun.com/news/257573831/oct04v56.flv
mp4 144p https://sh201.moviefap.com/59/16/591621/stretchy ...,https://cdn-fck.moviefap.com/moviefap/3dc4849b5d363c942cc1.flv%3Fkey%3Dc69fcf69e5432df74b808f08d11368bf%26VID%3D591621%26rollover%3D1%26timeline%3D1%26startThumb%3D26
Frustrated US Lawmakers Threaten Action on Trump's Tariffs,https://www.irishsun.com/news/257696859/oct04v56.flv
Busty russian teen minx merit posing erotically in pussy to touch her ...,http://www.amandapics.com/news/6532588/Busty_russian_teen_minx_merit_posing_erotically_in_pussy_to_touch_her_bedroom-BigTits/galleries.payserve.com/1/34696/36597/images/deedee.flv
Analysts: Looming Idlib Conflict Threatens Turkey's Syria Strategy,https://www.beijingbulletin.com/news/257977642/oct04v56.flv
"As Forgiveness Sweeps Ethiopia, Some Wonder About Justice",https://www.sierraleonetimes.com/news/257837639/oct04v40.flv
"Britain's Brexit Proposal Dead, May Humiliated, Press Says",https://www.manufacturingmirror.com/news/258023321/oct04v56.flv
"Hard to See, Hard to Breathe: US West Struggles with Smoke",https://www.batonrougepost.com/news/257869547/oct04v56.flv
[PDF] Indian Folk Traditions and - the Modern Theatre,https://minio.la.utexas.edu/colaweb-prod/profile/custom_pages/0/119/indian_folk_traditions_and_the_modern_th_ea595889-23ff-42e8-b4e6-0640896eeacc.flv
couple trying all poses.FLV - XNXX.COM,https://www.xnxx.com/video-3octjb1/couple_trying_all_poses.flv
"After Summit, Trump Says North Korea 'No Longer A Nuclear Threat'",https://www.shanghaisun.com/news/257478756/oct04v40.flv
Ukraine Conflict Sees Spike in Violence - Voice of America,https://www.southeastasiapost.com/news/257540204/oct04v40.flv
U.S. Special Forces Soldier Dies From Wounds Received In ...,https://www.centralasiatimes.com/news/257835105/oct04v56.flv
Trump Calls On U.S. Attorney General To End Russia Probe 'Right ...,https://www.europesun.com/news/257774538/oct04v56.flv
US Elected Officials Call for More Refugees,https://www.calgarymonitor.com/news/257843574/feb24v21.flv
"Russia-Friendly Party, Populists Top Latvian Elections - Radio Free ...",https://www.malaysiasun.com/news/258094343/oct04v56.flv
