sexy blonde fingering her pussy til she cums(8).flv - Free Porn ...,https://www.xv-videos1.com/video2111307/sexy_blonde_fingering_her_pussy_til_she_cums_8_.flv
sexy blonde fingering her pussy til she cums(8).flv - XVIDEOS.COM,https://www.xvideos4.com/video2111307/sexy_blonde_fingering_her_pussy_til_she_cums_8_.flv
Walmart Canada acquiring several Target stores,https://www.irishsun.com/news/232691065/oct04v56.flv
The big ass of my neighbor.FLV - XNXX.COM,https://www.xnxx.com/video-57mcabb/the_big_ass_of_my_neighbor.flv
onMetaData duration width height videodatarate framerate ...,http://www.kxsdwh.com/UpdataLoadFile/video/2016-02/201602141714440000621322.flv
Desi Wife Enjoying In Moving Train - Xvideos.com.flv - xxx video e ...,https://it.iporntv.net/download/15952231/desi-wife-enjoying-in-moving-train-xvideos.com.flv
sexy blonde fingering her pussy til she cums(8).flv - XVIDEOS.COM,https://bd-shemale.xvideostube.to/video2111307/sexy_blonde_fingering_her_pussy_til_she_cums_8_.flv%3Fpl%3D8598868%26plname%3Dcatsuits
Baby TV Nursery Rhymes.flv - Teledyski - Bajki - bodzio291,"http://chomikuj.pl/bodzio291/Galeria/Bajki/Teledyski/Baby%2BTV-Nursery%2BRhymes,1428159301.flv"
