Teaching English at Public Schools in the Czech Republic - MZV,https://www.mzv.cz/washington/en/culture_events/education/information_for_teachers_of_english/index.rss
"Sylvania Schools, teachers union reach tentative deal | The Blade",https://www.toledoblade.com/Education/2017/09/15/Sylvania-1/stories/feed/index.rss
Oregon City Schools discuss classroom safety with community,https://www.toledoblade.com/local/2018/02/26/Local-district-discusses-school-safety-with-community/stories/feed/feed/index.rss
"Find Apartments near Schools in Wendell Phillips, MO ...",https://www.apartmenthomeliving.com/kansas-city/wendell-phillips/schools-education/lincoln-college-prep-school-apartments.rss
Somers Schools Tusker Talk - Anchor,https://feeds.buzzsprout.com/197929.rss
Theoretical Physics Schools (ASC),https://cast.itunes.uni-muenchen.de/vod/playlists/ZBBQFSF9Wc/ipod.rss
Admission Insight - Audioboom,https://audioboom.com/channels/4924169.rss
Schools Radio Network - Subscribe on Android,https://subscribeonandroid.com/feeds.soundcloud.com/users/soundcloud:users:44130807/sounds.rss
opebet登录|来自ope体育滚球|ope官方网站,https://www.hcsw77.com/Intranet/Groups/Schools/feed.rss
