Spongy Hailstone Growth Criteria I. Orientation Fabrics in,https://journals.ametsoc.org/view/journals/atsc/25/3/1520-0469_1968_025_0445_shgcio_2_0_co_2.xml
On the Mechanism of Spongy Hailstone Growth in - AMS Journals,https://journals.ametsoc.org/view/journals/atsc/25/3/1520-0469_1968_025_0440_otmosh_2_0_co_2.xml
An Integrated Microstructural and Sensory Approach to De scribe ...,https://journals.ashs.org/jashs/view/journals/jashs/128/3/article-p381.xml
INTRODUCTION Why Marie-Claire Bancquart? Because no French ...,https://brill.com/previewpdf/book/9789401205580/B9789401205580-s002.xml
1. Introduction - Hindawi.com,https://downloads.hindawi.com/journals/jfq/2022/6641904.xml
Histopathological Changes Produced by Implanted Electrodes in ...,https://thejns.org/view/journals/j-neurosurg/14/3/article-p302.xml
Fluorescein Studies of Cerebral Edema Produced by the Cryogenic ...,https://thejns.org/previewpdf/journals/j-neurosurg/23/1/article-p38.xml
"Book XIII - PLINY THE ELDER, Natural History | Loeb Classical Library",https://www.loebclassics.com/view/pliny_elder-natural_history/1938/pb_LCL370.147.xml%3FmainRsKey%3DV7FKrS%26readMode%3Drecto
Normative Economics - SAGE Reference - Encyclopedia of Law ...,https://sk.sagepub.com/reference/law/n490.xml
