TSWJ The Scientific World Journal 1537-744X Hindawi Publishing ...,http://downloads.hindawi.com/journals/tswj/2013/178649.xml
[PDF] The Role of NAD(P)H:Quinone Oxidoreductase (NQO1) - MDPI,https://journals.scholarsportal.info/pdf/14220067/v21i0022/nfp_acoantrono.xml
Antifibrinolytic therapy of experimentally grown malignant brain ...,https://thejns.org/view/journals/j-neurosurg/64/2/article-p263.xml
Emergency reversal of anticoagulation and antiplatelet therapies in ...,https://thejns.org/view/journals/j-neurosurg/112/2/article-p307.xml
"p53 and breast cancer, an update in",https://erc.bioscientifica.com/view/journals/erc/13/2/0130293.xml
"p53 and breast cancer, an update",https://erc.bioscientifica.com/downloadpdf/journals/erc/13/2/0130293.xml
1598 - RxNav,https://rxnav.nlm.nih.gov/REST/rxcui/1598/allProperties.xml%3Fprop%3Dall
Antioxidant Activities and Anticancer Cell Proliferation Properties of ...,https://journals.ashs.org/jashs/view/journals/jashs/132/5/article-p647.xml
biorxiv BIORXIV bioRxiv bioRxiv Cold Spring Harbor Laboratory ...,https://www.biorxiv.org/content/biorxiv/early/2019/11/25/849927.source.xml
