Untitled,https://www.govinfo.gov/content/pkg/CFR-2016-title24-vol5/xml/CFR-2016-title24-vol5-sec3280-611.xml
P-09 Island Fixture Venting - Permit Sonoma,https://permitsonoma.org/x65374.xml
P-09 2020-Current: Island Fixture Venting - Permit Sonoma,https://permitsonoma.org/x67357.xml
Ventilation and Venting,https://www.gpo.gov/fdsys/pkg/CFR-2002-title46-vol1/xml/CFR-2002-title46-vol1-part32-subpart32-55.xml
Morphology of Warts in the Tracheids of Cypress Pine (Callitris Vent ...,https://brill.com/view/journals/iawa/15/3/article-p265_10.xml%3Flanguage%3Den
"Oplophorid shrimp (Decapoda, Caridea) from an Arctic hydrothermal ...",https://brill.com/view/journals/cr/76/7/article-p871_8.xml
Venting of Heat and Carbon Dioxide from Urban Canyons at Night in,https://journals.ametsoc.org/view/journals/apme/44/8/jam2260.1.xml
Variation in Ornamental Traits of Dalea purpurea Vent. (Purple ...,https://journals.ashs.org/hortsci/view/journals/hortsci/27/8/article-p927.xml
The Incidence and Consequences of Filter Vent Blocking Amongst ...,https://www.degruyter.com/view/j/cttr.1998.18.issue-2/cttr-2013-0672/cttr-2013-0672.xml
