Nonalignment: Yugoslavia's Foreign Policy Climax - Brill,https://brill.com/previewpdf/book/9789004358997/BP000015.xml
Why We Cannot Make History. Some Remarks on a Lesson ... - Brill,https://brill.com/view/journals/jph/4/2/article-p121_2.xml%3Flanguage%3Den
Rear Admiral (Astronaut) Alan Shepard: Ménière's disease and the ...,https://thejns.org/view/journals/j-neurosurg/131/1/article-p304.xml
"Franklin Repository: June 8, 1859 - Valley of the Shadow: Civil War ...",https://valley.lib.virginia.edu/news/fr1859/pa.fr.fr.1859.06.08.xml
Editorial in: Transfers Volume 7 Issue 1 (2017) - Berghahn Journals,https://www.berghahnjournals.com/view/journals/transfers/7/1/trans070101.xml
LightningDOT: Pre-training Visual-Semantic Embeddings for Real ...,https://aclanthology.org/2021.naacl-main.77.xml
Characterizing Transport between the Surface Mixed Layer and the ...,https://journals.ametsoc.org/downloadpdf/journals/phoc/35/4/jpo2699.1.xml
Urban Ethnography - Sociology - Oxford Bibliographies,https://www.oxfordbibliographies.com/view/document/obo-9780199756384/obo-9780199756384-0256.xml
Paradise - Jewish Film Institute,https://sfjff.org/x6110.xml
