Land: Guarding against single story narratives | News24,https://www.theuknews.com/news/258000961/oct04v40.flv
Threats to media freedom in Africa: some old methods and some new,https://www.kenyastar.com/news/258086124/oct04v40.flv
"[PDF] Parsi Theater, Urdu Drama, and the Communalization of Knowledge",https://minio.la.utexas.edu/colaweb-prod/profile/custom_pages/0/119/parsi_theater_urdu_drama_and_the_communa_51b7a927-cb02-4217-9c55-0726dcb7b8bf.flv
DA after the De Lille saga - News24,https://www.irishsun.com/news/257255700/oct04v56.flv
'Star Wars' actor Kelly Marie Tran opens up about online harassment,https://www.malaysiasun.com/news/257874951/oct04v56.flv
"Putin Bullish On Russian Economy, Blasts West In Q&A Session",https://www.moscowinquirer.com/news/257438599/oct04v40.flv
Meet the Funding Recipients - IDHS,https://www.dhs.state.il.us/page.aspx/FACT_1WhatIsVR.flv%3Fitem%3D128226
SACLC Schedule.cwk - Linguistics Mailing List,http://listserv.linguistlist.org/pipermail/siouan/attachments/20100529/a9f2cc78/attachment.flv
New UN Rights Chief Voices Concern About Abuses Worldwide,https://www.beijingbulletin.com/news/257959534/feb24v21.flv
