EG softball clinches DVC title outright | Sports | egcitizen.com,http://www.egcitizen.com/articles/2014/05/07/sports/doc536924c521a29925495755.txt
Shorthanded Corvallis clinches share | High School | gazettetimes ...,http://gazettetimes.com/articles/2008/02/16/sports/high_school/2pre02_bx.txt
BASEBALL / PCMS clinches top seed after finishing unbeaten | Sports,http://www.theblacksheartimes.com/articles/2014/03/31/sports/doc5331d77b74464491034924.txt
Vinton Clinches WAMAC Conference Championship - Community ...,http://communitynewspapergroup.com/articles/2013/02/18/cedar_valley_daily_times/sports/doc511a9b5395be0468722985.txt
"Full text of ""History of Clinch County, Georgia"" - Internet Archive",https://archive.org/stream/historyofclinchc00huxf_0/historyofclinchc00huxf_0_djvu.txt
BHS clinches 18-4A title | Sports | brenhambanner.com,http://www.brenhambanner.com/articles/2007/10/20/sports/sports02.txt
Gallipolis Blue Devils clinch SEOAL golf championship | Sports,http://www.logandaily.com/articles/2011/09/03/sports/doc4e61b95e87deb178459470.txt
"Sharp Patriots clinch division, playoff berth | Sports - The Sun ...",http://www.thesunchronicle.com/articles/2009/12/28/sports/6685485.txt
Rising Sun falls flat in attempt to clinch title | Sports | cecildaily.com,http://www.cecilwhig.com/articles/2007/10/24/sports/03-local_roundup.txt
