[PDF] Custom Humanized Mouse Models - Taconic Biosciences,http://info.taconic.com/hubfs/Collateral/Brochures_And_Sell_Sheets/Taconic-Biosciences-Custom-Humanized-Mouse-Models.pdf
Autologous humanized mouse models of iPSC- derived tumors ...,https://www.cell.com/cell-reports-methods/pdf/S2667-2375(21)00230-7.pdf
[PDF] Humanized Mice - Foundation for Biomedical Research,https://fbresearch.org/wp-content/uploads/2022/02/FBR-Humanized-Mice-Fact-Sheet.pdf
Studies in humanized mice and convalescent humans yield a SARS ...,https://www.science.org/doi/pdf/10.1126/science.abd0827
[PDF] Humanized antibodies for antiviral therapy - NCBI,http://www.ncbi.nlm.nih.gov/pmc/articles/PMC51341/pdf/pnas01057-0266.pdf
Humanized GPRC6AKGKY is a gain-of-function polymorphism in mice,https://www.nature.com/articles/s41598-020-68113-z.pdf%3Forigin%3Dppub
[PDF] Validation of humanized PD-1 knock-in mice as an emerging model ...,https://www.criver.com/sites/default/files/resource-files/SP-AACR-19-validation-of-humanized-PD-1-knock-in-mice-as-an-emerging-model-to-evaluate-human-specific-PD-1-therapeutics.pdf
Human or Humanized Monoclonal Antibodies,https://www.karger.com/Article/Pdf/415995
Humanization of an anti-p185HER2 antibody for human - PNAS,https://www.pnas.org/doi/pdf/10.1073/pnas.89.10.4285
Modelling CAR-T therapy in humanized mice - The Lancet,https://www.thelancet.com/pdfs/journals/ebiom/PIIS2352-3964(19)30034-9.pdf
