Eighteen in: The Annotated Critical Laozi - Brill,https://brill.com/view/book/edcoll/9789004421646/BP000027.xml
Year-to-Year Reoutcropping of Eighteen Degree Water in an Eddy ...,https://journals.ametsoc.org/view/journals/phoc/45/4/jpo-d-14-0122.1.xml
Precipitation Characteristics in Eighteen Coupled Climate Models in,https://journals.ametsoc.org/view/journals/clim/19/18/jcli3884.1.xml
IMF Staff Country Reports Volume 2019 Issue 255: Cabo Verde,https://www.elibrary.imf.org/view/journals/002/2019/255/002.2019.issue-255-en.xml
Nixon's Vietnam War: The First Eighteen Months - Scholars Portal ...,https://journals.scholarsportal.info/details/09592318/v18i0002/288_nvwtfem.xml
SAGE Reference - The Handbook of Counseling,https://sk.sagepub.com/reference/the-handbook-of-counseling/n18.xml
DETECTION OF AN ACTH-SECRETING BRONCHIAL CARCINOID ...,https://eje.bioscientifica.com/view/journals/eje/67/4/acta_67_4_001.xml
Eighteen-Month Follow-up on the Treatment of Urinary ...,https://www.ajtmh.org/view/journals/tpmd/34/4/article-p746.xml
What has eighteen legs and catches flies? - NCTM,https://pubs.nctm.org/downloadpdf/journals/at/10/5/article-p293.xml
