Meet the Funding Recipients - IDHS,https://www.dhs.state.il.us/page.aspx/FACT_1WhatIsVR.flv%3Fitem%3D128226
"Volume XIII, Issue XXXVII - May 2020 - IDHS",https://www.dhs.state.il.us/page.aspx/FACT_Intro.flv%3Fitem%3D124359
Daemen University - ECC,https://www.eccsports.org/media/videos/ECC_Preseason_Poll_-_Softball.flv
Emory Softball's Cassie Walsh Intro to EmoryAthletics.com,https://www.emoryathletics.com/sports/sball/video/WalshIntro.flv
Former Softball Player Jenna Lamoreaux Reflects About Emory,https://www.emoryathletics.com/sports/sball/video/Lamoreaux_Talks_Emory.flv
"(Im)migration News Recap, Jan. 20-26",https://www.malaysiasun.com/news/259221934/feb24v21.flv
The long queue for social grants | News24,https://www.nigeriasun.com/news/251423063/oct04v40.flv
Trump Blames Democrats for Family Separations — Again,https://www.austinglobe.com/news/257494417/oct04v40.flv
Eastern Cape taxi strike disrupts social grant payments - News24,https://www.sierraleonetimes.com/news/258014998/oct04v56.flv
Lottery grant of R28.3m goes to waste as Limpopo school falls apart,https://www.polandsun.com/news/258095902/oct04v56.flv
