Kinetics of fast brominations: A potentiometric study,https://pubs.acs.org/doi/pdf/10.1021/ed046p370
On the mechanism of N-bromosuccinimide brominations ...,https://pubs.acs.org/doi/pdf/10.1021/jo00164a021
[PDF] Radical Brominations of Alkanic Positions by Bromine and by N,http://digitalcommons.lsu.edu/cgi/viewcontent.cgi%3Farticle%3D3616%26context%3Dgradschool_disstheses
Brominations with Pr4NBr9 as a Solid Reagent with High Reactivity ...,https://www.thieme-connect.com/products/ejournals/pdf/10.1055/s-0033-1340705.pdf
Benzylic Brominations with N-Bromosuccinimide in (Trifluoromethyl),https://www.thieme-connect.com/products/ejournals/pdf/10.1055/s-0029-1216793.pdf
Bromination of Hydrocarbons. II. Photochemical Bromination of ...,https://aip.scitation.org/doi/pdf/10.1063/1.1723897
Kinetics of electrophilic brominations. Mechanistic significance of the ...,https://onlinelibrary.wiley.com/doi/pdf/10.1002/kin.550150305
The Bromination of Aromatic Compounds with a Mixture of ...,https://www.journal.csj.jp/doi/pdf/10.1246/bcsj.37.960
[PDF] REGIOSELECTIVITY IN FREE RADICAL BROMINATION OF ...,https://etd.ohiolink.edu/apexprod/rws_etd/send_file/send%3Faccession%3Dmiami1263340046%26disposition%3Dinline
[PDF] The synthetic protocol for α-bromocarbonyl compounds via ...,https://www.sciencedirect.com/science/article/am/pii/S0040402019303503
