On the Safe Side - Safety+Health Magazine,https://www.safetyandhealthmagazine.com/media/podcasts/1332-on-the-safe-side.rss
Travel Safe - CDC Media Library,https://tools.cdc.gov/api/v2/resources/media/302090.rss%3Ftype%3Da
Safe and Sound Protocol (SSP) Podcast- A Polyvagal Theory ...,https://feeds.buzzsprout.com/730355.rss
Marked Safe: A Disaster Podcast - Buzzsprout,https://feeds.buzzsprout.com/1112411.rss
Simple tweak of lead-safe ordinance will help kids | The Blade,https://www.toledoblade.com/Editorials/2017/09/08/Simple-tweak-of-lead-safe-ordinance-will-help-kids/stories/feed/feed/index.rss
Lawsuit against lead-safe law is irrational | The Blade,https://www.toledoblade.com/Opinion/Editorials/2018/06/08/Lawsuit-against-lead-safe-law-is-irrational/stories/feed/index.rss
a safe destination for your investments | Consulate General of the ...,https://www.mzv.cz/losangeles/en/trade_and_economy/for_investors/index.rss
Article notification: New version of Safe Measurements for ... - MZV,https://www.mzv.cz/seoul/en/visas_and_consular_information/new_version_of_safe_measurements_for.rss%3Fnotify%3D1
RESPECTFULLY JUSTIN - Audioboom,https://audioboom.com/channels/5075221.rss
