The Forest World - Texas Archive of the Moving Image,https://texasarchive.org/2009_00191.flv
Indian Folk Traditions and - the Modern Theatre,https://minio.la.utexas.edu/colaweb-prod/profile/custom_pages/0/119/indian_folk_traditions_and_the_modern_th_ea595889-23ff-42e8-b4e6-0640896eeacc.flv
EU Gears Up for Trade War as Populist Challenge Grows,https://www.madagascarsun.com/news/257470968/oct04v56.flv
North's Missile Frustrates South Korea's Olympic Preparation,https://www.northkoreatimes.com/news/255602103/oct04v56.flv
China Rebuffs Trump's Blame in North Korea Denuclearization Fallout,https://www.northkoreatimes.com/news/257651848/oct04v56.flv
| justACRO.com,https://justacro.com/news/120822/icare-clip09.flv%3Fpage%3D29
"Employees Pose Big Potential Danger to Aviation, Experts Say",https://www.internationaltravelnews.com/news/257828044/oct04v56.flv
Tension Flares in Kosovo Over Possible Land Swap With Serbia,https://www.polandsun.com/news/258057585/feb24v21.flv
"The Week In Russia: Spies, 'Scumbags,' And Senior Citizens",https://www.austinglobe.com/news/258086108/oct04v40.flv
