XML - Nova Scotia Open Data,https://data.novascotia.ca/api/views/ee6b-9nmb/rows.xml%3FaccessType%3DDOWNLOAD
Home Ground: A First Nations Perspective - Brill,https://brill.com/previewpdf/journals/adva/2/3/article-p255_5.xml
Technology Tips: The Paperless Classroom in - NCTM - National ...,https://pubs.nctm.org/view/journals/mt/108/3/article-p226.xml
The Back Page: Building the Unit Circle: A Patty Paper Approach in,https://pubs.nctm.org/view/journals/mt/103/3/article-p232.xml
JOURNAL OF THE HISTORY OF THE BEHAVIORAL SCIENCES,https://images.webofknowledge.com/alerting/cat2-WOSCC-CCC-MEDLINE-WOS000459599300003.xml
rss2.xml - Jim's Child Of The '60s - Podomatic,https://jwitty.podomatic.com/rss2.xml
Twist Around The Clock! - Podomatic,https://oldiesjim.podomatic.com/rss2.xml
"Foreign Affairs, A Talk with N. Thompson - Sympatico",http://www3.sympatico.ca/michael.north/thompson.xml
Contact Us,http://montreal.itamaraty.gov.br/en-us/contact_us.xml
