Leaf Epinasty Induced by Reflection of Light from Beneath Marigold ...,https://journals.ashs.org/hortsci/view/journals/hortsci/36/1/article-p83.xml
Evaluating Ethylene Sensitivity and Exogenous Ethylene Impact on ...,https://journals.ashs.org/horttech/view/journals/horttech/32/2/article-p129.xml
Biological activities and structure-activity relationship of substitution ...,https://journals.scholarsportal.info/details/0032079x/v255i0001/67_baasroorsnaa.xml
To Francis Darwin 13 [September 1878] 1 - Darwin Correspondence ...,https://www.darwinproject.ac.uk/letter/DCP-LETT-11692.xml
"IAWA Bulletin ns, Vol. 8 (1),1987 11 EFFECT OF ETHREL ON ... - Brill",https://brill.com/downloadpdf/journals/iawa/8/1/article-p11_2.xml
biorxiv BIORXIV bioRxiv bioRxiv Cold Spring Harbor Laboratory ...,https://www.biorxiv.org/content/biorxiv/early/2015/01/16/013821.source.xml
Author Summary - PLOS,http://open-repository.kisti.re.kr/cube/bitstream/open_repository/273824/1/journal.ppat.1005196.xml
AJPS American Journal of Plant Sciences 2158-2742 Scientific ...,https://www.scirp.org/xml/84927.xml
1471-2229-14-36 1471-2229 Research article Involvement of plant ...,http://digital.csic.es/bitstream/10261/89975/1/1471-2229-14-36.xml
