State archaeologists and lab confirm time in a bottle,http://shl.uiowa.edu/publications/lablink/201610/bottle.xml
Epic Big Bad Peanut Butter Cup 22oz Bottle - Rayan's Liquors,https://rayanliquors.com/shop/modules/homeslider/config.xml%3Fproduct-id%3D5d9d180fb741973fe24d0d23
Odious Cellars Fact Or Fiction Single Bottle - Rayans Liquor's,https://rayanliquors.com/shop/modules/homeslider/config.xml%3Fproduct-id%3D5fa310907c5c7d4684f9accc
Development of Bottle Gourd Lines Resistant to Zucchini Yellow ...,https://journals.ashs.org/hortsci/view/journals/hortsci/56/8/article-p909.xml
Wittgenstein's Enactive Apophaticism and Interreligious Dialogue in,https://brill.com/abstract/book/9789004408050/BP000006.xml
[PDF] Utility of anaerobic bottles for the diagnosis of bloodstream infections,https://journals.scholarsportal.info/pdf/14712334/v20inone/nfp_uoabftdobi.xml
Household Contamination of Baby Bottles and Opportunities to ...,https://www.ajtmh.org/view/journals/tpmd/100/4/article-p988.xml
Popular Combinations (Glass) - Radcom Packaging,https://radcompackaging.com/category/15/sitemap.xml%3F%26cap%3D15ML%26ind%3DCosmetic%26sort%3DDefault%26ap%3DFace%2520Wash%26nck%3D20%2520MM
Running Mechanics and Metabolic Responses With Water Bottles ...,https://journals.humankinetics.com/abstract/journals/ijspp/13/8/article-p977.xml
