Occupying a Middle Space: Toward a Mestiza Sport Studies in,https://journals.humankinetics.com/view/journals/ssj/20/1/article-p1.xml
sitemap_blogs_1.xml - MESTIZA NEW YORK,https://mestizanewyork.com/sitemap_blogs_1.xml
Depth Psychology in Gloria Anzaldúa's Borderlands/La Frontera,https://journals.scholarsportal.info/details/1920986x/v13inone/52_dpigabf.xml
Afterword: Community Writing Pedagogies in the Spirit of the New ...,https://brill.com/view/book/edcoll/9789004248472/B9789004248472-s013.xml
"The Brown/Mestiza Metaphor, or the Impertinence against Borders in",https://brill.com/view/book/9789401204774/B9789401204774-s009.xml
SAGE Reference - Encyclopedia of Gender and Society,https://sk.sagepub.com/reference/gender/n277.xml
Chapter 13 | Borderland-Mestizaje Feminism: The New Tribalism,https://methods.sagepub.com/book/handbook-of-critical-and-indigenous-methodologies/n13.xml
Gloria Anzaldúa - American Literature - Oxford Bibliographies,https://www.oxfordbibliographies.com/view/document/obo-9780199827251/obo-9780199827251-0078.xml
Collection on Gloria Evangelina Anzaldúa - TARO - Texas Archival ...,https://txarchives.org/utlac/finding_aids/00533.xml
