[PDF] Some Shrubs and Trees with Colored Foliage Growing in the Arnold ...,http://arnoldia.arboretum.harvard.edu/pdf/articles/1954-14--some-shrubs-and-trees-with-colored-foliage-growing-in-the-arnold-arboretum.pdf
[PDF] Herbs for Foliage and Fragrance - Rain Retail POS,https://media.rainpos.com/5482/herbs_for_foliage_and_fragrance.pdf
Measurement and analysis of human micro-Doppler features in ...,https://ieeexplore.ieee.org/iel7/7569813/7577473/07577483.pdf
Foliage Profile by Vertical Measurements - JSTOR,https://www.jstor.org/stable/1933693
In vitro propagation of green-foliaged Dracaena fragrans Ker.,https://link.springer.com/content/pdf/10.1007/BF00042277.pdf
Foliage Profile by Vertical Measurements - ESA Journals,https://esajournals.onlinelibrary.wiley.com/doi/pdf/10.2307/1933693
ESTIMATION OF FOLIAGE DENSENESS AND FOLIAGE ANGLE BY ...,https://www.publish.csiro.au/bt/pdf/BT9630095
[PDF] Inheritance of foliage color of common rosemallow (Hibiscus ...,https://as-botanicalstudies.springeropen.com/track/pdf/10.1186/s40529-019-0251-4.pdf
Impact of foliage on LoRa 433MHz propagation in tropical ...,https://aip.scitation.org/doi/pdf/10.1063/1.5022903
[PDF] Pleasing Purple Foliage - American Horticultural Society,https://ahsgardening.org/uploads/pdfs/2012-03r.pdf
