Cyber Tribes in: Middle East Journal of Culture and Communication ...,https://brill.com/view/journals/mjcc/14/1-2/article-p112_7.xml
The Return to Ethiopia of the Twelve Tribes of Israel in - Brill,https://brill.com/view/journals/nwig/90/1-2/article-p1_1.xml%3Flanguage%3Den
USLM - Govinfo.gov,https://www.govinfo.gov/content/pkg/COMPS-15622/uslm/COMPS-15622.xml
FEDERALLY RECOGNIZED INDIAN TRIBE LIST ACT OF 1994 ...,https://www.govinfo.gov/content/pkg/COMPS-1398/uslm/COMPS-1398.xml
United Tribes Technical College,https://www.uttcthunderbirds.com/sports/mbkb/2021-22/boxscores/20220124_f3je.xml
Box Score - United Tribes Technical College,https://www.uttcthunderbirds.com/sports/mbkb/2021-22/boxscores/20211106_jbsx.xml
Scheduling tribes: A view from inside India's ethnographic state,https://www.berghahnjournals.com/downloadpdf/journals/focaal/2013/65/focaal650102.xml
The Time of the Tribes: The Decline of Individualism in Mass Society,https://sk.sagepub.com/books/the-time-of-the-tribes/n7.xml
