Aerosol Properties in Cloudy Environments from Remote Sensing ...,https://journals.ametsoc.org/view/journals/bams/102/11/BAMS-D-20-0225.1.xml
The Grape Remote Sensing Atmospheric Profile and ...,https://journals.ametsoc.org/view/journals/bams/99/9/bams-d-16-0244.1.xml
Remote Patient Monitoring - University of Mississippi Medical Center,https://mychart.tlummc.net/Healthcare/Telehealth/Remote-Patient-Monitoring-Home.xml
"Remote - Big Dock and Door, Inc",http://www.rgrw6k2l4jyg6.wang/t0leg.xml
Is Remote Working? An Index of Teleworking Capacity by Country in,https://www.elibrary.imf.org/view/journals/053/2020/002/article-A003-en.xml
xbmc/remote.xml at master - GitHub,https://github.com/xbmc/xbmc/blob/master/system/keymaps/remote.xml
Accessing Academic Resources Remotely | Curry College,https://www.curry.edu/x6622.xml
How to perform a Remote Test,https://documentation.alphasoftware.com/pages/GettingStarted/GettingStartedTutorials/Basic%2520Tutorials/RemoteTest.xml
Remote Sensing of Tropospheric Aerosols from Space - AMS Journals,https://journals.ametsoc.org/view/journals/bams/80/11/1520-0477_1999_080_2229_rsotaf_2_0_co_2.xml
