Chapter 9: The Challenge of Machine Translation Post-editing - Brill,https://brill.com/view/book/edcoll/9789004351790/B9789004351790_013.xml
The Challenge of Machine Translation Post-editing - Brill,https://brill.com/downloadpdf/book/9789004351790/B9789004351790_013.xml
Evidence from translation trainees' self-perception and performance in,https://akjournals.com/view/journals/084/22/1/article-p100.xml
The interaction effect between source text complexity and machine ...,https://akjournals.com/view/journals/084/23/1/article-p36.xml
PET: a Tool for Post-editing and Assessing ... - ACL Anthology,https://aclanthology.org/L12-1587.xml
Post-editing time as a measure of cognitive effort - ACL Anthology,https://aclanthology.org/2012.amta-wptp.2.xml
Translation Tasks for Learning Collocations: Effects of Machine ...,https://journals.scholarsportal.info/details/10237267/v45i0001/27_ttflcetppast.xml
1. Introduction - Hindawi.com,https://downloads.hindawi.com/journals/complexity/2021/2806108.xml
Upper Floridan Aquifer Potentiometric Surface - ArcGIS Online,https://www.arcgis.com/sharing/rest/content/items/ad3c8d451657485088bc231023aa2d5b/info/metadata/metadata.xml%3Fformat%3Ddefault%26output%3Dhtml
Long-Short Term Masking Transformer - DBLP,https://dblp.org/pid/36/5940.xml
