Axonemal Dynein Arms - Cold Spring Harbor Perspectives in Biology,https://cshperspectives.cshlp.org/content/8/11/a028100.full.pdf
Axoneme Structure from Motile Cilia,https://cshperspectives.cshlp.org/content/9/1/a028076.full.pdf
Structure of a microtubule-bound axonemal dynein - Nature,https://www.nature.com/articles/s41467-020-20735-7.pdf%3Forigin%3Dppub
Distinct architecture and composition of mouse axonemal ... - PNAS,https://www.pnas.org/doi/pdf/10.1073/pnas.2021180118
Functional Diversity of Axonemal Dyneins as Assessed by in Vitro ...,https://bioone.org/journals/zoological-science/volume-31/issue-10/zs140066/Functional-Diversity-of-Axonemal-Dyneins-as-Assessed-by-in-Vitro/10.2108/zs140066.pdf
Axonemal structure and insect phylogeny,http://www.tandfonline.com/doi/pdf/10.1080/11250009309355851
"Tubulin glycylation controls axonemal dynein activity, flagellar beat ...",https://www.science.org/doi/pdf/10.1126/science.abd4914
Cytoplasmic factories for axonemal dynein assembly,https://journals.biologists.com/jcs/article-pdf/134/15/jcs258626/2092458/jcs258626.pdf
[PDF] Molecular architecture of axonemal microtubule doublets revealed ...,https://www.osti.gov/servlets/purl/902016
THE ROLE OF AXONEMAL COMPONENTS IN CILIARY MOTILITY,https://www.sciencedirect.com/science/article/pii/0300962989905586/pdf%3Fmd5%3D336931183eb39e1e883f766875014dd6%26pid%3D1-s2.0-0300962989905586-main.pdf%26_valck%3D1
An actin-like protein is a component of axonemes from ...,https://www.jbc.org/article/S0021-9258(17)30203-X/pdf
An Axonemal Dynein Particularly Important for Flagellar Movement ...,https://www.jbc.org/article/S0021-9258(20)58950-3/pdf
Loss of function of axonemal dynein Mdnah5 causes primary ciliary ...,https://academic.oup.com/hmg/article-pdf/11/6/715/9464874/ddf073.pdf
Identification and Analysis of Axonemal Dynein Light Chain 1 in ...,https://www.atsjournals.org/doi/pdf/10.1165/rcmb.2004-0335OC
Structure of the Decorated Ciliary Doublet Microtubule - Cell Press,https://www.cell.com/cell/pdf/S0092-8674(19)31081-5.pdf
Tubulin Lattice of the Axonemal Microtubule Doublet and Binding ...,https://www.cell.com/structure/pdfExtended/S0969-2126(15)00270-1
Fifty years of microtubule sliding in cilia,https://www.molbiolcell.org/doi/pdf/10.1091/mbc.E17-07-0483
A System for Analyzing Sliding and Axonemal Spoke Arrangements,https://rupress.org/jcb/article-pdf/71/2/589/1387752/589.pdf
Mechanical properties of ciliary axonemes and membranes as ...,https://jcs.biologists.org/content/104/4/1251.full.pdf
[PDF] Computational Modeling of Axonemal Dynein and Microtubules in ...,https://www.clemson.edu/science/departments/physics-astro/academics/undergrad-research/biophysics-reu/past-projects/alshehab.pdf
