Chapter 14: Inoculation Theory - SAGE Knowledge,https://sk.sagepub.com/reference/hdbk_persuasion2ed/n14.xml
Can Inoculation-Informed Public Relations Strategies Protect Fan ...,https://journals.humankinetics.com/view/journals/ijsc/9/1/article-p1.xml
Studies on the efficiency of different inoculation methods of rice ...,https://brill.com/view/journals/nemy/21/7/article-p673_1.xml%3Flanguage%3Den
Conclusion in: Battling Smallpox before Vaccination - Brill,https://brill.com/view/book/9789004465374/BP000019.xml%3Flanguage%3Den
Inoculation with Ericoid Mycorrhizal Fungi Alters Fertilizer Use of ...,https://journals.ashs.org/hortsci/view/journals/hortsci/40/3/article-p786.xml
An Artificial Inoculation Method to Select Mature Onion Bulbs ...,https://journals.ashs.org/hortsci/view/journals/hortsci/55/11/article-p1840.xml
Simultaneous Inoculation with Plasmodium Vivax and Plasmodium ...,https://www.ajtmh.org/view/journals/tpmd/s1-17/6/article-p855.xml
Primary Cutaneous (Inoculation) Blastomycosis: An Occupational ...,http://ajcp.oxfordjournals.org/content/79/2/253.source.xml
Neutrophil migration into the bovine uterine lumen following ...,https://rep.bioscientifica.com/view/journals/rep/93/2/jrf_93_2_011.xml
[PDF] New Parvovirus Associated with Serum Hepatitis in Horses after ...,https://journals.scholarsportal.info/pdf/10806040/v24i0002/303_npawshaiocbp.xml
