Chapter 13 Ancient Medicine in the Galenic Corpus: The Story of a ...,https://brill.com/view/book/9789004470200/BP000014.xml
Chapter 13 Ancient Medicine in the Galenic Corpus: The Story of a ...,https://brill.com/abstract/book/9789004470200/BP000014.xml
Galenic dural arteriovenous fistula: unusual clinical presentation ...,https://thejns.org/view/journals/j-neurosurg/97/2/article-p467.xml
Galenic dural arteriovenous fistula: unusual clinical presentation ...,https://thejns.org/downloadpdf/journals/j-neurosurg/97/2/article-p467.xml
The Elements of Vision: The Micro-Cosmology of Galenic Visual ...,https://journals.scholarsportal.info/details/00659746/v72i0005/1_teovtmtathii.xml
Galen - Classics - Oxford Bibliographies,https://www.oxfordbibliographies.com/view/document/obo-9780195389661/obo-9780195389661-0258.xml
Conserving health in early modern culture - manchester hive,https://www.manchesterhive.com/view/9781526113498/9781526113498.xml
"GALEN, On the Constitution of the Art of Medicine. The Art of ...",https://www.loebclassics.com/view/LCL523/2016/pb_LCL523.lix.xml
Background and purpose - Stroke and Vascular Neurology,https://svn.bmj.com/content/6/2/260.download.xml
