"Shaping Edits, Creating Fractals in - Berghahn Journals",https://www.berghahnjournals.com/view/journals/projections/13/1/proj130102.xml
"Shaping Edits, Creating Fractals - Berghahn Journals",https://www.berghahnjournals.com/downloadpdf/journals/projections/13/1/proj130102.xml
Edit Menu Functions - Alpha Anywhere Documentation,https://documentation.alphasoftware.com/pages/Ref/Desktop_Api/System/Menu%2520Functions/Edit%2520Menu%2520Functions.xml
karaf/test-edits.xml at main · apache/karaf - GitHub,https://github.com/apache/karaf/blob/master/tooling/utils/src/test/resources/org/apache/karaf/tools/utils/test-edits.xml
"[PDF] Efficient generation of stable, heritable gene edits in wheat using ...",https://journals.scholarsportal.info/pdf/14712229/v18inone/nfp_egoshgeiwuc.xml
Edit the Machining Data Library,http://www2.me.rochester.edu/courses/ME204/nx_help/en_US/tdocExt/content/t/com_opts_mach_data_lib-edit.xml
9 Conrad Gessner Edits Brudus Lusitanus. The Trials and ... - Brill,https://brill.com/view/book/edcoll/9789004364974/B9789004364974_010.xml
Wildland Fire Dispatch Area Boundaries (polygon),https://www.arcgis.com/sharing/rest/content/items/f0b016c313f24a83a4e5c515fc59b113/info/metadata/metadata.xml%3Fformat%3Ddefault%26output%3Dhtml
Manager of Executive Communications | Duquesne University,https://www.duq.edu/x155606.xml
