JNM Journal of Nanomaterials 1687-4129 1687-4110 Hindawi ...,http://downloads.hindawi.com/journals/jnm/2019/5942194.xml
The back-titration of chemisorbed atomic oxygen on copper by ...,https://akjournals.com/downloadpdf/journals/10973/91/1/article-p173.xml
Journal of Thermal Analysis and Calorimetry - AKJournals,https://akjournals.com/view/journals/10973/91/1/article-p173.xml
Two forms of chemisorbed sulfur on platinum and related studies ...,https://journals.scholarsportal.info/details/00220728/v96i0002/175_tfocsopars.xml
"Phenylacetylene chemisorbed on Pt (111), reactivity and molecular ...",https://journals.scholarsportal.info/details/03682048/v98-99inone/175_pcopracwcmap.xml
References - Copernicus.org,https://acp.copernicus.org/preprints/14/19293/2014/acpd-14-19293-2014.xml
1. Introduction - Hindawi.com,https://downloads.hindawi.com/journals/ijp/2011/596710.xml
Electronic structure and photoexcitation dynamics of chemisorbed ...,http://d-scholarship.pitt.edu/cgi/export/31384/MODS/d-scholarship-31384.xml
Experimental data of CaTiO 3 photocatalyst for degradation of ...,https://europepmc.org/articles/pmc7451799/bin/mmc2.xml
INHIBITION OF FREEZING NUCLEI BY ADSORBED ...,https://journals.ametsoc.org/view/journals/atsc/16/3/1520-0469_1959_016_0288_iofnba_2_0_co_2.xml
