Testing cladograms by fossil record: the ghost range test in - Brill,https://brill.com/view/journals/ctoz/69/4/article-p251_3.xml%3Frskey%3DGI4smB%26result%3D25
Cladistic Characters and Cladogram Stability | Scholars Portal ...,https://journals.scholarsportal.info/details/03636445/v18i0002/188_ccacs.xml
cladogram : A Dictionary of Climate Change and the Environment ...,https://www.elgaronline.com/view/nlm-book/9781849803878/c_583.xml
galaxy_lefse/plot_cladogram.xml at master - GitHub,https://github.com/biobakery/galaxy_lefse/blob/master/plot_cladogram.xml
Interspecific Relationships in Pistacia Based on RAPD ...,https://journals.ashs.org/hortsci/view/journals/hortsci/37/1/article-p168.xml
Review of a Bromeliad-Ovipositing Lineage in Wyeomyia and the ...,https://aesa.oxfordjournals.org/content/91/5/572.source.xml
biorxiv BIORXIV bioRxiv bioRxiv Cold Spring Harbor Laboratory ...,https://www.biorxiv.org/content/biorxiv/early/2022/01/22/2022.01.17.476642.source.xml
