Artificial Benignancy of Neoplasm - Cancer Research,https://cancerres.aacrjournals.org/content/canres/1/11/869.full.pdf
"Prediction of Benignancy of the Solitary ""Cold"" Thyroid Nodule by ...",https://jnm.snmjournals.org/content/jnumed/26/5/461.full.pdf
Borderline cases between benignancy and malignancy of the ...,https://www.tandfonline.com/doi/pdf/10.3109/00365520903287551
[PDF] Humoral Hypercalcemia of Benignancy: The Role of PTHrP,https://www.huntingtonhospital.org/wp-content/uploads/2019/11/CME-2nd-Monday.pdf
Pelvic imaging: multicystic uterine cervical lesions. can magnetic ...,https://journals.sagepub.com/doi/pdf/10.1080/02841850410003293
Humoral Hypercalcemia of Benignancy Secondary to Parathyroid ...,https://www.amjmedsci.com/article/S0002-9629(15)32312-0/pdf
[PDF] Sacrococcygeal Germ Cell Tumors : Differential Features between ...,https://synapse.koreamed.org/upload/synapsedata/pdfdata/1016jkrs/jkrs-35-417.pdf
[PDF] Tumor Malignancy to Benignancy Acetylation in Host Genes and ...,https://citeseerx.ist.psu.edu/viewdoc/download%3Fdoi%3D10.1.1.322.8014%26rep%3Drep1%26type%3Dpdf
Cytologic Malignancy Versus Benignancy - ProQuest,https://search.proquest.com/openview/78185bf7785e581a0ffa60d88efb0146/1.pdf%3Fpq-origsite%3Dgscholar%26cbl%3D42082
CLINICAL CHEMISTRY Case Report T h e H u m o r a l H ...,https://academic.oup.com/ajcp/article-pdf/105/4/487/24878228/ajcpath105-0487.pdf
