"Naloxone Hydrochloride 0.4 mg/mL Injection, USP 1 mL Carpuject",https://www.accessdata.fda.gov/SPL/DATA/F0F55C94-0C04-46C9-B82B-53EFBE8FF14F/F0F55C94-0C04-46C9-B82B-53EFBE8FF14F.XML
Methylprednisolone or naloxone treatment after acute spinal cord ...,https://thejns.org/view/journals/j-neurosurg/76/1/article-p23.xml
Effect of oral morphine and naloxone on pituitary-adrenal response ...,https://eje.bioscientifica.com/view/journals/eje/114/4/acta_114_4_008.xml
Effects of naloxone and electroacupuncture treatment on - plasma ...,https://joe.bioscientifica.com/downloadpdf/journals/joe/101/1/joe_101_1_012.xml
[PDF] Naloxone HCl - Ashp Publications,https://publications.ashp.org/previewpdf/book/9781585285402/ch176.xml%3FpdfJsInlineViewToken%3D136750927%26inlineView%3Dtrue
[PDF] Naloxone interventions in opioid overdoses: a systematic review ...,https://journals.scholarsportal.info/pdf/20464053/v8inone/nfp_niiooasrp.xml
"Findings from a Decade of Naloxone Distribution in Pittsburgh, PA",https://journals.scholarsportal.info/details/02791072/v50i0003/240_fptlbfondipp.xml
American Journal of Veterinary Research,https://avmajournals.avma.org/view/journals/ajvr/80/7/ajvr.80.7.696.xml
Objectives - BMJ Open,https://bmjopen.bmj.com/content/9/10/e030046.download.xml
