Starving Your Performance? Reduced Preexercise Hunger ...,https://journals.humankinetics.com/view/journals/ijspp/17/3/article-p458.xml
'A STARVING MOB HAS NO RESPECt' URBAN MARKETS AND ...,https://brill.com/view/book/edcoll/9789004401624/B9789004401624_s010.xml
II. Prohibition of Deliberate Starvation - Brill,https://brill.com/previewpdf/book/9789004288577/B9789004288577-s008.xml
Influence of starvation on testosterone-luteinizing hormone feedback ...,https://eje.bioscientifica.com/view/journals/eje/96/3/acta_96_3_019.xml
EFFECTS OF STARVATION ON LEVELS OF CORTICOTROPHIN ...,https://eje.bioscientifica.com/view/journals/eje/61/4/acta_61_4_011.xml
Potassium Starvation Increases Stomatal Conductance in Olive ...,https://journals.ashs.org/hortsci/view/journals/hortsci/41/2/article-p433.xml
starving Aztecs are alleged to have thrown millions of dollars' worth of,https://journals.ametsoc.org/downloadpdf/journals/bams/11/6-7/1520-0477-11_6-7_139a.xml
A Starving Revolution: ID Cards and Food Rationing in Bolivarian ...,https://journals.scholarsportal.info/details/14777487/v15i3-4/590_asricafribv.xml
A case study of gendered practices in the online pro-eating-disorder ...,https://journals.scholarsportal.info/details/03186431/v35i0004/595_hhbswapitopc.xml
