Foreword in: Decolonization and Anti-colonial Praxis - Brill,https://brill.com/view/book/edcoll/9789004404588/front-6.xml
Decolonization and International Law: Putting the Ocean on the Map in,https://brill.com/view/journals/jhil/23/1/article-p161_8.xml
Decolonization in International Law - Oxford Bibliographies,https://www.oxfordbibliographies.com/view/document/obo-9780199796953/obo-9780199796953-0195.xml
Introduction: Decolonization and Religion in the French Empire - JStor,https://www.berghahnjournals.com/downloadpdf/journals/fpcs/33/2/fpcs330201.xml
Decolonization and Restitution: Moving Towards a More Holistic and ...,https://www.berghahnjournals.com/view/journals/museum-worlds/8/1/armw080114.xml
Anishinaabekweg Dibaajimowinan (Stories) of Decolonization ...,https://journals.humankinetics.com/view/journals/ssj/35/3/article-p207.xml
Indigenous Feminist Gikendaasowin (Knowledge): Decolonization ...,https://journals.humankinetics.com/view/journals/ssj/aop/article-10.1123-ssj.2022-0007/article-10.1123-ssj.2022-0007.xml
Decolonization is not a metaphor | Scholars Portal Périodiques,https://journals.scholarsportal.info/details/19298692/v01i0001/nfp_dinam.xml%3Flang%3Dfr
Towards the 'tangible unknown': Decolonization and the Indigenous ...,https://journals.scholarsportal.info/details/19298692/v01i0001/nfp_ttudatif.xml
