Rolling Averages - SAGE Research Methods,https://methods.sagepub.com/reference/encyclopedia-of-survey-research-methods/n497.xml
The Effects of Self-Myofascial Release Foam Rolling on Muscle ...,https://journals.humankinetics.com/view/journals/ijatt/25/6/article-p294.xml
The Role of Structured Foam Rolling Programs in Improving ...,https://journals.humankinetics.com/view/journals/ijatt/26/3/article-p125.xml
Rolling Role and the National Curriculum in: Learning That Matters,https://brill.com/view/book/9789463004350/BP000010.xml
Stress distribution and strength condition of two rolling cylinders ...,https://www.ideals.illinois.edu/bitstream/handle/2142/4380/engineeringexperv00000i00408_tei.xml%3Fsequence%3D1
Effects of Rolling and Sand Topdressing on Dollar Spot Severity in ...,https://journals.ashs.org/horttech/view/journals/horttech/29/4/article-p394.xml
"Inventory Rolling Wheels Inc Fort Lauderdale, FL (954) 527-5522",https://www.rollingwheelsinc.com/inventory/feeds/atom.xml
Fault diagnosis of roll shape under the speed variation in hot rolling ...,https://journals.scholarsportal.info/details/1738494x/v20i0009/1410_fdorsusvihrm.xml
XML - Utah Legislature,https://le.utah.gov/xcode/Title59/Chapter14/C59-14_1800010118000101.xml
The Rolling Corpus in - Brill,https://brill.com/view/journals/dsd/27/2/article-p161_1.xml%3Flanguage%3Den
SECTION B PERFORMING OPERATIONS TRANSPORTING ...,ftp://ftp.wipo.int/pub/itos4ipc/ITSupport_and_download_area/IPC6/subclass/core/en/xml/B21B.xml
5 Rolling Expenditure Plans: Australian Experience and Prognosis in,https://www.elibrary.imf.org/abstract/books/071/02890-9781557751492-en/ch006.xml
