Policy Statement: Nondiscrimination and Affirmative Action - IDHS,https://www.dhs.state.il.us/page.aspx/FACT_Intro.flv%3Fitem%3D40749
Republican Advisers Weigh Trump Foreign Policy Risks,https://www.irishsun.com/news/243852805/oct04v56.flv
U.S. Security Adviser: Washington Not Pushing Iran 'Regime Change',https://www.irishsun.com/news/257260987/oct04v56.flv
Online Videos | Soil Science Society of America,https://www.soils.org/videos/play/psa/sssa-psa-001-water.flv
Nevada Interscholastic Activities Association - NIAA,https://www.niaa.com/misc/D-A/NIAA_Final.flv
Trump Blames Democrats for Family Separations — Again,https://www.austinglobe.com/news/257494417/oct04v40.flv
(Video) Salisbury cross country hosts Fall Classic - Salisbury,https://www.suseagulls.com/sports/xc/2011-12/videos/Fall_Classic_with_voiceover.flv
Coach Bokosky postgame interview (Black Hills State) - Chapman,https://www.chapmanathletics.com/sports/mbkb/2011-12/videos/VIDEO0024.flv
JamFest - Bridgewater St. - BSU Bears,https://www.bsubears.com/Campus_Recreation/Club_Sports/cheer/Multimedia/videovault/Bridgewater_State_College_Cheerleading.flv%3Flist%3D/Campus_Recreation/Club_Sports/cheer/Multimedia/videovault/cheervideo
