"[PDF] Dishing the Personal Narrative: Its Present Classroom Ignominy, Its ...",https://vc.bridgew.edu/cgi/viewcontent.cgi%3Farticle%3D1377%26context%3Dbr_rev
The Proof of Ignominy: Vichy France's Past and Presence - jstor,https://www.jstor.org/stable/20081654
Shanghai Prostitution Revisited (1849-1949) - JSTOR,https://www.jstor.org/stable/189340
Reappraising the Effects of the Greco-Ottoman War of 1897 on,https://muse.jhu.edu/article/754262/pdf
[PDF] igprof - the ignominious profiler - CERN Indico,https://indico.cern.ch/event/0/contributions/1294495/attachments/831/1440/IgProf_CHEP2004.pdf
"[PDF] Antisemitism, Near, and a Threshold for Ignominy",https://open.mitchellhamline.edu/cgi/viewcontent.cgi%3Farticle%3D1253%26context%3Dmhlr
[PDF] Ignominy - Denison Digital Commons,https://digitalcommons.denison.edu/cgi/viewcontent.cgi%3Farticle%3D1334%26context%3Dexile
The Proof of Ignominy: Vichy France's Past and Presence,https://www.cambridge.org/core/services/aop-cambridge-core/content/view/2C682CC3D0925A1DD4E50B6250A9C74D/S0960777300004781a.pdf/the-proof-of-ignominy-vichy-frances-past-and-presence.pdf
no place in the law: the ignominy of criminal libel,https://www.tandfonline.com/doi/pdf/10.1207/s15326926clp0904_4
