Treatment of aggressive pituitary tumours and carcinomas,https://eje.bioscientifica.com/view/journals/eje/178/3/EJE-17-0933.xml
Both aggressive and affiliative behaviour facilitate resource access ...,https://brill.com/view/journals/beh/157/3-4/article-p267_3.xml%3Flanguage%3Den
Deep brain stimulation for aggressiveness: long-term follow-up and ...,https://thejns.org/view/journals/j-neurosurg/134/2/article-p366.xml
Aggressive Behavior in the Disabled: Revisited | Pain Medicine,http://painmedicine.oxfordjournals.org/content/1/2/101.source.xml
"Pediatric Aggressive Mature B-Cell Lymphomas, Version 2.2020 ...",https://jnccn.org/view/journals/jnccn/18/8/article-p1105.xml
Management of Patients With Aggressive Nonmelanoma Skin ...,https://jnccn.org/abstract/journals/jnccn/20/5.5/article-p1_8.xml
SAGE Reference - Encyclopedia of Media ... - SAGE Knowledge,https://sk.sagepub.com/reference/encyclopedia-of-media-violence/i3801.xml
SAGE Reference - Encyclopedia of Media ... - SAGE Knowledge,https://sk.sagepub.com/reference/encyclopedia-of-media-violence/i519.xml
