Responses of Ornamental Grass and Grasslike Plants to Saline ...,https://journals.ashs.org/horttech/view/journals/horttech/28/6/article-p799.xml
Tolerance of Native and Ornamental Grasses to Over-the-top ...,https://journals.ashs.org/hortsci/view/journals/hortsci/53/6/article-p842.xml
"REVIEWS JAMES DAVID MUHLY, Copper and tin. The distribution ...",https://brill.com/previewpdf/journals/jesh/17/1/article-p103_6.xml%3FpdfJsInlineViewToken%3D804856685%26inlineView%3Dtrue
"A Gold and Lapis Lazuli Bead from Petras, Crete - Brill",https://brill.com/downloadpdf/book/edcoll/9789004353572/B9789004353572_005.xml
NPI Database | NPI:1033721881 | ABIGAIL SUZANNA MUHLY ...,https://www.hipaaspace.com/medical_billing/coding/national_provider_identifier/codes/npi_1033721881.xml
Tin Trade Routes of the Bronze Age: New evidence and new ...,https://journals.scholarsportal.info/details/00030996/v61i0004/404_ttrotbmsotaw.xml
FELL BUNDLES AND IMPRIMITIVITY THEOREMS: MANSFIELD'S ...,https://journals.scholarsportal.info/details/14467887/v95i0001/68_fbaitmaft.xml
Glacial Ridge Project - The Nature Conservancy,http://www.stbbr.com/ourinitiatives/regions/northamerica/unitedstates/minnesota/placesweprotect/glacial-ridge-project.xml
sitemap_blogs_1.xml - PlantingTree,https://www.plantingtree.com/sitemap_blogs_1.xml
