"Franklin Repository: 11 06, 1867 - Valley of the Shadow: Civil War ...",https://valley.lib.virginia.edu/news/fr1867/pa.fr.fr.1867.11.06.xml
BETWEEN REASON AND EXPERIENCE - Brill,https://brill.com/previewpdf/journals/dyp/42/1/article-p7_7.xml
Tony Blair and Military Intervention: Protector or Provocateur? - Brill,https://brill.com/previewpdf/book/edcoll/9789004280380/B9789004280380-s005.xml
"Trauma: Contemporary Directions in Theory, Practice ... - SAGE Books",https://sk.sagepub.com/books/trauma-contemporary/n11.xml
"Self and Nation: Categorization, Contestation and Mobilization",https://sk.sagepub.com/books/self-and-nation/n8.xml
AN EPISTLE FROM A SWISS Officer to his Friend at Rome . FROM ...,https://www.eighteenthcenturypoetry.org/works/o5154-w0090/o5154-w0090.xml
<emph>War Songs of the South:</emph> Electronic Edition.,https://docsouth.unc.edu/imls/shepperson/shepperson.xml
gordon.xml - Documenting the American South,https://docsouth.unc.edu/fpn/gordon/gordon.xml
The transnational kangaroo hunt in: Worlding the south,https://www.manchesteropenhive.com/view/9781526152893/9781526152893.00017.xml
The Wife of His Youth and Other Stories of the Color Line,https://docsouth.unc.edu/southlit/chesnuttwife/cheswife.xml
[PDF] The transnational kangaroo hunt - Worlding the south : Nineteenth ...,https://www.manchesteropenhive.com/downloadpdf/9781526152893/9781526152893.00017.xml
