Chapter 5 Leaving Judaism in - Brill,https://brill.com/view/book/edcoll/9789004331471/BP000006.xml
The Fractured Jew - Brill,https://brill.com/view/book/9789004510135/BP000011.xml%3Flanguage%3Den
Jew or Jew? A Note on Orthography - De Gruyter,https://www.degruyter.com/rutgers/view/book/9780813563046/10.36019/9780813563046-003.xml
Hellenistic Judaism - Biblical Studies - Oxford Bibliographies,https://www.oxfordbibliographies.com/view/document/obo-9780195393361/obo-9780195393361-0052.xml
Marx's defence of Jewish emancipation and critique of the Jewish ...,https://www.manchesteropenhive.com/view/9781526104960/9781526104960.00007.xml
Polish national identity and antisemitism in the third decade after the ...,https://www.elgaronline.com/view/edcoll/9781789903430/9781789903430.00046.xml
"Josephus, The Jewish War, Volume II: Books 3-4 - Loeb Classical ...",https://www.loebclassics.com/view/LCL487/1927/volume.xml
Bulletin of the John Rylands Library Volume 18 Issue 1 (1934),https://www.manchesterhive.com/view/journals/bjrl/18/1/article-p34.xml
"March 16, 2022 CCBC Catonsville at Montgomery College (MD)",https://www.ccbccatonsvillecardinals.com/sports/sball/2021-22/boxscores/20220316_h1ux.xml
Jewish Marriage as an Expression of Israel's Conflicted Identity,https://methods.sagepub.com/book/case-studies-in-interdisciplinary-research/n2.xml
