Ukraine Demands Access To Imprisoned Film Director Sentsov,https://www.irishsun.com/news/258057547/oct04v56.flv
"Trade Dispute Hits China's Yuan, Investors",https://www.londonmercury.com/news/257581337/oct04v56.flv
Protest Against Ingush-Chechen Land Swap Enters Third Day,https://www.santabarbarapost.com/news/258088921/oct04v40.flv
UN Says Ceasefire Reached for Libyan Capital,https://www.orangecountysun.com/news/257940417/oct04v56.flv
Dartmouth Too Much for Vermont - ECAC Hockey,https://www.ecachockey.com/women/video/2011-12/20120401_Dartmouth_Vermont-desktop.flv
Jake Mochoskay and Don Kellum Dunk Session - Ohio Dominican,https://www.ohiodominicanpanthers.com/sports/mbkb/2011-12/videos/Jake_Mochoskay_and_Don_Kellum_Dunk_Session_(9_6_11).flv
Left or Right: Whose Side Is History On? - Voice of America,https://www.calgarymonitor.com/news/258088644/oct04v40.flv
