Live video feed that showed giraffe birth to be taken down | The Blade,https://www.toledoblade.com/Culture/2017/04/18/Live-video-feed-that-showed-giraffe-birth-to-be-taken-down/stories/feed/index.rss
Pilot's many adventures showed his zest for life | The Blade,https://www.toledoblade.com/Deaths/2003/09/09/Pilot-s-many-adventures-showed-his-zest-for-life/stories/feed/feed/index.rss
Demi Lovato Shares Instagram Photo of Her Stomach - Insider,https://www.thisisinsider.com/demi-lovato-stomach-instagram-photo-2017-8/culture.rss
The craziest outfits at the MTV Video Music Awards - Insider,https://www.thisisinsider.com/crazy-outfits-at-mtv-vmas-2016-8/culture.rss
RLVNTNEWS PODCAST - Buzzsprout,https://feeds.buzzsprout.com/1634242.rss
Remarks at the Israel Council on Foreign Relations - MZV,https://www.mzv.cz/jnp/en/about_the_ministry/organization_of_the_ministry/minister/speeches_and_articles/archive/x2014_11_05_remarks_at_israeli_council_on_foreign_relations.rss%3Fforce_format%3Dmobile
