SEC FORM D/A,https://www.sec.gov/Archives/edgar/data/1630102/000148813815000001/xslFormDX01/primary_doc.xml
FORM D - SEC.gov,https://www.sec.gov/Archives/edgar/data/1773116/000177311619000001/xslFormDX01/primary_doc.xml
Irrigation System by Tailwater Recovery on ... - Water Resources,https://water.usgs.gov/GIS/metadata/styles/landingPage/nri92_cp447.xml
Model of predicted nitrate concentration in ... - Water Resources,https://water.usgs.gov/GIS/metadata/styles/landingPage/gwava-s_twre.xml
eng; USA utf8 dataset Kimberly L. Dibble U.S. Geological Survey ...,https://gis.water.ca.gov/app/test/wafDatagovDOI-orig/aHR0cHM6Ly9jYXRhbG9nLmRhdGEuZ292L2hhcnZlc3Qvb2JqZWN0LzUyNmFlMWVjLWUyYzAtNDcxYy1iMDI5LTFjODZjOWNmMWRmMg%3D%3D.xml
decodes xml - Rivergages.com,https://rivergages.mvr.usace.army.mil/WaterControl/Districts/MVR/decoding_xml/RRDI4.xml
MSE Modelling and Simulation in Engineering 1687-5605 1687 ...,https://downloads.hindawi.com/journals/mse/2018/3194935.xml
Sitemap,https://www.hishingsmart.com/sitemap.xml
Using Polyacrylamide (PAM) for Reducing Sediment and Nutrient ...,https://journals.ashs.org/hortsci/view/journals/hortsci/40/4/article-p1110C.xml
