'ways of seeing' politics in the digital media environment - Elgaronline,https://www.elgaronline.com/view/edcoll/9781782548751/9781782548751.00036.xml
Visibility and visualities: 'ways of seeing' politics in the digital media ...,https://www.elgaronline.com/abstract/edcoll/9781782548751/9781782548751.00036.xml
New Transdisciplinary Visualities As an Alternative to Redistribute ...,https://journals.scholarsportal.info/details/10431578/v33inone/165_ntvaaatrtpot.xml
The Visuality of Professionalised Sousveillance - Scholars Portal ...,https://journals.scholarsportal.info/details/14777487/v18i0002/276_tvops.xml
"Visuality in Social Media: Researching Images, Circulations and ...",https://methods.sagepub.com/book/the-sage-handbook-of-social-media-research-methods/i1909.xml
"Visuality, Virtuality and the Spatial Turn - SAGE Research Methods",https://methods.sagepub.com/book/advances-in-visual-methodology/n7.xml
Aspects of Visuality in Nonantolan Music Script in - Wilhelm Fink ...,https://www.fink.de/abstract/book/9783846765043/BP000014.xml
