[PDF] Fresnel reflection of diffusely incident light,http://nvlpubs.nist.gov/nistpubs/jres/29/jresv29n5p329_A1b.pdf
Diagnostic Value of CT Density in Patients With Diffusely Increased ...,https://www.ajronline.org/doi/pdf/10.2214/AJR.09.3319
[PDF] Angular Distribution of Diffusely Transmitted Light,https://repository.upenn.edu/cgi/viewcontent.cgi%3Farticle%3D1611%26context%3Dphysics_papers
Diffusely abnormal white matter converts to T2 ... - Oxford Academic,https://academic.oup.com/brain/advance-article-pdf/doi/10.1093/brain/awab448/43683786/awab448.pdf
Diffusely Abnormal White Matter in Multiple Sclerosis,https://academic.oup.com/jnen/article-pdf/72/1/42/9562199/72-1-42.pdf
[PDF] The Sonographic Evaluation of Diffuse Thyroid Disease and ...,https://www.pennmedicine.org/~/media/event%2520media/2016/thyroid%2520master%2520class/diffuse_thyroid_disorders.ashx%3Fla%3Den
Effect of a Sonographically Diffusely Enlarged Uterus Without ...,https://link.springer.com/content/pdf/10.1023%252FA%253A1020593930366.pdf
Diffusely Adhering Escherichia coli (DAEC) Strains - Wiley Online ...,https://onlinelibrary.wiley.com/doi/pdf/10.1111/j.1348-0421.1999.tb02388.x
Diffusely Thick Cerebral Cortex - JAMA Network,https://jamanetwork.com/journals/NEUR/articlepdf/588781/archneur_46_4_025.pdf
[PDF] Diffusely abnormal white matter converts to T2 lesion ... - bioRxiv,https://www.biorxiv.org/content/10.1101/2021.08.09.455717v1.full.pdf
Clinical Significance of Diffusely Increased 18F-FDG Uptake in the ...,https://jnm.snmjournals.org/content/jnumed/48/6/896.full.pdf
Heterogeneity among Strains of Diffusely Adherent <italic toggle ...,https://jcm.asm.org/content/43/4/1968.full.pdf
Diffusely increased bone marrow FDG uptake in recently untreated ...,https://onlinelibrary.wiley.com/doi/pdf/10.1111/ejh.12483
Repeated Dilution of Diffusely Held Debt* - JSTOR,https://www.jstor.org/stable/10.1086/429643
Alterations in the Brain Microenvironment in Diffusely Infiltrating Low ...,https://www.neurosurgery.theclinics.com/article/S1042-3680(18)30882-9/pdf
ERBB1 Is Amplified and Overexpressed in High-grade Diffusely ...,https://aacrjournals.org/clincancerres/article-pdf/9/10/3620/2085603/df1003003620.pdf
Partial Collimation of Diffuse Light from a Diffusely Reflective Source,https://www.tandfonline.com/doi/pdf/10.1080/09500349214552131
Complete surgical correction of the totally occluded and diffusely ...,https://www.sciencedirect.com/science/article/pii/S0022522319423301/pdf%3Fmd5%3Dd6207b034d3c82a6e9684d0a1e91ec2a%26pid%3D1-s2.0-S0022522319423301-main.pdf
"PDF, Holographic Generation of Contour Map of Diffusely Reflecting ...",https://iopscience.iop.org/article/10.1143/JJAP.7.904/pdf
[PDF] Subsurface Probing in Diffusely Scattering Media Using Spatially ...,https://opg.optica.org/viewmedia.cfm%3Fid%3D116982%26seq%3D0
GAIN IN A DIFFUSELY PUMPED RAMAN AMPLIFIER,https://aip.scitation.org/doi/pdf/10.1063/1.1754260
Optimal Method of Coronary Endarterectomy for Diffusely Diseased ...,https://www.annalsthoracicsurgery.org/article/S0003-4975(04)01396-7/pdf
[PDF] Standoff Detection from Diffusely Scattering Surfaces using Dual ...,http://www.psicorp.com/sites/psicorp.com/files/articles/SR-2018-4-SPIE-Hensley.pdf
Pathological basis of diffusely abnormal white matter - SAGE Journals,http://journals.sagepub.com/doi/pdf/10.1177/1352458510384008
Diffraction by Diffusely Scattering Materials of High Transparency,https://journals.iucr.org/j/issues/1995/01/00/hn0020/hn0020.pdf
Diffusely Bound Mg2+ Ions Slightly Reorient Stems I and II of the ...,http://pubs.acs.org/doi/pdf/10.1021/bi0347757
Insights from sodium (23Na) MRI - Multiple Sclerosis and Related ...,https://www.msard-journal.com/article/S2211-0348(21)00018-3/pdf
Alterations in molecular pathways of diffusely infiltrating glial ...,https://www.spandidos-publications.com/ijo/23/4/857/download
Pressure injury prediction using diffusely scattered light,https://www.spiedigitallibrary.org/journals/Journal-of-Biomedical-Optics/volume-22/issue-2/025003/Pressure-injury-prediction-using-diffusely-scattered-light/10.1117/1.JBO.22.2.025003.pdf
“EMG Disease” or Asymptomatic Myotonia Congenita? A Report of 2 ...,https://www.archives-pmr.org/article/S0003-9993(07)00432-7/pdf
