"US Consumer Spending Rises, Brexit Casts Shadow on Outlook",https://www.irishsun.com/news/245417165/feb24v21.flv
News Article: Global food import bill on the rise despite stable markets,https://www.irishsun.com/news/253508035/oct04v56.flv
Turkey's Currency Dips Again,https://www.ohiostandard.com/news/257831990/oct04v56.flv
"Report: Canada, US Make Progress on NAFTA; No Deal Yet",https://www.ohiostandard.com/news/258063165/oct04v56.flv
Young Americans Are Less Wealthy Than Their Parents,https://www.indiagazette.com/news/257837598/oct04v56.flv
"Filipinos Favor US Aid, Leery of China",https://www.malaysiasun.com/news/248746639/oct04v56.flv
Trump ratchets up tariff pressure on China with $200 billion hit | Fin24,https://www.chinanationalnews.com/news/258006974/oct04v56.flv
"100+ ""Sap-(fi)-hcu.flv"" profiles | LinkedIn",https://www.linkedin.com/pub/dir/%2B/Sap-%2528fi%2529-hcu.flv
"The Week In Russia: Spies, 'Scumbags,' And Senior Citizens",https://www.austinglobe.com/news/258086108/oct04v40.flv
IPTV: мировые тенденции развития и перспективы в России,http://broadcasting.ru/articles2/econandmen/iptv-mirovie-tendencii/video.flv/video.flv
