DETERMINATION OF SOLUBILITY OF SPARINGLY SOLUBLE ...,https://pubs.acs.org/doi/pdf/10.1021/ja01359a013
[PDF] Using quotations – sparingly! - The University of Edinburgh,http://www.docs.hss.ed.ac.uk/iad/Undergraduate/Resources/IAD_using_quotation.pdf
Analysis of Porous Electrodes with Sparingly Soluble Reactants,https://iopscience.iop.org/article/10.1149/1.2408300/pdf
[PDF] Sparingly Soluble Selenites 401 p[SeO~-],https://srdata.nist.gov/solubility/IUPAC/SDS-26/SDS-26-pages_401.pdf
Water Solubility of Sparingly Soluble Salts of Weak Acids and/Or ...,https://onlinelibrary.wiley.com/doi/pdf/10.1002/bscb.19951041205
THE PREPARATION OF SPARINGLY SOLUBLE PENICILLIN SALTS,https://onlinelibrary.wiley.com/doi/pdf/10.1111/j.2042-7158.1954.tb10917.x
The Effect of Co-solvent on the Solubility of a ... - ScienceDirect.com,https://www.sciencedirect.com/science/article/pii/S1877705816310153/pdf%3Fmd5%3Db7c72c6926d0ba5011ec25b8e7199fd2%26pid%3D1-s2.0-S1877705816310153-main.pdf
The Solubility of Some Sparingly Soluble Salts of Zinc and Cadmium ...,https://aip.scitation.org/doi/pdf/10.1063/1.555909
MECHANISMS OF GROWTH AND DISSOLUTION OF SPARINGLY ...,https://www.degruyter.com/document/doi/10.1515/9781501509131-013/pdf
The Electrokinetic Potential of Sparingly Soluble Salts,https://www.journal.csj.jp/doi/pdf/10.1246/bcsj.37.386
