A laboratory ozonizer,https://pubs.acs.org/doi/pdf/10.1021/ed032p154
An easily made ozonizer,https://pubs.acs.org/doi/pdf/10.1021/ed005p1493
[PDF] Instructions for Use Ozonizer CERTIZON C25 C50 C100 C200 C300,https://www.aqua-sander.de/fileadmin/downloads/gebrauchsanweisungen/en/Ozone_Certizon.pdf
A ceramic-based ozonizer using high-frequency discharge,https://ieeexplore.ieee.org/iel1/28/164/00002860.pdf
Design and implementation of a highly efficient DBD ozonizer using ...,https://ieeexplore.ieee.org/iel7/6516132/6520164/06520510.pdf
Ozone Generation of Bipolar-Type Ceramic Ozonizer ... - IOPscience,https://iopscience.iop.org/article/10.1143/JJAP.32.1229/pdf
[PDF] OPERATION CONDITIONS IN AN OZONIZER CONTAINING A WIRE ...,https://citeseerx.ist.psu.edu/viewdoc/download%3Fdoi%3D10.1.1.550.2234%26rep%3Drep1%26type%3Dpdf
[PDF] Murata Ionisiomo Solution 2020 [Ionizer & Ozonizer],https://go.murata.com/rs/382-MEZ-125/images/HC%2520Ionizer%2520Ozonizer%25202020.pdf
Use of Borosilicate Glass in Ozonizer Tubes - Science,https://www.science.org/doi/pdf/10.1126/science.128.3338.1578
AN OZONIZER FOR LABORATORY USE* By M. J. Goss and MAX ...,https://academic.oup.com/jaoac/article-pdf/21/2/327/32762035/jaoac0327.pdf
