"Rio Theatre, Upcoming Events in Santa Cruz on DoTheBay",http://do415.com/venue/rio-theatre.rss
"The Castro Theatre, Upcoming Events in San Francisco on DoTheBay",http://do415.com/venue/the-castro-theatre.rss
Theatre Theater - Audioboom,https://audioboom.com/channels/5023109.rss
NT Talks - AWS,http://audioboom.com/channels/2543339.rss
"The West End Frame Show: Theatre News, Reviews & Chat",https://feeds.buzzsprout.com/404491.rss
A Musical Theatre Podcast - Megaphone,https://feeds.buzzsprout.com/719289.rss
AMC Theatres to acquire Carmike Cinemas | The Blade,https://www.toledoblade.com/Movies/2016/03/03/AMC-Theatres-to-acquire-Carmike-Cinemas/stories/feed/feed/index.rss
MusicalTalk - The UK's Independent Musical Theatre Podcast - Libsyn,https://pod.link/190005618.rss
The Suitcase Theatre at the Jewish Culture Festival - MZV,https://www.mzv.cz/copenhagen/en/culture_education/cultural_events/theatre/the_suitcase_theatre_at_the_jewish_1.rss%3Fnotify%3D1
