Permutational Extreme Values of Autocorrelation Coefficients and a ...,https://projecteuclid.org/journals/annals-of-statistics/volume-20/issue-1/Permutational-Extreme-Values-of-Autocorrelation-Coefficients-and-a-Pitman-Test/10.1214/aos/1176348536.xml
A Two-Dimensional Functional Permutational Central Limit Theorem ...,https://projecteuclid.org/journals/annals-of-probability/volume-4/issue-1/A-Two-Dimensional-Functional-Permutational-Central-Limit-Theorem-for-Linear/10.1214/aop/1176996177.xml
On sums of subsequent terms of permutations - AKJournals,https://akjournals.com/downloadpdf/journals/10473/41/1-2/article-p177.xml
Permutational Group Sequential Test for Time-to-Event Data R ...,http://cran.nexr.com/web/dcmeta/permGS.xml
A new improved NEH heuristic for permutation flowshop scheduling ...,https://journals.scholarsportal.info/details/09255273/v193icomplete/21_aninhfpfsp.xml
Cayley's Theorem - Sciendo,https://www.degruyter.com/view/j/forma.2011.19.issue-4/v10037-011-0030-5/v10037-011-0030-5.xml
Programma Dettagliato,https://aunicalogin.polimi.it/aunicalogin/getservizio.xml%3Fid_servizio%3D178%26c_classe%3D690176
Resampling A Conceptual and Procedural Introduction - SAGE ...,http://methods.sagepub.com/base/download/BookChapter/best-practices-in-quantitative-methods/d24.xml
Permutational Algorithm to Simulate Survival Data R package ...,https://cran.r-project.org/web/dcmeta/PermAlgo.xml
Serialism - Music - Oxford Bibliographies,https://www.oxfordbibliographies.com/view/document/obo-9780199757824/obo-9780199757824-0265.xml
