Kinematic Structure and Dynamics of the Denmark Strait Overflow ...,https://journals.ametsoc.org/view/journals/phoc/50/11/JPO-D-20-0095.1.xml
Baroclinic Instability of the Faroe Bank Channel Overflow in,https://journals.ametsoc.org/view/journals/phoc/44/10/jpo-d-14-0080.1.xml
Buffer Overflow Vulnerability In IBM Domino LDAP Server,https://support.ixiacom.com/strikes/exploits/ldap/cve_2015_0117_ibm_domino_ldap_server_modifyrequest_stack_buffer_overflow.xml
Kaspersky Antivirus Library Heap Buffer Overflow attack - Ixia Support,https://support.ixiacom.com/strikes/generic/ixia/kaspersky_antivirus_library_heap_buffer_overflow_attack.xml
Patterns of buffer overflow in a class of queues with long memory in ...,https://projecteuclid.org/journals/annals-of-applied-probability/volume-7/issue-4/Patterns-of-buffer-overflow-in-a-class-of-queues-with/10.1214/aoap/1043862423.xml
Wastewater Combined Sewer Overflow (CSO) Outfall Locations of ...,https://www.arcgis.com/sharing/rest/content/items/a78ebaf964764515a477b11c2bf2c881/info/metadata/metadata.xml%3Fformat%3Ddefault%26output%3Dhtml
XML,https://le.utah.gov/xcode/Title35A/Chapter16/C35A-16-S502_2022050420220504.xml
XML,https://le.utah.gov/xcode/Title35A/Chapter16/C35A-16-P5_2022050420220701.xml
Overwhelmed by overflows? - Manchester Open Hive,https://www.manchesteropenhive.com/view/9789198469813/9789198469813.xml
