set-list.xml - Ultimate Classic Rock,https://ultimateclassicrock.com/sitemap/category/set-list.xml
DIALOGUE AND DIALECTIC IN PLATO'S PHAEDO: PLATO AS ...,https://brill.com/previewpdf/journals/agpt/10/1-2/article-p40_5.xml
"Book Reviews in: Bijdragen tot de taal-, land - Brill",https://brill.com/view/journals/bki/162/4/article-p523_5.xml%3Flanguage%3Den
Acknowledgements in: Imperialism and music - manchester hive,https://www.manchesterhive.com/view/9781526121370/9781526121370.00006.xml
Classic 45's Jukebox,https://www.classic45s.com/classic45sjukebox.xml
jellyfin-androidtv/strings.xml at master - GitHub,https://github.com/jellyfin/jellyfin-androidtv/blob/master/app/src/main/res/values-en-rGB/strings.xml
A New Tonal System? - Oxford History of Western Music,https://www.oxfordwesternmusic.com/view/Volume4/actrade-9780195384840-div1-007006.xml%3Frskey%3DJLeURe%26result%3D464
SAGE Reference - The SAGE Handbook of Educational Action ...,https://sk.sagepub.com/reference/hdbk_edaction/n24.xml
XML Query Use Cases - W3C,https://www.w3.org/TR/2007/NOTE-xquery-use-cases-20070323/xquery-use-cases.xml
