Dependability of the theory of concrete arches ... - IDEALS @ Illinois,https://www.ideals.illinois.edu/bitstream/handle/2142/4476/engineeringexperv00000i00203_tei.xml%3Fsequence%3D1%26isAllowed%3Dy
Laboratory tests of three-span reinforced ... - IDEALS @ Illinois,https://www.ideals.illinois.edu/bitstream/handle/2142/4506/engineeringexperv00000i00270_tei.xml%3Fsequence%3D1%26isAllowed%3Dy
"Aviary, London Zoological Gardens - De Gruyter",https://www.degruyter.com/california/downloadpdf/book/9780520923201/10.1525/9780520923201-023.xml
SAGE Reference - The Handbook of Group Research and Practice,https://sk.sagepub.com/reference/the-handbook-of-group-research-and-practice/n27.xml
CRESWELL'S USE OF THE THEORY OF DATING BY THE ... - Brill,https://brill.com/downloadpdf/journals/muqj/8/1/article-p59_10.xml
The Topography of Images in Santiago Cathedral - Brill,https://brill.com/downloadpdf/book/edcoll/9789004288607/B9789004288607-s021.xml
The strategic role of perigean spring tides in nautical history and ...,https://www.gpo.gov/fdsys/pkg/CZIC-gc356-a1-w66-1978/xml/CZIC-gc356-a1-w66-1978.xml
Untitled,https://www.ccel.org/ccel/m/maclaren/psalms.xml
1. Introduction - Hindawi.com,https://downloads.hindawi.com/journals/jhe/2022/5171016.xml
Force production and spatial arm coordination profile in arm crawl ...,https://akjournals.com/view/journals/036/97/4/article-p385.xml
