"The inherent uncertainty of precipitation variability, trends, and ...",https://journals.ametsoc.org/view/journals/clim/aop/JCLI-D-21-0251.1/JCLI-D-21-0251.1.xml
Increased Risk of the 2019 Alaskan July Fires due to Anthropogenic ...,https://journals.ametsoc.org/view/journals/bams/102/1/BAMS-D-20-0154.1.xml
Investor Due Diligence and Legitimate Expectations in - Brill,https://brill.com/view/journals/jwit/23/2/article-p313_7.xml
Chapter 20 Legal and Political Considerations on the ... - Brill,https://brill.com/abstract/book/edcoll/9789004437753/BP000036.xml
Monogenic diabetes due to an INSR mutation in a child with severe ...,https://edm.bioscientifica.com/view/journals/edm/2022/1/EDM21-0114.xml
Excess mortality in Finnish diabetic subjects due to alcohol ...,https://eje.bioscientifica.com/view/journals/eje/179/5/EJE-18-0351.xml
Final Course Grades Due - Midwestern University,https://www.midwestern.edu/downers-grove-il-campus-catalog/downers-grove-overview/academic-policies/final-course-grades-due.xml
