"Toledo's breaking news, sports, and entertainment ... - The Blade",https://www.toledoblade.com/frontpage/2006/03/30/Parents-told-to-fight-early-use-of-alcohol/stories/feed/index.rss
Parents told to fight early use of alcohol - Toledo Blade,https://www.toledoblade.com/frontpage/2006/03/30/Parents-told-to-fight-early-use-of-alcohol/stories/feed/feed/index.rss
Outer Limits Of Inner Truth - Audioboom,https://audioboom.com/channels/5050764.rss
LifeRocks - Buzzsprout,https://feeds.buzzsprout.com/731243.rss
Friends for the Journey - Buzzsprout,https://feeds.buzzsprout.com/1363012.rss
The Daily Philosophy Podcast - Substack,https://api.substack.com/feed/podcast/95499.rss
