eloquent-blameable/.phpmd.cleancode.xml at master - GitHub,https://github.com/richan-fongdasen/eloquent-blameable/blob/master/.phpmd.cleancode.xml
Getting class blameable not found? ▷ Download gollumsf/doctrine ...,https://php-download.com/package/gollumsf/doctrine-extensions-bundle/file/Resources/config/blameable.xml
Series 1. General Correspondence. 1833-1916: Abraham ... - Loc,https://tile.loc.gov/storage-services/service/mss/mal/021/0214100/0214100.xml
"Thomas Jefferson to Thomas Pinckney, May 29 ... - American Memory",https://memory.loc.gov/service/mss/mtj/mtj1/020/020_1266_1269.xml
config/schema/User.User.orm.xml · master · Symfony ... - GitLab,https://gitlab.cwd.at/symfony/cwd-symfony-edition-old/-/blob/master/config/schema/User.User.orm.xml
Blaming and Forgiving Mentally Ill Abusers Christian Perring - Brill,https://brill.com/downloadpdf/book/edcoll/9781848881624/BP000003.xml
Cascading Morality After Dewey: A Proposal for a Pluralist Meta ...,https://brill.com/view/journals/copr/18/1/article-p18_18.xml
Untitled,https://akclivenews18.com/admin_panel/vendor/stof/doctrine-extensions-bundle/Resources/config/blameable.xml
"[PDF] Freedom, law, politics, genes: the case of mitochondrial transfer",https://www.manchesteropenhive.com/downloadpdf/9781526146472/9781526146472.00016.xml
