Neighbor wakes girl from burning West Toledo home | The Blade,https://www.toledoblade.com/Police-Fire/2007/06/21/Neighbor-wakes-girl-from-burning-West-Toledo-home/stories/feed/index.rss
Boy wakes up dad; they escape house fire | The Blade,https://www.toledoblade.com/Nation/2016/05/22/Boy-wakes-up-dad-they-escape-house-fire-7-year-old-didn-t-hesitate-when-he-smelled-smoke/stories/feed/index.rss
Wake Up Call with Tony Desiere & Ronn Culver - Audioboom,https://audioboom.com/channels/4554177.rss
Toronto 'Til I Die - Audioboom,https://audioboom.com/channels/4642880.rss
Wake Up Podcast by Aleks Svetski - Anchor,https://pod.link/1482223406.rss
Wake Up Call - Megaphone,http://feeds.soundcloud.com/users/soundcloud:users:387807353/sounds.rss
Hired: A Legal Career Podcast - Wake Forest Law,https://law.wfu.edu/podcasts/hired/rss/hired.rss
Wake Up With Weslie - Buzzsprout,https://feeds.buzzsprout.com/786119.rss
The Dark Mind Podcast - Spreaker,https://feeds.buzzsprout.com/1847686.rss
