Abnormal Pressure Natriuresis - AHA Journals,https://www.ahajournals.org/doi/pdf/10.1161/01.HYP.15.6.547%3Fdownload%3Dtrue
Renal sympathetic nerve activity and the exaggerated natriuresis of ...,https://www.ahajournals.org/doi/pdf/10.1161/01.HYP.3.1.134
The Mechanism of the Initial Natriuresis After Transjugular ...,https://www.gastrojournal.org/article/S0016-5085(97)00129-7/pdf
Circadian rhythm and postural change in natriuresis in non-dipper ...,https://www.nature.com/articles/1001185.pdf%3Forigin%3Dppub
Natriuresis of fasting: the possible role of leptin–neuropeptide Y ...,https://www.sciencedirect.com/science/article/pii/S0306987700911769/pdf%3Fmd5%3D7bb8957b549b13291a88af229878da91%26pid%3D1-s2.0-S0306987700911769-main.pdf
Mechanisms of pressure natriuresis,https://link.springer.com/content/pdf/10.1007/s11906-002-0040-3.pdf
Dissociation of natriuresis and diuresis and heterogeneity of the ...,https://www.jci.org/articles/view/113907/version/1/pdf/render.pdf
Natriuresis and Carbohydrate-Induced Antinatriuresis after ...,https://www.karger.com/Article/Pdf/179830
Natriuresis induced by mild hypernatremia in humans,https://journals.physiology.org/doi/pdf/10.1152/ajpregu.00732.2001
Role of NO on pressure-natriuresis in Wistar-Kyoto and ...,https://www.kidney-international.org/article/S0085-2538(15)57907-6/pdf
Excess diuresis and natriuresis during acute sleep deprivation in ...,https://journals.physiology.org/doi/pdf/10.1152/ajprenal.00126.2010
Adenosine and Renal Sodium Handling: Direct Natriuresis a nd ...,https://jasn.asnjournals.org/content/jnephrol/6/5/1491.full.pdf
Atrial natriuretic peptide and oxytocin induce natriuresis by ... - PNAS,https://www.pnas.org/doi/pdf/10.1073/pnas.96.1.278
Natriuresis in Rats Acutely Depleted of Chloride - Portland Press,https://portlandpress.com/clinsci/article-pdf/52/1/23/816807/cs0520023.pdf
[PDF] The effect of dopamine receptor blockade on natriuresis is ...,https://kidneyinternational-online.org/article/S0085-2538(15)57120-2/pdf
Circadian rhythm of natriuresis is disturbed in nondipper type of ...,https://www.ajkd.org/article/S0272-6386(99)70254-4/pdf
Furosemide-Induced Natriuresis as a Test To Identify Cirrhotic ...,https://aasldpubs.onlinelibrary.wiley.com/doi/pdf/10.1053/jhep.2001.20646
Vesical-Renal Reflex: Diuresis and Natriuresis Activated by ...,https://www.tandfonline.com/doi/pdf/10.3109/00365599509180537
Mobilising Oedema in the Oedematous Critically Ill Patient with ARDS,http://journals.sagepub.com/doi/pdf/10.1177/175114371101200204
[PDF] Atrial natriuretic peptide may not play a role in diuresis and ...,https://www.jtcvs.org/article/S0022-5223(19)34883-4/pdf
