Housing crisis has complicated divorces in must-sell situations,https://www.toledoblade.com/Real-Estate/2012/02/26/Housing-crisis-has-complicated-divorces-in-must-sell-situations/stories/feed/index.rss
Valerie Bertinelli divorcing Eddie Van Halen - Toledo Blade,https://www.toledoblade.com/TV-Radio/2005/12/06/Valerie-Bertinelli-divorcing-Eddie-Van-Halen/stories/feed/index.rss
The Divorced Dadvocate - Buzzsprout,https://feeds.buzzsprout.com/1014739.rss
Modern Divorce - The Do-Over For A Better You - Buzzsprout,https://feeds.buzzsprout.com/1357057.rss
How To Stay Married (So Far) - Audioboom,https://audioboom.com/channels/4930455.rss
K-HITS Mornings with Murphy & Melissa - JustCast,https://feed.justcast.com/shows/khits-mornings-with-murphy-melissa/audioposts.rss
Juicy Scoop with Heather McDonald - Simplecast,https://pod.link/1135332109.rss
Carol Dorian,https://www.transformationtalkradio.com/feed/episodes/itunes.rss%3Fhost%3D152
Latest Divorcelawyer Podcast Episodes - Pod.casts,https://pod.casts.io/topics/divorcelawyer/new-episodes.rss
