Lymph node colonization induces tumor-immune tolerance to ...,https://www.cell.com/cell/pdf/S0092-8674(22)00466-4.pdf
Psilocybin induces rapid and persistent growth of dendritic spines in ...,https://www.cell.com/neuron/pdf/S0896-6273(21)00423-2.pdf
Copper induces cell death by targeting lipoylated TCA cycle proteins,https://www.science.org/doi/pdf/10.1126/science.abf0529
SARS‑CoV‑2 spike protein induces cognitive deficit and anxiety‑like ...,https://www.nature.com/articles/s41598-022-09410-7.pdf%3Forigin%3Dppub
[PDF] and Endoplasmic Reticulum Stress-Dependent Pancreatic β-Cell ...,https://www.mdpi.com/1422-0067/23/5/2858/pdf
Tumor suppressor p53 induces miRâ•'1915 processing to inhibit ...,https://febs.onlinelibrary.wiley.com/doi/pdfdirect/10.1111/febs.12831
Oxidized phosphatidylcholine induces the activation of NLRP3 ...,https://jlb.onlinelibrary.wiley.com/doi/pdf/10.1189/jlb.3VMA1215-579RR
[PDF] Glucose induces cAMP-independent growth-related changes ... - NCBI,http://www.ncbi.nlm.nih.gov/pmc/articles/PMC51950/pdf/pnas01063-0255.pdf
airborne methyl jasmonate induces synthesis of proteinase ... - PNAS,https://www.pnas.org/content/87/19/7713.full.pdf%2Bhtml
"[PDF] ""Low for Long"" and Risk-Taking - International Monetary Fund",https://www.imf.org/-/media/Files/Publications/DP/2020/English/LFLRTEA.ashx
Helicobacter pylori Infection Induces Gastric Cancer in Mongolian ...,https://www.gastrojournal.org/article/S0016-5085(98)70143-X/pdf
FGF Induces a Switch in Death Receptor Pathways in Neuronal Cells,https://www.jneurosci.org/content/jneuro/21/14/4996.full.pdf
C-Reactive Protein Induces Apoptosis in Human Coronary Vascular ...,https://www.ahajournals.org/doi/pdf/10.1161/01.CIR.0000136999.77584.A2%3Fdownload%3Dtrue
[PDF] Activation of the NLRP3 inflammasome in dendritic cells induces IL ...,https://www.roswellpark.org/sites/default/files/gollnick_2-13-14_paper_for_lecture_3.pdf
Staurosporine induces apoptosis of melanoma by both caspase ...,https://aacrjournals.org/mct/article-pdf/3/2/187/1867593/187-197.pdf
[PDF] An Antibiotic Prescription Induces Resistance at the Individual Level ...,https://www.medicine.wisc.edu/sites/default/files/antibiotic_perscription_resistance_crnich.pdf
Bleomycin induces pleural and subpleural fibrosis in the presence of ...,https://erj.ersjournals.com/content/35/1/176.full.pdf
Inhibition of Wnt activity induces heart formation from posterior ...,http://genesdev.cshlp.org/content/15/3/316.full.pdf
Overexpressed active Notch1 induces cell growth arrest of HeLa ...,https://ijgc.bmj.com/content/ijgc/17/6/1283.full.pdf
