Production of live foals via intracytoplasmic injection of lyophilized ...,https://rep.bioscientifica.com/view/journals/rep/142/4/529.xml
Lyophilized Human Dura Mater as a Dural Substitute in - Journal of ...,https://thejns.org/view/journals/j-neurosurg/15/2/article-p192.xml
The Use of Adhesive and Lyophilized Dura in the Treatment of ...,https://thejns.org/view/journals/j-neurosurg/26/1part1/article-p92.xml
Do lyophilized platelets hold promise for treatment of hemorrhagic ...,https://avmajournals.avma.org/abstract/journals/javma/252/2/javma.252.2.168.xml
[PDF] Limited influence of marine sediment lyophilization on prokaryotic ...,https://journals.scholarsportal.info/pdf/21678359/v9inone/nfp_liomslcslith.xml
Whole genome integrity and enhanced developmental ... - Nature,https://journals.scholarsportal.info/pdf/20452322/v10inone/nfp_wgiaedfsamst.xml
Journal of Thermal Analysis and Calorimetry - AKJournals,https://akjournals.com/view/journals/10973/95/3/article-p881.xml
biorxiv BIORXIV bioRxiv bioRxiv Cold Spring Harbor Laboratory ...,https://www.biorxiv.org/content/biorxiv/early/2022/02/11/2022.02.10.479867.source.xml
The Protective Effect of Viable and Nonviable Ascaris Suum Larvae ...,https://www.ajtmh.org/view/journals/tpmd/14/5/article-p765.xml
