[PDF] Vitellin and Formation of Yolk Spheres in Vitellogenic Follicles of the ...,https://www.ars.usda.gov/ARSUserFiles/5129/VITOLLIN%2520AND%2520FORMATION.pdf
developmental changes in the level of vitellin - jstor,https://www.jstor.org/stable/1548924
CHARACTERIZATION OF VITELLIN AND VITELLOGENIN,https://www.sciencedirect.com/science/article/pii/002017908590068X/pdf%3Fmd5%3D7eae182ddc0b2a5903ec72067fe3ab57%26pid%3D1-s2.0-002017908590068X-main.pdf%26_valck%3D1
VITELLIN OF HEN'S EGG - ScienceDirect.com,https://www.sciencedirect.com/science/article/pii/S0021925818763874/pdf%3Fmd5%3D5af53b1bfda6358f4e1b3cfaeaef0460%26pid%3D1-s2.0-S0021925818763874-main.pdf
[PDF] Identification and Partial Characterization of vitellin and vitellogenin ...,https://www.zobodat.at/pdf/BERI_S10_0117-0121.pdf
Larval Development and Vitellin-like Protein Expression in ... - BioOne,https://bioone.org/journals/integrative-and-comparative-biology/volume-45/issue-1/45.1.51/Larval-Development-and-Vitellin-like-Protein-Expression-in-Palaemon-elegans/10.1093/icb/45.1.51.pdf
jcb0001.pdf - Oxford Academic,https://academic.oup.com/jcb/article-pdf/16/1/1/10337191/jcb0001.pdf
High quality purification of German cockroach vitellin/vitellogenin ...,https://www.jacionline.org/article/S0091-6749(21)02536-7/pdf
"Vitellin and vitellogenin in the soldier bug, <i>Podisus maculiventris ...",https://onlinelibrary.wiley.com/doi/pdf/10.1002/1520-6327%2528200007%252944%253A3%253C130%253A%253AAID-ARCH4%253E3.0.CO%253B2-B
Purification and characterization of oocyte vitellin from <i>Perinereis ...,https://febs.onlinelibrary.wiley.com/doi/pdf/10.1111/j.1432-1033.1984.tb08317.x
Protein and Lipid Composition of a Vitellin Isolated from Eggs of ...,https://www.degruyter.com/document/doi/10.1515/znc-2004-1-225/pdf
Changes in vitellin during oogenesis and effect of estradiol-17β on ...,https://www.tandfonline.com/doi/pdf/10.1080/07924259.1998.9652345
Mosquito Cathepsin B-like Protease Involved in Embryonic ...,https://www.jbc.org/article/S0021-9258(18)36881-9/pdf
"Protein, Vitellogenin, and Vitellin Levels in the Hemolymph and ...",https://www.journals.uchicago.edu/doi/pdfplus/10.2307/1542015
Mosquito Vitellin: Structural and Functional Studies with Monoclonal ...,https://www.cambridge.org/core/services/aop-cambridge-core/content/view/1E41464F3C1FFB4054B2156EEB98EF60/S1742758400011036a.pdf/mosquito_vitellin_structural_and_functional_studies_with_monoclonal_antibodies.pdf
[PDF] Using vitellin monoclonal antibodies to assess the vitellogenesis ...,http://www.scienceasia.org/2014.40.n2/scias40_157.pdf
Vitellin and Egg-Specific Protein as Metal-Binding - J-Stage,https://www.jstage.jst.go.jp/article/kontyushigen1930/62/4/62_4_310/_pdf
Purification and properties of vitellogenin and vitellin from a tick ...,https://link.springer.com/content/pdf/10.1007/BF00689722.pdf
HYDROLYSIS OF VITELLIN FROM THE HEN'S EGG - American ...,https://journals.physiology.org/doi/pdf/10.1152/ajplegacy.1909.24.1.153
