Workbook for Manual for Pharmacy Technicians - Ashp Publications,https://publications.ashp.org/view/book/9781585286201/9781585286201.xml
Legal Handbook for Pharmacy Technicians | ASHP,https://publications.ashp.org/view/book/9781585282791/9781585282791.xml
Survey finds underuse related to retention for veterinary technicians,https://avmajournals.avma.org/view/post/news/survey-finds-underuse-related-to-retention-for-veterinary-technicians.xml
Credentialed veterinary technician intrinsic and extrinsic rewards,https://avmajournals.avma.org/abstract/journals/javma/260/9/javma.22.01.0023.xml
Does a Novice Technician Produce Results Similar to That of an ...,https://journals.humankinetics.com/view/journals/ijsnem/29/4/article-p435.xml
With the Technicians | Scholars Portal Journals,https://journals.scholarsportal.info/details/00221546/v20i0007/373_wtt.xml
Parts Technician - SAIT,https://www.sait.ab.ca/x34806.xml
Reliability of technicians in computerized and standard A-mode ...,https://thejns.org/view/journals/j-neurosurg/41/6/article-p736.xml
II 112th CONGRESS 1st Session S. 1893 IN THE SENATE OF THE ...,https://www.govinfo.gov/content/pkg/BILLS-112s1893is/xml/BILLS-112s1893is.xml
