SAGE Reference - The SAGE Handbook of Drug and Alcohol Studies,https://sk.sagepub.com/reference/the-sage-handbook-of-drug-alcohol-studies-v1/i2932.xml
SAGE Reference - The SAGE Handbook of Drug ... - SAGE Knowledge,https://sk.sagepub.com/reference/the-sage-handbook-of-drug-alcohol-studies-v1/i2837.xml
"I'D LIKE TO WELCOME UP OUR FIRST SPEAKER FOR TODAY, DR ...",https://videocast.nih.gov/vodCaptions/ordr030117.xml%3Fdownload%3Dyes
Download .xml file - NIH VideoCast,https://videocast.nih.gov/vodCaptions/idi092415.xml%3Fdownload%3Dyes
"Addiction, Identity and the Problem of Normal Kimmo Saaristo - Brill",https://brill.com/downloadpdf/book/edcoll/9789401206716/B9789401206716-s012.xml
"Medically Treating, Not Healing - Brill",https://brill.com/downloadpdf/book/9789004420182/BP000012.xml
image-sitemap-2019-06-27.xml - TheHealthSite.com,https://www.thehealthsite.com/image-sitemap-2019-06-27.xml
"Modelling immune deterioration, immune recovery and state-specific ...",https://journals.scholarsportal.info/details/14712458/v20inone/nfp_midiralaupmm.xml
References in: Descending with angels - manchester hive,https://www.manchesterhive.com/view/9781526140326/9781526140326.00017.xml
TEI Simple Processing Model,https://exist.al.uw.edu.pl:8444/exist/apps/tei-simple/test/A10228.xml%3Froot%3D1.2.3.4.6%26odd%3Dbeamer.odd
