Russian mass media seeks motives for ambassador's assassination,https://www.irishsun.com/news/250341347/oct04v56.flv
Hoax or warning? Russian police find no explosives after receiving ...,https://www.northkoreatimes.com/news/250472165/oct04v56.flv
"Crocs shuts manufacturing, but going nowhere - Big News Network ...",https://www.northkoreatimes.com/news/257824866/oct04v56.flv
"Broncos waive former 1st-round pick Lynch, claim QB Hogan",https://www.kansascitypost.com/news/257931938/oct04v56.flv
Philippines' Mayon volcano causes heavy volcanic ashfall,https://www.illinoisintelligencer.com/news/256192357/oct04v56.flv
Praveen Kumar bids adieu to cricket - Big News Network.com,https://www.vietnamtribune.com/news/258149498/feb24v21.flv
