Stranglers,https://www.omnycontent.com/d/playlist/aaea4e69-af51-495e-afc9-a9760146922b/392bb045-9ca1-43cd-a8df-aa3200e14bdb/37dd8660-9458-4f11-9dc8-aa3200e14bdf/podcast.rss
DA: Dead suspect tied to '64 Boston Strangler case | The Blade,https://www.toledoblade.com/news/Nation/2013/07/11/DA-Dead-suspect-tied-to-64-Boston-Strangler-case/stories/feed/index.rss
Scientists say DeSalvo wasn't Boston Strangler | The Blade,https://www.toledoblade.com/Police-Fire/2001/12/07/Scientists-say-DeSalvo-wasn-t-Boston-Strangler/stories/feed/feed/index.rss
The Investigation and Trial of the Hillside Strangler - Buzzsprout,https://feeds.buzzsprout.com/1987088.rss
Crime N Dumplins - Buzzsprout,https://feeds.buzzsprout.com/1876220.rss
What Makes a Killer - Audioboom,https://audioboom.com/channels/5004071.rss
Strange - Audioboom,https://audioboom.com/channels/4699384.rss
Gruesome: Horrific True Crime - Zencastr,https://feeds.zencastr.com/f/RO_2-fIL.rss
The Generation Why Podcast - Art19.com,https://pod.link/541481026.rss
