Measurements of Axial Pressures in Tornado-like Vortices in,https://journals.ametsoc.org/view/journals/atsc/42/6/1520-0469_1985_042_0576_moapit_2_0_co_2.xml
Measurements of Maximum Surface Pressure Deficits in Modeled ...,https://journals.ametsoc.org/view/journals/atsc/39/2/1520-0469_1982_039_0369_momspd_2_0_co_2.xml
"LIVY, History of Rome 41 | Loeb Classical Library",https://www.loebclassics.com/view/livy-history_rome_41/1938/pb_LCL332.215.xml
"Book I - LIVY, History of Rome 1 | Loeb Classical Library",https://www.loebclassics.com/view/livy-history_rome_1/1919/pb_LCL114.39.xml%3FreadMode%3Dreader
Nondestructive detection of hydrogen in steel by vibration damping,https://journals.scholarsportal.info/details/03089126/v21i0005/327_ndohisbvd.xml
Numerical Study on the Secondary Air Performance of the Film ... - DOI,https://www.degruyter.com/view/j/tjj.ahead-of-print/tjj-2017-0022/tjj-2017-0022.xml
WeeklyVolcanoCAP.xml - Global Volcanism Program - Smithsonian ...,https://volcano.si.edu/news/WeeklyVolcanoCAP.xml
Primary Intraparenchymatous Hematomas in - Journal of ...,https://thejns.org/view/journals/j-neurosurg/27/3/article-p207.xml
Mullā Ṣadrā's Arrivers in the Heart (al-Wāridāt al-Qalbiyya) - Brill,https://brill.com/downloadpdf/journals/jss/10/1-2/article-p53_4.xml
