[PDF] POLYPIDE MORPHOLOGY AND FEEDING BEHAVIOR IN MARINE ...,https://repository.si.edu/bitstream/handle/10088/4625/sms_winston_1978.pdf
Polypide anatomy of hornerid bryozoans (<fc>Stenolaemata,https://onlinelibrary.wiley.com/doi/pdf/10.1002/jmor.21415
bryozoan Bugula and their inference in Archimedes,https://besjournals.onlinelibrary.wiley.com/doi/pdf/10.1111/j.1502-3931.1986.tb01903.x
indications of polypides in feeding zooids and polymorphs in - JStor,https://www.jstor.org/stable/1306841
Influence of food concentration on polypide regression in the marine ...,https://www.sciencedirect.com/science/article/pii/0022098194902232/pdf%3Fmd5%3D9a6cf9501bbf5d93cd85b4400a98c037%26pid%3D1-s2.0-0022098194902232-main.pdf
"[PDF] Tamberg, p. 1 Polypide anatomy of hornerid bryozoans (Stenolaemata",https://www.biorxiv.org/content/10.1101/2021.03.09.433978v1.full.pdf
In search of predictive models for stenolaemate ... - GeoScienceWorld,https://pubs.geoscienceworld.org/paleobiol/article-pdf/46/2/218/5073166/s0094837320000135a.pdf
Article - In search of predictive models for stenolaemate ...,https://www.cambridge.org/core/services/aop-cambridge-core/content/view/B9C84C4513F8CFC4CC96B0597FE8267A/S0094837320000135a.pdf/in_search_of_predictive_models_for_stenolaemate_morphometry_across_the_skeletalpolypide_divide.pdf
Biographies of Some Worms,https://www.journals.uchicago.edu/doi/pdf/10.1086/271523
