The Characteristics of Postmodern Cultural Media - Brill,https://brill.com/downloadpdf/journals/fphc/12/2/article-p265_265.xml
Early Dutch Ultracentrifuge Development in International Context - Brill,https://brill.com/downloadpdf/book/edcoll/9789004264885/BP000017.xml
[PDF] v11p1828.pdf - Theranostics,https://journals.scholarsportal.info/pdf/18387640/v11i0004/1828_adasctatiimf.xml
biorxiv BIORXIV bioRxiv bioRxiv Cold Spring Harbor Laboratory ...,https://www.biorxiv.org/content/biorxiv/early/2020/05/26/2020.05.26.116889.source.xml
biorxiv BIORXIV bioRxiv bioRxiv Cold Spring Harbor Laboratory ...,https://www.biorxiv.org/content/biorxiv/early/2020/05/31/2020.05.30.125062.source.xml
sitemap-paper-0004647.xml - Semantic Scholar,https://www.semanticscholar.org/sitemap-paper-0004647.xml
