The role of the AR/ER ratio in ER-positive breast cancer patients in,https://erc.bioscientifica.com/view/journals/erc/25/3/ERC-17-0417.xml
The AR in bone marrow progenitor cells protects against short-term ...,https://jme.bioscientifica.com/view/journals/jme/aop/jme-22-0038/jme-22-0038.xml
"A Study of AR-, TS-, and MCS-Associated Precipitation and Extreme ...",https://journals.ametsoc.org/view/journals/clim/35/2/JCLI-D-21-0145.1.xml
A Scale to Characterize the Strength and Impacts of Atmospheric ...,https://journals.ametsoc.org/view/journals/bams/100/2/bams-d-18-0023.1.xml
sitemap-ar-qa-core-1.xml - Apple Support,https://support.apple.com/ar-qa/sitemaps/sitemap-ar-qa-core-1.xml
Entry Augmented Reality - SAGE Reference - The SAGE ...,https://sk.sagepub.com/reference/the-sage-encyclopedia-of-educational-technology/i1586.xml
data/etc/android.hardware.camera.ar.xml - platform/frameworks/native,https://android.googlesource.com/platform/frameworks/native/%2B/master/data/etc/android.hardware.camera.ar.xml
R-Estimation of the Parameters of Autoregressive [Ar (p)] Models,https://projecteuclid.org/journals/annals-of-statistics/volume-21/issue-1/R-Estimation-of-the-Parameters-of-Autoregressive-Ar-p-Models/10.1214/aos/1176349041.xml
Frede Castberg Seksti Ar in - Brill,https://brill.com/view/journals/nord/22/1/article-p176_33.xml%3Flanguage%3Den
