WAG 07-04-09-b: Handling of Exempt Funds - IDHS,https://www.dhs.state.il.us/page.aspx/FACT_1WhatIsVR.flv%3Fitem%3D15145
$366 for a person: How do people become slaves in Russia?,https://www.kenyastar.com/news/258088617/oct04v40.flv
Japanese PM Abe Seen Headed for Extended Term Despite Flat ...,https://www.longbeachstar.com/news/257896731/oct04v56.flv
Iran's Parliament Passes Bill Against Funding Terrorism,https://www.philippinetimes.com/news/258095659/oct04v56.flv
NothingToxic.com | Skier Becomes a Human Fidget Spinner ...,https://nothingtoxic.com/download/73f65f7aa5fe4e5edbd796a90978cbcb.flv
Men's Hoops vs. Rivier - Saint Joseph's College of Maine,https://www.gomonks.com/sports/mbkb/2010-11/videos/vsrivier.flv
Online Videos - Certified Crop Adviser,https://www.certifiedcropadviser.org/videos/play/certified/education/cover-crops-soil-health.flv
Ira David's Pedal America TV Show,http://www.iradavidspedalamerica.com/joomla/index.php/component/content/frontpage/pedal_america_final.flv
"Hard to See, Hard to Breathe: US West Struggles with Smoke",https://www.batonrougepost.com/news/257869547/oct04v56.flv
Bosnia Struggling With Influx Of Migrants After Other Routes Shut ...,https://www.africaleader.com/news/257880419/oct04v56.flv
Echelon Void Collection - Wintercroft,http://echelonvoid.com/video/clips_for_empire_from_ollie.flv
TallyAll,https://tallyall.club/0:/live/Morning%2520Becomes%2520Eclectic%252C%2520Live%2520at%2520KCRW%2520-%2520Tally%2520Hall%2520%25282006%2529.flv%3Fa%3Dview
Amandla Stenberg: I'm Still Finding My Voice,https://www.nigeriasun.com/news/258101430/feb24v21.flv
CVMC eyes to become mega hospital by 2022 - Philippine Times,https://www.manilametro.com/news/257529014/oct04v40.flv
About US -> Secretary's Message,http://www.akinosato.cceg.ca/tr-trailers.com/cutecristina/trailer.flv
| justACRO.com,https://justacro.com/news/icare-clip09.flv%3Fpage%3D53
British Mining Venture Signs Exploration Deal in Afghanistan,https://www.cardiffstar.com/news/258088814/oct04v40.flv
US Lobsters Are a Target of China's Threatened Tariffs,https://www.manufacturingmirror.com/news/257497244/oct04v56.flv
Alibaba expected to raise $20 billion through IPO,https://www.irishsun.com/news/225297085/oct04v56.flv
Movie_Segments_for_Warm-ups_and_Follow ... - PBworks,http://seg7.pbworks.com/w/file/95705801/Movie_Segments_for_Warm-ups_and_Follow-ups_Death_Becomes_Her.flv
"After Mosul and Raqqa Fall, Where Will Next Battle With IS Be?",https://www.parisguardian.com/news/253809973/oct04v56.flv
Fast Wally | America's Got Talent Wiki - Fandom,http://agt.wikia.com/wiki/File:America%2527s_Got_Talent_Fast_Wally.flv
World Tourism Day: harnessing new technologies to transform travel,https://www.northkoreatimes.com/news/258052055/oct04v56.flv
Universal platform WiseMote - the WiSeNet Lab,http://www.wisenetlab.ru/forum/clever_chalk1.flv%3FPage%3Dplatform
Untitled,https://minio.la.utexas.edu/colaweb-prod/profile/custom_pages/0/119/indian_folk_traditions_and_the_modern_th_ea595889-23ff-42e8-b4e6-0640896eeacc.flv
Baby Signing Workshops - TinyTalk,https://www.tinytalk.co.uk/workshops.php/uboard/tt-n-video-files/small-gallery-video-1328505694-lhdmc-1815816269.flv
eps1.6_v1ew-s0urce.flv | Mr. Robot Wiki | Fandom,https://mrrobot.fandom.com/wiki/Eps1.6_v1ew-s0urce.flv
What Zimbabweans Say About First Post-Mugabe Poll,https://www.madagascarsun.com/news/257755074/oct04v56.flv
Checked bags on United Airlines to become expensive,https://www.vietnamtribune.com/news/257931882/oct04v56.flv
From Sri Lanka to America: 10 museums dedicated to great Russian ...,https://www.malaysiasun.com/news/251047901/oct04v56.flv
NATO Allies Defend Military Spending Amid Trump Criticism,https://www.polandsun.com/news/257605988/oct04v40.flv
How to Join Equity UK - Acting Modeling,http://www.hollywoodauditions.com/video/2008_superbowl_ads/2q/tide_to_go-talking_stain.flv
XNXX.COM,https://xxx.yayatube.com/video-4ymfdc6/u_usu_u..._u_u_u_u_c_u_u_u..._u_usu_-_u_u_.flv
Russia's military and NATO held first telephone talks in three years,https://www.stpetersburgstar.com/news/252223357/feb24v21.flv
"DA is not losing support, Maimane says in response to recent poll",https://www.johannesburglife.com/news/258575204/feb24v21.flv
WATCH: 20 000 rally for Scottish independence as Brexit looms,https://www.londonmercury.com/news/258089030/oct04v56.flv
Untitled,https://cdn-fck.moviefap.com/moviefap/22c66c0bd130388d8406.flv%3Fkey%3De29c806133dc49cab6928532ba75fc7c%26VID%3D377895%26rollover%3D1%26timeline%3D1%26startThumb%3D15
Gunmen kidnap German nurse in Somalia capital - News24,https://www.sierraleonetimes.com/news/257175132/oct04v56.flv
Expert's take: Why women must be at the heart of the humanitarian ...,https://www.trinidadtimes.com/news/248567191/oct04v56.flv
African First Ladies: Private Sector Trailing Gender Equality,https://www.northernirelandnews.com/news/254821009/oct04v40.flv
Whereabouts of 2 Former Colombian Rebel Leaders Unknown,https://www.orangecountysun.com/news/257926436/oct04v56.flv
Bosnians Cast Ballots After Divisive Election Campaign,https://www.mediterraneantimes.com/news/258089036/oct04v40.flv
Murali Yadama of MYK Laticrete wins 'The Most Trusted CEO' award,https://www.kualalumpurtimes.com/news/257934547/oct04v56.flv
US Senators Seek Action on Rohingya Refugee Crisis,https://www.myanmarsun.com/news/256206232/oct04v56.flv
Rowyo.com is for sale - Squadhelp,http://www.xuziping.com/vod/b6e6415fca49aa71df8e7b4075f1365d.flv
Links - The Israel Center for Social & Economic Progress,http://icsep.org.il/links/MiltonFriedmanEng.flv
"Trump, Kim Arrive In Singapore Ahead Of Historic Summit",https://www.southeastasiapost.com/news/257456627/oct04v40.flv
Welcome To IANS - India's Largest Independent News Service,https://ians.in/index.php/upload/Goodbye%2520KBC%25205.flv
"Gazprom Clinches Deal In Lengthy EU Antitrust Case, Avoids Fine",https://www.germanysun.com/news/257341421/oct04v56.flv
DOCTOR.WHO.FULL.HD.DROPBOX.flv - Tracy Johnson,https://seesaawiki.jp/naikugi/d/DOCTOR.WHO.FULL.HD.DROPBOX.flv
Markets Step Back After Three-Day Rally,https://www.cambodiantimes.com/news/247946535/oct04v56.flv
342.FLV - XNXX.com,https://xnxx-moi.com/vi24057305/342.flv
New Treatments Give Hope to People With Brain Tumors,https://www.ohiostandard.com/news/257618314/feb24v21.flv
The live broadcast room of the small fresh model A-Peach&comma ...,https://www.nudejet.com/video31513353/the_live_broadcast_room_of_the_small_fresh_model_a-peach_the_first_stop_of_the_chinese_live_video_broadcast_featuring_a_large_number_of_beautiful_talents.flv
Cyril feels Zuma heat | News24,https://www.businesssun.com/news/256443194/oct04v56.flv
"With Morkel struggling, Maharaj key to Proteas cause | Sport - News24",https://www.australianherald.com/news/256902350/oct04v40.flv
"U.S. airstrike targets Afghan ISIS group, kills its leader",https://www.shanghaisun.com/news/257903549/oct04v40.flv
I learned tailoring for Sui Dhaga: Varun Dhawan,https://www.entertainmentsun.com/news/257880466/oct04v56.flv
Czech Leader Opposes Merkel's Idea of EU Immigration 'Flexibility',https://www.munichmetro.com/news/257418721/oct04v40.flv
Turkey's Erdogan Wins New Term In Poll Criticized By Monitors,https://www.southamericatimes.com/news/257556113/oct04v56.flv
EU Lays Out Accession Path For Balkan Countries,https://www.dublinnews.com/news/256383024/oct04v40.flv
"The Week In Russia: Spies, 'Scumbags,' And Senior Citizens",https://www.austinglobe.com/news/258086108/oct04v40.flv
Australia break women's 4x100m freestyle WR | Sport - News24,https://www.brazilsun.com/news/256937346/feb24v21.flv
BTCA - Dakoda Brookes.FLV - XNXX.COM,https://www.xnxx2.com/video-64cbi52/btca_-_dakoda_brookes.flv
The matches that made Alastair Cook a record-breaker - ESPNcricinfo,https://www.jamaicantimes.com/news/257935754/oct04v40.flv
Illuminati sissy toy.FLV - XNXX.COM,https://www.xnxx.com/video-zm0zf2/illuminati_sissy_toy.flv
New York overtakes London as attractive financial center - Nigeria Sun,https://www.chinanationalnews.com/news/257987047/oct04v56.flv
Adda52 announces Chris Gayle as brand ambassador,https://www.bangladeshsun.com/news/257794938/oct04v56.flv
Land: Guarding against single story narratives - News24,https://www.theuknews.com/news/258000961/oct04v40.flv
Whistle blown on arts boss | News24,https://www.iranherald.com/news/256707937/oct04v40.flv
alaskarian.com is available at DomainMarket.com. Call 888-694-6735,http://alaskarian.com/video/urlv/8.flv
Oiled up beautiful babe gets her pussy - XNXX.COM.FLV,https://www.xnxx.tv/video-41he595/oiled_up_beautiful_babe_gets_her_pussy_-_xnxx.com.flv
korean guy jerk off&period;FLV - XNXX.COM - RizTube,https://xxx.riztube.com/video-6lbvfff/korean_guy_jerk_off.flv
Biba Hespaña 1x02&period;flv - XNXX.COM - RizTube,https://xxx.riztube.com/video-kvywvdf/biba_hespana_1x02.flv
Granting Test status to Afghanistan a hasty decision: Azhar,https://www.centralasiatimes.com/news/257498325/feb24v21.flv
Indian actress rajini fucking video - XNXX.COM.FLV - XRedWap.CoM,https://xredwap.com/xvid/video/12533805/indian_actress_rajini_fucking_video_-_xnxx.com.flv
slut.flv - Yum XXX,https://yumxxx.com/search/slut.flv
Chapter 5: AcuServer Functions - Die Blumengalerie,https://www.blumengalerie.at/videos/VTS_02_1.flv
Experts believe organic social media marketing will die at the hands ...,https://www.michigansun.com/news/250578715/oct04v40.flv
brunette playing hard with her pussy til cum(3).flv - XXXXXX.TO,https://in.xxxxxx.to/vid-MeVH/brunette_playing_hard_with_her_pussy_til_cum_3_.flv
Die Wirtin von der Lahn English Version - xHamster.com.FLV,https://www.edxx.org/video-38i6727/die_wirtin_von_der_lahn_english_version_-_xhamster.com.flv
pulsion2014.FLV - danhchotre.com,https://danhchotre.com/video25714299/pulsion2014.flv%3Fpl%3D36541889%26plname%3Dfull_movies
