A role for 11 C-methionine PET imaging in ACTH-dependent ...,https://eje.bioscientifica.com/view/journals/eje/173/4/M107.xml
A role for C-methionine PET imaging in ACTH-dependent Cushing's ...,https://eje.bioscientifica.com/downloadpdf/journals/eje/173/4/M107.xml
Polymorphisms of methionine metabolism and susceptibility to ...,https://thejns.org/view/journals/j-neurosurg/108/5/article-p999.xml
11C-methionine-18F-FDG dual-PET-tracer–based target delineation ...,https://thejns.org/view/journals/j-neurosurg/131/3/article-p676.xml
Methionine sulfoxide reductase regulates brain catechol- O,https://ijnp.oxfordjournals.org/content/17/10/1707.source.xml
Genetic evidence for the existence of two pathways for the ...,http://femsle.oxfordjournals.org/content/225/2/257.source.xml
[PDF] Glycine promotes longevity in Caenorhabditis elegans in a ... - PLOS,https://journals.scholarsportal.info/pdf/15537390/v15i0003/nfp_gpliceiamcf.xml
(PDF) Cysteine and Methionine Biosynthetic Enzymes Have Distinct ...,https://journals.scholarsportal.info/pdf/1664462x/v11inone/nfp_cambehmsspir.xml
CLO22-082: Texture Feature Analysis With C11 Methionine in ...,https://jnccn.org/view/journals/jnccn/20/3.5/article-pCLO22-082.xml
