Isoenzyme type 1 of 5alpha-reductase is abundantly transcribed in ...,https://eje.bioscientifica.com/view/journals/eje/152/6/1520875.xml
Recognition of 5α-reductase-2 deficiency in an adult female 46XY ...,https://eje.bioscientifica.com/view/journals/eje/164/6/1019.xml
Enterococcus faecalis glutathione reductase - Oxford Academic,https://femsle.oxfordjournals.org/content/166/1/155.source.xml
Aldose reductase activity and glucose-related opacities in incubated ...,https://avmajournals.avma.org/view/journals/ajvr/63/11/ajvr.2002.63.1591.xml
Inhibitory effects on the HMG-CoA Reductase in the chemical ...,http://www.degruyter.com/view/j/rrlm.2016.24.issue-4/rrlm-2016-0041/rrlm-2016-0041.xml
Methylenetetrahydrofolate Reductase Gene 677,https://umc.edu/som/Departments%2520and%2520Offices/SOM%2520Departments/Pathology/UMMC%2520Lab%2520Services/Lab%2520Test%2520List/Laboratory/Tests/Methylenetetrahydrofolate-Reductase-Gene-677.xml
HMG-CoA reductase from Camphor Tulsi (Ocimum ... - Nature,https://journals.scholarsportal.info/pdf/20452322/v8inone/nfp_hrfctkihahps.xml
Cloning and Characterization of Glycolate Oxidase and NADH ...,https://journals.ashs.org/hortsci/view/journals/hortsci/41/5/article-p1226.xml
Iron Deficiency Induced Changes in Iron Reductase Activity in ...,https://journals.ashs.org/jashs/view/journals/jashs/127/2/article-p184.xml
