tits_fuck.mkv — Keeley Hazell - Last.fm,https://www.last.fm/music/Keeley%2BHazell/_/tits_fuck.mkv
A strategy employed by an obligate nest invader to avoid conflict ...,https://europepmc.org/articles/pmc7452783/bin/ece3-10-8741-s002.mkv
@Galaxz.mkv | Linktree,https://linktr.ee/Galaxz.mkv
Indian Actress Elli Avram Leaked Video Hotel Cam 2016 You Tube,https://4fanvideos-com.fotosacompanhantes.com/video24150941/indian_actress_elli_avram_leaked_video_hotel_cam_2016_you_tube_-_youtube.mkv
Monalisa hot Boob Show After Bath (BIG BOSS STAR AKA Antara ...,https://4fanvideos-com.fotosacompanhantes.com/video27478737/monalisa_hot_boob_show_after_bath_big_boss_star_aka_antara_biswas_-_youtube.mkv
Rapid bioerosion in a tropical upwelling coral reef - Europe PMC,https://europepmc.org/articles/pmc6135564/bin/pone.0202887.s007.mkv
