rendezvous-meetup-app/AndroidManifest.xml at master · dlitz ...,https://github.com/dlitz/rendezvous-meetup-app/blob/master/AndroidManifest.xml
Theory of Reflection and Transcendental Idealism—An ... - Brill,https://brill.com/downloadpdf/book/9789004280991/B9789004280991_018.xml
Host Identity Protocol (HIP) Rendezvous Extension - Pike ...,http://pike.lysator.liu.se/docs/ietf/rfc/52/rfc5204.xml
Time versus space trade-offs for rendezvous in trees | Scholars ...,https://journals.scholarsportal.info/details/01782770/v27i0002/95_tvstfrit.xml
How to meet when you forget: log-space rendezvous in arbitrary ...,https://journals.scholarsportal.info/details/01782770/v25i0002/165_htmwyflriag.xml
feed.xml - The Rendezvous Podcast,https://www.307rendezvous.com/feed.xml
Observer-Based Robust Control for Spacecraft Rendezvous with ...,https://projecteuclid.org/journals/abstract-and-applied-analysis/volume-2014/issue-SI42/Observer-Based-Robust-Control-for-Spacecraft-Rendezvous-with-Thrust-Saturation/10.1155/2014/710850.xml
"1. Seance as Test, or, Russian Writers at a Spiritualist Rendezvous",https://www.degruyter.com/toronto/abstract/book/9781442697959/10.3138/9781442697959-005.xml%3Flanguage%3Den
FORM D - SEC.gov,https://www.sec.gov/Archives/edgar/data/1780457/000178043819000002/xslFormDX01/primary_doc.xml
Out There With the Birds - Bird Watcher's Digest,https://www.birdwatchersdigest.com/podcasts/otwtb/stream.xml
Host Identity Protocol (HIP) Rendezvous Extension - » RFC Editor,https://www.rfc-editor.org/refs/bibxml/reference.RFC.8004.xml
'The rendez vous of cracked brains'? in: The Debate on the Crusades,https://www.manchesterhive.com/abstract/9781847799005/9781847799005.00008.xml
bauhaus &amp; film: Mesalliance oder verpasstes Rendezvous ...,https://www.degruyter.com/view/j/muk.2011.57.issue-1-2/muk.2011.57.12.7/muk.2011.57.12.7.xml%3Flang%3Dde
▷  ▷ 06 buick rendezvous owner s manual - Aspire Plus,http://aspire-plus.com/bci/www/img/06-buick-rendezvous-owner-s-manual.xml
XML,https://le.utah.gov/xcode/Title72/Chapter3/C72-3-S202_1800010118000101.xml
"Frederick Inns Ltd, The Rendezvous Ltd, The Graduate Ltd, Motels ...",https://www.bloomsburyprofessionalonline.com/ireland/view/irish-tax-reports-vol-iv/bp-N27454c.xml
"Rendezvous in 43442300, al wasl road, Villa G5, Jumeirah Dubai",https://www.dubaionline.ae/profile/Rendezvous-297964/sitemap.xml
Untitled,https://dblp.org/pid/86/7052.xml
xml - Govinfo.gov,https://www.govinfo.gov/bulkdata/BILLS/116/2/sres/BILLS-116sres704ats.xml
Cultural Programs of the National Academy of Sciences Podcast,http://cpnas.org.s3.amazonaws.com/cpnas.xml
