Dapagliflozin Trial Stirs Controversy in - Kidney News Online,https://www.kidneynews.org/abstract/journals/kidney-news/12/7/article-p22_18.xml
Dapagliflozin Trial Stirs Controversy in: Kidney News Volume 12 ...,https://www.kidneynews.org/view/journals/kidney-news/12/7/article-p22_18.xml%3Frskey%3DlppEC1%26result%3D6
index.xml - CNN,https://www.cnn.com/video/data/3.0/video/business/2022/01/30/joe-rogans-podcast-stirs-big-problems-for-spotify.cnn/index.xml
Maxwell trial stirs ludicrous anti-media conspiracy theories Julie K ...,https://edition.cnn.com/video/data/3.0/video/business/2021/12/05/maxwell-trial-stirs-ludicrous-anti-media-conspiracy-theories.cnn/index.xml
6 Revision of Environmental Protection Law Stirs Controversy in - Brill,https://brill.com/view/book/edcoll/9789004269385/B9789004269385_008.xml
A novel melanoma therapy stirs up a storm: ipilimumab-induced ...,https://edm.bioscientifica.com/view/journals/edm/2015/1/EDM14-0092.xml
Monitoring Hydrous Metal Oxide Surface Charge and Adsorption by ...,https://journals.scholarsportal.info/details/07437463/v13i0010/2614_mhmoscaabs.xml
Additional comments on personality testing issue . . . . Zoonosis ...,https://avmajournals.avma.org/view/journals/javma/223/8/javma.2003.223.1109.xml
Letters to the Editor in - AVMA Journals - American Veterinary ...,https://avmajournals.avma.org/abstract/journals/javma/229/10/javma.229.10.1563.xml
