Soluble Prefusion Closed DS-SOSIP.664-Env Trimers of Diverse ...,https://www.cell.com/cell-reports/pdf/S2211-1247(17)31636-4.pdf
Immunogenicity of Stabilized HIV-1 Envelope Trimers with Reduced ...,https://www.cell.com/cell/pdf/S0092-8674(15)01575-5.pdf
[PDF] Similarities and differences between native HIV-1 envelope ... - PLOS,https://journals.plos.org/plospathogens/article/file%3Fid%3D10.1371/journal.ppat.1007920%26type%3Dprintable
Cleavage strongly influences whether soluble HIV-1 ... - PNAS,https://www.pnas.org/doi/pdf/10.1073/pnas.1314351110
Thiophene-Based Trimers for In Vivo Electronic Functionalization of ...,https://pubs.acs.org/doi/pdf/10.1021/acsaelm.0c00861
"Dimers, trimers, and tetramers of cytosine with guanine - American ...",https://pubs.acs.org/doi/pdf/10.1021/ja00200a046
Conformational dynamics of single HIV-1 envelope trimers on the ...,https://www.science.org/cms/asset/365c7173-9135-45ae-a96b-3c8f5f9027a1/pap.pdf
Formation of Highly Stable Chimeric Trimers by Fusion of an ...,https://www.jbc.org/article/S0021-9258(17)47804-5/pdf
Presence of Trimers in Glucagon Solution,https://febs.onlinelibrary.wiley.com/doi/pdf/10.1111/j.1432-1033.1972.tb02558.x
[PDF] Associations of Escherichia coli K-12 OmpF Trimers with Rough and ...,http://www.ncbi.nlm.nih.gov/pmc/articles/PMC213194/pdf/jbacter00123-0577.pdf
