The Garrulous Glaswegian. Editor and publisher of the Authentic ...,https://feeds.buzzsprout.com/1928138.rss
Birding for beginners in South Texas | The Blade,https://www.toledoblade.com/Culture/2011/04/24/Birding-for-beginners-in-South-Texas/stories/feed/feed/index.rss
BGSU prof enjoyed being in classroom - The Toledo Blade,https://www.toledoblade.com/Deaths/2007/07/07/BGSU-prof-enjoyed-being-in-classroom/stories/feed/feed/index.rss
Czech Music in Pristina | Embassy of the Czech Republic in Pristina,https://www.mzv.cz/pristina/en/bilateral_and_multilateral_relations/czech_music_in_pristina.rss
"OH GOD, WHAT NOW? Formerly Remainiacs - Megaphone",https://audioboom.com/channels/4908905.rss
Doctor Who: Tin Dog Podcast,https://audioboom.com/channels/2940967.rss
