Older Adult Team - County Of Sonoma,https://sonomacounty.ca.gov/x65023.xml
Physical and Psychological Health Conditions of Older Adults ...,https://journals.ashs.org/hortsci/view/journals/hortsci/44/1/article-p206.xml
"NCCN Guidelines® Insights: Older Adult Oncology, Version 1.2021 in",https://jnccn.org/view/journals/jnccn/19/9/article-p1006.xml
Psychotherapy with Older Adults - SAGE Books,https://sk.sagepub.com/books/psychotherapy-with-older-adults-3e/n6.xml
Role of resective surgery in patients older than 60 years with therapy ...,https://thejns.org/view/journals/j-neurosurg/aop/article-10.3171-2021.9.JNS211037/article-10.3171-2021.9.JNS211037.xml
The Relationship Between Concerns About Falling and Daily Life ...,https://journals.humankinetics.com/view/journals/japa/30/2/article-p217.xml
Why Older Australians Participate in Exercise and Sport in,https://journals.humankinetics.com/view/journals/japa/12/2/article-p185.xml
Digital inequality among older adults: how East Yorkers in Toronto ...,https://www.elgaronline.com/view/edcoll/9781788116565/9781788116565.00020.xml
