Peripheral location and infiltrative margin predict invasive features of ...,https://eje.bioscientifica.com/view/journals/eje/181/2/EJE-18-1025.xml
Infiltrative lymphocytic hypophysitis successfully treated with ...,https://edm.bioscientifica.com/view/journals/edm/2020/1/EDM20-0041.xml
Aggressive resection at the infiltrative margins of glioblastoma ...,https://thejns.org/view/journals/j-neurosurg/127/1/article-p111.xml
Repeated operations for infiltrative low-grade gliomas without ...,https://thejns.org/view/journals/j-neurosurg/98/6/article-p1165.xml
[PDF] Infiltrative pattern of metastatic invasive lobular breast carcinoma in ...,https://journals.scholarsportal.info/pdf/18694101/v12inone/nfp_ipomilitaapr.xml
[PDF] Preoperative immunonutrition regulates tumor infiltrative ...,https://journals.scholarsportal.info/pdf/17341922/v13i0006/1365_pirtiltaigcp.xml
What Is Your Diagnosis? in - AVMA Journals,https://avmajournals.avma.org/view/journals/javma/245/1/javma.245.1.43.xml
What Is Your Neurologic Diagnosis? in - AVMA Journals - American ...,https://avmajournals.avma.org/abstract/journals/javma/251/1/javma.251.1.41.xml
Infiltrative Granulomatous Pulmonary Disease and Skin Sensitivity to ...,https://www.ajtmh.org/view/journals/tpmd/18/6/article-p1042.xml
