[PDF] Program for the Cerebral Palsied - CDC stacks,https://stacks.cdc.gov/view/cdc/72863/cdc_72863_DS1.pdf%3F
The Multiply Handicapped Cerebral Palsied Child - SAGE Journals,https://journals.sagepub.com/doi/pdf/10.1177/001440295302000103
The Cerebral-Palsied Deaf Pupil - JSTOR,https://www.jstor.org/stable/44399379
[PDF] The dental status of cerebral palsied children - AAPD,https://www.aapd.org/globalassets/media/publications/archives/pope-13-03.pdf
Dentistry for the Cerebral Palsied - ScienceDirect.com,https://www.sciencedirect.com/science/article/pii/S000281775012003X/pdf%3Fmd5%3Dd4d232c009a116b2f73c09143ad5367a%26pid%3D1-s2.0-S000281775012003X-main.pdf
PHYSICAL EXAMINATION OF THE CEREBRAL PALSIED CHILD,https://jamanetwork.com/journals/JAMA/articlepdf/313330/jama_148_1_008.pdf
RESPIRATION AND SPEECH IN THE CEREBRAL PALSIED CHILD,https://jamanetwork.com/HttpHandlers/ArticlePdfHandler.ashx%3Fjournal%3Dpeds%26articleId%3D497196%26pdfFileName%3Darchpedi_89_1_009.pdf
Speech Problems of the Cerebral Palsied,https://pubs.asha.org/doi/pdf/10.1044/jshd.1202.129
Situational Speech Therapy For Retarded Cerebral Palsied Children,https://pubs.asha.org/doi/pdf/10.1044/jshd.2401.16
[PDF] Treatment of 140 cerebral palsied children with a combined method ...,https://atriumhealth.org/documents/NorthEastInternalIntegrative/research-library/Pediatrics/Treatment140CerebralPalsied.pdf
