Hafted spears and the archaeology of mind - PNAS,https://www.pnas.org/doi/pdf/10.1073/pnas.0904369106
Hafting and Retooling: Effects on the Archaeological Record - jstor,https://www.jstor.org/stable/280285
Two Hafted Tools from Recent Excavations of PPNB Sites ... - jstor,https://www.jstor.org/stable/23383570
"A Hafted Stone Celt from Genesee County, Michigan and ...",https://www.tandfonline.com/doi/pdf/10.1179/mca.2011.002
"Hafted Unifaces from Southwestern Coahuila, Mexico",https://www.tandfonline.com/doi/pdf/10.1080/00231940.1971.11757747
[PDF] A Probable Hafted Uniface from the Clovis Occupation at the Topper ...,https://scholarcommons.sc.edu/cgi/viewcontent.cgi%3Farticle%3D1006%26context%3Dsciaa_staffpub%26httpsredir%3D1%26referer%3D
Prehistoric Hafted Flint Knives,https://www.journals.uchicago.edu/doi/pdf/10.1086/278055
[PDF] asphaltum hafting and projectile point durability: an experimental,https://citeseerx.ist.psu.edu/viewdoc/download%3Fdoi%3D10.1.1.1009.3054%26rep%3Drep1%26type%3Dpdf
Evidence for Early Hafted Hunting Technology - Science,https://www.science.org/doi/pdf/10.1126/science.1227608
"[PDF] Retouched, rejuvenated, recycled, and occasionally hafted as ...",https://onlinelibrary.wiley.com/doi/am-pdf/10.1002/arco.5204
