arachnoidal proliferations with cyst formation in human spinal nerve ...,https://thejns.org/downloadpdf/journals/j-neurosurg/4/5/article-p414.xml
SPINAL NERVE INJURY IN DORSO-LATERAL PRO,https://thejns.org/downloadpdf/journals/j-neurosurg/5/5/article-p413.xml
An Investigation of a Cold Eddy on the Eastern Side of the Gulf ...,https://journals.ametsoc.org/view/journals/phoc/6/4/1520-0485_1976_006_0605_aioace_2_0_co_2.xml
The ErbB receptor tyrosine family as signal integrators,https://erc.bioscientifica.com/downloadpdf/journals/erc/8/3/11566606.xml
Decrease in Ins + Glut2 LO β-cells with advancing age in mouse and ...,https://joe.bioscientifica.com/view/journals/joe/233/3/229.xml
CONTINUOUS AXENIC CULTURE OF FREE-LIVING NEMATODES ...,https://brill.com/previewpdf/journals/nema/12/1/article-p138_13.xml
from a seamount - AKJournals,https://akjournals.com/downloadpdf/journals/10967/137/4/article-p299.xml
OASIS: Organic Vegetable Production Teaching Endeavor and ...,https://journals.ashs.org/view/journals/hortsci/39/4/article-p808E.xml
FR-2021-09-20.xml - Govinfo.gov,https://www.govinfo.gov/content/pkg/FR-2021-09-20/xml/FR-2021-09-20.xml
