File:en-us-brow.ogg - Wiktionary,https://en.m.wiktionary.org/wiki/File:en-us-brow.ogg
File:En-us-brow.ogg - Wikimedia Commons,https://commons.wikimedia.org/wiki/File:En-us-brow.ogg
File:En-au-sweat of one's brow.ogg - Wikimedia Commons,https://commons.wikimedia.org/wiki/File:En-au-sweat_of_one%2527s_brow.ogg
"Fasciculus:Enrico Caruso, L'elisir d'amore, Una furtiva lagrima.ogg","https://la.wikipedia.org/wiki/Fasciculus:Enrico_Caruso,_L%2527elisir_d%2527amore,_Una_furtiva_lagrima.ogg"
"Fasciculus:Leo Slezak, Tosca, E lucevan le stelle.ogg - Vicipaedia","https://la.wikipedia.org/wiki/Fasciculus:Leo_Slezak,_Tosca,_E_lucevan_le_stelle.ogg"
"File:Enrico Caruso, L'elisir d'amore, Una furtiva lagrima.ogg - 维基 ...","https://zh.wikidark.org/wiki/File:Enrico_Caruso,_L%2527elisir_d%2527amore,_Una_furtiva_lagrima.ogg"
Balloon Zombie (Plants vs. Zombies),http://plantsvszombies.wikia.com/wiki/File:Ballooninflate.ogg
