A Case of Biting Humans by Nabis americoferus (Heteroptera ...,https://jme.oxfordjournals.org/content/53/1/230.source.xml
Population Dispersion and Development of Sampling Plans for ...,http://ee.oxfordjournals.org/content/10/6/956.source.xml
Early induction of hypothermia for evacuated intracranial hematomas,https://thejns.org/downloadpdf/journals/j-neurosurg/117/4/article-p714.xml
FORM D - SEC.gov,https://www.sec.gov/Archives/edgar/data/1869403/000186940321000002/xslFormDX01/primary_doc.xml
Machiavelli's Greek Tyrant as Republican Reformer - Brill,https://brill.com/downloadpdf/book/9789004287686/B9789004287686_019.xml
Culturally Significant Objects Being Imported for ... - Govinfo.gov,https://www.govinfo.gov/metadata/granule/FR-2021-06-08/2021-11899/mods.xml
Black Coral - Annual Distribution,https://www.arcgis.com/sharing/rest/content/items/d04c6121c37d447c95be4cf6ee927773/info/metadata/metadata.xml%3Fformat%3Ddefault%26output%3Dhtml
Dark Ghost Shark - Annual Distribution,https://www.arcgis.com/sharing/rest/content/items/83587e92d33b4d8287862c4b9a145fc6/info/metadata/metadata.xml%3Fformat%3Ddefault%26output%3Dhtml
"The Nabidae (Insecta, Hemiptera, Heteroptera) of Argentina",https://europepmc.org/articles/pmc3800831/bin/zookeys.333.5084-treatment3.xml
