The Girdles and Hind Limb of Holosaurus Abruptus Marsh - jstor,https://www.jstor.org/stable/30065675
The Pectoral Girdles of Rana rugulosa (Ranidae) and Nesomantis ...,https://www.jstor.org/stable/3893270
ON THE ORIGIN OF GIRDLES AND PAIRED FINS,https://www.tandfonline.com/doi/pdf/10.1080/00212210.1965.10688214
[PDF] The Origin of Tetrapod Limbs and Girdles - DiVA portal,https://uu.diva-portal.org/smash/get/diva2:201539/FULLTEXT01.pdf
"[PDF] Finish, Culet Size, and Girdle Thickness: Categories of the GIA ...",https://www.gia.edu/doc/booklet_finish_culet_girdle.pdf
A COMPARISON OF NORMAL GIRDLES AND KNIFE-LINE ...,https://www.ajevonline.org/content/ajev/32/3/206.full.pdf
The evolution of the pectoral girdle - Wiley Online Library,https://onlinelibrary.wiley.com/doi/pdf/10.1046/j.1469-7580.2001.19910189.x
PART I: PAIRED FINS AND GIRDLES IN OSTRACODERMS ...,https://nyaspubs.onlinelibrary.wiley.com/doi/pdf/10.1111/j.1749-6632.1942.tb57058.x
[PDF] Delivered Without Peril Birth Girdles and Childbirth in Late Medieval ...,https://scholarworks.unr.edu/bitstream/handle/11714/7463/Blackard_unr_0139M_13200.pdf%3Fsequence%3D1%26isAllowed%3Dy
Pectoral and pelvic girdle rotations during walking and swimming in ...,https://journals.biologists.com/jeb/article-pdf/222/24/jeb212688/1980542/jeb212688.pdf
