ELL Shadowing as a Catalyst for Change - SAGE Books,https://sk.sagepub.com/books/ell-shadowing-as-a-catalyst-for-change/i222.xml
"Job Shadowing in: Adults, Mathematics and Work - Brill",https://brill.com/view/book/9789004381766/BP000006.xml
A note on the shadowing lemma of Liao - Project Euclid,https://projecteuclid.org/journals/tohoku-mathematical-journal/volume-62/issue-4/A-note-on-the-shadowing-lemma-of-Liao--A/10.2748/tmj/1294170344.xml
Shadowing Shakespeare in: Critical Survey Volume 33 Issue 1 (2021),https://www.berghahnjournals.com/abstract/journals/critical-survey/33/1/cs330106.xml
Shadowing Shakespeare - Berghahn Journals,https://www.berghahnjournals.com/downloadpdf/journals/critical-survey/33/1/cs330106.xml
Chapter 4: How to shadow organizing in: Organizational Ethnography,https://www.elgaronline.com/view/edcoll/9781786438096/9781786438096.00008.xml
index.xml - CNN,https://www.cnn.com/video/data/3.0/video/us/2021/07/29/matt-damon-stillwater-shadowing-oil-rig-workers-sot-newday-vpx.cnn/index.xml
The Impact of Blocking and Shadowing on the Indoor Visible Light ...,https://journals.scholarsportal.info/details/21669589/v2021inone/1_tiobastivlps.xml
Shadowing in: Dying for the nation,https://www.manchesterhive.com/view/9781526135650/9781526135650.00005.xml
