Hypothalamic-pituitary function in uraemia in - European Journal of ...,https://eje.bioscientifica.com/view/journals/eje/98/4/acta_98_4_002.xml
insufficiency is unexplained. The growth failure in uraemia has been ...,https://eje.bioscientifica.com/downloadpdf/journals/eje/91/1/acta_91_1_005.xml
Endourological renal salvage in patients with calculus nephropathy ...,https://journals.scholarsportal.info/details/14644096/v84i0003/252_ersipwcnaau.xml
Distrubance of growth hormone-insulin-like growth factor axis in ...,https://journals.scholarsportal.info/details/0931041x/v04i0006/654_doghgfaiu.xml
1. Introduction - Hindawi.com,https://downloads.hindawi.com/journals/bmri/2015/106902.xml
recast-jats-build e082d6219a bmjopen BMJ Open bmjopen BMJ ...,https://bmjopen.bmj.com/content/9/7/e027970.download.xml
international-journal-of-pediatric-research-ijpr-8-085.xml,https://clinmedjournals.org/articles/ijpr/international-journal-of-pediatric-research-ijpr-8-085.xml
Abnormalities in l-arginine transport and nitric oxide biosynthesis in ...,https://cardiovascres.oxfordjournals.org/content/49/4/697.source.xml
Microbiome Research in Kidney Diseases: Listening in on the Gut ...,https://www.kidneynews.org/view/journals/kidney-news/14/4/article-p17_7.xml
