SAGE Reference - Encyclopedia of Environment and Society,https://sk.sagepub.com/reference/environment/n1193.xml
"COLUMELLA, On Agriculture | Loeb Classical Library",https://www.loebclassics.com/view/columella-agriculture/1941/pb_LCL361.9.xml%3FreadMode%3Drecto
"Collection on LH Wellesley Wesley, 1893-1914 - Texas Archival ...",https://txarchives.org/smu/finding_aids/00255.xml
The Edict Passed against the Catholics by the Advice of the ... - Brill,https://brill.com/previewpdf/book/edcoll/9789004323964/B9789004323964-s101.xml%3FpdfJsInlineViewToken%3D1900536524%26inlineView%3Dtrue
"Ascham & Co: St John's College, Cambridge, in the 1540s - Brill",https://brill.com/downloadpdf/book/edcoll/9789004382282/BP000004.xml
"Chaplains in early modern England: Patronage, literature and religion",https://www.manchesterhive.com/downloadpdf/9781526110695/9781526110695.00007.xml
The Tragedy of Richard the Third - Oracle Help Center,https://docs.oracle.com/javase/tutorial/jaxp/sax/examples/rich_iii.xml
The potency ofSaccharomyces cerevisiaeandLactobacillus ...,https://journals.scholarsportal.info/details/00221155/v53i0012/4205_tpocpdopiwdf.xml
"<hi rend=""bold"">The History and Present State of Virginia, In Four ...",https://docsouth.unc.edu/southlit/beverley/beverley.xml
"The proceedings of the Woman's Rights Convention, held at Akron ...",https://tile.loc.gov/storage-services/service/rbc/rbnawsa/n8317/n8317.xml
