Chapter 9 | Sneaky Measurement of Crime and Disorder - SAGE ...,https://methods.sagepub.com/book/doing-criminological-research/d116.xml
Henry and Sneaky in: Re-Telling Our Stories - Brill,https://brill.com/view/book/edcoll/9789463005678/BP000008.xml
SNEAKY RADIO SESSIONS PODCAST - Podomatic,https://sneakyradio.podomatic.com/rss2.xml
Sneaking in Basic Drill with Sneaky Squares in: The Arithmetic ...,https://pubs.nctm.org/view/journals/at/30/4/article-p32.xml
Sneaky sasquatch descargar para android,http://speckorea.co.kr/userData/board/sneaky-sasquatch-descargar-para-android-y161.xml
"Passive partial ownership, sneaky takeover, and merger control",https://sociorepec.org/publication.xml%3Fh%3DRePEc:zbw:dicedp:102%26l%3Den
Sneak Peek: The Nicklaus Family Tours the USGA Museum,https://www.usga.org/content/usga/home-page/clubhouse/40ungatedcontent/sneak-peek--jack-nicklaus-and-family1/_jcr_content/photoDetails.data.xml
Version Update 17.5.0 Sneak Peek - Entropia Universe,https://www.entropiauniverse.com/bulletin/buzz/2020/11/30/index.xml
sitemap_products_1.xml - Sneaky Pete Store,https://www.sneakypetestore.com/sitemap_products_1.xml%3Ffrom%3D3455298115%26to%3D72625127430
7 Auto/Biography and Ideological Blindness - Brill,https://brill.com/downloadpdf/book/9789460911408/BP000008.xml
