WAG 07: Assets - IDHS,https://www.dhs.state.il.us/page.aspx/FACT_1WhatIsVR.flv%3Fitem%3D14779
IDHS: E,https://www.dhs.state.il.us/page.aspx/FACT_1WhatIsVR.flv%3Fitem%3D19659
Experts in absorbent products for urinary incontinence,http://www.indas.com/en/indas-commercial/Product-search/swf/comercial_presentacion.flv
Bad Sports | Stoked Wiki - Fandom,https://stoked.wikia.com/wiki/File:Stoked_Season_2_Episode_16_-_Bad_Sports.flv
12 Colours of Christmas Video unavailable - Resene Paints,http://www.resene.co.nz/nzauonly/RES_12.flv
Rowyo.com is for sale - Squadhelp,http://www.xuziping.com/vod/b6e6415fca49aa71df8e7b4075f1365d.flv
Fdasp.com is for sale | HugeDomains,http://www.wzzfsy.com/uploads/Video/%25E5%2585%25AC%25E5%258F%25B8%25E5%25BD%25B1%25E7%2589%2587.flv
Kerala floods: Death toll rises to 167 - Big News Network.com,https://www.indiagazette.com/news/257852132/oct04v40.flv
SharedZip.com is for sale | HugeDomains,http://www.sharedzip.com/9ie6p4iakwtg/VideoCast-3.flv
