"Closing Out Summer, Safely | Article | The United States Army",https://www.calgarymonitor.com/news/257952749/oct04v56.flv
Pakistan's Khan Denounces India's Arrogant Decision To Cancel Talks,https://www.malaysiasun.com/news/258031567/oct04v40.flv
WATCH: Vettel slams Verstappen for fateful Suzuka tangle - News24,https://www.chinanationalnews.com/news/258095485/oct04v56.flv
"Iran oil tanker collides off China's coast, dozens missing",https://www.northkoreatimes.com/news/256003001/feb24v21.flv
EU Gears Up for Trade War as Populist Challenge Grows,https://www.madagascarsun.com/news/257470968/oct04v56.flv
Maine Candidates Aim for Civility After Outgoing Firebrand Governor,https://www.oaklandtimes.com/news/258088645/oct04v40.flv
Analysts: Looming Idlib Conflict Threatens Turkey's Syria Strategy,https://www.beijingbulletin.com/news/257977642/oct04v56.flv
Irishman nabbed over ATM robberies in Australia,https://www.australianherald.com/news/256523909/feb24v21.flv
Journal L'Union,https://www.lunion.fr/art/542531/article/2015-09-06/video/MMV791149_TFR.flv
