Primary Oblique Muscle Overaction - JAMA Network,https://jamanetwork.com/data/Journals/OPHTH/6726/ECS00257.pdf
Multiple Mechanisms of Extraocular Muscle ˝Overaction˛,https://jamanetwork.com/HttpHandlers/ArticlePdfHandler.ashx%3Fjournal%3Dophth%26articleId%3D417675%26pdfFileName%3Decs60014.pdf
Overaction of the Superior Oblique Muscle: Some Nosologic ...,https://www.tandfonline.com/doi/pdf/10.1080/0065955X.1993.11981984
[PDF] A- and V-Patterns and Oblique Muscle Overaction - Elsevier Health,http://www3.us.elsevierhealth.com/HHS/reqoph/WrightCh18.pdf
Primary Inferior Oblique Overaction in Congenital Esotropia ...,https://www.sciencedirect.com/science/article/pii/S0161642089327746/pdf%3Fmd5%3Dfc9cc6018e4d3aab4310a7d3d55451f7%26pid%3D1-s2.0-S0161642089327746-main.pdf
"A-Exotropia, Alternating Sursumduction, and Superior Oblique ...",https://www.sciencedirect.com/science/article/pii/0002939469920492/pdf%3Fmd5%3D041152a8abd56c1a8c7bae8af058461f%26pid%3D1-s2.0-0002939469920492-main.pdf
Treatment of Inferior Oblique Muscle Overaction with Myectomy Or ...,https://journals.sagepub.com/doi/pdf/10.1177/112067219600600103
Imaging of the Superior Rectus in Superior Rectus Overaction after ...,https://www.aaojournal.org/article/S0161-6420(06)00538-0/pdf
Inferior oblique muscles from patients with inferior oblique overaction,https://www.jaapos.org/article/S1091-8531(09)00533-3/pdf
[PDF] Modified superior oblique intrasheath tenectomy in A-pattern with ...,https://bmcophthalmol.biomedcentral.com/track/pdf/10.1186/s12886-021-01942-2.pdf
RELATIONSHIP OF INFERIOR OBLIQUE OVERACTION ... - jaapos.,https://www.jaapos.org/article/S1091-8531(16)00073-2/pdf
A Case of Marcus Gunn Jaw Winking and Pseudo Inferior Oblique ...,https://www.ajo.com/article/S0002-9394(00)00705-4/pdf
DIAGRAMMATIC REPRESENTATION OF STRABISMUS - Nature,https://www.nature.com/articles/eye1993123.pdf%3Forigin%3Dppub
Dissociated Vertical Deviation and Inferior Oblique Overaction,https://journals.healio.com/doi/pdf/10.3928/01913913-20090505-01
17 Inferior Oblique Muscle Weakening Procedures,https://link.springer.com/content/pdf/10.1007%252F978-0-387-68625-7_17.pdf
Primary and secondary overacting inferior oblique muscles,https://bjo.bmj.com/content/bjophthalmol/68/6/416.full.pdf
[PDF] The Double-Bellied Inferior Oblique Muscle: Clinical Correlates,https://www.privateeyeclinic.com/s/infobl7.pdf
[PDF] Surgical Treatments in Inferior Oblique Muscle Overaction,https://pdfs.semanticscholar.org/3c68/8c1de3963c82e4a2dff5d0117944d760134c.pdf
[PDF] The Efficacy of Anterior-Nasal Surgery in Managing Inferior Oblique ...,https://www.longdom.org/open-access-pdfs/the-efficacy-of-anteriornasal-surgery-in-managing-inferior-oblique-overaction-either-with-dvd-or-with-v-pattern.pdf
[PDF] Diagnosis of a Superior Rectus Overaction After Cataract Surgery,https://cdn.ymaws.com/www.covd.org/resource/resmgr/ovd42-3/ovd_42-3_journal_article_rom.pdf
