gw-general-models/Models_3.7z at master · usgs/gw ... - GitHub,https://github.com/usgs/gw-general-models/blob/master/Genmod0.1/Models_3.7z
hlibbabii/bohr: Big Old Heuristic Repository - DagsHub,https://dagshub.com/hlibbabii/bohr/src/053f422dcf0b2fe94a70e770a5d46dc901f9c2e0/downloaded-data/test.7z
File:The Dukes of Hazzard - Return of the General Lee (Jun 18 ...,"https://hiddenpalace.org/File:The_Dukes_of_Hazzard_-_Return_of_the_General_Lee_(Jun_18,_2004_prototype).7z"
4chan Divination General - Internet Archive,https://archive.org/details/4chanDivinationGeneral22719.7z
Panzer General II Demo : Strategic Simulations - Internet Archive,https://archive.org/details/PanzerII.7z
Implications of Increasing College Attainment for Aging in General ...,https://europepmc.org/articles/pmc7454034/bin/nihms1550592-supplement-2.7z
Relationship between Citizens' Health Engagement ... - Europe PMC,https://europepmc.org/articles/pmc7711984/bin/vaccines-08-00576-s001.7z
TG2/SMW P370 Single Ended Layout DXF 16 Feb 2018.7z ...,https://opensource.ieee.org/elec-char/ieee-370/-/blob/6bb9637adc82e94a56acc2f92d7d42bc8585558d/TG2/SMW%2520P370%2520Single%2520Ended%2520Layout%2520DXF%252016%2520Feb%25202018.7z
Basic Concepts and Their Interpretation - NASA/ADS,https://ui.adsabs.harvard.edu/abs/2003dacw.conf....7Z
