Glycoproteins: An overview,https://iubmb.onlinelibrary.wiley.com/doi/pdf/10.1016/0307-4412%252889%252990136-2
Glycoproteins: Structure and Function - Wiley Online Library,https://onlinelibrary.wiley.com/doi/pdf/10.1002/9783527614738.ch8
"The history of glycoprotein research, a personal view",https://www.sciencedirect.com/science/article/pii/S0167730608605840/pdf%3Fmd5%3Dbfb8c76da193c9a21892039de9a15001%26pid%3D1-s2.0-S0167730608605840-main.pdf
Glycoproteins of Cell Surfaces - ScienceDirect.com,https://www.sciencedirect.com/science/article/pii/S0021925818617946/pdf%3Fmd5%3D4ebcf9944e961feae6fc87e51e561734%26pid%3D1-s2.0-S0021925818617946-main.pdf
"[PDF] Human Serum/Plasma Glycoprotein Analysis by H-NMR, an ... - MDPI",https://www.mdpi.com/2077-0383/9/2/354/pdf
[PDF] Glycoprotein Synthesis: An Update,https://users.ox.ac.uk/~dplb0149/publication/pub105.pdf
The Hantavirus Surface Glycoprotein Lattice and Its Fusion Control ...,https://www.cell.com/cell/pdf/S0092-8674(20)31064-3.pdf
[PDF] Virus Glycoprotein - NCBI,https://www.ncbi.nlm.nih.gov/pmc/articles/PMC247981/pdf/jvirol00065-0315.pdf
[PDF] Glycoprotein Characterization of the Gelatinous Matrix in the Root ...,https://www.ncbi.nlm.nih.gov/pmc/articles/PMC2619412/pdf/585.pdf
Size and Configuration of Glycoprotein Fragments Cleaved from ...,https://www.jbc.org/article/S0021-9258(19)43943-4/pdf
Biochemistry: Comprehensive glycoprotein characterization - Nature,https://www.nature.com/articles/nmeth.3713.pdf%3Forigin%3Dppub
A Role for the Dystrophin-Glycoprotein Complex as a ...,https://rupress.org/jcb/article-pdf/122/4/809/1258304/809.pdf
Evidence for Glycoprotein Nature of Stem Bromelain. Isolation of a ...,http://pubs.acs.org/doi/pdf/10.1021/bi00864a015
The Coronavirus Membrane Glycoprotein - Springer,https://link.springer.com/content/pdf/10.1007%25252F978-1-4899-1531-3_6.pdf
"[PDF] P-Glycoprotein, a gatekeeper in the blood–brain barrier - AngioChem",https://angiochem.com/sites/default/files/publications/BBB-Schinkel.pdf
Mechanistic reconstruction of glycoprotein secretion ... - Science,https://www.science.org/doi/pdf/10.1126/sciadv.aax8930
[PDF] Pierce Glycoprotein Staining Kit - Thermo Fisher,https://assets.thermofisher.com/TFS-Assets/LSG/manuals/MAN0011387_Pierce_Glycoprotein_Stain_UG.pdf
Method development of glycoprotein biomarkers for cancers,https://www.future-science.com/doi/pdf/10.4155/bio-2017-0077
[PDF] Human cell surface glycoprotein related to cell proliferation is the ...,https://salk.edu/pdf/otmd/ref/S38185.pdf
[PDF] Membrane Organization of the Dystrophin-Glycoprotein Complex,http://web.mit.edu/7.61/restricted/readings/Ervasti-Campbell.pdf
