N is for networker in: The ABC of the projectariat - manchester hive,https://www.manchesterhive.com/view/9781526161345/9781526161345.00058.xml
Network and security solutions by OVH,https://www.ovh.com/world/network-and-security-solutions.xml
An Overview of the Global Historical Climatology Network ...,https://journals.ametsoc.org/view/journals/bams/78/12/1520-0477_1997_078_2837_aootgh_2_0_co_2.xml
Journal of the National Comprehensive Cancer Network | JNCCN,https://jnccn.org/view/journals/jnccn/jnccn-overview.xml
Volume 20 (2022): Issue 5 (May 2022) - JNCCN,https://jnccn.org/view/journals/jnccn/20/5/jnccn.20.issue-5.xml
SAGE Reference - The SAGE Handbook of Social Network Analysis,https://sk.sagepub.com/reference/the-sage-handbook-of-social-network-analysis/n2.xml
Network Harmonization of Physical Activity Variables Through ...,https://journals.humankinetics.com/view/journals/jmpb/3/1/article-p8.xml
The Nephrotic Syndrome Study Network (NEPTUNE) - Kidney News ...,https://www.kidneynews.org/view/journals/kidney-news/14/4/article-p24_13.xml
45 CFR 156.230 -- Network adequacy standards. - eCFR,https://www.govinfo.gov/content/pkg/CFR-2017-title45-vol1/xml/CFR-2017-title45-vol1-sec156-230.xml
