Atypical mating in a scorpionfly without a notal organ in - Brill,https://brill.com/view/journals/ctoz/84/4/article-p305_3.xml%3Flanguage%3Den
Nuptial feeding and genital coupling of Neopanorpa scorpionflies ...,https://brill.com/view/journals/ctoz/88/4/article-p498_498.xml%3Flanguage%3Den
A new species of Neopanorpa with an extremely long notal organ ...,https://europepmc.org/articles/pmc5916897/bin/zookeys.750.23486-treatment1.xml
Taxon classification Animalia Nudibranchia Coryphellidae ...,https://www.researchgate.net/publication/322908657_XML_Treatment_for_Fjordia/data/5a75082c45851541ce566605/zookeys71721885-treatment16.xml
Automated Identification of Lesion Activity in Neovascular Age ...,https://journals.scholarsportal.info/details/01616420/v123i0008/1731_aiolainamd.xml
MONTHLY WEATHER REVIEW.,https://journals.ametsoc.org/downloadpdf/journals/mwre/24/2/1520-0493_1896_24_39c_aohalp_2_0_co_2.xml
InfantSEE®,https://pennsylvania.aoa.org/x19352.xml
Department of the Navy Freedom of Information Act Program,https://www.govinfo.gov/content/pkg/CFR-1999-title32-vol5/xml/CFR-1999-title32-vol5-part701-subpartA.xml
Abstract - bioRxiv,https://www.biorxiv.org/content/biorxiv/early/2022/06/05/2022.06.05.494862.source.xml
