Prenatal dexamethasone treatment for classic 21-hydroxylase ...,https://eje.bioscientifica.com/view/journals/eje/186/5/EJE-21-0554.xml
Prenatal exposure to glucocorticoids and the prevalence of ...,https://eje.bioscientifica.com/view/journals/eje/186/4/EJE-21-0846.xml
Prenatal Screening for Birth Defects | My Doctor Online,https://mydoctor.kaiserpermanente.org/mas/structured-content/Procedure_Optional_Prenatal_Tests_-_Ob_Gyn.xml%3Fco%3D/regions/mas
Prenatal Diagnostic Tests: Testing for Genetic Disorders,https://mydoctor.kaiserpermanente.org/ncal/structured-content/Procedure_Prenatal_Diagnostic_Tests_-_Testing_for_Genetic_Disorders.xml%3Fco%3D/regions/ncal
a comparison of prenatal versus postnatal closure in,https://thejns.org/pediatrics/view/journals/j-neurosurg-pediatr/29/5/article-p497.xml
The Ethics of Prenatal Injury - Brill,https://brill.com/downloadpdf/journals/jmp/aop/article-10.1163-17455243-BJA10059/article-10.1163-17455243-BJA10059.xml
The Organizational Effect of Prenatal Testosterone Upon Gender ...,https://journals.humankinetics.com/view/journals/wspaj/27/1/article-p37.xml
[PDF] Prenatal maternal and childhood bisphenol a exposure and brain ...,https://journals.scholarsportal.info/pdf/1476069x/v18inone/nfp_pmacbasaboyc.xml
Pregnancy and Women's Health,https://sonomacounty.ca.gov/x37957.xml
