ISIS AS PLANE IN THE GOSPEL OF TRUTH?* - Brill,https://brill.com/previewpdf/book/edcoll/9789004437203/BP000004.xml%3FpdfJsInlineViewToken%3D1019734828%26inlineView%3Dtrue
Neurosurgical forum - Journal of Neurosurgery,https://thejns.org/downloadpdf/journals/j-neurosurg/77/5/article-jns.1992.77.5.0823.xml.xml
Caught in Limbo: The Precarious (legal) Situation of Non-removable ...,https://www.bloomsburyprofessionalonline.com/view/journal_immigration/JINL_35-3-0001501.xml
Patient Outcomes Utilizing the Mulligan Concept of Mobilization With ...,https://journals.humankinetics.com/downloadpdf/journals/jsr/26/6/article-p486.xml
Fibular Reposition Taping Does Not Change Lower Extremity ...,https://journals.humankinetics.com/downloadpdf/journals/ijatt/24/3/article-p122.xml
08012019.xml,http://infosicoes.com/sitemap/08012019.xml
1. Research Background and Significance - Hindawi.com,https://downloads.hindawi.com/journals/ijdmb/2017/4815932.xml
Survey of the Freshwater Mussels (Mollusca ... - IDEALS @ Illinois,https://www.ideals.illinois.edu/bitstream/handle/2142/10612/inhsfauv01988i00008_tei.xml%3Fsequence%3D1%26isAllowed%3Dy
Management program for San Francisco Bay - US Government ...,https://www.gpo.gov/fdsys/pkg/CZIC-hd1695-s27-m36-1976-v-1/xml/CZIC-hd1695-s27-m36-1976-v-1.xml
