Hierarchal vector basis functions of arbitrary order for triangular and ...,https://ieeexplore.ieee.org/iel5/8/17206/00791939.pdf
Hierarchal genetic stratigraphy: A framework for paleoceanography,https://agupubs.onlinelibrary.wiley.com/doi/pdf/10.1029/PA002i002p00141
Hierarchal triangular elements using orthogonal polynomials,https://onlinelibrary.wiley.com/doi/pdf/10.1002/nme.1620380206
Multisite and hierarchal protein phosphorylation - ScienceDirect.com,https://www.sciencedirect.com/science/article/pii/S0021925818986539/pdf%3Fmd5%3D8661891236fe2401aae73d437f46b542%26pid%3D1-s2.0-S0021925818986539-main.pdf
Matching a Given Field Using Hierarchal Vector Basis Functions,https://www.tandfonline.com/doi/pdf/10.1080/02726340490261590
The Analysis of Variance of the S-Stage Hierarchal Classification,https://www.jstor.org/stable/2527899
[PDF] A Hierarchal Approach to Validation Experiments in Magnetic ...,https://science.osti.gov/-/media/fes/fesac/pdf/2010/Fesac_valex_pt_slides.pdf
[PDF] Hierarchal Testbench Configuration Using uvm_config_db - Synopsys,https://www.synopsys.com/content/dam/synopsys/services/whitepapers/hierarchical-testbench-configuration-using-uvm.pdf
[PDF] Theoretical Implications for Functional Dizziness - Frontiers,https://www.frontiersin.org/articles/10.3389/fnint.2021.806940/pdf
A hierarchal model of coding knowledge towards facilitating ...,https://www.emerald.com/insight/content/doi/10.1108/IDD-08-2020-0105/full/pdf
A Novel Hierarchal-Based Approach to Measure Insulin Sensitivity ...,https://journals.sagepub.com/doi/pdf/10.1177/1932296814536511
[PDF] Spatial Random Tree Grammars for Modeling Hierarchal Structure ...,https://citeseerx.ist.psu.edu/viewdoc/download%3Fdoi%3D10.1.1.75.5188%26rep%3Drep1%26type%3Dpdf
[PDF] Flattened hierarchal interface in a Geographical Information System,https://www.diva-portal.org/smash/get/diva2:972432/FULLTEXT01.pdf
Biomimicking of Hierarchal Molluscan Shell Structure Via Layer by ...,https://pubs.acs.org/doi/pdf/10.1021/acs.iecr.8b01738
Micro−Nano Hierarchal Web of Activated Carbon Fibers for ...,http://pubs.acs.org/doi/pdf/10.1021/ie071114n
[PDF] Traditional Hierarchal Organizational Chart,https://www.nist.gov/document-1186
Hardware design of hierarchal active-sensing networks for structural ...,http://iopscience.iop.org/0964-1726/15/1/042/pdf/sms6_1_042.pdf
"PDF, Self-adaptive Image Segmentation Optimization for Hierarchal ...",https://iopscience.iop.org/article/10.1088/1755-1315/540/1/012090/pdf
Three-level hierarchal modeling of gecko toe adhesion,https://www.cambridge.org/core/services/aop-cambridge-core/content/view/358F949D217FD58B00F3246B70CAD84E/S1946427400590472a.pdf/three-level-hierarchal-modeling-of-gecko-toe-adhesion.pdf
Hierarchal autophagic divergence of hematopoietic system.,https://www.jbc.org/article/S0021-9258(20)39541-7/pdf
