Chorionic somatomammotropin impacts early fetal growth and ...,https://joe.bioscientifica.com/view/journals/joe/237/3/JOE-18-0093.xml
The production of chorionic somatomammotrophin in sheep in,https://rep.bioscientifica.com/view/journals/rep/49/2/jrf_49_2_017.xml
Use of Dehydrated Human Amnion/Chorion Membrane Allografts in ...,https://japmaonline.org/view/journals/apms/108/2/17-039.xml
Micronized Dehydrated Human Amnion/Chorion Membrane ...,https://japmaonline.org/view/journals/apms/111/6/19-170.xml
Scanning electron microscope study on the egg chorion of ... - Brill,https://brill.com/downloadpdf/journals/ab/58/2/article-p235_7.xml
Scanning electron microscope study on the egg chorion of ... - Brill,https://brill.com/view/journals/ab/58/2/article-p235_7.xml
Abstract - bioRxiv,https://www.biorxiv.org/content/biorxiv/early/2022/03/22/2022.03.21.485195.source.xml
Characterisation of dehydrated amnion chorion membranes and ...,https://journals.scholarsportal.info/details/17424801/v16i0003/827_codacmfakriv.xml
Primary intracranial β-human chorionic gonadotropin–producing ...,https://thejns.org/pediatrics/view/journals/j-neurosurg-pediatr/10/2/article-p121.xml
