CRYPTIC NOTE II AND WAGS Ill - Brill,https://brill.com/previewpdf/book/edcoll/9789004368859/BP000019.xml
WAGS: A Beautiful English-Italian Benchmark Supporting Word ...,https://aclanthology.org/L16-1562.xml
sitemap.xml - Wags and Walks,https://www.wagsandwalks.org/sitemap.xml
The Tail that Wags the Nation | Scholars Portal Journals,https://journals.scholarsportal.info/details/01926365/v19i0058/50_tttwtn.xml
"Does the Tail Wag the Dog? Abstainers, Alcohol Dependence ...",https://alcalc.oxfordjournals.org/content/52/1/80.ref-stubs.xml
FORM D - SEC.gov,https://www.sec.gov/Archives/edgar/data/1753451/000175345118000001/xslFormDX01/primary_doc.xml
wp-sitemap-posts-ai1ec_event-2.xml - Generation Wags,https://www.generationwags.com/wp-sitemap-posts-ai1ec_event-2.xml
Media Representations of Footballers' Wives: A Wag's Life in,https://journals.humankinetics.com/view/journals/ssj/34/3/article-p296.xml
WAG HTTPS Store Detail Sitemap.xml - Walgreens,https://www.walgreens.com/WAG%2520HTTPS%2520Store%2520Detail%2520Sitemap.xml
