James Elden's Playwright's Spotlight - Buzzsprout,https://feeds.buzzsprout.com/1870751.rss
La Jolla Playhouse Presents - Buzzsprout,https://feeds.buzzsprout.com/1081877.rss
PHOTO GALLERY: Campers learn the ins and outs of theater,https://www.toledoblade.com/a-e/Music-Theater-Dance/2018/08/09/Campers-leaern-the-ins-and-outs-of-theater/stories/feed/index.rss
Is the playwright dead?,https://feeds.podcastpass.net/4d263b1ff953f14c5165281dc000c565.rss
How to Improvise and Survive in Tough Times with Manu Toigo,https://www.empoweradio.com/home/podcasts/on-demand/creating-change/808178-How-Improvise-and-Survive-Tough-Times-with-Manu-Toigo.rss
#movies - mastodon.nu - Mastodon.nu,https://mastodon.nu/tags/movies.rss
#filmmaking - Mastodon.ART,https://mastodon.art/tags/filmmaking.rss
New York Podcasting Cafe Radio,https://www.blogtalkradio.com/newyorkpodcastingcafe.rss
I have a idea of a non-oracle solo engine. Feel free to contribute.,https://libredd.it/r/Solo_Roleplaying/comments/t6huhd/i_have_a_idea_of_a_nonoracle_solo_engine_feel/.rss%3Fsort%3Dconfidence
