Nest Sharing by two Blackbird Turdus merula Females - BioOne,http://rcin.org.pl/Content/55512/url-publication.xml
Rusty Blackbirds select areas of greater habitat complexity during ...,https://bioone.org/journals/the-condor/volume-122/issue-4/duaa040/Rusty-Blackbirds-select-areas-of-greater-habitat-complexity-during-stopover/10.1093/condor/duaa040.xml
Song Features Essential for Species Discrimination and Behaviour ...,https://brill.com/view/journals/beh/121/3-4/article-p259_5.xml%3Flanguage%3Den
Analysis of 85 years of ring recovery data - Sciendo,https://www.degruyter.com/view/j/orhu.2017.25.issue-1/orhu-2017-0007/orhu-2017-0007.xml%3Fformat%3DINT
Campylobacter jejuni sequence types show remarkable spatial and ...,https://journals.scholarsportal.info/details/20008686/v5inone/nfp_cjstsrsatsib.xml
Quills | Birds | Looking at Thirteen Blackbirds Confused by Global ...,https://cdrhsites.unl.edu/quills/doc/qls.0072.xml
Yellow-headed Blackbirds in Illinois 2000 ... - IDEALS @ Illinois,https://www.ideals.illinois.edu/bitstream/handle/2142/10264/inhsbiodv02000i00017_tei.xml%3Fsequence%3D1%26isAllowed%3Dy
[KML] Dead Animals Map - ABC News,https://abcnews.go.com/images/WN/map_birdsTake7.xml%3F1
[KML] Dead Animals Map - ABC News,http://abcnews.go.com/images/WN/map12_10h.xml%3F1
