AN UNUSUAL SURGE OF COLD AIR ACROSS THE NORTHWEST ...,https://journals.ametsoc.org/downloadpdf/journals/mwre/78/8/1520-0493_1950_078_0156_ausoca_2_0_co_2.xml
The Shema in the Second Temple Period - Brill,https://brill.com/downloadpdf/journals/jaj/6/1/article-p58_4.xml
"[PDF] Caneburning Effects on Weeds, Primocane Growth, and Fruit Yield ...",https://journals.ashs.org/hortsci/downloadpdf/journals/hortsci/52/5/article-p692.xml
[PDF] Ascorbic Acid Content in 'Passe-Crassane' Winter Pear as Affected ...,https://journals.ashs.org/hortsci/downloadpdf/journals/hortsci/51/5/article-p543.xml
"Kuru, AIDS, and Witchcraft in - Berghahn Journals",https://www.berghahnjournals.com/view/journals/social-analysis/57/3/sa570302.xml
[PDF] ©International Monetary Fund. Not for Redistribution,https://www.elibrary.imf.org/downloadpdf/books/054/14812-9781451939118-en/ch12.xml
Disappearance of Anti-Thyroid Autoantibodies following ...,https://etj.bioscientifica.com/downloadpdf/journals/etj/10/3/ETJ510701.xml
[PDF] Is Off-label repeat prescription of ketamine as a rapid antidepressant ...,https://journals.scholarsportal.info/pdf/14726939/v17inone/nfp_iorpokcecali.xml
Neoadjuvant Dose-Dense Gemcitabine plus Docetaxel and ...,https://journals.scholarsportal.info/pdf/11745886/v11i0002/147_ndgpdapefobc.xml
Calculus Reform and Graphing Calculators: A University View in ...,https://pubs.nctm.org/view/journals/mt/90/5/article-p356.xml
