"VITRUVIUS, On Architecture | Loeb Classical Library",https://www.loebclassics.com/view/vitruvius-architecture/1931/pb_LCL251.211.xml
Conseils Juridiques Et Monde Universitaire Au XVe Siècle in - Brill,https://brill.com/view/journals/lega/60/3-4/article-p393_6.xml%3Frskey%3DrF084F%26result%3D10
"feasts, religion and burials - Brill",https://brill.com/downloadpdf/book/9789047444831/Bej.9789004177741.i-428_009.xml
Untitled,https://www.ikea.com/sitemaps/prod-gl-ES_17.xml
Associations between δ18O of Water and Climate Parameters in a ...,https://journals.ametsoc.org/abstract/journals/clim/15/22/1520-0442_2002_015_3150_aboowa_2.0.co_2.xml
gear.xml - ACME Laboratories,http://acme.com/jef/kol/gear_machine/gear.xml
"Plymouth St. at UMass Boston - October 5, 2019 - 01:00 - Box Score ...",https://plymouthstate.prestosports.com/sports/wsoc/2019-20/boxscores/20191005_dxyb.xml
"Pompeii, Origins through Destruction - Oxford Bibliographies",https://www.oxfordbibliographies.com/view/document/obo-9780190922467/obo-9780190922467-0040.xml
textos.xml,https://www.edu.xunta.es/espazoAbalar/sites/espazoAbalar/files/datos/1285568224/contido/cm16_oa03_ga/cm16_oa03_02_ga/textos.xml
