X-Ray Diffraction Measurements for Riveted Joints. The Application ...,https://www.degruyter.com/view/j/fas.ahead-of-print/v10164-012-0053-6/v10164-012-0053-6.xml
Comparison of Selected Rivet and Riveting Instructions - Sciendo,http://www.degruyter.com/view/j/fas.2014.2014.issue-6/fas-2014-0004/fas-2014-0004.xml
Fatigue crack initiation and growth in riveted specimens,https://journals.scholarsportal.info/details/01421123/v19i0093/331_fciagiaoaams.xml
On the longitudinal riveted joints of steam-boiler shells | Scholars ...,https://journals.scholarsportal.info/details/00160032/v128i0002/131_otlrjoss.xml
Study of the practical efficiency under static loading of riveted joints ...,https://www.ideals.illinois.edu/bitstream/handle/2142/4395/engineeringexperv00000i00402_tei.xml%3Fsequence%3D1%26isAllowed%3Dy
Investigation of the strength or riveted joints in ... - IDEALS @ Illinois,https://www.ideals.illinois.edu/bitstream/handle/2142/4346/engineeringexperv00000i00360_tei.xml%3Fsequence%3D1%26isAllowed%3Dy
Untitled,https://downloads.hindawi.com/journals/amse/2021/4381544.xml
1. Introduction - Hindawi.com,http://downloads.hindawi.com/journals/amse/2017/5824171.xml
Riveted to a Monstrous Site in - Brill,https://brill.com/view/journals/rip/35/1/article-p327_16.xml%3Flanguage%3Den
