FORM D - SEC.gov,https://www.sec.gov/Archives/edgar/data/1723294/000172329417000001/xslFormDX01/primary_doc.xml
"Occurrence, ecological risk assessment, and spatio-temporal ...",https://journals.scholarsportal.info/details/09441344/v24i0036/27913_oeraasraintp.xml
Building Reconciliation and Social Cohesion through Cinematic ...,https://brill.com/downloadpdf/book/edcoll/9781848882096/BP000008.xml
From Dyson Lacy [before 13 August 1868] 1,https://www.darwinproject.ac.uk/letter/DCP-LETT-6374.xml
"Participatory Rural Appraisal: Principles, Methods ... - SAGE Books",https://sk.sagepub.com/books/participatory-rural-appraisal/n5.xml
The Green Pen: Environmental Journalism in India and South Asia,https://sk.sagepub.com/books/the-green-pen/n14.xml
Environmental Change Perception and Engagement of Mountain ...,https://journals.ametsoc.org/downloadpdf/journals/wcas/13/4/WCAS-D-21-0051.1.xml
pwsc_vote_20150630.xml,https://www.legco.gov.hk/yr14-15/chinese/fc/pwsc/results/pwsc_vote_20150630.xml
Untitled,https://ndpublisher.in/xmlfiles/AssessmentofIchthyofaunalDiversityofRiverSutlejinDistrictLudhianaPunjabIndia.xml
