"Search Results For ""韶关外围经纪人【微29130390】应聘.mpv""",https://laschoolreport.com/search/%25E9%259F%25B6%25E5%2585%25B3%25E5%25A4%2596%25E5%259B%25B4%25E7%25BB%258F%25E7%25BA%25AA%25E4%25BA%25BA%25E3%2580%2590%25E5%25BE%25AE29130390%25E3%2580%2591%25E5%25BA%2594%25E8%2581%2598.mpv
boram/LICENSE.MPV at master - GitHub,https://github.com/Kagami/boram/blob/master/licenses/LICENSE.MPV
Comparison: KiT Player vs mpv-android - AppGrooves,https://appgrooves.com/compare/app-kihno-player-by-kihno-inc/android-is.xyz.mpv
Comparison: VRTV VR Video Player vs mpv-android - AppGrooves,https://appgrooves.com/compare/android-se.chai.vrtv/android-is.xyz.mpv
MusicPrimaVista App for iPhone - Free Download MusicPrimaVista ...,https://iphone.apkpure.com/musicprimavista/com.kwetree.mpv
"Download mpv-android on PC : Windows 10,8,7 & Mac Laptop",https://www.dlappsforpc.com/is.xyz.mpv
Untitled,http://anhsirk.tripod.com/tambu.mpv
Imran Hossain,https://hi-in.facebook.com/imran.mpv%3Fcomment_id%3DY29tbWVudDoyNjQ4MjU3NTg4MjM2NzRfMjY0ODI1ODk4ODIzNjYw
Скачать Smiile6 APK Последняя версия App на Smiile Для ...,https://apkamp.com/ru/com.monptivoisinage.mpv
