major (@major.flv) • Instagram photos and videos,https://instagr.am/major.flv
Pompeo to Discuss US-Russia Relations in Senate Committee ...,https://www.kansascitypost.com/news/257733513/oct04v56.flv
US Dismisses North Korean 'Declaration of War' Claim,https://www.northkoreatimes.com/news/254829559/oct04v56.flv
"February 10, 2022, Illinois Autism Task Force Meeting - DHS",https://www.dhs.state.il.us/page.aspx/FACT_1WhatIsVR.flv%3Fitem%3D141237%26newssidebar%3D27897%26postdate%3D4/7/2021
Meet the Funding Recipients - IDHS,https://www.dhs.state.il.us/page.aspx/FACT_1WhatIsVR.flv%3Fitem%3D128226
"Family, Pakistan Mourn Loss Of Student Killed In Texas Shooting",https://www.vietnamtribune.com/news/257309538/oct04v56.flv
Boko Haram commander killed over 'planned surrender' - News24,https://www.sierraleonetimes.com/news/258064630/oct04v56.flv
Four JDT players out of Malaysia squad for Asian Cup qualifier vs ...,https://www.malaysiasun.com/news/253467391/oct04v56.flv
Trump Trade Strategy Savaged on Capitol Hill,https://www.pekingpress.com/news/257527615/oct04v40.flv
