Thought Experiments - Philosophy - Oxford Bibliographies,https://www.oxfordbibliographies.com/view/document/obo-9780195396577/obo-9780195396577-0143.xml
Singular Thought - Philosophy - Oxford Bibliographies,https://www.oxfordbibliographies.com/view/document/obo-9780195396577/obo-9780195396577-0163.xml
Chapter 3 Ethical Thought: an Overview in: Becoming Human - Brill,https://brill.com/view/book/9789004423664/BP000010.xml
Comparative Political Thought: What Are We Looking At? in - Brill,https://brill.com/view/journals/cpt/1/1/article-p3_3.xml%3Flanguage%3Den
Effects of Three Types of Thought Content Instructions on Skiing ...,https://journals.humankinetics.com/view/journals/tsp/2/4/article-p283.xml
Azanian Political Thought and the Undoing of South African ...,https://www.berghahnjournals.com/view/journals/theoria/68/168/th6816804.xml
The Artistry of Critical Thought in - Berghahn Journals,https://www.berghahnjournals.com/view/journals/theoria/69/170/th6917004.xml
IMF Working Papers Volume 2018 Issue 133: Fiscal Adjustment in ...,https://www.elibrary.imf.org/view/journals/001/2018/133/001.2018.issue-133-en.xml
"Bodies of Thought: Embodiment, Identity and Modernity - SAGE Books",https://sk.sagepub.com/books/bodies-of-thought/n2.xml
SAGE Books - Spaces of Geographical Thought,https://sk.sagepub.com/books/spaces-of-geographical-thought/n5.xml
