Monstrosity and the Subhuman in Michael Gira and Nietzsche in - Brill,https://brill.com/view/book/edcoll/9781848884076/BP000007.xml
Atherosclerosis in Subhuman Primates in: Folia Primatologica ... - Brill,https://brill.com/view/journals/ijfp/3/4/article-p277_5.xml
"FRUCTOSE, LACTIC ACID AND CITRIC ACID CONTENT OF THE ...",https://rep.bioscientifica.com/view/journals/rep/17/3/jrf_17_3_019.xml
semen specimens immediately upon thawing at room temperature ...,https://rep.bioscientifica.com/downloadpdf/journals/rep/27/3/jrf_27_3_015.xml
Renoprival erythropoietin responsiveness in subhuman primates ...,https://journals.scholarsportal.info/details/00224790/v02i0001/9_rerisp.xml
Untitled,https://edition.cnn.com/video/data/3.0/video/politics/2014/02/18/bts-wolf-nugent-subhuman-mongrel-slater.cnn/index.xml
The role of cell therapy for stroke in - Journal of Neurosurgery,https://thejns.org/focus/view/journals/neurosurg-focus/13/5/foc.2002.13.5.2.xml
Discussion in: Journal of Neurosurgery Volume 11 Issue 1 (1954 ...,https://thejns.org/view/journals/j-neurosurg/11/1/article-p26.xml
The Domination of the Kurds - Berghahn Journals,https://www.berghahnjournals.com/downloadpdf/journals/theoria/68/169/th6816903.xml
