Lisa Anita (@lisvslife) | Lookbook,https://lookbook.nu/user/2735367-Lisa-A/looks.rss
Always in the Garden Podcast - with Jason Jorgensen - Buzzsprout,https://feeds.buzzsprout.com/386122.rss
Next two weekends the peak for walleye fishing in the rivers,https://www.toledoblade.com/frontpage/2000/03/28/Next-two-weekends-the-peak-for-walleye-fishing-in-the-rivers/stories/feed/feed/index.rss
Plates & People is green with envy over The Last Word - Toledo Blade,https://www.toledoblade.com/Food/2018/05/15/Plates-People-is-green-with-envy-over-The-Last-Word-Paula-Brown-1/stories/feed/index.rss
The Decoding Cocktails Podcast - Audioboom,https://audioboom.com/channels/5064425.rss
Proof - Art19.com,http://www.cooksillustrated.com/podcast/feed/podcast.rss
Thought and a Chaser - Libsyn,https://pod.link/thoughtchaser.rss
Bartender at Large - Libsyn,http://feeds.soundcloud.com/users/soundcloud:users:197153356/sounds.rss
Pulse Width Mornings from BFF.fm,https://data.bff.fm/shows/pulse-width-mornings.rss
The Blume Saloon: A Judy Blume Book Podcast - Spreaker,http://www.blogtalkradio.com/theblumesaloon.rss
