"Some Observations of Rotating Updrafts in a Low-Buoyancy, Highly ...",https://journals.ametsoc.org/abstract/journals/mwre/128/2/1520-0493_2000_128_0449_soorui_2.0.co_2.xml
"Some Observations of Rotating Updrafts in a Low-Buoyancy, Highly ...",https://journals.ametsoc.org/view/journals/mwre/128/2/1520-0493_2000_128_0449_soorui_2.0.co_2.xml
Role of carbonic anhydrase IX expression in prediction of the ...,https://erc.bioscientifica.com/downloadpdf/journals/erc/13/3/0130921.xml
Role of carbonic anhydrase IX expression in prediction of the ...,https://erc.bioscientifica.com/view/journals/erc/13/3/0130921.xml
The role of endogenous cytokinins and environmental factors ... - Brill,https://brill.com/downloadpdf/journals/ijps/60/3/article-p371_12.xml
Synthesis of monovinyl- and divinyl-chlorophyll analogs and their ...,https://journals.scholarsportal.info/details/00404020/v73i0004/313_somadaatpp.xml
Chapter 19: Terror Management Theory - SAGE Knowledge,https://sk.sagepub.com/reference/hdbk_socialpsychtheories1/n20.xml
Transgenic mice overexpressing human KvLQT1 dominant-negative ...,https://cardiovascres.oxfordjournals.org/content/50/2/328.ref-links.xml
6339eb9b-0c34-4844-b7be-8ee8fa69cce2.xml - Accessdata.fda.gov,https://www.accessdata.fda.gov/spl/data/6339eb9b-0c34-4844-b7be-8ee8fa69cce2/6339eb9b-0c34-4844-b7be-8ee8fa69cce2.xml
biorxiv BIORXIV bioRxiv bioRxiv Cold Spring Harbor Laboratory ...,https://www.biorxiv.org/content/biorxiv/early/2021/04/24/2021.04.23.441150.source.xml
