A Nonreflecting Upper Boundary Condition for Anelastic ...,https://journals.ametsoc.org/view/journals/mwre/121/4/1520-0493_1993_121_1249_anubcf_2_0_co_2.xml
Nonreflecting Internal Wave Beam Propagation in the Deep Ocean in,https://journals.ametsoc.org/view/journals/phoc/40/4/2009jpo4180.1.xml
The cylindrical antenna with nonreflecting resistive loading ...,https://journals.scholarsportal.info/details/00961973/v13i0003/369_tcawnrl.xml
A simple error correction method for two-port transmission ...,https://journals.scholarsportal.info/details/10518207/v08i0002/58_asecmfttpm.xml
STRONG NEGATIVE PARTITION RELATIONS BELOW ... - AKJournals,https://akjournals.com/previewpdf/journals/10473/58/1-2/article-p95.xml%3FpdfJsInlineViewToken%3D396036062%26inlineView%3Dtrue
"Open Graves, Open Minds - ManchesterHive",https://www.manchesterhive.com/view/9781526102157/9781526102157.xml
JAMP Journal of Applied Mathematics and Physics 2327-4352 ...,https://www.scirp.org/xml/112134.xml
1. Introduction - Hindawi.com,http://downloads.hindawi.com/journals/cmmm/2017/4198095.xml
[PDF] A Novel Thermochromic Liquid Crystal Fabric Design for the Early ...,https://japmaonline.org/downloadpdf/journals/apms/107/3/15-151.xml
