Pitch Talks - Audioboom,https://audioboom.com/channels/4339821.rss
Jays From the Couch Radio- Complete Toronto Blue Jays Audio,https://feeds.buzzsprout.com/795131.rss
Blue Jays acquire catcher Miguel Montero from Cubs - Toledo Blade,https://www.toledoblade.com/sports/pro/2017/07/03/BC-BBO-Blue-Jays-Cubs-Trade-3rd-Ld-Writethru/stories/feed/index.rss
Blue Jays beat Tigers 10-5 | The Blade,https://www.toledoblade.com/Tigers/2015/07/05/Verlander-drops-to-0-4-as-Blue-Jays-beat-Tigers-10-5/stories/feed/feed/index.rss
Jays Journal Podcast on the Toronto Blue Jays,https://www.omnycontent.com/d/playlist/33250137-f269-48a3-86dc-abcd016c932f/3126dbce-11d7-410e-8dde-ac29001e9801/985fe331-726e-4029-b097-ac29001e9801/podcast.rss
The Pesky Report (Red Sox)   - Spreaker,https://pod.link/1559565095.rss
COUNTRY 107 Afternoons with Carly Koop - Podcastville,https://podcastville.ca/shows/42/episodes.rss
