keywordCompare/letter_B.txt at master · sourcec0de ... - GitHub,https://github.com/sourcec0de/keywordCompare/blob/master/dictionary/letter_B.txt
abbreviation abdication abduction aberration abjection abjuration ...,https://sheeptester.github.io/sentence/tion.txt
and preempting the establishment of deleterious rhizosphere ...,https://ufdcimages.uflib.ufl.edu/AA/00/01/88/82/00001/interactionsbetw00elbo_0079.txt
abbreviation abdication aberration abjuration ablation abnegation ...,https://www.ik1hge.com/images/cw/files/ation_words_ik1hge.txt
b b ee0 --- n baa b aa0 --- i b ae0 --- i baaed b aa0 d --- fi b ae0 d ...,http://www.cs.cmu.edu/afs/cs.cmu.edu/project/fgdata/OldFiles/DICT/UCLAshoup/bp1.txt
ization$|noun|ize$|verb|2013|ORG_RULE|CHILD # Total count ...,https://lhncbc.nlm.nih.gov/LSG/Projects/lexicon/current/docs/designDoc/UDF/derivations/SD-Examples/example.145.txt
From the root to the stem: interaction between the biocontrol root ...,https://digital.csic.es/bitstream/10261/94998/5/root_stem_Maldonado.pdf.txt
