DECAL Download - Buzzsprout,https://feeds.buzzsprout.com/211637.rss
"Walleye to hold moment of silence, wear TFD decal ... - Toledo Blade",https://www.toledoblade.com/sports/walleye/2014/01/31/Walleye-to-hold-moment-of-silence-wear-TFD-decal-on-helmet-to-honor-fallen-firefighters/stories/feed/feed/index.rss
"Walleye to hold moment of silence, wear TFD decal ... - Toledo Blade",https://www.toledoblade.com/Walleye/2014/01/31/Walleye-to-hold-moment-of-silence-wear-TFD-decal-on-helmet-to-honor-fallen-firefighters/stories/feed/index.rss
Information on Driving Motor Vehicles in the Czech Republic ...,https://www.mzv.cz/consulate.newyork/en/visa_and_consular_information/travelling_to_the_czech_republic/information_on_driving_motor_vehicles_in.rss
The NBL Pocket Podcast - Audioboom,https://audioboom.com/channels/4982930.rss
"Beach Too Sandy, Water Too Wet - Art19.com",https://pod.link/1446051252.rss
Feed - Dinner with Racers,https://pod.link/1057030449.rss
Herald Sports - Megaphone,http://feeds.soundcloud.com/users/soundcloud:users:389651721/sounds.rss
Latest Seal Podcast Episodes,https://pod.casts.io/topics/seal/new-episodes.rss
