[PDF] impact of alkalinizing agents on human performance during exercise,https://www.uww.edu/Documents/colleges/coeps/hperc/past-ugresearch/IMPACT%2520OF%2520ALKALINIZING%2520AGENTS%2520ON%2520HUMAN%2520PERFORMANCE%2520DURING%2520EXERCISE.pdf
The Impact of Alternative Alkalinizing Agents on 24-Hour Urine ...,https://www.goldjournal.net/article/S0090-4295(20)30428-3/pdf
"A Review of Prescription, Over-the-Counter, and Medical Food ...",https://www.liebertpub.com/doi/pdf/10.1089/end.2019.0292
Alkalinizing Agents for the Treatment of Cardiac Arrest - Springer,https://link.springer.com/content/pdf/10.1007/978-1-4614-7542-2_9.pdf
Leyla weighs in: Acidic versus alkalinizing foods,https://drhoffman.com/article/leyla-weighs-in-acidic-vs-alkalinizing-foods/%3Fprint%3Dpdf
Oral alkalinizing solution as a potential prophylaxis against ...,https://academic.oup.com/ndt/article-pdf/20/6/1228/5148291/gfh779.pdf
[PDF] How can Oral Alkalizing Agents Prevent Renal Damage in Chronic ...,https://clinical-experimental-nephrology.imedpub.com/how-can-oral-alkalizing-agents-prevent-renal-damage-in-chronic-kidney-disease.pdf
A fungal pathogen secretes plant alkalinizing peptides to increase ...,https://www.nature.com/articles/nmicrobiol201643.pdf%3Fproof%3Dt
"Alkalinized Glutaraldehyde, a New Antimicrobial Agent",https://www.sciencedirect.com/science/article/pii/S002235491534572X/pdf%3Fmd5%3De297e5e2a54bbb10c904a1eee3c9db33%26pid%3D1-s2.0-S002235491534572X-main.pdf
ALKALINIZING AGENTS AND FLUID PRIMING IN HEMORRHAGIC ...,https://journals.physiology.org/doi/pdf/10.1152/ajplegacy.1945.144.4.505
