11 scene 10 shoulder surfing IT - ENISA - European Union,https://www.enisa.europa.eu/media/multimedia/material/videos/11-scene-10-shoulder-surfing-it.flv
Trump Receives Letter from North Korea's Kim,https://www.northkoreatimes.com/news/257777365/oct04v56.flv
"100+ ""Sap-(fi)-hcu.flv"" profiles | LinkedIn",https://www.linkedin.com/pub/dir/%2B/Sap-%2528fi%2529-hcu.flv
The Hardware Connection March 2019 Contents View,https://magazine.thehardwareconnection.com/sept-oct-2020/repo26/7474/187124/uploads/Electrical_Contact_Cleaner.flv%3Fi%3D573726
Slovakia Detains Suspects In Slain Journalist Case,https://www.irishsun.com/news/258049965/oct04v56.flv
Home Credit Group announces new India CEO,https://www.irishsun.com/news/257801806/oct04v56.flv
Nehawu threatens to down tools over Parliamentary bonuses,https://www.kenyastar.com/news/258086018/oct04v40.flv
[PPT] Summary of 50 LOPAs carried out since PSLG ... - ResearchGate,https://www.researchgate.net/profile/Richard-Gowland/publication/267344499_206787_How_Layer_of_Protection_Analysis_In_Europe_Is_Affected_by_the_Guidance_Drawn_up_After_the_Buncefield_Accident/links/5923f3ccaca27295a8aa7c0e/Donald-Rumsfeld-Unknown-Unknowns.flv
RAK Ceramics to exit Sudan business - Big News Network.com,https://www.kansascitypost.com/news/228861189/oct04v40.flv
Whistle blown on arts boss - News24,https://www.iranherald.com/news/256707937/oct04v40.flv
