Comparison: KiT Player vs mpv-android - AppGrooves,https://appgrooves.com/compare/app-kihno-player-by-kihno-inc/android-is.xyz.mpv
Download My Project Video MPV APK for Android - APKMonk,https://www.apkmonk.net/app/eu.vizeo.android.mpv
Lataa Smiile APK Uusin Versio App mennessä Android-laitteille Smiile,https://apkamp.com/fi/com.monptivoisinage.mpv
Smiile - Seneste Version Til Android - Download Apk - ApkGK.com,https://apkgk.com/da/com.monptivoisinage.mpv
mpv-android 2022-03-23-release APK,https://apk-dl.com/mpvandroid/is.xyz.mpv
"My Video Project, MPV 2.0.2 APK Download - Android Tools ...",https://apk-dl.com/ar/my-video-project-mpv/eu.vizeo.android.mpv
