Quills | Birds | from Missouri River Journals - University of Nebraska ...,https://cdrhsites.unl.edu/quills/doc/qls.0033.xml
org.assertj.core.util.xml java code examples | Tabnine,https://www.tabnine.com/code/java/packages/org.assertj.core.util.xml
"PLAUTUS, Casina | Loeb Classical Library",https://www.loebclassics.com/view/plautus-casina/2011/pb_LCL061.103.xml%3FreadMode%3Dreader
MONTHLY WEATHER REVIEW. - AMS Journals,https://journals.ametsoc.org/downloadpdf/journals/mwre/29/11/1520-0493_1901_29_490a_bfd_2_0_co_2.xml
take notice ye members of ye olde Roxburghe Clubbe of San ... - Loc,https://tile.loc.gov/storage-services/service/rbc/rbpe/rbpe00/rbpe002/00203700/00203700.xml
scraps the foreign warships an “at home” - Brill,https://brill.com/previewpdf/book/edcoll/9789004212633/B9789004212633-s030.xml
Arnold and Walt Whitman,https://whitmanarchive.org/criticism/interviews/tei/med.00637.xml
Jamaica: Local Eugenics Survey Completed - The University of ...,http://www.uvm.edu/~eugenics/primarydocs/onmsbdr122630.xml
