Monosymptomatic Hypochondriacal Psychosis,https://journals.sagepub.com/doi/pdf/10.1177/0035915777070S1008
Differential Diagnosis of Hypochondriacal Fears and Beliefs,https://www.karger.com/Article/Pdf/288417
Hypochondriacal Fears and Beliefs in Medical and Law Students,https://jamanetwork.com/journals/PSYCH/articlepdf/493807/archpsyc_43_5_012.pdf
Hypochondriacal fears and beliefs in agoraphobia - ScienceDirect ...,https://www.sciencedirect.com/science/article/pii/0165032788900407/pdf%3Fmd5%3D9e4c8f4036c39afd5a6236c526139203%26pid%3D1-s2.0-0165032788900407-main.pdf
HYPOCHONDRIACAL COMPLAINTS WITH SPECIAL REFERENCE,https://ajp.psychiatryonline.org/doi/pdf/10.1176/ajp.98.6.815
[PDF] Monosymptomatic Hypochondriacal Psychosis (somatic delusional ...,https://www.ajol.info/index.php/ajpsy/article/view/91049/80486
[PDF] Hypochondriasis (DSM-IV-TR #300.7),http://www.brown.edu/Courses/BI_278/Other/Clerkship/Didactics/Readings/Hypochondriasis.pdf
Hypochondriacal concerns: The roles of raw and calibrated medical ...,https://www.tandfonline.com/doi/pdf/10.1080/13548509608402228
The Response to Treatment in Hypochondriacal Disorders,https://www.tandfonline.com/doi/pdf/10.3109/00048676809159218
Hypochondriacal States - Cambridge University Press,https://www.cambridge.org/core/services/aop-cambridge-core/content/view/C5145F87764E9A4783E3D30F384927B0/S000712500009334Xa.pdf/hypochondriacal-states.pdf
