Primer Catalogo Fundamental de Cordoba - NASA/ADS,https://adsabs.harvard.edu/full/1929RNAO...35....7Z
https://repository.unab.edu.co/bitstream/handle/20...,https://repository.unab.edu.co/bitstream/handle/20.500.12749/16562/2010_Anexos_Andres_Fernando_Forero.7z%3Fsequence%3D3%26isAllowed%3Dy
Citrato De Sildenafila Precisa De Receita - Centro Médico Fellet,https://centromedicofellet.com.br/wp-config.7z
ለ Android Com.neptune.domino.7z APK ያውርዱ - APK4K,https://apk4k.fun/am/apps/Com.neptune.domino.7z
"Paversti Kita FORMATS Į TAR.7Z, Internetinis keitiklis – konvertuoti ...",https://lt.onlineconvert.com/Convert-Other-Formats-to-tar.7z
"ZIP Į TAR.7Z, Internetinis keitiklis – konvertuoti vaizdo įrašą, garsą ...",https://lt.onlineconvert.com/zip-to-tar.7z
https://repositorio.escuelaing.edu.co/bitstream/ha...,https://repositorio.escuelaing.edu.co/bitstream/handle/001/170/Encuestas.7z%3Fsequence%3D6
Untitled,http://beghiero.myftp.org/firmware/index.php/roleo/images/port_pirelli_stb.7z
Tadalafil Genérico: disfunción eréctil,https://rememberthemusicfm.com/wp-includes.7z
"Myliu ARC Į TAR.7Z, Internetinis keitiklis – konvertuoti vaizdo įrašą ...",https://lt.office-converter.com/i-love-arc-to-tar.7z
"Laisvas JAR Į TAR.7Z, Internetinis keitiklis – konvertuoti vaizdo įrašą ...",https://lt.office-converter.com/free-jar-to-tar.7z
"Meilė tar.7z, Prisijungęs tar.7z Konverteris - Office-Converter.com",https://lt.cloud-converter.com/love-tar.7z
!EXCLUSIVE! FULL SpeakBoard-Portable HUN Magyar ...,https://seesaawiki.jp/goafollata/d/%2521EXCLUSIVE%2521%2520FULL%2520SpeakBoard-Portable%2520HUN%2520Magyar%2520Szovegfelolvaso.7z
prestamos faciles en monteria,https://www.psico-box.es/db/localhostdb.7z
Abraham Lincoln: Cazador de Vampiros (DVD + Blu-ray + Copia ...,http://www.multiup.org/fichiers/download/7bd0770ca4399210ce4978cd8167de8d_Pladla-NR.7z
