Biochemical severity of thyroid ectopia in congenital hypothyroidism ...,https://eje.bioscientifica.com/view/journals/eje/156/1/1560049.xml
Tonsillar ectopia and Chiari malformations: monozygotic triplets in,https://thejns.org/view/journals/j-neurosurg/82/3/article-p497.xml
Effects of embryo transfer and cortical ectopias upon the behavior of ...,https://journals.scholarsportal.info/details/01653806/v93i1-2/100_eoetacbobabm.xml
Comparison of two surgical techniques for management of ...,https://avmajournals.avma.org/abstract/journals/javma/229/3/javma.229.3.389.xml
A minimally invasive surgical technique for ureteral ostioplasty in ...,https://avmajournals.avma.org/abstract/journals/javma/253/11/javma.253.11.1467.xml
Anim Cells Syst (Seoul) Anim Cells Syst (Seoul) TACS tacs20 ...,https://www.researchpad.co/dataresources/articles/2091/19152/19152.xml
biorxiv BIORXIV bioRxiv bioRxiv Cold Spring Harbor Laboratory ...,https://www.biorxiv.org/content/biorxiv/early/2017/08/09/164897.source.xml
CRIU Case Reports in Urology 2090-6978 2090-696X Hindawi ...,https://downloads.hindawi.com/journals/criu/2018/6919387.xml
An unusual variant of Zinner syndrome with ureteral ectopia from an ...,https://europepmc.org/articles/pmc7171451/bin/mmc1.xml
