Intragroup Diversit - SAGE Reference - Encyclopedia of Diversity in ...,https://sk.sagepub.com/reference/diversityineducation/n400.xml
Diversity: A Contested Concept - SAGE Knowledge,https://sk.sagepub.com/reference/diversityineducation/n208.xml
The Greater Pittsburgh Diversity & Inclusion Forum,http://vibrantpittsburgh.org/EmployersCDO.xml
Diversity - Management - Oxford Bibliographies,https://www.oxfordbibliographies.com/view/document/obo-9780199846740/obo-9780199846740-0031.xml
"Diversity, Equity, Inclusion, and Justice Yesterday, Today, and ...",https://www.kidneynews.org/view/journals/kidney-news/14/3/article-p14_7.xml
Diversity Annual Events | University of Tampa,https://www.lvxixangsp.com/campus-life/leadership-and-engagement/diversity-annual-events.xml
Understanding Student Perceptions of Diversity and Inclusion in,https://journals.humankinetics.com/abstract/journals/smej/16/1/article-p30.xml
Understanding ENSO Diversity in - AMS Journals - American ...,https://journals.ametsoc.org/view/journals/bams/96/6/bams-d-13-00117.1.xml
Coming to Terms With the Henrietta Lacks Act in - JNCCN,https://jnccn.org/view/journals/jnccn/19/8/article-p993.xml
