IMF Working Papers Volume 2021 Issue 227: When Do Politicians ...,https://www.elibrary.imf.org/view/journals/001/2021/227/001.2021.issue-227-en.xml
When Do Politicians Appeal Broadly? The Economic Consequences ...,https://www.elibrary.imf.org/view/journals/001/2021/227/article-A001-en.xml
DNA metabarcoding reveals broadly overlapping diets in three ...,https://bioone.org/journals/ornithology/volume-139/issue-1/ukab074/DNA-metabarcoding-reveals-broadly-overlapping-diets-in-three-sympatric-North/10.1093/ornithology/ukab074.xml
Counseling Across Cultures - SAGE Books,https://sk.sagepub.com/books/counseling-across-cultures/d205.xml
[PDF] The Acting Chair's Summing Up - International Monetary Fund,https://0-www-elibrary-imf-org.library.svsu.edu/downloadpdf/journals/007/2022/021/007.2022.issue-021-en.xml
Regucalcin is broadly expressed in male reproductive tissues and is ...,https://rep.bioscientifica.com/view/journals/rep/142/3/447.xml
s13567-021-00914-0.pdf,https://journals.scholarsportal.info/pdf/09284249/v52inone/nfp_abnmaiahpsip.xml
"Signals were broadly positive for months, but never definitive",https://journals.scholarsportal.info/details/1198743x/v28i0003/371_swbpfmbndtts.xml
Hidden diversity within the broadly distributed Amazonian giant ...,https://brill.com/view/journals/amre/41/3/article-p349_5.xml%3Flanguage%3Den
