https://www.rt.com/files/news/yeltsin-legacy-memor...,https://www.rt.com/files/news/yeltsin-legacy-memorial-monument/volk_yeltsin.flv%3Fdownload%3D1
From Sri Lanka to America: 10 museums dedicated to great Russian ...,https://www.malaysiasun.com/news/251047901/oct04v56.flv
Putin Hits Out At U.S. In Red Square Parade Speech,https://www.stpetersburgstar.com/news/257225616/oct04v56.flv
中文| 红楼阁REDdist,https://www.reddist.com/taxonomy/term/169/sample.FLV%3Fpage%3D524
[PDF] Ils sont six à briguer le siège de Pierre Kohler,https://www.suissesolidaire.org/wp-content/uploads/20150321.pdf.flv
Tak pracują sądy w Polsce Proces europosła Witolda Tomczaka w ...,"http://chomikuj.pl/TheFLACmaniak/WIDEO/YouTube/Tak%2Bpracuj*c4*85%2Bs*c4*85dy%2Bw%2BPolsce%2B-%2BProces%2Beuropos*c5*82a%2BWitolda%2BTomczaka%2Bw%2BOstrowie%2BWielkopolskim%2B(1-2),640966442.flv"
