34 CFR Part 97 -- Protection of Human Subjects - eCFR,https://www.gpo.gov/fdsys/pkg/CFR-2018-title34-vol1/xml/CFR-2018-title34-vol1-part97.xml
PROTECTION OF HUMAN SUBJECTS - Govinfo.gov,https://www.govinfo.gov/content/pkg/CFR-2017-title45-vol1/xml/CFR-2017-title45-vol1-part46.xml
PROTECTION OF HUMAN SUBJECTS - Govinfo.gov,https://www.govinfo.gov/content/pkg/CFR-2010-title40-vol1/xml/CFR-2010-title40-vol1-part26.xml
"Research, Innovation, Donor Protections: Key Priorities for Kidney ...",https://www.kidneynews.org/view/post/policy-12/research-innovation-donor-protections.xml
Your Rights and Protections Against Surprise Medical Bills,https://www.umc.edu/Healthcare/Patients-and-Visitors/Bill%2520Pay/Surprise-Billing-Rights-Protections.xml
XML - Congress.gov,https://www.congress.gov/117/bills/hr3985/BILLS-117hr3985eh.xml
115 HRES 1066 IH: Expressing the sense of the House of ...,https://www.congress.gov/115/bills/hres1066/BILLS-115hres1066ih.xml
The Council of Europe's Responses to the Decay of the Rule of Law ...,https://brill.com/view/journals/eclr/2/2/article-p165_165.xml%3Flanguage%3Den
"'Free In, Free Out': Exploring Dutch Firewall Protections for Irregular ...",https://brill.com/view/journals/emil/22/3/article-p427_5.xml%3Flanguage%3Den
XML,https://le.utah.gov/xcode/Title17/Chapter41/C17-41-P1_1800010118000101.xml
