Download Boost C++ Libraries from SourceForge.net,https://sourceforge.net/projects/boost/files/boost/1.38.0/boost_1_38_0.7z
Download bs1770gain from SourceForge.net,https://iweb.dl.sourceforge.net/project/bs1770gain/bs1770gain/0.6.2/bs1770gain-0.6.2-win32.7z
Forecasting the need for medical specialists in Spain - Europe PMC,https://europepmc.org/articles/pmc2987757/bin/1478-4491-8-24-s1.7z
Measuring epistemic success of a biodiversity citizen science program,https://europepmc.org/articles/pmc8504750/bin/pone.0258350.s006.7z
"A free C, C++ and Fortran IDE - Download Code::Blocks from ...",https://qa.debian.org/watch/sf.php/codeblocks/CB_20220122_rev12672_win64.7z
Looking to the Future with RAD - Affordable Housing Finance,https://cambridge-housing.org/download/50/press-publications/4374/affordable-housing-finance-looking-to-the-future-with-rad.7z
Formation of Primordial Black Holes in a Stiff Universe - NASA/ADS,https://adsabs.harvard.edu/full/1980SvAL....6....7Z
Movie Style Dark Side Transitions - Star Wars: KotOR II - The Games,https://gamefront.online/files/9435579/tsldstransmod.7z
Endar Spire Retexture - Weapons - Creatures Mod - Star Wars,https://gamefront.online/files/7980574/endm01aa.7z
Duck On Cover : www.shearer.de - Internet Archive,https://archive.org/details/ShearerDuckOnCover.7z
