Anaphylaxis | My Doctor Online,https://mydoctor.kaiserpermanente.org/ncal/structured-content/Condition_Anaphylaxis.xml%3Fco%3D/regions/ncal
Mortality rate and prognostic factors for dogs with severe anaphylaxis,https://avmajournals.avma.org/abstract/journals/javma/256/10/javma.256.10.1137.xml
Comparison of clinical findings between dogs with suspected ...,https://avmajournals.avma.org/view/journals/javma/251/6/javma.251.6.681.xml
Exercise-Induced Anaphylaxis: A Food-Dependent Variant,https://journals.humankinetics.com/previewpdf/journals/ijatt/19/1/article-p1.xml
[PDF] COVID-19 vaccine-associated anaphylaxis: A statement of the World ...,https://journals.scholarsportal.info/pdf/19394551/v14i0002/nfp_cvaasotwaoac.xml
Contrast Media–Induced Anaphylaxis Causing a Stress-Related ...,https://journals.scholarsportal.info/pdf/23247096/v05i0002/nfp_cmacasppcicr.xml
"EFFECT OF ALLOXAN DIABETES, GLUCOSE FEEDING AND ...",https://eje.bioscientifica.com/view/journals/eje/47/1/acta_47_1_016.xml
Allergy to Mammalian Meat Linked to Alpha-Gal Syndrome ...,https://www.ajtmh.org/view/journals/tpmd/105/5/article-p1396.xml
Additional Contributions: - CDC stacks,https://stacks.cdc.gov/view/cdc/115083/cdc_115083_DS2.xml
