Osteochondral necrosis of the femoral condyles in Thoroughbred foals,https://avmajournals.avma.org/view/journals/javma/260/3/javma.21.03.0166.xml
Clinical implications of high liver enzyme activities in hospitalized ...,https://avmajournals.avma.org/view/journals/javma/239/5/javma.239.5.661.xml
Foal Rejection - Characteristics and Therapy of Inadequate Maternal ...,https://www.degruyter.com/view/j/aoas.2012.12.issue-2/v10220-012-0011-9/v10220-012-0011-9.xml
and postnatal growth in the horse - REPRODUCTION - Bioscientifica,https://rep.bioscientifica.com/downloadpdf/journals/rep/127/1/1270067.xml
Production of live foals via intracytoplasmic injection of lyophilized ...,https://rep.bioscientifica.com/view/journals/rep/142/4/529.xml
"Comparison of the reliability of snap foal Ig test, Gamma-Check E ...",https://akjournals.com/view/journals/004/66/4/article-p573.xml
[PDF] Further Evidence for in Utero Transmission of Equine Hepacivirus to ...,https://journals.scholarsportal.info/pdf/19994915/v11i0012/nfp_fefiutoehtf.xml
Home - Flanders Foal Auction,https://flandersfoalauction.be/nl/resources/resources/mediaGroupData/group.xml
Evidence of infanticide in the Cape mountain zebra (Equus ... - Brill,https://brill.com/abstract/journals/beh/158/11/article-p1043_5.xml
