Bonsai In Conversation - Buzzsprout,https://feeds.buzzsprout.com/1437208.rss
Bonsai Wire - Buzzsprout,https://feeds.buzzsprout.com/1276571.rss
Bonsai Mirai: Asymmetry - Podbean,http://feeds.soundcloud.com/users/soundcloud:users:317999888/sounds.rss
Big day for tiny trees at Ben Sell Greenhouse - Toledo Blade,https://www.toledoblade.com/local/2009/03/16/Big-day-for-tiny-trees-at-Ben-Sell-Greenhouse/stories/feed/index.rss
"Toledo's breaking news, sports, and entertainment ... - The Blade",https://www.toledoblade.com/frontpage/2008/07/28/Visitors-rediscover-Lenawee-County-botanical-park/stories/feed/index.rss
Why Japan is obsessed with moss - Insider,https://www.businessinsider.com/japanese-people-have-a-new-obsession-with-a-common-plant-heres-why-2015-12/comments.rss
Kinh ngạc với những chậu bonsai biết bay có thật - CafeF,http://cafef.vn/biet-bay.html.rss
Trăm năm tuổi: Khu vườn với hơn 30 chậu cây bonsai chục năm tuổi ...,https://cafef.vn/tram-nam-tuoi.html.rss
Poetry Off the Shelf - Simplecast,https://audioboom.com/channels/2543314.rss
