Ketika Marquez Gagal Podium Musim Ini - Kompas - Olahraga,https://olahraga.kompas.com/read/xml/2014/08/18/05294591/Ketika.Marquez.Gagal.Podium.Musim.Ini
Marquez Masih Kejar Podium Pertama Musim Ini - Kompas - Olahraga,https://olahraga.kompas.com/read/xml/2017/04/19/16420821/marquez.masih.kejar.podium.pertama.musim.ini
acc-extension-config/vir.ini at master · ac-custom-shaders-patch/acc ...,https://github.com/ac-custom-shaders-patch/acc-extension-config/blob/master/config/tracks/vir.ini
Ancelotti Jengkel dengan Gelandang Masa Depan Timnas Italia Ini,https://www.juara.net/read/sepak-bola/dunia/157230-ancelotti.jengkel.dengan.gelandang.masa.depan.timnas.italia.ini
5 Hal Menarik dari Kesuksesan PSG Juara Ligue 1 Musim Ini,https://www.juara.net/read/sepakbola/features/140478-5.hal.menarik.dari.kesuksesan.psg.juara.ligue.1.musim.ini
Halaman anda tidak ditemukan - GridOto.com,https://otomania.gridoto.com/read/2015/04/26/123004530/Bawa.Keluarga.Jika.Ingin.Gabung.di.Klub.Ini
