Closing Africa's wealth gap | Africa Renewal - the United Nations,https://www.parisguardian.com/news/255795881/oct04v56.flv
WAG 20-22-03: Payment - IDHS,https://www.dhs.state.il.us/page.aspx/FACT_1WhatIsVR.flv%3Fitem%3D18075
FY15Q3 Immunizations - IDHS,https://www.dhs.state.il.us/page.aspx/FACT_Intro.flv%3Fitem%3D78263
Markets Step Back After Three-Day Rally,https://www.cambodiantimes.com/news/247946535/oct04v56.flv
South Africa slip to third in Test rankings,https://www.malaysiasun.com/news/259676812/feb24v21.flv
TROJ_INJECTR.FLV - Threat Encyclopedia - Trend Micro,https://www.trendmicro.com/vinfo/us/threat-encyclopedia/malware/troj_injectr.flv
Facebook Shares Sink; Further Growth Drops Expected,https://www.mediterraneantimes.com/news/257739995/oct04v56.flv
Young Americans Are Less Wealthy Than Their Parents,https://www.indiagazette.com/news/257837598/oct04v56.flv
Cultural (100712_kikuyugrass.flv) | PACE Turf,https://www.paceturf.org/journal/category/Cultural/100712_kikuyugrass.flv
Funai Electric of Japan to buy Philips home entertainment business,https://www.irishsun.com/news/212209124/oct04v56.flv
Wells Fargo announces plans to layoff 5-10 percent staff,https://www.northkoreatimes.com/news/258025665/oct04v56.flv
US Elected Officials Call for More Refugees,https://www.calgarymonitor.com/news/257843574/feb24v21.flv
France's Macron Encounters Obstacle Course at Home,https://www.sierraleonetimes.com/news/257940413/oct04v40.flv
Trump Calls On U.S. Attorney General To End Russia Probe 'Right ...,https://www.europesun.com/news/257774538/oct04v56.flv
"[PPT] Romanticism, Realism & Impressionism",https://static1.squarespace.com/static/57a4f527e6f2e1f140ce2c14/t/58228e1a579fb3c9af3c00e9/1478659636050/Luciano%2520Pavarotti%2520-%2520Celeste%2520Aida2.flv
Celebrities attend Amit Thackeray's big day! - Big News Network.com,https://www.shanghaisun.com/news/259247918/feb24v21.flv
How the Ugandan media has borne the brunt of censorship for ...,https://www.johannesburglife.com/news/258095953/oct04v56.flv
