Shell-to-solid Transition Element (RSSCON),http://www2.me.rochester.edu/courses/ME204/nx_help/en_US/tdocExt/content/1/id503721.xml
directions for using gelatin sponge in hemostasis - Journal of ...,https://thejns.org/view/journals/j-neurosurg/2/5/article-p435.xml
Exploring a Multiresolution Modeling Approach within the Shallow ...,https://journals.ametsoc.org/view/journals/mwre/139/11/mwr-d-10-05049.1.xml
Finite Elements for Shallow-Water Equation Ocean Models in,https://journals.ametsoc.org/view/journals/mwre/126/7/1520-0493_1998_126_1931_fefswe_2.0.co_2.xml
biorxiv BIORXIV bioRxiv bioRxiv Cold Spring Harbor Laboratory ...,https://www.biorxiv.org/content/biorxiv/early/2022/04/08/2022.02.28.482292.source.xml
Chapter Four Marx's Late Writings on Postcapitalist Society - Brill,https://brill.com/downloadpdf/book/9789004229860/B9789004229860_006.xml
The Real of Reality: The Realist Turn in Contemporary Film Theory,https://brill.com/downloadpdf/book/9789004466760/BP000021.xml
1. Introduction - Hindawi.com,https://downloads.hindawi.com/journals/cris/2017/4385913.xml
CIN Computational Intelligence and Neuroscience 1687-5273 1687 ...,https://downloads.hindawi.com/journals/cin/2022/3990216.xml
Information Fusion for (Re)Configuring Bike Station Networks With ...,https://dblp.org/pid/s/KangGShin.xml
Yu Hong Yeung Yu Hong Yeung Alex Pothen Jessica Crouch AMPS ...,https://dblp.uni-trier.de/pid/90/303.xml
3_ja_0_sitemap.xml - KOALA Equipment,http://koala-equipment.com/3_ja_0_sitemap.xml
10915 10.1007/10915.1573-7691 Journal of Scientific Computing J ...,https://www.repository.cam.ac.uk/bitstream/handle/1810/318716/10915_2020_Article_1184_nlm.xml%3Fsequence%3D3%26isAllowed%3Dy
Pre-Raphaelitism and the Pre-Raphaelite Brotherhood - Rossetti ...,http://www.rossettiarchive.org/docs/nd467.h9.1914.1.rad.xml
config/NEmeshTemplate.xml at master · smdharris/config · GitHub,https://github.com/smdharris/config/blob/master/labConfigurations_2015_AUT/portableConfigExample/CONFIG_v0.99/mayaConfig/2015-x64/prefs/viewTemplates/NEmeshTemplate.xml
Population dynamics and life history aspects of major marine ...,https://www.gpo.gov/fdsys/pkg/CZIC-ql628-g4-m8-1984-no-38/xml/CZIC-ql628-g4-m8-1984-no-38.xml
VEGAS Effective Geometric Algorithms for Surfaces and Visibility ...,https://raweb.inria.fr/rapportsactivite/RA2013/vegas/vegas.xml
sitemap-paper-0003792.xml - Semantic Scholar,https://www.semanticscholar.org/sitemap-paper-0003792.xml
