Early craniometric tools as a predecessor to neurosurgical ...,https://thejns.org/view/journals/j-neurosurg/124/6/article-p1867.xml
Early craniometric tools as a predecessor to neurosurgical stereotaxis,https://thejns.org/downloadpdf/journals/j-neurosurg/124/6/article-p1867.xml
Developments in Cranial Morphometrics in - Brill,https://brill.com/view/journals/ijfp/53/1-4/article-p101_9.xml
Revisiting historical Khoe-San skeletal remains in European ...,https://journals.scholarsportal.info/details/0018442x/v68i0004/243_rhksrisfitca.xml
ABSTRACT - World Wide Journals,https://www.worldwidejournals.com/international-journal-of-scientific-research-(IJSR)/xmlview.xml%3Fid%3D16816
Untitled,https://www.scirp.org/xml/109002.xml
"Book Reviews in: French Politics, Culture ... - Berghahn Journals",https://www.berghahnjournals.com/view/journals/fpcs/33/1/fpcs330108.xml
The Dream of a Transparent Body: Identity ... - manchester hive,https://www.manchesterhive.com/downloadpdf/journals/gs/14/1/article-p93.xml
