faded/codeStyleConfig.xml at master 路 theapache64/faded 路 GitHub,https://github.com/theapache64/faded/blob/master/.idea/codeStyles/codeStyleConfig.xml
faded/vcs.xml at master 路 theapache64/faded 路 GitHub,https://github.com/theapache64/faded/blob/master/.idea/vcs.xml
Fading (Vol. III) - SAGE Knowledge,https://sk.sagepub.com/reference/cbt/n3064.xml
Half-Faded Pictures: Die Judenbuche as Historical Fiction - Brill,https://brill.com/previewpdf/book/edcoll/9789004333949/B9789004333949-s003.xml
Half-Faded Pictures: Die Judenbuche as Historical Fiction in - Brill,https://brill.com/view/book/9789004333949/B9789004333949-s003.xml
"Faded Versus Increasing Feedback, Task Variability Trajectories ...",https://journals.scholarsportal.info/details/08959285/v22i0001/64_fviftvtatot.xml%3Flang%3Dfr
TREATMENT OF SLEEP PROBLEMS IN A TODDLER: A ...,https://journals.scholarsportal.info/details/00218855/v31i0001/127_tospiafbwrcp.xml
150 Color Fading of Rose Petals Due to a Transient High ...,https://journals.ashs.org/hortsci/view/journals/hortsci/35/3/article-p415D.xml
Fading Ricardian Equivalence in Ageing Japan (2016) - IMF eLibrary,https://www.elibrary.imf.org/view/journals/001/2016/194/001.2016.issue-194-en.xml
