Models to Describe Cycas micronesica Leaf and Strobili ...,https://journals.ashs.org/hortsci/view/journals/hortsci/46/9/article-p1333.xml
"Growth, Strobile Yield, and Quality of Four Humulus lupulus ...",https://journals.ashs.org/hortsci/view/journals/hortsci/51/7/article-p838.xml
Figure 2. A. & strobili (pollen cones) of Pinus nigra J. F. Arnold ... - Brill,https://brill.com/downloadpdf/book/9789047415169/B9789047415169_005.xml
6 Indeed Strobilus appears at the first verse of the next scene. This is ...,https://brill.com/downloadpdf/book/9789004326996/BP000003.xml
"Select Papyri. Poetry. Middle Comedy and New Comedy, 4th and ...",https://www.loebclassics.com/view/select_papyri_poetry_middle_comedy_new_comedy_4th_3rd_centuries_bc/1941/pb_LCL360.295.xml
Select Papyri. Poetry. Middle Comedy and ... - Loeb Classical Library,https://www.loebclassics.com/view/select_papyri_poetry_middle_comedy_new_comedy_4th_3rd_centuries_bc/1941/pb_LCL360.297.xml
Clone Fertility and Genetic Diversity in a Black Pine Seed Orchard,https://www.degruyter.com/view/j/sg.2009.59.issue-1-6/sg-2010-0017/sg-2010-0017.xml
biorxiv BIORXIV bioRxiv bioRxiv Cold Spring Harbor Laboratory ...,https://www.biorxiv.org/content/biorxiv/early/2020/04/23/2020.04.21.054320.source.xml
A whole noeggerathialean plant Tingia unita Wang from the earliest ...,https://journals.scholarsportal.info/details/00346667/v294icomplete/nfp_awnptupfwcim.xml
