Chapter 10 Computation and Visualization Thought Experiments ...,https://brill.com/abstract/book/edcoll/9789004445956/BP000011.xml
Computation andVisualizationThought Experiments after Lakatos's ...,https://brill.com/downloadpdf/book/edcoll/9789004445956/BP000011.xml
Impacts of Fire and Warming on Ecosystem Uptake in the Boreal ...,https://journals.ametsoc.org/view/journals/clim/13/13/1520-0442_2000_013_2334_iofawo_2.0.co_2.xml
Circadian Rhythm of Spontaneous non-Linear Peptidization with ...,https://akjournals.com/downloadpdf/journals/1326/29/1/article-p135.xml
"The Tragedy of Hamlet, Prince of Denmark",http://www.w3.org/People/maxf/XSLideMaker/hamlet.xml
1. Introduction - Hindawi.com,https://downloads.hindawi.com/journals/bn/2019/1068260.xml
biorxiv BIORXIV bioRxiv bioRxiv Cold Spring Harbor Laboratory ...,https://www.biorxiv.org/content/biorxiv/early/2020/06/23/2020.06.22.164616.source.xml
Certain queries vpon the dissolving of the late ... - Oxford Text Archive,https://ota.bodleian.ox.ac.uk/repository/xmlui/bitstream/handle/20.500.12024/A78498/A78498.xml%3Fsequence%3D6%26isAllowed%3Dy
An argument for toleration and indulgence in relation to differences ...,https://ota.bodleian.ox.ac.uk/repository/xmlui/bitstream/handle/20.500.12024/A65677/A65677.xml%3Fsequence%3D6%26isAllowed%3Dy
